url,website,date,country,keyword,sentence,kw,kw_lemma,kw_pos,left_w1,left_l1,left_p1,left_w2,left_l2,left_p2,left_w3,left_l3,left_p3,left_w4,left_l4,left_p4,left_w5,left_l5,left_p5,right_w1,right_l1,right_p1,right_w2,right_l2,right_p2,right_w3,right_l3,right_p3,right_w4,right_l4,right_p4,right_w5,right_l5,right_p5,datetime,year,10years,pattern_around5,pattern_around3,pattern_left2,pattern_left3,pattern_left4,pattern_right2,pattern_right3,pattern_right4,pattern_around5_lex,pattern_around3_lex,pattern_left2_lex,pattern_left3_lex,pattern_left4_lex,pattern_right2_lex,pattern_right3_lex,pattern_right4_lex
http://www.elle.fr/Societe/News/J-ai-eu-un-bebe-quatre-ans-apres-mon-cancer-du-sein-et-la-congelation-de-mes-ovocytes-3731666#xtor%3DRSS-21,elle.fr,2018-10-17,France,clearblue/NOM/clearblue,"Ce  fameux  test clearblue  dont  je  rêvais  ,  le  Graal  !  Le  test  urinaire  était  positif  ,  et  ,  y  croyant  à  peine  ,  je  suis  retournée  le  montrer  à  la  pharmacienne  qui  m'  a  confirmé  que  je  ne  rêvais  pas  .",clearblue,nom,clearblue,test,test,NOUN,fameux,fameux,ADJ,Ce,ce,PRON,,,,,,,dont,dont,PRON,je,je,PRON,rêvais,rêver,VERB,",",",",PUNCT,le,le,DET,2018-10-17,2018,2010,ADJ NOUN Clearblue PRON PRON,NOUN Clearblue PRON,ADJ NOUN Clearblue,PRON ADJ NOUN Clearblue,,Clearblue PRON PRON,Clearblue PRON PRON VERB,Clearblue PRON PRON VERB PUNCT,fameux test Clearblue dont je,test Clearblue dont,fameux test Clearblue,ce fameux test Clearblue,,Clearblue dont je,Clearblue dont je rêver,"Clearblue dont je rêver ,"
https://www.nouvelobs.com/nos-vies-intimes/20181212.OBS10217/quand-les-pubs-ciblees-rappellent-a-un-parent-la-perte-d-un-enfant.html,nouvelobs.com,2018-12-12,France,Clearblue/NAM/Clearblue,"En  2016  ,  sur  Rue  89  ,  nous  évoquions  le  cas  des  tests  de  grossesse Clearblue  ,  qui  cible  sur  YouTube  les  ""  femmes  en  âge  de  procréer  ""  ,  touchant  au  passage  celles  qui  essaient  en  vain  d'  avoir  des  enfants  ou  ne  peuvent  pas  en  avoir  ...",clearblue,nam,clearblue,grossesse,grossesse,NOUN,de,de,ADP,tests,test,NOUN,des,du,ADP DET,cas,cas,NOUN,",",",",PUNCT,qui,qui,PRON,cible,cibler,VERB,sur,sur,ADP,YouTube,YouTube,PROPN,2018-12-12,2018,2010,ADP NOUN Clearblue PUNCT PRON,NOUN Clearblue PUNCT,ADP NOUN Clearblue,NOUN ADP NOUN Clearblue,ADP DET NOUN ADP NOUN Clearblue,Clearblue PUNCT PRON,Clearblue PUNCT PRON VERB,Clearblue PUNCT PRON VERB ADP,"de grossesse Clearblue , qui","grossesse Clearblue ,",de grossesse Clearblue,test de grossesse Clearblue,du test de grossesse Clearblue,"Clearblue , qui","Clearblue , qui cibler","Clearblue , qui cibler sur"
https://www.francetvinfo.fr/sante/grossesse/enquete-franceinfo-applications-objets-connectes-les-dessous-du-business-de-la-fertilite-sur-internet_3159803.html#xtor%3DRSS-3-%255Blestitres%255D,francetvinfo.fr,2019-02-07,France,Clearblue/VER:pper/Clearblue,C'  est  quand  j'  ai  vu  la  première  pub Clearblue  sur  ma  page  Facebook  que  je  me  suis  dit  que  j'  étais  ciblée  .,clearblue,ver:pper,clearblue,pub,pub,NOUN,première,premier,ADJ,la,le,DET,vu,voir,VERB,ai,avoir,VERB,sur,sur,ADP,ma,mon,DET,page,page,NOUN,Facebook,Facebook,PROPN,que,que,PRON,2019-02-07,2019,2010,ADJ NOUN Clearblue ADP DET,NOUN Clearblue ADP,ADJ NOUN Clearblue,DET ADJ NOUN Clearblue,VERB DET ADJ NOUN Clearblue,Clearblue ADP DET,Clearblue ADP DET NOUN,Clearblue ADP DET NOUN PROPN,premier pub Clearblue sur mon,pub Clearblue sur,premier pub Clearblue,le premier pub Clearblue,voir le premier pub Clearblue,Clearblue sur mon,Clearblue sur mon page,Clearblue sur mon page Facebook
https://www.aufeminin.com/vouloir-un-enfant/tomber-enceinte-rapidement-s639819.html,aufeminin.com,2019-07-03,===NONE===,Clearblue/NAM/Clearblue,"Il  existe  aussi  en  pharmacie  des  tests  d'  ovulation  ( Clearblue  ,  Primatime  ,  Revelatest  ,  Biotester  ,  Ovutest  ,  Discretest  )  .",clearblue,nam,clearblue,(,(,PUNCT,ovulation,ovulation,NOUN,d',de,ADP,tests,test,NOUN,des,du,ADP DET,",",",",PUNCT,Primatime,Primatime,PROPN,",",",",PUNCT,Revelatest,Revelatest,PROPN,",",",",PUNCT,2019-07-03,2019,2010,NOUN PUNCT Clearblue PUNCT PROPN,PUNCT Clearblue PUNCT,NOUN PUNCT Clearblue,ADP NOUN PUNCT Clearblue,NOUN ADP NOUN PUNCT Clearblue,Clearblue PUNCT PROPN,Clearblue PUNCT PROPN PUNCT,Clearblue PUNCT PROPN PUNCT PROPN,"ovulation ( Clearblue , Primatime","( Clearblue ,",ovulation ( Clearblue,de ovulation ( Clearblue,test de ovulation ( Clearblue,"Clearblue , Primatime","Clearblue , Primatime ,","Clearblue , Primatime , Revelatest"
https://www.magicmaman.com/une-star-d-orange-is-the-new-black-est-enceinte-de-son-premier-enfant-photos%2C3637234.asp,magicmaman.com,2019-07-03,===NONE===,Clearblue/ADJ/Clearblue,"Comme  elle  l'  indique  au-dessus  de  sa  photo  et  dans  ses  stories  ,  l'  actrice  d'  Orange  is  the  New  Black  fait  cette  annonce  en  partenariat  avec  la  marque  de  tests Clearblue  .",clearblue,adj,clearblue,tests,test,NOUN,de,de,ADP,marque,marque,NOUN,la,le,DET,avec,avec,ADP,.,.,PUNCT,,,,,,,,,,,,,2019-07-03,2019,2010,,NOUN Clearblue PUNCT,ADP NOUN Clearblue,NOUN ADP NOUN Clearblue,DET NOUN ADP NOUN Clearblue,,,,,test Clearblue .,de test Clearblue,marque de test Clearblue,le marque de test Clearblue,,,
https://www.20minutes.fr/sante/2580391-20190809-non-pilule-lendemain-tests-grossesse#xtor%3DRSS-149,20minutes.fr,2019-08-09,France,Clearblue/NAM/Clearblue,"Cet  objet  rond  est  en  réalité  un  dessiccateur  ,  confirme Clearblue  ,  la  marque  du  test  de  grossesse  visible  dans  la  vidéo  .",clearblue,nam,clearblue,confirme,confirmer,VERB,",",",",PUNCT,dessiccateur,dessiccateur,NOUN,un,un,DET,réalité,réalité,NOUN,",",",",PUNCT,la,le,DET,marque,marque,NOUN,du,du,ADP DET,test,test,NOUN,2019-08-09,2019,2010,PUNCT VERB Clearblue PUNCT DET,VERB Clearblue PUNCT,PUNCT VERB Clearblue,NOUN PUNCT VERB Clearblue,DET NOUN PUNCT VERB Clearblue,Clearblue PUNCT DET,Clearblue PUNCT DET NOUN,Clearblue PUNCT DET NOUN ADP DET,", confirmer Clearblue , le","confirmer Clearblue ,",", confirmer Clearblue","dessiccateur , confirmer Clearblue","un dessiccateur , confirmer Clearblue","Clearblue , le","Clearblue , le marque","Clearblue , le marque du"
https://www.elle.fr/Societe/News/J-ai-eu-un-bebe-quatre-ans-apres-mon-cancer-du-sein-et-la-congelation-de-mes-ovocytes-3731666,elle.fr,2019-10-02,France,clearblue/NOM/clearblue,"Ce  fameux  test clearblue  dont  je  rêvais  ,  le  Graal  !  Le  test  urinaire  était  positif  ,  et  ,  y  croyant  à  peine  ,  je  suis  retournée  le  montrer  à  la  pharmacienne  qui  m'  a  confirmé  que  je  ne  rêvais  pas  .",clearblue,nom,clearblue,test,test,NOUN,fameux,fameux,ADJ,Ce,ce,PRON,,,,,,,dont,dont,PRON,je,je,PRON,rêvais,rêver,VERB,",",",",PUNCT,le,le,DET,2019-10-02,2019,2010,ADJ NOUN Clearblue PRON PRON,NOUN Clearblue PRON,ADJ NOUN Clearblue,PRON ADJ NOUN Clearblue,,Clearblue PRON PRON,Clearblue PRON PRON VERB,Clearblue PRON PRON VERB PUNCT,fameux test Clearblue dont je,test Clearblue dont,fameux test Clearblue,ce fameux test Clearblue,,Clearblue dont je,Clearblue dont je rêver,"Clearblue dont je rêver ,"
https://mcetv.fr/mon-mag-buzz/people/khloe-kardashian-bff-malika-haqq-echographie-bebe-26122019/,mcetv.fr,2019-12-26,France,ClearBlue/NAM/ClearBlue,"Merci  ,  @ ClearBlue  d'  être  une  partie  CLAIRE  et  complexe  du  résultat  du  test  le  plus  important  de  ma  vie  .  2020  bébé  !",clearblue,nam,clearblue,@,@,NOUN,",",",",PUNCT,Merci,merci,NOUN,,,,,,,d',de,ADP,être,être,VERB,une,un,DET,partie,partie,NOUN,CLAIRE,clair,ADJ,2019-12-26,2019,2010,PUNCT NOUN Clearblue ADP VERB,NOUN Clearblue ADP,PUNCT NOUN Clearblue,NOUN PUNCT NOUN Clearblue,,Clearblue ADP VERB,Clearblue ADP VERB DET,Clearblue ADP VERB DET NOUN,", @ Clearblue de être",@ Clearblue de,", @ Clearblue","merci , @ Clearblue",,Clearblue de être,Clearblue de être un,Clearblue de être un partie
https://www.journaldunet.com/ebusiness/internet-mobile/1487886-les-batteries-en-papier-le-pari-de-befc-dans-l-iot/,journaldunet.com,2020-01-06,France,Clearblue/NAM/Clearblue,Des  contrats  sont  notamment  engagés  avec  le  spécialiste  suisse  des  tests  d'  ovulation  et  de  grossesse Clearblue  et  un  groupe  urologique  suédois  .,clearblue,nam,clearblue,grossesse,grossesse,NOUN,de,de,ADP,et,et,CONJ,ovulation,ovulation,NOUN,d',de,ADP,et,et,CONJ,un,un,DET,groupe,groupe,NOUN,urologique,urologique,ADJ,suédois,suédois,ADJ,2020-01-06,2020,2020,ADP NOUN Clearblue CONJ DET,NOUN Clearblue CONJ,ADP NOUN Clearblue,CONJ ADP NOUN Clearblue,NOUN CONJ ADP NOUN Clearblue,Clearblue CONJ DET,Clearblue CONJ DET NOUN,Clearblue CONJ DET NOUN ADJ,de grossesse Clearblue et un,grossesse Clearblue et,de grossesse Clearblue,et de grossesse Clearblue,ovulation et de grossesse Clearblue,Clearblue et un,Clearblue et un groupe,Clearblue et un groupe urologique
https://www.sudinfo.be/id165273/article/2020-02-03/vos-enfants-utilisent-lapplication-tiktok-attention-cette-nouvelle-tendance-tres,sudinfo.be,2020-02-03,Belgium,Clearblue/ADJ/Clearblue,La  dernière  tendance  sortie  par  les  jeunes  utilisateurs  de  TikTok  consiste  à  avaler  la  pastille  présente  à  l'  intérieur  des  tests  de  grossesse Clearblue  .,clearblue,adj,clearblue,grossesse,grossesse,NOUN,de,de,ADP,tests,test,NOUN,des,du,ADP DET,intérieur,intérieur,NOUN,.,.,PUNCT,,,,,,,,,,,,,2020-02-03,2020,2020,,NOUN Clearblue PUNCT,ADP NOUN Clearblue,NOUN ADP NOUN Clearblue,ADP DET NOUN ADP NOUN Clearblue,,,,,grossesse Clearblue .,de grossesse Clearblue,test de grossesse Clearblue,du test de grossesse Clearblue,,,
https://www.sudinfo.be/id165273/article/2020-02-03/vos-enfants-utilisent-lapplication-tiktok-attention-cette-nouvelle-tendance-tres,sudinfo.be,2020-02-03,Belgium,Clearblue/NAM/Clearblue,"""  Vous  ne  pensiez  pas  qu'  il  y  avait  un  plan  B  dans  les  tests  de  grossesse Clearblue  ""  ,  a  déclaré  un  utilisateur  dans  une  vidéo  partagée  sur  TikTok  .",clearblue,nam,clearblue,grossesse,grossesse,NOUN,de,de,ADP,tests,test,NOUN,les,le,DET,dans,dans,ADP,"""","""",PUNCT,",",",",PUNCT,a,avoir,VERB,déclaré,déclarer,VERB,un,un,DET,2020-02-03,2020,2020,ADP NOUN Clearblue PUNCT PUNCT,NOUN Clearblue PUNCT,ADP NOUN Clearblue,NOUN ADP NOUN Clearblue,DET NOUN ADP NOUN Clearblue,Clearblue PUNCT PUNCT,Clearblue PUNCT PUNCT VERB,Clearblue PUNCT PUNCT VERB VERB,"de grossesse Clearblue "" ,","grossesse Clearblue """,de grossesse Clearblue,test de grossesse Clearblue,le test de grossesse Clearblue,"Clearblue "" ,","Clearblue "" , avoir","Clearblue "" , avoir déclarer"
https://www.sudinfo.be/id165273/article/2020-02-03/vos-enfants-utilisent-lapplication-tiktok-attention-cette-nouvelle-tendance-tres,sudinfo.be,2020-02-03,Belgium,Clearblue/NAM/Clearblue,"Suite  à  ces  bruits  concernant  le  test  de  grossesse  , Clearblue  a  démenti  cette  rumeur  .",clearblue,nam,clearblue,",",",",PUNCT,grossesse,grossesse,NOUN,de,de,ADP,test,test,NOUN,le,le,DET,a,avoir,VERB,démenti,démentir,VERB,cette,ce,PRON,rumeur,rumeur,NOUN,.,.,PUNCT,2020-02-03,2020,2020,NOUN PUNCT Clearblue VERB VERB,PUNCT Clearblue VERB,NOUN PUNCT Clearblue,ADP NOUN PUNCT Clearblue,NOUN ADP NOUN PUNCT Clearblue,Clearblue VERB VERB,Clearblue VERB VERB PRON,Clearblue VERB VERB PRON NOUN,"grossesse , Clearblue avoir démentir",", Clearblue avoir","grossesse , Clearblue","de grossesse , Clearblue","test de grossesse , Clearblue",Clearblue avoir démentir,Clearblue avoir démentir ce,Clearblue avoir démentir ce rumeur
https://www.sudinfo.be/id165273/article/2020-02-03/vos-enfants-utilisent-lapplication-tiktok-attention-cette-nouvelle-tendance-tres,sudinfo.be,2020-02-03,Belgium,Clearblue/NAM/Clearblue,"""  Les  tests  de  grossesse Clearblue  ne  contiennent  PAS  de  plan  B.  Tous  nos  tests  contiennent  un  petit  comprimé  déshydratant  qui  est  inclus  pour  absorber  l'  humidité  et  ne  doit  pas  être  mangé  ""  ,  a  déclaré  la  célèbre  marque  sur  Twitter  . </doc>",clearblue,nam,clearblue,grossesse,grossesse,NOUN,de,de,ADP,tests,test,NOUN,Les,le,DET,"""","""",PUNCT,ne,ne,ADV,contiennent,contenir,VERB,PAS,PAS,VERB,de,de,ADP,plan,plan,ADJ,2020-02-03,2020,2020,ADP NOUN Clearblue ADV VERB,NOUN Clearblue ADV,ADP NOUN Clearblue,NOUN ADP NOUN Clearblue,DET NOUN ADP NOUN Clearblue,Clearblue ADV VERB,Clearblue ADV VERB VERB,Clearblue ADV VERB VERB ADP,de grossesse Clearblue ne contenir,grossesse Clearblue ne,de grossesse Clearblue,test de grossesse Clearblue,le test de grossesse Clearblue,Clearblue ne contenir,Clearblue ne contenir PAS,Clearblue ne contenir PAS de
https://www.magicmaman.com/nouvelle-mode-sur-le-web-ingerer-la-pastille-presente-dans-les-tests-de-grossesse%2C3652096.asp,magicmaman.com,2020-02-04,===NONE===,Clearblue/NAM/Clearblue," Clearblue  ,  la  marque  de  test  de  grossesse  utilisée  dans  la  majorité  des  vidéos  du  challenge  ,  a  tenu  à  s'  exprimer  sur  la  question  :  ""  Nous  avons  appris  l'  existence  de  vidéos  concernant  la  pastille  à  l'  intérieur  de  nos  tests  de  grossesse  Clearblue  .",clearblue,nam,clearblue,,,,,,,,,,,,,,,,",",",",PUNCT,la,le,DET,marque,marque,NOUN,de,de,ADP,test,test,NOUN,2020-02-04,2020,2020,,,,,,Clearblue PUNCT DET,Clearblue PUNCT DET NOUN,Clearblue PUNCT DET NOUN ADP,,,,,,"Clearblue , le","Clearblue , le marque","Clearblue , le marque de"
https://www.magicmaman.com/nouvelle-mode-sur-le-web-ingerer-la-pastille-presente-dans-les-tests-de-grossesse%2C3652096.asp,magicmaman.com,2020-02-04,===NONE===,Clearblue/ADJ/Clearblue,"Clearblue  ,  la  marque  de  test  de  grossesse  utilisée  dans  la  majorité  des  vidéos  du  challenge  ,  a  tenu  à  s'  exprimer  sur  la  question  :  ""  Nous  avons  appris  l'  existence  de  vidéos  concernant  la  pastille  à  l'  intérieur  de  nos  tests  de  grossesse Clearblue  .",clearblue,adj,clearblue,grossesse,grossesse,NOUN,de,de,ADP,tests,test,NOUN,nos,notre,DET,de,de,ADP,.,.,PUNCT,,,,,,,,,,,,,2020-02-04,2020,2020,,NOUN Clearblue PUNCT,ADP NOUN Clearblue,NOUN ADP NOUN Clearblue,DET NOUN ADP NOUN Clearblue,,,,,grossesse Clearblue .,de grossesse Clearblue,test de grossesse Clearblue,notre test de grossesse Clearblue,,,
https://www.frenchweb.fr/piles-a-biocarburant-comment-befc-peut-appliquer-sa-technologie-aux-dispositifs-medicaux/392969,frenchweb.fr,2020-02-21,France,Clearblue/NAM/Clearblue,"En  partenariat  avec Clearblue  ,  le  fabricant  suisse  de  test  de  grossesse  et  d'  ovulation  ,  BeFC  est  en  phase  d'  essai  et  d'  évaluation  en  vue  de  produire  10  millions  d'  unités  .",clearblue,nam,clearblue,avec,avec,ADP,partenariat,partenariat,NOUN,En,en,ADP,,,,,,,",",",",PUNCT,le,le,DET,fabricant,fabricant,NOUN,suisse,suisse,ADJ,de,de,ADP,2020-02-21,2020,2020,NOUN ADP Clearblue PUNCT DET,ADP Clearblue PUNCT,NOUN ADP Clearblue,ADP NOUN ADP Clearblue,,Clearblue PUNCT DET,Clearblue PUNCT DET NOUN,Clearblue PUNCT DET NOUN ADJ,"partenariat avec Clearblue , le","avec Clearblue ,",partenariat avec Clearblue,en partenariat avec Clearblue,,"Clearblue , le","Clearblue , le fabricant","Clearblue , le fabricant suisse"
https://www.sudinfo.be/id170195/article/2020-02-28/attention-ce-nouveau-defi-sur-tiktok-un-medecin-met-en-garde-cela-peut-entrainer,sudinfo.be,2020-02-28,Belgium,Clearblue/ADJ/Clearblue,"Après  les  défis  de  la  pièce  dans  un  chargeur  ,  du  comprimé  dans  les  tests  de  grossesse Clearblue  ou  encore  le  défi  du  ""  cercle  ""  ,  une  nouvelle  tendance  est  apparue  sur  l'  application  très  en  vogue  chez  les  jeunes  .",clearblue,adj,clearblue,grossesse,grossesse,NOUN,de,de,ADP,tests,test,NOUN,les,le,DET,dans,dans,ADP,ou,ou,CONJ,encore,encore,ADV,le,le,DET,défi,défi,NOUN,du,du,ADP DET,2020-02-28,2020,2020,ADP NOUN Clearblue CONJ ADV,NOUN Clearblue CONJ,ADP NOUN Clearblue,NOUN ADP NOUN Clearblue,DET NOUN ADP NOUN Clearblue,Clearblue CONJ ADV,Clearblue CONJ ADV DET,Clearblue CONJ ADV DET NOUN,de grossesse Clearblue ou encore,grossesse Clearblue ou,de grossesse Clearblue,test de grossesse Clearblue,le test de grossesse Clearblue,Clearblue ou encore,Clearblue ou encore le,Clearblue ou encore le défi
https://www.mapnews.ma/fr/actualites/economie/mascir-et-mologic-sassocient-pour-d%C3%A9velopper-des-biosimilaires-et-des-tests-de,mapnews.ma,2020-06-25,Morocco,Clearblue/ADJ/Clearblue,"Paul  DAVIS  ,  co-fondateur  et  directeur  scientifique  de  Mologic  ,  a  été  co-inventeur  du  test  de  grossesse Clearblue  ,  lancé  en  1988  .",clearblue,adj,clearblue,grossesse,grossesse,NOUN,de,de,ADP,test,test,NOUN,du,du,ADP DET,co-inventeur,co-inventeur,NOUN,",",",",PUNCT,lancé,lancer,VERB,en,en,ADP,1988,@card@,ADJ,.,.,PUNCT,2020-06-25,2020,2020,ADP NOUN Clearblue PUNCT VERB,NOUN Clearblue PUNCT,ADP NOUN Clearblue,NOUN ADP NOUN Clearblue,ADP DET NOUN ADP NOUN Clearblue,Clearblue PUNCT VERB,Clearblue PUNCT VERB ADP,Clearblue PUNCT VERB ADP ADJ,"de grossesse Clearblue , lancer","grossesse Clearblue ,",de grossesse Clearblue,test de grossesse Clearblue,du test de grossesse Clearblue,"Clearblue , lancer","Clearblue , lancer en","Clearblue , lancer en @card@"
https://www.usine-digitale.fr/article/les-biopiles-ecologiques-du-grenoblois-befc-levent-3-millions-d-euros.N988789,usine-digitale.fr,2020-07-24,France,Clearblue/NAM/Clearblue,"Après  une  première  collaboration  avec  la  société Clearblue  ,  spécialiste  des  tests  d'  ovulation  et  de  grossesse  ,  pour  laquelle  BeFC  a  remplacé  à  efficacité  similaire  l'  une  des  deux  piles  bouton  par  une  pile  à  biocarburant  écologique  à  base  de  papier  ,  la  start-up  souhaite  profiter  de  cette  levée  de  fonds  pour  lier  de  nouveaux  contacts  .",clearblue,nam,clearblue,société,société,NOUN,la,le,DET,avec,avec,ADP,collaboration,collaboration,NOUN,première,premier,ADJ,",",",",PUNCT,spécialiste,spécialiste,NOUN,des,du,ADP DET,tests,test,NOUN,d',de,ADP,2020-07-24,2020,2020,DET NOUN Clearblue PUNCT NOUN,NOUN Clearblue PUNCT,DET NOUN Clearblue,ADP DET NOUN Clearblue,NOUN ADP DET NOUN Clearblue,Clearblue PUNCT NOUN,Clearblue PUNCT NOUN ADP DET,Clearblue PUNCT NOUN ADP DET NOUN,"le société Clearblue , spécialiste","société Clearblue ,",le société Clearblue,avec le société Clearblue,collaboration avec le société Clearblue,"Clearblue , spécialiste","Clearblue , spécialiste du","Clearblue , spécialiste du test"
https://jeuxvideo.rds.ca/doom-est-a-present-jouable-sur-un-test-de-grossesse/,rds.ca,2020-09-08,Canada,Clearblue/NAM/Clearblue,"Pour  bien  comprendre  comment  est  venue  l'  idée  de  faire  tourner  Doom  sur  un  test  de  grossesse  ,  il  faut  d'abord  savoir  que  cela  vient  directement  d'  une  polémique  venant  d'  un  produit  vendu  par  Walmart  et Clearblue  .",clearblue,nam,clearblue,et,et,CONJ,Walmart,Walmart,PROPN,par,par,ADP,vendu,vendre,VERB,produit,produit,NOUN,.,.,PUNCT,,,,,,,,,,,,,2020-09-08,2020,2020,,CONJ Clearblue PUNCT,PROPN CONJ Clearblue,ADP PROPN CONJ Clearblue,VERB ADP PROPN CONJ Clearblue,,,,,et Clearblue .,Walmart et Clearblue,par Walmart et Clearblue,vendre par Walmart et Clearblue,,,
https://www.huffingtonpost.fr/entry/ma-mesaventure-avec-un-sterilet-me-fait-realiser-le-poids-de-la-contraception-qui-pese-encore-sur-les-femmes-blog_fr_5f71ea10c5b64deddef116f3,huffingtonpost.fr,2020-09-29,France,ClearBlue/NAM/ClearBlue,"Faudrait  préciser  cette  question  :  grossesses  désirées  ou  non  désirées  ,  grossesse  au  sens  Clear  Blue  (  marque  de  test  de  grossesse  )  du  terme  ou  au  sens  de  la  Sécurité  sociale  ?  Parce  que  dans  mon  cas  ça  varie  du  simple  au  double  ,  en ClearBlue  ,  ça  fait  4  ,  en  sécu  ,  ça  fait  2  .",clearblue,nam,clearblue,en,en,ADP,",",",",PUNCT,double,double,NOUN,au,au,ADP DET,simple,simple,ADJ,",",",",PUNCT,ça,cela,PRON,fait,faire,VERB,4,@card@,ADJ,",",",",PUNCT,2020-09-29,2020,2020,PUNCT ADP Clearblue PUNCT PRON,ADP Clearblue PUNCT,PUNCT ADP Clearblue,NOUN PUNCT ADP Clearblue,ADP DET NOUN PUNCT ADP Clearblue,Clearblue PUNCT PRON,Clearblue PUNCT PRON VERB,Clearblue PUNCT PRON VERB ADJ,", en Clearblue , cela","en Clearblue ,",", en Clearblue","double , en Clearblue","au double , en Clearblue","Clearblue , cela","Clearblue , cela faire","Clearblue , cela faire @card@"
https://www.lemonde.fr/planete/article/2020/11/09/a-cause-de-l-epidemie-de-covid-19-le-nombre-de-naissances-pourrait-baisser-aux-etats-unis_6059074_3244.html,lemonde.fr,2020-11-09,France,Clearblue/NAM/Clearblue,"Pour  le  vérifier  ,  les  chercheurs  ont  effectué  différents  tests  avec  plusieurs  combinaisons  de  mots  allant  de Clearblue  (  une  marque  américaine  populaire  de  tests  de  grossesse  )  ,  sage-femme  ,  ovulation  ,  échographie  ,  conception  ,  fécondation  in  vitro  (  FIV  )  à  pilule  du  lendemain  ,  sexe  non  protégé  ,  fausse  couche  ,  divorce  ... </doc>",clearblue,nam,clearblue,de,de,ADP,allant,aller,VERB,mots,mot,NOUN,de,de,ADP,combinaisons,combinaison,NOUN,(,(,PUNCT,une,un,DET,marque,marque,NOUN,américaine,américain,ADJ,populaire,populaire,ADJ,2020-11-09,2020,2020,VERB ADP Clearblue PUNCT DET,ADP Clearblue PUNCT,VERB ADP Clearblue,NOUN VERB ADP Clearblue,ADP NOUN VERB ADP Clearblue,Clearblue PUNCT DET,Clearblue PUNCT DET NOUN,Clearblue PUNCT DET NOUN ADJ,aller de Clearblue ( un,de Clearblue (,aller de Clearblue,mot aller de Clearblue,de mot aller de Clearblue,Clearblue ( un,Clearblue ( un marque,Clearblue ( un marque américain
https://toutfilm.com/les-marseillais-une-candidate-enceinte-un-test-devoile-accidentellement/,toutfilm.com,2021-01-21,===NONE===,Clearblue/ADJ/Clearblue,"Et  très  vite  ,  des  internautes  très  vigilants  ont  remarqué  qu'  en  coin  ,  on  pouvait  apercevoir  un  probable  test  de  grossesse  de  la  marque Clearblue  .",clearblue,adj,clearblue,marque,marque,NOUN,la,le,DET,de,de,ADP,grossesse,grossesse,NOUN,de,de,ADP,.,.,PUNCT,,,,,,,,,,,,,2021-01-21,2021,2020,,NOUN Clearblue PUNCT,DET NOUN Clearblue,ADP DET NOUN Clearblue,NOUN ADP DET NOUN Clearblue,,,,,marque Clearblue .,le marque Clearblue,de le marque Clearblue,grossesse de le marque Clearblue,,,
https://www.voici.fr/news-people/actu-people/photo-une-star-des-marseillais-enceinte-elle-filme-accidentellement-son-test-de-grossesse-695239,voici.fr,2021-01-21,France,Clearblue/ADJ/Clearblue,"Sauf  qu'  au  coin  de  l'  image  ,  posé  sur  la  table  ,  ses  abonnés  ont  cru  distinguer  ce  qui  semblait  être  un  test  de  grossesse  !  Seuls  la  lettre  C  et  le  mot  ""  Test  ""  sont  visibles  ,  mais  une  simple  recherche  suffit  à  se  convaincre  qu'  il  s'  agit  d'  un  produit  de  la  marque Clearblue  .",clearblue,adj,clearblue,marque,marque,NOUN,la,le,DET,de,de,ADP,produit,produit,NOUN,un,un,DET,.,.,PUNCT,,,,,,,,,,,,,2021-01-21,2021,2020,,NOUN Clearblue PUNCT,DET NOUN Clearblue,ADP DET NOUN Clearblue,NOUN ADP DET NOUN Clearblue,,,,,marque Clearblue .,le marque Clearblue,de le marque Clearblue,produit de le marque Clearblue,,,
https://mcetv.fr/mon-mag-buzz/tele-realite/les-marseillais-candidate-enceinte-21012021/,mcetv.fr,2021-01-21,France,Clearblue/NAM/Clearblue,"Après  quelques  recherches  ,  ils  ont  découvert  qu'  il  s'  agissait  d'  un  produit  de  la  marque Clearblue  ,  qui  propose  des  tests  de  grossesse  .",clearblue,nam,clearblue,marque,marque,NOUN,la,le,DET,de,de,ADP,produit,produit,NOUN,un,un,DET,",",",",PUNCT,qui,qui,PRON,propose,proposer,VERB,des,du,ADP DET,tests,test,NOUN,2021-01-21,2021,2020,DET NOUN Clearblue PUNCT PRON,NOUN Clearblue PUNCT,DET NOUN Clearblue,ADP DET NOUN Clearblue,NOUN ADP DET NOUN Clearblue,Clearblue PUNCT PRON,Clearblue PUNCT PRON VERB,Clearblue PUNCT PRON VERB ADP DET,"le marque Clearblue , qui","marque Clearblue ,",le marque Clearblue,de le marque Clearblue,produit de le marque Clearblue,"Clearblue , qui","Clearblue , qui proposer","Clearblue , qui proposer du"
https://toutfilm.com/les-marseillais-une-candidate-vient-elle-de-devoiler-accidentellement-sa-grossesse/,toutfilm.com,2021-01-21,===NONE===,Clearblue/NAM/Clearblue,L'  emballage  bleu  de  la  marque Clearblue  ne  laisse  pas  deviner  s'  il  s'  agit  d'  un  test  de  diagnostic  de  grossesse  précoce  (  résultat  jusqu'  à  4  jours  avant  la  date  des  règles  )  ou  d'  un  test  destiné  à  indiquer  les  jours  propices  à  la  conception  d'  un  enfant  .,clearblue,nam,clearblue,marque,marque,NOUN,la,le,DET,de,de,ADP,bleu,bleu,ADJ,emballage,emballage,NOUN,ne,ne,ADV,laisse,laisser,VERB,pas,pas,ADV,deviner,deviner,VERB,s',si,CONJ,2021-01-21,2021,2020,DET NOUN Clearblue ADV VERB,NOUN Clearblue ADV,DET NOUN Clearblue,ADP DET NOUN Clearblue,ADJ ADP DET NOUN Clearblue,Clearblue ADV VERB,Clearblue ADV VERB ADV,Clearblue ADV VERB ADV VERB,le marque Clearblue ne laisser,marque Clearblue ne,le marque Clearblue,de le marque Clearblue,bleu de le marque Clearblue,Clearblue ne laisser,Clearblue ne laisser pas,Clearblue ne laisser pas deviner
https://news-24.fr/le-petit-ami-de-katie-price-carl-woods-vu-pas-si-subtilement-faire-un-test-de-grossesse/,news-24.fr,2021-03-04,France,Clearblue/VER:pper/Clearblue,"Carl  ,  32  ans  ,  a  été  aperçu  en  train  de  quitter  Tesco  avec  une  pochette  Louis  Vuitton  et  un  test  de  grossesse Clearblue  à  la  main  .",clearblue,ver:pper,clearblue,grossesse,grossesse,NOUN,de,de,ADP,test,test,NOUN,un,un,DET,et,et,CONJ,à,à,ADP,la,le,DET,main,main,NOUN,.,.,PUNCT,,,,2021-03-04,2021,2020,ADP NOUN Clearblue ADP DET,NOUN Clearblue ADP,ADP NOUN Clearblue,NOUN ADP NOUN Clearblue,DET NOUN ADP NOUN Clearblue,Clearblue ADP DET,Clearblue ADP DET NOUN,Clearblue ADP DET NOUN PUNCT,de grossesse Clearblue à le,grossesse Clearblue à,de grossesse Clearblue,test de grossesse Clearblue,un test de grossesse Clearblue,Clearblue à le,Clearblue à le main,Clearblue à le main .
