url,website,date,country,keyword,sentence,kw,kw_lemma,kw_pos,left_w1,left_l1,left_p1,left_w2,left_l2,left_p2,left_w3,left_l3,left_p3,left_w4,left_l4,left_p4,left_w5,left_l5,left_p5,right_w1,right_l1,right_p1,right_w2,right_l2,right_p2,right_w3,right_l3,right_p3,right_w4,right_l4,right_p4,right_w5,right_l5,right_p5,datetime,year,10years,pattern_around5,pattern_around3,pattern_left2,pattern_left3,pattern_left4,pattern_right2,pattern_right3,pattern_right4,pattern_around5_lex,pattern_around3_lex,pattern_left2_lex,pattern_left3_lex,pattern_left4_lex,pattern_right2_lex,pattern_right3_lex,pattern_right4_lex
http://www.lesechos.fr/industrie-services/mode-luxe/0211751520464-avec-msrcom-monoprix-accelere-dans-la-mode-2061846.php#xtor%3DRSS-2219,lesechos.fr,2017-02-01,France,UGG/NAM/UGG,"Racheté  par  le  groupe  Casino  (  propriétaire  de  Monoprix  )  en  2012  ,  ce  site  de  vente  en  ligne  ,  rebaptisé  Msr  ,  vient  de  se  relancer  sur  le  segment  du  ""  luxe  accessible  ""  avec  une  offre  enrichie  de  quelque  250  marques  ,  françaises  beaucoup  ,  American  Vintage  ,  Bash  ,  Sessun  ,  Avril  Gau  ,  Tyla  March  et  internationales  ,  Canada  Goose  , UGG  ,  J  Brand  ,  See  by  Chloé  ...",ugg,nam,ugg,",",",",PUNCT,Goose,Goose,PROPN,Canada,Canada,PROPN,",",",",PUNCT,internationales,international,ADJ,",",",",PUNCT,J,J,PROPN,Brand,Brand,PROPN,",",",",PUNCT,See,See,PROPN,2017-02-01,2017,2010,PROPN PUNCT Ugg PUNCT PROPN,PUNCT Ugg PUNCT,PROPN PUNCT Ugg,PROPN PROPN PUNCT Ugg,PUNCT PROPN PROPN PUNCT Ugg,Ugg PUNCT PROPN,Ugg PUNCT PROPN PROPN,Ugg PUNCT PROPN PROPN PUNCT,"Goose , Ugg , J",", Ugg ,","Goose , Ugg","Canada Goose , Ugg",", Canada Goose , Ugg","Ugg , J","Ugg , J Brand","Ugg , J Brand ,"
http://www.lesechos.fr/sport/omnisport/0211761305792-tom-brady-licone-de-la-nfl-qui-divise-lamerique-2062701.php#xtor%3DRSS-2056,lesechos.fr,2017-02-05,France,Ugg/NAM/Ugg,"En  associant  son  image  à  des  challengers  comme  Under  Armour  ou Ugg  ,  il  cultive  la  discrétion  sans  dévoiler  le  montant  de  ses  investissements  ou  de  ses  contrats  publicitaires  .",ugg,nam,ugg,ou,ou,CONJ,Armour,Armour,PROPN,Under,Under,PROPN,comme,comme,CONJ,challengers,challenger,NOUN,",",",",PUNCT,il,il,PRON,cultive,cultiver,VERB,la,le,DET,discrétion,discrétion,NOUN,2017-02-05,2017,2010,PROPN CONJ Ugg PUNCT PRON,CONJ Ugg PUNCT,PROPN CONJ Ugg,PROPN PROPN CONJ Ugg,CONJ PROPN PROPN CONJ Ugg,Ugg PUNCT PRON,Ugg PUNCT PRON VERB,Ugg PUNCT PRON VERB DET,"Armour ou Ugg , il","ou Ugg ,",Armour ou Ugg,Under Armour ou Ugg,comme Under Armour ou Ugg,"Ugg , il","Ugg , il cultiver","Ugg , il cultiver le"
http://www.lexpress.fr/styles/beaute/les-irremplacables-de-mathilde-lacombe_1876754.html,lexpress.fr,2017-02-09,France,UGG/NAM/UGG,Les UGG  en  hiver  et  les  Birkenstock  en  été  .,ugg,nam,ugg,Les,le,DET,,,,,,,,,,,,,en,en,ADP,hiver,hiver,NOUN,et,et,CONJ,les,le,DET,Birkenstock,Birkenstock,PROPN,2017-02-09,2017,2010,,DET Ugg ADP,,,,Ugg ADP NOUN,Ugg ADP NOUN CONJ,Ugg ADP NOUN CONJ DET,,le Ugg en,,,,Ugg en hiver,Ugg en hiver et,Ugg en hiver et le
http://www.leparisien.fr/laparisienne/actu-people/le-mannequin-rosie-huntington-whiteley-enceinte-de-jason-statham-10-02-2017-6670176.php#xtor%3DRSS-1481423633,leparisien.fr,2017-02-10,France,UGG/NAM/UGG,"La  jeune  femme  ,  égérie  de  la  marque  de  chaussures UGG  ,  est  aussi  actrice  .",ugg,nam,ugg,chaussures,chaussure,NOUN,de,de,ADP,marque,marque,NOUN,la,le,DET,de,de,ADP,",",",",PUNCT,est,être,VERB,aussi,aussi,ADV,actrice,acteur|actrice,NOUN,.,.,PUNCT,2017-02-10,2017,2010,ADP NOUN Ugg PUNCT VERB,NOUN Ugg PUNCT,ADP NOUN Ugg,NOUN ADP NOUN Ugg,DET NOUN ADP NOUN Ugg,Ugg PUNCT VERB,Ugg PUNCT VERB ADV,Ugg PUNCT VERB ADV NOUN,"de chaussure Ugg , être","chaussure Ugg ,",de chaussure Ugg,marque de chaussure Ugg,le marque de chaussure Ugg,"Ugg , être","Ugg , être aussi","Ugg , être aussi acteur|actrice"
http://www.lemonde.fr/fashion-week/article/2017/02/13/fashion-week-new-york-en-plein-flou-artistique_5078978_1824875.html,lemonde.fr,2017-03-08,France,Ugg/NAM/Ugg,"Les  manteaux  à  épaules  extra-larges  croisent  ici  des  pantalons  de  cuir  moulant  à  taille  haute  ,  des  mini-robes  filet  se  portent  avec  des  bottines  lacées  ou  des  chaussons Ugg  cloutés  .",ugg,nam,ugg,chaussons,chausson,NOUN,des,du,ADP DET,ou,ou,CONJ,lacées,lacer,VERB,bottines,bottine,NOUN,cloutés,clouter,VERB,.,.,PUNCT,,,,,,,,,,2017-03-08,2017,2010,ADP DET NOUN Ugg VERB PUNCT,NOUN Ugg VERB,ADP DET NOUN Ugg,CONJ ADP DET NOUN Ugg,VERB CONJ ADP DET NOUN Ugg,Ugg VERB PUNCT,,,du chausson Ugg clouter .,chausson Ugg clouter,du chausson Ugg,ou du chausson Ugg,lacer ou du chausson Ugg,Ugg clouter .,,
http://www.elle.fr/Mode/Les-news-mode/L-instant-mode-Ugg-devoile-sa-collection-capsule-Royale-3460478#utm_source%3DRSS-ELLE%26utm_medium%3DFlux-Rss%26utm_campaign%3DRSS_Le_fil_info_de_ELLE%26xtor%3DRSS-21,elle.fr,2017-03-28,France,Ugg/NAM/Ugg,<doc uri=http://www.elle.fr/Mode/Les-news-mode/L-instant-mode-Ugg-devoile-sa-collection-capsule-Royale-3460478#utm_source%3DRSS-ELLE%26utm_medium%3DFlux-Rss%26utm_campaign%3DRSS_Le_fil_info_de_ELLE%26xtor%3DRSS-21 website=elle.fr date=2017-03-28 source_country=France> /Lâ/NOM /€/ABR /™/SYM /instant/ADJ /mode/NOM /:/PUN Ugg  dĂŠvoile  sa  collection  capsule  ÂŤ  Royale  Âť,ugg,nam,ugg,:,:,PUNCT,mode,mode,NOUN,instant,instant,ADJ,™,™,SYM,€,€,ABR,dĂŠvoile,dĂŠvoile,VERB,sa,son,DET,collection,collection,NOUN,capsule,capsuler,VERB,ÂŤ,ÂŤ,NOUN,2017-03-28,2017,2010,NOUN PUNCT Ugg VERB DET,PUNCT Ugg VERB,NOUN PUNCT Ugg,ADJ NOUN PUNCT Ugg,SYM ADJ NOUN PUNCT Ugg,Ugg VERB DET,Ugg VERB DET NOUN,Ugg VERB DET NOUN VERB,mode : Ugg dĂŠvoile son,: Ugg dĂŠvoile,mode : Ugg,instant mode : Ugg,™ instant mode : Ugg,Ugg dĂŠvoile son,Ugg dĂŠvoile son collection,Ugg dĂŠvoile son collection capsuler
http://www.elle.fr/Mode/Les-news-mode/L-instant-mode-Ugg-devoile-sa-collection-capsule-Royale-3460478#utm_source%3DRSS-ELLE%26utm_medium%3DFlux-Rss%26utm_campaign%3DRSS_Le_fil_info_de_ELLE%26xtor%3DRSS-21,elle.fr,2017-03-28,France,Ugg/NAM/Ugg,"Convoitée  par  toutes  les  filles  cool  désireuses  de  porter  des  chaussures  à  la  fois  stylées  et  confortables  ,  la  marque  californienne Ugg  crée  l'  évènement  en  dévoilant  une  toute  nouvelle  capsule  basée  sur  un  it  de  la  saison  :  la  claquette  .",ugg,nam,ugg,californienne,californien,ADJ,marque,marque,NOUN,la,le,DET,",",",",PUNCT,confortables,confortable,ADJ,crée,créer,VERB,l',le,DET,évènement,événement,NOUN,en,en,ADP,dévoilant,dévoiler,VERB,2017-03-28,2017,2010,NOUN ADJ Ugg VERB DET,ADJ Ugg VERB,NOUN ADJ Ugg,DET NOUN ADJ Ugg,PUNCT DET NOUN ADJ Ugg,Ugg VERB DET,Ugg VERB DET NOUN,Ugg VERB DET NOUN ADP,marque californien Ugg créer le,californien Ugg créer,marque californien Ugg,le marque californien Ugg,", le marque californien Ugg",Ugg créer le,Ugg créer le événement,Ugg créer le événement en
http://www.elle.fr/Mode/Les-news-mode/L-instant-mode-Ugg-devoile-sa-collection-capsule-Royale-3460478#utm_source%3DRSS-ELLE%26utm_medium%3DFlux-Rss%26utm_campaign%3DRSS_Le_fil_info_de_ELLE%26xtor%3DRSS-21,elle.fr,2017-03-28,France,Ugg/NAM/Ugg,"Collection  capsule  ""  Royale  ""  ,  d'  ores  et  déjà  disponible  en  boutiques  et  sur  l'  e-shop  de Ugg  ,  93  €  (  attention  ,  édition  très  limitée  )  . </doc>",ugg,nam,ugg,de,de,ADP,e-shop,e-shop,NOUN,l',le,DET,sur,sur,ADP,et,et,CONJ,",",",",PUNCT,93,@card@,ADJ,€,€,NOUN,(,(,PUNCT,attention,attention,NOUN,2017-03-28,2017,2010,NOUN ADP Ugg PUNCT ADJ,ADP Ugg PUNCT,NOUN ADP Ugg,DET NOUN ADP Ugg,ADP DET NOUN ADP Ugg,Ugg PUNCT ADJ,Ugg PUNCT ADJ NOUN,Ugg PUNCT ADJ NOUN PUNCT,"e-shop de Ugg , @card@","de Ugg ,",e-shop de Ugg,le e-shop de Ugg,sur le e-shop de Ugg,"Ugg , @card@","Ugg , @card@ €","Ugg , @card@ € ("
http://www.dhnet.be/lifestyle/people/que-faisait-kate-middleton-pendant-que-le-prince-william-se-tremoussait-seul-sur-le-dancefloor-58e35b8bcd70e80512a81886,dhnet.be,2017-04-04,Belgium,Ugg/NAM/Ugg,"""  Les  propriétaires  voulaient  impressionner  leurs  clients  royaux  ,  ils  ont  offert  des  cadeaux  aux  filles  :  des  montres  Swatch  ,  des  pantoufles Ugg  ,  des  blocs-notes  avec  des  finitions  en  cuir  ,  des  parfums  ""  ,  poursuit  cette  personne  .",ugg,nam,ugg,pantoufles,pantoufle,NOUN,des,du,ADP DET,",",",",PUNCT,Swatch,Swatch,PROPN,montres,montre,NOUN,",",",",PUNCT,des,du,ADP DET,blocs-notes,blocs-notes,NOUN,avec,avec,ADP,des,du,ADP DET,2017-04-04,2017,2010,ADP DET NOUN Ugg PUNCT ADP DET,NOUN Ugg PUNCT,ADP DET NOUN Ugg,PUNCT ADP DET NOUN Ugg,PROPN PUNCT ADP DET NOUN Ugg,Ugg PUNCT ADP DET,Ugg PUNCT ADP DET NOUN,Ugg PUNCT ADP DET NOUN ADP,"du pantoufle Ugg , du","pantoufle Ugg ,",du pantoufle Ugg,", du pantoufle Ugg","Swatch , du pantoufle Ugg","Ugg , du","Ugg , du blocs-notes","Ugg , du blocs-notes avec"
http://www.20minutes.fr/people/2043175-20170404-kate-middleton-fete-evjf-ur-pippa-luxueux-chalet-france#xtor%3DRSS-149,20minutes.fr,2017-04-04,France,Ugg/NAM/Ugg,"""  Les  propriétaires  voulaient  aussi  impressionner  leurs  clients  royaux  ,  ils  ont  offert  des  cadeaux  aux  filles  :  des  montres  Swatch  ,  des  pantoufles Ugg  ,  des  blocs-notes  avec  des  finitions  en  cuir  ,  des  parfums  ,  a  continué  cette  personne  .",ugg,nam,ugg,pantoufles,pantoufle,NOUN,des,du,ADP DET,",",",",PUNCT,Swatch,Swatch,PROPN,montres,montre,NOUN,",",",",PUNCT,des,du,ADP DET,blocs-notes,blocs-notes,NOUN,avec,avec,ADP,des,du,ADP DET,2017-04-04,2017,2010,ADP DET NOUN Ugg PUNCT ADP DET,NOUN Ugg PUNCT,ADP DET NOUN Ugg,PUNCT ADP DET NOUN Ugg,PROPN PUNCT ADP DET NOUN Ugg,Ugg PUNCT ADP DET,Ugg PUNCT ADP DET NOUN,Ugg PUNCT ADP DET NOUN ADP,"du pantoufle Ugg , du","pantoufle Ugg ,",du pantoufle Ugg,", du pantoufle Ugg","Swatch , du pantoufle Ugg","Ugg , du","Ugg , du blocs-notes","Ugg , du blocs-notes avec"
http://www.journaldesfemmes.com/mariage/organisation/1827997-evjf-kate-pippa-middleton/,journaldesfemmes.com,2017-04-05,===NONE===,Ugg/NAM/Ugg,"""  Ils  leur  ont  offert  des  montres  Swatch  ,  des  pantoufles Ugg  ,  des  cahiers  en  cuir  et  des  parfums  réalisés  sur-mesure  .",ugg,nam,ugg,pantoufles,pantoufle,NOUN,des,du,ADP DET,",",",",PUNCT,Swatch,Swatch,PROPN,montres,montre,NOUN,",",",",PUNCT,des,du,ADP DET,cahiers,cahier,NOUN,en,en,ADP,cuir,cuir,NOUN,2017-04-05,2017,2010,ADP DET NOUN Ugg PUNCT ADP DET,NOUN Ugg PUNCT,ADP DET NOUN Ugg,PUNCT ADP DET NOUN Ugg,PROPN PUNCT ADP DET NOUN Ugg,Ugg PUNCT ADP DET,Ugg PUNCT ADP DET NOUN,Ugg PUNCT ADP DET NOUN ADP,"du pantoufle Ugg , du","pantoufle Ugg ,",du pantoufle Ugg,", du pantoufle Ugg","Swatch , du pantoufle Ugg","Ugg , du","Ugg , du cahier","Ugg , du cahier en"
http://www.purepeople.com/article/kate-middleton-ce-qu-elle-faisait-pendant-l-ivresse-de-william-a-verbier_a230140/1,purepeople.com,2017-04-06,France,Ugg/NAM/Ugg,"Les  propriétaires  ont  aussi  voulu  faire  bonne  impression  à  leurs  invitées  royales  et  les  ont  couvertes  de  cadeaux  :  des  montres  Swatch  ,  des  chaussons Ugg  ,  des  carnets  à  reliure  cuir  et  des  parfums  sur  mesure  .",ugg,nam,ugg,chaussons,chausson,NOUN,des,du,ADP DET,",",",",PUNCT,Swatch,Swatch,PROPN,montres,montre,NOUN,",",",",PUNCT,des,du,ADP DET,carnets,carnet,NOUN,à,à,ADP,reliure,reliure,NOUN,2017-04-06,2017,2010,ADP DET NOUN Ugg PUNCT ADP DET,NOUN Ugg PUNCT,ADP DET NOUN Ugg,PUNCT ADP DET NOUN Ugg,PROPN PUNCT ADP DET NOUN Ugg,Ugg PUNCT ADP DET,Ugg PUNCT ADP DET NOUN,Ugg PUNCT ADP DET NOUN ADP,"du chausson Ugg , du","chausson Ugg ,",du chausson Ugg,", du chausson Ugg","Swatch , du chausson Ugg","Ugg , du","Ugg , du carnet","Ugg , du carnet à"
http://www.purepeople.com/article/channing-tatum-et-jenna-dewan-la-bombe-raconte-leurs-debuts-laborieux_a232594/1,purepeople.com,2017-04-25,France,Ugg/NAM/Ugg,"Quand  j'  ai  ouvert  la  porte  ,  il  était  là  ,  en  sous-vêtements  et  sombrero  ,  avec  une  paire  de Ugg  .",ugg,nam,ugg,de,de,ADP,paire,paire,NOUN,une,un,DET,avec,avec,ADP,",",",",PUNCT,.,.,PUNCT,,,,,,,,,,,,,2017-04-25,2017,2010,,ADP Ugg PUNCT,NOUN ADP Ugg,DET NOUN ADP Ugg,ADP DET NOUN ADP Ugg,,,,,de Ugg .,paire de Ugg,un paire de Ugg,avec un paire de Ugg,,,
http://www.lecho.be/entreprises/textile/Les-bottes-Ugg-bientot-en-vente/9887140?ckc=1&ts=1493193796,lecho.be,2017-04-26,Belgium,Ugg/NAM/Ugg,<doc uri=http://www.lecho.be/entreprises/textile/Les-bottes-Ugg-bientot-en-vente/9887140?ckc=1&ts=1493193796 website=lecho.be date=2017-04-26 source_country=Belgium> /le/DET:ART /botte/NOM Ugg  bientôt  en  vente  ?,ugg,nam,ugg,bottes,botte,NOUN,Les,le,DET,,,,,,,,,,bientôt,bientôt,ADV,en,en,ADP,vente,vente,NOUN,?,?,PUNCT,,,,2017-04-26,2017,2010,DET NOUN Ugg ADV ADP,NOUN Ugg ADV,DET NOUN Ugg,,,Ugg ADV ADP,Ugg ADV ADP NOUN,Ugg ADV ADP NOUN PUNCT,le botte Ugg bientôt en,botte Ugg bientôt,le botte Ugg,,,Ugg bientôt en,Ugg bientôt en vente,Ugg bientôt en vente ?
http://www.lecho.be/entreprises/textile/Les-bottes-Ugg-bientot-en-vente/9887140?ckc=1&ts=1493193796,lecho.be,2017-04-26,Belgium,Ugg/NAM/Ugg,"Le  propriétaire  des  célèbres  bottes Ugg  ,  en  perte  de  vitesse  ,  envisage  de  se  vendre  .",ugg,nam,ugg,bottes,botte,NOUN,célèbres,célèbre,ADJ,des,du,ADP DET,propriétaire,propriétaire,NOUN,Le,le,DET,",",",",PUNCT,en,en,ADP,perte,perte,NOUN,de,de,ADP,vitesse,vitesse,NOUN,2017-04-26,2017,2010,ADJ NOUN Ugg PUNCT ADP,NOUN Ugg PUNCT,ADJ NOUN Ugg,ADP DET ADJ NOUN Ugg,NOUN ADP DET ADJ NOUN Ugg,Ugg PUNCT ADP,Ugg PUNCT ADP NOUN,Ugg PUNCT ADP NOUN ADP,"célèbre botte Ugg , en","botte Ugg ,",célèbre botte Ugg,du célèbre botte Ugg,propriétaire du célèbre botte Ugg,"Ugg , en","Ugg , en perte","Ugg , en perte de"
http://www.lecho.be/entreprises/textile/Les-bottes-Ugg-bientot-en-vente/9887140?ckc=1&ts=1493193796,lecho.be,2017-04-26,Belgium,Ugg/NAM/Ugg,"Après  le  luxueux  Jimmy  Choo  ,  c'  est  au  tour  de  l'  américaine  Deckers  Outdoor  ,  propriétaire  notamment  de  la  populaire  marque  de  bottes  fourrées  en  peau  de  mouton Ugg  ,  d'  envisager  de  se  mettre  en  vente  ,  a-t-elle  annoncé  mardi  .",ugg,nam,ugg,mouton,mouton,NOUN,de,de,ADP,peau,peau,NOUN,en,en,ADP,fourrées,fourrer,VERB,",",",",PUNCT,d',de,ADP,envisager,envisager,VERB,de,de,ADP,se,se,PRON,2017-04-26,2017,2010,ADP NOUN Ugg PUNCT ADP,NOUN Ugg PUNCT,ADP NOUN Ugg,NOUN ADP NOUN Ugg,ADP NOUN ADP NOUN Ugg,Ugg PUNCT ADP,Ugg PUNCT ADP VERB,Ugg PUNCT ADP VERB ADP,"de mouton Ugg , de","mouton Ugg ,",de mouton Ugg,peau de mouton Ugg,en peau de mouton Ugg,"Ugg , de","Ugg , de envisager","Ugg , de envisager de"
http://www.lecho.be/entreprises/textile/Les-bottes-Ugg-bientot-en-vente/9887140?ckc=1&ts=1493193796,lecho.be,2017-04-26,Belgium,Ugg/NAM/Ugg,"L'  entreprise  tire  l'  essentiel  de  ses  revenus  de  sa  marque  vedette Ugg  (  -  5,3  %  à  704  millions  de  dollars  au  troisième  trimestre  )  qui  ,  à  côté  de  ses  célèbres  bottes  ,  propose  aussi  des  chaussons  ,  mocassins  ,  sandales  ainsi  qu'  une  gamme  de  vêtements  et  d'  accessoires  .",ugg,nam,ugg,vedette,vedette,NOUN,marque,marque,NOUN,sa,son,DET,de,de,ADP,revenus,revenu,NOUN,(,(,PUNCT,-,-,PUNCT,"5,3",@card@,ADJ,%,%,SYM,à,à,ADP,2017-04-26,2017,2010,NOUN NOUN Ugg PUNCT PUNCT,NOUN Ugg PUNCT,NOUN NOUN Ugg,DET NOUN NOUN Ugg,ADP DET NOUN NOUN Ugg,Ugg PUNCT PUNCT,Ugg PUNCT PUNCT ADJ,Ugg PUNCT PUNCT ADJ SYM,marque vedette Ugg ( -,vedette Ugg (,marque vedette Ugg,son marque vedette Ugg,de son marque vedette Ugg,Ugg ( -,Ugg ( - @card@,Ugg ( - @card@ %
http://www.madmoizelle.com/vide-dressing-juin-2017-770481,madmoizelle.com,2017-05-10,===NONE===,UGG/NAM/UGG,"Parmi  les  marques  qu'  elles  proposeront  :  Zara  ,  Mango  ,  Forever  21  ,  Kookai  ,  Maje  ,  Sandro  ,  Naf  Naf  ,  Etam  ,  Uniqlo  ,  Asos  ,  Vivienne  Westwood  ,  Urban  Outfitters  ,  Abercrombie  &  Fitch  ,  Comptoir  des  Cotonniers  ,  Doc  Martens  ,  Petit  Bateau  ,  American  Apparel  ,  Levi  '  s  ,  Nike  ,  New  Look  ,  H  &  M  ,  IKKS  ,  Modcloth  ,  Gucci  , UGG  ,  The  Kooples  ,  Hollister  ,  Pull  and  Bear  ,  Converse  mais  aussi  du  fait  main  et  des  vêtements  vintage  .",ugg,nam,ugg,",",",",PUNCT,Gucci,Gucci,PROPN,",",",",PUNCT,Modcloth,Modcloth,PROPN,",",",",PUNCT,",",",",PUNCT,The,The,PROPN,Kooples,Kooples,PROPN,",",",",PUNCT,Hollister,Hollister,PROPN,2017-05-10,2017,2010,PROPN PUNCT Ugg PUNCT PROPN,PUNCT Ugg PUNCT,PROPN PUNCT Ugg,PUNCT PROPN PUNCT Ugg,PROPN PUNCT PROPN PUNCT Ugg,Ugg PUNCT PROPN,Ugg PUNCT PROPN PROPN,Ugg PUNCT PROPN PROPN PUNCT,"Gucci , Ugg , The",", Ugg ,","Gucci , Ugg",", Gucci , Ugg","Modcloth , Gucci , Ugg","Ugg , The","Ugg , The Kooples","Ugg , The Kooples ,"
http://www.journaldesfemmes.com/mode/shopping-mode/1845478-claquettes-piscine-mules-printemps-ete-2017-selection/,journaldesfemmes.com,2017-05-18,===NONE===,UGG/NAM/UGG,"Une  matière  qu'  ont  aussi  adopté  Jonak  et UGG  ,  inévitablement  .",ugg,nam,ugg,et,et,CONJ,Jonak,Jonak,PROPN,adopté,adopter,VERB,aussi,aussi,ADV,ont,avoir,VERB,",",",",PUNCT,inévitablement,inévitablement,ADV,.,.,PUNCT,,,,,,,2017-05-18,2017,2010,PROPN CONJ Ugg PUNCT ADV,CONJ Ugg PUNCT,PROPN CONJ Ugg,VERB PROPN CONJ Ugg,ADV VERB PROPN CONJ Ugg,Ugg PUNCT ADV,Ugg PUNCT ADV PUNCT,,"Jonak et Ugg , inévitablement","et Ugg ,",Jonak et Ugg,adopter Jonak et Ugg,aussi adopter Jonak et Ugg,"Ugg , inévitablement","Ugg , inévitablement .",
http://www.zonebourse.com/actualite-bourse/Apres-une-serie-de-hausses-Wall-Street-marque-le-pas-a-l-ouverture--24496890/,zonebourse.com,2017-05-26,===NONE===,Ugg/NAM/Ugg,"La  marque  de  chaussures  Deckers  Outdoor  ,  fabriquant  notamment  des  bottes Ugg  ,  s'  envolait  de  17,39  %  à  66,41  dollars  après  avoir  annoncé  un  bénéfice  net  par  action  au  dernier  trimestre  ,  la  référence  à  Wall  Street  ,  alors  que  les  analystes  s'  attendaient  à  des  pertes  .",ugg,nam,ugg,bottes,botte,NOUN,des,du,ADP DET,notamment,notamment,ADV,fabriquant,fabriquer,VERB,",",",",PUNCT,",",",",PUNCT,s',se,PRON,envolait,envoler,VERB,de,de,ADP,"17,39",@card@,ADJ,2017-05-26,2017,2010,ADP DET NOUN Ugg PUNCT PRON,NOUN Ugg PUNCT,ADP DET NOUN Ugg,ADV ADP DET NOUN Ugg,VERB ADV ADP DET NOUN Ugg,Ugg PUNCT PRON,Ugg PUNCT PRON VERB,Ugg PUNCT PRON VERB ADP,"du botte Ugg , se","botte Ugg ,",du botte Ugg,notamment du botte Ugg,fabriquer notamment du botte Ugg,"Ugg , se","Ugg , se envoler","Ugg , se envoler de"
http://www.leparisien.fr/economie/business/hoka-la-chaussure-tricolore-qui-monte-03-07-2017-7105632.php#xtor%3DRSS-1481423633,leparisien.fr,2017-07-03,France,Ugg/NAM/Ugg,"Entre-temps  ,  faute  d'  avoir  trouvé  des  financements  suffisants  dans  l'  Hexagone  pour  accompagner  son  développement  fulgurant  ,  la  marque  tricolore  s'  est  fait  aspirer  par  l'  américain  Deckers  ( Ugg  )  ,  plutôt  spécialiste  des  chaussures  de  ville  .",ugg,nam,ugg,(,(,PUNCT,Deckers,Deckers,PROPN,américain,américain,ADJ,l',le,DET,par,par,ADP,),),PUNCT,",",",",PUNCT,plutôt,plutôt,ADV,spécialiste,spécialiste,NOUN,des,du,ADP DET,2017-07-03,2017,2010,PROPN PUNCT Ugg PUNCT PUNCT,PUNCT Ugg PUNCT,PROPN PUNCT Ugg,ADJ PROPN PUNCT Ugg,DET ADJ PROPN PUNCT Ugg,Ugg PUNCT PUNCT,Ugg PUNCT PUNCT ADV,Ugg PUNCT PUNCT ADV NOUN,"Deckers ( Ugg ) ,",( Ugg ),Deckers ( Ugg,américain Deckers ( Ugg,le américain Deckers ( Ugg,"Ugg ) ,","Ugg ) , plutôt","Ugg ) , plutôt spécialiste"
http://www.ladepeche.fr/article/2017/07/07/2608635-semaine-paris-haute-couture-les-bottes-d-exception.html,ladepeche.fr,2017-07-07,France,UGG/NAM/UGG,Les  bottines  à  fourrure  façon UGG  sont  de  retour  chez  Alexandre  Vauthier  et  Jean  Paul  Gaultier  .,ugg,nam,ugg,façon,façon,NOUN,fourrure,fourrure,NOUN,à,à,ADP,bottines,bottine,NOUN,Les,le,DET,sont,être,VERB,de,de,ADP,retour,retour,NOUN,chez,chez,ADP,Alexandre,Alexandre,PROPN,2017-07-07,2017,2010,NOUN NOUN Ugg VERB ADP,NOUN Ugg VERB,NOUN NOUN Ugg,ADP NOUN NOUN Ugg,NOUN ADP NOUN NOUN Ugg,Ugg VERB ADP,Ugg VERB ADP NOUN,Ugg VERB ADP NOUN ADP,fourrure façon Ugg être de,façon Ugg être,fourrure façon Ugg,à fourrure façon Ugg,bottine à fourrure façon Ugg,Ugg être de,Ugg être de retour,Ugg être de retour chez
http://www.ledauphine.com/haute-savoie/2017/09/04/hoka-one-one-s-envole-vers-les-sommets,ledauphine.com,2017-09-05,===NONE===,UGG/NAM/UGG,"Groupe  américain  (  qui  détient  les  marques UGG  ,  Teva  ,  Sanuk  )  ,  propriétaire  de  Hoka  depuis  2013  .",ugg,nam,ugg,marques,marque,NOUN,les,le,DET,détient,détenir,VERB,qui,qui,PRON,(,(,PUNCT,",",",",PUNCT,Teva,Teva,PROPN,",",",",PUNCT,Sanuk,Sanuk,PROPN,),),PUNCT,2017-09-05,2017,2010,DET NOUN Ugg PUNCT PROPN,NOUN Ugg PUNCT,DET NOUN Ugg,VERB DET NOUN Ugg,PRON VERB DET NOUN Ugg,Ugg PUNCT PROPN,Ugg PUNCT PROPN PUNCT,Ugg PUNCT PROPN PUNCT PROPN,"le marque Ugg , Teva","marque Ugg ,",le marque Ugg,détenir le marque Ugg,qui détenir le marque Ugg,"Ugg , Teva","Ugg , Teva ,","Ugg , Teva , Sanuk"
http://www.ledauphine.com/haute-savoie/2017/09/04/hoka-one-one-s-envole-vers-les-sommets,ledauphine.com,2017-09-05,===NONE===,UGG/NAM/UGG,"Aujourd  '  hui  ,  Hoka  est  la  2  e  marque  du  groupe  ,  juste  derrière UGG  ""  ,  sourit  Jean-Luc  Diard  .",ugg,nam,ugg,derrière,derrière,ADP,juste,juste,ADJ,",",",",PUNCT,groupe,groupe,NOUN,du,du,ADP DET,"""","""",PUNCT,",",",",PUNCT,sourit,sourire,VERB,Jean-Luc,Jean-Luc,PROPN,Diard,Diard,PROPN,2017-09-05,2017,2010,ADJ ADP Ugg PUNCT PUNCT,ADP Ugg PUNCT,ADJ ADP Ugg,PUNCT ADJ ADP Ugg,NOUN PUNCT ADJ ADP Ugg,Ugg PUNCT PUNCT,Ugg PUNCT PUNCT VERB,Ugg PUNCT PUNCT VERB PROPN,"juste derrière Ugg "" ,","derrière Ugg """,juste derrière Ugg,", juste derrière Ugg","groupe , juste derrière Ugg","Ugg "" ,","Ugg "" , sourire","Ugg "" , sourire Jean-Luc"
http://www.lemonde.fr/m-le-mag/article/2017/10/29/pour-ses-ugg-l-australie-deterre-la-hache-de-guerre_5207422_4500055.html,lemonde.fr,2017-10-29,France,Ugg/NAM/Ugg,"<doc uri=http://www.lemonde.fr/m-le-mag/article/2017/10/29/pour-ses-ugg-l-australie-deterre-la-hache-de-guerre_5207422_4500055.html website=lemonde.fr date=2017-10-29 source_country=France> /pour/PRP /son/DET:POS Ugg  ,  l'  Australie  déterre  la  hache  de  guerre",ugg,nam,ugg,ses,son,DET,Pour,pour,ADP,,,,,,,,,,",",",",PUNCT,l',le,DET,Australie,Australie,PROPN,déterre,déterrer,VERB,la,le,DET,2017-10-29,2017,2010,ADP DET Ugg PUNCT DET,DET Ugg PUNCT,ADP DET Ugg,,,Ugg PUNCT DET,Ugg PUNCT DET PROPN,Ugg PUNCT DET PROPN VERB,"pour son Ugg , le","son Ugg ,",pour son Ugg,,,"Ugg , le","Ugg , le Australie","Ugg , le Australie déterrer"
http://www.lemonde.fr/m-le-mag/article/2017/10/29/pour-ses-ugg-l-australie-deterre-la-hache-de-guerre_5207422_4500055.html,lemonde.fr,2017-10-29,France,Ugg/NAM/Ugg,"Depuis  qu'  une  firme  californienne  a  déposé  le  nom  "" Ugg  ""  en  1999  ,  les  fabricants  australiens  de  bottes  en  peau  de  mouton  ont  vu  le  marché  international  leur  échapper  .",ugg,nam,ugg,"""","""",PUNCT,nom,nom,NOUN,le,le,DET,déposé,déposer,VERB,a,avoir,VERB,"""","""",PUNCT,en,en,ADP,1999,@card@,ADJ,",",",",PUNCT,les,le,DET,2017-10-29,2017,2010,NOUN PUNCT Ugg PUNCT ADP,PUNCT Ugg PUNCT,NOUN PUNCT Ugg,DET NOUN PUNCT Ugg,VERB DET NOUN PUNCT Ugg,Ugg PUNCT ADP,Ugg PUNCT ADP ADJ,Ugg PUNCT ADP ADJ PUNCT,"nom "" Ugg "" en",""" Ugg ""","nom "" Ugg","le nom "" Ugg","déposer le nom "" Ugg","Ugg "" en","Ugg "" en @card@","Ugg "" en @card@ ,"
http://www.lemonde.fr/m-le-mag/article/2017/10/29/pour-ses-ugg-l-australie-deterre-la-hache-de-guerre_5207422_4500055.html,lemonde.fr,2017-10-29,France,Ugg/NAM/Ugg,"Mauve  pour  les  petites  filles  ,  marron  et  fourrées  en  laine  pour  les  puristes  ,  en  synthétique  pour  les  moins  fortunés  ,  les Ugg  sont  si  emblématiques  de  l'  Australie  que  ,  sous  une  multitude  de  déclinaisons  ,  elles  encombrent  les  étalages  de  tout  bon  magasin  de  souvenirs  à  Sydney  .",ugg,nam,ugg,les,le,DET,",",",",PUNCT,fortunés,fortuné,ADJ,moins,moins,ADV,les,le,DET,sont,être,VERB,si,si,ADV,emblématiques,emblématique,ADJ,de,de,ADP,l',le,DET,2017-10-29,2017,2010,PUNCT DET Ugg VERB ADV,DET Ugg VERB,PUNCT DET Ugg,ADJ PUNCT DET Ugg,ADV ADJ PUNCT DET Ugg,Ugg VERB ADV,Ugg VERB ADV ADJ,Ugg VERB ADV ADJ ADP,", le Ugg être si",le Ugg être,", le Ugg","fortuné , le Ugg","moins fortuné , le Ugg",Ugg être si,Ugg être si emblématique,Ugg être si emblématique de
http://www.lemonde.fr/m-le-mag/article/2017/10/29/pour-ses-ugg-l-australie-deterre-la-hache-de-guerre_5207422_4500055.html,lemonde.fr,2017-10-29,France,Ugg/NAM/Ugg,"A  partir  de  1999  ,  la  firme  a  déposé  le  nom  de  la  marque Ugg  dans  plus  d'  une  centaine  de  pays  .",ugg,nam,ugg,marque,marque,NOUN,la,le,DET,de,de,ADP,nom,nom,NOUN,le,le,DET,dans,dans,ADP,plus,plus,ADV,d',de,ADP,une,un,DET,centaine,centaine,NOUN,2017-10-29,2017,2010,DET NOUN Ugg ADP ADV,NOUN Ugg ADP,DET NOUN Ugg,ADP DET NOUN Ugg,NOUN ADP DET NOUN Ugg,Ugg ADP ADV,Ugg ADP ADV ADP,Ugg ADP ADV ADP DET,le marque Ugg dans plus,marque Ugg dans,le marque Ugg,de le marque Ugg,nom de le marque Ugg,Ugg dans plus,Ugg dans plus de,Ugg dans plus de un
