url,website,date,country,keyword,sentence,kw,kw_lemma,kw_pos,left_w1,left_l1,left_p1,left_w2,left_l2,left_p2,left_w3,left_l3,left_p3,left_w4,left_l4,left_p4,left_w5,left_l5,left_p5,right_w1,right_l1,right_p1,right_w2,right_l2,right_p2,right_w3,right_l3,right_p3,right_w4,right_l4,right_p4,right_w5,right_l5,right_p5,datetime,year,10years,pattern_around5,pattern_around3,pattern_left2,pattern_left3,pattern_left4,pattern_right2,pattern_right3,pattern_right4,pattern_around5_lex,pattern_around3_lex,pattern_left2_lex,pattern_left3_lex,pattern_left4_lex,pattern_right2_lex,pattern_right3_lex,pattern_right4_lex
http://www.femmeactuelle.fr/sante/sante-pratique/maux-de-gorge-causes-maladies-33560,femmeactuelle.fr,2016-10-27,France,Mercurochrome/NAM/Mercurochrome,"""  (  Spray  nasal  hypertonique  à  l'  eau  de  mer Mercurochrome  ou  Humer  ,  Sérum  Stérimar  ,  Spray  nasal  phytaroma  de  Naturactive  qui  combine  sel  marin  et  huiles  essentielles  )  .",mercurochrome,nam,mercurochrome,mer,mer,NOUN,de,de,ADP,eau,eau,NOUN,l',le,DET,à,à,ADP,ou,ou,CONJ,Humer,Humer,PROPN,",",",",PUNCT,Sérum,Sérum,PROPN,Stérimar,Stérimar,PROPN,2016-10-27,2016,2010,ADP NOUN Mercurochrome CONJ PROPN,NOUN Mercurochrome CONJ,ADP NOUN Mercurochrome,NOUN ADP NOUN Mercurochrome,DET NOUN ADP NOUN Mercurochrome,Mercurochrome CONJ PROPN,Mercurochrome CONJ PROPN PUNCT,Mercurochrome CONJ PROPN PUNCT PROPN,de mer Mercurochrome ou Humer,mer Mercurochrome ou,de mer Mercurochrome,eau de mer Mercurochrome,le eau de mer Mercurochrome,Mercurochrome ou Humer,"Mercurochrome ou Humer ,","Mercurochrome ou Humer , Sérum"
http://www.femmeactuelle.fr/sante/sante-pratique/maux-de-gorge-causes-maladies-33560,femmeactuelle.fr,2016-10-27,France,Mercurochrome/NAM/Mercurochrome,"En  version  nomade  pour  le  bureau  :  Capsules  gorge  à  avaler  aux  HE  de  thym  et  d'  eucalyptus  de Mercurochrome  ,  Spray  Gorge  Activox  combinant  érysimum  ,  matricaire  ,  thym  et  propolis  de  Arkopharma  .",mercurochrome,nam,mercurochrome,de,de,ADP,eucalyptus,eucalyptus,NOUN,d',de,ADP,et,et,CONJ,thym,thym,NOUN,",",",",PUNCT,Spray,Spray,PROPN,Gorge,Gorge,PROPN,Activox,Activox,PROPN,combinant,combiner,VERB,2016-10-27,2016,2010,NOUN ADP Mercurochrome PUNCT PROPN,ADP Mercurochrome PUNCT,NOUN ADP Mercurochrome,ADP NOUN ADP Mercurochrome,CONJ ADP NOUN ADP Mercurochrome,Mercurochrome PUNCT PROPN,Mercurochrome PUNCT PROPN PROPN,Mercurochrome PUNCT PROPN PROPN PROPN,"eucalyptus de Mercurochrome , Spray","de Mercurochrome ,",eucalyptus de Mercurochrome,de eucalyptus de Mercurochrome,et de eucalyptus de Mercurochrome,"Mercurochrome , Spray","Mercurochrome , Spray Gorge","Mercurochrome , Spray Gorge Activox"
http://next.liberation.fr/food/2016/11/02/marc-veyrat-couvre-chef_1525731?xtor=rss-450,liberation.fr,2016-11-03,France,mercurochrome/NOM/mercurochrome,"A  côté  des  emmerdes  qu'  il  a  connues  ,  les  dix  plaies  d'  Egypte  sont  comme  une  collection  reliée  de  Nous  Deux  imprimé  avec  du mercurochrome  .",mercurochrome,nom,mercurochrome,du,du,ADP DET,avec,avec,ADP,imprimé,imprimer,VERB,Deux,Deux,VER:subi,Nous,nous,PRON,.,.,PUNCT,,,,,,,,,,,,,2016-11-03,2016,2010,,ADP DET Mercurochrome PUNCT,ADP ADP DET Mercurochrome,VERB ADP ADP DET Mercurochrome,VER:subi VERB ADP ADP DET Mercurochrome,,,,,du Mercurochrome .,avec du Mercurochrome,imprimer avec du Mercurochrome,Deux imprimer avec du Mercurochrome,,,
http://www.corsematin.com/article/musique/marillion-les-derniers-rois.2085000.html,corsematin.com,2016-11-11,France,Mercurochrome/NOM/mercurochrome,"Dans  un  monde  de  la  musique  où  le  marché  du  disque  tente  de  survivre  comme  il  peut  et  où  les  rééditions  des  grands  classiques  sont  autant  de  couches  de Mercurochrome  sur  jambe  de  bois  ,  la  persévérance  et  l'  inspiration  de  Marillion  sont  admirables  .",mercurochrome,nom,mercurochrome,de,de,ADP,couches,couche,NOUN,de,de,ADP,autant,autant,ADV,sont,être,VERB,sur,sur,ADP,jambe,jambe,NOUN,de,de,ADP,bois,bois,NOUN,",",",",PUNCT,2016-11-11,2016,2010,NOUN ADP Mercurochrome ADP NOUN,ADP Mercurochrome ADP,NOUN ADP Mercurochrome,ADP NOUN ADP Mercurochrome,ADV ADP NOUN ADP Mercurochrome,Mercurochrome ADP NOUN,Mercurochrome ADP NOUN ADP,Mercurochrome ADP NOUN ADP NOUN,couche de Mercurochrome sur jambe,de Mercurochrome sur,couche de Mercurochrome,de couche de Mercurochrome,autant de couche de Mercurochrome,Mercurochrome sur jambe,Mercurochrome sur jambe de,Mercurochrome sur jambe de bois
http://quebec.huffingtonpost.ca/2016/11/11/martin-michaud-lessard-roman-entrevue-_n_12912142.html?utm_hp_ref=canada-quebec&ir=Canada%2BQuebec,huffingtonpost.ca,2016-11-11,Canada,mercurochrome/NOM/mercurochrome,"Les  deux  premiers  tiers  du  livre  sont  réservés  à  L'  effet  placebo  ,  un  roman  qui  catapulte  les  lecteurs  à  Cploêbá  ,  là  où  on  boit  du mercurochrome  ,  où  les  chaussures  prennent  le  large  quand  on  les  détache  ,  où  le  frik  est  l'  unité  monétaire  locale  ,  où  l'  on  annonce  des  logements  pour  oiseaux  et  où  l'  on  peut  s'  envoler  ,  réellement  ,  pour  le  bout  du  monde  .",mercurochrome,nom,mercurochrome,du,du,ADP DET,boit,boire,VERB,on,on,PRON,où,où,PRON,là,là,ADV,",",",",PUNCT,où,où,PRON,les,le,DET,chaussures,chaussure,NOUN,prennent,prendre,VERB,2016-11-11,2016,2010,VERB ADP DET Mercurochrome PUNCT PRON,ADP DET Mercurochrome PUNCT,VERB ADP DET Mercurochrome,PRON VERB ADP DET Mercurochrome,PRON PRON VERB ADP DET Mercurochrome,Mercurochrome PUNCT PRON,Mercurochrome PUNCT PRON DET,Mercurochrome PUNCT PRON DET NOUN,"boire du Mercurochrome , où","du Mercurochrome ,",boire du Mercurochrome,on boire du Mercurochrome,où on boire du Mercurochrome,"Mercurochrome , où","Mercurochrome , où le","Mercurochrome , où le chaussure"
http://www.elwatan.com/hebdo/sante/les-specialistes-denoncent-le-recours-abusif-a-l-amputation-14-11-2016-332867_156.php,elwatan.com,2016-11-14,Algeria,mercurochrome/NOM/mercurochrome,"Il  recommande  en  outre  l'  usage  de  certains  antiseptiques  tels  que  l'  eau  de  Dakin  ,  la  bétadine  ,  l'  eau  oxygénée  et  le mercurochrome  .",mercurochrome,nom,mercurochrome,le,le,DET,et,et,CONJ,oxygénée,oxygéner,VERB,eau,eau,NOUN,l',le,DET,.,.,PUNCT,,,,,,,,,,,,,2016-11-14,2016,2010,,DET Mercurochrome PUNCT,CONJ DET Mercurochrome,VERB CONJ DET Mercurochrome,NOUN VERB CONJ DET Mercurochrome,,,,,le Mercurochrome .,et le Mercurochrome,oxygéner et le Mercurochrome,eau oxygéner et le Mercurochrome,,,
http://www.lesinrocks.com/2016/12/27/medias/decryptage-de-maitre-gims-a-melenchon-mister-jday-11895639/,lesinrocks.com,2016-12-27,===NONE===,Mercurochrome/ADJ/Mercurochrome,"En  creusant  le  concept  d'  impact  mémoriel  (  souvenez-vous  du  slogan  réitéré  ad  lib  dans  la  pub Mercurochrome  )  ,  le  vidéaste-citoyen  invite  son  public  à  prendre  du  recul  face  à  la  boîte  à  images  .",mercurochrome,adj,mercurochrome,pub,pub,NOUN,la,le,DET,dans,dans,ADP,lib,lib,NOUN,ad,ad,ADV,),),PUNCT,",",",",PUNCT,le,le,DET,vidéaste-citoyen,vidéaste-citoyen,NOUN,invite,inviter,VERB,2016-12-27,2016,2010,DET NOUN Mercurochrome PUNCT PUNCT,NOUN Mercurochrome PUNCT,DET NOUN Mercurochrome,ADP DET NOUN Mercurochrome,NOUN ADP DET NOUN Mercurochrome,Mercurochrome PUNCT PUNCT,Mercurochrome PUNCT PUNCT DET,Mercurochrome PUNCT PUNCT DET NOUN,"le pub Mercurochrome ) ,",pub Mercurochrome ),le pub Mercurochrome,dans le pub Mercurochrome,lib dans le pub Mercurochrome,"Mercurochrome ) ,","Mercurochrome ) , le","Mercurochrome ) , le vidéaste-citoyen"
http://next.liberation.fr/arts/2017/01/01/galerie-de-fantasmes-pour-galeres-de-famille_1538478?xtor=rss-450,liberation.fr,2017-01-02,France,mercurochrome/NOM/mercurochrome,"Des  tableaux  au  fond  rose  chair  à  la  surface  tamponnée  de mercurochrome  ,  sur  laquelle  glissent  des  protagonistes  flous  et  instables  ,  incapables  de  s'  entendre  entre  eux  et  de  faire  corps  .",mercurochrome,nom,mercurochrome,de,de,ADP,tamponnée,tamponner,VERB,surface,surface,NOUN,la,le,DET,à,à,ADP,",",",",PUNCT,sur,sur,ADP,laquelle,lequel,PRON,glissent,glisser,VERB,des,du,ADP DET,2017-01-02,2017,2010,VERB ADP Mercurochrome PUNCT ADP,ADP Mercurochrome PUNCT,VERB ADP Mercurochrome,NOUN VERB ADP Mercurochrome,DET NOUN VERB ADP Mercurochrome,Mercurochrome PUNCT ADP,Mercurochrome PUNCT ADP PRON,Mercurochrome PUNCT ADP PRON VERB,"tamponner de Mercurochrome , sur","de Mercurochrome ,",tamponner de Mercurochrome,surface tamponner de Mercurochrome,le surface tamponner de Mercurochrome,"Mercurochrome , sur","Mercurochrome , sur lequel","Mercurochrome , sur lequel glisser"
http://www.20minutes.fr/mode/1997531-20170118-vague-froid-comment-cold-cream-va-sauver-peau#xtor%3DRSS-149,20minutes.fr,2017-01-18,France,Mercurochrome/NAM/Mercurochrome,"Ce  pansement  liquide  ne  prend  pas  de  gants  avec  les  crevasses  :  il  protège  et  soulage  ces  plaies  superficielles  :  Pansement  Liquide  Crevasses Mercurochrome  ,  7,99  euros  . </doc>",mercurochrome,nam,mercurochrome,Crevasses,Crevasses,PROPN,Liquide,Liquide,PROPN,Pansement,pansement,NOUN,:,:,PUNCT,superficielles,superficiel,ADJ,",",",",PUNCT,"7,99",@card@,ADJ,euros,euro,NOUN,.,.,PUNCT,</doc>,,,2017-01-18,2017,2010,PROPN PROPN Mercurochrome PUNCT ADJ,PROPN Mercurochrome PUNCT,PROPN PROPN Mercurochrome,NOUN PROPN PROPN Mercurochrome,PUNCT NOUN PROPN PROPN Mercurochrome,Mercurochrome PUNCT ADJ,Mercurochrome PUNCT ADJ NOUN,Mercurochrome PUNCT ADJ NOUN PUNCT,"Liquide Crevasses Mercurochrome , @card@","Crevasses Mercurochrome ,",Liquide Crevasses Mercurochrome,pansement Liquide Crevasses Mercurochrome,: pansement Liquide Crevasses Mercurochrome,"Mercurochrome , @card@","Mercurochrome , @card@ euro","Mercurochrome , @card@ euro ."
http://www.laliberte.ch/news/chroniques/la-der-la-chronique/le-temps-et-l-odeur-du-mercurochrome--377280,laliberte.ch,2017-01-19,Switzerland,Mercurochrome/NAM/Mercurochrome,<doc uri=http://www.laliberte.ch/news/chroniques/la-der-la-chronique/le-temps-et-l-odeur-du-mercurochrome--377280 website=laliberte.ch date=2017-01-19 source_country=Switzerland> /le/DET:ART /temps/NOM /et/KON /le/DET:ART /odeur/NOM /du/PRP:det Mercurochrome ,mercurochrome,nam,mercurochrome,du,du,ADP DET,odeur,odeur,NOUN,l',le,DET,et,et,CONJ,temps,temps,NOUN,,,,,,,,,,,,,,,,2017-01-19,2017,2010,,,NOUN ADP DET Mercurochrome,DET NOUN ADP DET Mercurochrome,CONJ DET NOUN ADP DET Mercurochrome,,,,,,odeur du Mercurochrome,le odeur du Mercurochrome,et le odeur du Mercurochrome,,,
http://www.laliberte.ch/news/chroniques/la-der-la-chronique/le-temps-et-l-odeur-du-mercurochrome--377280,laliberte.ch,2017-01-19,Switzerland,Mercurochrome/NAM/Mercurochrome,"L'  enfance  a  ce  petit  goût  d'  édulcorant  ,  et  l'  odeur  du Mercurochrome  .",mercurochrome,nam,mercurochrome,du,du,ADP DET,odeur,odeur,NOUN,l',le,DET,et,et,CONJ,",",",",PUNCT,.,.,PUNCT,,,,,,,,,,,,,2017-01-19,2017,2010,,ADP DET Mercurochrome PUNCT,NOUN ADP DET Mercurochrome,DET NOUN ADP DET Mercurochrome,CONJ DET NOUN ADP DET Mercurochrome,,,,,du Mercurochrome .,odeur du Mercurochrome,le odeur du Mercurochrome,et le odeur du Mercurochrome,,,
http://www.lecalame.info/?q=node%2F5062,lecalame.info,2017-01-26,===NONE===,mercurochrome/NOM/mercurochrome,"La  première  ordonnance  tombe  pour  chacun  :  collier  cervical  et  des  gants  pour  l'  un  ;  du  sparadrap  , mercurochrome  et  coton  pour  l'  autre  ;  puis  avalanche  d'  examens  :  radio  ,  scanner  ,  échographie  et  autres  pour  les  deux  .",mercurochrome,nom,mercurochrome,",",",",PUNCT,sparadrap,sparadrap,NOUN,du,du,ADP DET,;,;,PUNCT,un,un,NOUN,et,et,CONJ,coton,coton,NOUN,pour,pour,ADP,l',le,DET,autre,autre,ADJ,2017-01-26,2017,2010,NOUN PUNCT Mercurochrome CONJ NOUN,PUNCT Mercurochrome CONJ,NOUN PUNCT Mercurochrome,ADP DET NOUN PUNCT Mercurochrome,PUNCT ADP DET NOUN PUNCT Mercurochrome,Mercurochrome CONJ NOUN,Mercurochrome CONJ NOUN ADP,Mercurochrome CONJ NOUN ADP DET,"sparadrap , Mercurochrome et coton",", Mercurochrome et","sparadrap , Mercurochrome","du sparadrap , Mercurochrome","; du sparadrap , Mercurochrome",Mercurochrome et coton,Mercurochrome et coton pour,Mercurochrome et coton pour le
http://www.camer.be/57689/27%3A30/cameroun-le-pouvoir-rampant-de-yaounde-naura-le-dessus-ni-sur-les-regions-anglophones-ni-sur-le-reste-du-pays-cameroon.html,camer.be,2017-01-29,Belgium,mercurochromes/NOM/mercurochrome,"Au  pays  du  dirigeant  amnésique  Paul  Biya  ,  les  plaies  sociopolitiques  sont  nombreuses  ,  profondes  ,  fétides  ,  désagréables  et  insupportables  ,  et  il  faut  admettre  qu'  elles  ne  sont  plus  faites  pour  les mercurochromes  auxquels  l'  on  nous  a  habitués  .",mercurochromes,nom,mercurochrome,les,le,DET,pour,pour,ADP,faites,faire,VERB,plus,plus,ADV,sont,être,VERB,auxquels,auquel,PRON,l',le,DET,on,on,PRON,nous,nous,PRON,a,avoir,VERB,2017-01-29,2017,2010,ADP DET Mercurochrome PRON DET,DET Mercurochrome PRON,ADP DET Mercurochrome,VERB ADP DET Mercurochrome,ADV VERB ADP DET Mercurochrome,Mercurochrome PRON DET,Mercurochrome PRON DET PRON,Mercurochrome PRON DET PRON PRON,pour le Mercurochrome auquel le,le Mercurochrome auquel,pour le Mercurochrome,faire pour le Mercurochrome,plus faire pour le Mercurochrome,Mercurochrome auquel le,Mercurochrome auquel le on,Mercurochrome auquel le on nous
http://www.sofoot.com/emery-est-inquiet-pour-pastore-438505.html,sofoot.com,2017-02-07,France,mercurochrome/NOM/mercurochrome,"Et  parmi  les  abonnés  au mercurochrome  et  au  sparadrap  ,  il  y  a  en  a  un  qui  inquiète  tout  particulièrement  la  petite  galaxie  du  Paris  Saint-Germain  ,  c'  est  Javier  Pastore  .",mercurochrome,nom,mercurochrome,au,au,ADP DET,abonnés,abonné,NOUN,les,le,DET,parmi,parmi,ADP,Et,et,CONJ,et,et,CONJ,au,au,ADP DET,sparadrap,sparadrap,NOUN,",",",",PUNCT,il,il,PRON,2017-02-07,2017,2010,NOUN ADP DET Mercurochrome CONJ ADP DET,ADP DET Mercurochrome CONJ,NOUN ADP DET Mercurochrome,DET NOUN ADP DET Mercurochrome,ADP DET NOUN ADP DET Mercurochrome,Mercurochrome CONJ ADP DET,Mercurochrome CONJ ADP DET NOUN,Mercurochrome CONJ ADP DET NOUN PUNCT,abonné au Mercurochrome et au,au Mercurochrome et,abonné au Mercurochrome,le abonné au Mercurochrome,parmi le abonné au Mercurochrome,Mercurochrome et au,Mercurochrome et au sparadrap,"Mercurochrome et au sparadrap ,"
http://www.europe1.fr/emissions/commandeur-news/le-patron-dagence-dalibi-je-vous-ai-mis-vos-faux-billets-de-train-dans-votre-casier-monsieur-switek-2978579,europe1.fr,2017-02-15,France,mercurochrome/NOM/mercurochrome,"Michel  :  Sotto  !  Je  lui  filé  une  poche  de mercurochrome  ,  qu'  il  fasse  croire  à  sa  femme  qu'  il  s'  est  blessé  en  ouvrant  une  huître  ,  je  vais  faire  semblant  de  l'  emmener  à  l'  hôpital  ,  dans  un  mini-van  ,  où  il  ne  sera  pas  seul  .",mercurochrome,nom,mercurochrome,de,de,ADP,poche,poche,NOUN,une,un,DET,filé,filer,VERB,lui,lui,PRON,",",",",PUNCT,qu',que,PRON,il,il,PRON,fasse,faire,VERB,croire,croire,VERB,2017-02-15,2017,2010,NOUN ADP Mercurochrome PUNCT PRON,ADP Mercurochrome PUNCT,NOUN ADP Mercurochrome,DET NOUN ADP Mercurochrome,VERB DET NOUN ADP Mercurochrome,Mercurochrome PUNCT PRON,Mercurochrome PUNCT PRON PRON,Mercurochrome PUNCT PRON PRON VERB,"poche de Mercurochrome , que","de Mercurochrome ,",poche de Mercurochrome,un poche de Mercurochrome,filer un poche de Mercurochrome,"Mercurochrome , que","Mercurochrome , que il","Mercurochrome , que il faire"
http://www.lesinrocks.com/2017/03/07/musique/le-premier-album-de-clash-fete-ses-40-ans-ou-quand-le-rock-guitares-pesait-sur-le-monde-11920445/,lesinrocks.com,2017-03-07,===NONE===,Mercurochrome/NOM/mercurochrome,"Avant  écoute  de  ce  disque  qui  attaque  l'  épiderme  ,  prévoir  le Mercurochrome  et  le  vaccin  antitétanique  .",mercurochrome,nom,mercurochrome,le,le,DET,prévoir,prévoir,VERB,",",",",PUNCT,épiderme,épiderme,NOUN,l',le,DET,et,et,CONJ,le,le,DET,vaccin,vaccin,NOUN,antitétanique,antitétanique,ADJ,.,.,PUNCT,2017-03-07,2017,2010,VERB DET Mercurochrome CONJ DET,DET Mercurochrome CONJ,VERB DET Mercurochrome,PUNCT VERB DET Mercurochrome,NOUN PUNCT VERB DET Mercurochrome,Mercurochrome CONJ DET,Mercurochrome CONJ DET NOUN,Mercurochrome CONJ DET NOUN ADJ,prévoir le Mercurochrome et le,le Mercurochrome et,prévoir le Mercurochrome,", prévoir le Mercurochrome","épiderme , prévoir le Mercurochrome",Mercurochrome et le,Mercurochrome et le vaccin,Mercurochrome et le vaccin antitétanique
http://xalimasn.com/bilan-dun-citoyen-inquiet-par-abdoul-moutalib-diouf/,xalimasn.com,2017-03-20,===NONE===,mercurochrome/NOM/mercurochrome,"fonctionnent  toujours  à  l'  aspirine  et  au mercurochrome  ,  le  maintien  de",mercurochrome,nom,mercurochrome,au,au,ADP DET,et,et,CONJ,aspirine,aspirine,NOUN,l',le,DET,à,à,ADP,",",",",PUNCT,le,le,DET,maintien,maintien,NOUN,de,de,ADP,,,,2017-03-20,2017,2010,CONJ ADP DET Mercurochrome PUNCT DET,ADP DET Mercurochrome PUNCT,CONJ ADP DET Mercurochrome,NOUN CONJ ADP DET Mercurochrome,DET NOUN CONJ ADP DET Mercurochrome,Mercurochrome PUNCT DET,Mercurochrome PUNCT DET NOUN,Mercurochrome PUNCT DET NOUN ADP,"et au Mercurochrome , le","au Mercurochrome ,",et au Mercurochrome,aspirine et au Mercurochrome,le aspirine et au Mercurochrome,"Mercurochrome , le","Mercurochrome , le maintien","Mercurochrome , le maintien de"
http://guineenews.org/dr-faya-ce-sont-les-politiques-qui-ont-detruit-et-qui-detruisent-notre-pays-et-nos-reves/,guineenews.org,2017-03-21,===NONE===,mercurochrome/NOM/mercurochrome,"Et  quand  on  a  un  cancer  ,  il  faut  amputer  ,  on  ne  met  pas  du mercurochrome  sur  le  cancer  .",mercurochrome,nom,mercurochrome,du,du,ADP DET,pas,pas,ADV,met,mettre,VERB,ne,ne,ADV,on,on,PRON,sur,sur,ADP,le,le,DET,cancer,cancer,NOUN,.,.,PUNCT,,,,2017-03-21,2017,2010,ADV ADP DET Mercurochrome ADP DET,ADP DET Mercurochrome ADP,ADV ADP DET Mercurochrome,VERB ADV ADP DET Mercurochrome,ADV VERB ADV ADP DET Mercurochrome,Mercurochrome ADP DET,Mercurochrome ADP DET NOUN,Mercurochrome ADP DET NOUN PUNCT,pas du Mercurochrome sur le,du Mercurochrome sur,pas du Mercurochrome,mettre pas du Mercurochrome,ne mettre pas du Mercurochrome,Mercurochrome sur le,Mercurochrome sur le cancer,Mercurochrome sur le cancer .
http://www.rtbf.be/info/medias/detail_l-opposant-russe-navalny-fait-le-buzz-apres-une-attaque-au-colorant-vert?id=9560085,rtbf.be,2017-03-21,Belgium,mercurochrome/NOM/mercurochrome,"Le  juriste  et  blogueur  anticorruption  a  en  fait  été  aspergé  d'  un  antiseptique  de  couleur  verte  ,  ""  zelyonka  ""  ,  l'  équivalent  du mercurochrome  en  Russie  .",mercurochrome,nom,mercurochrome,du,du,ADP DET,équivalent,équivalent,NOUN,l',le,DET,",",",",PUNCT,"""","""",PUNCT,en,en,ADP,Russie,Russie,PROPN,.,.,PUNCT,,,,,,,2017-03-21,2017,2010,NOUN ADP DET Mercurochrome ADP PROPN,ADP DET Mercurochrome ADP,NOUN ADP DET Mercurochrome,DET NOUN ADP DET Mercurochrome,PUNCT DET NOUN ADP DET Mercurochrome,Mercurochrome ADP PROPN,Mercurochrome ADP PROPN PUNCT,,équivalent du Mercurochrome en Russie,du Mercurochrome en,équivalent du Mercurochrome,le équivalent du Mercurochrome,", le équivalent du Mercurochrome",Mercurochrome en Russie,Mercurochrome en Russie .,
http://www.courrierinternational.com/dessin/russie-les-attaques-au-produit-colorant-nouvelle-arme-contre-lopposition,courrierinternational.com,2017-03-21,France,mercurochrome/NOM/mercurochrome,"Les  aggressions  au  moyen  de  cet  antiseptique  ,  l'  équivalent  du mercurochrome  ,  deviennent  de  plus  en  plus  fréquentes  .",mercurochrome,nom,mercurochrome,du,du,ADP DET,équivalent,équivalent,NOUN,l',le,DET,",",",",PUNCT,antiseptique,antiseptique,ADJ,",",",",PUNCT,deviennent,devenir,VERB,de,de,ADP,plus,plus,ADV,en,en,ADP,2017-03-21,2017,2010,NOUN ADP DET Mercurochrome PUNCT VERB,ADP DET Mercurochrome PUNCT,NOUN ADP DET Mercurochrome,DET NOUN ADP DET Mercurochrome,PUNCT DET NOUN ADP DET Mercurochrome,Mercurochrome PUNCT VERB,Mercurochrome PUNCT VERB ADP,Mercurochrome PUNCT VERB ADP ADV,"équivalent du Mercurochrome , devenir","du Mercurochrome ,",équivalent du Mercurochrome,le équivalent du Mercurochrome,", le équivalent du Mercurochrome","Mercurochrome , devenir","Mercurochrome , devenir de","Mercurochrome , devenir de plus"
http://www.melty.fr/les-anges-9-jordan-et-jonathan-insupportables-avec-haneia-elle-decide-de-se-venger-replay-du-22-mars-a596506.html,melty.fr,2017-03-22,France,Mercurochrome/NAM/Mercurochrome,"Plus  habituée  aux  paillettes  qu'  au Mercurochrome  ,  Milla  a  beaucoup  de  mal  a  entrer  dans  le  personnage  .",mercurochrome,nam,mercurochrome,au,au,ADP DET,qu',que,CONJ,paillettes,paillette,NOUN,aux,au,ADP DET,habituée,habituer,VERB,",",",",PUNCT,Milla,Milla,PROPN,a,avoir,VERB,beaucoup,beaucoup,ADV,de,de,ADP,2017-03-22,2017,2010,CONJ ADP DET Mercurochrome PUNCT PROPN,ADP DET Mercurochrome PUNCT,CONJ ADP DET Mercurochrome,NOUN CONJ ADP DET Mercurochrome,ADP DET NOUN CONJ ADP DET Mercurochrome,Mercurochrome PUNCT PROPN,Mercurochrome PUNCT PROPN VERB,Mercurochrome PUNCT PROPN VERB ADV,"que au Mercurochrome , Milla","au Mercurochrome ,",que au Mercurochrome,paillette que au Mercurochrome,au paillette que au Mercurochrome,"Mercurochrome , Milla","Mercurochrome , Milla avoir","Mercurochrome , Milla avoir beaucoup"
http://www.lemondeinformatique.fr/actualites/lire-pour-ameliorer-son-controle-budgetaire-juva-sante-a-travaille-en-mode-low-code-67938.html,lemondeinformatique.fr,2017-04-14,France,Mercurochrome/NAM/Mercurochrome,"Filiale  du  groupe  Urgo  ,  Juva  Santé  est  un  laboratoire  parapharmaceutique  connu  pour  ses  marques  Juvamine  , Mercurochrome  ,  Marie  Rose  et  Intimy  .",mercurochrome,nam,mercurochrome,",",",",PUNCT,Juvamine,Juvamine,PROPN,marques,marque,NOUN,ses,son,DET,pour,pour,ADP,",",",",PUNCT,Marie,Marie,PROPN,Rose,Rose,PROPN,et,et,CONJ,Intimy,Intimy,PROPN,2017-04-14,2017,2010,PROPN PUNCT Mercurochrome PUNCT PROPN,PUNCT Mercurochrome PUNCT,PROPN PUNCT Mercurochrome,NOUN PROPN PUNCT Mercurochrome,DET NOUN PROPN PUNCT Mercurochrome,Mercurochrome PUNCT PROPN,Mercurochrome PUNCT PROPN PROPN,Mercurochrome PUNCT PROPN PROPN CONJ,"Juvamine , Mercurochrome , Marie",", Mercurochrome ,","Juvamine , Mercurochrome","marque Juvamine , Mercurochrome","son marque Juvamine , Mercurochrome","Mercurochrome , Marie","Mercurochrome , Marie Rose","Mercurochrome , Marie Rose et"
http://www.atlantico.fr/decryptage/comment-gauche-social-liberale-est-devenue-idiote-utile-exces-mondialisation-sylvain-boulouque-3032382.html,atlantico.fr,2017-04-28,France,mercurochrome/NOM/mercurochrome,"Mais  ceux-ci  aillant  disparus  ,  la  gauche  ne  propose  plus  que  de  la  gestion  quotidienne  en  se  contentant  de  mettre  du  "" mercurochrome  sur  les  bobos  trop  importants  de  la  mondialisation  ""  .",mercurochrome,nom,mercurochrome,"""","""",PUNCT,du,du,ADP DET,mettre,mettre,VERB,de,de,ADP,contentant,contenter,VERB,sur,sur,ADP,les,le,DET,bobos,bobo,NOUN,trop,trop,ADV,importants,important,ADJ,2017-04-28,2017,2010,ADP DET PUNCT Mercurochrome ADP DET,PUNCT Mercurochrome ADP,ADP DET PUNCT Mercurochrome,VERB ADP DET PUNCT Mercurochrome,ADP VERB ADP DET PUNCT Mercurochrome,Mercurochrome ADP DET,Mercurochrome ADP DET NOUN,Mercurochrome ADP DET NOUN ADV,"du "" Mercurochrome sur le",""" Mercurochrome sur","du "" Mercurochrome","mettre du "" Mercurochrome","de mettre du "" Mercurochrome",Mercurochrome sur le,Mercurochrome sur le bobo,Mercurochrome sur le bobo trop
http://www.cridem.org/C_Info.php?article=697488,cridem.org,2017-05-03,===NONE===,Mercurochrome/ADJ/Mercurochrome,Mon  Père  venait  à  peine  de  terminer  sa  phrase  que  les  mauritaniens  quittaient  déjà  le  sépis  du  gardien  à  l'  entrée  de  Zouerate  et  firent  mouvement  en  traversant  la  cité  par  le  quartier Mercurochrome  et  se  dirigeaient  vers  le  terrain  de  football  .  Je  me  souviens  que  mon  père  nous  fit  rentrer  immédiatement  dans  la  maison  et  qu'  il  y  eut  des  cris  sur  le  passage  des  grévistes  et  des  cailloux  jetés  contre  les  portes  et  fenêtres  de  notre  ESA  et  sur  ceux  des  voisins  .,mercurochrome,adj,mercurochrome,quartier,quartier,NOUN,le,le,DET,par,par,ADP,cité,cité,NOUN,la,le,DET,et,et,CONJ,se,se,PRON,dirigeaient,diriger,VERB,vers,vers,ADP,le,le,DET,2017-05-03,2017,2010,DET NOUN Mercurochrome CONJ PRON,NOUN Mercurochrome CONJ,DET NOUN Mercurochrome,ADP DET NOUN Mercurochrome,NOUN ADP DET NOUN Mercurochrome,Mercurochrome CONJ PRON,Mercurochrome CONJ PRON VERB,Mercurochrome CONJ PRON VERB ADP,le quartier Mercurochrome et se,quartier Mercurochrome et,le quartier Mercurochrome,par le quartier Mercurochrome,cité par le quartier Mercurochrome,Mercurochrome et se,Mercurochrome et se diriger,Mercurochrome et se diriger vers
http://www.elwatan.com/culture/nourredine-chegrane-signe-de-beau-ton-04-05-2017-344490_113.php,elwatan.com,2017-05-04,Algeria,mercurochrome/NOM/mercurochrome,"Les  œuvres  sont  saupoudrées  par  un  soupçon  de mercurochrome  ,  de  Bétadine  et  de  ""  safran  ""  .",mercurochrome,nom,mercurochrome,de,de,ADP,soupçon,soupçon,NOUN,un,un,DET,par,par,ADP,saupoudrées,saupoudrer,VERB,",",",",PUNCT,de,de,ADP,Bétadine,Bétadine,PROPN,et,et,CONJ,de,de,ADP,2017-05-04,2017,2010,NOUN ADP Mercurochrome PUNCT ADP,ADP Mercurochrome PUNCT,NOUN ADP Mercurochrome,DET NOUN ADP Mercurochrome,ADP DET NOUN ADP Mercurochrome,Mercurochrome PUNCT ADP,Mercurochrome PUNCT ADP PROPN,Mercurochrome PUNCT ADP PROPN CONJ,"soupçon de Mercurochrome , de","de Mercurochrome ,",soupçon de Mercurochrome,un soupçon de Mercurochrome,par un soupçon de Mercurochrome,"Mercurochrome , de","Mercurochrome , de Bétadine","Mercurochrome , de Bétadine et"
