url,website,date,country,keyword,sentence,kw,kw_lemma,kw_pos,left_w1,left_l1,left_p1,left_w2,left_l2,left_p2,left_w3,left_l3,left_p3,left_w4,left_l4,left_p4,left_w5,left_l5,left_p5,right_w1,right_l1,right_p1,right_w2,right_l2,right_p2,right_w3,right_l3,right_p3,right_w4,right_l4,right_p4,right_w5,right_l5,right_p5,datetime,year,10years,pattern_around5,pattern_around3,pattern_left2,pattern_left3,pattern_left4,pattern_right2,pattern_right3,pattern_right4,pattern_around5_lex,pattern_around3_lex,pattern_left2_lex,pattern_left3_lex,pattern_left4_lex,pattern_right2_lex,pattern_right3_lex,pattern_right4_lex
http://bourse.lesechos.fr/infos-conseils-boursiers/infos-conseils-valeurs/infos/le-millenaire-symbole-d-une-consommation-francaise-en-berne-1020095.php,lesechos.fr,2014-12-14,France,Desigual/ADJ/Desigual,D'  autres  ont  suivi  comme  l'  espagnol Desigual  ou  l'  enseigne  de  décoration  portugaise  A  Loja  do  Gato  Preto  .,desigual,adj,desigual,espagnol,espagnol,NOUN,l',le,DET,comme,comme,ADV,suivi,suivre,VERB,ont,avoir,VERB,ou,ou,CONJ,l',le,DET,enseigne,enseigne,NOUN,de,de,ADP,décoration,décoration,NOUN,2014-12-14,2014,2010,DET NOUN Desigual CONJ DET,NOUN Desigual CONJ,DET NOUN Desigual,ADV DET NOUN Desigual,VERB ADV DET NOUN Desigual,Desigual CONJ DET,Desigual CONJ DET NOUN,Desigual CONJ DET NOUN ADP,le espagnol Desigual ou le,espagnol Desigual ou,le espagnol Desigual,comme le espagnol Desigual,suivre comme le espagnol Desigual,Desigual ou le,Desigual ou le enseigne,Desigual ou le enseigne de
http://www.zonebourse.com/actualite-bourse/EURAZEO--LANCE-LrsquoINTRODUCTION-EN-BOURSE-DrsquoELIS--19772757/,zonebourse.com,2015-01-28,===NONE===,Desigual/NAM/Desigual,"Elle  est  notamment  l'  actionnaire  majoritaire  ou  de  référence  d'  Accor  ,  ANF  Immobilier  ,  Asmodee  , Desigual  ,  Elis  ,  Europcar  ,  Foncia  ,  Moncler  ,  et  des  sociétés  de  taille  plus  modeste  dont  IES  Synergy  ,  Fonroche  Energie  et  les  participations  d'  Eurazeo  PME  .",desigual,nam,desigual,",",",",PUNCT,Asmodee,Asmodee,PROPN,",",",",PUNCT,Immobilier,Immobilier,PROPN,ANF,ANF,PROPN,",",",",PUNCT,Elis,Elis,PROPN,",",",",PUNCT,Europcar,Europcar,PROPN,",",",",PUNCT,2015-01-28,2015,2010,PROPN PUNCT Desigual PUNCT PROPN,PUNCT Desigual PUNCT,PROPN PUNCT Desigual,PUNCT PROPN PUNCT Desigual,PROPN PUNCT PROPN PUNCT Desigual,Desigual PUNCT PROPN,Desigual PUNCT PROPN PUNCT,Desigual PUNCT PROPN PUNCT PROPN,"Asmodee , Desigual , Elis",", Desigual ,","Asmodee , Desigual",", Asmodee , Desigual","Immobilier , Asmodee , Desigual","Desigual , Elis","Desigual , Elis ,","Desigual , Elis , Europcar"
http://www.laprovence.com/article/elles-co/3248635/chantelle-winnie-prend-a-nouveau-la-pose-pour-desigual.html,laprovence.com,2015-02-02,France,Desigual/NAM/Desigual,<doc uri=http://www.laprovence.com/article/elles-co/3248635/chantelle-winnie-prend-a-nouveau-la-pose-pour-desigual.html website=laprovence.com date=2015-02-02 source_country=France> /Chantelle/NAM /Winnie/NAM /prendre/VER:pres /à/PRP /nouveau/ADJ /le/DET:ART /pose/NOM /pour/PRP Desigual ,desigual,nam,desigual,pour,pour,ADP,pose,pose,NOUN,la,le,DET,nouveau,nouveau,ADJ,à,à,ADP,,,,,,,,,,,,,,,,2015-02-02,2015,2010,,,NOUN ADP Desigual,DET NOUN ADP Desigual,ADJ DET NOUN ADP Desigual,,,,,,pose pour Desigual,le pose pour Desigual,nouveau le pose pour Desigual,,,
http://www.laprovence.com/article/elles-co/3248635/chantelle-winnie-prend-a-nouveau-la-pose-pour-desigual.html,laprovence.com,2015-02-02,France,Desigual/NAM/Desigual,"Ce  n'  est  pas  la  première  fois  que  la  jeune  femme  collabore  avec Desigual  ,  mais  elle  devient  avec  cette  campagne  un  des  visages  officiels  de  la  griffe  espagnole  .",desigual,nam,desigual,avec,avec,ADP,collabore,collaborer,VERB,femme,femme,NOUN,jeune,jeune,ADJ,la,le,DET,",",",",PUNCT,mais,mais,CONJ,elle,elle,PRON,devient,devenir,VERB,avec,avec,ADP,2015-02-02,2015,2010,VERB ADP Desigual PUNCT CONJ,ADP Desigual PUNCT,VERB ADP Desigual,NOUN VERB ADP Desigual,ADJ NOUN VERB ADP Desigual,Desigual PUNCT CONJ,Desigual PUNCT CONJ PRON,Desigual PUNCT CONJ PRON VERB,"collaborer avec Desigual , mais","avec Desigual ,",collaborer avec Desigual,femme collaborer avec Desigual,jeune femme collaborer avec Desigual,"Desigual , mais","Desigual , mais elle","Desigual , mais elle devenir"
http://www.laprovence.com/article/elles-co/3248635/chantelle-winnie-prend-a-nouveau-la-pose-pour-desigual.html,laprovence.com,2015-02-02,France,Desigual/ADJ/Desigual,"""  Chantelle  Winnie  est  l'  incarnation  vivante  de  '  La  Vida  es  Chula  '  ,  ce  mode  de  vie  que  prône Desigual  .",desigual,adj,desigual,prône,prône,NOUN,que,que,CONJ,vie,vie,NOUN,de,de,ADP,mode,mode,NOUN,.,.,PUNCT,,,,,,,,,,,,,2015-02-02,2015,2010,,NOUN Desigual PUNCT,CONJ NOUN Desigual,NOUN CONJ NOUN Desigual,ADP NOUN CONJ NOUN Desigual,,,,,prône Desigual .,que prône Desigual,vie que prône Desigual,de vie que prône Desigual,,,
http://www.parismatch.com/Vivre/Mode/La-mode-des-egeries-atypiques-Jean-Paul-Gaultier-Desigual-Diesel-704600,parismatch.com,2015-02-07,France,Desigual/NAM/Desigual,"<doc uri=http://www.parismatch.com/Vivre/Mode/La-mode-des-egeries-atypiques-Jean-Paul-Gaultier-Desigual-Diesel-704600 website=parismatch.com date=2015-02-07 source_country=France> /Jean/NAM /Paul/NAM /Gaultier/NAM /,/PUN Desigual  ,  Diesel  ...  -  La  mode  des  égéries  atypiques",desigual,nam,desigual,",",",",PUNCT,Gaultier,Gaultier,PROPN,Paul,Paul,PROPN,Jean,Jean,PROPN,,,,",",",",PUNCT,Diesel,Diesel,PROPN,...,...,PUNCT,-,-,PUNCT,La,le,DET,2015-02-07,2015,2010,PROPN PUNCT Desigual PUNCT PROPN,PUNCT Desigual PUNCT,PROPN PUNCT Desigual,PROPN PROPN PUNCT Desigual,PROPN PROPN PROPN PUNCT Desigual,Desigual PUNCT PROPN,Desigual PUNCT PROPN PUNCT,Desigual PUNCT PROPN PUNCT PUNCT,"Gaultier , Desigual , Diesel",", Desigual ,","Gaultier , Desigual","Paul Gaultier , Desigual","Jean Paul Gaultier , Desigual","Desigual , Diesel","Desigual , Diesel ...","Desigual , Diesel ... -"
http://www.parismatch.com/Vivre/Mode/La-mode-des-egeries-atypiques-Jean-Paul-Gaultier-Desigual-Diesel-704600,parismatch.com,2015-02-07,France,Desigual/ADJ/Desigual,"Plus  récemment  ,  la  marque  espagnole Desigual  fait  porter  ses  vêtements  colorés  par  Winnie  Harlow  ,  une  magnifique  noire  canadienne  ,  arborant  de  larges  tâches  blanches  sur  sa  peau  .",desigual,adj,desigual,espagnole,espagnol,ADJ,marque,marque,NOUN,la,le,DET,",",",",PUNCT,récemment,récemment,ADV,fait,faire,VERB,porter,porter,VERB,ses,son,DET,vêtements,vêtement,NOUN,colorés,colorer,VERB,2015-02-07,2015,2010,NOUN ADJ Desigual VERB VERB,ADJ Desigual VERB,NOUN ADJ Desigual,DET NOUN ADJ Desigual,PUNCT DET NOUN ADJ Desigual,Desigual VERB VERB,Desigual VERB VERB DET,Desigual VERB VERB DET NOUN,marque espagnol Desigual faire porter,espagnol Desigual faire,marque espagnol Desigual,le marque espagnol Desigual,", le marque espagnol Desigual",Desigual faire porter,Desigual faire porter son,Desigual faire porter son vêtement
http://www.24heures.ch/economie/Nouvelles-baisses-de-prix-chez-Manor/story/29940239,24heures.ch,2015-02-11,Switzerland,Desigual/NAM/Desigual,"Ils  en  recevront  désormais  encore  davantage  pour  leur  argent  dans  les  rayons  Mode  et  Sport  également  -  par  exemple  pour  les  marques  Burlington  ,  Bree  , Desigual  ,  Esprit  ,  Falke  ,  Hugo  Boss  ,  Lacoste  ,  Mammut  et  The  North  Face  .",desigual,nam,desigual,",",",",PUNCT,Bree,Bree,PROPN,",",",",PUNCT,Burlington,Burlington,PROPN,marques,marque,NOUN,",",",",PUNCT,Esprit,Esprit,PROPN,",",",",PUNCT,Falke,Falke,PROPN,",",",",PUNCT,2015-02-11,2015,2010,PROPN PUNCT Desigual PUNCT PROPN,PUNCT Desigual PUNCT,PROPN PUNCT Desigual,PUNCT PROPN PUNCT Desigual,PROPN PUNCT PROPN PUNCT Desigual,Desigual PUNCT PROPN,Desigual PUNCT PROPN PUNCT,Desigual PUNCT PROPN PUNCT PROPN,"Bree , Desigual , Esprit",", Desigual ,","Bree , Desigual",", Bree , Desigual","Burlington , Bree , Desigual","Desigual , Esprit","Desigual , Esprit ,","Desigual , Esprit , Falke"
http://www.24heures.ch/economie/Nouvelles-baisses-de-prix-chez-Manor/story/29940239,24heures.ch,2015-02-11,Switzerland,Desigual/NAM/Desigual,"D'  autres  produits  de  fabricants  de  la  zone  euro  ,  renommés  dans  le  domaine  de  la  Mode  et  du  Sport  ,  affichent  également  des  baisses  de  prix  substantielles  :  il  en  va  ainsi  d'  articles  de  marques  telles  que  Burlington  ,  Bree  , Desigual  ,  Esprit  ,  Falke  ,  Hugo  Boss  ,  Mammut  et  The  North  Face  .",desigual,nam,desigual,",",",",PUNCT,Bree,Bree,PROPN,",",",",PUNCT,Burlington,Burlington,PROPN,que,que,PRON,",",",",PUNCT,Esprit,Esprit,PROPN,",",",",PUNCT,Falke,Falke,PROPN,",",",",PUNCT,2015-02-11,2015,2010,PROPN PUNCT Desigual PUNCT PROPN,PUNCT Desigual PUNCT,PROPN PUNCT Desigual,PUNCT PROPN PUNCT Desigual,PROPN PUNCT PROPN PUNCT Desigual,Desigual PUNCT PROPN,Desigual PUNCT PROPN PUNCT,Desigual PUNCT PROPN PUNCT PROPN,"Bree , Desigual , Esprit",", Desigual ,","Bree , Desigual",", Bree , Desigual","Burlington , Bree , Desigual","Desigual , Esprit","Desigual , Esprit ,","Desigual , Esprit , Falke"
http://www.parismatch.com/People/Spectacles/En-images/Beyonce-Rihanna-Justin-Bieber-et-Katie-Holmes-aux-defiles-du-premier-jour-de-la-Fashion-Week-de-New-York-708278,parismatch.com,2015-02-13,France,Desigual/ADJ/Desigual,Pauline  Lefèvre  au  défile Desigual  à  la  Fashion  Week  de  New  York,desigual,adj,desigual,défile,défiler,VERB,au,au,ADP DET,Lefèvre,Lefèvre,PROPN,Pauline,Pauline,PROPN,,,,à,à,ADP,la,le,DET,Fashion,fashion,NOUN,Week,Week,PROPN,de,de,ADP,2015-02-13,2015,2010,ADP DET VERB Desigual ADP DET,VERB Desigual ADP,ADP DET VERB Desigual,PROPN ADP DET VERB Desigual,PROPN PROPN ADP DET VERB Desigual,Desigual ADP DET,Desigual ADP DET NOUN,Desigual ADP DET NOUN PROPN,au défiler Desigual à le,défiler Desigual à,au défiler Desigual,Lefèvre au défiler Desigual,Pauline Lefèvre au défiler Desigual,Desigual à le,Desigual à le fashion,Desigual à le fashion Week
http://www.parismatch.com/People/Spectacles/En-images/Beyonce-Rihanna-Justin-Bieber-et-Katie-Holmes-aux-defiles-du-premier-jour-de-la-Fashion-Week-de-New-York-708278,parismatch.com,2015-02-13,France,Desigual/ADJ/Desigual,"C'  est  tout  d'abord  une  Française  qui  a  fait  une  apparition  surprise  au  défilé Desigual  puisque  l'  actrice  Pauline  Lefèvre  a  pris  place  non  loin  d'  une  habituée  des  premiers  rangs  ,  Katie  Holmes  .",desigual,adj,desigual,défilé,défilé,NOUN,au,au,ADP DET,surprise,surprendre,VERB,apparition,apparition,NOUN,une,un,DET,puisque,puisque,CONJ,l',le,DET,actrice,acteur|actrice,NOUN,Pauline,Pauline,PROPN,Lefèvre,Lefèvre,PROPN,2015-02-13,2015,2010,ADP DET NOUN Desigual CONJ DET,NOUN Desigual CONJ,ADP DET NOUN Desigual,VERB ADP DET NOUN Desigual,NOUN VERB ADP DET NOUN Desigual,Desigual CONJ DET,Desigual CONJ DET NOUN,Desigual CONJ DET NOUN PROPN,au défilé Desigual puisque le,défilé Desigual puisque,au défilé Desigual,surprendre au défilé Desigual,apparition surprendre au défilé Desigual,Desigual puisque le,Desigual puisque le acteur|actrice,Desigual puisque le acteur|actrice Pauline
http://www.franceguyane.fr/actualite/international/mannequin-et-malade-chantelle-winnie-se-veut-porte-parole-du-bonheur-230689.php,franceguyane.fr,2015-02-13,France,Desigual/NAM/Desigual,"Winnie  Harlow  dans  le  défilé  de Desigual  de  la  New  York  Fashion  Week  ,  le  12  février  2015  à  New  York  -  Joshua  Lott  (  AFP  )",desigual,nam,desigual,de,de,ADP,défilé,défilé,NOUN,le,le,DET,dans,dans,ADP,Harlow,Harlow,PROPN,de,de,ADP,la,le,DET,New,New,PROPN,York,York,PROPN,Fashion,Fashion,PROPN,2015-02-13,2015,2010,NOUN ADP Desigual ADP DET,ADP Desigual ADP,NOUN ADP Desigual,DET NOUN ADP Desigual,ADP DET NOUN ADP Desigual,Desigual ADP DET,Desigual ADP DET PROPN,Desigual ADP DET PROPN PROPN,défilé de Desigual de le,de Desigual de,défilé de Desigual,le défilé de Desigual,dans le défilé de Desigual,Desigual de le,Desigual de le New,Desigual de le New York
http://www.franceguyane.fr/actualite/international/mannequin-et-malade-chantelle-winnie-se-veut-porte-parole-du-bonheur-230689.php,franceguyane.fr,2015-02-13,France,Desigual/ADJ/Desigual,"""  Je  pourrais  m'  appeler  la  porte-parole  du  bonheur  ""  ,  confie  à  l'  AFP  celle  qui  est  devenue  l'  égérie  de  la  marque  barcelonaise Desigual  ,  pour  laquelle  elle  défilait  jeudi  ,  au  premier  jour  de  la  Fashion  Week  à  New  York  .",desigual,adj,desigual,barcelonaise,barcelonaise,NOUN,marque,marque,NOUN,la,le,DET,de,de,ADP,égérie,égérie,NOUN,",",",",PUNCT,pour,pour,CONJ,laquelle,lequel,PRON,elle,elle,PRON,défilait,défiler,VERB,2015-02-13,2015,2010,NOUN NOUN Desigual PUNCT CONJ,NOUN Desigual PUNCT,NOUN NOUN Desigual,DET NOUN NOUN Desigual,ADP DET NOUN NOUN Desigual,Desigual PUNCT CONJ,Desigual PUNCT CONJ PRON,Desigual PUNCT CONJ PRON PRON,"marque barcelonaise Desigual , pour","barcelonaise Desigual ,",marque barcelonaise Desigual,le marque barcelonaise Desigual,de le marque barcelonaise Desigual,"Desigual , pour","Desigual , pour lequel","Desigual , pour lequel elle"
http://www.franceguyane.fr/actualite/international/mannequin-et-malade-chantelle-winnie-se-veut-porte-parole-du-bonheur-230689.php,franceguyane.fr,2015-02-13,France,Desigual/NAM/Desigual,"L'  an  dernier  ,  elle  devenait  le  visage  de Desigual  .",desigual,nam,desigual,de,de,ADP,visage,visage,NOUN,le,le,DET,devenait,devenir,VERB,elle,elle,PRON,.,.,PUNCT,,,,,,,,,,,,,2015-02-13,2015,2010,,ADP Desigual PUNCT,NOUN ADP Desigual,DET NOUN ADP Desigual,VERB DET NOUN ADP Desigual,,,,,de Desigual .,visage de Desigual,le visage de Desigual,devenir le visage de Desigual,,,
http://www.parismatch.com/Vivre/Mode/En-images/Sa-difference-est-sa-force-710920,parismatch.com,2015-02-17,France,Desigual/NAM/Desigual,"Découverte  (  bien  qu'  éliminée  )  par  Tyra  Banks  dans  l'  émission  ""  America  '  s  Next  Top  Model  ""  ,  elle  est  depuis  2014  égérie  de Desigual  ,  marque  espagnole  pour  laquelle  elle  a  défilé  la  semaine  dernière  dans  le  cadre  de  la  fashion  Week  de  New  York  Automne-Hiver  2015  .",desigual,nam,desigual,de,de,ADP,égérie,égérie,NOUN,2014,@card@,ADJ,depuis,depuis,ADP,est,être,VERB,",",",",PUNCT,marque,marque,NOUN,espagnole,espagnol,ADJ,pour,pour,CONJ,laquelle,lequel,PRON,2015-02-17,2015,2010,NOUN ADP Desigual PUNCT NOUN,ADP Desigual PUNCT,NOUN ADP Desigual,ADJ NOUN ADP Desigual,ADP ADJ NOUN ADP Desigual,Desigual PUNCT NOUN,Desigual PUNCT NOUN ADJ,Desigual PUNCT NOUN ADJ CONJ,"égérie de Desigual , marque","de Desigual ,",égérie de Desigual,@card@ égérie de Desigual,depuis @card@ égérie de Desigual,"Desigual , marque","Desigual , marque espagnol","Desigual , marque espagnol pour"
http://www.lemonde.fr/m-styles/article/2015/02/17/new-york-fait-defiler-les-differences_4578393_4497319.html#xtor%3DRSS-3208001,lemonde.fr,2015-02-18,France,Desigual/NAM/Desigual,"Chez Desigual  ,  marque  espagnole  qui  défilait  également  à  New  York  le  12  février  ,  l'  égérie  est  Winnie  Harlow  ,  atteinte  de  vitiligo  .",desigual,nam,desigual,Chez,chez,ADP,,,,,,,,,,,,,",",",",PUNCT,marque,marque,NOUN,espagnole,espagnol,ADJ,qui,qui,PRON,défilait,défiler,VERB,2015-02-18,2015,2010,,ADP Desigual PUNCT,,,,Desigual PUNCT NOUN,Desigual PUNCT NOUN ADJ,Desigual PUNCT NOUN ADJ PRON,,"chez Desigual ,",,,,"Desigual , marque","Desigual , marque espagnol","Desigual , marque espagnol qui"
http://www.lemonde.fr/economie/article/2015/02/19/aeroports-de-paris-refuse-d-augmenter-les-salaires-et-de-baisser-les-taxes_4580084_3234.html,lemonde.fr,2015-02-19,France,Desigual/NAM/Desigual,"Après  les  grands  noms  du  luxe  ,  ce  sont  des  marques  milieu  de  gamme  ,  comme Desigual  et  Mango  ,  qui  devraient  ouvrir  des  boutiques  à  Orly  et  à  Roissy  . </doc>",desigual,nam,desigual,comme,comme,CONJ,",",",",PUNCT,gamme,gamme,NOUN,de,de,ADP,milieu,milieu,NOUN,et,et,CONJ,Mango,Mango,PROPN,",",",",PUNCT,qui,qui,PRON,devraient,devoir,VERB,2015-02-19,2015,2010,PUNCT CONJ Desigual CONJ PROPN,CONJ Desigual CONJ,PUNCT CONJ Desigual,NOUN PUNCT CONJ Desigual,ADP NOUN PUNCT CONJ Desigual,Desigual CONJ PROPN,Desigual CONJ PROPN PUNCT,Desigual CONJ PROPN PUNCT PRON,", comme Desigual et Mango",comme Desigual et,", comme Desigual","gamme , comme Desigual","de gamme , comme Desigual",Desigual et Mango,"Desigual et Mango ,","Desigual et Mango , qui"
http://www.lemonde.fr/m-le-mag/article/2015/02/27/la-beaute-sort-des-canons_4583739_4500055.html#xtor%3DRSS-3208001,lemonde.fr,2015-02-27,France,Desigual/ADJ/Desigual,"Egalement  égérie  de  la  griffe  espagnole Desigual  ,  elle  incarne  cet  hiver  le  spécial  beauté  du  magazine  britannique  i-D  et  figure  parmi  les  cent  personnes  les  plus  importantes  de  l'  année  2015  distinguées  par  le  magazine  Dazed  &  Confused  .",desigual,adj,desigual,espagnole,espagnol,ADJ,griffe,griffe,NOUN,la,le,DET,de,de,ADP,égérie,égérie,NOUN,",",",",PUNCT,elle,elle,PRON,incarne,incarner,VERB,cet,ce,PRON,hiver,hiver,NOUN,2015-02-27,2015,2010,NOUN ADJ Desigual PUNCT PRON,ADJ Desigual PUNCT,NOUN ADJ Desigual,DET NOUN ADJ Desigual,ADP DET NOUN ADJ Desigual,Desigual PUNCT PRON,Desigual PUNCT PRON VERB,Desigual PUNCT PRON VERB PRON,"griffe espagnol Desigual , elle","espagnol Desigual ,",griffe espagnol Desigual,le griffe espagnol Desigual,de le griffe espagnol Desigual,"Desigual , elle","Desigual , elle incarner","Desigual , elle incarner ce"
http://www.lemonde.fr/m-le-mag/article/2015/02/27/la-beaute-sort-des-canons_4583739_4500055.html#xtor%3DRSS-3208001,lemonde.fr,2015-02-27,France,Desigual/NAM/Desigual,"Une  technique  marketing  puissante  ,  censée  conférer  à  un  achat  ""  un  sens  plus  profond  ,  une  émotion  ""  ,  déclare  le  directeur  de  la  communication  de Desigual  ,  Borja  Castresana  .",desigual,nam,desigual,de,de,ADP,communication,communication,NOUN,la,le,DET,de,de,ADP,directeur,directeur,NOUN,",",",",PUNCT,Borja,Borja,PROPN,Castresana,Castresana,PROPN,.,.,PUNCT,,,,2015-02-27,2015,2010,NOUN ADP Desigual PUNCT PROPN,ADP Desigual PUNCT,NOUN ADP Desigual,DET NOUN ADP Desigual,ADP DET NOUN ADP Desigual,Desigual PUNCT PROPN,Desigual PUNCT PROPN PROPN,Desigual PUNCT PROPN PROPN PUNCT,"communication de Desigual , Borja","de Desigual ,",communication de Desigual,le communication de Desigual,de le communication de Desigual,"Desigual , Borja","Desigual , Borja Castresana","Desigual , Borja Castresana ."
http://www.newswire.ca/en/story/1481967/desigual-nomme-chantelle-brown-young-ambassadrice-de-marque-pour-sa-campagne-printemps-ete-2015-intitulee-say-something-nice,newswire.ca,2015-02-04,Canada,Desigual/NAM/Desigual,<doc uri=http://www.newswire.ca/en/story/1481967/desigual-nomme-chantelle-brown-young-ambassadrice-de-marque-pour-sa-campagne-printemps-ete-2015-intitulee-say-something-nice website=newswire.ca date=2015-02-04 source_country=Canada> Desigual  nomme  Chantelle  Brown-Young  ambassadrice  de  marque  pour  sa  campagne  printemps  /  été  2015  intitulée  Say  Something  Nice,desigual,nam,desigual,,,,,,,,,,,,,,,,nomme,nommer,VERB,Chantelle,Chantelle,PROPN,Brown-Young,Brown-Young,PROPN,ambassadrice,ambassadrice,NOUN,de,de,ADP,2015-02-04,2015,2010,,,,,,Desigual VERB PROPN,Desigual VERB PROPN PROPN,Desigual VERB PROPN PROPN NOUN,,,,,,Desigual nommer Chantelle,Desigual nommer Chantelle Brown-Young,Desigual nommer Chantelle Brown-Young ambassadrice
http://www.newswire.ca/en/story/1481967/desigual-nomme-chantelle-brown-young-ambassadrice-de-marque-pour-sa-campagne-printemps-ete-2015-intitulee-say-something-nice,newswire.ca,2015-02-04,Canada,Desigual/NAM/Desigual,"BARCELONE  ,  Espagne  ,  le  4  février  2015  /  CNW  /  -- Desigual  a  choisi  la  mannequin  canadienne  Chantelle  Brown-Young  ,  aussi  connue  sous  le  nom  de  Winnie  Harlow  ,  comme  vedette  de  sa  campagne  printemps  /  été  2015  à  titre  de  nouvelle  ambassadrice  de  marque  .",desigual,nam,desigual,--,--,PUNCT,/,,,CNW,CNW,PROPN,/,,,2015,@card@,ADJ,a,avoir,VERB,choisi,choisir,VERB,la,le,DET,mannequin,mannequin,NOUN,canadienne,canadien,ADJ,2015-02-04,2015,2010,,PUNCT Desigual VERB,,,,Desigual VERB VERB,Desigual VERB VERB DET,Desigual VERB VERB DET NOUN,,-- Desigual avoir,,,,Desigual avoir choisir,Desigual avoir choisir le,Desigual avoir choisir le mannequin
http://www.newswire.ca/en/story/1481967/desigual-nomme-chantelle-brown-young-ambassadrice-de-marque-pour-sa-campagne-printemps-ete-2015-intitulee-say-something-nice,newswire.ca,2015-02-04,Canada,Desigual/NAM/Desigual,"Chantelle  personnifie  ""  La  vie  est  chula  ""  ,  le  modus  vivendi  de Desigual  .",desigual,nam,desigual,de,de,ADP,vivendi,vivendi,NOUN,modus,modus,ADJ,le,le,DET,",",",",PUNCT,.,.,PUNCT,,,,,,,,,,,,,2015-02-04,2015,2010,,ADP Desigual PUNCT,NOUN ADP Desigual,ADJ NOUN ADP Desigual,DET ADJ NOUN ADP Desigual,,,,,de Desigual .,vivendi de Desigual,modus vivendi de Desigual,le modus vivendi de Desigual,,,
http://www.newswire.ca/en/story/1481967/desigual-nomme-chantelle-brown-young-ambassadrice-de-marque-pour-sa-campagne-printemps-ete-2015-intitulee-say-something-nice,newswire.ca,2015-02-04,Canada,Desigual/NAM/Desigual,Chantelle  et Desigual  s'  unissent  pour  offrir  au  monde  des  messages  qui  font  sourire  et  ils  y  parviennent  par  leur  médium  de  prédilection  --  les  vêtements  --  grâce  à  une  collection  vivante  et  spontanée  qui  véhicule  des  messages  allant  droit  au  cœur  .,desigual,nam,desigual,et,et,CONJ,Chantelle,Chantelle,PROPN,,,,,,,,,,s',se,PRON,unissent,unir,VERB,pour,pour,ADP,offrir,offrir,VERB,au,au,ADP DET,2015-02-04,2015,2010,PROPN CONJ Desigual PRON VERB,CONJ Desigual PRON,PROPN CONJ Desigual,,,Desigual PRON VERB,Desigual PRON VERB ADP,Desigual PRON VERB ADP VERB,Chantelle et Desigual se unir,et Desigual se,Chantelle et Desigual,,,Desigual se unir,Desigual se unir pour,Desigual se unir pour offrir
http://www.newswire.ca/en/story/1481967/desigual-nomme-chantelle-brown-young-ambassadrice-de-marque-pour-sa-campagne-printemps-ete-2015-intitulee-say-something-nice,newswire.ca,2015-02-04,Canada,Desigual/NAM/Desigual," Desigual  (  www.desigual.com  )  se  caractérise  par  ses  conceptions  distinctes  ,  optimistes  et  colorées  .",desigual,nam,desigual,,,,,,,,,,,,,,,,(,(,PUNCT,www.desigual.com,www.desigual.com,NOUN,),),PUNCT,se,se,PRON,caractérise,caractériser,VERB,2015-02-04,2015,2010,,,,,,Desigual PUNCT NOUN,Desigual PUNCT NOUN PUNCT,Desigual PUNCT NOUN PUNCT PRON,,,,,,Desigual ( www.desigual.com,Desigual ( www.desigual.com ),Desigual ( www.desigual.com ) se
http://www.newswire.ca/en/story/1481967/desigual-nomme-chantelle-brown-young-ambassadrice-de-marque-pour-sa-campagne-printemps-ete-2015-intitulee-say-something-nice,newswire.ca,2015-02-04,Canada,www.desigual.com/NOM/www.desigual.com,"Desigual  ( www.desigual.com  )  se  caractérise  par  ses  conceptions  distinctes  ,  optimistes  et  colorées  .",www.desigual.com,nom,www.desigual.com,(,(,PUNCT,Desigual,Desigual,PROPN,,,,,,,,,,),),PUNCT,se,se,PRON,caractérise,caractériser,VERB,par,par,ADP,ses,son,DET,2015-02-04,2015,2010,PROPN PUNCT Desigual PUNCT PRON,PUNCT Desigual PUNCT,PROPN PUNCT Desigual,,,Desigual PUNCT PRON,Desigual PUNCT PRON VERB,Desigual PUNCT PRON VERB ADP,Desigual ( Desigual ) se,( Desigual ),Desigual ( Desigual,,,Desigual ) se,Desigual ) se caractériser,Desigual ) se caractériser par
http://www.newswire.ca/en/story/1481967/desigual-nomme-chantelle-brown-young-ambassadrice-de-marque-pour-sa-campagne-printemps-ete-2015-intitulee-say-something-nice,newswire.ca,2015-02-04,Canada,Desigual/NAM/Desigual,"Le  slogan  de Desigual  ,  La  Vida  es  Chula  ,  traduit  la  manière  dont  cette  société  perçoit  la  mode  et  la  vie  .",desigual,nam,desigual,de,de,ADP,slogan,slogan,NOUN,Le,le,DET,,,,,,,",",",",PUNCT,La,le,DET,Vida,Vida,PROPN,es,être,VERB,Chula,Chula,PROPN,2015-02-04,2015,2010,NOUN ADP Desigual PUNCT DET,ADP Desigual PUNCT,NOUN ADP Desigual,DET NOUN ADP Desigual,,Desigual PUNCT DET,Desigual PUNCT DET PROPN,Desigual PUNCT DET PROPN VERB,"slogan de Desigual , le","de Desigual ,",slogan de Desigual,le slogan de Desigual,,"Desigual , le","Desigual , le Vida","Desigual , le Vida être"
http://www.newswire.ca/en/story/1481967/desigual-nomme-chantelle-brown-young-ambassadrice-de-marque-pour-sa-campagne-printemps-ete-2015-intitulee-say-something-nice,newswire.ca,2015-02-04,Canada,Desigual/NAM/Desigual,"Elle  explique  la  raison  d'  être  de Desigual  ,  qui  est  profondément  ancrée  dans  l'  ADN  de  la  marque  ainsi  que  dans  les  valeurs  qu'  elle  véhicule  .",desigual,nam,desigual,de,de,ADP,être,être,VERB,d',de,ADP,raison,raison,NOUN,la,le,DET,",",",",PUNCT,qui,qui,PRON,est,être,VERB,profondément,profondément,ADV,ancrée,ancrer,VERB,2015-02-04,2015,2010,VERB ADP Desigual PUNCT PRON,ADP Desigual PUNCT,VERB ADP Desigual,ADP VERB ADP Desigual,NOUN ADP VERB ADP Desigual,Desigual PUNCT PRON,Desigual PUNCT PRON VERB,Desigual PUNCT PRON VERB ADV,"être de Desigual , qui","de Desigual ,",être de Desigual,de être de Desigual,raison de être de Desigual,"Desigual , qui","Desigual , qui être","Desigual , qui être profondément"
