url,website,date,country,keyword,sentence,kw,kw_lemma,kw_pos,left_w1,left_l1,left_p1,left_w2,left_l2,left_p2,left_w3,left_l3,left_p3,left_w4,left_l4,left_p4,left_w5,left_l5,left_p5,right_w1,right_l1,right_p1,right_w2,right_l2,right_p2,right_w3,right_l3,right_p3,right_w4,right_l4,right_p4,right_w5,right_l5,right_p5,datetime,year,10years,pattern_around5,pattern_around3,pattern_left2,pattern_left3,pattern_left4,pattern_right2,pattern_right3,pattern_right4,pattern_around5_lex,pattern_around3_lex,pattern_left2_lex,pattern_left3_lex,pattern_left4_lex,pattern_right2_lex,pattern_right3_lex,pattern_right4_lex
http://next.liberation.fr/musique/2016/11/11/leonard-cohen-le-songwriter-impressionniste_1527906?xtor=rss-450,liberation.fr,2016-11-12,France,vaseline/NOM/vaseline,"""  You  were  the  promise  at  dawn  /  I  was  the  morning  after  [  ...  ]  Y  ou  were  Marlon  Brando  /  I  was  Steve  McQueen  /  You  were  K.Y.  Jelly  /  I  was  Vaseline  ""  (  Tu  étais  la  promesse  de  l'  aube  /  J'  étais  le  matin  suivant  [  ...  ]  Tu  étais  Marlon  Brando  /  J'  étais  Steve  McQueen  /  Tu  étais  K.Y.  Jelly  /  J'  étais  la vaseline  ""  ,  Is  This  What  You  Wanted  ,  sur  New  Skin  for  the  Old  Ceremony  ,  1974  )  .",vaseline,nom,vaseline,la,le,DET,étais,être,VERB,J',J',PROPN,/,,,Jelly,Jelly,PROPN,"""","""",PUNCT,",",",",PUNCT,Is,Is,NOUN,This,This,PROPN,What,What,PROPN,2016-11-12,2016,2010,VERB DET Vaseline PUNCT PUNCT,DET Vaseline PUNCT,VERB DET Vaseline,PROPN VERB DET Vaseline,,Vaseline PUNCT PUNCT,Vaseline PUNCT PUNCT NOUN,Vaseline PUNCT PUNCT NOUN PROPN,"être le Vaseline "" ,","le Vaseline """,être le Vaseline,J' être le Vaseline,,"Vaseline "" ,","Vaseline "" , Is","Vaseline "" , Is This"
http://www.lefigaro.fr/flash-actu/2016/11/13/97001-20161113FILWWW00104-l-homme-qui-veut-traverser-l-atlantique-a-la-nage-est-parti-ce-dimanche.php,lefigaro.fr,2016-11-13,France,vaseline/NOM/vaseline,"Après  s'  être  préparé  en  se  mettant  notamment  de  la vaseline  pour  bébé  sous  les  aisselles  pour  se  protéger  la  peau  et  dit  au  revoir  au  personnel  de  l'  hôtel  ,  il  a  pris  le  départ  devant  une  dizaine  de  journalistes  et  une  dizaine  de  proches  et  membres  de  l'  équipage  qui  doit  l'  escorter  en  bateau  durant  sa  tentative  de  ""  franchir  la  muraille  bleue  ""  (  ""  Swim  The  Big  Blue  ""  )  .",vaseline,nom,vaseline,la,le,DET,de,de,ADP,notamment,notamment,ADV,mettant,mettre,VERB,se,se,PRON,pour,pour,ADP,bébé,bébé,NOUN,sous,sous,ADP,les,le,DET,aisselles,aisselle,NOUN,2016-11-13,2016,2010,ADP DET Vaseline ADP NOUN,DET Vaseline ADP,ADP DET Vaseline,ADV ADP DET Vaseline,VERB ADV ADP DET Vaseline,Vaseline ADP NOUN,Vaseline ADP NOUN ADP,Vaseline ADP NOUN ADP DET,de le Vaseline pour bébé,le Vaseline pour,de le Vaseline,notamment de le Vaseline,mettre notamment de le Vaseline,Vaseline pour bébé,Vaseline pour bébé sous,Vaseline pour bébé sous le
http://www.20min.ch/ro/news/insolite/story/Son-derriere-etait-en-or-massif-12747889,20min.ch,2016-11-14,Switzerland,vaseline/NOM/vaseline,"L'  homme  de  35  ans  ,  qui  travaillait  frיquemment  seul  dans  son  atelier  de  raffinage  ultrasיcurisי  ,  avait  pris  l'  habitude  de  subtiliser  des  palets  d'  or  de  210  g.  Dans  son  casier  ,  les  enquךteurs  ont  retrouvי  des  gants  en  latex  et  de  la vaseline  .",vaseline,nom,vaseline,la,le,DET,de,de,ADP,et,et,CONJ,latex,latex,NOUN,en,en,ADP,.,.,PUNCT,,,,,,,,,,,,,2016-11-14,2016,2010,,DET Vaseline PUNCT,ADP DET Vaseline,CONJ ADP DET Vaseline,NOUN CONJ ADP DET Vaseline,,,,,le Vaseline .,de le Vaseline,et de le Vaseline,latex et de le Vaseline,,,
http://www.byzegut.fr/2016/11/vendredi-18-novembre-2016.html,byzegut.fr,2016-11-17,France,Vaselines/NAM/Vaselines,"Nirvana  interprète  des  titres  rares  et  des  reprises  de  The Vaselines  ,  David  Bowie  ,  Meat  Puppets  et  Lead  Belly  .",vaselines,nam,vaselines,The,The,PROPN,de,de,ADP,reprises,reprise,NOUN,des,du,ADP DET,et,et,CONJ,",",",",PUNCT,David,David,PROPN,Bowie,Bowie,PROPN,",",",",PUNCT,Meat,Meat,PROPN,2016-11-17,2016,2010,ADP PROPN Vaseline PUNCT PROPN,PROPN Vaseline PUNCT,ADP PROPN Vaseline,NOUN ADP PROPN Vaseline,ADP DET NOUN ADP PROPN Vaseline,Vaseline PUNCT PROPN,Vaseline PUNCT PROPN PROPN,Vaseline PUNCT PROPN PROPN PUNCT,"de The Vaseline , David","The Vaseline ,",de The Vaseline,reprise de The Vaseline,du reprise de The Vaseline,"Vaseline , David","Vaseline , David Bowie","Vaseline , David Bowie ,"
http://www.essor.ml/2016/11/canada-un-employe-cachait-de-lor-dans-lune-de-ses-cavites-corporelles/,essor.ml,2016-11-24,Mali,Vaseline/NAM/Vaseline,Le  fait  que  de  la Vaseline  et  des  gants  de  latex  aient  été  retrouvés  dans  le  casier  de  M.  Lawrence  a  également  semblé  convaincre  le  juge  .,vaseline,nam,vaseline,la,le,DET,de,de,ADP,que,que,CONJ,fait,fait,NOUN,Le,le,DET,et,et,CONJ,des,du,ADP DET,gants,gant,NOUN,de,de,ADP,latex,latex,NOUN,2016-11-24,2016,2010,ADP DET Vaseline CONJ ADP DET,DET Vaseline CONJ,ADP DET Vaseline,CONJ ADP DET Vaseline,NOUN CONJ ADP DET Vaseline,Vaseline CONJ ADP DET,Vaseline CONJ ADP DET NOUN,Vaseline CONJ ADP DET NOUN ADP,de le Vaseline et du,le Vaseline et,de le Vaseline,que de le Vaseline,fait que de le Vaseline,Vaseline et du,Vaseline et du gant,Vaseline et du gant de
http://www.journaldequebec.com/2016/11/22/voici-18-conseils-infaillibles-pour-reussir-et-apprecier-le-sexe-anal,journaldequebec.com,2016-11-25,Armenia,Vaseline/NAM/Vaseline,"Et  non  ,  la Vaseline  ne  fonctionne  pas  .",vaseline,nam,vaseline,la,le,DET,",",",",PUNCT,non,non,ADV,Et,et,CONJ,,,,ne,ne,ADV,fonctionne,fonctionner,VERB,pas,pas,ADV,.,.,PUNCT,,,,2016-11-25,2016,2010,PUNCT DET Vaseline ADV VERB,DET Vaseline ADV,PUNCT DET Vaseline,ADV PUNCT DET Vaseline,CONJ ADV PUNCT DET Vaseline,Vaseline ADV VERB,Vaseline ADV VERB ADV,Vaseline ADV VERB ADV PUNCT,", le Vaseline ne fonctionner",le Vaseline ne,", le Vaseline","non , le Vaseline","et non , le Vaseline",Vaseline ne fonctionner,Vaseline ne fonctionner pas,Vaseline ne fonctionner pas .
http://www.elle.fr/Beaute/News-beaute/Soins/Avec-cette-astuce-vous-n-aurez-plus-jamais-les-levres-gercees-3391199,elle.fr,2016-11-25,France,vaseline/NOM/vaseline,"Et  si  notre  arme  secrĂ  ¨  te  pour  une  bouche  lisse  et  parfaitement  hydratĂŠe  se  trouvait  dĂŠjĂ  dans  notre  vanity  ?  Pour  rĂŠparer  nos  lĂ  ¨  vres  abĂŽmĂŠes  par  le  froid  ,  on  pense  souvent  Ă  utiliser  un  corps  gras  comme  la vaseline  ou  un  baume  Ă  lĂ  ¨  vres  hydratant  ultra  riche  .",vaseline,nom,vaseline,la,le,DET,comme,comme,CONJ,gras,gras,ADJ,corps,corps,NOUN,un,un,DET,ou,ou,CONJ,un,un,DET,baume,baume,NOUN,Ă,Ă,ADJ,lĂ,lĂ,ADJ,2016-11-25,2016,2010,CONJ DET Vaseline CONJ DET,DET Vaseline CONJ,CONJ DET Vaseline,ADJ CONJ DET Vaseline,NOUN ADJ CONJ DET Vaseline,Vaseline CONJ DET,Vaseline CONJ DET NOUN,Vaseline CONJ DET NOUN ADJ,comme le Vaseline ou un,le Vaseline ou,comme le Vaseline,gras comme le Vaseline,corps gras comme le Vaseline,Vaseline ou un,Vaseline ou un baume,Vaseline ou un baume Ă
http://www.lequipe.fr/Ilosport/Running/Actualites/5-blessures-recurrentes-du-runner-comment-les-soigner/741865#xtor%3DRSS-1,lequipe.fr,2016-11-25,France,vaseline/NOM/vaseline,"Utiliser  un  pansement  gras  (  exemple  :  tulle  gras  )  pour  soigner  la  brûlure  et  appliquer  une  crème  anti-frottement  ou  de  la vaseline  sur  les  zones  à  risque  ,  en  prévention  ,  avant  d'  aller  courir  .",vaseline,nom,vaseline,la,le,DET,de,de,ADP,ou,ou,CONJ,anti-frottement,anti-frottement,NOUN,crème,crème,NOUN,sur,sur,ADP,les,le,DET,zones,zone,NOUN,à,à,ADP,risque,risque,NOUN,2016-11-25,2016,2010,ADP DET Vaseline ADP DET,DET Vaseline ADP,ADP DET Vaseline,CONJ ADP DET Vaseline,NOUN CONJ ADP DET Vaseline,Vaseline ADP DET,Vaseline ADP DET NOUN,Vaseline ADP DET NOUN ADP,de le Vaseline sur le,le Vaseline sur,de le Vaseline,ou de le Vaseline,anti-frottement ou de le Vaseline,Vaseline sur le,Vaseline sur le zone,Vaseline sur le zone à
http://next.liberation.fr/arts/2016/11/27/david-hamilton-le-voile-tombe_1531278?xtor=rss-450,liberation.fr,2016-11-28,France,vaseline/NOM/vaseline,Mais  rien  n'  autorise  à  accréditer  l'  existence  de  ces  trucs  qu'  on  lui  a  prêtés  et  qui  sont  ici  ou  là  rapportés  avec  gourmandise  (  un  bas  ou  de  la vaseline  sur  l'  objectif  )  .,vaseline,nom,vaseline,la,le,DET,de,de,ADP,ou,ou,CONJ,bas,bas,NOUN,un,un,DET,sur,sur,ADP,l',le,DET,objectif,objectif,NOUN,),),PUNCT,.,.,PUNCT,2016-11-28,2016,2010,ADP DET Vaseline ADP DET,DET Vaseline ADP,ADP DET Vaseline,CONJ ADP DET Vaseline,NOUN CONJ ADP DET Vaseline,Vaseline ADP DET,Vaseline ADP DET NOUN,Vaseline ADP DET NOUN PUNCT,de le Vaseline sur le,le Vaseline sur,de le Vaseline,ou de le Vaseline,bas ou de le Vaseline,Vaseline sur le,Vaseline sur le objectif,Vaseline sur le objectif )
http://www.rfi.fr/science/20161202-comment-bien-utiliser-le-preservatif-catherine-solano,rfi.fr,2016-12-02,France,vaseline/NOM/vaseline,"Surtout  pas  de vaseline  ,  d'  huile  ,  de  beurre  ,  et  autres  corps  gras  rendant  les  préservatifs  poreux  donc  moins  efficaces  .",vaseline,nom,vaseline,de,de,ADP,pas,pas,ADV,Surtout,surtout,ADV,,,,,,,",",",",PUNCT,d',de,ADP,huile,huile,NOUN,",",",",PUNCT,de,de,ADP,2016-12-02,2016,2010,ADV ADP Vaseline PUNCT ADP,ADP Vaseline PUNCT,ADV ADP Vaseline,ADV ADV ADP Vaseline,,Vaseline PUNCT ADP,Vaseline PUNCT ADP NOUN,Vaseline PUNCT ADP NOUN PUNCT,"pas de Vaseline , de","de Vaseline ,",pas de Vaseline,surtout pas de Vaseline,,"Vaseline , de","Vaseline , de huile","Vaseline , de huile ,"
http://www.journaldequebec.com/2016/12/04/un-maniaque-sexuel-demeure-detenu,journaldequebec.com,2016-12-04,Armenia,Vaseline/NAM/Vaseline,"Il  avait  été  arrêté  en  possession  d'  un  sac  du  parfait  agresseur  contenant  de  la Vaseline  ,  des  gants  de  latex  ainsi  que  des  cassettes  contenant  des  cris  de  jouissance  .",vaseline,nam,vaseline,la,le,DET,de,de,ADP,contenant,contenir,VERB,agresseur,agresseur,NOUN,parfait,parfait,ADJ,",",",",PUNCT,des,du,ADP DET,gants,gant,NOUN,de,de,ADP,latex,latex,NOUN,2016-12-04,2016,2010,ADP DET Vaseline PUNCT ADP DET,DET Vaseline PUNCT,ADP DET Vaseline,VERB ADP DET Vaseline,NOUN VERB ADP DET Vaseline,Vaseline PUNCT ADP DET,Vaseline PUNCT ADP DET NOUN,Vaseline PUNCT ADP DET NOUN ADP,"de le Vaseline , du","le Vaseline ,",de le Vaseline,contenir de le Vaseline,agresseur contenir de le Vaseline,"Vaseline , du","Vaseline , du gant","Vaseline , du gant de"
http://www.yabiladi.com/articles/details/48962/hicham-lasri-realisateur-bissara-overdose.html,yabiladi.com,2016-12-05,Morocco,Vaseline/NAM/Vaseline,"""  No Vaseline  Fatwa  ""  est  passée  pendant  le  mois  de  Ramadan  ,  est-ce  un  substitut  à  la  télévision  marocaine  ?",vaseline,nam,vaseline,No,No,NOUN,"""","""",PUNCT,,,,,,,,,,Fatwa,Fatwa,PROPN,"""","""",PUNCT,est,être,VERB,passée,passer,VERB,pendant,pendant,ADP,2016-12-05,2016,2010,PUNCT NOUN Vaseline PROPN PUNCT,NOUN Vaseline PROPN,PUNCT NOUN Vaseline,,,Vaseline PROPN PUNCT,Vaseline PROPN PUNCT VERB,Vaseline PROPN PUNCT VERB VERB,""" No Vaseline Fatwa """,No Vaseline Fatwa,""" No Vaseline",,,"Vaseline Fatwa ""","Vaseline Fatwa "" être","Vaseline Fatwa "" être passer"
http://www.actusoins.com/281700/les-pansements-et-leurs-utilisations.html,actusoins.com,2016-12-08,===NONE===,vaseline/NOM/vaseline,"ils  sont  constitués  d'  une  trame  ,  imprégnée  ou  enduite  de vaseline  .",vaseline,nom,vaseline,de,de,ADP,enduite,enduire,VERB,ou,ou,CONJ,imprégnée,imprégner,VERB,",",",",PUNCT,.,.,PUNCT,,,,,,,,,,,,,2016-12-08,2016,2010,,ADP Vaseline PUNCT,VERB ADP Vaseline,CONJ VERB ADP Vaseline,VERB CONJ VERB ADP Vaseline,,,,,de Vaseline .,enduire de Vaseline,ou enduire de Vaseline,imprégner ou enduire de Vaseline,,,
http://www.sofoot.com/ca-c-est-le-pied-436112.html,sofoot.com,2016-12-08,France,vaseline/NOM/vaseline,"Sinon  ,  on  peut  toujours  utiliser  du  spray  ,  de  la vaseline  ou  de  la  crème  anti-frottement  .",vaseline,nom,vaseline,la,le,DET,de,de,ADP,",",",",PUNCT,spray,spray,NOUN,du,du,ADP DET,ou,ou,CONJ,de,de,ADP,la,le,DET,crème,crème,NOUN,anti-frottement,anti-frottement,NOUN,2016-12-08,2016,2010,ADP DET Vaseline CONJ ADP,DET Vaseline CONJ,ADP DET Vaseline,PUNCT ADP DET Vaseline,NOUN PUNCT ADP DET Vaseline,Vaseline CONJ ADP,Vaseline CONJ ADP DET,Vaseline CONJ ADP DET NOUN,de le Vaseline ou de,le Vaseline ou,de le Vaseline,", de le Vaseline","spray , de le Vaseline",Vaseline ou de,Vaseline ou de le,Vaseline ou de le crème
http://www.lexpress.fr/styles/soins/les-recettes-pour-un-baume-a-levres-maison_1859162.html,lexpress.fr,2016-12-12,France,vaseline/NOM/vaseline,Mélangez  dans  un  bol  une  cuillère  à  café  de vaseline  ou  d'  huile  de  coco  et  la  moitié  d'  une  cuillère  à  café  de  miel  .,vaseline,nom,vaseline,de,de,ADP,café,café,NOUN,à,à,ADP,cuillère,cuillère,NOUN,une,un,DET,ou,ou,CONJ,d',de,ADP,huile,huile,NOUN,de,de,ADP,coco,coco,NOUN,2016-12-12,2016,2010,NOUN ADP Vaseline CONJ ADP,ADP Vaseline CONJ,NOUN ADP Vaseline,ADP NOUN ADP Vaseline,NOUN ADP NOUN ADP Vaseline,Vaseline CONJ ADP,Vaseline CONJ ADP NOUN,Vaseline CONJ ADP NOUN ADP,café de Vaseline ou de,de Vaseline ou,café de Vaseline,à café de Vaseline,cuillère à café de Vaseline,Vaseline ou de,Vaseline ou de huile,Vaseline ou de huile de
http://www.lepoint.fr/pop-culture/cinema/cannes-kristen-stewart-des-gens-ont-essaye-de-me-detraquer-11-05-2016-2038390_2923.php#xtor%3DRSS-283,lepoint.fr,2016-12-14,France,vaseline/NOM/vaseline,"Je  souris  beaucoup  (  rires  )  !  Mais  j'  imagine  que  si  vous  me  comparez  à  des  personnes  surexcitées  qui  font  étinceler  leur  dentition  à  tout  bout  de  champ  et  mettent  de  la vaseline  sur  leurs  lèvres  pour  être  sûres  qu'  elles  ne  sèchent  jamais  ...  si  j'  étais  comme  ça  ,  je  serais  un  robot  !",vaseline,nom,vaseline,la,le,DET,de,de,ADP,mettent,mettre,VERB,et,et,CONJ,champ,champ,NOUN,sur,sur,ADP,leurs,leur,DET,lèvres,lèvre,NOUN,pour,pour,ADP,être,être,VERB,2016-12-14,2016,2010,ADP DET Vaseline ADP DET,DET Vaseline ADP,ADP DET Vaseline,VERB ADP DET Vaseline,CONJ VERB ADP DET Vaseline,Vaseline ADP DET,Vaseline ADP DET NOUN,Vaseline ADP DET NOUN ADP,de le Vaseline sur leur,le Vaseline sur,de le Vaseline,mettre de le Vaseline,et mettre de le Vaseline,Vaseline sur leur,Vaseline sur leur lèvre,Vaseline sur leur lèvre pour
http://fr.canoe.ca/artdevivre/modebeaute/nouvelles/archives/2016/12/20161214-130542.html,canoe.ca,2016-12-14,Canada,Vaseline/NAM/Vaseline,"Si  vous  souhaitez  suivre  cette  approche  subtile  ,  prenez  de  la Vaseline  et  étalez-en  doucement  sur  les  paupières  .",vaseline,nam,vaseline,la,le,DET,de,de,ADP,prenez,prendre,VERB,",",",",PUNCT,subtile,subtil,ADJ,et,et,CONJ,étalez-en,étalez-en,ADJ,doucement,doucement,ADV,sur,sur,ADP,les,le,DET,2016-12-14,2016,2010,ADP DET Vaseline CONJ ADJ,DET Vaseline CONJ,ADP DET Vaseline,VERB ADP DET Vaseline,PUNCT VERB ADP DET Vaseline,Vaseline CONJ ADJ,Vaseline CONJ ADJ ADV,Vaseline CONJ ADJ ADV ADP,de le Vaseline et étalez-en,le Vaseline et,de le Vaseline,prendre de le Vaseline,", prendre de le Vaseline",Vaseline et étalez-en,Vaseline et étalez-en doucement,Vaseline et étalez-en doucement sur
http://fr.canoe.ca/artdevivre/modebeaute/nouvelles/archives/2016/12/20161214-130542.html,canoe.ca,2016-12-14,Canada,Vaseline/NAM/Vaseline,"Encore  une  fois  ,  vous  pouvez  utiliser  de  la Vaseline  ou  un  autre  baume  gras  pour  la  finition  de  votre  look  .",vaseline,nam,vaseline,la,le,DET,de,de,ADP,utiliser,utiliser,VERB,pouvez,pouvoir,VERB,vous,vous,PRON,ou,ou,CONJ,un,un,DET,autre,autre,ADJ,baume,baume,NOUN,gras,gras,ADJ,2016-12-14,2016,2010,ADP DET Vaseline CONJ DET,DET Vaseline CONJ,ADP DET Vaseline,VERB ADP DET Vaseline,VERB VERB ADP DET Vaseline,Vaseline CONJ DET,Vaseline CONJ DET ADJ,Vaseline CONJ DET ADJ NOUN,de le Vaseline ou un,le Vaseline ou,de le Vaseline,utiliser de le Vaseline,pouvoir utiliser de le Vaseline,Vaseline ou un,Vaseline ou un autre,Vaseline ou un autre baume
http://www.jeuneafrique.com/384175/culture/maroc-web-series-de-hicham-lasri-dezinguent/,jeuneafrique.com,2016-12-16,United States,Vaseline/NAM/Vaseline,"""  Caca  Mind  ""  ,  ""  Bissara  Overdose  ""  ,  ""  No Vaseline  Fatwa  ""  ...",vaseline,nam,vaseline,No,No,NOUN,"""","""",PUNCT,",",",",PUNCT,"""","""",PUNCT,Overdose,Overdose,PROPN,Fatwa,Fatwa,PROPN,"""","""",PUNCT,...,...,PUNCT,,,,,,,2016-12-16,2016,2010,PUNCT NOUN Vaseline PROPN PUNCT,NOUN Vaseline PROPN,PUNCT NOUN Vaseline,PUNCT PUNCT NOUN Vaseline,PUNCT PUNCT PUNCT NOUN Vaseline,Vaseline PROPN PUNCT,Vaseline PROPN PUNCT PUNCT,,""" No Vaseline Fatwa """,No Vaseline Fatwa,""" No Vaseline",", "" No Vaseline",""" , "" No Vaseline","Vaseline Fatwa ""","Vaseline Fatwa "" ...",
http://www.jeuneafrique.com/384175/culture/maroc-web-series-de-hicham-lasri-dezinguent/,jeuneafrique.com,2016-12-16,United States,Vaseline/NAM/Vaseline,"Sa  précédente  web-série  ,  ""  No Vaseline  Fatwa  ""  ,  sortie  pendant  le  ramadan  et  dont  le  titre  est  inspiré  du  tube  du  groupe  de  rap  Ice  Cube  ,  comptabilise  plus  de  111  0  0  0  vues  sur  YouTube  .",vaseline,nam,vaseline,No,No,NOUN,"""","""",PUNCT,",",",",PUNCT,web-série,web-série,NOUN,précédente,précédent,ADJ,Fatwa,Fatwa,PROPN,"""","""",PUNCT,",",",",PUNCT,sortie,sortir,VERB,pendant,pendant,ADP,2016-12-16,2016,2010,PUNCT NOUN Vaseline PROPN PUNCT,NOUN Vaseline PROPN,PUNCT NOUN Vaseline,PUNCT PUNCT NOUN Vaseline,NOUN PUNCT PUNCT NOUN Vaseline,Vaseline PROPN PUNCT,Vaseline PROPN PUNCT PUNCT,Vaseline PROPN PUNCT PUNCT VERB,""" No Vaseline Fatwa """,No Vaseline Fatwa,""" No Vaseline",", "" No Vaseline","web-série , "" No Vaseline","Vaseline Fatwa ""","Vaseline Fatwa "" ,","Vaseline Fatwa "" , sortir"
http://www.sudouest.fr/2016/12/18/seche-ou-grasse-attention-a-votre-peau-3037511-4696.php#xtor%3DRSS-10521769,sudouest.fr,2016-12-18,France,vaseline/NOM/vaseline,"Les  peaux  sèches  ,  quant  à  elles  ,  utiliseront  pour  leur  toilette  de  la vaseline  ou  un  cold-cream  .",vaseline,nom,vaseline,la,le,DET,de,de,ADP,toilette,toilette,NOUN,leur,leur,DET,pour,pour,ADP,ou,ou,CONJ,un,un,DET,cold-cream,cold-cream,NOUN,.,.,PUNCT,,,,2016-12-18,2016,2010,ADP DET Vaseline CONJ DET,DET Vaseline CONJ,ADP DET Vaseline,NOUN ADP DET Vaseline,DET NOUN ADP DET Vaseline,Vaseline CONJ DET,Vaseline CONJ DET NOUN,Vaseline CONJ DET NOUN PUNCT,de le Vaseline ou un,le Vaseline ou,de le Vaseline,toilette de le Vaseline,leur toilette de le Vaseline,Vaseline ou un,Vaseline ou un cold-cream,Vaseline ou un cold-cream .
http://fr.ubergizmo.com/2016/12/21/decouvrez-segment-cable-sous-marin.html,ubergizmo.com,2016-12-21,===NONE===,vaseline/NOM/vaseline,Celle-ci  est  contenue  dans  un  tube  de  cuivre  ou  d'  aluminium  (  généralement  rempli  de vaseline  )  .,vaseline,nom,vaseline,de,de,ADP,rempli,remplir,VERB,généralement,généralement,ADV,(,(,PUNCT,aluminium,aluminium,NOUN,),),PUNCT,.,.,PUNCT,,,,,,,,,,2016-12-21,2016,2010,VERB ADP Vaseline PUNCT PUNCT,ADP Vaseline PUNCT,VERB ADP Vaseline,ADV VERB ADP Vaseline,PUNCT ADV VERB ADP Vaseline,Vaseline PUNCT PUNCT,,,remplir de Vaseline ) .,de Vaseline ),remplir de Vaseline,généralement remplir de Vaseline,( généralement remplir de Vaseline,Vaseline ) .,,
http://fr.ubergizmo.com/2016/12/21/decouvrez-segment-cable-sous-marin.html,ubergizmo.com,2016-12-21,===NONE===,Vaseline/NOM/vaseline, Vaseline  .  8  .,vaseline,nom,vaseline,,,,,,,,,,,,,,,,.,.,PUNCT,8,@card@,ADJ,.,.,PUNCT,,,,,,,2016-12-21,2016,2010,,,,,,Vaseline PUNCT ADJ,Vaseline PUNCT ADJ PUNCT,,,,,,,Vaseline . @card@,Vaseline . @card@ .,
http://telquel.ma/2016/12/19/caca-mind-nouvelle-serie-dhicham-lasri-pointe-les-incivilites-marocains_1527780,telquel.ma,2016-12-26,Morocco,Vaseline/NAM/Vaseline,"Habitué  du  genre  ,  Hicham  Lasri  ,  qui  compte  à  son  actif  plusieurs  web-séries  (  No Vaseline  Fatwa  ,  K  7  al  Rass  et  Bissara  Overdose  )  ,  confiait  lors  de  son  interrogatoire  pour  TelQuel  (  numéro  744  ,  disponible  en  kiosque  )  ,  son  attachement  pour  la  plate-forme  Web  :  ""  Internet  ,  c'  est  l'  avenir  ,  c'  est  la  jeunesse  .",vaseline,nam,vaseline,No,No,VERB,(,(,PUNCT,web-séries,web-séries,NOUN,plusieurs,plusieurs,PRON,actif,actif,ADJ,Fatwa,Fatwa,PROPN,",",",",PUNCT,K,K,PROPN,7,@card@,ADJ,al,al,NOUN,2016-12-26,2016,2010,PUNCT VERB Vaseline PROPN PUNCT,VERB Vaseline PROPN,PUNCT VERB Vaseline,NOUN PUNCT VERB Vaseline,PRON NOUN PUNCT VERB Vaseline,Vaseline PROPN PUNCT,Vaseline PROPN PUNCT PROPN,Vaseline PROPN PUNCT PROPN ADJ,"( No Vaseline Fatwa ,",No Vaseline Fatwa,( No Vaseline,web-séries ( No Vaseline,plusieurs web-séries ( No Vaseline,"Vaseline Fatwa ,","Vaseline Fatwa , K","Vaseline Fatwa , K @card@"
http://www.rfi.fr/afrique/20161228-afrique-sud-deces-celebre-criminel-ananias-mathe,rfi.fr,2016-12-28,France,Vaseline/NAM/Vaseline,"Surnommé  tour  à  tour  ""  Prison  Breaker  ""  ,  ""  King Vaseline  ""  ou  le  Houdini  de  C-Max  ...",vaseline,nam,vaseline,King,King,PROPN,"""","""",PUNCT,",",",",PUNCT,"""","""",PUNCT,Breaker,Breaker,PROPN,"""","""",PUNCT,ou,ou,CONJ,le,le,DET,Houdini,Houdini,NOUN,de,de,ADP,2016-12-28,2016,2010,PUNCT PROPN Vaseline PUNCT CONJ,PROPN Vaseline PUNCT,PUNCT PROPN Vaseline,PUNCT PUNCT PROPN Vaseline,PUNCT PUNCT PUNCT PROPN Vaseline,Vaseline PUNCT CONJ,Vaseline PUNCT CONJ DET,Vaseline PUNCT CONJ DET NOUN,""" King Vaseline "" ou","King Vaseline """,""" King Vaseline",", "" King Vaseline",""" , "" King Vaseline","Vaseline "" ou","Vaseline "" ou le","Vaseline "" ou le Houdini"
http://www.rfi.fr/afrique/20161228-afrique-sud-deces-celebre-criminel-ananias-mathe,rfi.fr,2016-12-28,France,vaseline/NOM/vaseline,"Après  être  parvenu  à  écarter  les  barreaux  de  sa  cellule  ,  le  criminel  s'  était  enduit  le  corps  de vaseline  pour  se  faufiler  dans  un  interstice  de  20  cm  sur  60  cm  ,  et  se  laisser  glisser  le  long  d'  une  corde  fabriquée  avec  ses  vêtements  et  ses  draps  .",vaseline,nom,vaseline,de,de,ADP,corps,corps,NOUN,le,le,DET,enduit,enduire,VERB,était,être,VERB,pour,pour,ADP,se,se,PRON,faufiler,faufiler,VERB,dans,dans,ADP,un,un,DET,2016-12-28,2016,2010,NOUN ADP Vaseline ADP PRON,ADP Vaseline ADP,NOUN ADP Vaseline,DET NOUN ADP Vaseline,VERB DET NOUN ADP Vaseline,Vaseline ADP PRON,Vaseline ADP PRON VERB,Vaseline ADP PRON VERB ADP,corps de Vaseline pour se,de Vaseline pour,corps de Vaseline,le corps de Vaseline,enduire le corps de Vaseline,Vaseline pour se,Vaseline pour se faufiler,Vaseline pour se faufiler dans
http://www.4-traders.com/UNILEVER-PLC-9590186/news/Unilever-s-offre-une-usine-pour-272-millions-de-dollars-a-Dubai-23622190/,4-traders.com,2016-12-29,===NONE===,Vaseline/NAM/Vaseline,"Les  principales  marques  qui  y  seront  produites  sont  Dove  ,  Fair  &  Lovely  ,  Lifebuoy  , Vaseline  ,  Clear  ,  TRESemmé  ,  and  Sunsilk  .",vaseline,nam,vaseline,",",",",PUNCT,Lifebuoy,Lifebuoy,PROPN,",",",",PUNCT,Lovely,Lovely,PROPN,&,&,SYM,",",",",PUNCT,Clear,Clear,PROPN,",",",",PUNCT,TRESemmé,TRESemmé,PROPN,",",",",PUNCT,2016-12-29,2016,2010,PROPN PUNCT Vaseline PUNCT PROPN,PUNCT Vaseline PUNCT,PROPN PUNCT Vaseline,PUNCT PROPN PUNCT Vaseline,PROPN PUNCT PROPN PUNCT Vaseline,Vaseline PUNCT PROPN,Vaseline PUNCT PROPN PUNCT,Vaseline PUNCT PROPN PUNCT PROPN,"Lifebuoy , Vaseline , Clear",", Vaseline ,","Lifebuoy , Vaseline",", Lifebuoy , Vaseline","Lovely , Lifebuoy , Vaseline","Vaseline , Clear","Vaseline , Clear ,","Vaseline , Clear , TRESemmé"
http://www.rts.ch/info/culture/spectacles/8274804-2017-sera-l-annee-de-la-deception-pour-moi-predit-thomas-wiesel.html?rts_source=rss_t,rts.ch,2016-12-30,Switzerland,vaseline/NOM/vaseline,"Face  à  des  nouvelles  souvent  difficiles  en  2016  ,  Thomas  Wiesel  se  voit  comme  un  pot  de  "" vaseline  qui  doit  aider  à  faire  passer  la  pilule  ""  de  l'  actualité  aux  Romands  ,  dit-il  tout  en  élégance  .",vaseline,nom,vaseline,"""","""",PUNCT,de,de,ADP,pot,pot,NOUN,un,un,DET,comme,comme,ADV,qui,qui,PRON,doit,devoir,VERB,aider,aider,VERB,à,à,ADP,faire,faire,VERB,2016-12-30,2016,2010,ADP PUNCT Vaseline PRON VERB,PUNCT Vaseline PRON,ADP PUNCT Vaseline,NOUN ADP PUNCT Vaseline,DET NOUN ADP PUNCT Vaseline,Vaseline PRON VERB,Vaseline PRON VERB VERB,Vaseline PRON VERB VERB ADP,"de "" Vaseline qui devoir",""" Vaseline qui","de "" Vaseline","pot de "" Vaseline","un pot de "" Vaseline",Vaseline qui devoir,Vaseline qui devoir aider,Vaseline qui devoir aider à
http://www.lamontagne.fr/puy-en-velay/art-de-vivre-bien-etre/haute-loire/2017/01/01/le-robinson-au-puy-en-velay-madame-rose-et-monsieur-georges-dit-monsieur-geo_12227679.html,lamontagne.fr,2017-01-01,France,vaseline/NOM/vaseline,"Repassage  ,  rouge  à  lèvres  ,  bas  ,  médicaments  , vaseline  ...",vaseline,nom,vaseline,",",",",PUNCT,médicaments,médicament,NOUN,",",",",PUNCT,bas,bas,ADV,",",",",PUNCT,...,...,PUNCT,,,,,,,,,,,,,2017-01-01,2017,2010,,PUNCT Vaseline PUNCT,NOUN PUNCT Vaseline,PUNCT NOUN PUNCT Vaseline,ADV PUNCT NOUN PUNCT Vaseline,,,,,", Vaseline ...","médicament , Vaseline",", médicament , Vaseline","bas , médicament , Vaseline",,,
