url,website,date,country,keyword,sentence,kw,kw_lemma,kw_pos,left_w1,left_l1,left_p1,left_w2,left_l2,left_p2,left_w3,left_l3,left_p3,left_w4,left_l4,left_p4,left_w5,left_l5,left_p5,right_w1,right_l1,right_p1,right_w2,right_l2,right_p2,right_w3,right_l3,right_p3,right_w4,right_l4,right_p4,right_w5,right_l5,right_p5,datetime,year,10years,pattern_around5,pattern_around3,pattern_left2,pattern_left3,pattern_left4,pattern_right2,pattern_right3,pattern_right4,pattern_around5_lex,pattern_around3_lex,pattern_left2_lex,pattern_left3_lex,pattern_left4_lex,pattern_right2_lex,pattern_right3_lex,pattern_right4_lex
http://www.rewmi.com/400-medicaments-cancerigenes-identifies.html,rewmi.com,2018-06-27,France,Primpéran/NAM/Primpéran,"Et  voici  la  liste  des  produits  ciblés  :  ''  De  nombreux  cosmétiques  pour  bébé  ;  des  crèmes  comme  la  Biafine  ;  de  nombreux  sirops  contre  la  toux  (  Clarix  ,  Codotussyl  ,  Drill  ,  Hexapneumine  ,  Humex  ,  Pectosan  ,  Rhinathiol  )  ;  des  pansements  gastriques  (  Maalox  ,  Gaviscon  )  ;  des  traitements  des  troubles  du  transit  intestinal  (  Motilium  )  ou  des  nausées  et  vomissements  ( Primpéran  )  ;  les  formes  en  suspension  buvable  de  médicaments  cardiovasculaires  (  Cozaar  ,  Vastarel  )  ou  antibiotiques  (  Josacine  ,  Zinnat  )  ;  des  médicaments  contre  la  douleur  et  la  fièvre  (  formes  génériques  d'  ibuprofène  et  de  paracétamol  )  ;  les  traitements  de  l'  asthénie  (  Sargenor  )  ;  sans  oublier  les  formes  génériques  de  ces  médicaments  ''  .",primpéran,nam,primpéran,(,(,PUNCT,vomissements,vomissement,NOUN,et,et,CONJ,nausées,nausée,NOUN,des,du,ADP DET,),),PUNCT,;,;,PUNCT,les,le,DET,formes,forme,NOUN,en,en,ADP,2018-06-27,2018,2010,NOUN PUNCT Primpéran PUNCT PUNCT,PUNCT Primpéran PUNCT,NOUN PUNCT Primpéran,CONJ NOUN PUNCT Primpéran,NOUN CONJ NOUN PUNCT Primpéran,Primpéran PUNCT PUNCT,Primpéran PUNCT PUNCT DET,Primpéran PUNCT PUNCT DET NOUN,vomissement ( Primpéran ) ;,( Primpéran ),vomissement ( Primpéran,et vomissement ( Primpéran,nausée et vomissement ( Primpéran,Primpéran ) ;,Primpéran ) ; le,Primpéran ) ; le forme
https://lille.maville.com/actu/actudet_-route-du-rhum.-le-medecin-des-skippers-sera-en-ligne-24-heures-sur-24_fil-3564993_actu.Htm?xtor=RSS-4,maville.com,2018-10-30,===NONE===,Primpéran/NAM/Primpéran,"Les  solutions  ?  ""  Prendre  du Primpéran  pour  éviter  la  nausée  ,  boire  du  Coca-cola  ,  du  jus  de  tomate  ...",primpéran,nam,primpéran,du,du,ADP DET,Prendre,prendre,VERB,"""","""",PUNCT,?,?,PUNCT,solutions,solution,NOUN,pour,pour,ADP,éviter,éviter,VERB,la,le,DET,nausée,nausée,NOUN,",",",",PUNCT,2018-10-30,2018,2010,VERB ADP DET Primpéran ADP VERB,ADP DET Primpéran ADP,VERB ADP DET Primpéran,PUNCT VERB ADP DET Primpéran,PUNCT PUNCT VERB ADP DET Primpéran,Primpéran ADP VERB,Primpéran ADP VERB DET,Primpéran ADP VERB DET NOUN,prendre du Primpéran pour éviter,du Primpéran pour,prendre du Primpéran,""" prendre du Primpéran","? "" prendre du Primpéran",Primpéran pour éviter,Primpéran pour éviter le,Primpéran pour éviter le nausée
https://lille.maville.com/sport/detail_-route-du-rhum.-les-derniers-commandements-de-doc-rousseau-aux-skippers_fil-3565516_actu.Htm?xtor=RSS-4,maville.com,2018-10-31,===NONE===,Primpéran/NAM/Primpéran,"En  médication  ,  privilégier  le  Vogalène  ou  le Primpéran  .",primpéran,nam,primpéran,le,le,DET,ou,ou,CONJ,Vogalène,Vogalène,PROPN,le,le,DET,privilégier,privilégier,VERB,.,.,PUNCT,,,,,,,,,,,,,2018-10-31,2018,2010,,DET Primpéran PUNCT,CONJ DET Primpéran,PROPN CONJ DET Primpéran,DET PROPN CONJ DET Primpéran,,,,,le Primpéran .,ou le Primpéran,Vogalène ou le Primpéran,le Vogalène ou le Primpéran,,,
https://redon.maville.com/actu/actudet_-route-du-rhum.-comment-font-les-marins-contre-le-mal-de-mer-_fil-3567960_actu.Htm?xtor=RSS-4,maville.com,2018-11-04,===NONE===,Primpéran/NAM/Primpéran,"Et  les  solutions  contre  le  mal  de  mer  ?  ""  Prendre  du Primpéran  ou  du  Vogalène  pour  éviter  la  nausée  ,  boire  du  Coca-cola  ,  du  jus  de  tomate  ,  mettre  du  sirop  dans  l'  eau  ...",primpéran,nam,primpéran,du,du,ADP DET,Prendre,prendre,VERB,"""","""",PUNCT,?,?,PUNCT,mer,mer,NOUN,ou,ou,CONJ,du,du,ADP DET,Vogalène,Vogalène,PROPN,pour,pour,ADP,éviter,éviter,VERB,2018-11-04,2018,2010,VERB ADP DET Primpéran CONJ ADP DET,ADP DET Primpéran CONJ,VERB ADP DET Primpéran,PUNCT VERB ADP DET Primpéran,PUNCT PUNCT VERB ADP DET Primpéran,Primpéran CONJ ADP DET,Primpéran CONJ ADP DET PROPN,Primpéran CONJ ADP DET PROPN ADP,prendre du Primpéran ou du,du Primpéran ou,prendre du Primpéran,""" prendre du Primpéran","? "" prendre du Primpéran",Primpéran ou du,Primpéran ou du Vogalène,Primpéran ou du Vogalène pour
http://www.slate.fr/story/178392/sante-medecine-grossesse-hyperemese-gravidique-femmes-enceintes-prise-en-charge,slate.fr,2019-06-14,France,Primpéran/NAM/Primpéran,"Il  préconise  d'  ""  arrêter  de  prescrire  du  Vogalène  et  du Primpéran  ,  inefficaces  dans  la  majorité  des  cas  face  à  cette  maladie  ,  [  de  ]  cesser  l'  hospitalisation  à  l'  isolement  ,  qui  ne  fait  que  renforcer  le  mal-être  des  patientes  .",primpéran,nam,primpéran,du,du,ADP DET,et,et,CONJ,Vogalène,Vogalène,PROPN,du,du,ADP DET,prescrire,prescrire,VERB,",",",",PUNCT,inefficaces,inefficace,ADJ,dans,dans,ADP,la,le,DET,majorité,majorité,NOUN,2019-06-14,2019,2010,CONJ ADP DET Primpéran PUNCT ADJ,ADP DET Primpéran PUNCT,CONJ ADP DET Primpéran,PROPN CONJ ADP DET Primpéran,ADP DET PROPN CONJ ADP DET Primpéran,Primpéran PUNCT ADJ,Primpéran PUNCT ADJ ADP,Primpéran PUNCT ADJ ADP DET,"et du Primpéran , inefficace","du Primpéran ,",et du Primpéran,Vogalène et du Primpéran,du Vogalène et du Primpéran,"Primpéran , inefficace","Primpéran , inefficace dans","Primpéran , inefficace dans le"
https://sante.journaldesfemmes.fr/magazine/1555133-motilium-interdit-domperidone-danger-posologie/,journaldesfemmes.fr,2019-07-01,France,Primpéran/NAM/Primpéran,"La  Haute  Autorité  de  Santé  rappelle  que  d'  autres  médicaments  permettent  de  soulager  les  nausées  et  vomissements  :  le  Vogalène  ®  et  ses  génériques  ,  à  base  de  métopimazine  ,  ou  le Primpéran  ®  et  ses  génériques  ,  à  base  de  métoclopramide  . </doc>",primpéran,nam,primpéran,le,le,DET,ou,ou,CONJ,",",",",PUNCT,métopimazine,métopimazine,NOUN,de,de,ADP,®,®,ADJ,et,et,CONJ,ses,son,DET,génériques,générique,NOUN,",",",",PUNCT,2019-07-01,2019,2010,CONJ DET Primpéran ADJ CONJ,DET Primpéran ADJ,CONJ DET Primpéran,PUNCT CONJ DET Primpéran,NOUN PUNCT CONJ DET Primpéran,Primpéran ADJ CONJ,Primpéran ADJ CONJ DET,Primpéran ADJ CONJ DET NOUN,ou le Primpéran ® et,le Primpéran ®,ou le Primpéran,", ou le Primpéran","métopimazine , ou le Primpéran",Primpéran ® et,Primpéran ® et son,Primpéran ® et son générique
https://www.bladi.net/maroc-chloroquine-protocole-therapeutique%2C66426.html,bladi.net,2020-03-24,===NONE===,Primpéran/NOM/Primpéran,"Les  médecins  recommandent  également  une  bonne  hydratation  et  un  régime  alimentaire  adapté  pendant  la  durée  du  traitement  ,  en  mettant  l'  accent  sur  les  produits  riches  en  vitamine  C.  Le  Paracétamol  est  indiqué  en  cas  de  fièvre  et  l'  antiémétique Primpéran  pour  les  vomissements  .",primpéran,nom,primpéran,antiémétique,antiémétique,ADJ,l',le,DET,et,et,CONJ,fièvre,fièvre,NOUN,de,de,ADP,pour,pour,ADP,les,le,DET,vomissements,vomissement,NOUN,.,.,PUNCT,,,,2020-03-24,2020,2020,DET ADJ Primpéran ADP DET,ADJ Primpéran ADP,DET ADJ Primpéran,CONJ DET ADJ Primpéran,NOUN CONJ DET ADJ Primpéran,Primpéran ADP DET,Primpéran ADP DET NOUN,Primpéran ADP DET NOUN PUNCT,le antiémétique Primpéran pour le,antiémétique Primpéran pour,le antiémétique Primpéran,et le antiémétique Primpéran,fièvre et le antiémétique Primpéran,Primpéran pour le,Primpéran pour le vomissement,Primpéran pour le vomissement .
https://lanationarabe.com/2020/08/11/pharmacie-le-cnop-condamne-des-manoeuvres-visant-a-contrecarrer-les-reformes-du-secteur/,lanationarabe.com,2020-08-11,===NONE===,Primpéran/NAM/Primpéran,"""  Le  pharmacien  m'  a  conseillé  de  donner  à  mon  mari  du Primpéran  ,  un  sirop  contre  les  vomissements  .",primpéran,nam,primpéran,du,du,ADP DET,mari,mari,NOUN,mon,mon,DET,à,à,ADP,donner,donner,VERB,",",",",PUNCT,un,un,DET,sirop,sirop,NOUN,contre,contre,ADP,les,le,DET,2020-08-11,2020,2020,NOUN ADP DET Primpéran PUNCT DET,ADP DET Primpéran PUNCT,NOUN ADP DET Primpéran,DET NOUN ADP DET Primpéran,ADP DET NOUN ADP DET Primpéran,Primpéran PUNCT DET,Primpéran PUNCT DET NOUN,Primpéran PUNCT DET NOUN ADP,"mari du Primpéran , un","du Primpéran ,",mari du Primpéran,mon mari du Primpéran,à mon mari du Primpéran,"Primpéran , un","Primpéran , un sirop","Primpéran , un sirop contre"
https://www.lexpress.fr/actualites/1/actualite/le-proces-des-attentats-de-janvier-2015-a-repris-apres-un-mois-d-interruption_2139881.html,lexpress.fr,2020-12-02,France,Primpéran/NAM/Primpéran,"Il  refuse  de  prendre  un  antivomitif  ,  le Primpéran  ,  le  médicament  le  plus  classique  .",primpéran,nam,primpéran,le,le,DET,",",",",PUNCT,antivomitif,antivomitif,ADJ,un,un,DET,prendre,prendre,VERB,",",",",PUNCT,le,le,DET,médicament,médicament,NOUN,le,le,DET,plus,plus,ADV,2020-12-02,2020,2020,PUNCT DET Primpéran PUNCT DET,DET Primpéran PUNCT,PUNCT DET Primpéran,ADJ PUNCT DET Primpéran,DET ADJ PUNCT DET Primpéran,Primpéran PUNCT DET,Primpéran PUNCT DET NOUN,Primpéran PUNCT DET NOUN DET,", le Primpéran , le","le Primpéran ,",", le Primpéran","antivomitif , le Primpéran","un antivomitif , le Primpéran","Primpéran , le","Primpéran , le médicament","Primpéran , le médicament le"
https://www.francetvinfo.fr/faits-divers/attaque-au-siege-de-charlie-hebdo/proces-des-attentats-de-janvier-2015-un-des-accuses-ali-riza-polat-vomit-dans-son-box-l-audience-se-poursuit_4203827.html,francetvinfo.fr,2020-12-02,France,Primpéran/NAM/Primpéran,"Du  côté  du  ministère  public  on  estime  que  ""  il  n'  y  a  aucune  contre-indication  à  la  prise  d'  un  traitement  ""  ,  le Primpéran  ,  que  l'  accusé  refuse  de  prendre  .",primpéran,nam,primpéran,le,le,DET,",",",",PUNCT,"""","""",PUNCT,traitement,traitement,NOUN,un,un,DET,",",",",PUNCT,que,que,CONJ,l',le,DET,accusé,accusé,NOUN,refuse,refuser,VERB,2020-12-02,2020,2020,PUNCT DET Primpéran PUNCT CONJ,DET Primpéran PUNCT,PUNCT DET Primpéran,PUNCT PUNCT DET Primpéran,NOUN PUNCT PUNCT DET Primpéran,Primpéran PUNCT CONJ,Primpéran PUNCT CONJ DET,Primpéran PUNCT CONJ DET NOUN,", le Primpéran , que","le Primpéran ,",", le Primpéran",""" , le Primpéran","traitement "" , le Primpéran","Primpéran , que","Primpéran , que le","Primpéran , que le accusé"
https://www.20minutes.fr/justice/2922415-20201202-attentat-janvier-2015-apres-mois-suspension-reprise-proces-emaillee-incidents,20minutes.fr,2020-12-02,France,Primpéran/NAM/Primpéran,"Un  traitement  au Primpéran  ,  un  anti-vomitif  classique  ,  a  été  préconisé  par  ce  soignant  mais  refusé  par  l'  accusé  .",primpéran,nam,primpéran,au,au,ADP DET,traitement,traitement,NOUN,Un,un,DET,,,,,,,",",",",PUNCT,un,un,DET,anti-vomitif,anti-vomitif,NOUN,classique,classique,ADJ,",",",",PUNCT,2020-12-02,2020,2020,NOUN ADP DET Primpéran PUNCT DET,ADP DET Primpéran PUNCT,NOUN ADP DET Primpéran,DET NOUN ADP DET Primpéran,,Primpéran PUNCT DET,Primpéran PUNCT DET NOUN,Primpéran PUNCT DET NOUN ADJ,"traitement au Primpéran , un","au Primpéran ,",traitement au Primpéran,un traitement au Primpéran,,"Primpéran , un","Primpéran , un anti-vomitif","Primpéran , un anti-vomitif classique"
https://www.lemonde.fr/societe/article/2020/12/02/emmenez-moi-a-l-hopital-reprise-chaotique-au-proces-des-attentats-de-janvier-2015_6061952_3224.html,lemonde.fr,2020-12-02,France,Primpéran/NAM/Primpéran,"On  y  apprend  que  M.  Polat  refuse  de  prendre  l'  anti-vomitif  basique  -  du Primpéran  -  que  lui  propose  le  médecin  car  il  ne  veut  ""  pas  servir  de  cobaye  ""  ,  mais  qu'  il  est  ""  apte  ""  à  retourner  au  tribunal  .",primpéran,nam,primpéran,du,du,ADP DET,-,-,PUNCT,basique,basique,ADJ,anti-vomitif,anti-vomitif,NOUN,l',le,DET,-,-,PUNCT,que,que,PRON,lui,lui,PRON,propose,proposer,VERB,le,le,DET,2020-12-02,2020,2020,PUNCT ADP DET Primpéran PUNCT PRON,ADP DET Primpéran PUNCT,PUNCT ADP DET Primpéran,ADJ PUNCT ADP DET Primpéran,NOUN ADJ PUNCT ADP DET Primpéran,Primpéran PUNCT PRON,Primpéran PUNCT PRON PRON,Primpéran PUNCT PRON PRON VERB,- du Primpéran - que,du Primpéran -,- du Primpéran,basique - du Primpéran,anti-vomitif basique - du Primpéran,Primpéran - que,Primpéran - que lui,Primpéran - que lui proposer
https://www.techno-science.net/glossaire-definition/Vomissement.html,techno-science.net,2021-01-13,===NONE===,Primpéran/NAM/Primpéran,"Il  y  a  des  risques  de  dyskinésies  neuroleptiques  précoces  (  trismus  ,  torticolis  spasmodiques  ,  crises  oculogyres  ...  )  sous Primpéran  chez  les  adultes  jeunes  .",primpéran,nam,primpéran,sous,sous,ADP,),),PUNCT,...,...,PUNCT,oculogyres,oculogyre,ADJ,crises,crise,NOUN,chez,chez,ADP,les,le,DET,adultes,adulte,NOUN,jeunes,jeune,ADJ,.,.,PUNCT,2021-01-13,2021,2020,PUNCT ADP Primpéran ADP DET,ADP Primpéran ADP,PUNCT ADP Primpéran,PUNCT PUNCT ADP Primpéran,ADJ PUNCT PUNCT ADP Primpéran,Primpéran ADP DET,Primpéran ADP DET NOUN,Primpéran ADP DET NOUN ADJ,) sous Primpéran chez le,sous Primpéran chez,) sous Primpéran,... ) sous Primpéran,oculogyre ... ) sous Primpéran,Primpéran chez le,Primpéran chez le adulte,Primpéran chez le adulte jeune
https://www.letelegramme.fr/cotes-darmor/plerin/interdiction-de-peche-sur-les-plages-plerinaises-pas-vu-le-panneau-03-03-2021-12713147.php?xtor=RSS-21,letelegramme.fr,2021-03-03,France,Primpéran/NAM/Primpéran,"Et  pour  faire  sa  fête  à  la  co  (  li  )  que  ,  certains  ont  la  recette  :  ""  On  prendra  un Primpéran  et  un  bon  coup  de  muscadet  !  ""  . </doc>",primpéran,nam,primpéran,un,un,DET,prendra,prendre,VERB,On,on,PRON,"""","""",PUNCT,:,:,PUNCT,et,et,CONJ,un,un,DET,bon,bon,ADJ,coup,coup,NOUN,de,de,ADP,2021-03-03,2021,2020,VERB DET Primpéran CONJ DET,DET Primpéran CONJ,VERB DET Primpéran,PRON VERB DET Primpéran,PUNCT PRON VERB DET Primpéran,Primpéran CONJ DET,Primpéran CONJ DET ADJ,Primpéran CONJ DET ADJ NOUN,prendre un Primpéran et un,un Primpéran et,prendre un Primpéran,on prendre un Primpéran,""" on prendre un Primpéran",Primpéran et un,Primpéran et un bon,Primpéran et un bon coup
http://www.slate.fr/societe/la-semaine-imaginaire/pierre-jean-chalencon,slate.fr,2021-04-10,France,Primpéran/NAM/Primpéran,Un  peu  comme  ce  flacon  en  format  familial  de Primpéran  bu  après  mon  dernier  brunch  chez  mon  grand  ami  qui  est  aussi  l'  ennemi  du  dressage  .,primpéran,nam,primpéran,de,de,ADP,familial,familial,ADJ,format,format,NOUN,en,en,ADP,flacon,flacon,NOUN,bu,boire,VERB,après,après,ADP,mon,mon,DET,dernier,dernier,ADJ,brunch,brunch,NOUN,2021-04-10,2021,2020,ADJ ADP Primpéran VERB ADP,ADP Primpéran VERB,ADJ ADP Primpéran,NOUN ADJ ADP Primpéran,ADP NOUN ADJ ADP Primpéran,Primpéran VERB ADP,Primpéran VERB ADP DET,Primpéran VERB ADP DET ADJ,familial de Primpéran boire après,de Primpéran boire,familial de Primpéran,format familial de Primpéran,en format familial de Primpéran,Primpéran boire après,Primpéran boire après mon,Primpéran boire après mon dernier
