url,website,date,country,keyword,sentence,kw,kw_lemma,kw_pos,left_w1,left_l1,left_p1,left_w2,left_l2,left_p2,left_w3,left_l3,left_p3,left_w4,left_l4,left_p4,left_w5,left_l5,left_p5,right_w1,right_l1,right_p1,right_w2,right_l2,right_p2,right_w3,right_l3,right_p3,right_w4,right_l4,right_p4,right_w5,right_l5,right_p5,datetime,year,10years,pattern_around5,pattern_around3,pattern_left2,pattern_left3,pattern_left4,pattern_right2,pattern_right3,pattern_right4,pattern_around5_lex,pattern_around3_lex,pattern_left2_lex,pattern_left3_lex,pattern_left4_lex,pattern_right2_lex,pattern_right3_lex,pattern_right4_lex
https://www.lopinion.fr/edition/wsj/reseaux-sociaux-lil-miquela-influenceuse-virtuelle-business-bien-reel-172038,lopinion.fr,2018-12-16,France,Ugg/NAM/Ugg,"Miquela  Sousa  ,  qui  a  récemment  orné  des  panneaux  publicitaires  de  Londres  au  Japon  dans  le  cadre  d'  une  campagne  publicitaire  d' Ugg  ,  coche  toutes  les  cases  d'  un  modèle  du  moment  :  elle  est  exotique  ,  attrayante  et  très  suivie  sur  Instagram  .",ugg,nam,ugg,d',de,ADP,publicitaire,publicitaire,ADJ,campagne,campagne,NOUN,une,un,DET,d',de,ADP,",",",",PUNCT,coche,cocher,VERB,toutes,tout,PRON,les,le,DET,cases,case,NOUN,2018-12-16,2018,2010,ADJ ADP Ugg PUNCT VERB,ADP Ugg PUNCT,ADJ ADP Ugg,NOUN ADJ ADP Ugg,DET NOUN ADJ ADP Ugg,Ugg PUNCT VERB,Ugg PUNCT VERB PRON,Ugg PUNCT VERB PRON DET,"publicitaire de Ugg , cocher","de Ugg ,",publicitaire de Ugg,campagne publicitaire de Ugg,un campagne publicitaire de Ugg,"Ugg , cocher","Ugg , cocher tout","Ugg , cocher tout le"
https://www.lemonde.fr/m-styles/article/2018/12/18/noel-une-histoire-sans-fin_5399083_4497319.html,lemonde.fr,2018-12-18,France,Ugg/NAM/Ugg,"Dans  l'  éternel  dilemme  des  grands  magasins  quant  à  leur  indépendance  ,  le  Printemps  a  fait  le  choix  des  marques  :  quatre  des  neuf  vitrines  sont  sponsorisées  par  des  griffes  assez  diverses  -  Canada  Goose  donc  mais  aussi  Dyson  ,  Häagen-Dazs  et Ugg  .",ugg,nam,ugg,et,et,CONJ,Häagen-Dazs,Häagen-Dazs,PROPN,",",",",PUNCT,Dyson,Dyson,PROPN,aussi,aussi,ADV,.,.,PUNCT,,,,,,,,,,,,,2018-12-18,2018,2010,,CONJ Ugg PUNCT,PROPN CONJ Ugg,PUNCT PROPN CONJ Ugg,PROPN PUNCT PROPN CONJ Ugg,,,,,et Ugg .,Häagen-Dazs et Ugg,", Häagen-Dazs et Ugg","Dyson , Häagen-Dazs et Ugg",,,
https://www.journaldesfemmes.fr/mode/shopping-mode/2424572-accessoires-grand-froid-automne-hiver-2018-2019-selection/,journaldesfemmes.fr,2018-12-19,France,UGG/NAM/UGG,"Si  cela  vous  semble  peu  affriolant  ,  vous  changerez  d'  avis  en  admirant  les  sublimes  gants  en  velours  de  C  &  A  ou  bien  en  adoptant  le  douillet  cache-oreilles  que  propose UGG  .",ugg,nam,ugg,propose,proposer,VERB,que,que,PRON,cache-oreilles,cache-oreilles,NOUN,douillet,douillet,ADJ,le,le,DET,.,.,PUNCT,,,,,,,,,,,,,2018-12-19,2018,2010,,VERB Ugg PUNCT,PRON VERB Ugg,NOUN PRON VERB Ugg,ADJ NOUN PRON VERB Ugg,,,,,proposer Ugg .,que proposer Ugg,cache-oreilles que proposer Ugg,douillet cache-oreilles que proposer Ugg,,,
https://lnt.ma/vallee-village-a-paris-plan-shopping-a-decouvrir/,lnt.ma,2018-12-20,Morocco,UGG/NAM/UGG,"Roberto  Cavalli  ,  Jimmy  Choo  ,  Burberry  ,  Ralph  Lauren  , UGG  ,  Diesel  ,  Tommy  Hilfiger  ,  Hackett  ,  Villeroy  &  Boch  ,  Lalique  ...  en  plus  des  plus  belles  boutiques  de  l'  avenue  Montaigne  à  Paris  ,  il  y  en  a  pour  tous  les  goûts  !  Femmes  ,  hommes  et  enfants  ,  tous  y  trouveront  leur  compte  .",ugg,nam,ugg,",",",",PUNCT,Lauren,Lauren,PROPN,Ralph,Ralph,PROPN,",",",",PUNCT,Burberry,Burberry,PROPN,",",",",PUNCT,Diesel,Diesel,PROPN,",",",",PUNCT,Tommy,Tommy,PROPN,Hilfiger,Hilfiger,PROPN,2018-12-20,2018,2010,PROPN PUNCT Ugg PUNCT PROPN,PUNCT Ugg PUNCT,PROPN PUNCT Ugg,PROPN PROPN PUNCT Ugg,PUNCT PROPN PROPN PUNCT Ugg,Ugg PUNCT PROPN,Ugg PUNCT PROPN PUNCT,Ugg PUNCT PROPN PUNCT PROPN,"Lauren , Ugg , Diesel",", Ugg ,","Lauren , Ugg","Ralph Lauren , Ugg",", Ralph Lauren , Ugg","Ugg , Diesel","Ugg , Diesel ,","Ugg , Diesel , Tommy"
https://www.femmeactuelle.fr/mode/coach-mode/bottines-fourrees-5-facons-de-les-porter-avec-style-cet-hiver-2073187,femmeactuelle.fr,2018-12-26,France,UGG/NAM/UGG,"Inspirées  de  la  tendance UGG  ,  ces  chaussures  ont  su  se  faire  une  place  de  marque  dans  les  pieds  des  modeuses  .",ugg,nam,ugg,tendance,tendance,NOUN,la,le,DET,de,de,ADP,Inspirées,inspirer,VERB,,,,",",",",PUNCT,ces,ce,PRON,chaussures,chaussure,NOUN,ont,avoir,VERB,su,savoir,VERB,2018-12-26,2018,2010,DET NOUN Ugg PUNCT PRON,NOUN Ugg PUNCT,DET NOUN Ugg,ADP DET NOUN Ugg,VERB ADP DET NOUN Ugg,Ugg PUNCT PRON,Ugg PUNCT PRON NOUN,Ugg PUNCT PRON NOUN VERB,"le tendance Ugg , ce","tendance Ugg ,",le tendance Ugg,de le tendance Ugg,inspirer de le tendance Ugg,"Ugg , ce","Ugg , ce chaussure","Ugg , ce chaussure avoir"
http://www.courrier-picard.fr/159071/article/2019-01-08/un-important-reseau-de-contrefacon-demantele-amiens,courrier-picard.fr,2019-01-08,France,UGG/NAM/UGG,"Dans  la  foulée  ,  ils  ont  procédé  à  une  perquisition  du  domicile  où  ils  ont  mis  la  main  sur  de  nombreux  vêtements  et  objets  de  contrefaçon  :  plus  de  200  paires  de  chaussures  et  plus  de  180  vêtements  de  marques  Nike  ,  Adidas  ,  Asics  , UGG  ,  Louboutin  ,  Gucci  ,  Hugo  Boss  ,  etc  .",ugg,nam,ugg,",",",",PUNCT,Asics,Asics,PROPN,",",",",PUNCT,Adidas,Adidas,PROPN,",",",",PUNCT,",",",",PUNCT,Louboutin,Louboutin,PROPN,",",",",PUNCT,Gucci,Gucci,PROPN,",",",",PUNCT,2019-01-08,2019,2010,PROPN PUNCT Ugg PUNCT PROPN,PUNCT Ugg PUNCT,PROPN PUNCT Ugg,PUNCT PROPN PUNCT Ugg,PROPN PUNCT PROPN PUNCT Ugg,Ugg PUNCT PROPN,Ugg PUNCT PROPN PUNCT,Ugg PUNCT PROPN PUNCT PROPN,"Asics , Ugg , Louboutin",", Ugg ,","Asics , Ugg",", Asics , Ugg","Adidas , Asics , Ugg","Ugg , Louboutin","Ugg , Louboutin ,","Ugg , Louboutin , Gucci"
https://www.20minutes.fr/arts-stars/people/2411451-20190109-demi-frere-meghan-markle-invite-mariage-fillettes-clan-kardashian-recoivent-sacs-louis-vuitton#xtor%3DRSS-149,20minutes.fr,2019-01-09,France,UGG/NAM/UGG,Lil  Wayne  vit  depuis  près  de  dix  ans  une  belle  histoire  d'  amour  avec  les  chaussures UGG  .,ugg,nam,ugg,chaussures,chaussure,NOUN,les,le,DET,avec,avec,ADP,amour,amour,NOUN,d',de,ADP,.,.,PUNCT,,,,,,,,,,,,,2019-01-09,2019,2010,,NOUN Ugg PUNCT,DET NOUN Ugg,ADP DET NOUN Ugg,NOUN ADP DET NOUN Ugg,,,,,chaussure Ugg .,le chaussure Ugg,avec le chaussure Ugg,amour avec le chaussure Ugg,,,
https://www.20minutes.fr/arts-stars/people/2411451-20190109-demi-frere-meghan-markle-invite-mariage-fillettes-clan-kardashian-recoivent-sacs-louis-vuitton#xtor%3DRSS-149,20minutes.fr,2019-01-09,France,UGG/NAM/UGG,"Le  rappeur  a  assuré  le  show  lors  de  la  mi-temps  des  matchs  de  football  disputés  au  collège  d'  ESPN  et  portait  des UGG  noires  en  cuissardes  nées  d'  une  collaboration  entre  la  marque  australienne  et  Y  /  Project  ,  leur  valeur  est  de  1.400  dollars  . </doc>",ugg,nam,ugg,des,du,ADP DET,portait,porter,VERB,et,et,CONJ,ESPN,ESPN,PROPN,d',de,ADP,noires,noir,ADJ,en,en,ADP,cuissardes,cuissardes,NOUN,nées,naître,VERB,d',de,ADP,2019-01-09,2019,2010,VERB ADP DET Ugg ADJ ADP,ADP DET Ugg ADJ,VERB ADP DET Ugg,CONJ VERB ADP DET Ugg,PROPN CONJ VERB ADP DET Ugg,Ugg ADJ ADP,Ugg ADJ ADP NOUN,Ugg ADJ ADP NOUN VERB,porter du Ugg noir en,du Ugg noir,porter du Ugg,et porter du Ugg,ESPN et porter du Ugg,Ugg noir en,Ugg noir en cuissardes,Ugg noir en cuissardes naître
http://www.lefigaro.fr/mode-homme/2019/01/11/30007-20190111ARTFIG00028-glenn-martens-revelateur-de-yproject.php,lefigaro.fr,2019-01-11,France,UGG/NAM/UGG,"L'  année  dernière  ,  la  marque  a  été  approchée  par  les  bottes UGG  pour  nouer  une  collaboration  mondiale  .",ugg,nam,ugg,bottes,botte,NOUN,les,le,DET,par,par,ADP,approchée,approcher,VERB,été,être,VERB,pour,pour,CONJ,nouer,nouer,VERB,une,un,DET,collaboration,collaboration,NOUN,mondiale,mondial,ADJ,2019-01-11,2019,2010,DET NOUN Ugg CONJ VERB,NOUN Ugg CONJ,DET NOUN Ugg,ADP DET NOUN Ugg,VERB ADP DET NOUN Ugg,Ugg CONJ VERB,Ugg CONJ VERB DET,Ugg CONJ VERB DET NOUN,le botte Ugg pour nouer,botte Ugg pour,le botte Ugg,par le botte Ugg,approcher par le botte Ugg,Ugg pour nouer,Ugg pour nouer un,Ugg pour nouer un collaboration
https://www.femmeactuelle.fr/mode/tendance-mode/mode-hiver-les-10-pieces-incontournables-du-moment-a-avoir-dans-son-placard-2073724,femmeactuelle.fr,2019-01-11,France,UGG/NAM/UGG,"Rebelote  cet  hiver  avec  les  néo  bottines  de  montagne  ,  qui  surfent  sur  le  succès  des  bottes  fourrées  façon UGG  .",ugg,nam,ugg,façon,façon,NOUN,fourrées,fourrer,VERB,bottes,botte,NOUN,des,du,ADP DET,succès,succès,NOUN,.,.,PUNCT,,,,,,,,,,,,,2019-01-11,2019,2010,,NOUN Ugg PUNCT,VERB NOUN Ugg,NOUN VERB NOUN Ugg,ADP DET NOUN VERB NOUN Ugg,,,,,façon Ugg .,fourrer façon Ugg,botte fourrer façon Ugg,du botte fourrer façon Ugg,,,
http://www.lefigaro.fr/mode-homme/2019/01/17/30007-20190117ARTFIG00026-collections-hommes-la-caution-de-paris.php,lefigaro.fr,2019-01-17,France,UGG/NAM/UGG,"Imper  en  Nylon  parachute  façon  blouse  de  labo  ,  pantalon  large  orange  D.D.E  et  pardessus  bleu  électrique  ,  boots UGG  revues  et  corrigées  en  des  chaussures  de  chantier  ...",ugg,nam,ugg,boots,boots,NOUN,",",",",PUNCT,électrique,électrique,ADJ,bleu,bleu,ADJ,pardessus,pardessus,NOUN,revues,revoir,VERB,et,et,CONJ,corrigées,corriger,VERB,en,en,ADP,des,du,ADP DET,2019-01-17,2019,2010,PUNCT NOUN Ugg VERB CONJ,NOUN Ugg VERB,PUNCT NOUN Ugg,ADJ PUNCT NOUN Ugg,ADJ ADJ PUNCT NOUN Ugg,Ugg VERB CONJ,Ugg VERB CONJ VERB,Ugg VERB CONJ VERB ADP,", boots Ugg revoir et",boots Ugg revoir,", boots Ugg","électrique , boots Ugg","bleu électrique , boots Ugg",Ugg revoir et,Ugg revoir et corriger,Ugg revoir et corriger en
https://next.liberation.fr/mode/2019/01/17/la-mode-hommes-en-service-continu_1703327?xtor=rss-450,liberation.fr,2019-01-17,France,Ugg/NAM/Ugg,"La  collection  mixte  de  Preston  était  ponctuée  de  vestes  et  survestes  de  travail  à  poches  larges  ,  d'  un  jogging  orange  flashy  ,  de  pulls  au  col  élargi  ,  de  godillots  dorés  ,  et  de Ugg  (  une  collaboration  est  attendue  cet  été  )  .",ugg,nam,ugg,de,de,ADP,et,et,CONJ,",",",",PUNCT,dorés,dorer,VERB,godillots,godillot,NOUN,(,(,PUNCT,une,un,DET,collaboration,collaboration,NOUN,est,être,VERB,attendue,attendre,VERB,2019-01-17,2019,2010,CONJ ADP Ugg PUNCT DET,ADP Ugg PUNCT,CONJ ADP Ugg,PUNCT CONJ ADP Ugg,VERB PUNCT CONJ ADP Ugg,Ugg PUNCT DET,Ugg PUNCT DET NOUN,Ugg PUNCT DET NOUN VERB,et de Ugg ( un,de Ugg (,et de Ugg,", et de Ugg","dorer , et de Ugg",Ugg ( un,Ugg ( un collaboration,Ugg ( un collaboration être
https://www.laprovence.com/article/femina-provence/5358196/mode-gucci-marque-la-plus-tendance-de-la-fin-de-lannee-2018.html,laprovence.com,2019-02-06,France,Ugg/NAM/Ugg,"On  retrouve  les  baskets  V  10  de  Veja  en  troisième  place  ,  les  baskets  Chain  Reaction  de  Versace  en  cinquième  position  ,  et  les  pantoufles  Fluff  Yeah  de  la  marque Ugg  en  sixième  place  .",ugg,nam,ugg,marque,marque,NOUN,la,le,DET,de,de,ADP,Yeah,Yeah,PROPN,Fluff,Fluff,PROPN,en,en,ADP,sixième,sixième,ADJ,place,place,NOUN,.,.,PUNCT,,,,2019-02-06,2019,2010,DET NOUN Ugg ADP ADJ,NOUN Ugg ADP,DET NOUN Ugg,ADP DET NOUN Ugg,PROPN ADP DET NOUN Ugg,Ugg ADP ADJ,Ugg ADP ADJ NOUN,Ugg ADP ADJ NOUN PUNCT,le marque Ugg en sixième,marque Ugg en,le marque Ugg,de le marque Ugg,Yeah de le marque Ugg,Ugg en sixième,Ugg en sixième place,Ugg en sixième place .
https://viacomit.net/2019/02/10/campagne-ugg-x-bape-mettant-vedette-lil-wayne/,viacomit.net,2019-02-10,===NONE===,UGG/NAM/UGG,<doc uri=https://viacomit.net/2019/02/10/campagne-ugg-x-bape-mettant-vedette-lil-wayne/ website=viacomit.net date=2019-02-10 source_country=> /campagne/NOM UGG  x  BAPE  mettant  en  vedette  Lil  Wayne,ugg,nam,ugg,Campagne,campagne,NOUN,,,,,,,,,,,,,x,x,VERB,BAPE,BAPE,NOUN,mettant,mettre,VERB,en,en,ADP,vedette,vedette,NOUN,2019-02-10,2019,2010,,NOUN Ugg VERB,,,,Ugg VERB NOUN,Ugg VERB NOUN VERB,Ugg VERB NOUN VERB ADP,,campagne Ugg x,,,,Ugg x BAPE,Ugg x BAPE mettre,Ugg x BAPE mettre en
https://viacomit.net/2019/02/10/campagne-ugg-x-bape-mettant-vedette-lil-wayne/,viacomit.net,2019-02-10,===NONE===,UGG/NAM/UGG," UGG  ,  marque  basée  dans  le  sud  de  la  Californie  et  la  marque  de  Tokyo  BAPE  dévoilent  ensemble  une  campagne  mondiale  dont  l'  égérie  n'  est  autre  que  l'  artiste  que  Lil  Wayne  .",ugg,nam,ugg,,,,,,,,,,,,,,,,",",",",PUNCT,marque,marquer,VERB,basée,baser,VERB,dans,dans,ADP,le,le,DET,2019-02-10,2019,2010,,,,,,Ugg PUNCT VERB,Ugg PUNCT VERB VERB,Ugg PUNCT VERB VERB ADP,,,,,,"Ugg , marquer","Ugg , marquer baser","Ugg , marquer baser dans"
https://viacomit.net/2019/02/10/campagne-ugg-x-bape-mettant-vedette-lil-wayne/,viacomit.net,2019-02-10,===NONE===,UGG/NAM/UGG,"La  collaboration  Printemps  /  Été  2019 UGG  x  BAPE  ,  qui  a  été  révélée  à  la  fin  de  l'  année  dernière  à  l'  occasion  du  25  ème  Anniversaire  de  BAPE  ,  propose  une  sélection  de  modèles  bestsellers  pour  Homme  UGG  dotés  de  l'  imprimé  camouflage  BAPE  .",ugg,nam,ugg,2019,@card@,ADJ,Été,été,NOUN,/,,,Printemps,Printemps,PROPN,collaboration,collaboration,NOUN,x,x,VERB,BAPE,BAPE,PROPN,",",",",PUNCT,qui,qui,PRON,a,avoir,VERB,2019-02-10,2019,2010,NOUN ADJ Ugg VERB PROPN,ADJ Ugg VERB,NOUN ADJ Ugg,,,Ugg VERB PROPN,Ugg VERB PROPN PUNCT,Ugg VERB PROPN PUNCT PRON,été @card@ Ugg x BAPE,@card@ Ugg x,été @card@ Ugg,,,Ugg x BAPE,"Ugg x BAPE ,","Ugg x BAPE , qui"
https://viacomit.net/2019/02/10/campagne-ugg-x-bape-mettant-vedette-lil-wayne/,viacomit.net,2019-02-10,===NONE===,UGG/NAM/UGG,"La  collaboration  Printemps  /  Été  2019  UGG  x  BAPE  ,  qui  a  été  révélée  à  la  fin  de  l'  année  dernière  à  l'  occasion  du  25  ème  Anniversaire  de  BAPE  ,  propose  une  sélection  de  modèles  bestsellers  pour  Homme UGG  dotés  de  l'  imprimé  camouflage  BAPE  .",ugg,nam,ugg,Homme,Homme,PROPN,pour,pour,ADP,bestsellers,bestsellers,NOUN,modèles,modèle,NOUN,de,de,ADP,dotés,doter,VERB,de,de,ADP,l',le,DET,imprimé,imprimé,ADJ,camouflage,camouflage,NOUN,2019-02-10,2019,2010,ADP PROPN Ugg VERB ADP,PROPN Ugg VERB,ADP PROPN Ugg,NOUN ADP PROPN Ugg,NOUN NOUN ADP PROPN Ugg,Ugg VERB ADP,Ugg VERB ADP DET,Ugg VERB ADP DET ADJ,pour Homme Ugg doter de,Homme Ugg doter,pour Homme Ugg,bestsellers pour Homme Ugg,modèle bestsellers pour Homme Ugg,Ugg doter de,Ugg doter de le,Ugg doter de le imprimé
https://viacomit.net/2019/02/10/campagne-ugg-x-bape-mettant-vedette-lil-wayne/,viacomit.net,2019-02-10,===NONE===,UGG/NAM/UGG,"La  campagne UGG  x  BAPE  a  été  shootée  par  le  photographe  Neil  Favila  basé  à  Los  Angeles  dans  une  résidence  privée  de  Miami  ,  et  produite  par  l'  agence  Go  Atticus  .",ugg,nam,ugg,campagne,campagne,NOUN,La,le,DET,,,,,,,,,,x,x,VERB,BAPE,BAPE,PROPN,a,avoir,VERB,été,être,VERB,shootée,shooter,VERB,2019-02-10,2019,2010,DET NOUN Ugg VERB PROPN,NOUN Ugg VERB,DET NOUN Ugg,,,Ugg VERB PROPN,Ugg VERB PROPN VERB,Ugg VERB PROPN VERB VERB,le campagne Ugg x BAPE,campagne Ugg x,le campagne Ugg,,,Ugg x BAPE,Ugg x BAPE avoir,Ugg x BAPE avoir être
https://viacomit.net/2019/02/10/campagne-ugg-x-bape-mettant-vedette-lil-wayne/,viacomit.net,2019-02-10,===NONE===,UGG/NAM/UGG,La  collection UGG  x  BAPE  est  disponible  dans  les  boutiques  BAPE  à  travers  le  monde  . </doc>,ugg,nam,ugg,collection,collection,NOUN,La,le,DET,,,,,,,,,,x,x,VERB,BAPE,BAPE,PROPN,est,être,VERB,disponible,disponible,ADJ,dans,dans,ADP,2019-02-10,2019,2010,DET NOUN Ugg VERB PROPN,NOUN Ugg VERB,DET NOUN Ugg,,,Ugg VERB PROPN,Ugg VERB PROPN VERB,Ugg VERB PROPN VERB ADJ,le collection Ugg x BAPE,collection Ugg x,le collection Ugg,,,Ugg x BAPE,Ugg x BAPE être,Ugg x BAPE être disponible
https://www.lexpress.fr/styles/mode/mode-chez-chloe-l-ascension-de-natacha-ramsay-levy_2062070.html,lexpress.fr,2019-02-14,France,UGG/NAM/UGG,"""  Entre  les  baskets  et  les UGG  ,  on  ne  voit  presque  plus  de  chaussures  en  cuir  dans  la  ville  :  cela  donne  à  réfléchir  quand  on  est  créateur  sur  les  attentes  de  ce  marché  qui  représente  50  ?  %  de  la  consommation  mondiale  de  mode  !  """,ugg,nam,ugg,les,le,DET,et,et,CONJ,baskets,basket,NOUN,les,le,DET,Entre,entre,ADP,",",",",PUNCT,on,on,PRON,ne,ne,ADV,voit,voir,VERB,presque,presque,ADV,2019-02-14,2019,2010,CONJ DET Ugg PUNCT PRON,DET Ugg PUNCT,CONJ DET Ugg,NOUN CONJ DET Ugg,DET NOUN CONJ DET Ugg,Ugg PUNCT PRON,Ugg PUNCT PRON ADV,Ugg PUNCT PRON ADV VERB,"et le Ugg , on","le Ugg ,",et le Ugg,basket et le Ugg,le basket et le Ugg,"Ugg , on","Ugg , on ne","Ugg , on ne voir"
https://www.laprovence.com/article/femina-provence/5371126/ugg-sassocie-a-eckhaus-latta-pour-lautomne-2019.html,laprovence.com,2019-02-15,France,UGG/NAM/UGG,<doc uri=https://www.laprovence.com/article/femina-provence/5371126/ugg-sassocie-a-eckhaus-latta-pour-lautomne-2019.html website=laprovence.com date=2019-02-15 source_country=France> UGG  s'  associe  à  Eckhaus  Latta  pour  l'  automne  2019,ugg,nam,ugg,,,,,,,,,,,,,,,,s',se,PRON,associe,associer,VERB,à,à,ADP,Eckhaus,Eckhaus,NOUN,Latta,Latta,PROPN,2019-02-15,2019,2010,,,,,,Ugg PRON VERB,Ugg PRON VERB ADP,Ugg PRON VERB ADP NOUN,,,,,,Ugg se associer,Ugg se associer à,Ugg se associer à Eckhaus
https://www.laprovence.com/article/femina-provence/5371126/ugg-sassocie-a-eckhaus-latta-pour-lautomne-2019.html,laprovence.com,2019-02-15,France,UGG/NAM/UGG,La  marque UGG  annonce  le  lancement  d'  une  collaboration  avec  la  marque  de  mode  américaine  Eckhaus  Latta  pour  la  saison  automne-hiver  2019  .,ugg,nam,ugg,marque,marque,NOUN,La,le,DET,,,,,,,,,,annonce,annoncer,VERB,le,le,DET,lancement,lancement,NOUN,d',de,ADP,une,un,DET,2019-02-15,2019,2010,DET NOUN Ugg VERB DET,NOUN Ugg VERB,DET NOUN Ugg,,,Ugg VERB DET,Ugg VERB DET NOUN,Ugg VERB DET NOUN ADP,le marque Ugg annoncer le,marque Ugg annoncer,le marque Ugg,,,Ugg annoncer le,Ugg annoncer le lancement,Ugg annoncer le lancement de
https://www.laprovence.com/article/femina-provence/5371126/ugg-sassocie-a-eckhaus-latta-pour-lautomne-2019.html,laprovence.com,2019-02-15,France,UGG/NAM/UGG,Les  collaborations  se  suivent  mais  ne  se  ressemblent  pas  chez UGG  .,ugg,nam,ugg,chez,chez,ADP,pas,pas,ADV,ressemblent,ressembler,VERB,se,se,PRON,ne,ne,ADV,.,.,PUNCT,,,,,,,,,,,,,2019-02-15,2019,2010,,ADP Ugg PUNCT,ADV ADP Ugg,VERB ADV ADP Ugg,PRON VERB ADV ADP Ugg,,,,,chez Ugg .,pas chez Ugg,ressembler pas chez Ugg,se ressembler pas chez Ugg,,,
https://www.laprovence.com/article/femina-provence/5371126/ugg-sassocie-a-eckhaus-latta-pour-lautomne-2019.html,laprovence.com,2019-02-15,France,UGG/NAM/UGG,"A  la  clé  ?  Une  collection  de  chaussures  ,  parfois  inspirée  des  modèles  emblématiques  de UGG  ,  mais  également  une  série  de  manteaux  .",ugg,nam,ugg,de,de,ADP,emblématiques,emblématique,ADJ,modèles,modèle,NOUN,des,du,ADP DET,inspirée,inspirer,VERB,",",",",PUNCT,mais,mais,CONJ,également,également,ADV,une,un,DET,série,série,NOUN,2019-02-15,2019,2010,ADJ ADP Ugg PUNCT CONJ,ADP Ugg PUNCT,ADJ ADP Ugg,NOUN ADJ ADP Ugg,ADP DET NOUN ADJ ADP Ugg,Ugg PUNCT CONJ,Ugg PUNCT CONJ ADV,Ugg PUNCT CONJ ADV DET,"emblématique de Ugg , mais","de Ugg ,",emblématique de Ugg,modèle emblématique de Ugg,du modèle emblématique de Ugg,"Ugg , mais","Ugg , mais également","Ugg , mais également un"
https://www.laprovence.com/article/femina-provence/5371126/ugg-sassocie-a-eckhaus-latta-pour-lautomne-2019.html,laprovence.com,2019-02-15,France,UGG/NAM/UGG,"""  Nous  aimons  le  fait  que  les  produits UGG  incarnent  un  lifestyle  si  décontracté  et  qu'  ils  sont  passés  du  statut  de  produit  casual  à  celui  d'  icône  de  mode  .",ugg,nam,ugg,produits,produit,NOUN,les,le,DET,que,que,CONJ,fait,fait,NOUN,le,le,DET,incarnent,incarner,VERB,un,un,DET,lifestyle,lifestyle,NOUN,si,si,ADV,décontracté,décontracter,VERB,2019-02-15,2019,2010,DET NOUN Ugg VERB DET,NOUN Ugg VERB,DET NOUN Ugg,CONJ DET NOUN Ugg,NOUN CONJ DET NOUN Ugg,Ugg VERB DET,Ugg VERB DET NOUN,Ugg VERB DET NOUN ADV,le produit Ugg incarner un,produit Ugg incarner,le produit Ugg,que le produit Ugg,fait que le produit Ugg,Ugg incarner un,Ugg incarner un lifestyle,Ugg incarner un lifestyle si
https://www.laprovence.com/article/femina-provence/5371126/ugg-sassocie-a-eckhaus-latta-pour-lautomne-2019.html,laprovence.com,2019-02-15,France,UGG/NAM/UGG,"Un  modèle  de  bottes  ,  inspiré  de  la  Classic  de UGG  ,  et  un  modèle  de  chaussons  complètent  cette  sélection  de  chaussures  .",ugg,nam,ugg,de,de,ADP,Classic,Classic,PROPN,la,le,DET,de,de,ADP,inspiré,inspirer,VERB,",",",",PUNCT,et,et,CONJ,un,un,DET,modèle,modèle,NOUN,de,de,ADP,2019-02-15,2019,2010,PROPN ADP Ugg PUNCT CONJ,ADP Ugg PUNCT,PROPN ADP Ugg,DET PROPN ADP Ugg,ADP DET PROPN ADP Ugg,Ugg PUNCT CONJ,Ugg PUNCT CONJ DET,Ugg PUNCT CONJ DET NOUN,"Classic de Ugg , et","de Ugg ,",Classic de Ugg,le Classic de Ugg,de le Classic de Ugg,"Ugg , et","Ugg , et un","Ugg , et un modèle"
https://www.lexpress.fr/styles/relooking/comment-avoir-chaud-aux-pieds-sans-moon-boots_1206841.html,lexpress.fr,2019-02-21,France,UGG/NAM/UGG,"Après  toutes  ces  précautions  ,  si  vous  craignez  encore  pour  vos  orteils  ,  offrez-vous  des UGG  ou  des  souliers  avec  des  semelles  de  crêpe  ,  moins  élégantes  mais  bien  plus  isolantes  que  les  semelles  de  cuir  ,  et  craquez  pour  des  chaussures  fourrées  jusqu'  à  la  semelle  (  la  fourrure-déco  autour  de  la  cheville  ne  sert  pas  à  grand  chose  si  ce  n'  est  à  faire  joli  !  )  .",ugg,nam,ugg,des,du,ADP DET,offrez-vous,offrez-vous,NOUN,",",",",PUNCT,orteils,orteil,NOUN,vos,votre,DET,ou,ou,CONJ,des,du,ADP DET,souliers,soulier,NOUN,avec,avec,ADP,des,du,ADP DET,2019-02-21,2019,2010,NOUN ADP DET Ugg CONJ ADP DET,ADP DET Ugg CONJ,NOUN ADP DET Ugg,PUNCT NOUN ADP DET Ugg,NOUN PUNCT NOUN ADP DET Ugg,Ugg CONJ ADP DET,Ugg CONJ ADP DET NOUN,Ugg CONJ ADP DET NOUN ADP,offrez-vous du Ugg ou du,du Ugg ou,offrez-vous du Ugg,", offrez-vous du Ugg","orteil , offrez-vous du Ugg",Ugg ou du,Ugg ou du soulier,Ugg ou du soulier avec
http://www.lefigaro.fr/mode-homme/blundstone-les-boots-de-tasmanie-debarquent-en-france-20190320,lefigaro.fr,2019-03-20,France,Ugg/NAM/Ugg,"Il  y  avait  les Ugg  (  des  surfeurs  )  ,  les  Birkenstock  (  du  corps  médical  )  ,  les  Dr  .",ugg,nam,ugg,les,le,DET,avait,avoir,VERB,y,y,PRON,Il,Il,PROPN,,,,(,(,PUNCT,des,du,ADP DET,surfeurs,surfeur,NOUN,),),PUNCT,",",",",PUNCT,2019-03-20,2019,2010,VERB DET Ugg PUNCT ADP DET,DET Ugg PUNCT,VERB DET Ugg,PRON VERB DET Ugg,PROPN PRON VERB DET Ugg,Ugg PUNCT ADP DET,Ugg PUNCT ADP DET NOUN,Ugg PUNCT ADP DET NOUN PUNCT,avoir le Ugg ( du,le Ugg (,avoir le Ugg,y avoir le Ugg,Il y avoir le Ugg,Ugg ( du,Ugg ( du surfeur,Ugg ( du surfeur )
https://fr.allafrica.com/stories/201904230200.html,allafrica.com,2019-04-23,===NONE===,UGG/NAM/UGG,"Dans  son  compte  twiter  ,  il  dit  avoir  appris  avec  tristesse  et  consternation  l'  attaque  des  cliniques  de  l' UGG  à  Butembo  .",ugg,nam,ugg,l',le,DET,de,de,ADP,cliniques,clinique,NOUN,des,du,ADP DET,attaque,attaque,NOUN,à,à,ADP,Butembo,Butembo,PROPN,.,.,PUNCT,,,,,,,2019-04-23,2019,2010,ADP DET Ugg ADP PROPN,DET Ugg ADP,ADP DET Ugg,NOUN ADP DET Ugg,ADP DET NOUN ADP DET Ugg,Ugg ADP PROPN,Ugg ADP PROPN PUNCT,,de le Ugg à Butembo,le Ugg à,de le Ugg,clinique de le Ugg,du clinique de le Ugg,Ugg à Butembo,Ugg à Butembo .,
http://www.slate.fr/story/176088/mode-hybridation-creation-recyclage-melange-genres,slate.fr,2019-04-24,France,UGG/NAM/UGG,"En  accessoires  ,  sa  collaboration  avec  les  bottes UGG  les  augmentait  d'  un  anachronique  talon  .",ugg,nam,ugg,bottes,botte,NOUN,les,le,DET,avec,avec,ADP,collaboration,collaboration,NOUN,sa,son,DET,les,la|le,PRON,augmentait,augmenter,VERB,d',de,ADP,un,un,DET,anachronique,anachronique,ADJ,2019-04-24,2019,2010,DET NOUN Ugg PRON VERB,NOUN Ugg PRON,DET NOUN Ugg,ADP DET NOUN Ugg,NOUN ADP DET NOUN Ugg,Ugg PRON VERB,Ugg PRON VERB ADP,Ugg PRON VERB ADP DET,le botte Ugg la|le augmenter,botte Ugg la|le,le botte Ugg,avec le botte Ugg,collaboration avec le botte Ugg,Ugg la|le augmenter,Ugg la|le augmenter de,Ugg la|le augmenter de un
https://www.lapresse.ca/debats/chroniques/marie-claude-lortie/201905/08/01-5225295-westmount-est-dans-la-rue.php,lapresse.ca,2019-05-09,Canada,Ugg/NAM/Ugg,"Même  l'  adresse  montréalaise  de  la  marque  américaine Ugg  ,  naguère  culte  ,  a  quitté  la  rue  et  c'  est  maintenant  une  boutique  Zadig  &  Voltaire  ,  autre  grande  enseigne  ,  cette  fois  française  ,  qui  a  pris  sa  place  . </doc>",ugg,nam,ugg,américaine,américain,ADJ,marque,marque,NOUN,la,le,DET,de,de,ADP,montréalaise,montréalaise,ADJ,",",",",PUNCT,naguère,naguère,ADV,culte,culte,NOUN,",",",",PUNCT,a,avoir,VERB,2019-05-09,2019,2010,NOUN ADJ Ugg PUNCT ADV,ADJ Ugg PUNCT,NOUN ADJ Ugg,DET NOUN ADJ Ugg,ADP DET NOUN ADJ Ugg,Ugg PUNCT ADV,Ugg PUNCT ADV NOUN,Ugg PUNCT ADV NOUN PUNCT,"marque américain Ugg , naguère","américain Ugg ,",marque américain Ugg,le marque américain Ugg,de le marque américain Ugg,"Ugg , naguère","Ugg , naguère culte","Ugg , naguère culte ,"
