url,website,date,country,keyword,sentence,kw,kw_lemma,kw_pos,left_w1,left_l1,left_p1,left_w2,left_l2,left_p2,left_w3,left_l3,left_p3,left_w4,left_l4,left_p4,left_w5,left_l5,left_p5,right_w1,right_l1,right_p1,right_w2,right_l2,right_p2,right_w3,right_l3,right_p3,right_w4,right_l4,right_p4,right_w5,right_l5,right_p5,datetime,year,10years,pattern_around5,pattern_around3,pattern_left2,pattern_left3,pattern_left4,pattern_right2,pattern_right3,pattern_right4,pattern_around5_lex,pattern_around3_lex,pattern_left2_lex,pattern_left3_lex,pattern_left4_lex,pattern_right2_lex,pattern_right3_lex,pattern_right4_lex
https://www.capital.fr/entreprises-marches/eurazeo-lactif-net-reevalue-a-augmente-de-4-2-en-2018-1330710,capital.fr,2019-03-08,France,Desigual/NAM/Desigual,"-  Forte  diversification  à  la  fois  entre  actifs  cotés  et  non  cotés  ,  répartis  entre  :  Eurazeo  capital  ,  axé  sur  les  entreprises  de  plus  de  150  à  200  M  €  de  valorisation  (  52  %  de  l'  ANR  à  fin  2016  )  :  Asmodée  ,  CPK  , Desigual  ,  Elis  ,  Europcar  ,  Fintrax  ,  Iberchem  ,  les  Petits  Chaperons  rouges  ,  Moncler  ,  Neovia  ,  Novacap  ,  Sommet  Education  ,  Trader  Interactive  ,  Worldstrides  /  Eurazeo  PME  ,  pour  les  valeurs  d'  entreprise  inférieures  à  150  /  200  M  €  (  9  %  de  l'  ANR  )  :  AssurCopro  ,  Dessange  ,  IntechMedical  ,  Léon  de  Bruxelles  ,  MKDirect  ,  Orolia  ,  Peters  Surgical  ,  Redspher  ,  Smile  ,  Vignal  Lighting  /  Eurazeo  croissance  ,  investi  dans  les  ""  leaders  de  demain  ""  :  Contentsquare  ,  acquis  début  2018  ,  Doctolib  ,  Farfetch  ,  IES  Synergy  ,",desigual,nam,desigual,",",",",PUNCT,CPK,CPK,PROPN,",",",",PUNCT,Asmodée,Asmodée,PROPN,:,:,PUNCT,",",",",PUNCT,Elis,Elis,PROPN,",",",",PUNCT,Europcar,Europcar,PROPN,",",",",PUNCT,2019-03-08,2019,2010,PROPN PUNCT Desigual PUNCT PROPN,PUNCT Desigual PUNCT,PROPN PUNCT Desigual,PUNCT PROPN PUNCT Desigual,PROPN PUNCT PROPN PUNCT Desigual,Desigual PUNCT PROPN,Desigual PUNCT PROPN PUNCT,Desigual PUNCT PROPN PUNCT PROPN,"CPK , Desigual , Elis",", Desigual ,","CPK , Desigual",", CPK , Desigual","Asmodée , CPK , Desigual","Desigual , Elis","Desigual , Elis ,","Desigual , Elis , Europcar"
https://www.lesechos.fr/finance-marches/banque-assurances/0600860515719-transforme-eurazeo-veut-poursuivre-lacceleration-de-2018-2250826.php#xtor%3DRSS-2009,lesechos.fr,2019-03-08,France,Desigual/NAM/Desigual,"Le  groupe  a  mené  pour  3,1  milliards  d'  euros  de  cessions  ,  dont  Asmodee  , Desigual  ou  sa  participation  dans  Accor  .  Dans  le  même  temps  ,  il  a  également  consacré  3,1  milliards  d'  euros  à  des  acquisitions  (  comme  l'  assureur  français  Albingia  )  ou  à  des  réinvestissements  .",desigual,nam,desigual,",",",",PUNCT,Asmodee,Asmodee,PROPN,dont,dont,PRON,",",",",PUNCT,cessions,cession,NOUN,ou,ou,CONJ,sa,son,DET,participation,participation,NOUN,dans,dans,ADP,Accor,Accor,PROPN,2019-03-08,2019,2010,PROPN PUNCT Desigual CONJ DET,PUNCT Desigual CONJ,PROPN PUNCT Desigual,PRON PROPN PUNCT Desigual,PUNCT PRON PROPN PUNCT Desigual,Desigual CONJ DET,Desigual CONJ DET NOUN,Desigual CONJ DET NOUN ADP,"Asmodee , Desigual ou son",", Desigual ou","Asmodee , Desigual","dont Asmodee , Desigual",", dont Asmodee , Desigual",Desigual ou son,Desigual ou son participation,Desigual ou son participation dans
https://www.franceinter.fr/emissions/tanguy-pastureau-maltraite-l-info/tanguy-pastureau-maltraite-l-info-18-mars-2019,franceinter.fr,2019-03-18,France,Desigual/ADJ/Desigual,"Moi  non  plus  ,  parce  que  ce  sont  les  pires  professions  au  monde  ,  même  les  top-models  embauchés  par Desigual  pour  porter  leurs  fringues  à  fleurs  à  gros  pistils  ,  quand  habillé  comme  ça  vous  croisez  Stéphane  Marie  de  Silence  ça  Pousse  ,  celui-ci  essaie  de  vous  bouturer  ,  ont  une  vie  plus  sympa  .",desigual,adj,desigual,par,par,ADP,embauchés,embaucher,VERB,top-models,top-models,NOUN,les,le,DET,même,même,ADV,pour,pour,ADP,porter,porter,VERB,leurs,leur,DET,fringues,fringues,NOUN,à,à,ADP,2019-03-18,2019,2010,VERB ADP Desigual ADP VERB,ADP Desigual ADP,VERB ADP Desigual,NOUN VERB ADP Desigual,DET NOUN VERB ADP Desigual,Desigual ADP VERB,Desigual ADP VERB DET,Desigual ADP VERB DET NOUN,embaucher par Desigual pour porter,par Desigual pour,embaucher par Desigual,top-models embaucher par Desigual,le top-models embaucher par Desigual,Desigual pour porter,Desigual pour porter leur,Desigual pour porter leur fringues
https://www.lesechos.fr/idees-debats/crible/0600937826975-eurazeomoncler-doudoune-olympique-2254032.php#xtor%3DRSS-145,lesechos.fr,2019-03-20,France,Desigual/NAM/Desigual,"La  Bourse  en  oubliera  d'autant  plus  facilement  le  revers  d'  Eurazeo  dans Desigual  ,  la  chaîne  de  prêt-à-porter  espagnol  (  vendue  à  0,5  fois  l'  investissement  initial  )  ,  satisfaite  de  pouvoir  être  un  tremplin  pour  une  entreprise  en  croissance  .",desigual,nam,desigual,dans,dans,ADP,Eurazeo,Eurazeo,PROPN,d',de,ADP,revers,revers,NOUN,le,le,DET,",",",",PUNCT,la,le,DET,chaîne,chaîne,NOUN,de,de,ADP,prêt-à-porter,prêt-à-porter,NOUN,2019-03-20,2019,2010,PROPN ADP Desigual PUNCT DET,ADP Desigual PUNCT,PROPN ADP Desigual,ADP PROPN ADP Desigual,NOUN ADP PROPN ADP Desigual,Desigual PUNCT DET,Desigual PUNCT DET NOUN,Desigual PUNCT DET NOUN ADP,"Eurazeo dans Desigual , le","dans Desigual ,",Eurazeo dans Desigual,de Eurazeo dans Desigual,revers de Eurazeo dans Desigual,"Desigual , le","Desigual , le chaîne","Desigual , le chaîne de"
https://www.laprovence.com/article/femina-provence/5430533/jean-paul-goude-quitte-la-direction-artistique-de-desigual.html,laprovence.com,2019-03-27,France,Desigual/ADJ/Desigual,<doc uri=https://www.laprovence.com/article/femina-provence/5430533/jean-paul-goude-quitte-la-direction-artistique-de-desigual.html website=laprovence.com date=2019-03-27 source_country=France> /Jean-Paul/NAM /Goude/NAM /quitter/VER:pres /le/DET:ART /direction/NOM /artistique/ADJ /de/PRP Desigual ,desigual,adj,desigual,de,de,ADP,artistique,artistique,ADJ,direction,direction,NOUN,la,le,DET,quitte,quitter,VERB,,,,,,,,,,,,,,,,2019-03-27,2019,2010,,,ADJ ADP Desigual,NOUN ADJ ADP Desigual,DET NOUN ADJ ADP Desigual,,,,,,artistique de Desigual,direction artistique de Desigual,le direction artistique de Desigual,,,
https://www.laprovence.com/article/femina-provence/5430533/jean-paul-goude-quitte-la-direction-artistique-de-desigual.html,laprovence.com,2019-03-27,France,Desigual/ADJ/Desigual,"La  marque Desigual  et  le  photographe  et  illustrateur  Jean-Paul  Goude  s'  apprêtent  à  prendre  des  chemins  différents  ,  révèle  le  site  FashionNetwork  .  com  .",desigual,adj,desigual,marque,marque,NOUN,La,le,DET,,,,,,,,,,et,et,CONJ,le,le,DET,photographe,photographe,NOUN,et,et,CONJ,illustrateur,illustrateur,NOUN,2019-03-27,2019,2010,DET NOUN Desigual CONJ DET,NOUN Desigual CONJ,DET NOUN Desigual,,,Desigual CONJ DET,Desigual CONJ DET NOUN,Desigual CONJ DET NOUN CONJ,le marque Desigual et le,marque Desigual et,le marque Desigual,,,Desigual et le,Desigual et le photographe,Desigual et le photographe et
https://www.laprovence.com/article/femina-provence/5430533/jean-paul-goude-quitte-la-direction-artistique-de-desigual.html,laprovence.com,2019-03-27,France,Desigual/NAM/Desigual,"Célèbre  pour  son  travail  pour  le  magazine  Esquire  ,  ses  nombreuses  illustrations  et  logos  ,  et  ses  mythiques  campagnes  publicitaires  ,  Jean-Paul  Goude  avait  créé  la  surprise  au  cours  de  l'  été  2017  devenant  le  nouveau  directeur  artistique  de Desigual  .",desigual,nam,desigual,de,de,ADP,artistique,artistique,ADJ,directeur,directeur,NOUN,nouveau,nouveau,ADJ,le,le,DET,.,.,PUNCT,,,,,,,,,,,,,2019-03-27,2019,2010,,ADP Desigual PUNCT,ADJ ADP Desigual,NOUN ADJ ADP Desigual,ADJ NOUN ADJ ADP Desigual,,,,,de Desigual .,artistique de Desigual,directeur artistique de Desigual,nouveau directeur artistique de Desigual,,,
https://www.laprovence.com/article/femina-provence/5430533/jean-paul-goude-quitte-la-direction-artistique-de-desigual.html,laprovence.com,2019-03-27,France,Desigual/ADJ/Desigual,"Ce  partenariat  hors-norme  prend  fin  aujourd  '  hui  ,  sans  savoir  si  la  marque Desigual  fera  appel  à  un  nouveau  directeur  créatif  pour  prendre  en  charge  ses  futures  collections  .",desigual,adj,desigual,marque,marque,NOUN,la,le,DET,si,si,CONJ,savoir,savoir,VERB,sans,sans,ADP,fera,faire,VERB,appel,appel,NOUN,à,à,ADP,un,un,DET,nouveau,nouveau,ADJ,2019-03-27,2019,2010,DET NOUN Desigual VERB NOUN,NOUN Desigual VERB,DET NOUN Desigual,CONJ DET NOUN Desigual,VERB CONJ DET NOUN Desigual,Desigual VERB NOUN,Desigual VERB NOUN ADP,Desigual VERB NOUN ADP DET,le marque Desigual faire appel,marque Desigual faire,le marque Desigual,si le marque Desigual,savoir si le marque Desigual,Desigual faire appel,Desigual faire appel à,Desigual faire appel à un
https://www.franceinter.fr/emissions/tanguy-pastureau-maltraite-l-info/tanguy-pastureau-maltraite-l-info-01-avril-2019,franceinter.fr,2019-04-01,France,Desigual/ADJ/Desigual,"J'  ai  remis  play  sur  la  vidéo  ,  2  ème  scène  ,  Arielle  arrive  à  Barcelone  ,  cette  ville  maudite  qui  s'  est  déjà  récupérée  Manuel  Valls  +  tous  nos  étudiants  en  Erasmus  bourrés  qui  portent  des  shorts  ,  voilà  que  maintenant  ils  se  coltinent  Dombasle  ,  je  pense  que  Dieu  punit  cet  endroit  ,  le  fondateur  de  la  ville  devait  forniquer  avec  Belzébuth  ,  ou  la  1  ère  boutique Desigual  au  monde  a  ouvert  là  ,  enfin  un  truc  qui  mérite  une  punition  divine  ,  invasion  de  criquets  ,  épidémie  de  typhus  ou  arrivée  d'  Arielle  Dombasle  à  l'  aéroport  .",desigual,adj,desigual,boutique,boutiquer,VERB,ère,ère,NOUN,1,@card@,ADJ,la,le,DET,ou,ou,CONJ,au,au,ADP DET,monde,monde,NOUN,a,avoir,VERB,ouvert,ouvrir,VERB,là,là,ADV,2019-04-01,2019,2010,NOUN VERB Desigual ADP DET NOUN,VERB Desigual ADP DET,NOUN VERB Desigual,ADJ NOUN VERB Desigual,DET ADJ NOUN VERB Desigual,Desigual ADP DET NOUN,Desigual ADP DET NOUN VERB,Desigual ADP DET NOUN VERB VERB,ère boutiquer Desigual au monde,boutiquer Desigual au,ère boutiquer Desigual,@card@ ère boutiquer Desigual,le @card@ ère boutiquer Desigual,Desigual au monde,Desigual au monde avoir,Desigual au monde avoir ouvrir
https://www.capital.fr/entreprises-marches/eurazeo-growth-prend-une-participation-minoritaire-dans-manomano-1333829,capital.fr,2019-04-02,France,Desigual/NAM/Desigual,"-  Forte  diversification  à  la  fois  entre  actifs  cotés  et  non  cotés  ,  répartis  entre  :  Eurazeo  capital  ,  axé  sur  les  entreprises  de  plus  de  150  à  200  M  €  de  valorisation  (  52  %  de  l'  ANR  à  fin  2016  )  :  Asmodée  ,  CPK  , Desigual  ,  Elis  ,  Europcar  ,  Fintrax  ,  Iberchem  ,  les  Petits  Chaperons  rouges  ,  Moncler  ,  Neovia  ,  Novacap  ,  Sommet  Education  ,  Trader  Interactive  ,  Worldstrides  /  Eurazeo  PME  ,  pour  les  valeurs  d'  entreprise  inférieures  à  150  /  200  M  €  (  9  %  de  l'  ANR  )  :  AssurCopro  ,  Dessange  ,  IntechMedical  ,  Léon  de  Bruxelles  ,  MKDirect  ,  Orolia  ,  Peters  Surgical  ,  Redspher  ,  Smile  ,  Vignal  Lighting  /  Eurazeo  croissance  ,  investi  dans  les  ""  leaders  de  demain  ""  :  Contentsquare  ,  acquis  début  2018  ,  Doctolib  ,  Farfetch  ,  IES  Synergy  ,",desigual,nam,desigual,",",",",PUNCT,CPK,CPK,PROPN,",",",",PUNCT,Asmodée,Asmodée,PROPN,:,:,PUNCT,",",",",PUNCT,Elis,Elis,PROPN,",",",",PUNCT,Europcar,Europcar,PROPN,",",",",PUNCT,2019-04-02,2019,2010,PROPN PUNCT Desigual PUNCT PROPN,PUNCT Desigual PUNCT,PROPN PUNCT Desigual,PUNCT PROPN PUNCT Desigual,PROPN PUNCT PROPN PUNCT Desigual,Desigual PUNCT PROPN,Desigual PUNCT PROPN PUNCT,Desigual PUNCT PROPN PUNCT PROPN,"CPK , Desigual , Elis",", Desigual ,","CPK , Desigual",", CPK , Desigual","Asmodée , CPK , Desigual","Desigual , Elis","Desigual , Elis ,","Desigual , Elis , Europcar"
https://www.laprovence.com/article/femina-provence/5449158/isamaya-ffrench-rejoint-christian-louboutin-beaute.html,laprovence.com,2019-04-08,France,Desigual/NAM/Desigual,"French  ,  qui  a  collaboré  avec  Gucci  , Desigual  ou  encore  Vivienne  Westwood  ,  a  été  ambassadrice  d'  YSL  Beauté  ,  ainsi  que  rédactrice  beauté  chez  i-D  Magazine  . </doc>",desigual,nam,desigual,",",",",PUNCT,Gucci,Gucci,PROPN,avec,avec,ADP,collaboré,collaborer,VERB,a,avoir,VERB,ou,ou,CONJ,encore,encore,ADV,Vivienne,Vivienne,PROPN,Westwood,Westwood,PROPN,",",",",PUNCT,2019-04-08,2019,2010,PROPN PUNCT Desigual CONJ ADV,PUNCT Desigual CONJ,PROPN PUNCT Desigual,ADP PROPN PUNCT Desigual,VERB ADP PROPN PUNCT Desigual,Desigual CONJ ADV,Desigual CONJ ADV PROPN,Desigual CONJ ADV PROPN PROPN,"Gucci , Desigual ou encore",", Desigual ou","Gucci , Desigual","avec Gucci , Desigual","collaborer avec Gucci , Desigual",Desigual ou encore,Desigual ou encore Vivienne,Desigual ou encore Vivienne Westwood
https://www.laprovence.com/article/femina-provence/5450393/desigual-reedite-des-pieces-concues-par-christian-lacroix-depuis-2011.html,laprovence.com,2019-04-09,France,Desigual/NAM/Desigual,<doc uri=https://www.laprovence.com/article/femina-provence/5450393/desigual-reedite-des-pieces-concues-par-christian-lacroix-depuis-2011.html website=laprovence.com date=2019-04-09 source_country=France> Desigual  réédite  des  pièces  conçues  par  Christian  Lacroix  depuis  2011,desigual,nam,desigual,,,,,,,,,,,,,,,,réédite,rééditer,VERB,des,du,ADP DET,pièces,pièce,NOUN,conçues,concevoir,VERB,par,par,ADP,2019-04-09,2019,2010,,,,,,Desigual VERB ADP DET,Desigual VERB ADP DET NOUN,Desigual VERB ADP DET NOUN VERB,,,,,,Desigual rééditer du,Desigual rééditer du pièce,Desigual rééditer du pièce concevoir
https://www.laprovence.com/article/femina-provence/5450393/desigual-reedite-des-pieces-concues-par-christian-lacroix-depuis-2011.html,laprovence.com,2019-04-09,France,Desigual/ADJ/Desigual,La  marque  de  prêt-à-porter Desigual  célèbre  huit  années  de  collaboration  régulière  avec  Christian  Lacroix  avec  une  capsule  exclusive  de  pièces  imaginées  par  le  designer  et  grand  couturier  français  depuis  2011  .,desigual,adj,desigual,prêt-à-porter,prêt-à-porter,NOUN,de,de,ADP,marque,marque,NOUN,La,le,DET,,,,célèbre,célébrer,VERB,huit,huit,ADJ,années,année,NOUN,de,de,ADP,collaboration,collaboration,NOUN,2019-04-09,2019,2010,ADP NOUN Desigual VERB ADJ,NOUN Desigual VERB,ADP NOUN Desigual,NOUN ADP NOUN Desigual,DET NOUN ADP NOUN Desigual,Desigual VERB ADJ,Desigual VERB ADJ NOUN,Desigual VERB ADJ NOUN ADP,de prêt-à-porter Desigual célébrer huit,prêt-à-porter Desigual célébrer,de prêt-à-porter Desigual,marque de prêt-à-porter Desigual,le marque de prêt-à-porter Desigual,Desigual célébrer huit,Desigual célébrer huit année,Desigual célébrer huit année de
https://www.laprovence.com/article/femina-provence/5450393/desigual-reedite-des-pieces-concues-par-christian-lacroix-depuis-2011.html,laprovence.com,2019-04-09,France,Desigual/ADJ/Desigual,A  découvrir  dans  une  sélection  de  magasins Desigual  et  en  ligne  sur  www.desigual.com  .,desigual,adj,desigual,magasins,magasin,NOUN,de,de,ADP,sélection,sélection,NOUN,une,un,DET,dans,dans,ADP,et,et,CONJ,en,en,ADP,ligne,ligne,NOUN,sur,sur,ADP,www.desigual.com,www.desigual.com,NOUN,2019-04-09,2019,2010,ADP NOUN Desigual CONJ ADP,NOUN Desigual CONJ,ADP NOUN Desigual,NOUN ADP NOUN Desigual,DET NOUN ADP NOUN Desigual,Desigual CONJ ADP,Desigual CONJ ADP NOUN,Desigual CONJ ADP NOUN ADP,de magasin Desigual et en,magasin Desigual et,de magasin Desigual,sélection de magasin Desigual,un sélection de magasin Desigual,Desigual et en,Desigual et en ligne,Desigual et en ligne sur
https://www.laprovence.com/article/femina-provence/5450393/desigual-reedite-des-pieces-concues-par-christian-lacroix-depuis-2011.html,laprovence.com,2019-04-09,France,www.desigual.com/NOM/www.desigual.com,A  découvrir  dans  une  sélection  de  magasins  Desigual  et  en  ligne  sur www.desigual.com  .,www.desigual.com,nom,www.desigual.com,sur,sur,ADP,ligne,ligne,NOUN,en,en,ADP,et,et,CONJ,Desigual,Desigual,ADJ,.,.,PUNCT,,,,,,,,,,,,,2019-04-09,2019,2010,,ADP Desigual PUNCT,NOUN ADP Desigual,ADP NOUN ADP Desigual,CONJ ADP NOUN ADP Desigual,,,,,sur Desigual .,ligne sur Desigual,en ligne sur Desigual,et en ligne sur Desigual,,,
https://www.laprovence.com/article/femina-provence/5450393/desigual-reedite-des-pieces-concues-par-christian-lacroix-depuis-2011.html,laprovence.com,2019-04-09,France,Desigual/NAM/Desigual,"Entre Desigual  et  Christian  Lacroix  ,  c'  est  une  histoire  qui  dure  .",desigual,nam,desigual,Entre,entre,ADP,,,,,,,,,,,,,et,et,CONJ,Christian,Christian,PROPN,Lacroix,Lacroix,PROPN,",",",",PUNCT,c',ce,PRON,2019-04-09,2019,2010,,ADP Desigual CONJ,,,,Desigual CONJ PROPN,Desigual CONJ PROPN PROPN,Desigual CONJ PROPN PROPN PUNCT,,entre Desigual et,,,,Desigual et Christian,Desigual et Christian Lacroix,"Desigual et Christian Lacroix ,"
https://www.laprovence.com/article/femina-provence/5450393/desigual-reedite-des-pieces-concues-par-christian-lacroix-depuis-2011.html,laprovence.com,2019-04-09,France,Desigual/NAM/Desigual,"Huit  ans  plus  tard  , Desigual  souhaite  rendre  hommage  à  ce  partenariat  en  rééditant  plusieurs  des  créations  créées  par  le  créateur  français  pour  la  marque  de  prêt-à-porter  .",desigual,nam,desigual,",",",",PUNCT,tard,tard,ADV,plus,plus,ADV,ans,an,NOUN,Huit,huit,ADJ,souhaite,souhaiter,VERB,rendre,rendre,VERB,hommage,hommage,NOUN,à,à,ADP,ce,ce,PRON,2019-04-09,2019,2010,ADV PUNCT Desigual VERB VERB,PUNCT Desigual VERB,ADV PUNCT Desigual,ADV ADV PUNCT Desigual,NOUN ADV ADV PUNCT Desigual,Desigual VERB VERB,Desigual VERB VERB NOUN,Desigual VERB VERB NOUN ADP,"tard , Desigual souhaiter rendre",", Desigual souhaiter","tard , Desigual","plus tard , Desigual","an plus tard , Desigual",Desigual souhaiter rendre,Desigual souhaiter rendre hommage,Desigual souhaiter rendre hommage à
https://www.laprovence.com/article/femina-provence/5450393/desigual-reedite-des-pieces-concues-par-christian-lacroix-depuis-2011.html,laprovence.com,2019-04-09,France,Desigual/NAM/Desigual,"La  capsule  comprend  notamment  dix  des  robes  les  plus  emblématiques  dessinées  par  Christian  Lacroix  pour Desigual  ,  tour  à  tour  d'  un  blanc  immaculé  ,  recouvertes  de  fleurs  ,  ou  ornées  d'  imprimés  psychédéliques  .",desigual,nam,desigual,pour,pour,ADP,Lacroix,Lacroix,PROPN,Christian,Christian,PROPN,par,par,ADP,dessinées,dessiner,VERB,",",",",PUNCT,tour,tour,NOUN,à,à,ADP,tour,tour,NOUN,d',de,ADP,2019-04-09,2019,2010,PROPN ADP Desigual PUNCT NOUN,ADP Desigual PUNCT,PROPN ADP Desigual,PROPN PROPN ADP Desigual,ADP PROPN PROPN ADP Desigual,Desigual PUNCT NOUN,Desigual PUNCT NOUN ADP,Desigual PUNCT NOUN ADP NOUN,"Lacroix pour Desigual , tour","pour Desigual ,",Lacroix pour Desigual,Christian Lacroix pour Desigual,par Christian Lacroix pour Desigual,"Desigual , tour","Desigual , tour à","Desigual , tour à tour"
https://www.laprovence.com/article/femina-provence/5450393/desigual-reedite-des-pieces-concues-par-christian-lacroix-depuis-2011.html,laprovence.com,2019-04-09,France,Desigual/ADJ/Desigual,"La  collection  "" Desigual  by  Christian  Lacroix  ""  est  disponible  dans  certains  magasins  Desigual  ,  et  sur  l'  e-shop  de  la  marque  . </doc>",desigual,adj,desigual,"""","""",PUNCT,collection,collection,NOUN,La,le,DET,,,,,,,by,by,NOUN,Christian,Christian,PROPN,Lacroix,Lacroix,PROPN,"""","""",PUNCT,est,être,VERB,2019-04-09,2019,2010,NOUN PUNCT Desigual NOUN PROPN,PUNCT Desigual NOUN,NOUN PUNCT Desigual,DET NOUN PUNCT Desigual,,Desigual NOUN PROPN,Desigual NOUN PROPN PROPN,Desigual NOUN PROPN PROPN PUNCT,"collection "" Desigual by Christian",""" Desigual by","collection "" Desigual","le collection "" Desigual",,Desigual by Christian,Desigual by Christian Lacroix,"Desigual by Christian Lacroix """
https://www.laprovence.com/article/femina-provence/5450393/desigual-reedite-des-pieces-concues-par-christian-lacroix-depuis-2011.html,laprovence.com,2019-04-09,France,Desigual/ADJ/Desigual,"La  collection  ""  Desigual  by  Christian  Lacroix  ""  est  disponible  dans  certains  magasins Desigual  ,  et  sur  l'  e-shop  de  la  marque  . </doc>",desigual,adj,desigual,magasins,magasin,NOUN,certains,certain,PRON,dans,dans,ADP,disponible,disponible,ADJ,est,être,VERB,",",",",PUNCT,et,et,CONJ,sur,sur,ADP,l',le,DET,e-shop,e-shop,NOUN,2019-04-09,2019,2010,PRON NOUN Desigual PUNCT CONJ,NOUN Desigual PUNCT,PRON NOUN Desigual,ADP PRON NOUN Desigual,ADJ ADP PRON NOUN Desigual,Desigual PUNCT CONJ,Desigual PUNCT CONJ ADP,Desigual PUNCT CONJ ADP DET,"certain magasin Desigual , et","magasin Desigual ,",certain magasin Desigual,dans certain magasin Desigual,disponible dans certain magasin Desigual,"Desigual , et","Desigual , et sur","Desigual , et sur le"
https://www.businesswire.com/news/home/20190410005935/fr/?feedref=JjAwJuNHiystnCoBq_hl-f-Mqy7--9RYfS_LXgrtWW7rOkYSjTKorE14c7uwcjIHj_R0p0VFN6GsXdq8PYoIcFEYGffXvFUnUBNNmxNkJdnQqLx557vS7ZRxiEolcr-hHrZo_gzQzmbSVgCo2ySDfw%253D%253D,businesswire.com,2019-04-11,===NONE===,Desigual/NAM/Desigual,"Foyer  de  nombreuses  marques  renommées  parmi  lesquelles  Zara  ,  Mango  et Desigual  ,  l'  Espagne  est  une  force  grandissante  dans  la  mode  .",desigual,nam,desigual,et,et,CONJ,Mango,Mango,PROPN,",",",",PUNCT,Zara,Zara,PROPN,lesquelles,lequel,PRON,",",",",PUNCT,l',le,DET,Espagne,Espagne,PROPN,est,être,VERB,une,un,DET,2019-04-11,2019,2010,PROPN CONJ Desigual PUNCT DET,CONJ Desigual PUNCT,PROPN CONJ Desigual,PUNCT PROPN CONJ Desigual,PROPN PUNCT PROPN CONJ Desigual,Desigual PUNCT DET,Desigual PUNCT DET PROPN,Desigual PUNCT DET PROPN VERB,"Mango et Desigual , le","et Desigual ,",Mango et Desigual,", Mango et Desigual","Zara , Mango et Desigual","Desigual , le","Desigual , le Espagne","Desigual , le Espagne être"
http://impactcampus.ca/le-mag/mettre-valeur-moche-lordinaire/,impactcampus.ca,2019-04-17,Canada,Desigual/NAM/Desigual,Certaines  marques  comme  Asos  ou Desigual  ont  fait  le  choix  de  ne  plus  retoucher  les  photos  de  leurs  modèles  et  de  présenter  les  mannequins  dans  leurs  naturalités  .,desigual,nam,desigual,ou,ou,CONJ,Asos,Asos,PROPN,comme,comme,CONJ,marques,marque,NOUN,Certaines,certain,PRON,ont,avoir,VERB,fait,faire,VERB,le,le,DET,choix,choix,NOUN,de,de,ADP,2019-04-17,2019,2010,PROPN CONJ Desigual VERB VERB,CONJ Desigual VERB,PROPN CONJ Desigual,CONJ PROPN CONJ Desigual,NOUN CONJ PROPN CONJ Desigual,Desigual VERB VERB,Desigual VERB VERB DET,Desigual VERB VERB DET NOUN,Asos ou Desigual avoir faire,ou Desigual avoir,Asos ou Desigual,comme Asos ou Desigual,marque comme Asos ou Desigual,Desigual avoir faire,Desigual avoir faire le,Desigual avoir faire le choix
https://www.zonebourse.com/KLEPIERRE-4665/actualite/Klepierre-ACTIVITE-DU-PREMIER-TRIMESTRE-2019-28444050/,zonebourse.com,2019-04-18,===NONE===,Desigual/NAM/Desigual,"À  Odysseum  (  Montpellier  )  ,  dix  ans  après  l'  ouverture  du  centre  ,  la  campagne  de  renouvellement  a  été  lancée  récemment  et  Calvin  Klein  Jeans  et Desigual  ont  ouvert  un  magasin  au  mois  de  janvier  .",desigual,nam,desigual,et,et,CONJ,Jeans,Jeans,PROPN,Klein,Klein,PROPN,Calvin,Calvin,PROPN,et,et,CONJ,ont,avoir,VERB,ouvert,ouvrir,VERB,un,un,DET,magasin,magasin,NOUN,au,au,ADP DET,2019-04-18,2019,2010,PROPN CONJ Desigual VERB VERB,CONJ Desigual VERB,PROPN CONJ Desigual,PROPN PROPN CONJ Desigual,PROPN PROPN PROPN CONJ Desigual,Desigual VERB VERB,Desigual VERB VERB DET,Desigual VERB VERB DET NOUN,Jeans et Desigual avoir ouvrir,et Desigual avoir,Jeans et Desigual,Klein Jeans et Desigual,Calvin Klein Jeans et Desigual,Desigual avoir ouvrir,Desigual avoir ouvrir un,Desigual avoir ouvrir un magasin
http://madame.lefigaro.fr/societe/fete-meres-petit-zapping-meilleures-declarations-video-220514-856068,lefigaro.fr,2019-05-06,France,Desigual/NAM/Desigual,"Dans  la  catégorie  bad  buzz  publicitaire  ,  l'  espagnole Desigual  a  décroché  la  palme  avec  un  clip  ,  dans  lequel  une  jeune-fille  joue  les  femmes  enceintes  avec  un  coussin  avant  de  percer  des  préservatifs  .",desigual,nam,desigual,espagnole,espagnol,ADJ,l',le,DET,",",",",PUNCT,publicitaire,publicitaire,ADJ,buzz,buzz,NOUN,a,avoir,VERB,décroché,décrocher,VERB,la,le,DET,palme,palme,NOUN,avec,avec,ADP,2019-05-06,2019,2010,DET ADJ Desigual VERB VERB,ADJ Desigual VERB,DET ADJ Desigual,PUNCT DET ADJ Desigual,ADJ PUNCT DET ADJ Desigual,Desigual VERB VERB,Desigual VERB VERB DET,Desigual VERB VERB DET NOUN,le espagnol Desigual avoir décrocher,espagnol Desigual avoir,le espagnol Desigual,", le espagnol Desigual","publicitaire , le espagnol Desigual",Desigual avoir décrocher,Desigual avoir décrocher le,Desigual avoir décrocher le palme
https://defimedia.info/camille-achard-la-mode-petits-prix,defimedia.info,2019-05-07,===NONE===,Desigual/NAM/Desigual,Les  collections  de  Whoops  comportent  surtout  des  marques  telles  que Desigual  et  Molly  Brancken  .,desigual,nam,desigual,que,que,PRON,telles,tel,PRON,marques,marque,NOUN,des,du,ADP DET,surtout,surtout,ADV,et,et,CONJ,Molly,Molly,PROPN,Brancken,Brancken,PROPN,.,.,PUNCT,,,,2019-05-07,2019,2010,PRON PRON Desigual CONJ PROPN,PRON Desigual CONJ,PRON PRON Desigual,NOUN PRON PRON Desigual,ADP DET NOUN PRON PRON Desigual,Desigual CONJ PROPN,Desigual CONJ PROPN PROPN,Desigual CONJ PROPN PROPN PUNCT,tel que Desigual et Molly,que Desigual et,tel que Desigual,marque tel que Desigual,du marque tel que Desigual,Desigual et Molly,Desigual et Molly Brancken,Desigual et Molly Brancken .
