url,website,date,country,keyword,sentence,kw,kw_lemma,kw_pos,left_w1,left_l1,left_p1,left_w2,left_l2,left_p2,left_w3,left_l3,left_p3,left_w4,left_l4,left_p4,left_w5,left_l5,left_p5,right_w1,right_l1,right_p1,right_w2,right_l2,right_p2,right_w3,right_l3,right_p3,right_w4,right_l4,right_p4,right_w5,right_l5,right_p5,datetime,year,10years,pattern_around5,pattern_around3,pattern_left2,pattern_left3,pattern_left4,pattern_right2,pattern_right3,pattern_right4,pattern_around5_lex,pattern_around3_lex,pattern_left2_lex,pattern_left3_lex,pattern_left4_lex,pattern_right2_lex,pattern_right3_lex,pattern_right4_lex
http://article.wn.com/view/2015/10/04/Blackstone_chiefs_donate_40M_to_underprivileged_students/,wn.com,2015-10-04,United States,mercurochrome/NOM/mercurochrome,"avoir  tout  compris  Il  y  a  un  type  qui  pleure  dehors  Sur  mon  visage  de  la  poudre  d'  or  Nous  et  la  man  on  est  de  sortie  Pire  qu'  une  simple  moitie  ́  on  compte  a  ̀  demi-demi  Pile  sur  un  des  bas  cote  ́  s  comme  des  origamis  Le  bras  tendu  parait  casse  ́  tout  n'  est  qu'  e  ́  pis  et  e  ́  clis  Ces  enfants  bizarres  Crache  ́  s  dehors  comme  par  hasard  Cachant  l'  effort  dans  le  griffoir  Et  une  creepy  song  en  e  ́  tendard  qui  fait  :  ""  J'  fais  tout  mon  make-up  au mercurochrome  Contre  les  pop-ups  qui  m'  assurent  le  trône  ""  Christine  and  the  Queens  sur  Facebook  :  https://www.facebook.com/christineand...  S  \  '  abonner  à  ma  chaîne  :  http://bit.ly/ChristinetheQueens  Follow  Christine  and  the  Queens  on  Facebook  :  https://www.facebook.com/christineand...  Subscribe  to  my  channel  :  http://bit.ly/ChristinetheQueens  ... </doc>",mercurochrome,nom,mercurochrome,au,au,ADP DET,make-up,make-up,NOUN,mon,mon,DET,tout,tout,ADV,fais,faire,VERB,Contre,contrer,VERB,les,le,DET,pop-ups,pop-ups,NOUN,qui,qui,PRON,m',me,PRON,2015-10-04,2015,2010,NOUN ADP DET Mercurochrome VERB DET,ADP DET Mercurochrome VERB,NOUN ADP DET Mercurochrome,DET NOUN ADP DET Mercurochrome,ADV DET NOUN ADP DET Mercurochrome,Mercurochrome VERB DET,Mercurochrome VERB DET NOUN,Mercurochrome VERB DET NOUN PRON,make-up au Mercurochrome contrer le,au Mercurochrome contrer,make-up au Mercurochrome,mon make-up au Mercurochrome,tout mon make-up au Mercurochrome,Mercurochrome contrer le,Mercurochrome contrer le pop-ups,Mercurochrome contrer le pop-ups qui
http://www.romandie.com/news/Urgo-acquiert-le-fabricant-daides-auditives-Sonalto/639275.rom,romandie.com,2015-10-15,Switzerland,Mercurochrome/NAM/Mercurochrome,"Paris  (  awp  /  afp  )  -  Le  groupe  Urgo  ,  qui  possède  notamment  les  marques  Humex  ou Mercurochrome  ,  a  annoncé  jeudi  l'  acquisition  de  la  société  Sonalto  ,  qui  fabrique  des  aides  auditives  .",mercurochrome,nam,mercurochrome,ou,ou,CONJ,Humex,Humex,PROPN,marques,marque,NOUN,les,le,DET,notamment,notamment,ADV,",",",",PUNCT,a,avoir,VERB,annoncé,annoncer,VERB,jeudi,jeudi,NOUN,l',le,DET,2015-10-15,2015,2010,PROPN CONJ Mercurochrome PUNCT VERB,CONJ Mercurochrome PUNCT,PROPN CONJ Mercurochrome,NOUN PROPN CONJ Mercurochrome,DET NOUN PROPN CONJ Mercurochrome,Mercurochrome PUNCT VERB,Mercurochrome PUNCT VERB VERB,Mercurochrome PUNCT VERB VERB NOUN,"Humex ou Mercurochrome , avoir","ou Mercurochrome ,",Humex ou Mercurochrome,marque Humex ou Mercurochrome,le marque Humex ou Mercurochrome,"Mercurochrome , avoir","Mercurochrome , avoir annoncer","Mercurochrome , avoir annoncer jeudi"
http://www.romandie.com/news/Urgo-acquiert-le-fabricant-daides-auditives-Sonalto/639275.rom,romandie.com,2015-10-15,Switzerland,Mercurochrome/NAM/Mercurochrome,"Il  est  présent  en  santé  grand  public  (  marques  Urgo  ,  Humex  , Mercurochrome  ,  Juvamine  )  et  en  produits  pour  professionnels  de  santé  . </doc>",mercurochrome,nam,mercurochrome,",",",",PUNCT,Humex,Humex,PROPN,",",",",PUNCT,Urgo,Urgo,PROPN,marques,marque,NOUN,",",",",PUNCT,Juvamine,Juvamine,PROPN,),),PUNCT,et,et,CONJ,en,en,ADP,2015-10-15,2015,2010,PROPN PUNCT Mercurochrome PUNCT PROPN,PUNCT Mercurochrome PUNCT,PROPN PUNCT Mercurochrome,PUNCT PROPN PUNCT Mercurochrome,PROPN PUNCT PROPN PUNCT Mercurochrome,Mercurochrome PUNCT PROPN,Mercurochrome PUNCT PROPN PUNCT,Mercurochrome PUNCT PROPN PUNCT CONJ,"Humex , Mercurochrome , Juvamine",", Mercurochrome ,","Humex , Mercurochrome",", Humex , Mercurochrome","Urgo , Humex , Mercurochrome","Mercurochrome , Juvamine","Mercurochrome , Juvamine )","Mercurochrome , Juvamine ) et"
http://www.lanouvellerepublique.fr/Vienne/Loisirs/Expos-musees/n/Contenus/Articles/2015/10/12/Sur-le-chemin-des-ecoliers-d-antan-2497451,lanouvellerepublique.fr,2015-10-12,France,mercurochrome/NOM/mercurochrome,"Dans  l'  atelier  musée  ,  on  replonge  tête  la  première  dans  ses  jours  heureux  d'  écolier  les  joues  barbouillées  de  confiture  et  les  genoux  peinturlurés  de mercurochrome  .",mercurochrome,nom,mercurochrome,de,de,ADP,peinturlurés,peinturlurer,VERB,genoux,genou,NOUN,les,le,DET,et,et,CONJ,.,.,PUNCT,,,,,,,,,,,,,2015-10-12,2015,2010,,ADP Mercurochrome PUNCT,VERB ADP Mercurochrome,NOUN VERB ADP Mercurochrome,DET NOUN VERB ADP Mercurochrome,,,,,de Mercurochrome .,peinturlurer de Mercurochrome,genou peinturlurer de Mercurochrome,le genou peinturlurer de Mercurochrome,,,
http://www.lefigaro.fr/societes/2015/10/14/20005-20151014ARTFIG00293-urgo-se-lance-dans-les-aides-auditives.php,lefigaro.fr,2015-10-14,France,Mercurochrome/NAM/Mercurochrome,"Le  groupe  Urgo  ,  qui  gère  aussi  les  marques Mercurochrome  ,  Humex  ,  Juva  ou  Super  Diet  ,  a  racheté  cet  été  la  start-up  Sonalto  ,  qui  commercialise  un  ""  assistant  d'  écoute  ""  ,  Octave  .",mercurochrome,nam,mercurochrome,marques,marque,NOUN,les,le,DET,aussi,aussi,ADV,gère,gérer,VERB,qui,qui,PRON,",",",",PUNCT,Humex,Humex,PROPN,",",",",PUNCT,Juva,Juva,PROPN,ou,ou,CONJ,2015-10-14,2015,2010,DET NOUN Mercurochrome PUNCT PROPN,NOUN Mercurochrome PUNCT,DET NOUN Mercurochrome,ADV DET NOUN Mercurochrome,VERB ADV DET NOUN Mercurochrome,Mercurochrome PUNCT PROPN,Mercurochrome PUNCT PROPN PUNCT,Mercurochrome PUNCT PROPN PUNCT PROPN,"le marque Mercurochrome , Humex","marque Mercurochrome ,",le marque Mercurochrome,aussi le marque Mercurochrome,gérer aussi le marque Mercurochrome,"Mercurochrome , Humex","Mercurochrome , Humex ,","Mercurochrome , Humex , Juva"
http://www.midilibre.fr/2015/10/26/depuis-15-ans-sa-maison-est-la-cible-d-un-vandale%2C1232034.php#xtor%3DRSS-5,midilibre.fr,2015-10-26,France,mercurochrome/NOM/mercurochrome,"La  liste  des  dommages  causés  à  son  domicile  et  des  projectiles  recensés  dans  son  jardin  est  sans  fin  :  déjections  canines  jetées  sur  la  véranda  ,  bris  de  verre  sur  les  platebandes  ,  fruits  pourris  ,  patte  d'  un  animal  indéterminé  ,  pierres  ,  désherbant  sur  un  rosier  ,  huile  de  vidange  versée  sur  le  seuil  de  la  porte-fenêtre  ,  tomates  pourries  trempées  dans  l'  huile  et  lancées  sur  la  façade  , mercurochrome  sur  le  crépi  ont  entre  autres  été  découverts  par  Michel  Alary  ,  à  intervalles  forcément  trop  réguliers  :  ""  Il  agit  dans  la  nuit  ou  au  petit  matin  .",mercurochrome,nom,mercurochrome,",",",",PUNCT,façade,façade,NOUN,la,le,DET,sur,sur,ADP,lancées,lancer,VERB,sur,sur,ADP,le,le,DET,crépi,crépi,NOUN,ont,avoir,VERB,entre,entre,ADP,2015-10-26,2015,2010,NOUN PUNCT Mercurochrome ADP DET,PUNCT Mercurochrome ADP,NOUN PUNCT Mercurochrome,DET NOUN PUNCT Mercurochrome,ADP DET NOUN PUNCT Mercurochrome,Mercurochrome ADP DET,Mercurochrome ADP DET NOUN,Mercurochrome ADP DET NOUN VERB,"façade , Mercurochrome sur le",", Mercurochrome sur","façade , Mercurochrome","le façade , Mercurochrome","sur le façade , Mercurochrome",Mercurochrome sur le,Mercurochrome sur le crépi,Mercurochrome sur le crépi avoir
http://article.wn.com/view/2015/11/08/Historymaking_soccer_season_ends_for_Springboro/,wn.com,2015-11-08,United States,mercurochrome/NOM/mercurochrome,"avoir  tout  compris  Il  y  a  un  type  qui  pleure  dehors  Sur  mon  visage  de  la  poudre  d'  or  Nous  et  la  man  on  est  de  sortie  Pire  qu'  une  simple  moitie  ́  on  compte  a  ̀  demi-demi  Pile  sur  un  des  bas  cote  ́  s  comme  des  origamis  Le  bras  tendu  parait  casse  ́  tout  n'  est  qu'  e  ́  pis  et  e  ́  clis  Ces  enfants  bizarres  Crache  ́  s  dehors  comme  par  hasard  Cachant  l'  effort  dans  le  griffoir  Et  une  creepy  song  en  e  ́  tendard  qui  fait  :  ""  J'  fais  tout  mon  make-up  au mercurochrome  Contre  les  pop-ups  qui  m'  assurent  le  trône  ""  Christine  and  the  Queens  sur  Facebook  :  https://www.facebook.com/christineand...  S  \  '  abonner  à  ma  chaîne  :  http://bit.ly/ChristinetheQueens  Follow  Christine  and  the  Queens  on  Facebook  :  https://www.facebook.com/christineand...  Subscribe  to  my  channel  :  http://bit.ly/ChristinetheQueens  ... </doc>",mercurochrome,nom,mercurochrome,au,au,ADP DET,make-up,make-up,NOUN,mon,mon,DET,tout,tout,ADV,fais,faire,VERB,Contre,contrer,VERB,les,le,DET,pop-ups,pop-ups,NOUN,qui,qui,PRON,m',me,PRON,2015-11-08,2015,2010,NOUN ADP DET Mercurochrome VERB DET,ADP DET Mercurochrome VERB,NOUN ADP DET Mercurochrome,DET NOUN ADP DET Mercurochrome,ADV DET NOUN ADP DET Mercurochrome,Mercurochrome VERB DET,Mercurochrome VERB DET NOUN,Mercurochrome VERB DET NOUN PRON,make-up au Mercurochrome contrer le,au Mercurochrome contrer,make-up au Mercurochrome,mon make-up au Mercurochrome,tout mon make-up au Mercurochrome,Mercurochrome contrer le,Mercurochrome contrer le pop-ups,Mercurochrome contrer le pop-ups qui
http://www.lemonde.fr/economie/article/2015/11/28/le-nickel-a-besoin-de-mercurochrome_4819587_3234.html#xtor%3DRSS-3208001,lemonde.fr,2015-11-28,France,Mercurochrome/NAM/Mercurochrome,<doc uri=http://www.lemonde.fr/economie/article/2015/11/28/le-nickel-a-besoin-de-mercurochrome_4819587_3234.html#xtor%3DRSS-3208001 website=lemonde.fr date=2015-11-28 source_country=France> /le/DET:ART /nickel/NOM /avoir/VER:pres /besoin/NOM /de/PRP Mercurochrome ,mercurochrome,nam,mercurochrome,de,de,ADP,besoin,besoin,NOUN,a,avoir,VERB,nickel,nickel,NOUN,Le,le,DET,,,,,,,,,,,,,,,,2015-11-28,2015,2010,,,NOUN ADP Mercurochrome,VERB NOUN ADP Mercurochrome,NOUN VERB NOUN ADP Mercurochrome,,,,,,besoin de Mercurochrome,avoir besoin de Mercurochrome,nickel avoir besoin de Mercurochrome,,,
http://www.nordeclair.fr/info-locale/lille-fissuree-l-eglise-saint-sauveur-fermee-deux-ans-jna49b0n947276?xtor=RSS-2,nordeclair.fr,2015-11-27,France,mercurochrome/NOM/mercurochrome,Du mercurochrome  sur  une  jambe  de  bois  .,mercurochrome,nom,mercurochrome,Du,du,ADP DET,,,,,,,,,,,,,sur,sur,ADP,une,un,DET,jambe,jambe,NOUN,de,de,ADP,bois,bois,NOUN,2015-11-27,2015,2010,,ADP DET Mercurochrome ADP,,,,Mercurochrome ADP DET,Mercurochrome ADP DET NOUN,Mercurochrome ADP DET NOUN ADP,,du Mercurochrome sur,,,,Mercurochrome sur un,Mercurochrome sur un jambe,Mercurochrome sur un jambe de
http://malijet.com/actualte_dans_les_regions_du_mali/rebellion_au_nord_du_mali/142747-chronique-satirique-quand-la-minusma-cantonne-des-anes.html,malijet.com,2015-12-22,===NONE===,mercurochrome/NOM/mercurochrome,"A  cette  sauce  fort  pimentée  ,  la  MINUSMA  risque  d'  investir  tout  son  budget  ,  non  dans  des  patrouilles  de  sécurité  ,  mais  dans  l'  achat  de  cercueils  et  de mercurochrome  .",mercurochrome,nom,mercurochrome,de,de,ADP,et,et,CONJ,cercueils,cercueil,NOUN,de,de,ADP,achat,achat,NOUN,.,.,PUNCT,,,,,,,,,,,,,2015-12-22,2015,2010,,ADP Mercurochrome PUNCT,CONJ ADP Mercurochrome,NOUN CONJ ADP Mercurochrome,ADP NOUN CONJ ADP Mercurochrome,,,,,de Mercurochrome .,et de Mercurochrome,cercueil et de Mercurochrome,de cercueil et de Mercurochrome,,,
http://www.programme-tv.net/news/musique/76541-concert-de-christine-and-the-queens-tf1-petit-sous-titrage-de-paroles-a-l-usage-des-neophytes/#xtor%3DRSS-18,programme-tv.net,2015-12-23,===NONE===,mercurochrome/NOM/mercurochrome,"Dans  le  titre  Christine  ,  pourquoi  fait-elle  ""  tout  [  s  ]  on  make-up  au mercurochrome  ""  ?",mercurochrome,nom,mercurochrome,au,au,ADP DET,make-up,make-up,NOUN,on,on,PRON,],],PUNCT,s,s,VERB,"""","""",PUNCT,?,?,PUNCT,,,,,,,,,,2015-12-23,2015,2010,NOUN ADP DET Mercurochrome PUNCT PUNCT,ADP DET Mercurochrome PUNCT,NOUN ADP DET Mercurochrome,PRON NOUN ADP DET Mercurochrome,PUNCT PRON NOUN ADP DET Mercurochrome,Mercurochrome PUNCT PUNCT,,,"make-up au Mercurochrome "" ?","au Mercurochrome """,make-up au Mercurochrome,on make-up au Mercurochrome,] on make-up au Mercurochrome,"Mercurochrome "" ?",,
http://article.wn.com/view/2015/12/02/100_Tanzanians_trained_to_proclaim_the_gospel_The_Anglican_C/,wn.com,2015-12-02,United States,mercurochrome/NOM/mercurochrome,"avoir  tout  compris  Il  y  a  un  type  qui  pleure  dehors  Sur  mon  visage  de  la  poudre  d'  or  Nous  et  la  man  on  est  de  sortie  Pire  qu'  une  simple  moitie  ́  on  compte  a  ̀  demi-demi  Pile  sur  un  des  bas  cote  ́  s  comme  des  origamis  Le  bras  tendu  parait  casse  ́  tout  n'  est  qu'  e  ́  pis  et  e  ́  clis  Ces  enfants  bizarres  Crache  ́  s  dehors  comme  par  hasard  Cachant  l'  effort  dans  le  griffoir  Et  une  creepy  song  en  e  ́  tendard  qui  fait  :  ""  J'  fais  tout  mon  make-up  au mercurochrome  Contre  les  pop-ups  qui  m'  assurent  le  trône  ""  Christine  and  the  Queens  sur  Facebook  :  https://www.facebook.com/christineand...  S  \  '  abonner  à  ma  chaîne  :  http://bit.ly/ChristinetheQueens  Follow  Christine  and  the  Queens  on  Facebook  :  https://www.facebook.com/christineand...  Subscribe  to  my  channel  :  http://bit.ly/ChristinetheQueens  ... </doc>",mercurochrome,nom,mercurochrome,au,au,ADP DET,make-up,make-up,NOUN,mon,mon,DET,tout,tout,ADV,fais,faire,VERB,Contre,contrer,VERB,les,le,DET,pop-ups,pop-ups,NOUN,qui,qui,PRON,m',me,PRON,2015-12-02,2015,2010,NOUN ADP DET Mercurochrome VERB DET,ADP DET Mercurochrome VERB,NOUN ADP DET Mercurochrome,DET NOUN ADP DET Mercurochrome,ADV DET NOUN ADP DET Mercurochrome,Mercurochrome VERB DET,Mercurochrome VERB DET NOUN,Mercurochrome VERB DET NOUN PRON,make-up au Mercurochrome contrer le,au Mercurochrome contrer,make-up au Mercurochrome,mon make-up au Mercurochrome,tout mon make-up au Mercurochrome,Mercurochrome contrer le,Mercurochrome contrer le pop-ups,Mercurochrome contrer le pop-ups qui
http://blogs.lexpress.fr/cinema/2015/11/10/le-spectre-dange-et-gabrielle/,lexpress.fr,2015-12-07,France,mercurochrome/NOM/mercurochrome,"Le  distributeur  a  décidé  de  ne  s'  appuyer  que  sur  la  promo  télé  et  radio  ,  celle-là  même  qui  a  autant  d'  influence  sur  le  public  que  du mercurochrome  sur  une  jambe  de  bois  -parce  qu'  à  l'  heure  des  réseaux  sociaux  et  d'  Internet  ,  plus  personne  n'  est  dupe  .",mercurochrome,nom,mercurochrome,du,du,ADP DET,que,que,CONJ,public,public,NOUN,le,le,DET,sur,sur,ADP,sur,sur,ADP,une,un,DET,jambe,jambe,NOUN,de,de,ADP,bois,bois,NOUN,2015-12-07,2015,2010,CONJ ADP DET Mercurochrome ADP DET,ADP DET Mercurochrome ADP,CONJ ADP DET Mercurochrome,NOUN CONJ ADP DET Mercurochrome,DET NOUN CONJ ADP DET Mercurochrome,Mercurochrome ADP DET,Mercurochrome ADP DET NOUN,Mercurochrome ADP DET NOUN ADP,que du Mercurochrome sur un,du Mercurochrome sur,que du Mercurochrome,public que du Mercurochrome,le public que du Mercurochrome,Mercurochrome sur un,Mercurochrome sur un jambe,Mercurochrome sur un jambe de
http://www.lavoixdunord.fr/region/bain-des-givres-a-dunkerque-une-peche-aux-p-tits-ia17b47588n3246291?xtor=RSS-2,lavoixdunord.fr,2016-01-01,France,mercurochrome/NOM/mercurochrome,"Envie  quand  même  de  jouer  au  plus  fin  ?  Marie-Anne  Gaschard  avertit  :  ""  Une  année  ,  certains  se  sont  mis  du mercurochrome  sur  le  corps  pour  nous  faire  croire  qu'  ils  étaient  rentrés  totalement  dans  l'  eau  .",mercurochrome,nom,mercurochrome,du,du,ADP DET,mis,mettre,VERB,sont,être,VERB,se,se,PRON,certains,certain,PRON,sur,sur,ADP,le,le,DET,corps,corps,NOUN,pour,pour,ADP,nous,nous,PRON,2016-01-01,2016,2010,VERB ADP DET Mercurochrome ADP DET,ADP DET Mercurochrome ADP,VERB ADP DET Mercurochrome,VERB VERB ADP DET Mercurochrome,PRON VERB VERB ADP DET Mercurochrome,Mercurochrome ADP DET,Mercurochrome ADP DET NOUN,Mercurochrome ADP DET NOUN ADP,mettre du Mercurochrome sur le,du Mercurochrome sur,mettre du Mercurochrome,être mettre du Mercurochrome,se être mettre du Mercurochrome,Mercurochrome sur le,Mercurochrome sur le corps,Mercurochrome sur le corps pour
http://www.lavoixdunord.fr/region/bain-des-givres-a-dunkerque-une-peche-aux-p-tits-ia17b47588n3246291?xtor=RSS-2,lavoixdunord.fr,2016-01-01,France,mercurochrome/NOM/mercurochrome,"En  tant  qu'  ancienne  urgentiste  ,  je  peux  vous  dire  que  je  sais  faire  la  différence  entre  de  vraies  rougeurs  et  du mercurochrome  !  Et  pour  enlever  ce  dernier  ,  je  vous  dis  pas  ,  c'  est  galère  ,  même  le  lendemain  !  ""  Le  message  est  passé  ...",mercurochrome,nom,mercurochrome,du,du,ADP DET,et,et,CONJ,rougeurs,rougeur,NOUN,vraies,vrai,ADJ,de,de,ADP,!,!,PUNCT,Et,et,CONJ,pour,pour,ADP,enlever,enlever,VERB,ce,ce,PRON,2016-01-01,2016,2010,CONJ ADP DET Mercurochrome PUNCT CONJ,ADP DET Mercurochrome PUNCT,CONJ ADP DET Mercurochrome,NOUN CONJ ADP DET Mercurochrome,ADJ NOUN CONJ ADP DET Mercurochrome,Mercurochrome PUNCT CONJ,Mercurochrome PUNCT CONJ ADP,Mercurochrome PUNCT CONJ ADP VERB,et du Mercurochrome ! et,du Mercurochrome !,et du Mercurochrome,rougeur et du Mercurochrome,vrai rougeur et du Mercurochrome,Mercurochrome ! et,Mercurochrome ! et pour,Mercurochrome ! et pour enlever
http://www.237online.com/article-31956-la-consecration-du-funambule-ble-goude-dix-neuf-ans-de-tragicomedie-politique.html,237online.com,2016-02-02,United States,mercurochrome/NOM/mercurochrome,"En  outre  ,  Blé  Goudé  se  saisit  subrepticement  d'  un  flacon  de mercurochrome  qu'  il  badigeonne  sur  sa  bouche  comme  s'  il  l'  avait  bu  .",mercurochrome,nom,mercurochrome,de,de,ADP,flacon,flacon,NOUN,un,un,DET,d',de,ADP,subrepticement,subrepticement,ADV,qu',que,PRON,il,il,PRON,badigeonne,badigeonner,VERB,sur,sur,ADP,sa,son,DET,2016-02-02,2016,2010,NOUN ADP Mercurochrome PRON PRON,ADP Mercurochrome PRON,NOUN ADP Mercurochrome,DET NOUN ADP Mercurochrome,ADP DET NOUN ADP Mercurochrome,Mercurochrome PRON PRON,Mercurochrome PRON PRON VERB,Mercurochrome PRON PRON VERB ADP,flacon de Mercurochrome que il,de Mercurochrome que,flacon de Mercurochrome,un flacon de Mercurochrome,de un flacon de Mercurochrome,Mercurochrome que il,Mercurochrome que il badigeonner,Mercurochrome que il badigeonner sur
http://www.237online.com/article-31956-la-consecration-du-funambule-ble-goude-dix-neuf-ans-de-tragicomedie-politique.html,237online.com,2016-02-02,United States,mercurochrome/NOM/mercurochrome,"On  extrait  Blé  Goudé  de  cellule  et  il  est  conduit  d'  urgence  en  clinique  où  des  examens  poussés  prouveront  vite  qu'  il  n'  a  ingurgité  ni  comprimés  ,  ni mercurochrome  .",mercurochrome,nom,mercurochrome,ni,ni,CONJ,",",",",PUNCT,comprimés,comprimer,VERB,ni,ni,CONJ,ingurgité,ingurgiter,VERB,.,.,PUNCT,,,,,,,,,,,,,2016-02-02,2016,2010,,CONJ Mercurochrome PUNCT,PUNCT CONJ Mercurochrome,VERB PUNCT CONJ Mercurochrome,CONJ VERB PUNCT CONJ Mercurochrome,,,,,ni Mercurochrome .,", ni Mercurochrome","comprimer , ni Mercurochrome","ni comprimer , ni Mercurochrome",,,
http://teleobs.nouvelobs.com/actualites/20160208.OBS4202/joey-starr-je-suis-une-pipelette-je-ne-feins-pas-ca-grince-parfois.html?xtor=RSS-24,nouvelobs.com,2016-02-14,France,Mercurochrome/NOM/mercurochrome,"L'  état  d'  urgence  ,  les  migrants  ,  l'  Europe  qui  se  déchire  ,  on  rafistole  et  l'  image  qui  me  vient  en  tête  est  celle  du Mercurochrome  sur  une  jambe  de  bois  .",mercurochrome,nom,mercurochrome,du,du,ADP DET,celle,celui,PRON,est,être,VERB,tête,tête,NOUN,en,en,ADP,sur,sur,ADP,une,un,DET,jambe,jambe,NOUN,de,de,ADP,bois,bois,NOUN,2016-02-14,2016,2010,PRON ADP DET Mercurochrome ADP DET,ADP DET Mercurochrome ADP,PRON ADP DET Mercurochrome,VERB PRON ADP DET Mercurochrome,NOUN VERB PRON ADP DET Mercurochrome,Mercurochrome ADP DET,Mercurochrome ADP DET NOUN,Mercurochrome ADP DET NOUN ADP,celui du Mercurochrome sur un,du Mercurochrome sur,celui du Mercurochrome,être celui du Mercurochrome,tête être celui du Mercurochrome,Mercurochrome sur un,Mercurochrome sur un jambe,Mercurochrome sur un jambe de
http://www.femmeactuelle.fr/sante/sante-pratique/thermotherapie-quand-la-chaleur-devient-medicament-27644,femmeactuelle.fr,2016-02-17,France,Mercurochrome/ADJ/Mercurochrome,"Et  ce  ne  sont  pas  les  solutions  qui  manquent  ,  à  commencer  par  les  patchs  chauffants  adhésifs  qui  restent  actifs  pendant  8  à  10  heures  (  Aroma  ®  Patchs  , Mercurochrome  ®  ,  Nexcare  ®  ,  Puressentiel  ®  articulations  ,  Syntholkiné  ®  ,  Thermacare  ®  ,  Urgo  ®  ,  Voltacare  ®  ,  etc  )  .",mercurochrome,adj,mercurochrome,",",",",PUNCT,Patchs,patch,NOUN,®,®,ADJ,Aroma,Aroma,VERB,(,(,PUNCT,®,®,NOUN,",",",",PUNCT,Nexcare,Nexcare,NOUN,®,®,ADJ,",",",",PUNCT,2016-02-17,2016,2010,NOUN PUNCT Mercurochrome NOUN PUNCT,PUNCT Mercurochrome NOUN,NOUN PUNCT Mercurochrome,ADJ NOUN PUNCT Mercurochrome,VERB ADJ NOUN PUNCT Mercurochrome,Mercurochrome NOUN PUNCT,Mercurochrome NOUN PUNCT NOUN,Mercurochrome NOUN PUNCT NOUN ADJ,"patch , Mercurochrome ® ,",", Mercurochrome ®","patch , Mercurochrome","® patch , Mercurochrome","Aroma ® patch , Mercurochrome","Mercurochrome ® ,","Mercurochrome ® , Nexcare","Mercurochrome ® , Nexcare ®"
http://www.lavoixdunord.fr/region/wavrechain-sous-denain-super-diet-continue-de-grossir-ia15b36981n3397125?xtor=RSS-2,lavoixdunord.fr,2016-03-19,France,Mercurochrome/NAM/Mercurochrome,"Aujourd  '  hui  ,  Super  Diet  fait  partie  du  groupe  Urgo  ,  qui  pèse  tout  de  même  600  millions  d'  euros  de  chiffre  d'  affaires  ,  emploie  2  500  personnes  et  dispose  de  quelques  marques  bien  connues  comme Mercurochrome  ou  Juvamine  .",mercurochrome,nam,mercurochrome,comme,comme,CONJ,connues,connaître,VERB,bien,bien,ADV,marques,marque,NOUN,quelques,quelque,PRON,ou,ou,CONJ,Juvamine,Juvamine,PROPN,.,.,PUNCT,,,,,,,2016-03-19,2016,2010,VERB CONJ Mercurochrome CONJ PROPN,CONJ Mercurochrome CONJ,VERB CONJ Mercurochrome,ADV VERB CONJ Mercurochrome,NOUN ADV VERB CONJ Mercurochrome,Mercurochrome CONJ PROPN,Mercurochrome CONJ PROPN PUNCT,,connaître comme Mercurochrome ou Juvamine,comme Mercurochrome ou,connaître comme Mercurochrome,bien connaître comme Mercurochrome,marque bien connaître comme Mercurochrome,Mercurochrome ou Juvamine,Mercurochrome ou Juvamine .,
http://www.liberte-algerie.com/actualite/lalgerie-tout-entiere-est-avec-vous-244976,liberte-algerie.com,2016-03-31,Algeria,mercurochrome/NOM/mercurochrome,"""  D'  autres  habitants  leur  ont  apporté  des  médicaments  ,  notamment  du mercurochrome  et  des  analgésiques  pour  calmer  les  douleurs  aux  pieds  et  aux  articulations  .",mercurochrome,nom,mercurochrome,du,du,ADP DET,notamment,notamment,ADV,",",",",PUNCT,médicaments,médicament,NOUN,des,du,ADP DET,et,et,CONJ,des,du,ADP DET,analgésiques,analgésique,NOUN,pour,pour,ADP,calmer,calmer,VERB,2016-03-31,2016,2010,ADV ADP DET Mercurochrome CONJ ADP DET,ADP DET Mercurochrome CONJ,ADV ADP DET Mercurochrome,PUNCT ADV ADP DET Mercurochrome,NOUN PUNCT ADV ADP DET Mercurochrome,Mercurochrome CONJ ADP DET,Mercurochrome CONJ ADP DET NOUN,Mercurochrome CONJ ADP DET NOUN ADP,notamment du Mercurochrome et du,du Mercurochrome et,notamment du Mercurochrome,", notamment du Mercurochrome","médicament , notamment du Mercurochrome",Mercurochrome et du,Mercurochrome et du analgésique,Mercurochrome et du analgésique pour
http://www.lesechos.fr/industrie-services/pharmacie-sante/021836052049-le-groupe-urgo-renforce-son-implantation-en-asie-1213334.php#xtor%3DRSS-2055,lesechos.fr,2016-04-12,France,Mercurochrome/NAM/Mercurochrome,"Son  premier  né  ,  My Mercurochrome  Stress  Control  ,  en  vente  depuis  janvier  dernier  ,  permet  à  ses  utilisateurs  d'  apprendre  à  réguler  leur  rythme  cardiaque  en  respirant  mieux  . </doc>",mercurochrome,nam,mercurochrome,My,My,PROPN,",",",",PUNCT,né,naître,VERB,premier,premier,NOUN,Son,son,DET,Stress,Stress,PROPN,Control,Control,PROPN,",",",",PUNCT,en,en,ADP,vente,vente,NOUN,2016-04-12,2016,2010,PUNCT PROPN Mercurochrome PROPN PROPN,PROPN Mercurochrome PROPN,PUNCT PROPN Mercurochrome,VERB PUNCT PROPN Mercurochrome,NOUN VERB PUNCT PROPN Mercurochrome,Mercurochrome PROPN PROPN,Mercurochrome PROPN PROPN PUNCT,Mercurochrome PROPN PROPN PUNCT ADP,", My Mercurochrome Stress Control",My Mercurochrome Stress,", My Mercurochrome","naître , My Mercurochrome","premier naître , My Mercurochrome",Mercurochrome Stress Control,"Mercurochrome Stress Control ,","Mercurochrome Stress Control , en"
