url,website,date,country,keyword,sentence,kw,kw_lemma,kw_pos,left_w1,left_l1,left_p1,left_w2,left_l2,left_p2,left_w3,left_l3,left_p3,left_w4,left_l4,left_p4,left_w5,left_l5,left_p5,right_w1,right_l1,right_p1,right_w2,right_l2,right_p2,right_w3,right_l3,right_p3,right_w4,right_l4,right_p4,right_w5,right_l5,right_p5,datetime,year,10years,pattern_around5,pattern_around3,pattern_left2,pattern_left3,pattern_left4,pattern_right2,pattern_right3,pattern_right4,pattern_around5_lex,pattern_around3_lex,pattern_left2_lex,pattern_left3_lex,pattern_left4_lex,pattern_right2_lex,pattern_right3_lex,pattern_right4_lex
http://www.lesinrocks.com/musique/critique-album/polica-shulamith/,lesinrocks.com,2014-01-21,===NONE===,Mercurochrome/NOM/mercurochrome,"Soit  elle  s'  est  lavé  les  cheveux  avec  du Mercurochrome  sans  se  rincer  ,  soit  elle  a  échappé  de  peu  à  un  scalp  exécuté  dans  les  règles  de  l'  art  .",mercurochrome,nom,mercurochrome,du,du,ADP DET,avec,avec,ADP,cheveux,cheveu,NOUN,les,le,DET,lavé,laver,VERB,sans,sans,ADP,se,se,PRON,rincer,rincer,VERB,",",",",PUNCT,soit,soit,CONJ,2014-01-21,2014,2010,ADP ADP DET Mercurochrome ADP PRON,ADP DET Mercurochrome ADP,ADP ADP DET Mercurochrome,NOUN ADP ADP DET Mercurochrome,DET NOUN ADP ADP DET Mercurochrome,Mercurochrome ADP PRON,Mercurochrome ADP PRON VERB,Mercurochrome ADP PRON VERB PUNCT,avec du Mercurochrome sans se,du Mercurochrome sans,avec du Mercurochrome,cheveu avec du Mercurochrome,le cheveu avec du Mercurochrome,Mercurochrome sans se,Mercurochrome sans se rincer,"Mercurochrome sans se rincer ,"
http://www.actubenin.com/?Mots-pour-maux-par-Charles-Toko,actubenin.com,2014-01-29,Benin,mercurochrome/NOM/mercurochrome,"Quand  vous  parlez  ""  des  miens  ""  câest  de  lâÃ  ©  lÃ  ©  gance  ?  Quand  vous  parlez  de  guerre  ,  câest  de  lâÃ  ©  lÃ  ©  gance  ?  Quand  vous  dites  au  tÃ  ©  lÃ  ©  phone  ""  Charles  je  vais  te  tuer  ,  je  vais  te  tuer  ""  et  vous  rÃ  ©  pÃ  ©  tez  Ã  §  a  neuf  fois  ,  câest  de  lâÃ  ©  lÃ  ©  gance  ?  Quelle  Ã  ©  lÃ  ©  gance  de  dire  que  les  syndicalistes  ont  mis  du mercurochrome  ,  alors  quâils  ont  Ã  ©  tÃ  ©  frappÃ  ©  s  ,  molestÃ  ©  s  ,  blessÃ  ©  sâ  |  allez  au  Cnhu  prendre  des  nouvelles  .",mercurochrome,nom,mercurochrome,du,du,ADP DET,mis,mettre,VERB,ont,avoir,VERB,syndicalistes,syndicaliste,NOUN,les,le,DET,",",",",PUNCT,alors,alors,ADV,quâils,quâils,NOUN,ont,avoir,VERB,Ã,Ã,NOUN,2014-01-29,2014,2010,VERB ADP DET Mercurochrome PUNCT ADV,ADP DET Mercurochrome PUNCT,VERB ADP DET Mercurochrome,VERB VERB ADP DET Mercurochrome,NOUN VERB VERB ADP DET Mercurochrome,Mercurochrome PUNCT ADV,Mercurochrome PUNCT ADV NOUN,Mercurochrome PUNCT ADV NOUN VERB,"mettre du Mercurochrome , alors","du Mercurochrome ,",mettre du Mercurochrome,avoir mettre du Mercurochrome,syndicaliste avoir mettre du Mercurochrome,"Mercurochrome , alors","Mercurochrome , alors quâils","Mercurochrome , alors quâils avoir"
http://www.24haubenin.info/spip.php?article3299,24haubenin.info,2014-02-03,===NONE===,Mercurochrome/NAM/Mercurochrome,"<doc uri=http://www.24haubenin.info/spip.php?article3299 website=24haubenin.info date=2014-02-03 source_country=> /Yayi/NAM /Boni/NAM /,/PUN /the/VER:simp Mercurochrome  ,  blood  mutton  and  human  blood  ?",mercurochrome,nam,mercurochrome,the,the,VERB,",",",",PUNCT,Boni,Boni,PROPN,Yayi,Yayi,PROPN,,,,",",",",PUNCT,blood,blood,NOUN,mutton,mutton,NOUN,and,and,VER:subi,human,human,ADJ,2014-02-03,2014,2010,PUNCT VERB Mercurochrome PUNCT NOUN,VERB Mercurochrome PUNCT,PUNCT VERB Mercurochrome,PROPN PUNCT VERB Mercurochrome,PROPN PROPN PUNCT VERB Mercurochrome,Mercurochrome PUNCT NOUN,Mercurochrome PUNCT NOUN NOUN,Mercurochrome PUNCT NOUN NOUN VER:subi,", the Mercurochrome , blood","the Mercurochrome ,",", the Mercurochrome","Boni , the Mercurochrome","Yayi Boni , the Mercurochrome","Mercurochrome , blood","Mercurochrome , blood mutton","Mercurochrome , blood mutton and"
http://www.lefigaro.fr/societes/2014/03/04/20005-20140304ARTFIG00040-mercurochrome-se-lance-dans-les-tests-de-grossesse.php,lefigaro.fr,2014-03-04,France,Mercurochrome/NOM/mercurochrome,<doc uri=http://www.lefigaro.fr/societes/2014/03/04/20005-20140304ARTFIG00040-mercurochrome-se-lance-dans-les-tests-de-grossesse.php website=lefigaro.fr date=2014-03-04 source_country=France> Mercurochrome  se  lance  dans  les  tests  de  grossesse,mercurochrome,nom,mercurochrome,,,,,,,,,,,,,,,,se,se,PRON,lance,lancer,VERB,dans,dans,ADP,les,le,DET,tests,test,NOUN,2014-03-04,2014,2010,,,,,,Mercurochrome PRON VERB,Mercurochrome PRON VERB ADP,Mercurochrome PRON VERB ADP DET,,,,,,Mercurochrome se lancer,Mercurochrome se lancer dans,Mercurochrome se lancer dans le
http://www.lefigaro.fr/societes/2014/03/04/20005-20140304ARTFIG00040-mercurochrome-se-lance-dans-les-tests-de-grossesse.php,lefigaro.fr,2014-03-04,France,Mercurochrome/ADJ/Mercurochrome,"Le  premier  à  se  lancer  dans  la  course  est  Juva  Santé  ,  avec  sa  marque Mercurochrome  .",mercurochrome,adj,mercurochrome,marque,marque,NOUN,sa,son,DET,avec,avec,ADP,",",",",PUNCT,Santé,Santé,VERB,.,.,PUNCT,,,,,,,,,,,,,2014-03-04,2014,2010,,NOUN Mercurochrome PUNCT,DET NOUN Mercurochrome,ADP DET NOUN Mercurochrome,PUNCT ADP DET NOUN Mercurochrome,,,,,marque Mercurochrome .,son marque Mercurochrome,avec son marque Mercurochrome,", avec son marque Mercurochrome",,,
http://www.lefigaro.fr/societes/2014/03/04/20005-20140304ARTFIG00040-mercurochrome-se-lance-dans-les-tests-de-grossesse.php,lefigaro.fr,2014-03-04,France,Mercurochrome/NOM/mercurochrome," Mercurochrome  ,  qui  a  fait  de  l'  accessibilité  sa  marque  de  fabrique  ,  planche  sur  le  sujet  depuis  l'  été  dernier  .",mercurochrome,nom,mercurochrome,,,,,,,,,,,,,,,,",",",",PUNCT,qui,qui,PRON,a,avoir,VERB,fait,faire,VERB,de,de,ADP,2014-03-04,2014,2010,,,,,,Mercurochrome PUNCT PRON,Mercurochrome PUNCT PRON VERB,Mercurochrome PUNCT PRON VERB VERB,,,,,,"Mercurochrome , qui","Mercurochrome , qui avoir","Mercurochrome , qui avoir faire"
http://www.lefigaro.fr/societes/2014/03/04/20005-20140304ARTFIG00040-mercurochrome-se-lance-dans-les-tests-de-grossesse.php,lefigaro.fr,2014-03-04,France,Mercurochrome/NAM/Mercurochrome,"""  Notre  métier  est  de  démocratiser  l'  accès  aux  produits  de  parapharmacie  ""  ,  explique  Briac  Le  Lous  ,  PDG  de  Juva  Santé  ( Mercurochrome  ,  Urgo  ,  Juvamine  ,  Intimy  ...  )  ,  qui  a  déjà  étendu  son  champ  d'  action  aux  vitamines  ,  aux  préservatifs  ou  aux  antiseptiques  .",mercurochrome,nam,mercurochrome,(,(,PUNCT,Santé,Santé,PROPN,Juva,Juva,PROPN,de,de,ADP,PDG,PDG,ABR,",",",",PUNCT,Urgo,Urgo,PROPN,",",",",PUNCT,Juvamine,Juvamine,PROPN,",",",",PUNCT,2014-03-04,2014,2010,PROPN PUNCT Mercurochrome PUNCT PROPN,PUNCT Mercurochrome PUNCT,PROPN PUNCT Mercurochrome,PROPN PROPN PUNCT Mercurochrome,ADP PROPN PROPN PUNCT Mercurochrome,Mercurochrome PUNCT PROPN,Mercurochrome PUNCT PROPN PUNCT,Mercurochrome PUNCT PROPN PUNCT PROPN,"Santé ( Mercurochrome , Urgo","( Mercurochrome ,",Santé ( Mercurochrome,Juva Santé ( Mercurochrome,de Juva Santé ( Mercurochrome,"Mercurochrome , Urgo","Mercurochrome , Urgo ,","Mercurochrome , Urgo , Juvamine"
http://www.fmliberte.com/component/content/article/40-libre-opinion/2493-bagarre-autour-dun-tricot-vert-une-histoire-emouvante-,fmliberte.com,2014-03-08,===NONE===,mercurochrome/NOM/mercurochrome,"contemple  ses  voitures  de  luxe  ,  respirant  et  avalant  la  salive  de  satisfaction  ,  tandis  qu'  une  majorité  démunie  de  tout  doit  se  bagarrer  ,  s'  entredéchirer  parfois  ,  s'  entre-dévorer  ,  impitoyables  comme  des  fauves  entre  eux  ,  non  seulement  autour  d'  un  tricot  ,  mais  aussi  autour  d'  une  mangue  ,  d'  une  noix  de  coco  ,  d'  une  papaye  pour  calmer  leur  faim  ;  autour  d'  un  bic  ,  d'  un  crayon  ,  d'  un  cahier  et  autres  fournitures  scolaires  ,  autour  d'  une  pièce  de  cent  francs  tombée  au  sol  ,  autour  d'  un  flacon  de mercurochrome  ou  de  quelques  comprimés  de  nivaquine  à  l'  hôpital  ,  au  dispensaire  .",mercurochrome,nom,mercurochrome,de,de,ADP,flacon,flacon,NOUN,un,un,DET,d',de,ADP,autour,autour,ADV,ou,ou,CONJ,de,de,ADP,quelques,quelque,PRON,comprimés,comprimé,NOUN,de,de,ADP,2014-03-08,2014,2010,NOUN ADP Mercurochrome CONJ ADP,ADP Mercurochrome CONJ,NOUN ADP Mercurochrome,DET NOUN ADP Mercurochrome,ADP DET NOUN ADP Mercurochrome,Mercurochrome CONJ ADP,Mercurochrome CONJ ADP PRON,Mercurochrome CONJ ADP PRON NOUN,flacon de Mercurochrome ou de,de Mercurochrome ou,flacon de Mercurochrome,un flacon de Mercurochrome,de un flacon de Mercurochrome,Mercurochrome ou de,Mercurochrome ou de quelque,Mercurochrome ou de quelque comprimé
http://www.lsa-conso.fr/pour-1-euro-les-tests-de-grossesse-arrivent-en-grandes-surfaces%2C167192,lsa-conso.fr,2014-03-19,France,Mercurochrome/ADJ/Mercurochrome,Les  laboratoires Mercurochrome  avaient  annoncé  qu'  ils  étaient  prêts  à  lancer  les  premiers  produits  le  jour  de  l'  entrée  en  application  de  la  loi  .,mercurochrome,adj,mercurochrome,laboratoires,laboratoire,NOUN,Les,le,DET,,,,,,,,,,avaient,avoir,VERB,annoncé,annoncer,VERB,qu',que,CONJ,ils,il,PRON,étaient,être,VERB,2014-03-19,2014,2010,DET NOUN Mercurochrome VERB VERB,NOUN Mercurochrome VERB,DET NOUN Mercurochrome,,,Mercurochrome VERB VERB,Mercurochrome VERB VERB CONJ,Mercurochrome VERB VERB CONJ PRON,le laboratoire Mercurochrome avoir annoncer,laboratoire Mercurochrome avoir,le laboratoire Mercurochrome,,,Mercurochrome avoir annoncer,Mercurochrome avoir annoncer que,Mercurochrome avoir annoncer que il
http://www.elle.fr/Societe/News/Bientot-des-tests-de-grossesse-a-1-euro-en-supermarche-2689493,elle.fr,2014-03-19,France,Mercurochrome/NAM/Mercurochrome,"Début  mars  , Mercurochrome  annonçait  déjà  la  commercialisation  de  tests  de  grossesses  à  5,90  euros  et  de  tests  d'  ovulation  à  9  euros  .",mercurochrome,nam,mercurochrome,",",",",PUNCT,mars,mars,NOUN,Début,début,NOUN,,,,,,,annonçait,annoncer,VERB,déjà,déjà,ADV,la,le,DET,commercialisation,commercialisation,NOUN,de,de,ADP,2014-03-19,2014,2010,NOUN PUNCT Mercurochrome VERB ADV,PUNCT Mercurochrome VERB,NOUN PUNCT Mercurochrome,NOUN NOUN PUNCT Mercurochrome,,Mercurochrome VERB ADV,Mercurochrome VERB ADV DET,Mercurochrome VERB ADV DET NOUN,"mars , Mercurochrome annoncer déjà",", Mercurochrome annoncer","mars , Mercurochrome","début mars , Mercurochrome",,Mercurochrome annoncer déjà,Mercurochrome annoncer déjà le,Mercurochrome annoncer déjà le commercialisation
http://frenchweb.fr/vivasante-juvamine-urgo-merchurochrome-pilote-desormais-la-start-up-fly-n-sense-specialisee-dans-les-drones-civils/148117,frenchweb.fr,2014-04-08,France,Mercurochrome/NAM/Mercurochrome,"Le  groupe  français  qui  commercialise  notamment  des  produits  comme  Urgo  ,  Juvamine  ,  Humex  ou Mercurochrome  ,  veut  mettre  la  main  sur  une  pépite  ,  et  prendre  des  parts  de  marché  ,  notamment  à  l'  international  :  ""  Nous  cherchions  en  dehors  de  la  santé  un  marché  naissant  ,  à  fort  potentiel  ,  avec  de  fortes  barrières  à  l'  entrée  ,  dont  la  R  &  D  ""  ,  explique  Guirec  Le  Lous  de  VivaSanté  . </doc>",mercurochrome,nam,mercurochrome,ou,ou,CONJ,Humex,Humex,PROPN,",",",",PUNCT,Juvamine,Juvamine,PROPN,",",",",PUNCT,",",",",PUNCT,veut,vouloir,VERB,mettre,mettre,VERB,la,le,DET,main,main,NOUN,2014-04-08,2014,2010,PROPN CONJ Mercurochrome PUNCT VERB,CONJ Mercurochrome PUNCT,PROPN CONJ Mercurochrome,PUNCT PROPN CONJ Mercurochrome,PROPN PUNCT PROPN CONJ Mercurochrome,Mercurochrome PUNCT VERB,Mercurochrome PUNCT VERB VERB,Mercurochrome PUNCT VERB VERB DET,"Humex ou Mercurochrome , vouloir","ou Mercurochrome ,",Humex ou Mercurochrome,", Humex ou Mercurochrome","Juvamine , Humex ou Mercurochrome","Mercurochrome , vouloir","Mercurochrome , vouloir mettre","Mercurochrome , vouloir mettre le"
http://rue89.nouvelobs.com/2014/04/12/prevention-routiere-si-personne-venait-a-enterrement-251441,nouvelobs.com,2014-04-12,===NONE===,Mercurochrome/NOM/mercurochrome,Toi  allongé  par  terre  recouvert  d'  un  drap  blanc  ;  lui  avec  du Mercurochrome  sur  la  gueule  en  train  de  dire  aux  flics  qu'  il  n'  a  pas  fait  exprès  .,mercurochrome,nom,mercurochrome,du,du,ADP DET,avec,avec,ADV,lui,lui,PRON,;,;,PUNCT,blanc,blanc,ADJ,sur,sur,ADP,la,le,DET,gueule,gueule,NOUN,en,en,ADP,train,train,NOUN,2014-04-12,2014,2010,ADV ADP DET Mercurochrome ADP DET,ADP DET Mercurochrome ADP,ADV ADP DET Mercurochrome,PRON ADV ADP DET Mercurochrome,PUNCT PRON ADV ADP DET Mercurochrome,Mercurochrome ADP DET,Mercurochrome ADP DET NOUN,Mercurochrome ADP DET NOUN ADP,avec du Mercurochrome sur le,du Mercurochrome sur,avec du Mercurochrome,lui avec du Mercurochrome,; lui avec du Mercurochrome,Mercurochrome sur le,Mercurochrome sur le gueule,Mercurochrome sur le gueule en
http://www.taurillon.org/troika-au-portugal-des-reussites-qui-ne-masquent-pas-les-echecs?utm_source=Feedburner,taurillon.org,2014-05-19,===NONE===,Mercurochrome/ADJ/Mercurochrome,On  peut  alors  légitimement  se  demander  si  cette  assistance  financière  n'  est  pas  en  réalité  qu'  un  pauvre  pansement Mercurochrome  sur  une  jambe  de  bois  ? </doc>,mercurochrome,adj,mercurochrome,pansement,pansement,NOUN,pauvre,pauvre,ADJ,un,un,DET,qu',que,CONJ,réalité,réalité,NOUN,sur,sur,ADP,une,un,DET,jambe,jambe,NOUN,de,de,ADP,bois,bois,NOUN,2014-05-19,2014,2010,ADJ NOUN Mercurochrome ADP DET,NOUN Mercurochrome ADP,ADJ NOUN Mercurochrome,DET ADJ NOUN Mercurochrome,CONJ DET ADJ NOUN Mercurochrome,Mercurochrome ADP DET,Mercurochrome ADP DET NOUN,Mercurochrome ADP DET NOUN ADP,pauvre pansement Mercurochrome sur un,pansement Mercurochrome sur,pauvre pansement Mercurochrome,un pauvre pansement Mercurochrome,que un pauvre pansement Mercurochrome,Mercurochrome sur un,Mercurochrome sur un jambe,Mercurochrome sur un jambe de
http://www.cridem.org/C_Info.php?article=656672,cridem.org,2014-05-26,===NONE===,mercurochrome/NOM/mercurochrome,"A  midi  ,  ce  sont  les  militaires  qui  organisent  le  retour  vers  la  ""  cité mercurochrome  ""  ,  appellation  donnée  au  quartier  en  raison  de  la  proximité  de  l'  ancienne  polyclinique  .",mercurochrome,nom,mercurochrome,cité,cité,NOUN,"""","""",PUNCT,la,le,DET,vers,vers,ADP,retour,retour,NOUN,"""","""",PUNCT,",",",",PUNCT,appellation,appellation,NOUN,donnée,donner,VERB,au,au,ADP DET,2014-05-26,2014,2010,PUNCT NOUN Mercurochrome PUNCT PUNCT,NOUN Mercurochrome PUNCT,PUNCT NOUN Mercurochrome,DET PUNCT NOUN Mercurochrome,ADP DET PUNCT NOUN Mercurochrome,Mercurochrome PUNCT PUNCT,Mercurochrome PUNCT PUNCT NOUN,Mercurochrome PUNCT PUNCT NOUN VERB,""" cité Mercurochrome "" ,","cité Mercurochrome """,""" cité Mercurochrome","le "" cité Mercurochrome","vers le "" cité Mercurochrome","Mercurochrome "" ,","Mercurochrome "" , appellation","Mercurochrome "" , appellation donner"
http://www.liberation.fr/chroniques/2014/06/02/et-si-le-fn-etait-plus-a-gauche-que-francois-hollande_1032201?xtor=rss-450,liberation.fr,2014-06-05,France,Mercurochrome/NOM/mercurochrome,"Le  bleu  Marine  tamponne  au Mercurochrome  éventé  ,  médecine  estampillée  PCF  années  70  ,  les  fractures  sociales  qui  se  rouvrent  à  chaque  spasme  européen  .",mercurochrome,nom,mercurochrome,au,au,ADP DET,tamponne,tamponner,VERB,Marine,Marine,PROPN,bleu,bleu,ADJ,Le,le,DET,éventé,éventé,ADJ,",",",",PUNCT,médecine,médeciner,VERB,estampillée,estampiller,VERB,PCF,PCF,ABR,2014-06-05,2014,2010,VERB ADP DET Mercurochrome ADJ PUNCT,ADP DET Mercurochrome ADJ,VERB ADP DET Mercurochrome,PROPN VERB ADP DET Mercurochrome,ADJ PROPN VERB ADP DET Mercurochrome,Mercurochrome ADJ PUNCT,Mercurochrome ADJ PUNCT VERB,Mercurochrome ADJ PUNCT VERB VERB,"tamponner au Mercurochrome éventé ,",au Mercurochrome éventé,tamponner au Mercurochrome,Marine tamponner au Mercurochrome,bleu Marine tamponner au Mercurochrome,"Mercurochrome éventé ,","Mercurochrome éventé , médeciner","Mercurochrome éventé , médeciner estampiller"
http://www.ladepeche.fr/article/2014/06/24/1906303-uniformite.html,ladepeche.fr,2014-07-11,France,mercurochrome/NOM/mercurochrome,"Avec  ses  trous  et  ses  pièces  ,  elle  était  le  reflet  de  la  vie  des  enfants  ,  comme  les  genoux  barbouillés  au mercurochrome  et  la  terre  sous  les  ongles  .",mercurochrome,nom,mercurochrome,au,au,ADP DET,barbouillés,barbouiller,VERB,genoux,genou,NOUN,les,le,DET,comme,comme,CONJ,et,et,CONJ,la,le,DET,terre,terre,NOUN,sous,sous,ADP,les,le,DET,2014-07-11,2014,2010,VERB ADP DET Mercurochrome CONJ DET,ADP DET Mercurochrome CONJ,VERB ADP DET Mercurochrome,NOUN VERB ADP DET Mercurochrome,DET NOUN VERB ADP DET Mercurochrome,Mercurochrome CONJ DET,Mercurochrome CONJ DET NOUN,Mercurochrome CONJ DET NOUN ADP,barbouiller au Mercurochrome et le,au Mercurochrome et,barbouiller au Mercurochrome,genou barbouiller au Mercurochrome,le genou barbouiller au Mercurochrome,Mercurochrome et le,Mercurochrome et le terre,Mercurochrome et le terre sous
http://www.ledevoir.com/culture/livres/414301/bede-faut-qu-on-y-aille-sinon-on-va-louper-le-dernier-drakkar-muzo?utm_source=feedburner&utm_medium=feed&utm_campaign=Feed%253A%2Bfluxdudevoir%2B%2528Le%2Bfil%2Bde%2Bpresse%2Bdu%2BDevoir%2529&utm_content=FeedBurner%2Buser%2Bview,ledevoir.com,2014-07-26,Canada,mercurochrome/NOM/mercurochrome,"Sinon  ,  c'  est  l'  infirmerie  ,  le mercurochrome  --  cet  antiseptique  rouge  de  Français  --  ,  la  rencontre  avec  une  infirmière  canon  et  le  début  d'  une  romance  qui  pourrait  faciliter  la  mise  en  couleur  du  projet  .",mercurochrome,nom,mercurochrome,le,le,DET,",",",",PUNCT,infirmerie,infirmerie,NOUN,l',le,DET,est,être,VERB,--,--,PUNCT,cet,ce,PRON,antiseptique,antiseptique,ADJ,rouge,rouge,NOUN,de,de,ADP,2014-07-26,2014,2010,PUNCT DET Mercurochrome PUNCT PRON,DET Mercurochrome PUNCT,PUNCT DET Mercurochrome,NOUN PUNCT DET Mercurochrome,DET NOUN PUNCT DET Mercurochrome,Mercurochrome PUNCT PRON,Mercurochrome PUNCT PRON ADJ,Mercurochrome PUNCT PRON ADJ NOUN,", le Mercurochrome -- ce",le Mercurochrome --,", le Mercurochrome","infirmerie , le Mercurochrome","le infirmerie , le Mercurochrome",Mercurochrome -- ce,Mercurochrome -- ce antiseptique,Mercurochrome -- ce antiseptique rouge
http://blogs.rue89.nouvelobs.com/no-wine-is-innocent/2014/07/28/les-sept-peches-du-vin-de-brad-pitt-233314,nouvelobs.com,2014-07-28,===NONE===,mercurochrome/NOM/mercurochrome,"Première  séquence  ,  la  vue  :  c'  est  clair  comme  de  la  flotte  avec  une  ou  deux  gouttes  de mercurochrome  qui  danseraient  le  tango  dedans  .",mercurochrome,nom,mercurochrome,de,de,ADP,gouttes,goutte,NOUN,deux,deux,ADJ,ou,ou,CONJ,une,un,ADJ,qui,qui,PRON,danseraient,danser,VERB,le,le,DET,tango,tango,ADJ,dedans,dedans,NOUN,2014-07-28,2014,2010,NOUN ADP Mercurochrome PRON VERB,ADP Mercurochrome PRON,NOUN ADP Mercurochrome,ADJ NOUN ADP Mercurochrome,CONJ ADJ NOUN ADP Mercurochrome,Mercurochrome PRON VERB,Mercurochrome PRON VERB DET,Mercurochrome PRON VERB DET ADJ,goutte de Mercurochrome qui danser,de Mercurochrome qui,goutte de Mercurochrome,deux goutte de Mercurochrome,ou deux goutte de Mercurochrome,Mercurochrome qui danser,Mercurochrome qui danser le,Mercurochrome qui danser le tango
http://www.ladepeche.fr/article/2014/08/05/1929762-les-nouveautes-rasage-de-la-rentree.html,ladepeche.fr,2014-08-13,France,Mercurochrome/NAM/Mercurochrome,"Heureusement  , Mercurochrome  a  de  quoi  redonner  le  sourire  aux  plus  grincheux  avec  son  gel  hémostatique  Stop  saignement  .",mercurochrome,nam,mercurochrome,",",",",PUNCT,Heureusement,heureusement,ADV,,,,,,,,,,a,avoir,VERB,de,de,ADP,quoi,quoi,PRON,redonner,redonner,VERB,le,le,DET,2014-08-13,2014,2010,ADV PUNCT Mercurochrome VERB ADP,PUNCT Mercurochrome VERB,ADV PUNCT Mercurochrome,,,Mercurochrome VERB ADP,Mercurochrome VERB ADP PRON,Mercurochrome VERB ADP PRON VERB,"heureusement , Mercurochrome avoir de",", Mercurochrome avoir","heureusement , Mercurochrome",,,Mercurochrome avoir de,Mercurochrome avoir de quoi,Mercurochrome avoir de quoi redonner
http://www.ladepeche.fr/article/2014/08/05/1929762-les-nouveautes-rasage-de-la-rentree.html,ladepeche.fr,2014-08-13,France,Mercurochrome/NAM/Mercurochrome,"Fruit  d'  une  technologie  brevetée  ,  il  facilite  la  coagulation  et  permet  de  stopper  le  saignement  plus  rapidement  (  Gel  Stop  Saignement Mercurochrome  ,  6,49  euros  )  .",mercurochrome,nam,mercurochrome,Saignement,Saignement,PROPN,Stop,Stop,PROPN,Gel,Gel,PROPN,(,(,PUNCT,rapidement,rapidement,ADV,",",",",PUNCT,"6,49",@card@,ADJ,euros,euro,NOUN,),),PUNCT,.,.,PUNCT,2014-08-13,2014,2010,PROPN PROPN Mercurochrome PUNCT ADJ,PROPN Mercurochrome PUNCT,PROPN PROPN Mercurochrome,PROPN PROPN PROPN Mercurochrome,PUNCT PROPN PROPN PROPN Mercurochrome,Mercurochrome PUNCT ADJ,Mercurochrome PUNCT ADJ NOUN,Mercurochrome PUNCT ADJ NOUN PUNCT,"Stop Saignement Mercurochrome , @card@","Saignement Mercurochrome ,",Stop Saignement Mercurochrome,Gel Stop Saignement Mercurochrome,( Gel Stop Saignement Mercurochrome,"Mercurochrome , @card@","Mercurochrome , @card@ euro","Mercurochrome , @card@ euro )"
http://sixactualites.fr/apple-iphone-6-watch-ce-quil-faut-connaitre/7269/,sixactualites.fr,2014-09-20,France,Mercurochrome/NOM/mercurochrome," Mercurochrome  propose  une  montre  connectée  à  moins  de  40  euros  ,  mais  les  fonctionnalités  ne  sont  pas  aussi  poussées  . </doc>",mercurochrome,nom,mercurochrome,,,,,,,,,,,,,,,,propose,proposer,VERB,une,un,DET,montre,montre,NOUN,connectée,connecter,VERB,à,à,ADP,2014-09-20,2014,2010,,,,,,Mercurochrome VERB DET,Mercurochrome VERB DET NOUN,Mercurochrome VERB DET NOUN VERB,,,,,,Mercurochrome proposer un,Mercurochrome proposer un montre,Mercurochrome proposer un montre connecter
http://www.cafebabel.fr/article/la-playlist-macho-de-la-semaine.html,cafebabel.fr,2014-10-07,France,Mercurochrome/NAM/Mercurochrome,"Et  comme  la  chanson  ne  comporte  quasiment  pas  de  couplet  ,  le  refrain  est  aussi  lancinant  qu'  une  pub  pour  le Mercurochrome  .",mercurochrome,nam,mercurochrome,le,le,DET,pour,pour,ADP,pub,pub,NOUN,une,un,DET,qu',que,CONJ,.,.,PUNCT,,,,,,,,,,,,,2014-10-07,2014,2010,,DET Mercurochrome PUNCT,ADP DET Mercurochrome,NOUN ADP DET Mercurochrome,DET NOUN ADP DET Mercurochrome,,,,,le Mercurochrome .,pour le Mercurochrome,pub pour le Mercurochrome,un pub pour le Mercurochrome,,,
http://www.ladepeche.fr/article/2014/10/07/1967155-les-objets-sante-connectes-bientot-en-grandes-surfaces.html,ladepeche.fr,2014-10-08,France,Mercurochrome/NAM/Mercurochrome,"Marque  incontournable  dans  le  quotidien  des  Français  , Mercurochrome  sufe  à  son  tour  sur  la  tendance  des  objets  connectés  permettant  de  surveiller  sa  santé  ,  et  plus  particulièrement  son  sommeil  et  son  stress  .",mercurochrome,nam,mercurochrome,",",",",PUNCT,Français,Français,PROPN,des,du,ADP DET,quotidien,quotidien,NOUN,le,le,DET,sufe,sufe,VERB,à,à,ADP,son,son,DET,tour,tour,NOUN,sur,sur,ADP,2014-10-08,2014,2010,PROPN PUNCT Mercurochrome VERB ADP,PUNCT Mercurochrome VERB,PROPN PUNCT Mercurochrome,ADP DET PROPN PUNCT Mercurochrome,NOUN ADP DET PROPN PUNCT Mercurochrome,Mercurochrome VERB ADP,Mercurochrome VERB ADP DET,Mercurochrome VERB ADP DET NOUN,"Français , Mercurochrome sufe à",", Mercurochrome sufe","Français , Mercurochrome","du Français , Mercurochrome","quotidien du Français , Mercurochrome",Mercurochrome sufe à,Mercurochrome sufe à son,Mercurochrome sufe à son tour
http://www.ladepeche.fr/article/2014/10/07/1967155-les-objets-sante-connectes-bientot-en-grandes-surfaces.html,ladepeche.fr,2014-10-08,France,Mercurochrome/ADJ/Mercurochrome,"À  la  mi-novembre  , Mercurochrome  lancera  deux  ""  coachs  ""  santé  disponibles  en  grandes  et  moyennes  surfaces  .",mercurochrome,adj,mercurochrome,",",",",PUNCT,mi-novembre,mi-novembre,NOUN,la,le,DET,À,à,ADP,,,,lancera,lancer,VERB,deux,deux,ADJ,"""","""",PUNCT,coachs,coach,NOUN,"""","""",PUNCT,2014-10-08,2014,2010,NOUN PUNCT Mercurochrome VERB ADJ,PUNCT Mercurochrome VERB,NOUN PUNCT Mercurochrome,DET NOUN PUNCT Mercurochrome,ADP DET NOUN PUNCT Mercurochrome,Mercurochrome VERB ADJ,Mercurochrome VERB ADJ PUNCT,Mercurochrome VERB ADJ PUNCT NOUN,"mi-novembre , Mercurochrome lancer deux",", Mercurochrome lancer","mi-novembre , Mercurochrome","le mi-novembre , Mercurochrome","à le mi-novembre , Mercurochrome",Mercurochrome lancer deux,"Mercurochrome lancer deux ""","Mercurochrome lancer deux "" coach"
http://www.ladepeche.fr/article/2014/10/07/1967155-les-objets-sante-connectes-bientot-en-grandes-surfaces.html,ladepeche.fr,2014-10-08,France,Mercurochrome/ADJ/Mercurochrome,"Pourtant  ,  ce  lancement  ne  peut  passer  inaperçu  tant  la  marque Mercurochrome  est  une  incontournable  dans  la  vie  des  consommateurs  ,  référence  pour  soigner  petites  plaies  et  douleurs  bénignes  .",mercurochrome,adj,mercurochrome,marque,marque,NOUN,la,le,DET,tant,tant,ADV,inaperçu,inaperçu,ADJ,passer,passer,VERB,est,être,VERB,une,un,DET,incontournable,incontournable,ADJ,dans,dans,ADP,la,le,DET,2014-10-08,2014,2010,DET NOUN Mercurochrome VERB DET,NOUN Mercurochrome VERB,DET NOUN Mercurochrome,ADV DET NOUN Mercurochrome,ADJ ADV DET NOUN Mercurochrome,Mercurochrome VERB DET,Mercurochrome VERB DET ADJ,Mercurochrome VERB DET ADJ ADP,le marque Mercurochrome être un,marque Mercurochrome être,le marque Mercurochrome,tant le marque Mercurochrome,inaperçu tant le marque Mercurochrome,Mercurochrome être un,Mercurochrome être un incontournable,Mercurochrome être un incontournable dans
