url,website,date,country,keyword,sentence,kw,kw_lemma,kw_pos,left_w1,left_l1,left_p1,left_w2,left_l2,left_p2,left_w3,left_l3,left_p3,left_w4,left_l4,left_p4,left_w5,left_l5,left_p5,right_w1,right_l1,right_p1,right_w2,right_l2,right_p2,right_w3,right_l3,right_p3,right_w4,right_l4,right_p4,right_w5,right_l5,right_p5,datetime,year,10years,pattern_around5,pattern_around3,pattern_left2,pattern_left3,pattern_left4,pattern_right2,pattern_right3,pattern_right4,pattern_around5_lex,pattern_around3_lex,pattern_left2_lex,pattern_left3_lex,pattern_left4_lex,pattern_right2_lex,pattern_right3_lex,pattern_right4_lex
http://www.leparisien.fr/flash-actualite-sante/la-revue-prescrire-appelle-au-retrait-du-motilium-cause-de-morts-subites-19-02-2014-3605519.php,leparisien.fr,2014-02-19,France,Primpéran/NAM/Primpéran,"En  pratique  ,  souvent  les  troubles  qui  motivent  la  prise  de  ce  médicament  disparaissent  spontanément  ,  ou  avec  l'  appoint  de  mesures  diététiques  ,  indique  Prescrire  qui  cite  des  options  thérapeutiques  comme  par  exemple  le  Mopral  en  cas  de  reflux  gastro-oesophagien  (  remontée  du  contenu  de  l'  estomac  dans  la  bouche  )  ou  encore  ""  dans  de  rares  cas  ""  et  ""  avec  beaucoup  de  prudence  ""  le Primpéran  ou  ses  équivalents  (  molécule  :  métoclopramide  )  et  à  dose  ""  minimale  ,  en  surveillant  de  très  près  ses  effets  indésirables  de  neuroleptique  ""  . </doc>",primpéran,nam,primpéran,le,le,DET,"""","""",PUNCT,prudence,prudence,NOUN,de,de,ADP,beaucoup,beaucoup,ADV,ou,ou,CONJ,ses,son,DET,équivalents,équivalent,NOUN,(,(,PUNCT,molécule,molécule,NOUN,2014-02-19,2014,2010,PUNCT DET Primpéran CONJ DET,DET Primpéran CONJ,PUNCT DET Primpéran,NOUN PUNCT DET Primpéran,ADP NOUN PUNCT DET Primpéran,Primpéran CONJ DET,Primpéran CONJ DET NOUN,Primpéran CONJ DET NOUN PUNCT,""" le Primpéran ou son",le Primpéran ou,""" le Primpéran","prudence "" le Primpéran","de prudence "" le Primpéran",Primpéran ou son,Primpéran ou son équivalent,Primpéran ou son équivalent (
http://www.quechoisir.org/sante-bien-etre/maladie-medecine/medicament/actualite-motilium-un-medicament-trop-dangereux,quechoisir.org,2014-02-20,===NONE===,Primpéran/NAM/Primpéran,"Si  un  médicament  est  jugé  indispensable  ,  le  métoclopramide  ( Primpéran  ou  autres  )  peut  être  envisagé  ,  avec  ""  beaucoup  de  prudence  ""  ,  souligne  Prescrire  qui  rappelle  que  ce  médicament  expose  aussi  à  des  effets  indésirables  importants  . </doc>",primpéran,nam,primpéran,(,(,PUNCT,métoclopramide,métoclopramide,NOUN,le,le,DET,",",",",PUNCT,indispensable,indispensable,ADJ,ou,ou,CONJ,autres,autre,ADJ,),),PUNCT,peut,pouvoir,VERB,être,être,VERB,2014-02-20,2014,2010,NOUN PUNCT Primpéran CONJ ADJ,PUNCT Primpéran CONJ,NOUN PUNCT Primpéran,DET NOUN PUNCT Primpéran,PUNCT DET NOUN PUNCT Primpéran,Primpéran CONJ ADJ,Primpéran CONJ ADJ PUNCT,Primpéran CONJ ADJ PUNCT VERB,métoclopramide ( Primpéran ou autre,( Primpéran ou,métoclopramide ( Primpéran,le métoclopramide ( Primpéran,", le métoclopramide ( Primpéran",Primpéran ou autre,Primpéran ou autre ),Primpéran ou autre ) pouvoir
http://news.doctissimo.fr/Medicaments/Motilium-cet-antivomitif-est-il-dangereux-34249,doctissimo.fr,2014-02-20,France,Primpéran/NAM/Primpéran,"-  Et  dans  les  rares  situations  où  un  ""  modificateur  de  la  motricité  ""  gastrique  semble  justifié  ,  le  métoclopramide  ( Primpéran  ou  autre  )  est  à  discuter  ,  mais  avec  beaucoup  de  prudence  :  à  posologie  minimale  ,  en  surveillant  de  très  près  ses  effets  indésirables  de  neuroleptique  .",primpéran,nam,primpéran,(,(,PUNCT,métoclopramide,métoclopramide,NOUN,le,le,DET,",",",",PUNCT,justifié,justifier,VERB,ou,ou,CONJ,autre,autre,ADJ,),),PUNCT,est,être,VERB,à,à,ADP,2014-02-20,2014,2010,NOUN PUNCT Primpéran CONJ ADJ,PUNCT Primpéran CONJ,NOUN PUNCT Primpéran,DET NOUN PUNCT Primpéran,PUNCT DET NOUN PUNCT Primpéran,Primpéran CONJ ADJ,Primpéran CONJ ADJ PUNCT,Primpéran CONJ ADJ PUNCT VERB,métoclopramide ( Primpéran ou autre,( Primpéran ou,métoclopramide ( Primpéran,le métoclopramide ( Primpéran,", le métoclopramide ( Primpéran",Primpéran ou autre,Primpéran ou autre ),Primpéran ou autre ) être
http://www.humanite.fr/societe/motilium-encore-un-medicament-sur-liste-noire-559698,humanite.fr,2014-02-21,France,Primpéran/NAM/Primpéran,"""  Et  dans  les  rares  situations  où  un  ""  modificateur  de  la  motricité  ""  gastrique  semble  justifié  ,  ""  le  métoclopramide  ( Primpéran  ou  autre  )  est  à  discuter  ,  mais  avec  beaucoup  de  prudence  ""  . </doc>",primpéran,nam,primpéran,(,(,PUNCT,métoclopramide,métoclopramide,NOUN,le,le,DET,"""","""",PUNCT,",",",",PUNCT,ou,ou,CONJ,autre,autre,ADJ,),),PUNCT,est,être,VERB,à,à,ADP,2014-02-21,2014,2010,NOUN PUNCT Primpéran CONJ ADJ,PUNCT Primpéran CONJ,NOUN PUNCT Primpéran,DET NOUN PUNCT Primpéran,PUNCT DET NOUN PUNCT Primpéran,Primpéran CONJ ADJ,Primpéran CONJ ADJ PUNCT,Primpéran CONJ ADJ PUNCT VERB,métoclopramide ( Primpéran ou autre,( Primpéran ou,métoclopramide ( Primpéran,le métoclopramide ( Primpéran,""" le métoclopramide ( Primpéran",Primpéran ou autre,Primpéran ou autre ),Primpéran ou autre ) être
http://www.liberation.fr/vous/2014/02/24/prescrire-sans-contestation_982633?xtor=rss-450,liberation.fr,2014-03-04,France,Primpéran/NAM/Primpéran,"Et  Prescrire  d'  ajouter  que  souvent  les  troubles  qui  motivent  la  prise  de  ce  médicament  disparaissent  spontanément  ,  et  de  citer  des  options  thérapeutiques  alternatives  comme  le  Mopral  ou  encore  ,  ""  dans  de  rares  cas  ""  et  ""  avec  beaucoup  de  prudence  ""  ,  le Primpéran  .",primpéran,nam,primpéran,le,le,DET,",",",",PUNCT,"""","""",PUNCT,prudence,prudence,NOUN,de,de,ADP,.,.,PUNCT,,,,,,,,,,,,,2014-03-04,2014,2010,,DET Primpéran PUNCT,PUNCT DET Primpéran,PUNCT PUNCT DET Primpéran,NOUN PUNCT PUNCT DET Primpéran,,,,,le Primpéran .,", le Primpéran",""" , le Primpéran","prudence "" , le Primpéran",,,
http://www1.lalibre.be/actu/sciences-sante/le-motilium-un-medicament-dangereux-bientot-retire-du-marche-5305c5df357025291dd162b4,lalibre.be,2014-03-10,Belgium,Primpéran/NAM/Primpéran,"En  pratique  ,  souvent  les  troubles  qui  motivent  la  prise  de  ce  médicament  disparaissent  spontanément  ,  ou  avec  l'  appoint  de  mesures  diététiques  ,  indique  Prescrire  qui  cite  des  options  thérapeutiques  comme  par  exemple  le  Mopral  en  cas  de  reflux  gastro-oesophagien  (  remontée  du  contenu  de  l'  estomac  dans  la  bouche  )  ou  encore  ""  dans  de  rares  cas  ""  et  ""  avec  beaucoup  de  prudence  ""  le Primpéran  ou  ses  équivalents  (  molécule  :  métoclopramide  )  et  à  dose  ""  minimale  ,  en  surveillant  de  très  près  ses  effets  indésirables  de  neuroleptique  ""  . </doc>",primpéran,nam,primpéran,le,le,DET,"""","""",PUNCT,prudence,prudence,NOUN,de,de,ADP,beaucoup,beaucoup,ADV,ou,ou,CONJ,ses,son,DET,équivalents,équivalent,NOUN,(,(,PUNCT,molécule,molécule,NOUN,2014-03-10,2014,2010,PUNCT DET Primpéran CONJ DET,DET Primpéran CONJ,PUNCT DET Primpéran,NOUN PUNCT DET Primpéran,ADP NOUN PUNCT DET Primpéran,Primpéran CONJ DET,Primpéran CONJ DET NOUN,Primpéran CONJ DET NOUN PUNCT,""" le Primpéran ou son",le Primpéran ou,""" le Primpéran","prudence "" le Primpéran","de prudence "" le Primpéran",Primpéran ou son,Primpéran ou son équivalent,Primpéran ou son équivalent (
http://www.ladepeche.fr/article/2015/03/26/2075617-migraine-les-medicaments-incontournables.html,ladepeche.fr,2015-03-27,France,Primpéran/NAM/Primpéran,On  peut  également  les  associer  à  des  anti-nauséeux  ( Primpéran  ®  )  .,primpéran,nam,primpéran,(,(,PUNCT,anti-nauséeux,anti-nauséeux,NOUN,des,du,ADP DET,à,à,ADP,associer,associer,VERB,®,®,NOUN,),),PUNCT,.,.,PUNCT,,,,,,,2015-03-27,2015,2010,NOUN PUNCT Primpéran NOUN PUNCT,PUNCT Primpéran NOUN,NOUN PUNCT Primpéran,ADP DET NOUN PUNCT Primpéran,ADP ADP DET NOUN PUNCT Primpéran,Primpéran NOUN PUNCT,Primpéran NOUN PUNCT PUNCT,,anti-nauséeux ( Primpéran ® ),( Primpéran ®,anti-nauséeux ( Primpéran,du anti-nauséeux ( Primpéran,à du anti-nauséeux ( Primpéran,Primpéran ® ),Primpéran ® ) .,
http://www.sudinfo.be/1258524/article/2015-04-08/les-anti-nausee-comme-le-motilium-pourraient-etre-responsables-de-plus-de-200-mo,sudinfo.be,2015-04-08,Belgium,Primpéran/NAM/Primpéran,"Elle  ajoute  dans  son  dernier  numéro  que  des  médicaments  comme  la  métopimazine  (  Vogalène  ou  générique  )  et  le  métoclopramide  ( Primpéran  ou  générique  )  sont  ""  voisins  de  la  dompéridone  et  sont  dangereux  aussi  ""  .",primpéran,nam,primpéran,(,(,PUNCT,métoclopramide,métoclopramide,NOUN,le,le,DET,et,et,CONJ,),),PUNCT,ou,ou,CONJ,générique,générique,ADJ,),),PUNCT,sont,être,VERB,"""","""",PUNCT,2015-04-08,2015,2010,NOUN PUNCT Primpéran CONJ ADJ,PUNCT Primpéran CONJ,NOUN PUNCT Primpéran,DET NOUN PUNCT Primpéran,CONJ DET NOUN PUNCT Primpéran,Primpéran CONJ ADJ,Primpéran CONJ ADJ PUNCT,Primpéran CONJ ADJ PUNCT VERB,métoclopramide ( Primpéran ou générique,( Primpéran ou,métoclopramide ( Primpéran,le métoclopramide ( Primpéran,et le métoclopramide ( Primpéran,Primpéran ou générique,Primpéran ou générique ),Primpéran ou générique ) être
http://www.sudinfo.be/1258524/article/2015-04-08/les-anti-nausee-comme-le-motilium-pourraient-etre-responsables-de-plus-de-200-mo,sudinfo.be,2015-04-08,Belgium,Primpéran/NAM/Primpéran,"Le Primpéran  (  et  ses  génériques  )  ,  également  utilisé  pour  combattre  les  nausées  et  les  vomissements  ,  a  lui  aussi  fait  l'  objet  d'  une  réévaluation  européenne  l'  an  dernier  qui  a  abouti  à  des  restrictions  d'  utilisation  pour  diminuer  le  risque  ""  d'  effets  indésirables  neurologiques  et  cardiovasculaires  ""  . </doc>",primpéran,nam,primpéran,Le,le,DET,,,,,,,,,,,,,(,(,PUNCT,et,et,CONJ,ses,son,DET,génériques,générique,NOUN,),),PUNCT,2015-04-08,2015,2010,,DET Primpéran PUNCT,,,,Primpéran PUNCT CONJ,Primpéran PUNCT CONJ DET,Primpéran PUNCT CONJ DET NOUN,,le Primpéran (,,,,Primpéran ( et,Primpéran ( et son,Primpéran ( et son générique
http://www.lemonde.fr/sante/article/2015/04/09/mort-subite-la-domperidone-a-nouveau-accusee_4612213_1651302.html,lemonde.fr,2015-04-09,France,Primpéran/NAM/Primpéran,"Les  médicaments  voisins  ,  tels  que  la  métopimazine  (  commercialisé  sous  le  nom  Vogalène  )  et  la  métoclopramide  ( Primpéran  )  ,  sont  également  dangereux  ,  ajoute  Prescrire  .",primpéran,nam,primpéran,(,(,PUNCT,métoclopramide,métoclopramide,NOUN,la,le,DET,et,et,CONJ,),),PUNCT,),),PUNCT,",",",",PUNCT,sont,être,VERB,également,également,ADV,dangereux,dangereux,ADJ,2015-04-09,2015,2010,NOUN PUNCT Primpéran PUNCT PUNCT,PUNCT Primpéran PUNCT,NOUN PUNCT Primpéran,DET NOUN PUNCT Primpéran,CONJ DET NOUN PUNCT Primpéran,Primpéran PUNCT PUNCT,Primpéran PUNCT PUNCT VERB,Primpéran PUNCT PUNCT VERB ADV,"métoclopramide ( Primpéran ) ,",( Primpéran ),métoclopramide ( Primpéran,le métoclopramide ( Primpéran,et le métoclopramide ( Primpéran,"Primpéran ) ,","Primpéran ) , être","Primpéran ) , être également"
http://www.ouest-france.fr/node/3353494,ouest-france.fr,2015-04-23,France,Primpéran/NAM/Primpéran,"Plus  généralement  ,  ""  les  praticiens  prescrivent  aussi  trop  d'  anti-vomitifs  ,  et  pas  seulement  la  dompéridone  ,  c'  est  aussi  le  cas  du  métoclopramide  ( Primpéran  )  et  de  la  métopimazine  (  Vogalène  )  ,  qui  ne  sont  pas  plus  à  favoriser  ""  ,  ajoute  le  DG  de  l'  ANSM  .",primpéran,nam,primpéran,(,(,PUNCT,métoclopramide,métoclopramide,NOUN,du,du,ADP DET,cas,cas,NOUN,le,le,DET,),),PUNCT,et,et,CONJ,de,de,ADP,la,le,DET,métopimazine,métopimazine,NOUN,2015-04-23,2015,2010,NOUN PUNCT Primpéran PUNCT CONJ,PUNCT Primpéran PUNCT,NOUN PUNCT Primpéran,ADP DET NOUN PUNCT Primpéran,NOUN ADP DET NOUN PUNCT Primpéran,Primpéran PUNCT CONJ,Primpéran PUNCT CONJ ADP,Primpéran PUNCT CONJ ADP DET,métoclopramide ( Primpéran ) et,( Primpéran ),métoclopramide ( Primpéran,du métoclopramide ( Primpéran,cas du métoclopramide ( Primpéran,Primpéran ) et,Primpéran ) et de,Primpéran ) et de le
http://www.actusoins.com/262391/motilium-et-ses-generiques-231-morts-en-2012.html,actusoins.com,2015-04-07,===NONE===,Primpéran/NOM/Primpéran,"Et  d'  alerter  :  ""  Les  médicaments  tels  que  la  métopimazine  (  Vogalène  ®  ou  autre  )  et  le  métoclopramide  ( Primpéran  ®  ou  autre  )  sont  voisins  de  la  dompéridone  et  sont  dangereux  aussi  ""  . </doc>",primpéran,nom,primpéran,(,(,PUNCT,métoclopramide,métoclopramide,NOUN,le,le,DET,et,et,CONJ,),),PUNCT,®,®,ADJ,ou,ou,CONJ,autre,autre,ADJ,),),PUNCT,sont,être,VERB,2015-04-07,2015,2010,NOUN PUNCT Primpéran ADJ CONJ,PUNCT Primpéran ADJ,NOUN PUNCT Primpéran,DET NOUN PUNCT Primpéran,CONJ DET NOUN PUNCT Primpéran,Primpéran ADJ CONJ,Primpéran ADJ CONJ ADJ,Primpéran ADJ CONJ ADJ PUNCT,métoclopramide ( Primpéran ® ou,( Primpéran ®,métoclopramide ( Primpéran,le métoclopramide ( Primpéran,et le métoclopramide ( Primpéran,Primpéran ® ou,Primpéran ® ou autre,Primpéran ® ou autre )
http://www.afrik.com/la-domperidone-a-cause-231-morts-subites-cardiaques-en-2012,afrik.com,2015-04-07,France,Primpéran/NAM/Primpéran,"Prescrire  indexe  aussi  des  produits  voisins  ,  notament  la  métopimazine  (  Vogalène  et  autres  )  et  le  métoclopramide  ( Primpéran  et  autres  )  . </doc>",primpéran,nam,primpéran,(,(,PUNCT,métoclopramide,métoclopramide,NOUN,le,le,DET,et,et,CONJ,),),PUNCT,et,et,CONJ,autres,autre,ADJ,),),PUNCT,.,.,PUNCT,</doc>,,,2015-04-07,2015,2010,NOUN PUNCT Primpéran CONJ ADJ,PUNCT Primpéran CONJ,NOUN PUNCT Primpéran,DET NOUN PUNCT Primpéran,CONJ DET NOUN PUNCT Primpéran,Primpéran CONJ ADJ,Primpéran CONJ ADJ PUNCT,Primpéran CONJ ADJ PUNCT PUNCT,métoclopramide ( Primpéran et autre,( Primpéran et,métoclopramide ( Primpéran,le métoclopramide ( Primpéran,et le métoclopramide ( Primpéran,Primpéran et autre,Primpéran et autre ),Primpéran et autre ) .
http://sante.lefigaro.fr/actualite/2015/04/22/23640-france-consomme-quatre-fois-trop-motilium,lefigaro.fr,2015-04-22,France,Primpéran/NAM/Primpéran,"Les  médecins  vous  diront  que  les  usagers  sont  très  demandeurs  ,  mais  les  praticiens  prescrivent  aussi  trop  d'  antivomitifs  ,  et  pas  seulement  la  dompéridone  ,  c'  est  aussi  le  cas  du  métoclopramide  ( Primpéran  )  et  de  la  métopimazine  (  Vogalène  )  ,  qui  ne  sont  pas  plus  à  favoriser  .",primpéran,nam,primpéran,(,(,PUNCT,métoclopramide,métoclopramide,NOUN,du,du,ADP DET,cas,cas,NOUN,le,le,DET,),),PUNCT,et,et,CONJ,de,de,ADP,la,le,DET,métopimazine,métopimazine,NOUN,2015-04-22,2015,2010,NOUN PUNCT Primpéran PUNCT CONJ,PUNCT Primpéran PUNCT,NOUN PUNCT Primpéran,ADP DET NOUN PUNCT Primpéran,NOUN ADP DET NOUN PUNCT Primpéran,Primpéran PUNCT CONJ,Primpéran PUNCT CONJ ADP,Primpéran PUNCT CONJ ADP DET,métoclopramide ( Primpéran ) et,( Primpéran ),métoclopramide ( Primpéran,du métoclopramide ( Primpéran,cas du métoclopramide ( Primpéran,Primpéran ) et,Primpéran ) et de,Primpéran ) et de le
http://www.metronews.fr/info/efferalgan-paracetamol-la-codeine-interdite-avant-l-age-de-12-ans/modB%21i50vuXL1o8Exs/,metronews.fr,2015-05-02,France,Primpéran/NAM/Primpéran,">>  Motilium  ,  Vogalène  , Primpéran  :  les  anti-nausée  aurait  causé  la  mort  de  231  personnes  en  2012 </doc>",primpéran,nam,primpéran,",",",",PUNCT,Vogalène,Vogalène,PROPN,",",",",PUNCT,Motilium,Motilium,PROPN,>>,>>,PUNCT,:,:,PUNCT,les,le,DET,anti-nausée,anti-nausée,NOUN,aurait,avoir,VERB,causé,causer,VERB,2015-05-02,2015,2010,PROPN PUNCT Primpéran PUNCT DET,PUNCT Primpéran PUNCT,PROPN PUNCT Primpéran,PUNCT PROPN PUNCT Primpéran,PROPN PUNCT PROPN PUNCT Primpéran,Primpéran PUNCT DET,Primpéran PUNCT DET NOUN,Primpéran PUNCT DET NOUN VERB,"Vogalène , Primpéran : le",", Primpéran :","Vogalène , Primpéran",", Vogalène , Primpéran","Motilium , Vogalène , Primpéran",Primpéran : le,Primpéran : le anti-nausée,Primpéran : le anti-nausée avoir
http://www.lexpress.fr/styles/enfant/quels-sont-les-remedes-contre-la-nausee-de-grossesse_1734757.html,lexpress.fr,2015-12-08,France,Primpéran/NAM/Primpéran,"En  cas  de  besoin  et  sur  prescription  ,  le  métoclopramide  ( Primpéran  )  peut  être  indiqué  .",primpéran,nam,primpéran,(,(,PUNCT,métoclopramide,métoclopramide,NOUN,le,le,DET,",",",",PUNCT,prescription,prescription,NOUN,),),PUNCT,peut,pouvoir,VERB,être,être,VERB,indiqué,indiquer,VERB,.,.,PUNCT,2015-12-08,2015,2010,NOUN PUNCT Primpéran PUNCT VERB,PUNCT Primpéran PUNCT,NOUN PUNCT Primpéran,DET NOUN PUNCT Primpéran,PUNCT DET NOUN PUNCT Primpéran,Primpéran PUNCT VERB,Primpéran PUNCT VERB VERB,Primpéran PUNCT VERB VERB VERB,métoclopramide ( Primpéran ) pouvoir,( Primpéran ),métoclopramide ( Primpéran,le métoclopramide ( Primpéran,", le métoclopramide ( Primpéran",Primpéran ) pouvoir,Primpéran ) pouvoir être,Primpéran ) pouvoir être indiquer
http://sante.journaldesfemmes.com/magazine/1555133-risque-motilium-domperidone-enfants-has/,journaldesfemmes.com,2016-03-25,===NONE===,Primpéran/NAM/Primpéran,"Le  Vogalène  et  ses  génériques  ,  à  base  de  métopimazine  ,  ou  le Primpéran  et  ses  génériques  ,  à  base  de  métoclopramide  . </doc>",primpéran,nam,primpéran,le,le,DET,ou,ou,CONJ,",",",",PUNCT,métopimazine,métopimazine,NOUN,de,de,ADP,et,et,CONJ,ses,son,DET,génériques,générique,NOUN,",",",",PUNCT,à,à,ADP,2016-03-25,2016,2010,CONJ DET Primpéran CONJ DET,DET Primpéran CONJ,CONJ DET Primpéran,PUNCT CONJ DET Primpéran,NOUN PUNCT CONJ DET Primpéran,Primpéran CONJ DET,Primpéran CONJ DET NOUN,Primpéran CONJ DET NOUN PUNCT,ou le Primpéran et son,le Primpéran et,ou le Primpéran,", ou le Primpéran","métopimazine , ou le Primpéran",Primpéran et son,Primpéran et son générique,"Primpéran et son générique ,"
http://www.femmeactuelle.fr/sante/news-sante/anti-nauseeux-motilium-fortement-deconseille-enfants-28673,femmeactuelle.fr,2016-03-27,France,Primpéran/NAM/Primpéran,"La  HAS  préconise  des  médicaments  à  base  de  métopimazine  tel  que  le  Vogalen  ou  de  métoclopramide  , Primpéran  .",primpéran,nam,primpéran,",",",",PUNCT,métoclopramide,métoclopramide,NOUN,de,de,ADP,ou,ou,CONJ,Vogalen,Vogalen,PROPN,.,.,PUNCT,,,,,,,,,,,,,2016-03-27,2016,2010,,PUNCT Primpéran PUNCT,NOUN PUNCT Primpéran,ADP NOUN PUNCT Primpéran,CONJ ADP NOUN PUNCT Primpéran,,,,,", Primpéran .","métoclopramide , Primpéran","de métoclopramide , Primpéran","ou de métoclopramide , Primpéran",,,
http://next.liberation.fr/cinema/2017/05/19/blitzkrieg-drone_1570912?xtor=rss-450,liberation.fr,2017-05-19,France,Primpéran/NOM/Primpéran,"Envoyez  le  sac  à  vomi  ,  mais  faites  quelque  chose  bitte  schön  :  il  reste  neuf  jours  de  Festival  ,  et  on  n'  envisage  pas  une  seconde  de  gober  plus  de  cinq Primpéran  par  jour  jusqu'  à  dimanche  prochain  . </doc>",primpéran,nom,primpéran,cinq,cinq,ADJ,de,de,ADP,plus,plus,ADV,gober,gober,VERB,de,de,ADP,par,par,ADP,jour,jour,NOUN,jusqu',jusque,ADP,à,à,ADP,dimanche,dimanche,NOUN,2017-05-19,2017,2010,ADP ADJ Primpéran ADP NOUN,ADJ Primpéran ADP,ADP ADJ Primpéran,ADV ADP ADJ Primpéran,VERB ADV ADP ADJ Primpéran,Primpéran ADP NOUN,Primpéran ADP NOUN ADP,Primpéran ADP NOUN ADP ADP,de cinq Primpéran par jour,cinq Primpéran par,de cinq Primpéran,plus de cinq Primpéran,gober plus de cinq Primpéran,Primpéran par jour,Primpéran par jour jusque,Primpéran par jour jusque à
http://www.leblogdelamechante.fr/blog-mode/guide-vol-long-courrier/?utm_source=feedburner&utm_medium=feed&utm_campaign=Feed%253A%2Bleblogdelamechante%252FWuau%2B%2528Eleonore%2BBridge%2529&utm_content=FeedBurner,leblogdelamechante.fr,2017-07-05,France,primpéran/NOM/primpéran,"Du  décontractyl  pour  éviter  de  se  choper  un  torticolis  avec  le  siège  pourri  et  le  froid  (  super  le  voyage  après  :  D  )  Du  lopéramide  pour  éviter  d'  aller  aux  toilettes  toutes  les  3  minutes  en  courant  (  entre  l'  inconfort  et  les  plats  d'  avions  ça  arrive  trèèès  souvent  )  Du primpéran  contre  la  nauséeDes  somnifères  pour  dormir  (  je  n'  en  prends  jamais  ,  mais  maintenant  je  sais  que  passer  une  nuit  blanche  dans  l'  avion  pour  embrayer  sur  une  journée  complète  à  l'  arrivée  est  plus  dévastateur  pour  mon  organisme  que  prendre  un  somnifère  )  Du  nerf  !",primpéran,nom,primpéran,Du,Du,VERB,),),PUNCT,souvent,souvent,ADV,trèèès,trèèès,NOUN,arrive,arriver,VERB,contre,contre,ADP,la,le,DET,nauséeDes,nauséeDes,NOUN,somnifères,somnifère,ADJ,pour,pour,ADP,2017-07-05,2017,2010,PUNCT VERB Primpéran ADP DET,VERB Primpéran ADP,PUNCT VERB Primpéran,ADV PUNCT VERB Primpéran,NOUN ADV PUNCT VERB Primpéran,Primpéran ADP DET,Primpéran ADP DET NOUN,Primpéran ADP DET NOUN ADJ,) Du Primpéran contre le,Du Primpéran contre,) Du Primpéran,souvent ) Du Primpéran,trèèès souvent ) Du Primpéran,Primpéran contre le,Primpéran contre le nauséeDes,Primpéran contre le nauséeDes somnifère
https://www.leblogdelamechante.fr/blog-mode/guide-vol-long-courrier/?utm_source=feedburner&utm_medium=feed&utm_campaign=Feed%253A%2Bleblogdelamechante%252FWuau%2B%2528Eleonore%2BBridge%2529&utm_content=FeedBurner,leblogdelamechante.fr,2017-09-03,France,primpéran/NOM/primpéran,"Du  décontractyl  pour  éviter  de  se  choper  un  torticolis  avec  le  siège  pourri  et  le  froid  (  super  le  voyage  après  :  D  )  Du  lopéramide  pour  éviter  d'  aller  aux  toilettes  toutes  les  3  minutes  en  courant  (  entre  l'  inconfort  et  les  plats  d'  avions  ça  arrive  trèèès  souvent  )  Du primpéran  contre  la  nauséeDes  somnifères  pour  dormir  (  je  n'  en  prends  jamais  ,  mais  maintenant  je  sais  que  passer  une  nuit  blanche  dans  l'  avion  pour  embrayer  sur  une  journée  complète  à  l'  arrivée  est  plus  dévastateur  pour  mon  organisme  que  prendre  un  somnifère  )  Du  nerf  !",primpéran,nom,primpéran,Du,Du,VERB,),),PUNCT,souvent,souvent,ADV,trèèès,trèèès,NOUN,arrive,arriver,VERB,contre,contre,ADP,la,le,DET,nauséeDes,nauséeDes,NOUN,somnifères,somnifère,ADJ,pour,pour,ADP,2017-09-03,2017,2010,PUNCT VERB Primpéran ADP DET,VERB Primpéran ADP,PUNCT VERB Primpéran,ADV PUNCT VERB Primpéran,NOUN ADV PUNCT VERB Primpéran,Primpéran ADP DET,Primpéran ADP DET NOUN,Primpéran ADP DET NOUN ADJ,) Du Primpéran contre le,Du Primpéran contre,) Du Primpéran,souvent ) Du Primpéran,trèèès souvent ) Du Primpéran,Primpéran contre le,Primpéran contre le nauséeDes,Primpéran contre le nauséeDes somnifère
https://www.huffingtonpost.fr/sandra-lorenzo/arretez-de-dire-aux-femmes-enceintes-que-leurs-nausees-sont-simplement-normales_a_23422596/,huffingtonpost.fr,2018-05-02,France,Primpéran/NAM/Primpéran,"Je  me  suis  tournée  vers  les  médicaments  ,  ma  médecin  m'  a  prescrit  du Primpéran  ,  un  anti-nausée  très  classique  qui  s'  est  révélé  inefficace  .",primpéran,nam,primpéran,du,du,ADP DET,prescrit,prescrire,VERB,a,avoir,VERB,m',me,PRON,médecin,médecin,NOUN,",",",",PUNCT,un,un,DET,anti-nausée,anti-nausée,NOUN,très,très,ADV,classique,classique,ADJ,2018-05-02,2018,2010,VERB ADP DET Primpéran PUNCT DET,ADP DET Primpéran PUNCT,VERB ADP DET Primpéran,VERB VERB ADP DET Primpéran,PRON VERB VERB ADP DET Primpéran,Primpéran PUNCT DET,Primpéran PUNCT DET NOUN,Primpéran PUNCT DET NOUN ADV,"prescrire du Primpéran , un","du Primpéran ,",prescrire du Primpéran,avoir prescrire du Primpéran,me avoir prescrire du Primpéran,"Primpéran , un","Primpéran , un anti-nausée","Primpéran , un anti-nausée très"
http://www.lemonde.fr/sciences/article/2018/05/21/en-2003-l-homeopathie-a-ete-deremboursee-partiellement_5302410_1650684.html,lemonde.fr,2018-05-21,France,Primpéran/NAM/Primpéran,"Figuraient  en  effet  des  médicaments  très  prescrits  ,  tels  que  Zyrtec  (  UCB  Pharma  )  ,  Clarityne  (  Schering-Plough  )  ,  très  utilisés  contre  les  allergies  ,  ou  encore  l'  antiémétique Primpéran  (  Sanofi-Synthélabo  )  .",primpéran,nam,primpéran,antiémétique,antiémétique,ADJ,l',le,DET,encore,encore,ADV,ou,ou,CONJ,",",",",PUNCT,(,(,PUNCT,Sanofi-Synthélabo,Sanofi-Synthélabo,PROPN,),),PUNCT,.,.,PUNCT,,,,2018-05-21,2018,2010,DET ADJ Primpéran PUNCT PROPN,ADJ Primpéran PUNCT,DET ADJ Primpéran,ADV DET ADJ Primpéran,CONJ ADV DET ADJ Primpéran,Primpéran PUNCT PROPN,Primpéran PUNCT PROPN PUNCT,Primpéran PUNCT PROPN PUNCT PUNCT,le antiémétique Primpéran ( Sanofi-Synthélabo,antiémétique Primpéran (,le antiémétique Primpéran,encore le antiémétique Primpéran,ou encore le antiémétique Primpéran,Primpéran ( Sanofi-Synthélabo,Primpéran ( Sanofi-Synthélabo ),Primpéran ( Sanofi-Synthélabo ) .
