url,website,date,country,keyword,sentence,kw,kw_lemma,kw_pos,left_w1,left_l1,left_p1,left_w2,left_l2,left_p2,left_w3,left_l3,left_p3,left_w4,left_l4,left_p4,left_w5,left_l5,left_p5,right_w1,right_l1,right_p1,right_w2,right_l2,right_p2,right_w3,right_l3,right_p3,right_w4,right_l4,right_p4,right_w5,right_l5,right_p5,datetime,year,10years,pattern_around5,pattern_around3,pattern_left2,pattern_left3,pattern_left4,pattern_right2,pattern_right3,pattern_right4,pattern_around5_lex,pattern_around3_lex,pattern_left2_lex,pattern_left3_lex,pattern_left4_lex,pattern_right2_lex,pattern_right3_lex,pattern_right4_lex
http://www.7sur7.be/7s7/fr/1504/Insolite/article/detail/1767335/2014/01/03/A-moitie-nus-dans-le-froid-pour-des-vetements-gratuits.dhtml,7sur7.be,2014-01-03,Belgium,Desigual/ADJ/Desigual," Desigual  est  désormais  habituée  de  cette  opération  marketing  :  le  premier  jour  des  soldes  ,  elle  propose  aux  cent  premiers  clients  venus  en  sous-vêtements  de  se  rhabiller  gratuitement  .",desigual,adj,desigual,,,,,,,,,,,,,,,,est,être,VERB,désormais,désormais,ADV,habituée,habituer,VERB,de,de,ADP,cette,ce,PRON,2014-01-03,2014,2010,,,,,,Desigual VERB ADV,Desigual VERB ADV VERB,Desigual VERB ADV VERB ADP,,,,,,Desigual être désormais,Desigual être désormais habituer,Desigual être désormais habituer de
http://www.7sur7.be/7s7/fr/1504/Insolite/article/detail/1767335/2014/01/03/A-moitie-nus-dans-le-froid-pour-des-vetements-gratuits.dhtml,7sur7.be,2014-01-03,Belgium,Desigual/ADJ/Desigual,"L'  opération  ,  baptisée  "" Desigual  seminaked  party  ""  ,  a  déjà  eu  lieu  dans  de  nombreuses  enseignes  de  la  marque  à  travers  l'  Europe  et  est  toujours  un  succès  .",desigual,adj,desigual,"""","""",PUNCT,baptisée,baptiser,VERB,",",",",PUNCT,opération,opération,NOUN,L',le,DET,seminaked,seminaked,NOUN,party,party,NOUN,"""","""",PUNCT,",",",",PUNCT,a,avoir,VERB,2014-01-03,2014,2010,VERB PUNCT Desigual NOUN NOUN,PUNCT Desigual NOUN,VERB PUNCT Desigual,PUNCT VERB PUNCT Desigual,NOUN PUNCT VERB PUNCT Desigual,Desigual NOUN NOUN,Desigual NOUN NOUN PUNCT,Desigual NOUN NOUN PUNCT PUNCT,"baptiser "" Desigual seminaked party",""" Desigual seminaked","baptiser "" Desigual",", baptiser "" Desigual","opération , baptiser "" Desigual",Desigual seminaked party,"Desigual seminaked party ""","Desigual seminaked party "" ,"
http://www.dhnet.be/conso/argent/video-en-sous-vetements-au-desigual-namur-52c63e4735701baedaaff3e5,dhnet.be,2014-01-03,Belgium,Desigual/NAM/Desigual,<doc uri=http://www.dhnet.be/conso/argent/video-en-sous-vetements-au-desigual-namur-52c63e4735701baedaaff3e5 website=dhnet.be date=2014-01-03 source_country=Belgium> /vidéo/ADJ /:/PUN /en/PRP /sous-vêtement/NOM /au/PRP:det Desigual  Namur,desigual,nam,desigual,au,au,ADP DET,sous-vêtements,sous-vêtement,NOUN,en,en,ADP,:,:,PUNCT,Vidéo,vidéo,ADJ,Namur,Namur,PROPN,,,,,,,,,,,,,2014-01-03,2014,2010,,ADP DET Desigual PROPN,NOUN ADP DET Desigual,ADP NOUN ADP DET Desigual,PUNCT ADP NOUN ADP DET Desigual,,,,,au Desigual Namur,sous-vêtement au Desigual,en sous-vêtement au Desigual,: en sous-vêtement au Desigual,,,
http://www.dhnet.be/conso/argent/video-en-sous-vetements-au-desigual-namur-52c63e4735701baedaaff3e5,dhnet.be,2014-01-03,Belgium,Desigual/ADJ/Desigual,"Déjà  organisé  par Desigual  dans  certaines  de  ses  enseignes  à  l'  étranger  et  à  Anvers  pour  le  début  des  derniers  soldes  d'  été  ,  l'  événement  qui  se  prépare  dans  l'  enseigne  namuroise  risque  d'  attirer  beaucoup  de  monde  .",desigual,adj,desigual,par,par,ADP,organisé,organiser,VERB,Déjà,déjà,ADV,,,,,,,dans,dans,ADP,certaines,certain,PRON,de,de,ADP,ses,son,DET,enseignes,enseigne,NOUN,2014-01-03,2014,2010,VERB ADP Desigual ADP PRON,ADP Desigual ADP,VERB ADP Desigual,ADV VERB ADP Desigual,,Desigual ADP PRON,Desigual ADP PRON ADP,Desigual ADP PRON ADP DET,organiser par Desigual dans certain,par Desigual dans,organiser par Desigual,déjà organiser par Desigual,,Desigual dans certain,Desigual dans certain de,Desigual dans certain de son
http://www.lalibre.be/light/societe/namur-ils-font-la-file-en-sous-vetements-pour-des-vetements-52c6794e35701baedab01713,lalibre.be,2014-01-03,Belgium,Desigual/ADJ/Desigual,<doc uri=http://www.lalibre.be/light/societe/namur-ils-font-la-file-en-sous-vetements-pour-des-vetements-52c6794e35701baedab01713 website=lalibre.be date=2014-01-03 source_country=Belgium> /bonjour/NOM /France/NAM /et/KON /Belgique/NAM /!/SENT /aller/VER:pres /courir/VER:infi /et/KON /danser/VER:infi /et/KON /se/PRO:PER /amuser/VER:infi /!/SENT /Seminaked/NAM /Party/NAM /by/NOM Desigual  à  Namur  pic  .  twitter  .  com  /  qqWYJjjETh </doc>,desigual,adj,desigual,by,by,NOUN,Party,Party,PROPN,Seminaked,Seminaked,PROPN,!,!,PUNCT,amuser,amuser,VERB,à,à,ADP,Namur,Namur,PROPN,pic,pic,ADV,.,.,PUNCT,twitter,twitter,NOUN,2014-01-03,2014,2010,PROPN NOUN Desigual ADP PROPN,NOUN Desigual ADP,PROPN NOUN Desigual,PROPN PROPN NOUN Desigual,PUNCT PROPN PROPN NOUN Desigual,Desigual ADP PROPN,Desigual ADP PROPN ADV,Desigual ADP PROPN ADV PUNCT,Party by Desigual à Namur,by Desigual à,Party by Desigual,Seminaked Party by Desigual,! Seminaked Party by Desigual,Desigual à Namur,Desigual à Namur pic,Desigual à Namur pic .
http://www.lesoir.be/393452/article/styles/air-du-temps/2014-01-03/desigual-deshabille-namurois-pour-soldes-video,lesoir.be,2014-01-03,Belgium,Desigual/NAM/Desigual,<doc uri=http://www.lesoir.be/393452/article/styles/air-du-temps/2014-01-03/desigual-deshabille-namurois-pour-soldes-video website=lesoir.be date=2014-01-03 source_country=Belgium> Desigual  déshabille  les  Namurois  (  vidéo  ),desigual,nam,desigual,,,,,,,,,,,,,,,,déshabille,déshabiller,VERB,les,le,DET,Namurois,Namurois,PROPN,(,(,PUNCT,vidéo,vidéo,ADJ,2014-01-03,2014,2010,,,,,,Desigual VERB DET,Desigual VERB DET PROPN,Desigual VERB DET PROPN PUNCT,,,,,,Desigual déshabiller le,Desigual déshabiller le Namurois,Desigual déshabiller le Namurois (
http://www.lesoir.be/393452/article/styles/air-du-temps/2014-01-03/desigual-deshabille-namurois-pour-soldes-video,lesoir.be,2014-01-03,Belgium,Desigual/ADJ/Desigual,"Les  soldes  débutent  ce  vendredi  dans  tout  le  pays  ,  et  c'  est  ce  jour  que  la  marque  espagnole Desigual  a  choisi  pour  importer  un  de  ses  concepts  phares  en  Belgique  .",desigual,adj,desigual,espagnole,espagnol,ADJ,marque,marque,NOUN,la,le,DET,que,que,CONJ,jour,jour,NOUN,a,avoir,VERB,choisi,choisir,VERB,pour,pour,ADP,importer,importer,VERB,un,un,ADJ,2014-01-03,2014,2010,NOUN ADJ Desigual VERB VERB,ADJ Desigual VERB,NOUN ADJ Desigual,DET NOUN ADJ Desigual,CONJ DET NOUN ADJ Desigual,Desigual VERB VERB,Desigual VERB VERB ADP,Desigual VERB VERB ADP VERB,marque espagnol Desigual avoir choisir,espagnol Desigual avoir,marque espagnol Desigual,le marque espagnol Desigual,que le marque espagnol Desigual,Desigual avoir choisir,Desigual avoir choisir pour,Desigual avoir choisir pour importer
http://www.lesoir.be/393452/article/styles/air-du-temps/2014-01-03/desigual-deshabille-namurois-pour-soldes-video,lesoir.be,2014-01-03,Belgium,Desigual/NAM/Desigual," Desigual  avait  déjà  pratiqué  la  même  action  à  Paris  et  Lyon  l'  année  dernière  ,  à  la  même  période  ,  et  donne  rendez-vous  aux  moins  frileux  la  semaine  prochaine  à  Paris  et  à  Nice  . </doc>",desigual,nam,desigual,,,,,,,,,,,,,,,,avait,avoir,VERB,déjà,déjà,ADV,pratiqué,pratiquer,VERB,la,le,DET,même,même,ADJ,2014-01-03,2014,2010,,,,,,Desigual VERB ADV,Desigual VERB ADV VERB,Desigual VERB ADV VERB DET,,,,,,Desigual avoir déjà,Desigual avoir déjà pratiquer,Desigual avoir déjà pratiquer le
http://www.lexpress.fr/styles/mode/desigual-lance-une-course-en-sous-vetements-pour-les-soldes-d-hiver_1311398.html,lexpress.fr,2014-01-03,France,Desigual/NAM/Desigual,<doc uri=http://www.lexpress.fr/styles/mode/desigual-lance-une-course-en-sous-vetements-pour-les-soldes-d-hiver_1311398.html website=lexpress.fr date=2014-01-03 source_country=France> Desigual  lance  une  course  en  sous-vêtements  pour  les  soldes,desigual,nam,desigual,,,,,,,,,,,,,,,,lance,lancer,VERB,une,un,DET,course,course,NOUN,en,en,ADP,sous-vêtements,sous-vêtement,NOUN,2014-01-03,2014,2010,,,,,,Desigual VERB DET,Desigual VERB DET NOUN,Desigual VERB DET NOUN ADP,,,,,,Desigual lancer un,Desigual lancer un course,Desigual lancer un course en
http://www.lexpress.fr/styles/mode/desigual-lance-une-course-en-sous-vetements-pour-les-soldes-d-hiver_1311398.html,lexpress.fr,2014-01-03,France,Desigual/ADJ/Desigual,La  marque  de  vêtements  espagnole Desigual  donne  rendez-vous  à  ses  clients  parisiens  le  8  janvier  pour  une  Seminaked  Party  permettant  aux  cent  premiers  arrivés  de  repartir  habillés  .,desigual,adj,desigual,espagnole,espagnol,ADJ,vêtements,vêtement,NOUN,de,de,ADP,marque,marque,NOUN,La,le,DET,donne,donner,VERB,rendez-vous,rendez-vous,NOUN,à,à,ADP,ses,son,DET,clients,client,NOUN,2014-01-03,2014,2010,NOUN ADJ Desigual VERB NOUN,ADJ Desigual VERB,NOUN ADJ Desigual,ADP NOUN ADJ Desigual,NOUN ADP NOUN ADJ Desigual,Desigual VERB NOUN,Desigual VERB NOUN ADP,Desigual VERB NOUN ADP DET,vêtement espagnol Desigual donner rendez-vous,espagnol Desigual donner,vêtement espagnol Desigual,de vêtement espagnol Desigual,marque de vêtement espagnol Desigual,Desigual donner rendez-vous,Desigual donner rendez-vous à,Desigual donner rendez-vous à son
http://www.lexpress.fr/styles/mode/desigual-lance-une-course-en-sous-vetements-pour-les-soldes-d-hiver_1311398.html,lexpress.fr,2014-01-03,France,Desigual/ADJ/Desigual,"Si  affronter  le  froid  en  petite  tenue  ne  vous  fait  pas  peur  et  que  vous  êtes  à  Paris  le  8  janvier  ,  rendez-vous  devant  le  magasin Desigual  du  quartier  de  l'  Opéra  (  9  ,  boulevard  des  Capucines  )  à  8  h.  A  l'  occasion  des  soldes  d'  hiver  ,  la  marque  espagnole  au  style  bariolé  reconduit  en  effet  son  principe  de  Seminaked  Party  lancé  en  2011  .",desigual,adj,desigual,magasin,magasin,NOUN,le,le,DET,devant,devant,ADP,rendez-vous,rendez-vous,NOUN,",",",",PUNCT,du,du,ADP DET,quartier,quartier,NOUN,de,de,ADP,l',le,DET,Opéra,Opéra,PROPN,2014-01-03,2014,2010,DET NOUN Desigual ADP DET NOUN,NOUN Desigual ADP DET,DET NOUN Desigual,ADP DET NOUN Desigual,NOUN ADP DET NOUN Desigual,Desigual ADP DET NOUN,Desigual ADP DET NOUN ADP,Desigual ADP DET NOUN ADP DET,le magasin Desigual du quartier,magasin Desigual du,le magasin Desigual,devant le magasin Desigual,rendez-vous devant le magasin Desigual,Desigual du quartier,Desigual du quartier de,Desigual du quartier de le
http://www.lexpress.fr/styles/mode/desigual-lance-une-course-en-sous-vetements-pour-les-soldes-d-hiver_1311398.html,lexpress.fr,2014-01-03,France,Desigual/NAM/Desigual,"Pour  varier  les  plaisirs  et  faire  la  promotion  de  sa  nouvelle  ligne  sport  , Desigual  demande  cette  fois  aux  candidats  intéressés  de  participer  en  sous-vêtements  à  une  course  de  100  mètres  .",desigual,nam,desigual,",",",",PUNCT,sport,sport,NOUN,ligne,ligne,NOUN,nouvelle,nouveau,ADJ,sa,son,DET,demande,demander,VERB,cette,ce,PRON,fois,foi|fois,NOUN,aux,au,ADP DET,candidats,candidat,NOUN,2014-01-03,2014,2010,NOUN PUNCT Desigual VERB PRON,PUNCT Desigual VERB,NOUN PUNCT Desigual,NOUN NOUN PUNCT Desigual,ADJ NOUN NOUN PUNCT Desigual,Desigual VERB PRON,Desigual VERB PRON NOUN,Desigual VERB PRON NOUN ADP DET,"sport , Desigual demander ce",", Desigual demander","sport , Desigual","ligne sport , Desigual","nouveau ligne sport , Desigual",Desigual demander ce,Desigual demander ce foi|fois,Desigual demander ce foi|fois au
http://storify.com/desigualsoldes/soldes-desigual-precedemment-dans-une-riche-teinte,storify.com,2014-01-07,===NONE===,desigual/ADJ/desigual,<doc uri=http://storify.com/desigualsoldes/soldes-desigual-precedemment-dans-une-riche-teinte website=storify.com date=2014-01-07 source_country=> /solde/NOM desigual  précédemment  dans  une  riche  teinte  .,desigual,adj,desigual,Soldes,solde,NOUN,,,,,,,,,,,,,précédemment,précédemment,ADV,dans,dans,ADP,une,un,DET,riche,riche,ADJ,teinte,teinte,NOUN,2014-01-07,2014,2010,,NOUN Desigual ADV,,,,Desigual ADV ADP,Desigual ADV ADP DET,Desigual ADV ADP DET ADJ,,solde Desigual précédemment,,,,Desigual précédemment dans,Desigual précédemment dans un,Desigual précédemment dans un riche
http://storify.com/desigualsoldes/soldes-desigual-precedemment-dans-une-riche-teinte,storify.com,2014-01-07,===NONE===,desigual/ADJ/desigual,Nous  avons  couvert  le  Soldes desigual  précédemment  dans  une  riche  teinte  de  jaune  et  maintenant  sont  le  couvrir  en  brun  foncé  .,desigual,adj,desigual,Soldes,solde,NOUN,le,le,DET,couvert,couvrir,VERB,avons,avoir,VERB,Nous,nous,PRON,précédemment,précédemment,ADV,dans,dans,ADP,une,un,DET,riche,riche,ADJ,teinte,teinte,NOUN,2014-01-07,2014,2010,DET NOUN Desigual ADV ADP,NOUN Desigual ADV,DET NOUN Desigual,VERB DET NOUN Desigual,VERB VERB DET NOUN Desigual,Desigual ADV ADP,Desigual ADV ADP DET,Desigual ADV ADP DET ADJ,le solde Desigual précédemment dans,solde Desigual précédemment,le solde Desigual,couvrir le solde Desigual,avoir couvrir le solde Desigual,Desigual précédemment dans,Desigual précédemment dans un,Desigual précédemment dans un riche
http://storify.com/desigualsoldes/soldes-desigual-precedemment-dans-une-riche-teinte,storify.com,2014-01-07,===NONE===,desigual/ADJ/desigual,Si  une desigual  soldes  2014  d'  hébergement  semble  avoir  une  mauvaise  cote  de  consommation  alors  vous  boho  less  peuvent  être  mieux  choisir  une  autre  compagnie  .,desigual,adj,desigual,une,un,DET,Si,si,CONJ,,,,,,,,,,soldes,solde,NOUN,2014,@card@,ADJ,d',de,ADP,hébergement,hébergement,NOUN,semble,sembler,VERB,2014-01-07,2014,2010,CONJ DET Desigual NOUN ADJ,DET Desigual NOUN,CONJ DET Desigual,,,Desigual NOUN ADJ,Desigual NOUN ADJ ADP,Desigual NOUN ADJ ADP NOUN,si un Desigual solde @card@,un Desigual solde,si un Desigual,,,Desigual solde @card@,Desigual solde @card@ de,Desigual solde @card@ de hébergement
http://storify.com/desigualsoldes/soldes-desigual-precedemment-dans-une-riche-teinte,storify.com,2014-01-07,===NONE===,desigual/ADJ/desigual,Manteaux desigual  suis  sûr  que  vous  ne  souhaitez  ignorer  les  véritables  desseins  qui  ne  sont  même  comme  les  originaux  .,desigual,adj,desigual,Manteaux,manteau,NOUN,,,,,,,,,,,,,suis,suivre|être,VERB,sûr,sûr,ADJ,que,que,CONJ,vous,vous,PRON,ne,ne,ADV,2014-01-07,2014,2010,,NOUN Desigual VERB,,,,Desigual VERB ADJ,Desigual VERB ADJ CONJ,Desigual VERB ADJ CONJ PRON,,manteau Desigual suivre|être,,,,Desigual suivre|être sûr,Desigual suivre|être sûr que,Desigual suivre|être sûr que vous
http://storify.com/desigualsoldes/soldes-desigual-precedemment-dans-une-riche-teinte,storify.com,2014-01-07,===NONE===,desigual/ADJ/desigual,Porter  vos  accessoires  autour  d'  un  manteau desigual  soldes  chaude  est  connu  comme  la  promesse  de  votre  sens  de  style  et  la  fierté  de  votre  apparence  .,desigual,adj,desigual,manteau,manteau,NOUN,un,un,DET,d',de,ADP,autour,autour,ADV,accessoires,accessoire,NOUN,soldes,solde,NOUN,chaude,chaud,ADJ,est,être,VERB,connu,connaître,VERB,comme,comme,ADV,2014-01-07,2014,2010,DET NOUN Desigual NOUN ADJ,NOUN Desigual NOUN,DET NOUN Desigual,ADP DET NOUN Desigual,ADV ADP DET NOUN Desigual,Desigual NOUN ADJ,Desigual NOUN ADJ VERB,Desigual NOUN ADJ VERB VERB,un manteau Desigual solde chaud,manteau Desigual solde,un manteau Desigual,de un manteau Desigual,autour de un manteau Desigual,Desigual solde chaud,Desigual solde chaud être,Desigual solde chaud être connaître
http://storify.com/desigualsoldes/soldes-desigual-precedemment-dans-une-riche-teinte,storify.com,2014-01-07,===NONE===,desigual/ADJ/desigual,Le  fruit  mûr  notamment  du  manteau desigual  a  un  inconvénient  .,desigual,adj,desigual,manteau,manteau,NOUN,du,du,ADP DET,notamment,notamment,ADV,mûr,mûr,ADJ,fruit,fruit,NOUN,a,avoir,VERB,un,un,DET,inconvénient,inconvénient,NOUN,.,.,PUNCT,,,,2014-01-07,2014,2010,ADP DET NOUN Desigual VERB DET,NOUN Desigual VERB,ADP DET NOUN Desigual,ADV ADP DET NOUN Desigual,ADJ ADV ADP DET NOUN Desigual,Desigual VERB DET,Desigual VERB DET NOUN,Desigual VERB DET NOUN PUNCT,du manteau Desigual avoir un,manteau Desigual avoir,du manteau Desigual,notamment du manteau Desigual,mûr notamment du manteau Desigual,Desigual avoir un,Desigual avoir un inconvénient,Desigual avoir un inconvénient .
http://storify.com/desigualsoldes/soldes-desigual-precedemment-dans-une-riche-teinte,storify.com,2014-01-07,===NONE===,desigual/ADJ/desigual,"Sans  aucun  doute  ,  manteau desigual  ont  souvent  été  sur  le  bord  majeur  de  fashion  .",desigual,adj,desigual,manteau,manteau,NOUN,",",",",PUNCT,doute,doute,NOUN,aucun,aucun,PRON,Sans,sans,ADP,ont,avoir,VERB,souvent,souvent,ADV,été,être,VERB,sur,sur,ADP,le,le,DET,2014-01-07,2014,2010,PUNCT NOUN Desigual VERB ADV,NOUN Desigual VERB,PUNCT NOUN Desigual,NOUN PUNCT NOUN Desigual,PRON NOUN PUNCT NOUN Desigual,Desigual VERB ADV,Desigual VERB ADV VERB,Desigual VERB ADV VERB ADP,", manteau Desigual avoir souvent",manteau Desigual avoir,", manteau Desigual","doute , manteau Desigual","aucun doute , manteau Desigual",Desigual avoir souvent,Desigual avoir souvent être,Desigual avoir souvent être sur
http://storify.com/desigualsoldes/soldes-desigual-precedemment-dans-une-riche-teinte,storify.com,2014-01-07,===NONE===,desigual/NOM/desigual,Choisissez  le desigual  pas  cher  qui  est  certainement  un  prix  abordable  et  élégant  parmi  de  sorte  que  vous  pouvez  vous  assurer  que  la  qualité  est  sérieusement  compromise  .,desigual,nom,desigual,le,le,DET,Choisissez,choisir,VERB,,,,,,,,,,pas,pas,ADV,cher,cher,ADJ,qui,qui,PRON,est,être,VERB,certainement,certainement,ADV,2014-01-07,2014,2010,VERB DET Desigual ADV ADJ,DET Desigual ADV,VERB DET Desigual,,,Desigual ADV ADJ,Desigual ADV ADJ PRON,Desigual ADV ADJ PRON VERB,choisir le Desigual pas cher,le Desigual pas,choisir le Desigual,,,Desigual pas cher,Desigual pas cher qui,Desigual pas cher qui être
http://www.leparisien.fr/val-d-oise-95/gonesse-le-grand-lifting-d-usines-center-07-01-2014-3470923.php,leparisien.fr,2014-01-07,France,Desigual/NAM/Desigual,"Et  marquer  l'  arrivée  récente  d'  une  dizaine  de  nouvelles  enseignes  ,  de  Benetton  à  Serge  Blanco  ,  en  passant  par  Alain  Manoukian  , Desigual  ,  Samsonite  ou  Delsey  .",desigual,nam,desigual,",",",",PUNCT,Manoukian,Manoukian,PROPN,Alain,Alain,PROPN,par,par,ADP,passant,passer,VERB,",",",",PUNCT,Samsonite,Samsonite,PROPN,ou,ou,CONJ,Delsey,Delsey,PROPN,.,.,PUNCT,2014-01-07,2014,2010,PROPN PUNCT Desigual PUNCT PROPN,PUNCT Desigual PUNCT,PROPN PUNCT Desigual,PROPN PROPN PUNCT Desigual,ADP PROPN PROPN PUNCT Desigual,Desigual PUNCT PROPN,Desigual PUNCT PROPN CONJ,Desigual PUNCT PROPN CONJ PROPN,"Manoukian , Desigual , Samsonite",", Desigual ,","Manoukian , Desigual","Alain Manoukian , Desigual","par Alain Manoukian , Desigual","Desigual , Samsonite","Desigual , Samsonite ou","Desigual , Samsonite ou Delsey"
http://www.nicematin.com/cagnes-sur-mer/200-personnes-en-petite-tenue-pour-le-debut-des-soldes-chez-desigual-a-cap-3000.1577946.html,nicematin.com,2014-01-08,===NONE===,Desigual/NAM/Desigual,<doc uri=http://www.nicematin.com/cagnes-sur-mer/200-personnes-en-petite-tenue-pour-le-debut-des-soldes-chez-desigual-a-cap-3000.1577946.html website=nicematin.com date=2014-01-08 source_country=> /@card@/NUM /personne/NOM /en/PRP /petit/ADJ /tenue/NOM /pour/PRP /le/DET:ART /début/NOM /du/PRP:det /solde/NOM /chez/PRP Desigual  à  Cap  3000,desigual,nam,desigual,chez,chez,ADP,soldes,solde,NOUN,des,du,ADP DET,début,début,NOUN,le,le,DET,à,à,ADP,Cap,Cap,PROPN,3000,@card@,ADJ,,,,,,,2014-01-08,2014,2010,NOUN ADP Desigual ADP PROPN,ADP Desigual ADP,NOUN ADP Desigual,ADP DET NOUN ADP Desigual,NOUN ADP DET NOUN ADP Desigual,Desigual ADP PROPN,Desigual ADP PROPN ADJ,,solde chez Desigual à Cap,chez Desigual à,solde chez Desigual,du solde chez Desigual,début du solde chez Desigual,Desigual à Cap,Desigual à Cap @card@,
http://www.nicematin.com/cagnes-sur-mer/200-personnes-en-petite-tenue-pour-le-debut-des-soldes-chez-desigual-a-cap-3000.1577946.html,nicematin.com,2014-01-08,===NONE===,Desigual/ADJ/Desigual,"La  marque  de  vêtements  espagnole  très  colorés  , Desigual  ,  organisait  ce  mercredi  une  ""  Seminaked  Party  ""  à  son  magasin  de  Cap  3000  pour  ce  premier  jour  des  soldes  .",desigual,adj,desigual,",",",",PUNCT,colorés,colorer,VERB,très,très,ADV,espagnole,espagnol,ADJ,vêtements,vêtement,NOUN,",",",",PUNCT,organisait,organiser,VERB,ce,ce,PRON,mercredi,mercredi,NOUN,une,un,DET,2014-01-08,2014,2010,VERB PUNCT Desigual PUNCT VERB,PUNCT Desigual PUNCT,VERB PUNCT Desigual,ADV VERB PUNCT Desigual,ADJ ADV VERB PUNCT Desigual,Desigual PUNCT VERB,Desigual PUNCT VERB PRON,Desigual PUNCT VERB PRON NOUN,"colorer , Desigual , organiser",", Desigual ,","colorer , Desigual","très colorer , Desigual","espagnol très colorer , Desigual","Desigual , organiser","Desigual , organiser ce","Desigual , organiser ce mercredi"
http://www.nicematin.com/cagnes-sur-mer/200-personnes-en-petite-tenue-pour-le-debut-des-soldes-chez-desigual-a-cap-3000.1577946.html,nicematin.com,2014-01-08,===NONE===,Desigual/ADJ/Desigual,Environ  200  personnes  ont  fait  la  queue  ce  mercredi  matin  devant  le  magasin Desigual  de  Cap  3000  .,desigual,adj,desigual,magasin,magasin,NOUN,le,le,DET,devant,devant,ADP,matin,matin,NOUN,mercredi,mercredi,NOUN,de,de,ADP,Cap,Cap,PROPN,3000,@card@,ADJ,.,.,PUNCT,,,,2014-01-08,2014,2010,DET NOUN Desigual ADP PROPN,NOUN Desigual ADP,DET NOUN Desigual,ADP DET NOUN Desigual,NOUN ADP DET NOUN Desigual,Desigual ADP PROPN,Desigual ADP PROPN ADJ,Desigual ADP PROPN ADJ PUNCT,le magasin Desigual de Cap,magasin Desigual de,le magasin Desigual,devant le magasin Desigual,matin devant le magasin Desigual,Desigual de Cap,Desigual de Cap @card@,Desigual de Cap @card@ .
http://www.metronews.fr/nice-cannes/photos-soldes-d-hiver-2014-tout-nus-et-tout-solde/mnah%21iFsys6CP8Qoo/,metronews.fr,2014-01-08,France,Desigual/ADJ/Desigual,La  marque Desigual  organisait  à  Cap  3000  une  semi-naked  party  .,desigual,adj,desigual,marque,marque,NOUN,La,le,DET,,,,,,,,,,organisait,organiser,VERB,à,à,ADP,Cap,Cap,PROPN,3000,@card@,ADJ,une,un,DET,2014-01-08,2014,2010,DET NOUN Desigual VERB ADP,NOUN Desigual VERB,DET NOUN Desigual,,,Desigual VERB ADP,Desigual VERB ADP PROPN,Desigual VERB ADP PROPN ADJ,le marque Desigual organiser à,marque Desigual organiser,le marque Desigual,,,Desigual organiser à,Desigual organiser à Cap,Desigual organiser à Cap @card@
http://videos.leparisien.fr/video/soldes-a-paris-ils-courent-a-moitie-nus-pour-une-tenue-gratuite-08-01-2014-x19dnqo,leparisien.fr,2014-01-08,France,Desigual/ADJ/Desigual,"Le  concept  ,  décliné  de  plusieurs  manières  par  la  marque  espagnole Desigual  ,  est  simple  :  vous  vous  inscrivez  sur  Internet  et  ,  si  vous  êtes  dans  les  100  premiers  ,  vous  obtenez  le  droit  de  venir  chercher  gratuitement  un  bas  et  un  haut  à  l'  ouverture  des  soldes  .",desigual,adj,desigual,espagnole,espagnol,ADJ,marque,marque,NOUN,la,le,DET,par,par,ADP,manières,manière,NOUN,",",",",PUNCT,est,être,VERB,simple,simple,ADJ,:,:,PUNCT,vous,vous,PRON,2014-01-08,2014,2010,NOUN ADJ Desigual PUNCT VERB,ADJ Desigual PUNCT,NOUN ADJ Desigual,DET NOUN ADJ Desigual,ADP DET NOUN ADJ Desigual,Desigual PUNCT VERB,Desigual PUNCT VERB ADJ,Desigual PUNCT VERB ADJ PUNCT,"marque espagnol Desigual , être","espagnol Desigual ,",marque espagnol Desigual,le marque espagnol Desigual,par le marque espagnol Desigual,"Desigual , être","Desigual , être simple","Desigual , être simple :"
http://www.ladepeche.fr/article/2014/01/14/1793818-trie-sur-baise-le-makadam-dans-ses-murs.html,ladepeche.fr,2014-01-14,France,Desigual/ADJ/Desigual,"Le  magasin  de  Jessica  d'  une  superficie  de  150  mètre  carrés  est  très  bien  achalandé  ,  on  y  trouve  de  grandes  marques  Une  tombola  vient  de  récompenser  plusieurs  clientes  :  P.  Dubié  manteau Desigual  ;  S.  Lacrampe  sac  Desigual  ,  R.  Lapoutge  sac  Little  Marcel  ,  J.  Baleur  porte  chéquier  Little  Marcel  ;  divers  cadeaux  à  Christelle  Sainte  marie  ,  S.  Solle  ,  E.  Flagin  ,  Lucette  Soulès  ,  R.  Fourcaud  ,  N.  Grégoire  ,  M.  Proroga  ,  A.  Claverie  ,  C.  Verdier  ,  E.  Pujol  ,  M.  Laran  .",desigual,adj,desigual,manteau,manteau,NOUN,Dubié,Dubié,ABR,P.,P.,ABR,:,:,PUNCT,clientes,client,NOUN,;,;,PUNCT,S.,S.,ABR,Lacrampe,Lacrampe,PROPN,sac,sac,NOUN,Desigual,Desigual,PROPN,2014-01-14,2014,2010,ABR NOUN Desigual PUNCT ABR,NOUN Desigual PUNCT,ABR NOUN Desigual,ABR ABR NOUN Desigual,PUNCT ABR ABR NOUN Desigual,Desigual PUNCT ABR,Desigual PUNCT ABR PROPN,Desigual PUNCT ABR PROPN NOUN,Dubié manteau Desigual ; S.,manteau Desigual ;,Dubié manteau Desigual,P. Dubié manteau Desigual,: P. Dubié manteau Desigual,Desigual ; S.,Desigual ; S. Lacrampe,Desigual ; S. Lacrampe sac
