url,website,date,country,keyword,sentence,kw,kw_lemma,kw_pos,left_w1,left_l1,left_p1,left_w2,left_l2,left_p2,left_w3,left_l3,left_p3,left_w4,left_l4,left_p4,left_w5,left_l5,left_p5,right_w1,right_l1,right_p1,right_w2,right_l2,right_p2,right_w3,right_l3,right_p3,right_w4,right_l4,right_p4,right_w5,right_l5,right_p5,datetime,year,10years,pattern_around5,pattern_around3,pattern_left2,pattern_left3,pattern_left4,pattern_right2,pattern_right3,pattern_right4,pattern_around5_lex,pattern_around3_lex,pattern_left2_lex,pattern_left3_lex,pattern_left4_lex,pattern_right2_lex,pattern_right3_lex,pattern_right4_lex
https://storify.com/jimmykelly/sera-certainement-mis-sur-un-sac-bandouliere-desig,storify.com,2016-12-05,===NONE===,desigual/ADJ/desigual,Le  long  de  la  présentation  de  petites  et  légères  enveloppe  généralement  ge  desigual  sera  certainement  mis  sur  un  sac  bandoulière desigual  d'  embrayage  ou  pantalon  pantalon  pantalon  ouvert  positions  .,desigual,adj,desigual,bandoulière,bandoulière,NOUN,sac,sac,NOUN,un,un,DET,sur,sur,ADP,mis,mettre,VERB,d',de,ADP,embrayage,embrayage,NOUN,ou,ou,CONJ,pantalon,pantalon,NOUN,pantalon,pantalon,NOUN,2016-12-05,2016,2010,NOUN NOUN Desigual ADP NOUN,NOUN Desigual ADP,NOUN NOUN Desigual,DET NOUN NOUN Desigual,ADP DET NOUN NOUN Desigual,Desigual ADP NOUN,Desigual ADP NOUN CONJ,Desigual ADP NOUN CONJ NOUN,sac bandoulière Desigual de embrayage,bandoulière Desigual de,sac bandoulière Desigual,un sac bandoulière Desigual,sur un sac bandoulière Desigual,Desigual de embrayage,Desigual de embrayage ou,Desigual de embrayage ou pantalon
https://storify.com/jimmykelly/sera-certainement-mis-sur-un-sac-bandouliere-desig,storify.com,2016-12-05,===NONE===,desigual/ADJ/desigual,"Ordinairement  le  conte  de  votre desigual  satan  ,  Phone  considéré  .",desigual,adj,desigual,votre,votre,DET,de,de,ADP,conte,conte,NOUN,le,le,DET,Ordinairement,ordinairement,ADV,satan,satan,NOUN,",",",",PUNCT,Phone,phone,NOUN,considéré,considérer,VERB,.,.,PUNCT,2016-12-05,2016,2010,ADP DET Desigual NOUN PUNCT,DET Desigual NOUN,ADP DET Desigual,NOUN ADP DET Desigual,DET NOUN ADP DET Desigual,Desigual NOUN PUNCT,Desigual NOUN PUNCT NOUN,Desigual NOUN PUNCT NOUN VERB,"de votre Desigual satan ,",votre Desigual satan,de votre Desigual,conte de votre Desigual,le conte de votre Desigual,"Desigual satan ,","Desigual satan , phone","Desigual satan , phone considérer"
http://www.tdg.ch/economie/Quand-un-proprietaire-perd-600-locataires/story/17017305,tdg.ch,2016-12-05,Switzerland,Desigual/ADJ/Desigual,La  marque  espagnole Desigual  vient  de  fermer  son  magasin  de  la  rue  de  Rive  .,desigual,adj,desigual,espagnole,espagnol,ADJ,marque,marque,NOUN,La,le,DET,,,,,,,vient,venir,VERB,de,de,ADP,fermer,fermer,VERB,son,son,DET,magasin,magasin,NOUN,2016-12-05,2016,2010,NOUN ADJ Desigual VERB ADP,ADJ Desigual VERB,NOUN ADJ Desigual,DET NOUN ADJ Desigual,,Desigual VERB ADP,Desigual VERB ADP VERB,Desigual VERB ADP VERB DET,marque espagnol Desigual venir de,espagnol Desigual venir,marque espagnol Desigual,le marque espagnol Desigual,,Desigual venir de,Desigual venir de fermer,Desigual venir de fermer son
http://www.elle.fr/Mode/Les-news-mode/British-Fashion-Awards-Gigi-Hadid-affronte-Bella-pour-le-titre-de-mannequin-de-l-annee-3395153#utm_source%3DRSS-ELLE%26utm_medium%3DFlux-Rss%26utm_campaign%3DRSS_tout_ELLE%26xtor%3DRSS-20,elle.fr,2016-12-05,France,Desigual/ADJ/Desigual,"Bella  :  Si  la  carrière  de  Gigi  s'  est  envolée  avant  celle  de  Bella  ,  force  est  de  constater  qu'  elles  ont  pourtant  fait  leurs  premiers  pas  sur  le  même  podium  ,  celui  du  défilé Desigual  (  printemps-été  2015  pour  Bella  ,  automne-hiver  2014  pour  Gigi  )  .",desigual,adj,desigual,défilé,défilé,NOUN,du,du,ADP DET,celui,celui,PRON,",",",",PUNCT,podium,podium,NOUN,(,(,PUNCT,printemps-été,printemps-été,NOUN,2015,@card@,ADJ,pour,pour,ADP,Bella,Bella,PROPN,2016-12-05,2016,2010,ADP DET NOUN Desigual PUNCT NOUN,NOUN Desigual PUNCT,ADP DET NOUN Desigual,PRON ADP DET NOUN Desigual,PUNCT PRON ADP DET NOUN Desigual,Desigual PUNCT NOUN,Desigual PUNCT NOUN ADJ,Desigual PUNCT NOUN ADJ ADP,du défilé Desigual ( printemps-été,défilé Desigual (,du défilé Desigual,celui du défilé Desigual,", celui du défilé Desigual",Desigual ( printemps-été,Desigual ( printemps-été @card@,Desigual ( printemps-été @card@ pour
http://www.20minutes.fr/sport/football/1976479-20161207-psg-angel-di-maria-gros-peureux-terrain#xtor%3DRSS-149,20minutes.fr,2016-12-07,France,Desigual/ADJ/Desigual,On  est  prêt  à  parier  notre  dernière  chemise Desigual  que  l'  Argentin  sera  titulaire  dimanche  pour  un  match  que  le  PSG  n'  a  pas  le  droit  de  perdre  .,desigual,adj,desigual,chemise,chemise,NOUN,dernière,dernier,ADJ,notre,notre,DET,parier,parier,VERB,à,à,ADP,que,que,CONJ,l',le,DET,Argentin,Argentin,PROPN,sera,être,VERB,titulaire,titulaire,ADJ,2016-12-07,2016,2010,ADJ NOUN Desigual CONJ DET,NOUN Desigual CONJ,ADJ NOUN Desigual,DET ADJ NOUN Desigual,VERB DET ADJ NOUN Desigual,Desigual CONJ DET,Desigual CONJ DET PROPN,Desigual CONJ DET PROPN VERB,dernier chemise Desigual que le,chemise Desigual que,dernier chemise Desigual,notre dernier chemise Desigual,parier notre dernier chemise Desigual,Desigual que le,Desigual que le Argentin,Desigual que le Argentin être
http://www.20minutes.fr/sport/football/1976479-20161207-psg-angel-di-maria-gros-peureux-terrain,20minutes.fr,2016-12-08,France,Desigual/ADJ/Desigual,On  est  prêt  à  parier  notre  dernière  chemise Desigual  que  l'  Argentin  sera  titulaire  dimanche  pour  un  match  que  le  PSG  n'  a  pas  le  droit  de  perdre  .,desigual,adj,desigual,chemise,chemise,NOUN,dernière,dernier,ADJ,notre,notre,DET,parier,parier,VERB,à,à,ADP,que,que,CONJ,l',le,DET,Argentin,Argentin,PROPN,sera,être,VERB,titulaire,titulaire,ADJ,2016-12-08,2016,2010,ADJ NOUN Desigual CONJ DET,NOUN Desigual CONJ,ADJ NOUN Desigual,DET ADJ NOUN Desigual,VERB DET ADJ NOUN Desigual,Desigual CONJ DET,Desigual CONJ DET PROPN,Desigual CONJ DET PROPN VERB,dernier chemise Desigual que le,chemise Desigual que,dernier chemise Desigual,notre dernier chemise Desigual,parier notre dernier chemise Desigual,Desigual que le,Desigual que le Argentin,Desigual que le Argentin être
http://appshopper.com/shopping/lavitrinedelamodecom,appshopper.com,2016-12-09,United States,Desigual/NAM/Desigual,"Faîtes  vous  donc  plaisir  avec  les  marques  comme  :  Le  temps  des  Cerises  , Desigual  ,  Tom  Tailor  ,  Christian  Lacroix  ,  Lollipops  ,  Dress  Code  et  pleins  d'  autres  marques  pour  vous  combler  tous  les  jours  .",desigual,nam,desigual,",",",",PUNCT,Cerises,Cerises,PROPN,des,du,ADP DET,temps,temps,NOUN,Le,le,DET,",",",",PUNCT,Tom,Tom,PROPN,Tailor,Tailor,PROPN,",",",",PUNCT,Christian,Christian,PROPN,2016-12-09,2016,2010,PROPN PUNCT Desigual PUNCT PROPN,PUNCT Desigual PUNCT,PROPN PUNCT Desigual,ADP DET PROPN PUNCT Desigual,NOUN ADP DET PROPN PUNCT Desigual,Desigual PUNCT PROPN,Desigual PUNCT PROPN PROPN,Desigual PUNCT PROPN PROPN PUNCT,"Cerises , Desigual , Tom",", Desigual ,","Cerises , Desigual","du Cerises , Desigual","temps du Cerises , Desigual","Desigual , Tom","Desigual , Tom Tailor","Desigual , Tom Tailor ,"
http://www.tradingsat.com/eurazeo-FR0000121121/actualites/eurazeo-la-decote-s-est-accentuee-sur-les-6-derniers-mois-712055.html,tradingsat.com,2016-12-09,===NONE===,Desigual/NAM/Desigual,"Natixis  estime  que  le  portefeuille  reste  globalement  bien  orienté  et  la  décote  élevée  ""  même  s'  il  existe  des  sujets  de  préoccupation  au  plan  opérationnel  sur  certains  actifs  ( Desigual  ,  Sommet  Education  )  ""  .",desigual,nam,desigual,(,(,PUNCT,actifs,actif,NOUN,certains,certain,PRON,sur,sur,ADP,opérationnel,opérationnel,ADJ,",",",",PUNCT,Sommet,Sommet,PROPN,Education,Education,PROPN,),),PUNCT,"""","""",PUNCT,2016-12-09,2016,2010,NOUN PUNCT Desigual PUNCT PROPN,PUNCT Desigual PUNCT,NOUN PUNCT Desigual,PRON NOUN PUNCT Desigual,ADP PRON NOUN PUNCT Desigual,Desigual PUNCT PROPN,Desigual PUNCT PROPN PROPN,Desigual PUNCT PROPN PROPN PUNCT,"actif ( Desigual , Sommet","( Desigual ,",actif ( Desigual,certain actif ( Desigual,sur certain actif ( Desigual,"Desigual , Sommet","Desigual , Sommet Education","Desigual , Sommet Education )"
http://www.capital.fr/bourse/actualites/eurazeo-renforce-son-equipe-americaine-1193077#xtor%3DRSS-218,capital.fr,2016-12-13,France,Desigual/NAM/Desigual,"-  Forte  diversification  à  la  fois  entre  actifs  cotés  (  plus  du  1  /  3  du  patrimoine  )  et  non  cotés  ,  répartis  entre  :  Eurazeo  capital  ""  ,  axé  sur  les  entreprises  de  plus  de  150  à  200  M  €  de  valorisation  :  Accor  Hôtels  ,  Asmodée  , Desigual  ,  Elis  ,  Europcar  ,  Fintrax  ,  Invivo  ,  Moncler  ...  ;  Eurazeo  PME  ,  pour  les  valeurs  d'  entreprise  inférieures  à  150  /  200  M  €  :  Colisée  ,  Dessange  ,  Vignal  Lighting  ,  Léon  de  Bruxelles  ....  ;  Eurazeo  croissance  ,  investi  dans  les  ""  leaders  de  demain  ""  :  IPulse  ,  Peopledoc  ,  Prêt  d'  Union  ...  ;  Eurazeo  patrimoine  regroupant  les  activités  liées  à  l'  immobilier  :  ANF  Immobilier  ,  fonds  Colyzeo  ...  ;",desigual,nam,desigual,",",",",PUNCT,Asmodée,Asmodée,PROPN,",",",",PUNCT,Hôtels,Hôtels,PROPN,Accor,Accor,PROPN,",",",",PUNCT,Elis,Elis,PROPN,",",",",PUNCT,Europcar,Europcar,PROPN,",",",",PUNCT,2016-12-13,2016,2010,PROPN PUNCT Desigual PUNCT PROPN,PUNCT Desigual PUNCT,PROPN PUNCT Desigual,PUNCT PROPN PUNCT Desigual,PROPN PUNCT PROPN PUNCT Desigual,Desigual PUNCT PROPN,Desigual PUNCT PROPN PUNCT,Desigual PUNCT PROPN PUNCT PROPN,"Asmodée , Desigual , Elis",", Desigual ,","Asmodée , Desigual",", Asmodée , Desigual","Hôtels , Asmodée , Desigual","Desigual , Elis","Desigual , Elis ,","Desigual , Elis , Europcar"
http://www.capital.fr/bourse/actualites/eurazeo-renforce-son-equipe-americaine-1193077#xtor%3DRSS-218,capital.fr,2016-12-13,France,Desigual/ADJ/Desigual,-  Déception  persistante  chez  la  chaîne  de  prêt-à-porter Desigual  ;,desigual,adj,desigual,prêt-à-porter,prêt-à-porter,NOUN,de,de,ADP,chaîne,chaîne,NOUN,la,le,DET,chez,chez,ADP,;,;,PUNCT,,,,,,,,,,,,,2016-12-13,2016,2010,,NOUN Desigual PUNCT,ADP NOUN Desigual,NOUN ADP NOUN Desigual,DET NOUN ADP NOUN Desigual,,,,,prêt-à-porter Desigual ;,de prêt-à-porter Desigual,chaîne de prêt-à-porter Desigual,le chaîne de prêt-à-porter Desigual,,,
https://storify.com/jimmykelly/la-meilleure-facon-d-avancer-juste-pour-le-jupe-de,storify.com,2016-12-17,===NONE===,desigual/ADJ/desigual,<doc uri=https://storify.com/jimmykelly/la-meilleure-facon-d-avancer-juste-pour-le-jupe-de website=storify.com date=2016-12-17 source_country=> /le/DET:ART /meilleur/ADJ /façon/NOM /de/PRP /avancer/VER:infi /juste/ADJ /pour/PRP /le/DET:ART /jupe/NOM desigual ,desigual,adj,desigual,jupe,jupe,NOUN,le,le,DET,pour,pour,ADP,juste,juste,ADJ,avancer,avancer,VERB,,,,,,,,,,,,,,,,2016-12-17,2016,2010,,,DET NOUN Desigual,ADP DET NOUN Desigual,ADJ ADP DET NOUN Desigual,,,,,,le jupe Desigual,pour le jupe Desigual,juste pour le jupe Desigual,,,
https://storify.com/jimmykelly/la-meilleure-facon-d-avancer-juste-pour-le-jupe-de,storify.com,2016-12-17,===NONE===,desigual/ADJ/desigual,"La  meilleure  façon  d'  avancer  juste  pour  le  jupe desigual  continuellement  pour  permettre  aux  super  stars  de  le  faire  ,  Absolument  certain  ,  desigual  est  réputé  pour  les  bons  sacs  ,  Mais  malheureusement  les  types  d'  entre  eux  ,  vous  ne  devriez  pas  acheter  .",desigual,adj,desigual,jupe,jupe,NOUN,le,le,DET,pour,pour,ADP,juste,juste,ADJ,avancer,avancer,VERB,continuellement,continuellement,ADV,pour,pour,ADP,permettre,permettre,VERB,aux,au,ADP DET,super,super,ADJ,2016-12-17,2016,2010,DET NOUN Desigual ADV ADP,NOUN Desigual ADV,DET NOUN Desigual,ADP DET NOUN Desigual,ADJ ADP DET NOUN Desigual,Desigual ADV ADP,Desigual ADV ADP VERB,Desigual ADV ADP VERB ADP DET,le jupe Desigual continuellement pour,jupe Desigual continuellement,le jupe Desigual,pour le jupe Desigual,juste pour le jupe Desigual,Desigual continuellement pour,Desigual continuellement pour permettre,Desigual continuellement pour permettre au
https://storify.com/jimmykelly/la-meilleure-facon-d-avancer-juste-pour-le-jupe-de,storify.com,2016-12-17,===NONE===,desigual/ADJ/desigual,"La  meilleure  façon  d'  avancer  juste  pour  le  jupe  desigual  continuellement  pour  permettre  aux  super  stars  de  le  faire  ,  Absolument  certain  , desigual  est  réputé  pour  les  bons  sacs  ,  Mais  malheureusement  les  types  d'  entre  eux  ,  vous  ne  devriez  pas  acheter  .",desigual,adj,desigual,",",",",PUNCT,certain,certain,PRON,Absolument,Absolument,VERB,",",",",PUNCT,faire,faire,VERB,est,être,VERB,réputé,réputer,VERB,pour,pour,ADP,les,le,DET,bons,bon,ADJ,2016-12-17,2016,2010,PRON PUNCT Desigual VERB VERB,PUNCT Desigual VERB,PRON PUNCT Desigual,VERB PRON PUNCT Desigual,PUNCT VERB PRON PUNCT Desigual,Desigual VERB VERB,Desigual VERB VERB ADP,Desigual VERB VERB ADP DET,"certain , Desigual être réputer",", Desigual être","certain , Desigual","Absolument certain , Desigual",", Absolument certain , Desigual",Desigual être réputer,Desigual être réputer pour,Desigual être réputer pour le
https://storify.com/jimmykelly/la-meilleure-facon-d-avancer-juste-pour-le-jupe-de,storify.com,2016-12-17,===NONE===,desigual/ADJ/desigual,Si  vous  pensez  que  vous  achetez  la  voiture  combinée  avec  obtenir  un  sacs desigual  classique  .,desigual,adj,desigual,sacs,sac,NOUN,un,un,DET,obtenir,obtenir,VERB,avec,avec,ADP,combinée,combiner,VERB,classique,classique,ADJ,.,.,PUNCT,,,,,,,,,,2016-12-17,2016,2010,DET NOUN Desigual ADJ PUNCT,NOUN Desigual ADJ,DET NOUN Desigual,VERB DET NOUN Desigual,ADP VERB DET NOUN Desigual,Desigual ADJ PUNCT,,,un sac Desigual classique .,sac Desigual classique,un sac Desigual,obtenir un sac Desigual,avec obtenir un sac Desigual,Desigual classique .,,
https://storify.com/jimmykelly/la-meilleure-facon-d-avancer-juste-pour-le-jupe-de,storify.com,2016-12-17,===NONE===,desigual/ADJ/desigual,"Ensemble  de  chansons  pour  les  chiens  et  les  chiots  (  en  anglais  )  Delaware  sketch  300  uros  assurance  nationale  porte  monnaie desigual  au  mme  prix  ,  J  '  ai  pas  l'  ensemble  des  moyens  bouteilles  en  plastique  des  trucs  pareils  (  Utilisations  tailleurs  venaient  environnant  les  Pimkie  ou  alors  du  Quai  s  Marques  prs  Cergy  )  L  '  avaien  permis  je  ne  l'  aurai  pas  fai  ou  alors  a  aurai  vraimen  excepionnel  .",desigual,adj,desigual,monnaie,monnaie,NOUN,porte,porter,VERB,nationale,national,ADJ,assurance,assurance,NOUN,uros,uros,NOUN,au,au,ADP DET,mme,mme,ADJ,prix,prix,NOUN,",",",",PUNCT,J,J,PROPN,2016-12-17,2016,2010,VERB NOUN Desigual ADP DET ADJ,NOUN Desigual ADP DET,VERB NOUN Desigual,ADJ VERB NOUN Desigual,NOUN ADJ VERB NOUN Desigual,Desigual ADP DET ADJ,Desigual ADP DET ADJ NOUN,Desigual ADP DET ADJ NOUN PUNCT,porter monnaie Desigual au mme,monnaie Desigual au,porter monnaie Desigual,national porter monnaie Desigual,assurance national porter monnaie Desigual,Desigual au mme,Desigual au mme prix,"Desigual au mme prix ,"
https://storify.com/jimmykelly/la-meilleure-facon-d-avancer-juste-pour-le-jupe-de,storify.com,2016-12-17,===NONE===,desigual/ADJ/desigual,Ne  soyez  pas  surpris  de  voir  un  peu  de  pastels  tendances  tout  de  suite  Lupita  Nyong  '  o  '  s  funfilled  sac desigual  promo  instance  aller  le  week-end  se  rapproche  .,desigual,adj,desigual,sac,sac,NOUN,funfilled,funfilled,NOUN,s,s,VERB,',',PUNCT,o,o,NOUN,promo,promo,NOUN,instance,instance,NOUN,aller,aller,VERB,le,le,DET,week-end,week-end,NOUN,2016-12-17,2016,2010,NOUN NOUN Desigual NOUN NOUN,NOUN Desigual NOUN,NOUN NOUN Desigual,VERB NOUN NOUN Desigual,PUNCT VERB NOUN NOUN Desigual,Desigual NOUN NOUN,Desigual NOUN NOUN VERB,Desigual NOUN NOUN VERB DET,funfilled sac Desigual promo instance,sac Desigual promo,funfilled sac Desigual,s funfilled sac Desigual,' s funfilled sac Desigual,Desigual promo instance,Desigual promo instance aller,Desigual promo instance aller le
http://www.dhnet.be/regions/bruxelles/berchem-des-commercants-du-basilix-denoncent-les-loyers-trop-eleves-58544f89cd70fa7e37c4cf3b,dhnet.be,2016-12-26,Belgium,Desigual/ADJ/Desigual,"Au  même  étage  ,  un  peu  plus  loin  ,  c'  est  l'  enseigne Desigual  qui  vient  d'  arrêter  ses  activités  ,  tandis  que  le  Casa  est  sur  le  point  de  le  faire  .",desigual,adj,desigual,enseigne,enseigne,NOUN,l',le,DET,est,être,VERB,c',ce,PRON,",",",",PUNCT,qui,qui,PRON,vient,venir,VERB,d',de,ADP,arrêter,arrêter,VERB,ses,son,DET,2016-12-26,2016,2010,DET NOUN Desigual PRON VERB,NOUN Desigual PRON,DET NOUN Desigual,VERB DET NOUN Desigual,PRON VERB DET NOUN Desigual,Desigual PRON VERB,Desigual PRON VERB ADP,Desigual PRON VERB ADP VERB,le enseigne Desigual qui venir,enseigne Desigual qui,le enseigne Desigual,être le enseigne Desigual,ce être le enseigne Desigual,Desigual qui venir,Desigual qui venir de,Desigual qui venir de arrêter
http://mcetv.fr/mon-mag-buzz/insolite/leboncoin-10-pires-reventes-cadeaux-noel-2016-2712/,mcetv.fr,2016-12-27,France,Desigual/ADJ/Desigual,"Bon  ,  on  ne  va  pas  faire  la  liste  de  tous  les  cadeaux Desigual  revendus  sur  Leboncoin  ou  on  en  a  pour  une  heure  .",desigual,adj,desigual,cadeaux,cadeau,NOUN,les,le,DET,tous,tout,PRON,de,de,ADP,liste,liste,NOUN,revendus,revendre,VERB,sur,sur,ADP,Leboncoin,Leboncoin,PROPN,ou,ou,CONJ,on,on,PRON,2016-12-27,2016,2010,DET NOUN Desigual VERB ADP,NOUN Desigual VERB,DET NOUN Desigual,PRON DET NOUN Desigual,ADP PRON DET NOUN Desigual,Desigual VERB ADP,Desigual VERB ADP PROPN,Desigual VERB ADP PROPN CONJ,le cadeau Desigual revendre sur,cadeau Desigual revendre,le cadeau Desigual,tout le cadeau Desigual,de tout le cadeau Desigual,Desigual revendre sur,Desigual revendre sur Leboncoin,Desigual revendre sur Leboncoin ou
http://www.elle.fr/Mode/Les-conseils-mode/Comment-choisir-son-jean-2879092#utm_source%3DRSS-ELLE%26utm_medium%3DFlux-Rss%26utm_campaign%3DRSS_Le_fil_info_de_ELLE%26xtor%3DRSS-21,elle.fr,2016-12-28,France,Desigual/NAM/Desigual,Le  Amsterdam  de Desigual  :  la  marque  espagnole  décalée  sort  du  rang  et  imagine  un  jean  jupe-culotte  en  denim  souple  .,desigual,nam,desigual,de,de,ADP,Amsterdam,Amsterdam,PROPN,Le,le,DET,,,,,,,:,:,PUNCT,la,le,DET,marque,marque,NOUN,espagnole,espagnol,ADJ,décalée,décaler,VERB,2016-12-28,2016,2010,PROPN ADP Desigual PUNCT DET,ADP Desigual PUNCT,PROPN ADP Desigual,DET PROPN ADP Desigual,,Desigual PUNCT DET,Desigual PUNCT DET NOUN,Desigual PUNCT DET NOUN ADJ,Amsterdam de Desigual : le,de Desigual :,Amsterdam de Desigual,le Amsterdam de Desigual,,Desigual : le,Desigual : le marque,Desigual : le marque espagnol
http://www.dhnet.be/lifestyle/beaute-mode/retro-2016-ces-15-tops-models-qui-ont-pris-d-assaut-la-planete-mode-58664830cd70717f88e197bc,dhnet.be,2016-12-30,Belgium,Desigual/ADJ/Desigual,"Ambassadrice  de  la  marque Desigual  aux  côtés  d'  Adriana  Lima  ,  Winnie  Harlow  a  pris  sa  revanche  sur  son  passé  .",desigual,adj,desigual,marque,marque,NOUN,la,le,DET,de,de,ADP,Ambassadrice,ambassadrice,NOUN,,,,aux,au,ADP DET,côtés,côté,NOUN,d',de,ADP,Adriana,Adriana,PROPN,Lima,Lima,PROPN,2016-12-30,2016,2010,DET NOUN Desigual ADP DET NOUN,NOUN Desigual ADP DET,DET NOUN Desigual,ADP DET NOUN Desigual,NOUN ADP DET NOUN Desigual,Desigual ADP DET NOUN,Desigual ADP DET NOUN ADP,Desigual ADP DET NOUN ADP PROPN,le marque Desigual au côté,marque Desigual au,le marque Desigual,de le marque Desigual,ambassadrice de le marque Desigual,Desigual au côté,Desigual au côté de,Desigual au côté de Adriana
http://www.capital.fr/bourse/actualites/eurazeo-asmodee-acquiert-heidelberger-spieleverlag-edge-entertainment-et-millennium-1196895#xtor%3DRSS-218,capital.fr,2017-01-03,France,Desigual/NAM/Desigual,"-  Forte  diversification  à  la  fois  entre  actifs  cotés  (  plus  du  1  /  3  du  patrimoine  )  et  non  cotés  ,  répartis  entre  :  Eurazeo  capital  ""  ,  axé  sur  les  entreprises  de  plus  de  150  à  200  M  €  de  valorisation  :  Accor  Hôtels  ,  Asmodée  , Desigual  ,  Elis  ,  Europcar  ,  Fintrax  ,  Invivo  ,  Moncler  ...  ;  Eurazeo  PME  ,  pour  les  valeurs  d'  entreprise  inférieures  à  150  /  200  M  €  :  Colisée  ,  Dessange  ,  Vignal  Lighting  ,  Léon  de  Bruxelles  ....  ;  Eurazeo  croissance  ,  investi  dans  les  ""  leaders  de  demain  ""  :  IPulse  ,  Peopledoc  ,  Prêt  d'  Union  ...  ;  Eurazeo  patrimoine  regroupant  les  activités  liées  à  l'  immobilier  :  ANF  Immobilier  ,  fonds  Colyzeo  ...  ;",desigual,nam,desigual,",",",",PUNCT,Asmodée,Asmodée,PROPN,",",",",PUNCT,Hôtels,Hôtels,PROPN,Accor,Accor,PROPN,",",",",PUNCT,Elis,Elis,PROPN,",",",",PUNCT,Europcar,Europcar,PROPN,",",",",PUNCT,2017-01-03,2017,2010,PROPN PUNCT Desigual PUNCT PROPN,PUNCT Desigual PUNCT,PROPN PUNCT Desigual,PUNCT PROPN PUNCT Desigual,PROPN PUNCT PROPN PUNCT Desigual,Desigual PUNCT PROPN,Desigual PUNCT PROPN PUNCT,Desigual PUNCT PROPN PUNCT PROPN,"Asmodée , Desigual , Elis",", Desigual ,","Asmodée , Desigual",", Asmodée , Desigual","Hôtels , Asmodée , Desigual","Desigual , Elis","Desigual , Elis ,","Desigual , Elis , Europcar"
http://www.capital.fr/bourse/actualites/eurazeo-asmodee-acquiert-heidelberger-spieleverlag-edge-entertainment-et-millennium-1196895#xtor%3DRSS-218,capital.fr,2017-01-03,France,Desigual/ADJ/Desigual,-  Déception  persistante  chez  la  chaîne  de  prêt-à-porter Desigual  ;,desigual,adj,desigual,prêt-à-porter,prêt-à-porter,NOUN,de,de,ADP,chaîne,chaîne,NOUN,la,le,DET,chez,chez,ADP,;,;,PUNCT,,,,,,,,,,,,,2017-01-03,2017,2010,,NOUN Desigual PUNCT,ADP NOUN Desigual,NOUN ADP NOUN Desigual,DET NOUN ADP NOUN Desigual,,,,,prêt-à-porter Desigual ;,de prêt-à-porter Desigual,chaîne de prêt-à-porter Desigual,le chaîne de prêt-à-porter Desigual,,,
http://www.zonebourse.com/EURAZEO-4643/actualite/Eurazeo-Avec-le-lancement-reussi-d-rsquo-Eurazeo-Capital-II-Eurazeo-gerera-six-milliards-d-rsquo-23643133/,zonebourse.com,2017-01-04,===NONE===,Desigual/NAM/Desigual,"Eurazeo  Capital  II  prendra  une  participation  minoritaire  de  25  %  ,  sans  impact  sur  la  gouvernance  ,  dans  les  sept  participations  non  cotées  d'  Eurazeo  Capital  -  Asmodée  , Desigual  ,  Neovia  ,  Fintrax  1  Les  Petits  Chaperons  Rouges  ,  Novacap  ,  et  Sommet  Education  pour  340  m  €  -  ainsi  que  dans  la  future  société  CPK  qui  sera  créée  pour  reprendre  les  marques  Carambar  ,  Poulain  et  Krema  au  cours  du  premier  semestre  2017  .",desigual,nam,desigual,",",",",PUNCT,Asmodée,Asmodée,PROPN,-,-,PUNCT,Capital,Capital,PROPN,Eurazeo,Eurazeo,PROPN,",",",",PUNCT,Neovia,Neovia,PROPN,",",",",PUNCT,Fintrax,Fintrax,ABR,1,@card@,ABR,2017-01-04,2017,2010,PROPN PUNCT Desigual PUNCT PROPN,PUNCT Desigual PUNCT,PROPN PUNCT Desigual,PUNCT PROPN PUNCT Desigual,PROPN PUNCT PROPN PUNCT Desigual,Desigual PUNCT PROPN,Desigual PUNCT PROPN PUNCT,Desigual PUNCT PROPN PUNCT ABR,"Asmodée , Desigual , Neovia",", Desigual ,","Asmodée , Desigual","- Asmodée , Desigual","Capital - Asmodée , Desigual","Desigual , Neovia","Desigual , Neovia ,","Desigual , Neovia , Fintrax"
http://www.zonebourse.com/EURAZEO-4643/actualite/Eurazeo-Avec-le-lancement-reussi-d-rsquo-Eurazeo-Capital-II-Eurazeo-gerera-six-milliards-d-rsquo-23643133/,zonebourse.com,2017-01-04,===NONE===,Desigual/NAM/Desigual,"Elle  est  notamment  l'  actionnaire  majoritaire  ou  de  référence  d'  AccorHotels  ,  ANF  Immobilier  ,  Asmodee  ,  CIFA  , Desigual  ,  Elis  ,  Europcar  ,  Fintrax  ,  Grape  Hospitality  ,  Les  Petits  Chaperons  Rouges  ,  Moncler  ,  Neovia  ,  Novacap  ,  Sommet  Education  ,  et  également  de  PME  comme  Colisée  ,  Péters  Surgical  ,  Flash  Europe  International  et  de  start-ups  comme  Farfetch  et  Vestiaire  Collective  .",desigual,nam,desigual,",",",",PUNCT,CIFA,CIFA,PROPN,",",",",PUNCT,Asmodee,Asmodee,PROPN,",",",",PUNCT,",",",",PUNCT,Elis,Elis,PROPN,",",",",PUNCT,Europcar,Europcar,PROPN,",",",",PUNCT,2017-01-04,2017,2010,PROPN PUNCT Desigual PUNCT PROPN,PUNCT Desigual PUNCT,PROPN PUNCT Desigual,PUNCT PROPN PUNCT Desigual,PROPN PUNCT PROPN PUNCT Desigual,Desigual PUNCT PROPN,Desigual PUNCT PROPN PUNCT,Desigual PUNCT PROPN PUNCT PROPN,"CIFA , Desigual , Elis",", Desigual ,","CIFA , Desigual",", CIFA , Desigual","Asmodee , CIFA , Desigual","Desigual , Elis","Desigual , Elis ,","Desigual , Elis , Europcar"
http://www.lefigaro.fr/societes/2017/01/04/20005-20170104ARTFIG00339-eurazeo-ouvre-la-porte-a-de-nouveaux-investisseurs.php,lefigaro.fr,2017-01-04,France,Desigual/NAM/Desigual,"La  société  ,  qui  détient Desigual  et  Carambar  ,  vient  de  lever  500  millions  d'  euros  .",desigual,nam,desigual,détient,détenir,VERB,qui,qui,PRON,",",",",PUNCT,société,société,NOUN,La,le,DET,et,et,CONJ,Carambar,Carambar,PROPN,",",",",PUNCT,vient,venir,VERB,de,de,ADP,2017-01-04,2017,2010,PRON VERB Desigual CONJ PROPN,VERB Desigual CONJ,PRON VERB Desigual,PUNCT PRON VERB Desigual,NOUN PUNCT PRON VERB Desigual,Desigual CONJ PROPN,Desigual CONJ PROPN PUNCT,Desigual CONJ PROPN PUNCT VERB,qui détenir Desigual et Carambar,détenir Desigual et,qui détenir Desigual,", qui détenir Desigual","société , qui détenir Desigual",Desigual et Carambar,"Desigual et Carambar ,","Desigual et Carambar , venir"
