url,website,date,country,keyword,sentence,kw,kw_lemma,kw_pos,left_w1,left_l1,left_p1,left_w2,left_l2,left_p2,left_w3,left_l3,left_p3,left_w4,left_l4,left_p4,left_w5,left_l5,left_p5,right_w1,right_l1,right_p1,right_w2,right_l2,right_p2,right_w3,right_l3,right_p3,right_w4,right_l4,right_p4,right_w5,right_l5,right_p5,datetime,year,10years,pattern_around5,pattern_around3,pattern_left2,pattern_left3,pattern_left4,pattern_right2,pattern_right3,pattern_right4,pattern_around5_lex,pattern_around3_lex,pattern_left2_lex,pattern_left3_lex,pattern_left4_lex,pattern_right2_lex,pattern_right3_lex,pattern_right4_lex
http://www.leparisien.fr/laparisienne/mode/silhouette/miranda-kerr-maxi-robe-pour-maxi-effet-pour-la-jeune-maman-a-shopper-03-01-2014-3459327.php,leparisien.fr,2014-01-03,France,Ugg/NAM/Ugg,"Créateurs  français  ,  anglais  et  américains  ,  Miranda  ne  fait  pas  de  jaloux  !  Même  son  fils  est  un  peu  griffé  puisqu  '  il  porte  les  chaussures  indispensables  en  plein  hiver  ,  les Ugg  .",ugg,nam,ugg,les,le,DET,",",",",PUNCT,hiver,hiver,NOUN,plein,plein,ADJ,en,en,ADP,.,.,PUNCT,,,,,,,,,,,,,2014-01-03,2014,2010,,DET Ugg PUNCT,PUNCT DET Ugg,NOUN PUNCT DET Ugg,ADJ NOUN PUNCT DET Ugg,,,,,le Ugg .,", le Ugg","hiver , le Ugg","plein hiver , le Ugg",,,
http://www.lepoint.fr/art-de-vivre/j-ai-teste-pour-vous-la-drague-10-01-2014-1778824_4.php,lepoint.fr,2014-01-10,France,Ugg/NAM/Ugg,"Dans  mon  cas  ,  cette  contre-image  de  l'  objet  aimé  peut  aussi  apparaître  si  la  jeune  fille  que  je  rencontre  porte  des Ugg  (  ces  bottes  fourrées  si  laides  )  et  /  ou  n'  a  aucune  passion  ,  m'  explique  qu'  elle  part  un  an  à  New  York  pour  ""  apprendre  l'  anglais  ""  (  alors  qu'  il  suffit  de  regarder  trois  épisodes  de  Friends  pour  être  anglophone  )  ,  poste  sur  Twitter  des  hashtags  du  type  #  trop  de  fun  #  big  gueule  de  bois  ,  écoute  Pascal  Obispo  .",ugg,nam,ugg,des,du,ADP DET,porte,porte,ADJ,rencontre,rencontrer,VERB,je,je,PRON,que,que,PRON,(,(,PUNCT,ces,ce,PRON,bottes,botte,NOUN,fourrées,fourré,ADJ,si,si,CONJ,2014-01-10,2014,2010,ADJ ADP DET Ugg PUNCT PRON,ADP DET Ugg PUNCT,ADJ ADP DET Ugg,VERB ADJ ADP DET Ugg,PRON VERB ADJ ADP DET Ugg,Ugg PUNCT PRON,Ugg PUNCT PRON NOUN,Ugg PUNCT PRON NOUN ADJ,porte du Ugg ( ce,du Ugg (,porte du Ugg,rencontrer porte du Ugg,je rencontrer porte du Ugg,Ugg ( ce,Ugg ( ce botte,Ugg ( ce botte fourré
http://www.lexpress.fr/actualite/monde/quand-des-lyceens-se-prennent-pour-des-delegues-de-l-onu-rejouent-les-sessions-de-l-onu_1323101.html,lexpress.fr,2014-02-16,France,Ugg/NAM/Ugg,"Ainsi  ,  ce  mot  de  la  Serbie  à  la  Suède  :  ""  Apparemment  ,  Nouvelle-Zélande  est  une  fille  et  porte  des Ugg  .",ugg,nam,ugg,des,du,ADP DET,porte,porte,NOUN,et,et,CONJ,fille,fille,NOUN,une,un,DET,.,.,PUNCT,,,,,,,,,,,,,2014-02-16,2014,2010,,ADP DET Ugg PUNCT,NOUN ADP DET Ugg,CONJ NOUN ADP DET Ugg,NOUN CONJ NOUN ADP DET Ugg,,,,,du Ugg .,porte du Ugg,et porte du Ugg,fille et porte du Ugg,,,
http://www.lexpress.fr/styles/mode/quand-la-rue-inspire-le-luxe_1497438.html,lexpress.fr,2014-03-06,France,Ugg/NAM/Ugg,"""  La  culture  Tumblr  et  l'  association  libre  d'  images  -et  donc  d'  idées-  donnent  un  réel  twist  3.0  à  la  mode  actuelle  ,  notamment  au  streetwear  ""  ,  pense  Julien  David  ,  créateur  qui  a  gagné  le  prix  de  l'  Andam  en  2012  en  présentant  des  robes  portées  avec  des  sweatshirts  à  capuche  et  des  bottes Ugg  ,  bien  éloignées  du  chic  parisien  classique  .",ugg,nam,ugg,bottes,botte,NOUN,des,du,ADP DET,et,et,CONJ,capuche,capuche,NOUN,à,à,ADP,",",",",PUNCT,bien,bien,ADV,éloignées,éloigner,VERB,du,du,ADP DET,chic,chic,NOUN,2014-03-06,2014,2010,ADP DET NOUN Ugg PUNCT ADV,NOUN Ugg PUNCT,ADP DET NOUN Ugg,CONJ ADP DET NOUN Ugg,NOUN CONJ ADP DET NOUN Ugg,Ugg PUNCT ADV,Ugg PUNCT ADV VERB,Ugg PUNCT ADV VERB ADP DET,"du botte Ugg , bien","botte Ugg ,",du botte Ugg,et du botte Ugg,capuche et du botte Ugg,"Ugg , bien","Ugg , bien éloigner","Ugg , bien éloigner du"
http://www.lexpress.fr/styles/mode/suki-waterhouse-egerie-superga_1503112.html,lexpress.fr,2014-03-25,France,UGG/NAM/UGG,"La  jeune  femme  de  22  ans  -plus  connue  pour  être  en  couple  avec  l'  acteur  américain  Bradley  Cooper  depuis  un  an-  est  aussi  l'  égérie  du  parfum  féminin  Brit  Rythms  de  Burberry  et  a  été  aperçue  dans  des  campagnes  publicitaires  pour  les  marques UGG  ,  Forever  21  ou  encore  H  &  M. </doc>",ugg,nam,ugg,marques,marque,NOUN,les,le,DET,pour,pour,ADP,publicitaires,publicitaire,ADJ,campagnes,campagne,NOUN,",",",",PUNCT,Forever,Forever,ABR,21,@card@,ADJ,ou,ou,CONJ,encore,encore,ADV,2014-03-25,2014,2010,DET NOUN Ugg PUNCT ABR,NOUN Ugg PUNCT,DET NOUN Ugg,ADP DET NOUN Ugg,ADJ ADP DET NOUN Ugg,Ugg PUNCT ABR,Ugg PUNCT ABR ADJ,Ugg PUNCT ABR ADJ CONJ,"le marque Ugg , Forever","marque Ugg ,",le marque Ugg,pour le marque Ugg,publicitaire pour le marque Ugg,"Ugg , Forever","Ugg , Forever @card@","Ugg , Forever @card@ ou"
http://www.lefigaro.fr/lefigaromagazine/2014/08/01/01006-20140801ARTFIG00193-cote-basque-au-coeur-de-la-vague.php,lefigaro.fr,2014-08-01,France,UGG/NAM/UGG,"Outre  les  maillots  de  bain  ,  casquettes  ,  sweat-shirts  ,  parmi  les  autres  vêtements  et  accessoires  de  mode  piqués  au  surf  ,  on  a  vu  ces  dernières  années  l'  explosion  dans  le  monde  de  la  marque  brésilienne  de  tongs  Havaianas  ,  mais  aussi  les UGG  ,  bottes  fourrées  australiennes  que  les  surfeurs  enfilent  à  la  sortie  de  l'  eau  .",ugg,nam,ugg,les,le,DET,aussi,aussi,ADV,mais,mais,CONJ,",",",",PUNCT,Havaianas,Havaianas,PROPN,",",",",PUNCT,bottes,botte,NOUN,fourrées,fourrer,VERB,australiennes,australien,ADJ,que,que,CONJ,2014-08-01,2014,2010,ADV DET Ugg PUNCT NOUN,DET Ugg PUNCT,ADV DET Ugg,CONJ ADV DET Ugg,PUNCT CONJ ADV DET Ugg,Ugg PUNCT NOUN,Ugg PUNCT NOUN VERB,Ugg PUNCT NOUN VERB ADJ,"aussi le Ugg , botte","le Ugg ,",aussi le Ugg,mais aussi le Ugg,", mais aussi le Ugg","Ugg , botte","Ugg , botte fourrer","Ugg , botte fourrer australien"
http://www.newswire.ca/fr/story/1400544/ugg-lance-sa-premiere-campagne-mondiale-de-marque,newswire.ca,2014-08-20,Canada,UGG/NAM/UGG,<doc uri=http://www.newswire.ca/fr/story/1400544/ugg-lance-sa-premiere-campagne-mondiale-de-marque website=newswire.ca date=2014-08-20 source_country=Canada> UGG  ®  lance  sa  première  campagne  mondiale  de  marque,ugg,nam,ugg,,,,,,,,,,,,,,,,®,®,NOUN,lance,lancer,VERB,sa,son,DET,première,premier,ADJ,campagne,campagne,NOUN,2014-08-20,2014,2010,,,,,,Ugg NOUN VERB,Ugg NOUN VERB DET,Ugg NOUN VERB DET ADJ,,,,,,Ugg ® lancer,Ugg ® lancer son,Ugg ® lancer son premier
http://www.newswire.ca/fr/story/1400544/ugg-lance-sa-premiere-campagne-mondiale-de-marque,newswire.ca,2014-08-20,Canada,UGG/NAM/UGG,"La  campagne  ""  THIS  IS UGG  ""  exprime  la  puissance  émotionnelle  de  la  marque  en  célébrant  les  petits  moments  les  plus  grands",ugg,nam,ugg,IS,IS,PROPN,THIS,THIS,PROPN,"""","""",PUNCT,campagne,campagne,NOUN,La,le,DET,"""","""",PUNCT,exprime,exprimer,VERB,la,le,DET,puissance,puissance,NOUN,émotionnelle,émotionnel,ADJ,2014-08-20,2014,2010,PROPN PROPN Ugg PUNCT VERB,PROPN Ugg PUNCT,PROPN PROPN Ugg,PUNCT PROPN PROPN Ugg,NOUN PUNCT PROPN PROPN Ugg,Ugg PUNCT VERB,Ugg PUNCT VERB DET,Ugg PUNCT VERB DET NOUN,"THIS IS Ugg "" exprimer","IS Ugg """,THIS IS Ugg,""" THIS IS Ugg","campagne "" THIS IS Ugg","Ugg "" exprimer","Ugg "" exprimer le","Ugg "" exprimer le puissance"
http://www.newswire.ca/fr/story/1400544/ugg-lance-sa-premiere-campagne-mondiale-de-marque,newswire.ca,2014-08-20,Canada,UGG/NAM/UGG,"NEW  YORK  ,  le  20  août  2014  /  CNW  /  -  La  marque  de  style  de  vie UGG  Australia  a  annoncé  aujourd  '  hui  le  lancement  de  sa  première  campagne  marketing  mondiale  de  marque  intitulée  ""  THIS  IS  UGG  ""  .",ugg,nam,ugg,vie,vie,NOUN,de,de,ADP,style,style,NOUN,de,de,ADP,marque,marque,NOUN,Australia,Australia,PROPN,a,avoir,VERB,annoncé,annoncer,VERB,aujourd,aujourd,ADJ,',',PUNCT,2014-08-20,2014,2010,ADP NOUN Ugg PROPN VERB,NOUN Ugg PROPN,ADP NOUN Ugg,NOUN ADP NOUN Ugg,ADP NOUN ADP NOUN Ugg,Ugg PROPN VERB,Ugg PROPN VERB VERB,Ugg PROPN VERB VERB ADJ,de vie Ugg Australia avoir,vie Ugg Australia,de vie Ugg,style de vie Ugg,de style de vie Ugg,Ugg Australia avoir,Ugg Australia avoir annoncer,Ugg Australia avoir annoncer aujourd
http://www.newswire.ca/fr/story/1400544/ugg-lance-sa-premiere-campagne-mondiale-de-marque,newswire.ca,2014-08-20,Canada,UGG/NAM/UGG,"NEW  YORK  ,  le  20  août  2014  /  CNW  /  -  La  marque  de  style  de  vie  UGG  Australia  a  annoncé  aujourd  '  hui  le  lancement  de  sa  première  campagne  marketing  mondiale  de  marque  intitulée  ""  THIS  IS UGG  ""  .",ugg,nam,ugg,IS,IS,PROPN,THIS,THIS,PROPN,"""","""",PUNCT,intitulée,intituler,VERB,marque,marque,NOUN,"""","""",PUNCT,.,.,PUNCT,,,,,,,,,,2014-08-20,2014,2010,PROPN PROPN Ugg PUNCT PUNCT,PROPN Ugg PUNCT,PROPN PROPN Ugg,PUNCT PROPN PROPN Ugg,VERB PUNCT PROPN PROPN Ugg,Ugg PUNCT PUNCT,,,"THIS IS Ugg "" .","IS Ugg """,THIS IS Ugg,""" THIS IS Ugg","intituler "" THIS IS Ugg","Ugg "" .",,
http://www.newswire.ca/fr/story/1400544/ugg-lance-sa-premiere-campagne-mondiale-de-marque,newswire.ca,2014-08-20,Canada,UGG/NAM/UGG,"""  THIS  IS UGG  ""  est  conçue  pour  rejoindre  les  consommateurs  à  des  niveaux  émotionnels  qui  transcendent  les  produits  dans  le  but  de  renforcer  davantage  la  position  d'  UGG  en  tant  que  marque  mondiale  de  style  de  vie  de  qualité  ,  et  ce  ,  peu  importe  le  moment  de  l'  année  .",ugg,nam,ugg,IS,IS,PROPN,THIS,THIS,PROPN,"""","""",PUNCT,,,,,,,"""","""",PUNCT,est,être,VERB,conçue,concevoir,VERB,pour,pour,ADP,rejoindre,rejoindre,VERB,2014-08-20,2014,2010,PROPN PROPN Ugg PUNCT VERB,PROPN Ugg PUNCT,PROPN PROPN Ugg,PUNCT PROPN PROPN Ugg,,Ugg PUNCT VERB,Ugg PUNCT VERB VERB,Ugg PUNCT VERB VERB ADP,"THIS IS Ugg "" être","IS Ugg """,THIS IS Ugg,""" THIS IS Ugg",,"Ugg "" être","Ugg "" être concevoir","Ugg "" être concevoir pour"
http://www.newswire.ca/fr/story/1400544/ugg-lance-sa-premiere-campagne-mondiale-de-marque,newswire.ca,2014-08-20,Canada,UGG/NAM/UGG,"""  THIS  IS  UGG  ""  est  conçue  pour  rejoindre  les  consommateurs  à  des  niveaux  émotionnels  qui  transcendent  les  produits  dans  le  but  de  renforcer  davantage  la  position  d' UGG  en  tant  que  marque  mondiale  de  style  de  vie  de  qualité  ,  et  ce  ,  peu  importe  le  moment  de  l'  année  .",ugg,nam,ugg,d',de,ADP,position,position,NOUN,la,le,DET,davantage,davantage,ADV,renforcer,renforcer,VERB,en,en,ADP,tant,tant,ADV,que,que,CONJ,marque,marquer,VERB,mondiale,mondial,ADJ,2014-08-20,2014,2010,NOUN ADP Ugg ADP ADV,ADP Ugg ADP,NOUN ADP Ugg,DET NOUN ADP Ugg,ADV DET NOUN ADP Ugg,Ugg ADP ADV,Ugg ADP ADV CONJ,Ugg ADP ADV CONJ VERB,position de Ugg en tant,de Ugg en,position de Ugg,le position de Ugg,davantage le position de Ugg,Ugg en tant,Ugg en tant que,Ugg en tant que marquer
http://www.newswire.ca/fr/story/1400544/ugg-lance-sa-premiere-campagne-mondiale-de-marque,newswire.ca,2014-08-20,Canada,UGG/NAM/UGG,"La  campagne  utilisera  cette  plateforme  de  mise  en  récit  pour  tirer  parti  de  tels  moments  afin  d'  illustrer  le  fait  que  "" UGG  Feels  Like  Nothing  Else  ""  (  le  sentiment  que  procure  UGG  est  inégalable  )  .",ugg,nam,ugg,"""","""",PUNCT,que,que,CONJ,fait,fait,NOUN,le,le,DET,illustrer,illustrer,VERB,Feels,Feels,PROPN,Like,Like,PROPN,Nothing,Nothing,PROPN,Else,Else,PROPN,"""","""",PUNCT,2014-08-20,2014,2010,CONJ PUNCT Ugg PROPN PROPN,PUNCT Ugg PROPN,CONJ PUNCT Ugg,NOUN CONJ PUNCT Ugg,DET NOUN CONJ PUNCT Ugg,Ugg PROPN PROPN,Ugg PROPN PROPN PROPN,Ugg PROPN PROPN PROPN PROPN,"que "" Ugg Feels Like",""" Ugg Feels","que "" Ugg","fait que "" Ugg","le fait que "" Ugg",Ugg Feels Like,Ugg Feels Like Nothing,Ugg Feels Like Nothing Else
http://www.newswire.ca/fr/story/1400544/ugg-lance-sa-premiere-campagne-mondiale-de-marque,newswire.ca,2014-08-20,Canada,UGG/NAM/UGG,"La  campagne  utilisera  cette  plateforme  de  mise  en  récit  pour  tirer  parti  de  tels  moments  afin  d'  illustrer  le  fait  que  ""  UGG  Feels  Like  Nothing  Else  ""  (  le  sentiment  que  procure UGG  est  inégalable  )  .",ugg,nam,ugg,procure,procurer,VERB,que,que,PRON,sentiment,sentiment,NOUN,le,le,DET,(,(,PUNCT,est,être,VERB,inégalable,inégalable,ADJ,),),PUNCT,.,.,PUNCT,,,,2014-08-20,2014,2010,PRON VERB Ugg VERB ADJ,VERB Ugg VERB,PRON VERB Ugg,NOUN PRON VERB Ugg,DET NOUN PRON VERB Ugg,Ugg VERB ADJ,Ugg VERB ADJ PUNCT,Ugg VERB ADJ PUNCT PUNCT,que procurer Ugg être inégalable,procurer Ugg être,que procurer Ugg,sentiment que procurer Ugg,le sentiment que procurer Ugg,Ugg être inégalable,Ugg être inégalable ),Ugg être inégalable ) .
http://www.newswire.ca/fr/story/1400544/ugg-lance-sa-premiere-campagne-mondiale-de-marque,newswire.ca,2014-08-20,Canada,UGG/NAM/UGG,"En  lançant  cette  campagne  de  marque  ,  nous  nous  sommes  donné  le  défi  de  communiquer  l'  expérience  unique  à  la  fois  émotionnelle  et  physique  qui  prend  place  lorsque  vous  possédez  des  produits UGG  ""  ,  a  déclaré  Connie  Rishwain  ,  présidente  d'  UGG  Australia  .",ugg,nam,ugg,produits,produit,NOUN,des,du,ADP DET,possédez,posséder,VERB,vous,vous,PRON,lorsque,lorsque,CONJ,"""","""",PUNCT,",",",",PUNCT,a,avoir,VERB,déclaré,déclarer,VERB,Connie,Connie,PROPN,2014-08-20,2014,2010,ADP DET NOUN Ugg PUNCT PUNCT,NOUN Ugg PUNCT,ADP DET NOUN Ugg,VERB ADP DET NOUN Ugg,PRON VERB ADP DET NOUN Ugg,Ugg PUNCT PUNCT,Ugg PUNCT PUNCT VERB,Ugg PUNCT PUNCT VERB VERB,"du produit Ugg "" ,","produit Ugg """,du produit Ugg,posséder du produit Ugg,vous posséder du produit Ugg,"Ugg "" ,","Ugg "" , avoir","Ugg "" , avoir déclarer"
http://www.newswire.ca/fr/story/1400544/ugg-lance-sa-premiere-campagne-mondiale-de-marque,newswire.ca,2014-08-20,Canada,UGG/NAM/UGG,"En  lançant  cette  campagne  de  marque  ,  nous  nous  sommes  donné  le  défi  de  communiquer  l'  expérience  unique  à  la  fois  émotionnelle  et  physique  qui  prend  place  lorsque  vous  possédez  des  produits  UGG  ""  ,  a  déclaré  Connie  Rishwain  ,  présidente  d' UGG  Australia  .",ugg,nam,ugg,d',de,ADP,présidente,président,NOUN,",",",",PUNCT,Rishwain,Rishwain,PROPN,Connie,Connie,PROPN,Australia,Australia,PROPN,.,.,PUNCT,,,,,,,,,,2014-08-20,2014,2010,NOUN ADP Ugg PROPN PUNCT,ADP Ugg PROPN,NOUN ADP Ugg,PUNCT NOUN ADP Ugg,PROPN PUNCT NOUN ADP Ugg,Ugg PROPN PUNCT,,,président de Ugg Australia .,de Ugg Australia,président de Ugg,", président de Ugg","Rishwain , président de Ugg",Ugg Australia .,,
http://www.newswire.ca/fr/story/1400544/ugg-lance-sa-premiere-campagne-mondiale-de-marque,newswire.ca,2014-08-20,Canada,UGG/NAM/UGG,"""  Nous  montrons  les  moments  personnels  au  cours  desquels UGG  vit  dans  l'  existence  de  nos  consommateurs  .",ugg,nam,ugg,desquels,duquel,PRON,cours,cour|cours,NOUN,au,au,ADP DET,personnels,personnel,ADJ,moments,moment,NOUN,vit,voir,VERB,dans,dans,ADP,l',le,DET,existence,existence,NOUN,de,de,ADP,2014-08-20,2014,2010,NOUN PRON Ugg VERB ADP,PRON Ugg VERB,NOUN PRON Ugg,ADP DET NOUN PRON Ugg,ADJ ADP DET NOUN PRON Ugg,Ugg VERB ADP,Ugg VERB ADP DET,Ugg VERB ADP DET NOUN,cour|cours duquel Ugg voir dans,duquel Ugg voir,cour|cours duquel Ugg,au cour|cours duquel Ugg,personnel au cour|cours duquel Ugg,Ugg voir dans,Ugg voir dans le,Ugg voir dans le existence
http://www.newswire.ca/fr/story/1400544/ugg-lance-sa-premiere-campagne-mondiale-de-marque,newswire.ca,2014-08-20,Canada,UGG/NAM/UGG,"""  THIS  IS UGG  ""  est  une  campagne  multimédia  et  multicanal  présentée  principalement  en  noir  et  blanc  mettant  en  vedette  de  vrais  moments  et  de  vraies  personnes  croqués  dans  un  milieu  personnel  qui  célèbrent  les  petits  moments  les  plus  importants  pour  ces  personnes  .",ugg,nam,ugg,IS,IS,PROPN,THIS,THIS,PROPN,"""","""",PUNCT,,,,,,,"""","""",PUNCT,est,être,VERB,une,un,DET,campagne,campagne,NOUN,multimédia,multimédia,ADJ,2014-08-20,2014,2010,PROPN PROPN Ugg PUNCT VERB,PROPN Ugg PUNCT,PROPN PROPN Ugg,PUNCT PROPN PROPN Ugg,,Ugg PUNCT VERB,Ugg PUNCT VERB DET,Ugg PUNCT VERB DET NOUN,"THIS IS Ugg "" être","IS Ugg """,THIS IS Ugg,""" THIS IS Ugg",,"Ugg "" être","Ugg "" être un","Ugg "" être un campagne"
http://www.newswire.ca/fr/story/1400544/ugg-lance-sa-premiere-campagne-mondiale-de-marque,newswire.ca,2014-08-20,Canada,UGG/NAM/UGG,"Par  ailleurs  ,  Tom  Brady  ,  qui  apparaît  habituellement  dans  les  campagnes  d' UGG  conçues  spécifiquement  pour  lui  ,  sera  intégré  à  ""  THIS  IS  UGG  ""  ,  où  on  le  verra  partager  des  moments  avec  sa  mère  et  son  père  .",ugg,nam,ugg,d',de,ADP,campagnes,campagne,NOUN,les,le,DET,dans,dans,ADP,habituellement,habituellement,ADV,conçues,concevoir,VERB,spécifiquement,spécifiquement,ADV,pour,pour,ADP,lui,lui,PRON,",",",",PUNCT,2014-08-20,2014,2010,NOUN ADP Ugg VERB ADV,ADP Ugg VERB,NOUN ADP Ugg,DET NOUN ADP Ugg,ADP DET NOUN ADP Ugg,Ugg VERB ADV,Ugg VERB ADV ADP,Ugg VERB ADV ADP PRON,campagne de Ugg concevoir spécifiquement,de Ugg concevoir,campagne de Ugg,le campagne de Ugg,dans le campagne de Ugg,Ugg concevoir spécifiquement,Ugg concevoir spécifiquement pour,Ugg concevoir spécifiquement pour lui
http://www.newswire.ca/fr/story/1400544/ugg-lance-sa-premiere-campagne-mondiale-de-marque,newswire.ca,2014-08-20,Canada,UGG/NAM/UGG,"Par  ailleurs  ,  Tom  Brady  ,  qui  apparaît  habituellement  dans  les  campagnes  d'  UGG  conçues  spécifiquement  pour  lui  ,  sera  intégré  à  ""  THIS  IS UGG  ""  ,  où  on  le  verra  partager  des  moments  avec  sa  mère  et  son  père  .",ugg,nam,ugg,IS,IS,PROPN,THIS,THIS,PROPN,"""","""",PUNCT,à,à,ADP,intégré,intégrer,VERB,"""","""",PUNCT,",",",",PUNCT,où,où,PRON,on,on,PRON,le,le,PRON,2014-08-20,2014,2010,PROPN PROPN Ugg PUNCT PUNCT,PROPN Ugg PUNCT,PROPN PROPN Ugg,PUNCT PROPN PROPN Ugg,ADP PUNCT PROPN PROPN Ugg,Ugg PUNCT PUNCT,Ugg PUNCT PUNCT PRON,Ugg PUNCT PUNCT PRON PRON,"THIS IS Ugg "" ,","IS Ugg """,THIS IS Ugg,""" THIS IS Ugg","à "" THIS IS Ugg","Ugg "" ,","Ugg "" , où","Ugg "" , où on"
http://www.newswire.ca/fr/story/1400544/ugg-lance-sa-premiere-campagne-mondiale-de-marque,newswire.ca,2014-08-20,Canada,UGG/NAM/UGG,"Enfin  ,  l'  architecte  californien  Harry  Gesner  sera  vu  avec  son  fils  et  son  petit-fils  ,  qui  sont  tous  amoureux  de  l'  océan  depuis  toujours  ,  en  train  de  faire  du  surf  sur  la  côte  de  Malibu  pour  lancer  un  clin  d'  œil  aux  racines  surf  d' UGG  .",ugg,nam,ugg,d',de,ADP,surf,surf,NOUN,racines,racine,NOUN,aux,au,ADP DET,œil,œil,NOUN,.,.,PUNCT,,,,,,,,,,,,,2014-08-20,2014,2010,,ADP Ugg PUNCT,NOUN ADP Ugg,NOUN NOUN ADP Ugg,ADP DET NOUN NOUN ADP Ugg,,,,,de Ugg .,surf de Ugg,racine surf de Ugg,au racine surf de Ugg,,,
http://www.newswire.ca/fr/story/1400544/ugg-lance-sa-premiere-campagne-mondiale-de-marque,newswire.ca,2014-08-20,Canada,UGG/NAM/UGG,"""  Puisque  chacun  de  nos  moments  met  en  valeur  de  vraies  personnes  ,  nous  pouvons  nous  immiscer  profondément  dans  elles  et  dans  le  moment  qu'  elles  sont  en  train  de  vivre  --  que  celui-ci  soit  reproduit  dans  notre  blogue  ,  notre  site  Web  ou  même  nos  réseaux  sociaux  --  et  donner  vie  au  milieu  dans  lequel  des  gens  de  tous  les  horizons  ,  qui  font  des  choses  différentes  dans  le  confort  de  leur  foyer  ,  existent  aux  côtés  d' UGG  ""  .",ugg,nam,ugg,d',de,ADP,côtés,côté,NOUN,aux,au,ADP DET,existent,exister,VERB,",",",",PUNCT,"""","""",PUNCT,.,.,PUNCT,,,,,,,,,,2014-08-20,2014,2010,NOUN ADP Ugg PUNCT PUNCT,ADP Ugg PUNCT,NOUN ADP Ugg,ADP DET NOUN ADP Ugg,VERB ADP DET NOUN ADP Ugg,Ugg PUNCT PUNCT,,,"côté de Ugg "" .","de Ugg """,côté de Ugg,au côté de Ugg,exister au côté de Ugg,"Ugg "" .",,
http://www.newswire.ca/fr/story/1400544/ugg-lance-sa-premiere-campagne-mondiale-de-marque,newswire.ca,2014-08-20,Canada,UGG/NAM/UGG," UGG  Australia  a  bâti  sa  réputation  sur  le  luxe  et  le  confort  en  utilisant  uniquement  les  matériaux  les  plus  raffinés  du  monde  ,  en  appliquant  les  plus  hauts  standards  de  fabrication  et  en  créant  des  styles  nouveaux  et  novateurs  dépassant  les  bottes  et  les  pantoufles  originales  reliées  en  basane  .",ugg,nam,ugg,,,,,,,,,,,,,,,,Australia,Australia,PROPN,a,avoir,VERB,bâti,bâtir,VERB,sa,son,DET,réputation,réputation,NOUN,2014-08-20,2014,2010,,,,,,Ugg PROPN VERB,Ugg PROPN VERB VERB,Ugg PROPN VERB VERB DET,,,,,,Ugg Australia avoir,Ugg Australia avoir bâtir,Ugg Australia avoir bâtir son
http://www.newswire.ca/fr/story/1400544/ugg-lance-sa-premiere-campagne-mondiale-de-marque,newswire.ca,2014-08-20,Canada,UGG/NAM/UGG," UGG  Australia  est  reconnue  comme  une  marque  prestigieuse  de  style  de  vie  qui  offre  des  chaussures  ,  des  vêtements  ainsi  que  des  vêtements  d'  extérieur  ,  des  accessoires  et  des  sacs  à  main  rapportant  1  milliard  $  en  vente  .",ugg,nam,ugg,,,,,,,,,,,,,,,,Australia,Australia,PROPN,est,être,VERB,reconnue,reconnaître,VERB,comme,comme,ADV,une,un,DET,2014-08-20,2014,2010,,,,,,Ugg PROPN VERB,Ugg PROPN VERB VERB,Ugg PROPN VERB VERB ADV,,,,,,Ugg Australia être,Ugg Australia être reconnaître,Ugg Australia être reconnaître comme
http://www.newswire.ca/fr/story/1400544/ugg-lance-sa-premiere-campagne-mondiale-de-marque,newswire.ca,2014-08-20,Canada,UGG/NAM/UGG,"Offrant  l'  ultime  expérience  de  marque  ,  les  70  magasins  concept UGG  Australia  dans  le  monde  sont  notamment  établis  à  New  York  ,  Chicago  ,  San  Francisco  ,  Los  Angeles  ,  Miami  ,  Londres  ,  Tokyo  ,  Shanghai  ,  Beijing  et  Moscou  .",ugg,nam,ugg,concept,concept,NOUN,magasins,magasin,NOUN,70,@card@,ADJ,les,le,DET,",",",",PUNCT,Australia,Australia,PROPN,dans,dans,ADP,le,le,DET,monde,monde,NOUN,sont,être,VERB,2014-08-20,2014,2010,NOUN NOUN Ugg PROPN ADP,NOUN Ugg PROPN,NOUN NOUN Ugg,ADJ NOUN NOUN Ugg,DET ADJ NOUN NOUN Ugg,Ugg PROPN ADP,Ugg PROPN ADP DET,Ugg PROPN ADP DET NOUN,magasin concept Ugg Australia dans,concept Ugg Australia,magasin concept Ugg,@card@ magasin concept Ugg,le @card@ magasin concept Ugg,Ugg Australia dans,Ugg Australia dans le,Ugg Australia dans le monde
http://www.newswire.ca/fr/story/1400544/ugg-lance-sa-premiere-campagne-mondiale-de-marque,newswire.ca,2014-08-20,Canada,UGG/NAM/UGG," UGG  Australia  est  active  dans  plusieurs  plateformes  de  médias  sociaux  ,  notamment  Twitter  ,  Vine  ,  Pinterest  ,  ainsi  que  son  blogue  de  marque  nommé  Plush  Hour  .",ugg,nam,ugg,,,,,,,,,,,,,,,,Australia,Australia,PROPN,est,être,VERB,active,actif,ADJ,dans,dans,ADP,plusieurs,plusieurs,PRON,2014-08-20,2014,2010,,,,,,Ugg PROPN VERB,Ugg PROPN VERB ADJ,Ugg PROPN VERB ADJ ADP,,,,,,Ugg Australia être,Ugg Australia être actif,Ugg Australia être actif dans
http://www.newswire.ca/fr/story/1400544/ugg-lance-sa-premiere-campagne-mondiale-de-marque,newswire.ca,2014-08-20,Canada,UGG/NAM/UGG,"Chaque  produit  authentique UGG  est  lié  à  ses  semblables  par  l'  inoubliable  expérience  de  la  reliure  en  basane  ,  qui  procure  un  sentiment  véritablement  inégalable  .",ugg,nam,ugg,authentique,authentique,ADJ,produit,produit,NOUN,Chaque,chaque,PRON,,,,,,,est,être,VERB,lié,lier,VERB,à,à,ADP,ses,son,DET,semblables,semblable,ADJ,2014-08-20,2014,2010,NOUN ADJ Ugg VERB VERB,ADJ Ugg VERB,NOUN ADJ Ugg,PRON NOUN ADJ Ugg,,Ugg VERB VERB,Ugg VERB VERB ADP,Ugg VERB VERB ADP DET,produit authentique Ugg être lier,authentique Ugg être,produit authentique Ugg,chaque produit authentique Ugg,,Ugg être lier,Ugg être lier à,Ugg être lier à son
http://www.newswire.ca/fr/story/1400544/ugg-lance-sa-premiere-campagne-mondiale-de-marque,newswire.ca,2014-08-20,Canada,UGG/NAM/UGG,"Le  portefeuille  de  la  société  regroupe  des  marques  comme UGG  ®  ,  I  HEART  UGG  ®  ,  Teva  ®  ,  Sanuk  ®  ,  TSUBO  ®  ,  Ahnu  ®  ,  MOZO  ®  ,  et  HOKA  ONE  ONE  ®  .",ugg,nam,ugg,comme,comme,CONJ,marques,marque,NOUN,des,du,ADP DET,regroupe,regrouper,VERB,société,société,NOUN,®,®,ADJ,",",",",PUNCT,I,I,ADJ,HEART,HEART,PROPN,UGG,UGG,PROPN,2014-08-20,2014,2010,NOUN CONJ Ugg ADJ PUNCT,CONJ Ugg ADJ,NOUN CONJ Ugg,ADP DET NOUN CONJ Ugg,VERB ADP DET NOUN CONJ Ugg,Ugg ADJ PUNCT,Ugg ADJ PUNCT ADJ,Ugg ADJ PUNCT ADJ PROPN,"marque comme Ugg ® ,",comme Ugg ®,marque comme Ugg,du marque comme Ugg,regrouper du marque comme Ugg,"Ugg ® ,","Ugg ® , I","Ugg ® , I HEART"
http://www.newswire.ca/fr/story/1400544/ugg-lance-sa-premiere-campagne-mondiale-de-marque,newswire.ca,2014-08-20,Canada,UGG/NAM/UGG,"Le  portefeuille  de  la  société  regroupe  des  marques  comme  UGG  ®  ,  I  HEART UGG  ®  ,  Teva  ®  ,  Sanuk  ®  ,  TSUBO  ®  ,  Ahnu  ®  ,  MOZO  ®  ,  et  HOKA  ONE  ONE  ®  .",ugg,nam,ugg,HEART,HEART,PROPN,I,I,ADJ,",",",",PUNCT,®,®,ADJ,UGG,UGG,PROPN,®,®,ADJ,",",",",PUNCT,Teva,Teva,VERB,®,®,NOUN,",",",",PUNCT,2014-08-20,2014,2010,ADJ PROPN Ugg ADJ PUNCT,PROPN Ugg ADJ,ADJ PROPN Ugg,PUNCT ADJ PROPN Ugg,ADJ PUNCT ADJ PROPN Ugg,Ugg ADJ PUNCT,Ugg ADJ PUNCT VERB,Ugg ADJ PUNCT VERB NOUN,"I HEART Ugg ® ,",HEART Ugg ®,I HEART Ugg,", I HEART Ugg","® , I HEART Ugg","Ugg ® ,","Ugg ® , Teva","Ugg ® , Teva ®"
