url,website,date,country,keyword,sentence,kw,kw_lemma,kw_pos,left_w1,left_l1,left_p1,left_w2,left_l2,left_p2,left_w3,left_l3,left_p3,left_w4,left_l4,left_p4,left_w5,left_l5,left_p5,right_w1,right_l1,right_p1,right_w2,right_l2,right_p2,right_w3,right_l3,right_p3,right_w4,right_l4,right_p4,right_w5,right_l5,right_p5,datetime,year,10years,pattern_around5,pattern_around3,pattern_left2,pattern_left3,pattern_left4,pattern_right2,pattern_right3,pattern_right4,pattern_around5_lex,pattern_around3_lex,pattern_left2_lex,pattern_left3_lex,pattern_left4_lex,pattern_right2_lex,pattern_right3_lex,pattern_right4_lex
http://www.leconomiste.com/article/915457-tr-mie-de-chimicolorcopisa-livre-dans-deux-semaines,leconomiste.com,2014-01-17,Morocco,Chimicolor/NAM/Chimicolor,<doc uri=http://www.leconomiste.com/article/915457-tr-mie-de-chimicolorcopisa-livre-dans-deux-semaines website=leconomiste.com date=2014-01-17 source_country=Morocco> /trémie/NOM /de/PRP Chimicolor  Copisa  livre  dans  deux  semaines,chimicolor,nam,chimicolor,de,de,ADP,Trémie,trémie,NOUN,,,,,,,,,,Copisa,Copisa,VERB,livre,livre,NOUN,dans,dans,ADP,deux,deux,ADJ,semaines,semaine,NOUN,2014-01-17,2014,2010,NOUN ADP Micolor VERB NOUN,ADP Micolor VERB,NOUN ADP Micolor,,,Micolor VERB NOUN,Micolor VERB NOUN ADP,Micolor VERB NOUN ADP ADJ,trémie de Micolor Copisa livre,de Micolor Copisa,trémie de Micolor,,,Micolor Copisa livre,Micolor Copisa livre dans,Micolor Copisa livre dans deux
http://www.leconomiste.com/article/915457-tr-mie-de-chimicolorcopisa-livre-dans-deux-semaines,leconomiste.com,2014-01-17,Morocco,Chimicolor/NAM/Chimicolor,rond-point  Dakar  (  plus  connu  sous  l'  appellation Chimicolor  )  .,chimicolor,nam,chimicolor,appellation,appellation,NOUN,l',le,DET,sous,sous,ADP,connu,connaître,VERB,plus,plus,ADV,),),PUNCT,.,.,PUNCT,,,,,,,,,,2014-01-17,2014,2010,DET NOUN Micolor PUNCT PUNCT,NOUN Micolor PUNCT,DET NOUN Micolor,ADP DET NOUN Micolor,VERB ADP DET NOUN Micolor,Micolor PUNCT PUNCT,,,le appellation Micolor ) .,appellation Micolor ),le appellation Micolor,sous le appellation Micolor,connaître sous le appellation Micolor,Micolor ) .,,
http://www.yabiladi.com/articles/details/23185/plan-d-urgence-casablanca-milliards-dirhams.html,yabiladi.com,2014-02-11,Morocco,Chimicolor/NAM/Chimicolor,"Pour  cette  dernière  ,  des  réalisations  ont  été  faites  avec  la  finalisation  de  la  trémie Chimicolor  qui  sera  inaugurée  ce  mois-ci  .",chimicolor,nam,chimicolor,trémie,trémie,NOUN,la,le,DET,de,de,ADP,finalisation,finalisation,NOUN,la,le,DET,qui,qui,PRON,sera,être,VERB,inaugurée,inaugurer,VERB,ce,ce,PRON,mois-ci,mois-ci,VERB,2014-02-11,2014,2010,DET NOUN Micolor PRON VERB,NOUN Micolor PRON,DET NOUN Micolor,ADP DET NOUN Micolor,NOUN ADP DET NOUN Micolor,Micolor PRON VERB,Micolor PRON VERB VERB,Micolor PRON VERB VERB PRON,le trémie Micolor qui être,trémie Micolor qui,le trémie Micolor,de le trémie Micolor,finalisation de le trémie Micolor,Micolor qui être,Micolor qui être inaugurer,Micolor qui être inaugurer ce
http://www.leconomiste.com/article/916981-casablancar-habilitationl-art-re-ouled-ziane-op-rationnelle-en-avril,leconomiste.com,2014-02-19,Morocco,Chimicolor/NAM/Chimicolor,"Il  s'  agit  notamment  de  la  trémie  Dakar  (  rond-point Chimicolor  )  qui  sera  opérationnelle  en  mars  prochain  ,  l'  autoroute  urbaine  (  avril  prochain  )  et  la  rocade  Sud-Ouest  (  juillet  2014  )  .",chimicolor,nam,chimicolor,rond-point,rond-point,NOUN,(,(,PUNCT,Dakar,Dakar,PROPN,trémie,trémie,NOUN,la,le,DET,),),PUNCT,qui,qui,PRON,sera,être,VERB,opérationnelle,opérationnel,ADJ,en,en,ADP,2014-02-19,2014,2010,PUNCT NOUN Micolor PUNCT PRON,NOUN Micolor PUNCT,PUNCT NOUN Micolor,PROPN PUNCT NOUN Micolor,NOUN PROPN PUNCT NOUN Micolor,Micolor PUNCT PRON,Micolor PUNCT PRON VERB,Micolor PUNCT PRON VERB ADJ,( rond-point Micolor ) qui,rond-point Micolor ),( rond-point Micolor,Dakar ( rond-point Micolor,trémie Dakar ( rond-point Micolor,Micolor ) qui,Micolor ) qui être,Micolor ) qui être opérationnel
http://www.leconomiste.com/article/917058-de-bonnes-sources,leconomiste.com,2014-02-20,Morocco,Chimicolor/NAM/Chimicolor,*  Trémie Chimicolor  :  Copisa  à  l'  heure  mais  pas  la  mairie  !,chimicolor,nam,chimicolor,Trémie,Trémie,PROPN,*,*,NOUN,,,,,,,,,,:,:,PUNCT,Copisa,Copisa,VERB,à,à,ADP,l',le,DET,heure,heure,NOUN,2014-02-20,2014,2010,NOUN PROPN Micolor PUNCT VERB,PROPN Micolor PUNCT,NOUN PROPN Micolor,,,Micolor PUNCT VERB,Micolor PUNCT VERB ADP,Micolor PUNCT VERB ADP DET,* Trémie Micolor : Copisa,Trémie Micolor :,* Trémie Micolor,,,Micolor : Copisa,Micolor : Copisa à,Micolor : Copisa à le
http://www.leconomiste.com/article/917058-de-bonnes-sources,leconomiste.com,2014-02-20,Morocco,Chimicolor/NAM/Chimicolor,Cela  fait  pratiquement  plusieurs  semaines  que  la  trémie  Dakar  ( Chimicolor  )  est  fin  prête  .,chimicolor,nam,chimicolor,(,(,PUNCT,Dakar,Dakar,PROPN,trémie,trémie,NOUN,la,le,DET,que,que,CONJ,),),PUNCT,est,être,VERB,fin,fin,NOUN,prête,prêt,ADJ,.,.,PUNCT,2014-02-20,2014,2010,PROPN PUNCT Micolor PUNCT VERB,PUNCT Micolor PUNCT,PROPN PUNCT Micolor,NOUN PROPN PUNCT Micolor,DET NOUN PROPN PUNCT Micolor,Micolor PUNCT VERB,Micolor PUNCT VERB NOUN,Micolor PUNCT VERB NOUN ADJ,Dakar ( Micolor ) être,( Micolor ),Dakar ( Micolor,trémie Dakar ( Micolor,le trémie Dakar ( Micolor,Micolor ) être,Micolor ) être fin,Micolor ) être fin prêt
http://www.lnt.ma/actualites/casablanca-la-tremie-dakar-enfin-operationnelle-97668.html,lnt.ma,2014-02-27,Morocco,Chimicolor/NOM/Chimicolor,"Pour  les  Casablancais  ,  en  particulier  les  usagers  de  cette  trémie  connue  sous  le  nom  de  "" Chimicolor  ""  ,  c'  est  certainement  un  grand  ouf  de  soulagement  qu'  ils  vont  laisser  échapper  ,  après  environ  trois  ans  de  travaux  à  l'  origine  de  difficultés  énormes  de  mobilité  au  niveau  notamment  des  boulevards  Al  Moukawama  ,  Emile  Zola  ,  Mohammed  V  ,  Mohammed  VI  ,  des  FAR  ,  avec  la  porte  n  °  3  du  port  qui  accouche  de  centaines  de  camions-conteneurs  par  jour  ,  les  rues  Mohamed  Douiri  et  Khouribga  et  la  route  Ouled  Ziane  .",chimicolor,nom,chimicolor,"""","""",PUNCT,de,de,ADP,nom,nom,NOUN,le,le,DET,sous,sous,ADP,"""","""",PUNCT,",",",",PUNCT,c',ce,PRON,est,être,VERB,certainement,certainement,ADV,2014-02-27,2014,2010,ADP PUNCT Micolor PUNCT PUNCT,PUNCT Micolor PUNCT,ADP PUNCT Micolor,NOUN ADP PUNCT Micolor,DET NOUN ADP PUNCT Micolor,Micolor PUNCT PUNCT,Micolor PUNCT PUNCT PRON,Micolor PUNCT PUNCT PRON VERB,"de "" Micolor "" ,",""" Micolor ""","de "" Micolor","nom de "" Micolor","le nom de "" Micolor","Micolor "" ,","Micolor "" , ce","Micolor "" , ce être"
http://www.yabiladi.com/articles/details/25270/casablanca-apres-moult-reports-tremie.html,yabiladi.com,2014-04-24,Morocco,Chimicolor/NAM/Chimicolor,"Cette  trémie  permettra  de  fluidifier  la  circulation  au  niveau  du  boulevard  la  Résistance  et  de  la  place  Dakar  ,  plus  connue  sous  le  nom Chimicolor  .",chimicolor,nam,chimicolor,nom,nom,NOUN,le,le,DET,sous,sous,ADP,connue,connaître,VERB,plus,plus,ADV,.,.,PUNCT,,,,,,,,,,,,,2014-04-24,2014,2010,,NOUN Micolor PUNCT,DET NOUN Micolor,ADP DET NOUN Micolor,VERB ADP DET NOUN Micolor,,,,,nom Micolor .,le nom Micolor,sous le nom Micolor,connaître sous le nom Micolor,,,
http://www.leconomiste.com/article/940261-casablanca-sajid-ouvre-la-tremie-de-dakar,leconomiste.com,2014-04-25,Morocco,Chimicolor/NAM/Chimicolor,La  trémie  de  Dakar  (  rond-point Chimicolor  )  a  été  ouverte  hier  aux  automobilistes  .,chimicolor,nam,chimicolor,rond-point,rond-point,NOUN,(,(,PUNCT,Dakar,Dakar,PROPN,de,de,ADP,trémie,trémie,NOUN,),),PUNCT,a,avoir,VERB,été,être,VERB,ouverte,ouvrir,VERB,hier,hier,ADV,2014-04-25,2014,2010,PUNCT NOUN Micolor PUNCT VERB,NOUN Micolor PUNCT,PUNCT NOUN Micolor,PROPN PUNCT NOUN Micolor,ADP PROPN PUNCT NOUN Micolor,Micolor PUNCT VERB,Micolor PUNCT VERB VERB,Micolor PUNCT VERB VERB VERB,( rond-point Micolor ) avoir,rond-point Micolor ),( rond-point Micolor,Dakar ( rond-point Micolor,de Dakar ( rond-point Micolor,Micolor ) avoir,Micolor ) avoir être,Micolor ) avoir être ouvrir
http://www.ladepeche.fr/article/2014/09/15/1952008-shu-uemura-la-collection-shupette-enfin-devoilee.html,ladepeche.fr,2014-09-15,France,Lumicolor/NOM/Lumicolor,"Mais  c'  est  aussi  la  qualité  des  produits  qui  devrait  attirer  les  clients  ,  comme  les  deux  trios  de  rouges  pour  les  lèvres  ,  qui  reprennent  la Lumicolor  Matrix  Technology  de  Shu  Uemura  ,  censée  intensifier  la  couleur  et  la  brillance  des  lèvres  .",lumicolor,nom,lumicolor,la,le,DET,reprennent,reprendre,VERB,qui,qui,PRON,",",",",PUNCT,lèvres,lèvre,NOUN,Matrix,Matrix,PROPN,Technology,Technology,PROPN,de,de,ADP,Shu,Shu,PROPN,Uemura,Uemura,PROPN,2014-09-15,2014,2010,VERB DET Micolor PROPN PROPN,DET Micolor PROPN,VERB DET Micolor,PRON VERB DET Micolor,PUNCT PRON VERB DET Micolor,Micolor PROPN PROPN,Micolor PROPN PROPN ADP,Micolor PROPN PROPN ADP PROPN,reprendre le Micolor Matrix Technology,le Micolor Matrix,reprendre le Micolor,qui reprendre le Micolor,", qui reprendre le Micolor",Micolor Matrix Technology,Micolor Matrix Technology de,Micolor Matrix Technology de Shu
http://www.leconomiste.com/article/960546-les-projets-immobiliers-fantomes,leconomiste.com,2014-10-16,Morocco,Chimicolor/NAM/Chimicolor,"Après  une  décennie  de  travaux  ,  de  calvaire  pour  les  automobilistes  qui  empruntaient  la  voie  de  l'  intersection  du  bd  Mohammed  VI  et  du  bd  de  la  Résistance  et  du  rond-point Chimicolor  vers  le  bd  des  FAR  ,  après  d'  importantes  déviations  des  conducteurs  d'  eau  et  d'  électricité  ,  les  usagers  de  cette  voie  ont  constaté  aujourd  '  hui  son  inutilité  .",chimicolor,nam,chimicolor,rond-point,rond-point,NOUN,du,du,ADP DET,et,et,CONJ,Résistance,résistance,NOUN,la,le,DET,vers,vers,ADP,le,le,DET,bd,bd,NOUN,des,du,ADP DET,FAR,FAR,PROPN,2014-10-16,2014,2010,ADP DET NOUN Micolor ADP DET,NOUN Micolor ADP,ADP DET NOUN Micolor,CONJ ADP DET NOUN Micolor,NOUN CONJ ADP DET NOUN Micolor,Micolor ADP DET,Micolor ADP DET NOUN,Micolor ADP DET NOUN ADP DET,du rond-point Micolor vers le,rond-point Micolor vers,du rond-point Micolor,et du rond-point Micolor,résistance et du rond-point Micolor,Micolor vers le,Micolor vers le bd,Micolor vers le bd du
http://journalmetro.com/plus/tendances/691645/noel-des-reflets-dores-et-une-bouche-glamour-pour-un-maquillage-de-fete-reussi/,journalmetro.com,2014-12-21,Canada,Lumicolor/NAM/Lumicolor,"Les  lèvres  sont  gourmandes  grâce  au  ""  Rouge  bonbon  fantasy  trio  ""  conçu  à  partir  de  la  technologie Lumicolor  Matrix  pour  donner  de  l'  intensité  ,  et  le  regard  se  veut  haute  couture  grâce  à  deux  versions  de  faux-cils  :  une  première  ornée  de  plumes  et  de  nuances  bleutées  et  une  seconde  aux  reflets  argentés  parés  de  cristaux  bleus  . </doc>",lumicolor,nam,lumicolor,technologie,technologie,NOUN,la,le,DET,de,de,ADP,partir,partir,VERB,à,à,ADP,Matrix,Matrix,PROPN,pour,pour,CONJ,donner,donner,VERB,de,de,ADP,l',le,DET,2014-12-21,2014,2010,DET NOUN Micolor PROPN CONJ,NOUN Micolor PROPN,DET NOUN Micolor,ADP DET NOUN Micolor,VERB ADP DET NOUN Micolor,Micolor PROPN CONJ,Micolor PROPN CONJ VERB,Micolor PROPN CONJ VERB ADP,le technologie Micolor Matrix pour,technologie Micolor Matrix,le technologie Micolor,de le technologie Micolor,partir de le technologie Micolor,Micolor Matrix pour,Micolor Matrix pour donner,Micolor Matrix pour donner de
http://www.lexpress.fr/actualite/inedit-lalla-laicity-au-megarama-d-azemmour_1711935.html,lexpress.fr,2015-09-02,France,Chimicolor/NAM/Chimicolor,"En  revanche  ,  il  me  semble  que  celle-ci  circule  en  boucle  sur  le  rond  point Chimicolor  .",chimicolor,nam,chimicolor,point,point,NOUN,rond,rond,ADJ,le,le,DET,sur,sur,ADP,boucle,boucle,NOUN,.,.,PUNCT,,,,,,,,,,,,,2015-09-02,2015,2010,,NOUN Micolor PUNCT,ADJ NOUN Micolor,DET ADJ NOUN Micolor,ADP DET ADJ NOUN Micolor,,,,,point Micolor .,rond point Micolor,le rond point Micolor,sur le rond point Micolor,,,
http://www.ladepeche.fr/article/2017/07/27/2618557-les-inedits-de-francois-pellarey-au-musee-larrey.html,ladepeche.fr,2017-07-27,France,lumicolor/NOM/lumicolor,"On  se  souvient  ,  en  effet  ,  de  cette  expo  qui  ,  en  2015  ,  avait  réuni  les  ""  noir  et  blanc  ""  du  peintre  bigourdan  et  les  ""  Variations lumicolor  ""  d'  un  autre  Bigourdan  ,  le  sculpteur  Philippe  Gauberti  ,  et  le  musée  lui  a  également  ouvert  plusieurs  fois  ses  portes  de  son  vivant  .",lumicolor,nom,lumicolor,Variations,variation,NOUN,"""","""",PUNCT,les,le,DET,et,et,CONJ,bigourdan,bigourdan,ADJ,"""","""",PUNCT,d',de,ADP,un,un,DET,autre,autre,ADJ,Bigourdan,Bigourdan,PROPN,2017-07-27,2017,2010,PUNCT NOUN Micolor PUNCT ADP,NOUN Micolor PUNCT,PUNCT NOUN Micolor,DET PUNCT NOUN Micolor,CONJ DET PUNCT NOUN Micolor,Micolor PUNCT ADP,Micolor PUNCT ADP DET,Micolor PUNCT ADP DET ADJ,""" variation Micolor "" de","variation Micolor """,""" variation Micolor","le "" variation Micolor","et le "" variation Micolor","Micolor "" de","Micolor "" de un","Micolor "" de un autre"
http://www.ouest-france.fr/bretagne/rennes-35000/rennes-deux-cine-concerts-de-gable-l-antipode-vendredi-5227239,ouest-france.fr,2017-09-07,France,Comicolor/NAM/Comicolor,"Le  ciné-concert  est  l'  avant-première  du  ciné-concert  "" Comicolor  ""  qui  va  partir  en  tournée  pour  une  dizaine  de  dates  .",comicolor,nam,comicolor,"""","""",PUNCT,ciné-concert,ciné-concert,NOUN,du,du,ADP DET,avant-première,avant-première,NOUN,l',le,DET,"""","""",PUNCT,qui,qui,PRON,va,aller,VERB,partir,partir,VERB,en,en,ADP,2017-09-07,2017,2010,NOUN PUNCT Micolor PUNCT PRON,PUNCT Micolor PUNCT,NOUN PUNCT Micolor,ADP DET NOUN PUNCT Micolor,NOUN ADP DET NOUN PUNCT Micolor,Micolor PUNCT PRON,Micolor PUNCT PRON VERB,Micolor PUNCT PRON VERB VERB,"ciné-concert "" Micolor "" qui",""" Micolor ""","ciné-concert "" Micolor","du ciné-concert "" Micolor","avant-première du ciné-concert "" Micolor","Micolor "" qui","Micolor "" qui aller","Micolor "" qui aller partir"
https://pontivy.maville.com/actu/actudet_-vannes.-une-nouvelle-saison-prometteuse-a-l-echonova_fil-3367006_actu.Htm?xtor=RSS-4&utm_source=RSS_MVI_pontivy&utm_medium=RSS&utm_campaign=RSS,maville.com,2018-01-24,===NONE===,ComiColor/NAM/ComiColor,"Pour  cette  saison  ,  l'  Échonova  réserve  de  nombreux  concerts  étonnants  ,  à  commencer  par  le  ciné-concert  du  21  février  ,  à  18  h.  Le  groupe  GaBlé  revisitera  les  dessins  animés  des  années  1930  ,  alors  appelés ComiColor  .",comicolor,nam,comicolor,appelés,appeler,VERB,alors,alors,ADV,",",",",PUNCT,1930,@card@,ADJ,années,année,NOUN,.,.,PUNCT,,,,,,,,,,,,,2018-01-24,2018,2010,,VERB Micolor PUNCT,ADV VERB Micolor,PUNCT ADV VERB Micolor,ADJ PUNCT ADV VERB Micolor,,,,,appeler Micolor .,alors appeler Micolor,", alors appeler Micolor","@card@ , alors appeler Micolor",,,
http://www.leconomiste.com/article/1024646-circulation-casablanca-les-points-noirs-eviter,leconomiste.com,2018-02-28,Morocco,Chimicolor/NAM/Chimicolor,"D'autant  plus  qu'  une  partie  de  la  circulation  qui  empruntait  l'  axe  du  bd  des  Almohades  (  via  la  trémie  de  la  mosquée  Hassan  II  pour  arriver  à  bd  Zerktouni  ou  la  Corniche  ,  Hay  Hassani  ,  Oulfa  ...  )  se  trouve  aujourd  '  hui  de  facto  déviée  vers  l'  axe  rond-point Chimicolor  ,  Bd  la  Résistance  ,  Zerktouni  ...",chimicolor,nam,chimicolor,rond-point,rond-point,NOUN,axe,axe,NOUN,l',le,DET,vers,vers,ADP,déviée,dévier,VERB,",",",",PUNCT,Bd,Bd,PROPN,la,le,DET,Résistance,Résistance,PROPN,",",",",PUNCT,2018-02-28,2018,2010,NOUN NOUN Micolor PUNCT PROPN,NOUN Micolor PUNCT,NOUN NOUN Micolor,DET NOUN NOUN Micolor,ADP DET NOUN NOUN Micolor,Micolor PUNCT PROPN,Micolor PUNCT PROPN DET,Micolor PUNCT PROPN DET PROPN,"axe rond-point Micolor , Bd","rond-point Micolor ,",axe rond-point Micolor,le axe rond-point Micolor,vers le axe rond-point Micolor,"Micolor , Bd","Micolor , Bd le","Micolor , Bd le Résistance"
https://redon.maville.com/actu/actudet_-a-bruz-l-affiche-2018-2019-des-spectacles-vivants-au-grand-logis_fil-3468494_actu.Htm?xtor=RSS-4,maville.com,2018-06-14,===NONE===,Comicolor/NAM/Comicolor,"Dimanche  27  ,  à  16  h  30  ,  ciné-concert Comicolor  avec  les  instruments  bricolés  et  la  musique  folk  électronique  de  GaBLé  .",comicolor,nam,comicolor,ciné-concert,ciné-concert,NOUN,",",",",PUNCT,30,@card@,ADJ,h,heure,ABR,16,@card@,ADJ,avec,avec,ADP,les,le,DET,instruments,instrument,NOUN,bricolés,bricoler,VERB,et,et,CONJ,2018-06-14,2018,2010,PUNCT NOUN Micolor ADP DET,NOUN Micolor ADP,PUNCT NOUN Micolor,ADJ PUNCT NOUN Micolor,ABR ADJ PUNCT NOUN Micolor,Micolor ADP DET,Micolor ADP DET NOUN,Micolor ADP DET NOUN VERB,", ciné-concert Micolor avec le",ciné-concert Micolor avec,", ciné-concert Micolor","@card@ , ciné-concert Micolor","heure @card@ , ciné-concert Micolor",Micolor avec le,Micolor avec le instrument,Micolor avec le instrument bricoler
https://cherbourg.maville.com/actu/actudet_-sortir-a-caen.-cine-concert-de-gable-en-mode-comicolor-au-cargo_fil-3468970_actu.Htm?xtor=RSS-4,maville.com,2018-06-15,===NONE===,ComiColor/NAM/ComiColor,"Ciné-concert  de  GaBLé  en  mode  "" ComiColor  ""  au  Cargö  (  Ouest-France  )",comicolor,nam,comicolor,"""","""",PUNCT,mode,mode,NOUN,en,en,ADP,GaBLé,GaBLé,PROPN,de,de,ADP,"""","""",PUNCT,au,au,ADP DET,Cargö,Cargö,ABR,(,(,PUNCT,Ouest-France,Ouest-France,NOUN,2018-06-15,2018,2010,NOUN PUNCT Micolor PUNCT ADP DET,PUNCT Micolor PUNCT,NOUN PUNCT Micolor,ADP NOUN PUNCT Micolor,PROPN ADP NOUN PUNCT Micolor,Micolor PUNCT ADP DET,Micolor PUNCT ADP DET ABR,Micolor PUNCT ADP DET ABR PUNCT,"mode "" Micolor "" au",""" Micolor ""","mode "" Micolor","en mode "" Micolor","GaBLé en mode "" Micolor","Micolor "" au","Micolor "" au Cargö","Micolor "" au Cargö ("
https://cherbourg.maville.com/actu/actudet_-sortir-a-caen.-cine-concert-de-gable-en-mode-comicolor-au-cargo_fil-3468970_actu.Htm?xtor=RSS-4,maville.com,2018-06-15,===NONE===,ComiColor/NOM/ComiColor,"Le  génial  et  foutraque  groupe  GaBLé  (  électro-folk  ,  Caen  )  ajoute  une  nouvelle  corde  à  son  arc  bien  tendu  :  un  ciné-concert  baptisé ComiColor  sur  des  images  animées  d'  Ub  Iwerks  ,  le  père  de  Mickey  .",comicolor,nom,comicolor,baptisé,baptiser,VERB,ciné-concert,ciné-concert,NOUN,un,un,DET,:,:,PUNCT,tendu,tendre,VERB,sur,sur,ADP,des,du,ADP DET,images,image,NOUN,animées,animer,VERB,d',de,ADP,2018-06-15,2018,2010,NOUN VERB Micolor ADP ADP DET,VERB Micolor ADP,NOUN VERB Micolor,DET NOUN VERB Micolor,PUNCT DET NOUN VERB Micolor,Micolor ADP ADP DET,Micolor ADP ADP DET NOUN,Micolor ADP ADP DET NOUN VERB,ciné-concert baptiser Micolor sur du,baptiser Micolor sur,ciné-concert baptiser Micolor,un ciné-concert baptiser Micolor,: un ciné-concert baptiser Micolor,Micolor sur du,Micolor sur du image,Micolor sur du image animer
https://cherbourg.maville.com/actu/actudet_-sortir-a-caen.-cine-concert-de-gable-en-mode-comicolor-au-cargo_fil-3468970_actu.Htm?xtor=RSS-4,maville.com,2018-06-15,===NONE===,ComiColor/NAM/ComiColor,"D'après  une  idée  originale  de  l'  Antipode  (  Rennes  )  ,  le  trio  caennais  GaBLé  tisse  sa  toile  avec ComiColor  ,  un  ciné-concert  d'  1  h  environ  sur  des  images  animées  d'  Ub  Iwerks  ,  figure  de  Disney  .",comicolor,nam,comicolor,avec,avec,ADP,toile,toile,NOUN,sa,son,DET,tisse,tisser,VERB,GaBLé,GaBLé,VERB,",",",",PUNCT,un,un,DET,ciné-concert,ciné-concert,NOUN,d',de,ADP,1,@card@,ADJ,2018-06-15,2018,2010,NOUN ADP Micolor PUNCT DET,ADP Micolor PUNCT,NOUN ADP Micolor,DET NOUN ADP Micolor,VERB DET NOUN ADP Micolor,Micolor PUNCT DET,Micolor PUNCT DET NOUN,Micolor PUNCT DET NOUN ADP,"toile avec Micolor , un","avec Micolor ,",toile avec Micolor,son toile avec Micolor,tisser son toile avec Micolor,"Micolor , un","Micolor , un ciné-concert","Micolor , un ciné-concert de"
https://www.paris-normandie.fr/loisirs/sortir-en-normandie/le-havre--presentation-en-musique-de-la-nouvelle-saison-vendredi-28-septembre-CL13814996,paris-normandie.fr,2018-09-28,France,Comicolor/NAM/Comicolor,"Lancement  jeudi  11  octobre  avec Comicolor  ,  un  ciné-concert  à  découvrir  en  famille  .",comicolor,nam,comicolor,avec,avec,ADP,octobre,octobre,NOUN,11,@card@,ADJ,jeudi,jeudi,NOUN,Lancement,lancement,NOUN,",",",",PUNCT,un,un,DET,ciné-concert,ciné-concert,NOUN,à,à,ADP,découvrir,découvrir,VERB,2018-09-28,2018,2010,NOUN ADP Micolor PUNCT DET,ADP Micolor PUNCT,NOUN ADP Micolor,ADJ NOUN ADP Micolor,NOUN ADJ NOUN ADP Micolor,Micolor PUNCT DET,Micolor PUNCT DET NOUN,Micolor PUNCT DET NOUN ADP,"octobre avec Micolor , un","avec Micolor ,",octobre avec Micolor,@card@ octobre avec Micolor,jeudi @card@ octobre avec Micolor,"Micolor , un","Micolor , un ciné-concert","Micolor , un ciné-concert à"
https://www.paris-normandie.fr/loisirs/des-dessins-animes-et-du-son-au-theatre-des-bains-douches-du-havre-NI13938041,paris-normandie.fr,2018-10-11,France,Comicolor/NOM/Comicolor,Ce  qui  donne  un  ciné-concert  animé  du  nom  de Comicolor  pour  les  enfants  et  leurs  parents  .,comicolor,nom,comicolor,de,de,ADP,nom,nom,NOUN,du,du,ADP DET,animé,animer,VERB,ciné-concert,ciné-concert,NOUN,pour,pour,ADP,les,le,DET,enfants,enfant,NOUN,et,et,CONJ,leurs,leur,DET,2018-10-11,2018,2010,NOUN ADP Micolor ADP DET,ADP Micolor ADP,NOUN ADP Micolor,ADP DET NOUN ADP Micolor,VERB ADP DET NOUN ADP Micolor,Micolor ADP DET,Micolor ADP DET NOUN,Micolor ADP DET NOUN CONJ,nom de Micolor pour le,de Micolor pour,nom de Micolor,du nom de Micolor,animer du nom de Micolor,Micolor pour le,Micolor pour le enfant,Micolor pour le enfant et
https://www.paris-normandie.fr/loisirs/sortir-en-normandie/au-havre-tous-les-univers-du-theatre-des-bains-douches-DO13955512,paris-normandie.fr,2018-10-13,France,Comicolor/NAM/Comicolor,"Jeudi  et  vendredi  soir  ,  le  théâtre  havrais  de  moins  de  cent  places  a  proposé  un  rendez-vous  familial  , Comicolor  ,  mélange  de  dessins  animés  et  de  musique  jouée  en  live  -  très  fort  ,  très  en  rythme  (  s  )  -  par  la  formation  caennaise  GaBLé  .",comicolor,nam,comicolor,",",",",PUNCT,familial,familial,ADJ,rendez-vous,rendez-vous,NOUN,un,un,DET,proposé,proposer,VERB,",",",",PUNCT,mélange,mélange,NOUN,de,de,ADP,dessins,dessin,NOUN,animés,animer,VERB,2018-10-13,2018,2010,ADJ PUNCT Micolor PUNCT NOUN,PUNCT Micolor PUNCT,ADJ PUNCT Micolor,NOUN ADJ PUNCT Micolor,DET NOUN ADJ PUNCT Micolor,Micolor PUNCT NOUN,Micolor PUNCT NOUN ADP,Micolor PUNCT NOUN ADP NOUN,"familial , Micolor , mélange",", Micolor ,","familial , Micolor","rendez-vous familial , Micolor","un rendez-vous familial , Micolor","Micolor , mélange","Micolor , mélange de","Micolor , mélange de dessin"
https://www.paris-normandie.fr/loisirs/sortir-en-normandie/au-havre-tous-les-univers-du-theatre-des-bains-douches-DO13955512,paris-normandie.fr,2018-10-13,France,Comicolor/NOM/Comicolor,Le  début  (  NDLR  : Comicolor  donc  )  et  la  fin  de  la  saison  donnent  sans  doute  une  teinte  lumineuse  .,comicolor,nom,comicolor,:,:,PUNCT,NDLR,NDLR,PROPN,(,(,PUNCT,début,début,NOUN,Le,le,DET,donc,donc,ADV,),),PUNCT,et,et,CONJ,la,le,DET,fin,fin,NOUN,2018-10-13,2018,2010,PROPN PUNCT Micolor ADV PUNCT,PUNCT Micolor ADV,PROPN PUNCT Micolor,PUNCT PROPN PUNCT Micolor,NOUN PUNCT PROPN PUNCT Micolor,Micolor ADV PUNCT,Micolor ADV PUNCT CONJ,Micolor ADV PUNCT CONJ DET,NDLR : Micolor donc ),: Micolor donc,NDLR : Micolor,( NDLR : Micolor,début ( NDLR : Micolor,Micolor donc ),Micolor donc ) et,Micolor donc ) et le
http://www.lequotidien.lu/culture/picelectronic-aux-rotondes-ce-nest-pas-que-pour-les-enfants/,lequotidien.lu,2018-10-23,Luxembourg,CoMiCoLoR/NAM/CoMiCoLoR,"Autre  must  de  cette  10  e  édition  le  ""  ciné-concert  GaBLé CoMiCoLoR  ""  .",comicolor,nam,comicolor,GaBLé,GaBLé,PROPN,ciné-concert,ciné-concert,NOUN,"""","""",PUNCT,le,le,DET,édition,édition,NOUN,"""","""",PUNCT,.,.,PUNCT,,,,,,,,,,2018-10-23,2018,2010,NOUN PROPN Micolor PUNCT PUNCT,PROPN Micolor PUNCT,NOUN PROPN Micolor,PUNCT NOUN PROPN Micolor,DET PUNCT NOUN PROPN Micolor,Micolor PUNCT PUNCT,,,"ciné-concert GaBLé Micolor "" .","GaBLé Micolor """,ciné-concert GaBLé Micolor,""" ciné-concert GaBLé Micolor","le "" ciné-concert GaBLé Micolor","Micolor "" .",,
http://www.lequotidien.lu/culture/picelectronic-aux-rotondes-ce-nest-pas-que-pour-les-enfants/,lequotidien.lu,2018-10-23,Luxembourg,ComiColor/NOM/ComiColor,"Le  trio  folk-electro  ,  que  les  habitués  des  Rotondes  ont  déjà  pu  voir  sur  scène  ,  fera  découvrir  aux  enfants  à  partir  de  6  ans  les  sons  de  ses  instruments  bricolés  sur  ""  ce  bijou  méconnu  des  années  30  ""  ,  la  série  animée ComiColor  ,  créée  par  Ub  Iwerks  ,  pilier  des  studios  Disney  .",comicolor,nom,comicolor,animée,animer,VERB,série,série,NOUN,la,le,DET,",",",",PUNCT,"""","""",PUNCT,",",",",PUNCT,créée,créer,VERB,par,par,ADP,Ub,Ub,PROPN,Iwerks,Iwerks,PROPN,2018-10-23,2018,2010,NOUN VERB Micolor PUNCT VERB,VERB Micolor PUNCT,NOUN VERB Micolor,DET NOUN VERB Micolor,PUNCT DET NOUN VERB Micolor,Micolor PUNCT VERB,Micolor PUNCT VERB ADP,Micolor PUNCT VERB ADP PROPN,"série animer Micolor , créer","animer Micolor ,",série animer Micolor,le série animer Micolor,", le série animer Micolor","Micolor , créer","Micolor , créer par","Micolor , créer par Ub"
