url,website,date,country,keyword,sentence,kw,kw_lemma,kw_pos,left_w1,left_l1,left_p1,left_w2,left_l2,left_p2,left_w3,left_l3,left_p3,left_w4,left_l4,left_p4,left_w5,left_l5,left_p5,right_w1,right_l1,right_p1,right_w2,right_l2,right_p2,right_w3,right_l3,right_p3,right_w4,right_l4,right_p4,right_w5,right_l5,right_p5,datetime,year,10years,pattern_around5,pattern_around3,pattern_left2,pattern_left3,pattern_left4,pattern_right2,pattern_right3,pattern_right4,pattern_around5_lex,pattern_around3_lex,pattern_left2_lex,pattern_left3_lex,pattern_left4_lex,pattern_right2_lex,pattern_right3_lex,pattern_right4_lex
http://www.metronews.fr/culture/21-groupes-a-decouvrir-en-live-au-mo-fo/mnaw%21Ilyxp16YTo1u/,metronews.fr,2014-01-24,France,Vaselines/NAM/Vaselines,"Et  rappelons-le  ,  des  artistes  comme  The  Gossip  ,  The Vaselines  ,  Da  Brasilians  ,  Shannon  wright  ,  Herman  Dune  ,  Bonnie  Prince  Billy  ou  encore  French  Cowboy  sont  passés  par  là  .",vaselines,nam,vaselines,The,The,PROPN,",",",",PUNCT,Gossip,Gossip,PROPN,The,The,PROPN,comme,comme,CONJ,",",",",PUNCT,Da,Da,PROPN,Brasilians,Brasilians,PROPN,",",",",PUNCT,Shannon,Shannon,PROPN,2014-01-24,2014,2010,PUNCT PROPN Vaseline PUNCT PROPN,PROPN Vaseline PUNCT,PUNCT PROPN Vaseline,PROPN PUNCT PROPN Vaseline,PROPN PROPN PUNCT PROPN Vaseline,Vaseline PUNCT PROPN,Vaseline PUNCT PROPN PROPN,Vaseline PUNCT PROPN PROPN PUNCT,", The Vaseline , Da","The Vaseline ,",", The Vaseline","Gossip , The Vaseline","The Gossip , The Vaseline","Vaseline , Da","Vaseline , Da Brasilians","Vaseline , Da Brasilians ,"
http://www.leparisien.fr/info-paris-ile-de-france-oise/claude-francois-photographe-erotique-a-dannemois-25-01-2014-3527053.php,leparisien.fr,2014-01-25,France,vaseline/NOM/vaseline,"Admiratif  de  l'  œuvre  de  David  Hamilton  --  qu'  il  a  rencontré  en  1972  et  à  qui  il  a  pris  le  ""  truc  ""  de  mettre  de  la vaseline  sur  l'  objectif  pour  donner  un  côté  sucré  et  flou  aux  clichés  --  et  passionné  des  jeux  de  lumière  sur  les  peaux  nacrées  ,  Cloclo  devient  à  son  tour  metteur  en  scène  et  photographe  à  l'  occasion  .",vaseline,nom,vaseline,la,le,DET,de,de,ADP,mettre,mettre,VERB,de,de,ADP,"""","""",PUNCT,sur,sur,ADP,l',le,DET,objectif,objectif,NOUN,pour,pour,ADP,donner,donner,VERB,2014-01-25,2014,2010,ADP DET Vaseline ADP DET,DET Vaseline ADP,ADP DET Vaseline,VERB ADP DET Vaseline,ADP VERB ADP DET Vaseline,Vaseline ADP DET,Vaseline ADP DET NOUN,Vaseline ADP DET NOUN ADP,de le Vaseline sur le,le Vaseline sur,de le Vaseline,mettre de le Vaseline,de mettre de le Vaseline,Vaseline sur le,Vaseline sur le objectif,Vaseline sur le objectif pour
http://www.tdg.ch/geneve/actu-genevoise/Des-beautes-toutes-betes-paradent-a-Carouge/story/30597671,tdg.ch,2014-01-29,Switzerland,vaseline/NOM/vaseline,"Pour  les  coqs  ,  une  pointe  de vaseline  fait  briller  la  crête  !",vaseline,nom,vaseline,de,de,ADP,pointe,pointe,NOUN,une,un,DET,",",",",PUNCT,coqs,coq,NOUN,fait,faire,VERB,briller,briller,VERB,la,le,DET,crête,crête,NOUN,!,!,PUNCT,2014-01-29,2014,2010,NOUN ADP Vaseline VERB VERB,ADP Vaseline VERB,NOUN ADP Vaseline,DET NOUN ADP Vaseline,PUNCT DET NOUN ADP Vaseline,Vaseline VERB VERB,Vaseline VERB VERB DET,Vaseline VERB VERB DET NOUN,pointe de Vaseline faire briller,de Vaseline faire,pointe de Vaseline,un pointe de Vaseline,", un pointe de Vaseline",Vaseline faire briller,Vaseline faire briller le,Vaseline faire briller le crête
http://www.techno-science.net/?onglet=news&news=12445,techno-science.net,2014-02-01,===NONE===,vaseline/NOM/vaseline,"Lubrifiez  d'abord  la  paroi  intérieure  du  goulot  de  la  bouteille  avec  un  peu  de vaseline  ,  de  graisse  ou  de  beurre  (  Les  Beurré  sont  un  groupe  de  variétés  de  poires  à  chair  fondante  ,  comprenant  entre  autres  les  variétés  suivantes  .  )  .",vaseline,nom,vaseline,de,de,ADP,peu,peu,ADV,un,un,DET,avec,avec,ADP,bouteille,bouteille,NOUN,",",",",PUNCT,de,de,ADP,graisse,graisse,NOUN,ou,ou,CONJ,de,de,ADP,2014-02-01,2014,2010,ADV ADP Vaseline PUNCT ADP,ADP Vaseline PUNCT,ADV ADP Vaseline,DET ADV ADP Vaseline,ADP DET ADV ADP Vaseline,Vaseline PUNCT ADP,Vaseline PUNCT ADP NOUN,Vaseline PUNCT ADP NOUN CONJ,"peu de Vaseline , de","de Vaseline ,",peu de Vaseline,un peu de Vaseline,avec un peu de Vaseline,"Vaseline , de","Vaseline , de graisse","Vaseline , de graisse ou"
http://youllneverblogalone.blogs.francefootball.fr/2014/02/04/crime-et-chatiment/,francefootball.fr,2014-02-05,France,vaseline/NOM/vaseline,"Il  a  raconté  des  horreurs  surnommées  par  les  tortionnaires  eux-mêmes  ""  the  glove  ""  (  le  gant  )  ou  ""  the  finger  ""  (  le  doigt  )  ,  ou  comment  le  gardien  de  but  Peter  Fox  enduisait  son  gant  de vaseline  avant  de  l'  introduire  dans  l'  anus  du  gamin  ,  âgé  de  16  ans  à  l'  époque  .",vaseline,nom,vaseline,de,de,ADP,gant,gant,NOUN,son,son,DET,enduisait,enduire,VERB,Fox,Fox,PROPN,avant,avant,ADP,de,de,ADP,l',la|le,PRON,introduire,introduire,VERB,dans,dans,ADP,2014-02-05,2014,2010,NOUN ADP Vaseline ADP ADP,ADP Vaseline ADP,NOUN ADP Vaseline,DET NOUN ADP Vaseline,VERB DET NOUN ADP Vaseline,Vaseline ADP ADP,Vaseline ADP ADP PRON,Vaseline ADP ADP PRON VERB,gant de Vaseline avant de,de Vaseline avant,gant de Vaseline,son gant de Vaseline,enduire son gant de Vaseline,Vaseline avant de,Vaseline avant de la|le,Vaseline avant de la|le introduire
http://next.liberation.fr/cinema/2014/02/11/c-est-tres-agreable-de-se-glisser-dans-un-premier-role_979443?xtor=rss-450,liberation.fr,2014-02-15,France,vaseline/NOM/vaseline,"Dans  les  Grandes  Ondes  (  à  l'  ouest  )  ,  il  est  parfait  en  grand  reporter  hagard  qui  couvre  la  révolution  des  œillets  au  Portugal  en  1974  et  ,  croyant  être  lusophone  ,  réclame  de  la vaseline  quand  il  veut  boire  du  vin  .",vaseline,nom,vaseline,la,le,DET,de,de,ADP,réclame,réclamer,VERB,",",",",PUNCT,lusophone,lusophone,NOUN,quand,quand,CONJ,il,il,PRON,veut,vouloir,VERB,boire,boire,VERB,du,du,ADP DET,2014-02-15,2014,2010,ADP DET Vaseline CONJ PRON,DET Vaseline CONJ,ADP DET Vaseline,VERB ADP DET Vaseline,PUNCT VERB ADP DET Vaseline,Vaseline CONJ PRON,Vaseline CONJ PRON VERB,Vaseline CONJ PRON VERB VERB,de le Vaseline quand il,le Vaseline quand,de le Vaseline,réclamer de le Vaseline,", réclamer de le Vaseline",Vaseline quand il,Vaseline quand il vouloir,Vaseline quand il vouloir boire
http://www.lapresse.ca/voyage/trucs-conseils/201402/28/01-4743539-comment-eviter-les-maladies-tropicales.php,lapresse.ca,2014-03-02,Canada,vaseline/NOM/vaseline,"Les  larves  ont  besoin  de  respirer  :  alors  ,  on  met  de  la vaseline  ,  un  pansement  ,  et  normalement  ,  les  larves  sortent  toutes  seules  .",vaseline,nom,vaseline,la,le,DET,de,de,ADP,met,mettre,VERB,on,on,PRON,",",",",PUNCT,",",",",PUNCT,un,un,DET,pansement,pansement,NOUN,",",",",PUNCT,et,et,CONJ,2014-03-02,2014,2010,ADP DET Vaseline PUNCT DET,DET Vaseline PUNCT,ADP DET Vaseline,VERB ADP DET Vaseline,PRON VERB ADP DET Vaseline,Vaseline PUNCT DET,Vaseline PUNCT DET NOUN,Vaseline PUNCT DET NOUN PUNCT,"de le Vaseline , un","le Vaseline ,",de le Vaseline,mettre de le Vaseline,on mettre de le Vaseline,"Vaseline , un","Vaseline , un pansement","Vaseline , un pansement ,"
http://www.ladepeche.fr/article/2014/02/27/1828418-sois-forte.html,ladepeche.fr,2014-03-04,France,vaseline/NOM/vaseline,"-  Il  ne  m'  embrassait  pas  dans  le  cou  ,  il  m'  a  chuchoté  à  l'  oreille  qu'  il  était  gay  ,  qu'  il  te  trouvait  à  son  goût  et  voulait  savoir  si  on  avait  de  la vaseline  .",vaseline,nom,vaseline,la,le,DET,de,de,ADP,avait,avoir,VERB,on,on,PRON,si,si,CONJ,.,.,PUNCT,,,,,,,,,,,,,2014-03-04,2014,2010,,DET Vaseline PUNCT,ADP DET Vaseline,VERB ADP DET Vaseline,PRON VERB ADP DET Vaseline,,,,,le Vaseline .,de le Vaseline,avoir de le Vaseline,on avoir de le Vaseline,,,
http://www.fredzone.org/faut-il-acheter-liphone-5c-8-go-039,fredzone.org,2014-03-18,===NONE===,vaseline/NOM/vaseline,"Avouez  que  c'  est  tentant  ,  non  ?  Après  tout  ,  ce  n'  est  même  pas  le  prix  d'  une  bouteille  de vaseline  .",vaseline,nom,vaseline,de,de,ADP,bouteille,bouteille,NOUN,une,un,DET,d',de,ADP,prix,prix,NOUN,.,.,PUNCT,,,,,,,,,,,,,2014-03-18,2014,2010,,ADP Vaseline PUNCT,NOUN ADP Vaseline,DET NOUN ADP Vaseline,ADP DET NOUN ADP Vaseline,,,,,de Vaseline .,bouteille de Vaseline,un bouteille de Vaseline,de un bouteille de Vaseline,,,
http://blogs.rue89.nouvelobs.com/en-attendant-la-troisieme-guerre-mondiale/2014/03/22/bilan-de-la-semaine-pour-une-revolution-vaseline-232571,nouvelobs.com,2014-03-22,===NONE===,vaseline/NOM/vaseline,"<doc uri=http://blogs.rue89.nouvelobs.com/en-attendant-la-troisieme-guerre-mondiale/2014/03/22/bilan-de-la-semaine-pour-une-revolution-vaseline-232571 website=nouvelobs.com date=2014-03-22 source_country=> /bilan/NOM /de/PRP /le/DET:ART /semaine/NOM /:/PUN /pour/PRP /un/DET:ART /""/PUN:cit /révolution/NOM vaseline  """,vaseline,nom,vaseline,révolution,révolution,NOUN,"""","""",PUNCT,une,un,DET,pour,pour,ADP,:,:,PUNCT,"""","""",PUNCT,,,,,,,,,,,,,2014-03-22,2014,2010,,NOUN Vaseline PUNCT,PUNCT NOUN Vaseline,DET PUNCT NOUN Vaseline,ADP DET PUNCT NOUN Vaseline,,,,,"révolution Vaseline """,""" révolution Vaseline","un "" révolution Vaseline","pour un "" révolution Vaseline",,,
http://blogs.rue89.nouvelobs.com/en-attendant-la-troisieme-guerre-mondiale/2014/03/22/bilan-de-la-semaine-pour-une-revolution-vaseline-232571,nouvelobs.com,2014-03-22,===NONE===,vaseline/NOM/vaseline,"Je  crois  qu'  au  fond  de  moi  ,  j'  appelle  de  tous  mes  vœux  une  ""  révolution vaseline  ""  ,  délicate  ,  méthodique  et  sans  douleur  inutile  . </doc>",vaseline,nom,vaseline,révolution,révolution,NOUN,"""","""",PUNCT,une,un,DET,vœux,vœu,NOUN,mes,mon,DET,"""","""",PUNCT,",",",",PUNCT,délicate,délicat,ADJ,",",",",PUNCT,méthodique,méthodique,ADJ,2014-03-22,2014,2010,PUNCT NOUN Vaseline PUNCT PUNCT,NOUN Vaseline PUNCT,PUNCT NOUN Vaseline,DET PUNCT NOUN Vaseline,NOUN DET PUNCT NOUN Vaseline,Vaseline PUNCT PUNCT,Vaseline PUNCT PUNCT ADJ,Vaseline PUNCT PUNCT ADJ PUNCT,""" révolution Vaseline "" ,","révolution Vaseline """,""" révolution Vaseline","un "" révolution Vaseline","vœu un "" révolution Vaseline","Vaseline "" ,","Vaseline "" , délicat","Vaseline "" , délicat ,"
http://www.7sur7.be/7s7/fr/1523/Famille/article/detail/1864380/2014/04/25/Les-confessions-les-plus-intimes-des-parents-excedes.dhtml,7sur7.be,2014-04-25,Belgium,vaseline/NOM/vaseline,"""  Mon  fils  de  deux  ans  a  mangé  de  la vaseline  et  je  n'  ai  pas  appelé  la  ligne  anti-poison  .",vaseline,nom,vaseline,la,le,DET,de,de,ADP,mangé,manger,VERB,a,avoir,VERB,ans,an,NOUN,et,et,CONJ,je,je,PRON,n',ne,ADV,ai,avoir,VERB,pas,pas,ADV,2014-04-25,2014,2010,ADP DET Vaseline CONJ PRON,DET Vaseline CONJ,ADP DET Vaseline,VERB ADP DET Vaseline,VERB VERB ADP DET Vaseline,Vaseline CONJ PRON,Vaseline CONJ PRON ADV,Vaseline CONJ PRON ADV VERB,de le Vaseline et je,le Vaseline et,de le Vaseline,manger de le Vaseline,avoir manger de le Vaseline,Vaseline et je,Vaseline et je ne,Vaseline et je ne avoir
http://www.newswire.ca/en/story/1349865/dove-se-lance-a-la-recherche-de-50-femmes-au-pays-qui-prendront-part-a-la-nouvelle-campagne-publicitaire-sur-la-vraie-beaute,newswire.ca,2014-05-06,Canada,Vaseline/NAM/Vaseline,"Ives  ®  ,  TRESemmé  ®  et Vaseline  ®  .",vaseline,nam,vaseline,et,et,CONJ,®,®,NOUN,TRESemmé,TRESemmé,ADJ,",",",",PUNCT,®,®,ADJ,®,®,ADJ,.,.,PUNCT,,,,,,,,,,2014-05-06,2014,2010,NOUN CONJ Vaseline ADJ PUNCT,CONJ Vaseline ADJ,NOUN CONJ Vaseline,ADJ NOUN CONJ Vaseline,PUNCT ADJ NOUN CONJ Vaseline,Vaseline ADJ PUNCT,,,® et Vaseline ® .,et Vaseline ®,® et Vaseline,TRESemmé ® et Vaseline,", TRESemmé ® et Vaseline",Vaseline ® .,,
http://sport24.lefigaro.fr/rugby/top-14/actualites/ko-de-fritz-toulouse-en-accusation-693833,lefigaro.fr,2014-05-10,France,vaseline/NOM/vaseline,"Il  retrouve  sa  place  sur  le  terrain  sans  protection  particulière  de  sa  plaie  ,  juste  un  peu  de vaseline  .",vaseline,nom,vaseline,de,de,ADP,peu,peu,ADV,un,un,DET,juste,juste,ADJ,",",",",PUNCT,.,.,PUNCT,,,,,,,,,,,,,2014-05-10,2014,2010,,ADP Vaseline PUNCT,ADV ADP Vaseline,DET ADV ADP Vaseline,ADJ DET ADV ADP Vaseline,,,,,de Vaseline .,peu de Vaseline,un peu de Vaseline,juste un peu de Vaseline,,,
http://www.midilibre.fr/2014/05/12/vivi-mac-la-petite-artiste-lapeyradoise-qui-fait-le-buzz%2C859518.php#xtor%3DRSS-5,midilibre.fr,2014-05-12,France,vaseline/NOM/vaseline,"Plus  de  17  0  0  0  ""  like  ""  sur  sa  page  Face  book  et  des  milliers  de  partages  qui  l'  ont  elle-même  étonnée  ont  accompagné  son  Barack  Obama  en  sucre  de  canne  (  Yes  we  can  )  ;  Bruce  Lee  (  lait  )  et  Nelson  Mandela  en  lait  ;  le  capitaine  Jack  Sparrow  en  rhum  ;  Manuel  Valls  en vaseline  (  sur  fond  noir  )  ;  le  Père  Noël  en  aiguilles  de  sapin  ;  Mao  Tsé-Toung  en  thé  ou  encore  Oussama  Ben  Laden  en  moussaka  .",vaseline,nom,vaseline,en,en,ADP,Valls,Valls,PROPN,Manuel,Manuel,PROPN,;,;,PUNCT,rhum,rhum,NOUN,(,(,PUNCT,sur,sur,ADP,fond,fond,NOUN,noir,noir,ADJ,),),PUNCT,2014-05-12,2014,2010,PROPN ADP Vaseline PUNCT ADP,ADP Vaseline PUNCT,PROPN ADP Vaseline,PROPN PROPN ADP Vaseline,PUNCT PROPN PROPN ADP Vaseline,Vaseline PUNCT ADP,Vaseline PUNCT ADP NOUN,Vaseline PUNCT ADP NOUN ADJ,Valls en Vaseline ( sur,en Vaseline (,Valls en Vaseline,Manuel Valls en Vaseline,; Manuel Valls en Vaseline,Vaseline ( sur,Vaseline ( sur fond,Vaseline ( sur fond noir
https://www.bluewin.ch/fr/lifestyle/mode-beaute/2014/5/26/petites-astuces-pour-faciliter-votre-manucure.html,bluewin.ch,2014-05-26,Switzerland,vaseline/NOM/vaseline,"Pour  éviter  ce  genre  d'  incident  souvent  engendré  par  le  vernis  qui  sèche  autour  de  la  bouteille  ,  appliquez  un  peu  de vaseline  au  coton  tige  sur  le  pourtour  du  flacon  avant  de  le  refermer  . </doc>",vaseline,nom,vaseline,de,de,ADP,peu,peu,ADV,un,un,DET,appliquez,appliquer,VERB,",",",",PUNCT,au,au,ADP DET,coton,coton,ADJ,tige,tige,NOUN,sur,sur,ADP,le,le,DET,2014-05-26,2014,2010,ADV ADP Vaseline ADP DET ADJ,ADP Vaseline ADP DET,ADV ADP Vaseline,DET ADV ADP Vaseline,VERB DET ADV ADP Vaseline,Vaseline ADP DET ADJ,Vaseline ADP DET ADJ NOUN,Vaseline ADP DET ADJ NOUN ADP,peu de Vaseline au coton,de Vaseline au,peu de Vaseline,un peu de Vaseline,appliquer un peu de Vaseline,Vaseline au coton,Vaseline au coton tige,Vaseline au coton tige sur
http://www.7sur7.be/7s7/fr/1518/Sante/article/detail/1913268/2014/06/10/L-enfant-a-la-peau-en-ecailles-de-poisson.dhtml,7sur7.be,2014-06-10,Belgium,vaseline/NOM/vaseline,De  la vaseline  doit  être  appliquée  sur  sa  peau  pour  éviter  qu'  elle  ne  se  fissure  .,vaseline,nom,vaseline,la,le,DET,De,de,ADP,,,,,,,,,,doit,devoir,VERB,être,être,VERB,appliquée,appliquer,VERB,sur,sur,ADP,sa,son,DET,2014-06-10,2014,2010,ADP DET Vaseline VERB VERB,DET Vaseline VERB,ADP DET Vaseline,,,Vaseline VERB VERB,Vaseline VERB VERB VERB,Vaseline VERB VERB VERB ADP,de le Vaseline devoir être,le Vaseline devoir,de le Vaseline,,,Vaseline devoir être,Vaseline devoir être appliquer,Vaseline devoir être appliquer sur
http://journalmetro.com/dossiers/canadien-de-montreal/513802/le-big-three-sera-reuni-au-plafond-du-centre-bell/,journalmetro.com,2014-06-20,Canada,vaseline/NOM/vaseline,Quelques-uns  de  ses  coups  pendables  ont  été  évoqués  au  cours  de  la  conférence  de  presse  :  avoir  découpé  les  sous-vêtements  de  Larry  Robinson  et  avoir  enduit  son  pare-brise  de vaseline  un  soir  de  bruine  ;  avoir  subtilisé  le  dentier  d'  un  coéquipier  (  que  l'  on  n'  a  pas  voulu  nommer  )  et  lui  avoir  expédié  la  chose  par  courrier  ;  avoir  remplacé  la  crème  glacée  de  Ken  Dryden  par  de  la  crème  sûre  ...,vaseline,nom,vaseline,de,de,ADP,pare-brise,pare-brise,NOUN,son,son,DET,enduit,enduire,VERB,avoir,avoir,VERB,un,un,DET,soir,soir,NOUN,de,de,ADP,bruine,bruine,NOUN,;,;,PUNCT,2014-06-20,2014,2010,NOUN ADP Vaseline DET NOUN,ADP Vaseline DET,NOUN ADP Vaseline,DET NOUN ADP Vaseline,VERB DET NOUN ADP Vaseline,Vaseline DET NOUN,Vaseline DET NOUN ADP,Vaseline DET NOUN ADP NOUN,pare-brise de Vaseline un soir,de Vaseline un,pare-brise de Vaseline,son pare-brise de Vaseline,enduire son pare-brise de Vaseline,Vaseline un soir,Vaseline un soir de,Vaseline un soir de bruine
http://www.lapresse.ca/sports/hockey/201406/20/01-4777492-guy-lapointe-je-suis-sur-un-nuage.php,lapresse.ca,2014-06-21,Canada,Vaseline/NAM/Vaseline,"""  Si  je  n'  avais  pas  joué  toutes  ces  années  avec  lui  ,  peut-être  que  mes  sous-vêtements  n'  auraient  pas  été  découpés  et  je  n'  aurais  pas  eu  de Vaseline  sur  mon  pare-brise  ""  ,  a  illustré  Robinson  . </doc>",vaseline,nam,vaseline,de,de,ADP,eu,avoir,VERB,pas,pas,ADV,aurais,avoir,VERB,n',ne,ADV,sur,sur,ADP,mon,mon,DET,pare-brise,pare-brise,NOUN,"""","""",PUNCT,",",",",PUNCT,2014-06-21,2014,2010,VERB ADP Vaseline ADP DET,ADP Vaseline ADP,VERB ADP Vaseline,ADV VERB ADP Vaseline,VERB ADV VERB ADP Vaseline,Vaseline ADP DET,Vaseline ADP DET NOUN,Vaseline ADP DET NOUN PUNCT,avoir de Vaseline sur mon,de Vaseline sur,avoir de Vaseline,pas avoir de Vaseline,avoir pas avoir de Vaseline,Vaseline sur mon,Vaseline sur mon pare-brise,"Vaseline sur mon pare-brise """
http://www.newswire.ca/en/story/1385543/unilever-est-a-la-recherche-de-jeunes-entrepreneurs-ayant-des-idees-de-projets-durables-pour-changer-le-monde,newswire.ca,2014-07-11,Canada,Vaseline/NAM/Vaseline,"Ives  ®  ,  TRESemmé  ®  et Vaseline  ®  .",vaseline,nam,vaseline,et,et,CONJ,®,®,NOUN,TRESemmé,TRESemmé,ADJ,",",",",PUNCT,®,®,ADJ,®,®,ADJ,.,.,PUNCT,,,,,,,,,,2014-07-11,2014,2010,NOUN CONJ Vaseline ADJ PUNCT,CONJ Vaseline ADJ,NOUN CONJ Vaseline,ADJ NOUN CONJ Vaseline,PUNCT ADJ NOUN CONJ Vaseline,Vaseline ADJ PUNCT,,,® et Vaseline ® .,et Vaseline ®,® et Vaseline,TRESemmé ® et Vaseline,", TRESemmé ® et Vaseline",Vaseline ® .,,
http://www.rtl.be/pourelle/article/les-fourmis-des-astuces-pour-s-en-debarrasser-naturellement-312094.htm,rtl.be,2014-07-14,Belgium,vaseline/NOM/vaseline,le  charbon  de  bois  en  poudrela  craiele  turmericla  cannellel  '  essence  d'  agrumesle  poivre  noir  ou  de  cayennela vaseline  (  idéale  pour  les  portes  et  fenêtres  )  la  poudre  pour  bébéla  poudre  à  récure,vaseline,nom,vaseline,cayennela,cayennela,NOUN,de,de,ADP,ou,ou,CONJ,noir,noir,ADJ,poivre,poivre,NOUN,(,(,PUNCT,idéale,idéal,ADJ,pour,pour,ADP,les,le,DET,portes,porte,NOUN,2014-07-14,2014,2010,ADP NOUN Vaseline PUNCT ADJ,NOUN Vaseline PUNCT,ADP NOUN Vaseline,CONJ ADP NOUN Vaseline,ADJ CONJ ADP NOUN Vaseline,Vaseline PUNCT ADJ,Vaseline PUNCT ADJ ADP,Vaseline PUNCT ADJ ADP DET,de cayennela Vaseline ( idéal,cayennela Vaseline (,de cayennela Vaseline,ou de cayennela Vaseline,noir ou de cayennela Vaseline,Vaseline ( idéal,Vaseline ( idéal pour,Vaseline ( idéal pour le
http://leplus.nouvelobs.com/contribution/1223589-du-jour-au-lendemain-l-emission-d-alain-veinstein-sacrifiee-sur-l-autel-de-la-promo.html,nouvelobs.com,2014-07-14,France,vaselinent/VER:pres/vaseliner,"Les  invités  s'  enfoncent  dans  le  fauteuil  confortable  de  la  promotion  et  du  service  après-vente  de  leur  ""  produit  culturel  ""  ,  tandis  que  les  animateurs vaselinent  leur  propos  pour  que  personne  ne  soit  mécontent  et  pour  que  ,  accessoirement  ,  ça  tweete  :  #  EricEmmanuelSchmidtBrillant  ,  #  ClaireCastillonNouvelleDuras  ou  #  MichelOnfraySubversif  .",vaselinent,ver:pres,vaseliner,animateurs,animateur,NOUN,les,le,DET,que,que,CONJ,tandis,tandis,CONJ,",",",",PUNCT,leur,leur,DET,propos,propos,NOUN,pour,pour,CONJ,que,que,CONJ,personne,personne,ADV,2014-07-14,2014,2010,DET NOUN Vaseline DET NOUN,NOUN Vaseline DET,DET NOUN Vaseline,CONJ DET NOUN Vaseline,CONJ CONJ DET NOUN Vaseline,Vaseline DET NOUN,Vaseline DET NOUN CONJ,Vaseline DET NOUN CONJ CONJ,le animateur Vaseline leur propos,animateur Vaseline leur,le animateur Vaseline,que le animateur Vaseline,tandis que le animateur Vaseline,Vaseline leur propos,Vaseline leur propos pour,Vaseline leur propos pour que
http://ecrans.liberation.fr/ecrans/2014/07/29/carole-gaessler-bleu-tele_1072406?xtor=rss-450,liberation.fr,2014-08-01,France,vaselines/NOM/vaseline,Elle  regarde  Champs-Elysées  et  autres vaselines  vassalisées  à  la  Drucker  .,vaselines,nom,vaseline,autres,autre,ADJ,et,et,CONJ,Champs-Elysées,Champs-Elysées,PROPN,regarde,regarder,VERB,Elle,elle,PRON,vassalisées,vassaliser,VERB,à,à,ADP,la,le,DET,Drucker,Drucker,PROPN,.,.,PUNCT,2014-08-01,2014,2010,CONJ ADJ Vaseline VERB ADP,ADJ Vaseline VERB,CONJ ADJ Vaseline,PROPN CONJ ADJ Vaseline,VERB PROPN CONJ ADJ Vaseline,Vaseline VERB ADP,Vaseline VERB ADP DET,Vaseline VERB ADP DET PROPN,et autre Vaseline vassaliser à,autre Vaseline vassaliser,et autre Vaseline,Champs-Elysées et autre Vaseline,regarder Champs-Elysées et autre Vaseline,Vaseline vassaliser à,Vaseline vassaliser à le,Vaseline vassaliser à le Drucker
http://ici.radio-canada.ca/emissions/a_rebours/2014-2015/chronique.asp?idChronique=346837,radio-canada.ca,2014-08-21,Canada,vaseline/NOM/vaseline,"Le  20  août  1955  ,  en  toute  fin  d'après  -midi  ,  entièrement  enduit  de vaseline  et  lunettes  de  natation  bien  en  place  sur  les  yeux  ,  Bill  Connor  plonge  dans  l'  aventure  .",vaseline,nom,vaseline,de,de,ADP,enduit,enduire,VERB,entièrement,entièrement,ADV,",",",",PUNCT,-midi,-midi,ADJ,et,et,CONJ,lunettes,lunette|lunettes,NOUN,de,de,ADP,natation,natation,NOUN,bien,bien,ADV,2014-08-21,2014,2010,VERB ADP Vaseline CONJ NOUN,ADP Vaseline CONJ,VERB ADP Vaseline,ADV VERB ADP Vaseline,PUNCT ADV VERB ADP Vaseline,Vaseline CONJ NOUN,Vaseline CONJ NOUN ADP,Vaseline CONJ NOUN ADP NOUN,enduire de Vaseline et lunette|lunettes,de Vaseline et,enduire de Vaseline,entièrement enduire de Vaseline,", entièrement enduire de Vaseline",Vaseline et lunette|lunettes,Vaseline et lunette|lunettes de,Vaseline et lunette|lunettes de natation
http://www.lapresse.ca/le-soleil/actualites/justice-et-faits-divers/201408/28/01-4795453-un-recidiviste-coupable-de-contact-sexuel-avec-une-fillette-de-huit-ans.php,lapresse.ca,2014-08-29,Canada,vaseline/NOM/vaseline,"Fait  troublant  ,  lorsqu'  ils  ont  arrêté  St-Amand  ,  les  policiers  ont  à  nouveau  trouvé  dans  les  effets  personnels  du  délinquant  un  sac  à  dos  contenant  des  condoms  ,  de  la vaseline  ,  de  l'  huile  à  bébé  ,  des  cassettes  avec  des  bruits  de  gémissement  de  femmes  et  plusieurs  objets  sexuels  .",vaseline,nom,vaseline,la,le,DET,de,de,ADP,",",",",PUNCT,condoms,condom,NOUN,des,du,ADP DET,",",",",PUNCT,de,de,ADP,l',le,DET,huile,huile,NOUN,à,à,ADP,2014-08-29,2014,2010,ADP DET Vaseline PUNCT ADP,DET Vaseline PUNCT,ADP DET Vaseline,PUNCT ADP DET Vaseline,NOUN PUNCT ADP DET Vaseline,Vaseline PUNCT ADP,Vaseline PUNCT ADP DET,Vaseline PUNCT ADP DET NOUN,"de le Vaseline , de","le Vaseline ,",de le Vaseline,", de le Vaseline","condom , de le Vaseline","Vaseline , de","Vaseline , de le","Vaseline , de le huile"
http://www.dreuz.info/2014/09/john-kerry-sexprime-sur-lislam/,dreuz.info,2014-09-04,===NONE===,vaseline/NOM/vaseline,"Donc  hier  mercredi  ,  Kerry  s'  exprimait  devant  un  parterre  presque  exclusivement  islamique  réunit  au  Département  d'  état  américain  pour  présenter  Shaarik  Zafar  ,  le  ""  nouveau  représentant  spécial  de  la  communauté  musulmane  ""  -  les  Etats  Unis  n'  auront  jamais  fait  autant  pour  leur  faciliter  l'  invasion  de  l'  Amérique  -  manque  plus  que  la vaseline  .",vaseline,nom,vaseline,la,le,DET,que,que,CONJ,plus,plus,ADV,manque,manquer,VERB,-,-,PUNCT,.,.,PUNCT,,,,,,,,,,,,,2014-09-04,2014,2010,,DET Vaseline PUNCT,CONJ DET Vaseline,ADV CONJ DET Vaseline,VERB ADV CONJ DET Vaseline,,,,,le Vaseline .,que le Vaseline,plus que le Vaseline,manquer plus que le Vaseline,,,
http://www.breizh-info.com/16318/actualite-internationale/ecosse-nombreux-peoples-soutiennent-lindependance/,breizh-info.com,2014-09-18,===NONE===,Vaselines/NAM/Vaselines,"Le  Monde  (  14  septembre  )  cite  d'  autres  chanteurs  acquis  à  l'  indépendance  :  Belle  and  Sebastian  ,  The Vaselines  ,  Stanley  Old  ,  Mogwai  ,  Frightfrened  Rabbit  :  c'  est  avec  ces  prestigieuses  têtes  d'  affiche  que  le  camp  du  oui  à  l'  indépendance  de  l'  Ecosse  a  joué  sa  dernière  carte  dimanche  14  septembre  :  celle  du  rock  .",vaselines,nam,vaselines,The,The,PROPN,",",",",PUNCT,Sebastian,Sebastian,PROPN,and,and,VERB,Belle,beau,ADJ,",",",",PUNCT,Stanley,Stanley,PROPN,Old,Old,PROPN,",",",",PUNCT,Mogwai,Mogwai,PROPN,2014-09-18,2014,2010,PUNCT PROPN Vaseline PUNCT PROPN,PROPN Vaseline PUNCT,PUNCT PROPN Vaseline,PROPN PUNCT PROPN Vaseline,VERB PROPN PUNCT PROPN Vaseline,Vaseline PUNCT PROPN,Vaseline PUNCT PROPN PROPN,Vaseline PUNCT PROPN PROPN PUNCT,", The Vaseline , Stanley","The Vaseline ,",", The Vaseline","Sebastian , The Vaseline","and Sebastian , The Vaseline","Vaseline , Stanley","Vaseline , Stanley Old","Vaseline , Stanley Old ,"
