url,website,date,country,keyword,sentence,kw,kw_lemma,kw_pos,left_w1,left_l1,left_p1,left_w2,left_l2,left_p2,left_w3,left_l3,left_p3,left_w4,left_l4,left_p4,left_w5,left_l5,left_p5,right_w1,right_l1,right_p1,right_w2,right_l2,right_p2,right_w3,right_l3,right_p3,right_w4,right_l4,right_p4,right_w5,right_l5,right_p5,datetime,year,10years,pattern_around5,pattern_around3,pattern_left2,pattern_left3,pattern_left4,pattern_right2,pattern_right3,pattern_right4,pattern_around5_lex,pattern_around3_lex,pattern_left2_lex,pattern_left3_lex,pattern_left4_lex,pattern_right2_lex,pattern_right3_lex,pattern_right4_lex
http://www.letribunaldunet.fr/actualites/employe-monnaie-royale-canadienne-palets-d-or-rectum.html,letribunaldunet.fr,2018-08-26,France,vaseline/NOM/vaseline,"Dans  son  casier  à  la  Monnaie  royale  ,  la  police  a  trouvé  des  gants  en  latex  et  un  pot  de vaseline  ,  donnant  une  indication  sur  la  méthode  utilisée  pour  faire  sortir  l'  or  de  la  fabrique  .",vaseline,nom,vaseline,de,de,ADP,pot,pot,NOUN,un,un,DET,et,et,CONJ,latex,latex,NOUN,",",",",PUNCT,donnant,donner,VERB,une,un,DET,indication,indication,NOUN,sur,sur,ADP,2018-08-26,2018,2010,NOUN ADP Vaseline PUNCT VERB,ADP Vaseline PUNCT,NOUN ADP Vaseline,DET NOUN ADP Vaseline,CONJ DET NOUN ADP Vaseline,Vaseline PUNCT VERB,Vaseline PUNCT VERB DET,Vaseline PUNCT VERB DET NOUN,"pot de Vaseline , donner","de Vaseline ,",pot de Vaseline,un pot de Vaseline,et un pot de Vaseline,"Vaseline , donner","Vaseline , donner un","Vaseline , donner un indication"
http://www.adiac-congo.com/content/rentree-scolaire-2018-2019-des-kits-scolaires-pour-les-albinos-et-enfants-vulnerables-88130,adiac-congo.com,2018-08-27,===NONE===,vaselines/NOM/vaseline,"Dans  ces  kits  ,  l'  ONG  va  également  ajouté  des  crèmes  solaires  ,  des vaselines  pures  et  autres  produits  disponibles  ,  en  vue  de  permettre  aux  albinos  de  se  protéger  contre  les  rayons  du  soleil  ,  surtout  en  ce  moment  de  rechaufemment  climatique  où  ces  rayons  sont  devenus  plus  virulents  .",vaselines,nom,vaseline,des,du,ADP DET,",",",",PUNCT,solaires,solaire,ADJ,crèmes,crème,NOUN,des,du,ADP DET,pures,pur,ADJ,et,et,CONJ,autres,autre,ADJ,produits,produit,NOUN,disponibles,disponible,ADJ,2018-08-27,2018,2010,PUNCT ADP DET Vaseline ADJ CONJ,ADP DET Vaseline ADJ,PUNCT ADP DET Vaseline,ADJ PUNCT ADP DET Vaseline,NOUN ADJ PUNCT ADP DET Vaseline,Vaseline ADJ CONJ,Vaseline ADJ CONJ ADJ,Vaseline ADJ CONJ ADJ NOUN,", du Vaseline pur et",du Vaseline pur,", du Vaseline","solaire , du Vaseline","crème solaire , du Vaseline",Vaseline pur et,Vaseline pur et autre,Vaseline pur et autre produit
http://www.elle.fr/Mode/Les-conseils-mode/Ces-7-astuces-qui-vont-sauver-la-vie-de-vos-chaussures-preferees-3715029#xtor%3DRSS-20,elle.fr,2018-08-29,France,vaseline/NOM/vaseline,"Ampoules  ,  irritations  ,  coupures  :  on  souffre  !  Pour  parer  à  ce  problème  ,  utilisez  du  lubrifiant  ou  de  la vaseline  que  vous  appliquerez  sur  les  talons  ,  les  malléoles  et  tous  les  endroits  concernés  .",vaseline,nom,vaseline,la,le,DET,de,de,ADP,ou,ou,CONJ,lubrifiant,lubrifiant,NOUN,du,du,ADP DET,que,que,PRON,vous,vous,PRON,appliquerez,appliquer,VERB,sur,sur,ADP,les,le,DET,2018-08-29,2018,2010,ADP DET Vaseline PRON PRON,DET Vaseline PRON,ADP DET Vaseline,CONJ ADP DET Vaseline,NOUN CONJ ADP DET Vaseline,Vaseline PRON PRON,Vaseline PRON PRON VERB,Vaseline PRON PRON VERB ADP,de le Vaseline que vous,le Vaseline que,de le Vaseline,ou de le Vaseline,lubrifiant ou de le Vaseline,Vaseline que vous,Vaseline que vous appliquer,Vaseline que vous appliquer sur
http://www.lessentiel.lu/fr/lifestyle/story/29554068,lessentiel.lu,2018-08-30,Luxembourg,vaseline/NOM/vaseline,Certaines  y  ajoutent  de  la vaseline  ou  des  grains  de  fenugrec  .,vaseline,nom,vaseline,la,le,DET,de,de,ADP,ajoutent,ajouter,VERB,y,y,PRON,Certaines,certain,PRON,ou,ou,CONJ,des,du,ADP DET,grains,grain,NOUN,de,de,ADP,fenugrec,fenugrec,NOUN,2018-08-30,2018,2010,ADP DET Vaseline CONJ ADP DET,DET Vaseline CONJ,ADP DET Vaseline,VERB ADP DET Vaseline,PRON VERB ADP DET Vaseline,Vaseline CONJ ADP DET,Vaseline CONJ ADP DET NOUN,Vaseline CONJ ADP DET NOUN ADP,de le Vaseline ou du,le Vaseline ou,de le Vaseline,ajouter de le Vaseline,y ajouter de le Vaseline,Vaseline ou du,Vaseline ou du grain,Vaseline ou du grain de
https://www.magicmaman.com/enquete-sur-les-couches-pour-bebe-les-reponses-aux-questions-des-parents%2C3602902.asp,magicmaman.com,2018-08-30,===NONE===,vaseline/NOM/vaseline,"C'  est  le  cas  du  petrolatum  ,  plus  connu  du  grand  public  sous  le  nom  de vaseline  ,  et  du  praffiunum  liquidum  ,  c'est-à-dire  l'  huile  de  paraffine  ""  ,  explique  60  millions  de  consommateurs  .",vaseline,nom,vaseline,de,de,ADP,nom,nom,NOUN,le,le,DET,sous,sous,ADP,public,public,NOUN,",",",",PUNCT,et,et,CONJ,du,du,ADP DET,praffiunum,praffiunum,NOUN,liquidum,liquidum,NOUN,2018-08-30,2018,2010,NOUN ADP Vaseline PUNCT CONJ,ADP Vaseline PUNCT,NOUN ADP Vaseline,DET NOUN ADP Vaseline,ADP DET NOUN ADP Vaseline,Vaseline PUNCT CONJ,Vaseline PUNCT CONJ ADP DET,Vaseline PUNCT CONJ ADP DET NOUN,"nom de Vaseline , et","de Vaseline ,",nom de Vaseline,le nom de Vaseline,sous le nom de Vaseline,"Vaseline , et","Vaseline , et du","Vaseline , et du praffiunum"
https://actu.fr/insolite/insolite-top-10-repliques-cultes-touristes-normandie_18363419.html,actu.fr,2018-08-30,France,vaseline/NOM/vaseline,"À  Domfront-en-Poiraie  ,  dans  l'  Orne  ,  une  demande  quelque  peu  incongrue  a  atterri  sur  le  bureau  de  l'  office  de  tourisme  :  ""  Bonjour  ,  vous  avez  de  la vaseline  ?  Il  en  faut  ici  pour  faire  passer  les  camping-cars  ""  .",vaseline,nom,vaseline,la,le,DET,de,de,ADP,avez,avoir,VERB,vous,vous,PRON,",",",",PUNCT,?,?,PUNCT,Il,il,PRON,en,en,PRON,faut,falloir,VERB,ici,ici,ADV,2018-08-30,2018,2010,ADP DET Vaseline PUNCT PRON,DET Vaseline PUNCT,ADP DET Vaseline,VERB ADP DET Vaseline,PRON VERB ADP DET Vaseline,Vaseline PUNCT PRON,Vaseline PUNCT PRON PRON,Vaseline PUNCT PRON PRON VERB,de le Vaseline ? il,le Vaseline ?,de le Vaseline,avoir de le Vaseline,vous avoir de le Vaseline,Vaseline ? il,Vaseline ? il en,Vaseline ? il en falloir
https://www.agoravox.fr/actualites/economie/article/macron-philippe-comment-profiter-207170?utm_source=feedburner&utm_medium=feed&utm_campaign=Feed%253A%2Bagoravox%252FgEOF%2B%2528AgoraVox%2B-%2Ble%2Bjournal%2Bcitoyen%2529&utm_content=FeedBurner,agoravox.fr,2018-08-30,France,vaseline/NOM/vaseline,"Et  en  plus  ,  le  prix  de  la vaseline  augmente  ...",vaseline,nom,vaseline,la,le,DET,de,de,ADP,prix,prix,NOUN,le,le,DET,",",",",PUNCT,augmente,augmenter,VERB,...,...,PUNCT,,,,,,,,,,2018-08-30,2018,2010,ADP DET Vaseline VERB PUNCT,DET Vaseline VERB,ADP DET Vaseline,NOUN ADP DET Vaseline,DET NOUN ADP DET Vaseline,Vaseline VERB PUNCT,,,de le Vaseline augmenter ...,le Vaseline augmenter,de le Vaseline,prix de le Vaseline,le prix de le Vaseline,Vaseline augmenter ...,,
https://actu.fr/hauts-de-france/abbeville_80001/dabbeville-dubai-lart-lutter-contre-pollution-plastique-selon-steve-stievenart_18419392.html,actu.fr,2018-09-03,France,vaseline/NOM/vaseline,"Quand  je  nage  par  exemple  dans  la  Manche  ,  je  ne  porte  pas  de  combinaison  ,  j'  utilise  des  réserves  de  graisse  comme  les  phoques  et  je  m'  isole  du  froid  avec  de  la vaseline  .",vaseline,nom,vaseline,la,le,DET,de,de,ADP,avec,avec,ADP,froid,froid,ADJ,du,du,ADP DET,.,.,PUNCT,,,,,,,,,,,,,2018-09-03,2018,2010,,DET Vaseline PUNCT,ADP DET Vaseline,ADP ADP DET Vaseline,ADJ ADP ADP DET Vaseline,,,,,le Vaseline .,de le Vaseline,avec de le Vaseline,froid avec de le Vaseline,,,
http://www.adiac-congo.com/content/rentree-scolaire-2018-2019-des-kits-scolaires-au-benefice-des-enfants-vivant-avec-handicap,adiac-congo.com,2018-09-03,===NONE===,vaseline/NOM/vaseline,"Pour  les  enfants  albinos  ,  il  y  a  eu  en  plus  des  boites  de vaseline  et  de  lunettes  solaires  en  vue  de  leur  permettre  de  protéger  leur  peau  et  leurs  yeux  des  rayons  de  soleil  .",vaseline,nom,vaseline,de,de,ADP,boites,boite,NOUN,des,du,ADP DET,plus,plus,ADV,en,en,ADP,et,et,CONJ,de,de,ADP,lunettes,lunette|lunettes,NOUN,solaires,solaire,ADJ,en,en,ADP,2018-09-03,2018,2010,NOUN ADP Vaseline CONJ ADP,ADP Vaseline CONJ,NOUN ADP Vaseline,ADP DET NOUN ADP Vaseline,ADV ADP DET NOUN ADP Vaseline,Vaseline CONJ ADP,Vaseline CONJ ADP NOUN,Vaseline CONJ ADP NOUN ADJ,boite de Vaseline et de,de Vaseline et,boite de Vaseline,du boite de Vaseline,plus du boite de Vaseline,Vaseline et de,Vaseline et de lunette|lunettes,Vaseline et de lunette|lunettes solaire
http://sosoir.lesoir.be/londres-accueille-un-bar-cocktail-entierement-dedie-david-bowie,lesoir.be,2018-09-05,Belgium,Vaseline/NAM/Vaseline,"Ainsi  ,  vous  pourrez  vous  délecter  d'  un  ""  Tigers  on Vaseline  ""  ,  un  cocktail  qui  réinterprétera  la  fameuse  Pina  Colada  et  qui  tire  son  nom  des  paroles  de  la  chanson  ""  Hang  On  To  Yourself  ""  ,  ou  encore  un  ""  Darkness  and  Disgrace  ""  ,  en  référence  au  morceau  ""  Lady  Stardust  ""  .",vaseline,nam,vaseline,on,on,PRON,Tigers,Tigers,PROPN,"""","""",PUNCT,un,un,DET,d',de,ADP,"""","""",PUNCT,",",",",PUNCT,un,un,DET,cocktail,cocktail,NOUN,qui,qui,PRON,2018-09-05,2018,2010,PROPN PRON Vaseline PUNCT PUNCT,PRON Vaseline PUNCT,PROPN PRON Vaseline,PUNCT PROPN PRON Vaseline,DET PUNCT PROPN PRON Vaseline,Vaseline PUNCT PUNCT,Vaseline PUNCT PUNCT DET,Vaseline PUNCT PUNCT DET NOUN,"Tigers on Vaseline "" ,","on Vaseline """,Tigers on Vaseline,""" Tigers on Vaseline","un "" Tigers on Vaseline","Vaseline "" ,","Vaseline "" , un","Vaseline "" , un cocktail"
http://www.letribunaldunet.fr/actualites/si-vous-etes-fans-de-david-bowie-vous-devez-absolument-vous-rendre-dans-cet-endroit.html,letribunaldunet.fr,2018-09-05,France,vaseline/VER:pres/vaseliner,"Quelques  noms  de  cocktails  ont  déjà  fuité  :  Tigers  on vaseline  ,  Darkness  and  disgrace  ou  encore  Lady  Stardust  .",vaseline,ver:pres,vaseliner,on,on,PRON,Tigers,Tigers,PROPN,:,:,PUNCT,fuité,fuiter,VERB,déjà,déjà,ADV,",",",",PUNCT,Darkness,Darkness,PROPN,and,and,VERB,disgrace,disgrace,ADJ,ou,ou,CONJ,2018-09-05,2018,2010,PROPN PRON Vaseline PUNCT PROPN,PRON Vaseline PUNCT,PROPN PRON Vaseline,PUNCT PROPN PRON Vaseline,VERB PUNCT PROPN PRON Vaseline,Vaseline PUNCT PROPN,Vaseline PUNCT PROPN VERB,Vaseline PUNCT PROPN VERB ADJ,"Tigers on Vaseline , Darkness","on Vaseline ,",Tigers on Vaseline,: Tigers on Vaseline,fuiter : Tigers on Vaseline,"Vaseline , Darkness","Vaseline , Darkness and","Vaseline , Darkness and disgrace"
http://lavdn.lavoixdunord.fr/443724/article/2018-09-06/condamne-42-mois-de-prison-pour-des-agressions-sexuelles-sur-ses-jeunes-voisins,lavoixdunord.fr,2018-09-06,France,vaseline/NOM/vaseline,"Fondant  plusieurs  fois  en  sanglots  à  l'  évocation  de  ces  faits  ,  le  prévenu  confirme  leur  avoir  mis  de  la  crème  (  a  priori  de  la vaseline  )  car  ""  un  jeune  a  dit  qu'  il  avait  un  problème  au  pénis  [  ...  ]  Il  se  grattait  ""  .",vaseline,nom,vaseline,la,le,DET,de,de,ADP,priori,priori,ADV,a,avoir,VERB,(,(,PUNCT,),),PUNCT,car,car,CONJ,"""","""",PUNCT,un,un,DET,jeune,jeune,ADJ,2018-09-06,2018,2010,ADP DET Vaseline PUNCT CONJ,DET Vaseline PUNCT,ADP DET Vaseline,ADV ADP DET Vaseline,VERB ADV ADP DET Vaseline,Vaseline PUNCT CONJ,Vaseline PUNCT CONJ PUNCT,Vaseline PUNCT CONJ PUNCT DET,de le Vaseline ) car,le Vaseline ),de le Vaseline,priori de le Vaseline,avoir priori de le Vaseline,Vaseline ) car,"Vaseline ) car ""","Vaseline ) car "" un"
https://www.franceculture.fr/musique/le-rap-fabrique-a-clashs,franceculture.fr,2018-09-06,France,Vaseline/NAM/Vaseline,"Les  exemples  de  ""  diss  song  ""  sont  nombreux  :  ""  No Vaseline  ""  écrite  par  Ice  Cube  lorsqu'  il  quitte  le  groupe  NWA  en  1989  pour  des  problèmes  de  répartition  des  gains  ,  ""  Takeover  ""  de  Jay-Z  en  2001  où  ce  dernier  attaque  Nas  en  prétendant  qu'  il  a  couché  avec  sa  femme  ,  ""  The  Warning  ""  enregistrée  par  Eminem  en  2009  où  le  rappeur  de  Detroit  affirme  avoir  eu  une  relation  avec  la  chanteuse  Mariah  Carey  ,  alors  que  l'  intéressée  dément  .",vaseline,nam,vaseline,No,No,NOUN,"""","""",PUNCT,:,:,PUNCT,nombreux,nombreux,ADJ,sont,être,VERB,"""","""",PUNCT,écrite,écrire,VERB,par,par,ADP,Ice,Ice,PROPN,Cube,Cube,PROPN,2018-09-06,2018,2010,PUNCT NOUN Vaseline PUNCT VERB,NOUN Vaseline PUNCT,PUNCT NOUN Vaseline,PUNCT PUNCT NOUN Vaseline,ADJ PUNCT PUNCT NOUN Vaseline,Vaseline PUNCT VERB,Vaseline PUNCT VERB ADP,Vaseline PUNCT VERB ADP PROPN,""" No Vaseline "" écrire","No Vaseline """,""" No Vaseline",": "" No Vaseline","nombreux : "" No Vaseline","Vaseline "" écrire","Vaseline "" écrire par","Vaseline "" écrire par Ice"
https://article.wn.com/view/2018/09/07/Le_RC_Montauban_au_menu_de_la_rentree_du_SSGL/,wn.com,2018-09-07,United States,vaseline/NOM/vaseline,"Dans  leur  cartable  ,  les  joueurs  ont  mis  l'  huile  camphrée  ,  la vaseline  ,  l'  elastoplaste  ,  les  crampons  et  le  reste  de  la  panoplie  du  parfait  rugbyman  .",vaseline,nom,vaseline,la,le,DET,",",",",PUNCT,camphrée,camphré,ADJ,huile,huile,NOUN,l',le,DET,",",",",PUNCT,l',le,DET,elastoplaste,elastoplaste,NOUN,",",",",PUNCT,les,le,DET,2018-09-07,2018,2010,PUNCT DET Vaseline PUNCT DET,DET Vaseline PUNCT,PUNCT DET Vaseline,ADJ PUNCT DET Vaseline,NOUN ADJ PUNCT DET Vaseline,Vaseline PUNCT DET,Vaseline PUNCT DET NOUN,Vaseline PUNCT DET NOUN PUNCT,", le Vaseline , le","le Vaseline ,",", le Vaseline","camphré , le Vaseline","huile camphré , le Vaseline","Vaseline , le","Vaseline , le elastoplaste","Vaseline , le elastoplaste ,"
http://www.francesoir.fr/societe-faits-divers/il-embrassait-le-sexe-de-jeunes-garcons-et-leur-montrait-des-videos-pedophiles,francesoir.fr,2018-09-07,France,vaseline/NOM/vaseline,"Deux  jeunes  disent  que  c'  est  à  ce  moment  là  qu'  il  leur  a  baissé  le  pantalon  et  leur  a  passé  de  la  pommade  sur  le  sexe  et  les  fesses  ,  probablement  de  la vaseline  .",vaseline,nom,vaseline,la,le,DET,de,de,ADP,probablement,probablement,ADV,",",",",PUNCT,fesses,fesse,NOUN,.,.,PUNCT,,,,,,,,,,,,,2018-09-07,2018,2010,,DET Vaseline PUNCT,ADP DET Vaseline,ADV ADP DET Vaseline,PUNCT ADV ADP DET Vaseline,,,,,le Vaseline .,de le Vaseline,probablement de le Vaseline,", probablement de le Vaseline",,,
https://www.20minutes.fr/arts-stars/culture/2333955-20180910-pourquoi-kanye-west-pourrait-etre-bon-president-etats-unis#xtor%3DRSS-149,20minutes.fr,2018-09-10,France,Vaseline/NAM/Vaseline,"Le  président  Calvin  Coolidge  aimait  par  exemple  se  faire  rotter  la  tête  avec  de  la Vaseline  pendant  le  petit-déjeunerr  ,  persuadé  que  c'  était  bon  pour  sa  santé  .",vaseline,nam,vaseline,la,le,DET,de,de,ADP,avec,avec,ADP,tête,tête,NOUN,la,le,DET,pendant,pendant,ADP,le,le,DET,petit-déjeunerr,petit-déjeunerr,NOUN,",",",",PUNCT,persuadé,persuader,VERB,2018-09-10,2018,2010,ADP DET Vaseline ADP DET,DET Vaseline ADP,ADP DET Vaseline,ADP ADP DET Vaseline,NOUN ADP ADP DET Vaseline,Vaseline ADP DET,Vaseline ADP DET NOUN,Vaseline ADP DET NOUN PUNCT,de le Vaseline pendant le,le Vaseline pendant,de le Vaseline,avec de le Vaseline,tête avec de le Vaseline,Vaseline pendant le,Vaseline pendant le petit-déjeunerr,"Vaseline pendant le petit-déjeunerr ,"
https://www.contrepoints.org/2018/09/17/325353-plan-pauvrete-parce-quil-faut-encore-plus-de-pauvres,contrepoints.org,2018-09-17,===NONE===,vaseline/NOM/vaseline,"Or  ,  en  la  matière  ,  force  est  de  constater  que  la  fiscalité  ""  sans  tabou  ""  ,  c'  est  un  peu  comme  la  sodomie  sans vaseline  ,  sans  prévenir  et  sans  consentement  :  ça  laisse  de  mauvais  souvenirs  .",vaseline,nom,vaseline,sans,sans,ADP,sodomie,sodomie,NOUN,la,le,DET,comme,comme,ADV,peu,peu,ADV,",",",",PUNCT,sans,sans,ADP,prévenir,prévenir,VERB,et,et,CONJ,sans,sans,ADP,2018-09-17,2018,2010,NOUN ADP Vaseline PUNCT ADP,ADP Vaseline PUNCT,NOUN ADP Vaseline,DET NOUN ADP Vaseline,ADV DET NOUN ADP Vaseline,Vaseline PUNCT ADP,Vaseline PUNCT ADP VERB,Vaseline PUNCT ADP VERB CONJ,"sodomie sans Vaseline , sans","sans Vaseline ,",sodomie sans Vaseline,le sodomie sans Vaseline,comme le sodomie sans Vaseline,"Vaseline , sans","Vaseline , sans prévenir","Vaseline , sans prévenir et"
https://www.afrikmag.com/decouvrez-nouvelle-technique-femme-faire-grossir-leurs-seins/,afrikmag.com,2018-09-17,===NONE===,vaseline/NOM/vaseline,"D'  autres  YouTubers  ,  tels  que  ZonelynTV  ,  ont  révélé  comment  ils  frottaient  du  dentifrice  sur  leurs  mamelons  et  de  la vaseline  sur  leur  poitrine  ,  afin  de  développer  leur  taille  de  bonnet  .",vaseline,nom,vaseline,la,le,DET,de,de,ADP,et,et,CONJ,mamelons,mamelon,NOUN,leurs,leur,DET,sur,sur,ADP,leur,leur,DET,poitrine,poitrine,NOUN,",",",",PUNCT,afin,afin,CONJ,2018-09-17,2018,2010,ADP DET Vaseline ADP DET,DET Vaseline ADP,ADP DET Vaseline,CONJ ADP DET Vaseline,NOUN CONJ ADP DET Vaseline,Vaseline ADP DET,Vaseline ADP DET NOUN,Vaseline ADP DET NOUN PUNCT,de le Vaseline sur leur,le Vaseline sur,de le Vaseline,et de le Vaseline,mamelon et de le Vaseline,Vaseline sur leur,Vaseline sur leur poitrine,"Vaseline sur leur poitrine ,"
https://www.afrikmag.com/decouvrez-nouvelle-technique-femme-faire-grossir-leurs-seins/,afrikmag.com,2018-09-17,===NONE===,vaseline/NOM/vaseline,"""  Malheureusement  ,  comme  beaucoup  d'  informations  sur  Internet  ,  la  méthode  d'  augmentation  mammaire  basée  sur  la vaseline  et  le  dentifrice  est  une  fausse  nouvelle  et  du  charlatanisme  en  ligne  .",vaseline,nom,vaseline,la,le,DET,sur,sur,ADP,basée,baser,VERB,mammaire,mammaire,ADJ,augmentation,augmentation,NOUN,et,et,CONJ,le,le,DET,dentifrice,dentifrice,NOUN,est,être,VERB,une,un,DET,2018-09-17,2018,2010,ADP DET Vaseline CONJ DET,DET Vaseline CONJ,ADP DET Vaseline,VERB ADP DET Vaseline,ADJ VERB ADP DET Vaseline,Vaseline CONJ DET,Vaseline CONJ DET NOUN,Vaseline CONJ DET NOUN VERB,sur le Vaseline et le,le Vaseline et,sur le Vaseline,baser sur le Vaseline,mammaire baser sur le Vaseline,Vaseline et le,Vaseline et le dentifrice,Vaseline et le dentifrice être
http://www.elle.fr/Beaute/Beaute-des-stars/Astuces/Les-secrets-beaute-des-tops-pour-survivre-a-la-Fashion-Week-3722695#xtor%3DRSS-20,elle.fr,2018-09-21,France,vaseline/NOM/vaseline,"Un  petit  pot  de vaseline  pour  maintenir  l'  hydratation  des  lèvres  ,  de  l'  huile  de  coco  miracle  pour  soulager  la  peau  qui  tiraille  ,  ou  encore  un  démaquillant  performant  pour  retirer  les  résidus  de  maquillage  récalcitrants  ...",vaseline,nom,vaseline,de,de,ADP,pot,pot,NOUN,petit,petit,ADJ,Un,un,DET,,,,pour,pour,ADP,maintenir,maintenir,VERB,l',le,DET,hydratation,hydratation,NOUN,des,du,ADP DET,2018-09-21,2018,2010,NOUN ADP Vaseline ADP VERB,ADP Vaseline ADP,NOUN ADP Vaseline,ADJ NOUN ADP Vaseline,DET ADJ NOUN ADP Vaseline,Vaseline ADP VERB,Vaseline ADP VERB DET,Vaseline ADP VERB DET NOUN,pot de Vaseline pour maintenir,de Vaseline pour,pot de Vaseline,petit pot de Vaseline,un petit pot de Vaseline,Vaseline pour maintenir,Vaseline pour maintenir le,Vaseline pour maintenir le hydratation
http://www.elle.fr/Beaute/Beaute-des-stars/Astuces/Les-secrets-beaute-des-tops-pour-survivre-a-la-Fashion-Week-3722695#xtor%3DRSS-20,elle.fr,2018-09-21,France,vaseline/NOM/vaseline,La  reine  du  maquillage  nude  garde  toujours  dans  son  sac  à  main  un  pot  de vaseline  pour  hydrater  ses  lèvres  et  un  highlighter  pour  afficher  un  glow  naturel  .,vaseline,nom,vaseline,de,de,ADP,pot,pot,NOUN,un,un,DET,main,main,NOUN,à,à,ADP,pour,pour,ADP,hydrater,hydrater,VERB,ses,son,DET,lèvres,lèvre,NOUN,et,et,CONJ,2018-09-21,2018,2010,NOUN ADP Vaseline ADP VERB,ADP Vaseline ADP,NOUN ADP Vaseline,DET NOUN ADP Vaseline,NOUN DET NOUN ADP Vaseline,Vaseline ADP VERB,Vaseline ADP VERB DET,Vaseline ADP VERB DET NOUN,pot de Vaseline pour hydrater,de Vaseline pour,pot de Vaseline,un pot de Vaseline,main un pot de Vaseline,Vaseline pour hydrater,Vaseline pour hydrater son,Vaseline pour hydrater son lèvre
https://www.lexpress.mu/node/339946,lexpress.mu,2018-09-26,Mauritius,Vaseline/NAM/Vaseline,C'  est  alors  que  les  douaniers  ont  remarqué  que  ses  parties  intimes  étaient  enduites  de Vaseline  .,vaseline,nam,vaseline,de,de,ADP,enduites,enduire,VERB,étaient,être,VERB,intimes,intime,ADJ,parties,partie,NOUN,.,.,PUNCT,,,,,,,,,,,,,2018-09-26,2018,2010,,ADP Vaseline PUNCT,VERB ADP Vaseline,VERB VERB ADP Vaseline,ADJ VERB VERB ADP Vaseline,,,,,de Vaseline .,enduire de Vaseline,être enduire de Vaseline,intime être enduire de Vaseline,,,
https://defimedia.info/laeroport-rs-15-m-dheroine-retrouvees-dans-ses-parties-intimes,defimedia.info,2018-09-26,===NONE===,vaseline/NOM/vaseline,Une  fouille  corporelle  a  permis  aux  officiers  la  Customs  Anti-Narcotics  Section  de  la  MRA  de  découvrir  qu'  il  avait  appliqué  de  la vaseline  dans  ses  parties  privées  .,vaseline,nom,vaseline,la,le,DET,de,de,ADP,appliqué,appliquer,VERB,avait,avoir,VERB,il,il,PRON,dans,dans,ADP,ses,son,DET,parties,partie,NOUN,privées,privé,ADJ,.,.,PUNCT,2018-09-26,2018,2010,ADP DET Vaseline ADP DET,DET Vaseline ADP,ADP DET Vaseline,VERB ADP DET Vaseline,VERB VERB ADP DET Vaseline,Vaseline ADP DET,Vaseline ADP DET NOUN,Vaseline ADP DET NOUN ADJ,de le Vaseline dans son,le Vaseline dans,de le Vaseline,appliquer de le Vaseline,avoir appliquer de le Vaseline,Vaseline dans son,Vaseline dans son partie,Vaseline dans son partie privé
https://www.inside.news/2018/09/26/pour-rs-100-000-il-dissimule-rs-15-m-dheroine-dans-son-anus/,inside.news,2018-09-26,===NONE===,vaseline/NOM/vaseline,C'  est  lorsqu'  il  a  été  soumis  à  une  fouille  corporelle  que  les  douaniers  ont  retrouvé  des  traces  de vaseline  ...,vaseline,nom,vaseline,de,de,ADP,traces,trace,NOUN,des,du,ADP DET,retrouvé,retrouver,VERB,ont,avoir,VERB,...,...,PUNCT,,,,,,,,,,,,,2018-09-26,2018,2010,,ADP Vaseline PUNCT,NOUN ADP Vaseline,ADP DET NOUN ADP Vaseline,VERB ADP DET NOUN ADP Vaseline,,,,,de Vaseline ...,trace de Vaseline,du trace de Vaseline,retrouver du trace de Vaseline,,,
https://www.inside.news/2018/09/26/pour-rs-100-000-il-dissimule-rs-15-m-dheroine-dans-son-anus/,inside.news,2018-09-26,===NONE===,vaseline/NOM/vaseline,"C'  est  pourquoi  qu'  avec  du vaseline  ,  il  a  dissimulé  la  drogue  dans  son  anus  .",vaseline,nom,vaseline,du,du,ADP DET,avec,avec,ADP,qu',que,CONJ,pourquoi,pourquoi,ADV,est,être,VERB,",",",",PUNCT,il,il,PRON,a,avoir,VERB,dissimulé,dissimuler,VERB,la,le,DET,2018-09-26,2018,2010,ADP ADP DET Vaseline PUNCT PRON,ADP DET Vaseline PUNCT,ADP ADP DET Vaseline,CONJ ADP ADP DET Vaseline,ADV CONJ ADP ADP DET Vaseline,Vaseline PUNCT PRON,Vaseline PUNCT PRON VERB,Vaseline PUNCT PRON VERB VERB,"avec du Vaseline , il","du Vaseline ,",avec du Vaseline,que avec du Vaseline,pourquoi que avec du Vaseline,"Vaseline , il","Vaseline , il avoir","Vaseline , il avoir dissimuler"
https://defimedia.info/laeroport-de-lheroine-decouverte-dans-les-parties-intimes-dun-passeur,defimedia.info,2018-09-27,===NONE===,vaseline/NOM/vaseline,"Lors  d'  une  fouille  ,  des  traces  de vaseline  sur  ses  parties  intimes  ont  éveillé  les  soupçons  des  policiers  et  des  douaniers  .",vaseline,nom,vaseline,de,de,ADP,traces,trace,NOUN,des,du,ADP DET,",",",",PUNCT,fouille,fouille,NOUN,sur,sur,ADP,ses,son,DET,parties,partie,NOUN,intimes,intime,ADJ,ont,avoir,VERB,2018-09-27,2018,2010,NOUN ADP Vaseline ADP DET,ADP Vaseline ADP,NOUN ADP Vaseline,ADP DET NOUN ADP Vaseline,PUNCT ADP DET NOUN ADP Vaseline,Vaseline ADP DET,Vaseline ADP DET NOUN,Vaseline ADP DET NOUN ADJ,trace de Vaseline sur son,de Vaseline sur,trace de Vaseline,du trace de Vaseline,", du trace de Vaseline",Vaseline sur son,Vaseline sur son partie,Vaseline sur son partie intime
https://www.forbes.fr/technologie/apple-que-signifie-labandon-de-la-gamme-se/,forbes.fr,2018-09-27,France,vaseline/NOM/vaseline,"Utiliser  une  paire  d'  écouteurs  décente  avec  un  adaptateur  bon  marché  ,  c'  est  comme  enduire  de vaseline  l'  objectif  d'  un  super  appareil  photo  .",vaseline,nom,vaseline,de,de,ADP,enduire,enduire,VERB,comme,comme,ADV,est,être,VERB,c',ce,PRON,l',le,DET,objectif,objectif,NOUN,d',de,ADP,un,un,DET,super,super,ADJ,2018-09-27,2018,2010,VERB ADP Vaseline DET NOUN,ADP Vaseline DET,VERB ADP Vaseline,ADV VERB ADP Vaseline,VERB ADV VERB ADP Vaseline,Vaseline DET NOUN,Vaseline DET NOUN ADP,Vaseline DET NOUN ADP DET,enduire de Vaseline le objectif,de Vaseline le,enduire de Vaseline,comme enduire de Vaseline,être comme enduire de Vaseline,Vaseline le objectif,Vaseline le objectif de,Vaseline le objectif de un
https://forums.futura-sciences.com/electronique/101566-nettoyant-circuit-electronique-contacts.html,futura-sciences.com,2018-10-04,France,vaseline/NOM/vaseline,"S'  il  s'  agit  de  connecteurs  utilisés  rarement  et  hors  tension  (  antenne  ,  etc  )  ou  de  contacts  ""  signal  ""  ,  on  peut  vaporiser  de  la vaseline  après  nettoyage  pour  éviter  une  oxydation  ultérieure  ;  ne  jamais  employer  sur  de  la  puissance  .",vaseline,nom,vaseline,la,le,DET,de,de,ADP,vaporiser,vaporiser,VERB,peut,pouvoir,VERB,on,on,PRON,après,après,ADP,nettoyage,nettoyage,NOUN,pour,pour,ADP,éviter,éviter,VERB,une,un,DET,2018-10-04,2018,2010,ADP DET Vaseline ADP NOUN,DET Vaseline ADP,ADP DET Vaseline,VERB ADP DET Vaseline,VERB VERB ADP DET Vaseline,Vaseline ADP NOUN,Vaseline ADP NOUN ADP,Vaseline ADP NOUN ADP VERB,de le Vaseline après nettoyage,le Vaseline après,de le Vaseline,vaporiser de le Vaseline,pouvoir vaporiser de le Vaseline,Vaseline après nettoyage,Vaseline après nettoyage pour,Vaseline après nettoyage pour éviter
