url,website,date,country,keyword,sentence,kw,kw_lemma,kw_pos,left_w1,left_l1,left_p1,left_w2,left_l2,left_p2,left_w3,left_l3,left_p3,left_w4,left_l4,left_p4,left_w5,left_l5,left_p5,right_w1,right_l1,right_p1,right_w2,right_l2,right_p2,right_w3,right_l3,right_p3,right_w4,right_l4,right_p4,right_w5,right_l5,right_p5,datetime,year,10years,pattern_around5,pattern_around3,pattern_left2,pattern_left3,pattern_left4,pattern_right2,pattern_right3,pattern_right4,pattern_around5_lex,pattern_around3_lex,pattern_left2_lex,pattern_left3_lex,pattern_left4_lex,pattern_right2_lex,pattern_right3_lex,pattern_right4_lex
https://www.lunion.fr/id120430/article/2020-01-03/baumes-levres-quels-sont-les-modeles-les-plus-efficaces,lunion.fr,2020-01-03,France,vaseline/NOM/vaseline,"Il  a  passé  en  revue  des  produits  composés  avec  de  la vaseline  et  de  la  paraffine  ,  très  utilisée  dans  les  crèmes  et  baumes  hydratants  mais  qui  peuvent  contenir  des  impuretés  cancérogènes  ,  avec  la  glycérine  qui  peut  susciter  des  allergies  ,  ou  encore  avec  les  huiles  végétales  et  beurres  végétaux  qui  sont  aujourd  '  hui  plébiscités  .",vaseline,nom,vaseline,la,le,DET,de,de,ADP,avec,avec,ADP,composés,composer,VERB,produits,produit,NOUN,et,et,CONJ,de,de,ADP,la,le,DET,paraffine,paraffine,NOUN,",",",",PUNCT,2020-01-03,2020,2020,ADP DET Vaseline CONJ ADP,DET Vaseline CONJ,ADP DET Vaseline,ADP ADP DET Vaseline,VERB ADP ADP DET Vaseline,Vaseline CONJ ADP,Vaseline CONJ ADP DET,Vaseline CONJ ADP DET NOUN,de le Vaseline et de,le Vaseline et,de le Vaseline,avec de le Vaseline,composer avec de le Vaseline,Vaseline et de,Vaseline et de le,Vaseline et de le paraffine
https://www.topsante.com/beaute-soins/soins-du-visage/soin-des-levres/classement-les-10-baumes-a-levres-les-plus-efficaces-pour-cet-hiver-634411,topsante.com,2020-01-03,France,vaseline/NOM/vaseline,"Le  magazine  fait  par  ailleurs  le  point  sur  les  substances  que  l'  on  trouve  dans  les  baumes  à  lèvres  comme  la vaseline  et  la  parraffine  (  petrolatum  ,  mineral  oil  ,  paraffinum  liquidum  ,  paraffin  ,  cera  microcristallina  ...  )  qui  ,  lorsqu'  elles  sont  mal  purifiées  ,  peuvent  être  cancérogènes  ou  la  lanoline  ,  traitée  avec  des  produits  allergisants  .",vaseline,nom,vaseline,la,le,DET,comme,comme,CONJ,lèvres,lèvre,NOUN,à,à,ADP,baumes,baume,NOUN,et,et,CONJ,la,le,DET,parraffine,parraffine,NOUN,(,(,PUNCT,petrolatum,petrolatum,NOUN,2020-01-03,2020,2020,CONJ DET Vaseline CONJ DET,DET Vaseline CONJ,CONJ DET Vaseline,NOUN CONJ DET Vaseline,ADP NOUN CONJ DET Vaseline,Vaseline CONJ DET,Vaseline CONJ DET NOUN,Vaseline CONJ DET NOUN PUNCT,comme le Vaseline et le,le Vaseline et,comme le Vaseline,lèvre comme le Vaseline,à lèvre comme le Vaseline,Vaseline et le,Vaseline et le parraffine,Vaseline et le parraffine (
https://www.lopinion.fr/edition/wsj/amazon-a-longtemps-domine-cloud-desormais-il-doit-repousser-rivaux-207676,lopinion.fr,2020-01-06,France,Vaseline/NAM/Vaseline,"Unilever  ,  le  géant  des  biens  de  consommation  qui  possède  des  marques  telles  que  Ben  &  Jerry  '  s  et Vaseline  ,  utilise  les  outils  d'  analyse  de  données  que  Microsoft  propose  avec  Azure  afin  d'  analyser  certaines  des  données  les  plus  sensibles  concernant  ses  clients  et  ses  fournisseurs  tiers  ,  selon  une  source  qui  connaît  bien  la  stratégie  de  cloud  computing  d'  Unilever  .",vaseline,nam,vaseline,et,et,CONJ,s,s,VERB,',',PUNCT,Jerry,Jerry,PROPN,&,&,SYM,",",",",PUNCT,utilise,utiliser,VERB,les,le,DET,outils,outil,NOUN,d',de,ADP,2020-01-06,2020,2020,VERB CONJ Vaseline PUNCT VERB,CONJ Vaseline PUNCT,VERB CONJ Vaseline,PUNCT VERB CONJ Vaseline,PROPN PUNCT VERB CONJ Vaseline,Vaseline PUNCT VERB,Vaseline PUNCT VERB DET,Vaseline PUNCT VERB DET NOUN,"s et Vaseline , utiliser","et Vaseline ,",s et Vaseline,' s et Vaseline,Jerry ' s et Vaseline,"Vaseline , utiliser","Vaseline , utiliser le","Vaseline , utiliser le outil"
https://www.femmeactuelle.fr/enfant/bebe/dermatite-seborrheique-du-nourrisson-que-faire-contre-les-croutes-de-lait-de-bebe-2089094,femmeactuelle.fr,2020-01-09,France,vaseline/NOM/vaseline,Les  croûtes  sont  particulièrement  épaisses  ?  Il  est  alors  conseillé  d'  appliquer  de  la vaseline  sur  le  cuir  chevelu  de  bébé  quelques  heures  avant  la  toilette  .,vaseline,nom,vaseline,la,le,DET,de,de,ADP,appliquer,appliquer,VERB,d',de,ADP,conseillé,conseiller,VERB,sur,sur,ADP,le,le,DET,cuir,cuir,NOUN,chevelu,chevelu,ADJ,de,de,ADP,2020-01-09,2020,2020,ADP DET Vaseline ADP DET,DET Vaseline ADP,ADP DET Vaseline,VERB ADP DET Vaseline,ADP VERB ADP DET Vaseline,Vaseline ADP DET,Vaseline ADP DET NOUN,Vaseline ADP DET NOUN ADJ,de le Vaseline sur le,le Vaseline sur,de le Vaseline,appliquer de le Vaseline,de appliquer de le Vaseline,Vaseline sur le,Vaseline sur le cuir,Vaseline sur le cuir chevelu
https://www.cameroon-tribune.cm/article.html/30296/en.html/climat-froid-glacial-dans-ladamaoua,cameroon-tribune.cm,2020-01-10,Cameroon,vaseline/NOM/vaseline,"Pour  contrer  les  effets  de  ces  caprices  du  climat  ,  en  dehors  des  vêtements  chauds  que  chacun  arbore  ,  la vaseline  et  la  glycérine  sont  utilisées  pour  lutter  contre  l'  assèchement  de  la  peau  .",vaseline,nom,vaseline,la,le,DET,",",",",PUNCT,arbore,arborer,VERB,chacun,chacun,PRON,que,que,PRON,et,et,CONJ,la,le,DET,glycérine,glycérine,NOUN,sont,être,VERB,utilisées,utiliser,VERB,2020-01-10,2020,2020,PUNCT DET Vaseline CONJ DET,DET Vaseline CONJ,PUNCT DET Vaseline,VERB PUNCT DET Vaseline,PRON VERB PUNCT DET Vaseline,Vaseline CONJ DET,Vaseline CONJ DET NOUN,Vaseline CONJ DET NOUN VERB,", le Vaseline et le",le Vaseline et,", le Vaseline","arborer , le Vaseline","chacun arborer , le Vaseline",Vaseline et le,Vaseline et le glycérine,Vaseline et le glycérine être
https://fr.besoccer.com/info/dybala-a-paracheve-l-udinese-avec-ce-delicieux-but-776795,besoccer.com,2020-01-15,===NONE===,vaseline/NOM/vaseline,"Mais  pas  avec  n'  importe  quelle  frappe  ,  mais  avec  une  véritable  ""  délicieuse  frappe  ""  :  une  sorte  de vaseline  qu'  il  dirige  parfaitement  vers  la  lucarne  pour  laisser  tout  le  monde  dans  le  stade  sans  voix  .",vaseline,nom,vaseline,de,de,ADP,sorte,sorte,NOUN,une,un,DET,:,:,PUNCT,"""","""",PUNCT,qu',que,PRON,il,il,PRON,dirige,diriger,VERB,parfaitement,parfaitement,ADV,vers,vers,ADP,2020-01-15,2020,2020,NOUN ADP Vaseline PRON PRON,ADP Vaseline PRON,NOUN ADP Vaseline,DET NOUN ADP Vaseline,PUNCT DET NOUN ADP Vaseline,Vaseline PRON PRON,Vaseline PRON PRON VERB,Vaseline PRON PRON VERB ADV,sorte de Vaseline que il,de Vaseline que,sorte de Vaseline,un sorte de Vaseline,: un sorte de Vaseline,Vaseline que il,Vaseline que il diriger,Vaseline que il diriger parfaitement
https://lefaso.net/spip.php?article94369,lefaso.net,2020-01-16,France,vaseline/NOM/vaseline,"2  -  Pour  la  2  e  astuce  ,  il  vous  faut  du  vinaigre  de  cidre  ,  que  vous  trouverez  dans  les  alimentations  ,  de  la vaseline  ou  du  beurre  de  karité  ,  une  pierre  ponce  ,  de  l'  eau  chaude  ,  une  bassine  ,  une  paire  de  chaussettes  .",vaseline,nom,vaseline,la,le,DET,de,de,ADP,",",",",PUNCT,alimentations,alimentation,NOUN,les,le,DET,ou,ou,CONJ,du,du,ADP DET,beurre,beurre,NOUN,de,de,ADP,karité,karité,NOUN,2020-01-16,2020,2020,ADP DET Vaseline CONJ ADP DET,DET Vaseline CONJ,ADP DET Vaseline,PUNCT ADP DET Vaseline,NOUN PUNCT ADP DET Vaseline,Vaseline CONJ ADP DET,Vaseline CONJ ADP DET NOUN,Vaseline CONJ ADP DET NOUN ADP,de le Vaseline ou du,le Vaseline ou,de le Vaseline,", de le Vaseline","alimentation , de le Vaseline",Vaseline ou du,Vaseline ou du beurre,Vaseline ou du beurre de
https://lefaso.net/spip.php?article94369,lefaso.net,2020-01-16,France,vaseline/NOM/vaseline,"Appliquez  généreusement  la vaseline  ou  le  beurre  de  karité  sur  vos  pieds  ,  portez  vos  chaussettes  et  passez  la  nuit  .",vaseline,nom,vaseline,la,le,DET,généreusement,généreusement,ADV,Appliquez,appliquer,VERB,,,,,,,ou,ou,CONJ,le,le,DET,beurre,beurre,NOUN,de,de,ADP,karité,karité,NOUN,2020-01-16,2020,2020,ADV DET Vaseline CONJ DET,DET Vaseline CONJ,ADV DET Vaseline,VERB ADV DET Vaseline,,Vaseline CONJ DET,Vaseline CONJ DET NOUN,Vaseline CONJ DET NOUN ADP,généreusement le Vaseline ou le,le Vaseline ou,généreusement le Vaseline,appliquer généreusement le Vaseline,,Vaseline ou le,Vaseline ou le beurre,Vaseline ou le beurre de
https://www.lapresse.ca/affaires/entreprises/202001/17/01-5257309-le-combat-dun-entrepreneur-contre-le-suicide.php,lapresse.ca,2020-01-18,Canada,vaseline/NOM/vaseline,"Le  premier  a  délicatement  appliqué  l'  indispensable vaseline  sur  le  visage  du  second  ,  qui  avait  oublié  son  onguent  .",vaseline,nom,vaseline,indispensable,indispensable,ADJ,l',le,DET,appliqué,appliquer,VERB,délicatement,délicatement,ADV,a,avoir,VERB,sur,sur,ADP,le,le,DET,visage,visage,NOUN,du,du,ADP DET,second,second,NOUN,2020-01-18,2020,2020,DET ADJ Vaseline ADP DET,ADJ Vaseline ADP,DET ADJ Vaseline,VERB DET ADJ Vaseline,ADV VERB DET ADJ Vaseline,Vaseline ADP DET,Vaseline ADP DET NOUN,Vaseline ADP DET NOUN ADP DET,le indispensable Vaseline sur le,indispensable Vaseline sur,le indispensable Vaseline,appliquer le indispensable Vaseline,délicatement appliquer le indispensable Vaseline,Vaseline sur le,Vaseline sur le visage,Vaseline sur le visage du
https://www.causeur.fr/pierre-robin-paris-esthetique-contre-cool-2-171693,causeur.fr,2020-01-26,France,vaseline/NOM/vaseline,"Ils  s'  appelaient  Alain  Delon  ou  Maurice  Druon  ,  oscillaient  entre  la  répartie  ""  Grand  Siècle  ""  et  une  flamboyance  criarde  ,  ils  incarnaient  une  époque  brute  qui  refusait  toute vaseline  moralisatrice  .",vaseline,nom,vaseline,toute,tout,PRON,refusait,refuser,VERB,qui,qui,PRON,brute,brut,ADJ,époque,époque,NOUN,moralisatrice,moralisateur,ADJ,.,.,PUNCT,,,,,,,,,,2020-01-26,2020,2020,VERB PRON Vaseline ADJ PUNCT,PRON Vaseline ADJ,VERB PRON Vaseline,PRON VERB PRON Vaseline,ADJ PRON VERB PRON Vaseline,Vaseline ADJ PUNCT,,,refuser tout Vaseline moralisateur .,tout Vaseline moralisateur,refuser tout Vaseline,qui refuser tout Vaseline,brut qui refuser tout Vaseline,Vaseline moralisateur .,,
https://www.franceinter.fr/culture/exposition-claudia-andujar-a-la-fondation-cartier-du-30-janvier-au-10-mai-2020,franceinter.fr,2020-01-29,France,vaseline/NOM/vaseline,"En  appliquant  de  la vaseline  sur  l'  objectif  de  son  appareil  ,  en  utilisant  une  pellicule  infrarouge  ou  en  jouant  avec  la  lumière  ,  elle  crée  des  distorsions  visuelles  qui  imprègnent  ses  images  d'  une  certaine  surréalité  .",vaseline,nom,vaseline,la,le,DET,de,de,ADP,appliquant,appliquer,VERB,En,en,PRON,,,,sur,sur,ADP,l',le,DET,objectif,objectif,NOUN,de,de,ADP,son,son,DET,2020-01-29,2020,2020,ADP DET Vaseline ADP DET,DET Vaseline ADP,ADP DET Vaseline,VERB ADP DET Vaseline,PRON VERB ADP DET Vaseline,Vaseline ADP DET,Vaseline ADP DET NOUN,Vaseline ADP DET NOUN ADP,de le Vaseline sur le,le Vaseline sur,de le Vaseline,appliquer de le Vaseline,en appliquer de le Vaseline,Vaseline sur le,Vaseline sur le objectif,Vaseline sur le objectif de
https://www.sciencesetavenir.fr/nature-environnement/amazonie-des-photos-font-vivre-la-mystique-et-la-lutte-des-yanomami_140985?xtor=RSS-15,sciencesetavenir.fr,2020-01-29,France,vaseline/NOM/vaseline,"Elle  adapte  ses  images  à  des  techniques  et  effets  ,  en  y  ajoutant  un  aspect  surréel  :  grand  angle  , vaseline  sur  l'  objectif  ,  pellicule  infrarouge  ,  filtres  .",vaseline,nom,vaseline,",",",",PUNCT,angle,angle,NOUN,grand,grand,ADJ,:,:,PUNCT,surréel,surréel,ADJ,sur,sur,ADP,l',le,DET,objectif,objectif,NOUN,",",",",PUNCT,pellicule,pellicule,NOUN,2020-01-29,2020,2020,NOUN PUNCT Vaseline ADP DET,PUNCT Vaseline ADP,NOUN PUNCT Vaseline,ADJ NOUN PUNCT Vaseline,PUNCT ADJ NOUN PUNCT Vaseline,Vaseline ADP DET,Vaseline ADP DET NOUN,Vaseline ADP DET NOUN PUNCT,"angle , Vaseline sur le",", Vaseline sur","angle , Vaseline","grand angle , Vaseline",": grand angle , Vaseline",Vaseline sur le,Vaseline sur le objectif,"Vaseline sur le objectif ,"
https://actu.orange.fr/societe/culture/bresil-le-combat-de-la-photographe-claudia-andujar-pour-la-survie-des-yanomami-CNT000001ni16M.html,orange.fr,2020-01-30,France,vaseline/NOM/vaseline,"Pour  mieux  rendre  compte  de  la  dimension  spirituelle  des  Yanomami  ,  Claudia  Andujar  a  même  eu  recours  à  des  effets  spéciaux  ,  utilisant  des  pellicules  infrarouges  ou  badigeonnant  son  objectif  de vaseline  .",vaseline,nom,vaseline,de,de,ADP,objectif,objectif,NOUN,son,son,DET,badigeonnant,badigeonner,VERB,ou,ou,CONJ,.,.,PUNCT,,,,,,,,,,,,,2020-01-30,2020,2020,,ADP Vaseline PUNCT,NOUN ADP Vaseline,DET NOUN ADP Vaseline,VERB DET NOUN ADP Vaseline,,,,,de Vaseline .,objectif de Vaseline,son objectif de Vaseline,badigeonner son objectif de Vaseline,,,
https://www.telerama.fr/sortir/claudia-andujar-a-la-fondation-cartier-une-retrospective-essentielle%2Cn6598803.php,telerama.fr,2020-01-30,France,vaseline/NOM/vaseline,"Parfois  ,  la  photographe  use  d'  un  grand  angle  et  applique  de  la vaseline  sur  l'  objectif  de  son  appareil  ,  rendant  les  bords  de  la  scène  floue  .",vaseline,nom,vaseline,la,le,DET,de,de,ADP,applique,appliquer,VERB,et,et,CONJ,angle,angle,NOUN,sur,sur,ADP,l',le,DET,objectif,objectif,NOUN,de,de,ADP,son,son,DET,2020-01-30,2020,2020,ADP DET Vaseline ADP DET,DET Vaseline ADP,ADP DET Vaseline,VERB ADP DET Vaseline,CONJ VERB ADP DET Vaseline,Vaseline ADP DET,Vaseline ADP DET NOUN,Vaseline ADP DET NOUN ADP,de le Vaseline sur le,le Vaseline sur,de le Vaseline,appliquer de le Vaseline,et appliquer de le Vaseline,Vaseline sur le,Vaseline sur le objectif,Vaseline sur le objectif de
https://www.francetvinfo.fr/culture/arts-expos/photographie/claudia-andujar-a-la-fondation-cartier-une-grande-photographe-au-service-d-un-peuple-menace-les-yanomamis_3805827.html#xtor%3DRSS-3-%255Bculture%255D,francetvinfo.fr,2020-01-31,France,vaseline/NOM/vaseline,"Elle  met  de  la vaseline  sur  ses  objectifs  pour  créer  du  flou  ,  capte  la  lumière  zénithale  qui  traverse  le  toit  de  l'  habitation  collective  en  fins  rayons  ,  elle  emploie  des  filtres  .",vaseline,nom,vaseline,la,le,DET,de,de,ADP,met,mettre,VERB,Elle,elle,PRON,,,,sur,sur,ADP,ses,son,DET,objectifs,objectif,NOUN,pour,pour,ADP,créer,créer,VERB,2020-01-31,2020,2020,ADP DET Vaseline ADP DET,DET Vaseline ADP,ADP DET Vaseline,VERB ADP DET Vaseline,PRON VERB ADP DET Vaseline,Vaseline ADP DET,Vaseline ADP DET NOUN,Vaseline ADP DET NOUN ADP,de le Vaseline sur son,le Vaseline sur,de le Vaseline,mettre de le Vaseline,elle mettre de le Vaseline,Vaseline sur son,Vaseline sur son objectif,Vaseline sur son objectif pour
https://www.francetvinfo.fr/culture/arts-expos/photographie/claudia-andujar-a-la-fondation-cartier-une-grande-photographe-au-service-d-un-peuple-menace-les-yanomamis_3805827.html#xtor%3DRSS-3-%255Bheadline%3A%3A13%255D,francetvinfo.fr,2020-02-01,France,vaseline/NOM/vaseline,"Elle  met  de  la vaseline  sur  ses  objectifs  pour  créer  du  flou  ,  capte  la  lumière  zénithale  qui  traverse  le  toit  de  l'  habitation  collective  en  fins  rayons  ,  elle  emploie  des  filtres  .",vaseline,nom,vaseline,la,le,DET,de,de,ADP,met,mettre,VERB,Elle,elle,PRON,,,,sur,sur,ADP,ses,son,DET,objectifs,objectif,NOUN,pour,pour,ADP,créer,créer,VERB,2020-02-01,2020,2020,ADP DET Vaseline ADP DET,DET Vaseline ADP,ADP DET Vaseline,VERB ADP DET Vaseline,PRON VERB ADP DET Vaseline,Vaseline ADP DET,Vaseline ADP DET NOUN,Vaseline ADP DET NOUN ADP,de le Vaseline sur son,le Vaseline sur,de le Vaseline,mettre de le Vaseline,elle mettre de le Vaseline,Vaseline sur son,Vaseline sur son objectif,Vaseline sur son objectif pour
https://www.agoravox.fr/tribune-libre/article/le-froid-tue-17-fois-plus-que-la-221139?utm_source=feedburner&utm_medium=feed&utm_campaign=Feed%253A%2Bagoravox%252FgEOF%2B%2528AgoraVox%2B-%2Ble%2Bjournal%2Bcitoyen%2529&utm_content=FeedBurner,agoravox.fr,2020-02-02,France,vaseline/NOM/vaseline,Les  nageurs  qui  effectuent  la  traversée  de  la  Manche  s'  enduisent  le  corps  de  plusieurs  kilogrammes  d'  un  mélange  de vaseline  et  de  graisse  de  mouton  .,vaseline,nom,vaseline,de,de,ADP,mélange,mélange,NOUN,un,un,DET,d',de,ADP,kilogrammes,kilogramme,NOUN,et,et,CONJ,de,de,ADP,graisse,graisse,NOUN,de,de,ADP,mouton,mouton,NOUN,2020-02-02,2020,2020,NOUN ADP Vaseline CONJ ADP,ADP Vaseline CONJ,NOUN ADP Vaseline,DET NOUN ADP Vaseline,ADP DET NOUN ADP Vaseline,Vaseline CONJ ADP,Vaseline CONJ ADP NOUN,Vaseline CONJ ADP NOUN ADP,mélange de Vaseline et de,de Vaseline et,mélange de Vaseline,un mélange de Vaseline,de un mélange de Vaseline,Vaseline et de,Vaseline et de graisse,Vaseline et de graisse de
https://www.lesoleil.com/arts/bresil-le-combat-de-la-photographe-claudia-andujar-pour-la-survie-des-yanomami-c41024468777f119f475a45e16dc7059,lesoleil.com,2020-02-02,===NONE===,vaseline/NOM/vaseline,"Pour  mieux  rendre  compte  de  la  dimension  spirituelle  des  Yanomami  ,  Claudia  Andujar  a  même  eu  recours  à  des  effets  spéciaux  ,  utilisant  des  pellicules  infrarouges  ou  badigeonnant  son  objectif  de vaseline  .",vaseline,nom,vaseline,de,de,ADP,objectif,objectif,NOUN,son,son,DET,badigeonnant,badigeonner,VERB,ou,ou,CONJ,.,.,PUNCT,,,,,,,,,,,,,2020-02-02,2020,2020,,ADP Vaseline PUNCT,NOUN ADP Vaseline,DET NOUN ADP Vaseline,VERB DET NOUN ADP Vaseline,,,,,de Vaseline .,objectif de Vaseline,son objectif de Vaseline,badigeonner son objectif de Vaseline,,,
https://www.lemonde.fr/culture/article/2020/02/03/avec-ses-photographies-claudia-andujar-donne-une-voix-aux-indiens_6028204_3246.html,lemonde.fr,2020-02-03,France,vaseline/NOM/vaseline,"Avec  des  expérimentations  multiples  -  pellicules  infrarouges  , vaseline  sur  l'  objectif  ,  jeux  de  flou  et  de  lumière  ,  superpositions  -  la  photographe  cherche  comme  à  traduire  visuellement  l'  univers  des  Yanomami  :  leurs  rapports  particuliers  aux  animaux  et  la  communion  à  la  ""  forêt-monde  ""  ,  les  visions  nébuleuses  nées  des  transes  chamaniques  ,  la  danse  joyeuse  des  esprits  invisibles  ...",vaseline,nom,vaseline,",",",",PUNCT,infrarouges,infrarouge,ADJ,pellicules,pellicule,NOUN,-,-,PUNCT,multiples,multiple,ADJ,sur,sur,ADP,l',le,DET,objectif,objectif,NOUN,",",",",PUNCT,jeux,jeu,NOUN,2020-02-03,2020,2020,ADJ PUNCT Vaseline ADP DET,PUNCT Vaseline ADP,ADJ PUNCT Vaseline,NOUN ADJ PUNCT Vaseline,PUNCT NOUN ADJ PUNCT Vaseline,Vaseline ADP DET,Vaseline ADP DET NOUN,Vaseline ADP DET NOUN PUNCT,"infrarouge , Vaseline sur le",", Vaseline sur","infrarouge , Vaseline","pellicule infrarouge , Vaseline","- pellicule infrarouge , Vaseline",Vaseline sur le,Vaseline sur le objectif,"Vaseline sur le objectif ,"
https://www.lejdd.fr/JDD-Paris/amazonie-chine-paris-trois-expositions-photo-a-ne-pas-manquer-3947067,lejdd.fr,2020-02-03,France,vaseline/NOM/vaseline,"Elle  use  d'  effets  dans  ses  clichés  ,  comme  des  filtres  de  couleur  ou  de  la vaseline  sur  son  objectif  pour  rendre  compte  de  la  spiritualité  des  Yanomami  .",vaseline,nom,vaseline,la,le,DET,de,de,ADP,ou,ou,CONJ,couleur,couleur,NOUN,de,de,ADP,sur,sur,ADP,son,son,DET,objectif,objectif,NOUN,pour,pour,ADP,rendre,rendre,VERB,2020-02-03,2020,2020,ADP DET Vaseline ADP DET,DET Vaseline ADP,ADP DET Vaseline,CONJ ADP DET Vaseline,NOUN CONJ ADP DET Vaseline,Vaseline ADP DET,Vaseline ADP DET NOUN,Vaseline ADP DET NOUN ADP,de le Vaseline sur son,le Vaseline sur,de le Vaseline,ou de le Vaseline,couleur ou de le Vaseline,Vaseline sur son,Vaseline sur son objectif,Vaseline sur son objectif pour
https://fr.euronews.com/2020/02/03/contre-plongee-chez-les-yanomami-le-combat-de-claudia-andujar,euronews.com,2020-02-03,France,vaseline/NOM/vaseline,"Pellicules  infrarouges  ,  superpositions  , vaseline  sur  l'  objectif  pour  jeux  de  flou  et  de  lumière  .",vaseline,nom,vaseline,",",",",PUNCT,superpositions,superposition,NOUN,",",",",PUNCT,infrarouges,infrarouge,ADJ,Pellicules,pellicule,NOUN,sur,sur,ADP,l',le,DET,objectif,objectif,NOUN,pour,pour,ADP,jeux,jeu,NOUN,2020-02-03,2020,2020,NOUN PUNCT Vaseline ADP DET,PUNCT Vaseline ADP,NOUN PUNCT Vaseline,PUNCT NOUN PUNCT Vaseline,ADJ PUNCT NOUN PUNCT Vaseline,Vaseline ADP DET,Vaseline ADP DET NOUN,Vaseline ADP DET NOUN ADP,"superposition , Vaseline sur le",", Vaseline sur","superposition , Vaseline",", superposition , Vaseline","infrarouge , superposition , Vaseline",Vaseline sur le,Vaseline sur le objectif,Vaseline sur le objectif pour
https://sante-medecine.journaldesfemmes.fr/forum/affich-2446866-contour-de-bouche-rouge-et-levres-brulantes,journaldesfemmes.fr,2020-02-08,France,vaseline/NOM/vaseline,"Traitement  avec  crème  euricin  , vaseline  ,  cicalfate  ,  cicaplast  ,  polysporin  contre  infection  .",vaseline,nom,vaseline,",",",",PUNCT,euricin,euricin,ADJ,crème,crème,NOUN,avec,avec,ADP,Traitement,traitement,NOUN,",",",",PUNCT,cicalfate,cicalfate,NOUN,",",",",PUNCT,cicaplast,cicaplast,NOUN,",",",",PUNCT,2020-02-08,2020,2020,ADJ PUNCT Vaseline PUNCT NOUN,PUNCT Vaseline PUNCT,ADJ PUNCT Vaseline,NOUN ADJ PUNCT Vaseline,ADP NOUN ADJ PUNCT Vaseline,Vaseline PUNCT NOUN,Vaseline PUNCT NOUN PUNCT,Vaseline PUNCT NOUN PUNCT NOUN,"euricin , Vaseline , cicalfate",", Vaseline ,","euricin , Vaseline","crème euricin , Vaseline","avec crème euricin , Vaseline","Vaseline , cicalfate","Vaseline , cicalfate ,","Vaseline , cicalfate , cicaplast"
https://sante-medecine.journaldesfemmes.fr/forum/affich-2446866-contour-de-bouche-rouge-et-levres-brulantes,journaldesfemmes.fr,2020-02-08,France,vaseline/NOM/vaseline,"On  recommence  avec vaseline  ,  aquaphor  ,  huile  neutre  et  lavande  aspic  et  niaouli  (  supposément  excellent  :  ça  brûle  plus  que  jamais  )  .",vaseline,nom,vaseline,avec,avec,ADP,recommence,recommencer,VERB,On,on,PRON,,,,,,,",",",",PUNCT,aquaphor,aquaphor,NOUN,",",",",PUNCT,huile,huile,NOUN,neutre,neutre,ADJ,2020-02-08,2020,2020,VERB ADP Vaseline PUNCT NOUN,ADP Vaseline PUNCT,VERB ADP Vaseline,PRON VERB ADP Vaseline,,Vaseline PUNCT NOUN,Vaseline PUNCT NOUN PUNCT,Vaseline PUNCT NOUN PUNCT NOUN,"recommencer avec Vaseline , aquaphor","avec Vaseline ,",recommencer avec Vaseline,on recommencer avec Vaseline,,"Vaseline , aquaphor","Vaseline , aquaphor ,","Vaseline , aquaphor , huile"
https://sante-medecine.journaldesfemmes.fr/forum/affich-2446866-contour-de-bouche-rouge-et-levres-brulantes,journaldesfemmes.fr,2020-02-08,France,vaseline/NOM/vaseline,La  seule  chose  qui  apaise  mais  ne  guérit  pas  c'  est  la vaseline  .,vaseline,nom,vaseline,la,le,DET,est,être,VERB,c',ce,PRON,pas,pas,ADV,guérit,guérir,VERB,.,.,PUNCT,,,,,,,,,,,,,2020-02-08,2020,2020,,DET Vaseline PUNCT,VERB DET Vaseline,PRON VERB DET Vaseline,ADV PRON VERB DET Vaseline,,,,,le Vaseline .,être le Vaseline,ce être le Vaseline,pas ce être le Vaseline,,,
https://www.telerama.fr/sortir/photo-les-11-expos-a-voir-absolument-en-fevrier-2020-a-paris%2Cn6602238.php,telerama.fr,2020-02-09,France,vaseline/NOM/vaseline,"Pour  réaliser  les  clichés  en  noir  et  blanc  ,  de  la vaseline  a  parfois  été  appliquée  sur  l'  objec  ...",vaseline,nom,vaseline,la,le,DET,de,de,ADP,",",",",PUNCT,blanc,blanc,ADJ,et,et,CONJ,a,avoir,VERB,parfois,parfois,ADV,été,être,VERB,appliquée,appliquer,VERB,sur,sur,ADP,2020-02-09,2020,2020,ADP DET Vaseline VERB ADV,DET Vaseline VERB,ADP DET Vaseline,PUNCT ADP DET Vaseline,ADJ PUNCT ADP DET Vaseline,Vaseline VERB ADV,Vaseline VERB ADV VERB,Vaseline VERB ADV VERB VERB,de le Vaseline avoir parfois,le Vaseline avoir,de le Vaseline,", de le Vaseline","blanc , de le Vaseline",Vaseline avoir parfois,Vaseline avoir parfois être,Vaseline avoir parfois être appliquer
https://www.letemps.ch/societe/samedi-michelle-obama-oprah-winfrey,letemps.ch,2020-02-10,Switzerland,vaseline/NOM/vaseline,"A  l'  intérieur  :  une  barre  chocolatée  et  un  sachet  de  tortillas  WW  ,  un  déodorant  arôme  vanille-poire  ,  un  shampoing  ,  un  stick  de vaseline  contre  les  peaux  sèches  et  un  gel  douche  eau  de  coco  et  fleur  de  mimosa  .",vaseline,nom,vaseline,de,de,ADP,stick,stick,NOUN,un,un,DET,",",",",PUNCT,shampoing,shampoing,NOUN,contre,contre,ADP,les,le,DET,peaux,peau,NOUN,sèches,sèche,ADJ,et,et,CONJ,2020-02-10,2020,2020,NOUN ADP Vaseline ADP DET,ADP Vaseline ADP,NOUN ADP Vaseline,DET NOUN ADP Vaseline,PUNCT DET NOUN ADP Vaseline,Vaseline ADP DET,Vaseline ADP DET NOUN,Vaseline ADP DET NOUN ADJ,stick de Vaseline contre le,de Vaseline contre,stick de Vaseline,un stick de Vaseline,", un stick de Vaseline",Vaseline contre le,Vaseline contre le peau,Vaseline contre le peau sèche
https://www.madmoizelle.com/baume-levres-assechant-1041133,madmoizelle.com,2020-02-11,===NONE===,vaseline/NOM/vaseline,"Si  le  plus  connu  est  la vaseline  ,  je  peux  comprendre  que  tout  le  monde  ne  souhaite  pas  intégrer  de  dérivés  pétrochimiques  dans  ses  produits  de  beauté  .",vaseline,nom,vaseline,la,le,DET,est,être,VERB,connu,connaître,VERB,plus,plus,ADV,le,le,DET,",",",",PUNCT,je,je,PRON,peux,pouvoir,VERB,comprendre,comprendre,VERB,que,que,CONJ,2020-02-11,2020,2020,VERB DET Vaseline PUNCT PRON,DET Vaseline PUNCT,VERB DET Vaseline,VERB VERB DET Vaseline,ADV VERB VERB DET Vaseline,Vaseline PUNCT PRON,Vaseline PUNCT PRON VERB,Vaseline PUNCT PRON VERB VERB,"être le Vaseline , je","le Vaseline ,",être le Vaseline,connaître être le Vaseline,plus connaître être le Vaseline,"Vaseline , je","Vaseline , je pouvoir","Vaseline , je pouvoir comprendre"
