url,website,date,country,keyword,sentence,kw,kw_lemma,kw_pos,left_w1,left_l1,left_p1,left_w2,left_l2,left_p2,left_w3,left_l3,left_p3,left_w4,left_l4,left_p4,left_w5,left_l5,left_p5,right_w1,right_l1,right_p1,right_w2,right_l2,right_p2,right_w3,right_l3,right_p3,right_w4,right_l4,right_p4,right_w5,right_l5,right_p5,datetime,year,10years,pattern_around5,pattern_around3,pattern_left2,pattern_left3,pattern_left4,pattern_right2,pattern_right3,pattern_right4,pattern_around5_lex,pattern_around3_lex,pattern_left2_lex,pattern_left3_lex,pattern_left4_lex,pattern_right2_lex,pattern_right3_lex,pattern_right4_lex
https://www.lamontagne.fr/riom-63200/loisirs/tendance-mode-hivernale-mode-printaniere-faux-pas-les-conseils-des-influenceuses-du-puy-de-dome-a-riom_13724718/,lamontagne.fr,2020-01-19,France,UGG/NAM/UGG,"Le  conseil  de  Laure-Anne  :  ""  Mon  conseil  mode  pour  l'  hiver  c'  est  une  jupe  avec  des  collants  chauds  ,  des  boots  types UGG  ®  ,  indémodable  ,  un  pull  loose  et  un  manteau  long  en  laine  ,  le  tout  avec  un  petit  bonnet  .",ugg,nam,ugg,types,type,NOUN,boots,boots,NOUN,des,du,ADP DET,",",",",PUNCT,chauds,chaud,ADJ,®,®,ADJ,",",",",PUNCT,indémodable,indémodable,ADJ,",",",",PUNCT,un,un,DET,2020-01-19,2020,2020,NOUN NOUN Ugg ADJ PUNCT,NOUN Ugg ADJ,NOUN NOUN Ugg,ADP DET NOUN NOUN Ugg,PUNCT ADP DET NOUN NOUN Ugg,Ugg ADJ PUNCT,Ugg ADJ PUNCT ADJ,Ugg ADJ PUNCT ADJ PUNCT,"boots type Ugg ® ,",type Ugg ®,boots type Ugg,du boots type Ugg,", du boots type Ugg","Ugg ® ,","Ugg ® , indémodable","Ugg ® , indémodable ,"
https://www.bfmtv.com/pratique/soldes-la-redoute-notre-selection-de-chaussures-a-prix-reduits-1846153.html,bfmtv.com,2020-01-23,France,Ugg/NAM/Ugg,"Boots  Classic  mini Ugg  à  127,43  €  au  lieu  de  192  €",ugg,nam,ugg,mini,mini,ADJ,Classic,Classic,PROPN,Boots,Boots,PROPN,,,,,,,à,à,ADP,"127,43",@card@,ADJ,€,€,NOUN,au,au,ADP DET,lieu,lieu,NOUN,2020-01-23,2020,2020,PROPN ADJ Ugg ADP ADJ,ADJ Ugg ADP,PROPN ADJ Ugg,PROPN PROPN ADJ Ugg,,Ugg ADP ADJ,Ugg ADP ADJ NOUN,Ugg ADP ADJ NOUN ADP DET,Classic mini Ugg à @card@,mini Ugg à,Classic mini Ugg,Boots Classic mini Ugg,,Ugg à @card@,Ugg à @card@ €,Ugg à @card@ € au
https://www.telestar.fr/serie-tv/exclu-baron-noir-kad-merad-pret-a-rempiler-pour-une-saison-4-489275,telestar.fr,2020-02-02,France,Ugg/NAM/Ugg,"Certes  ,  il  fallait  arriver  à  l'  incarner  mais  j'  ai  un  scénario  tellement  bien  écrit  qu'  il  suffit  de  rentrer  dedans  comme  dans  des Ugg  !  Sans  chaussettes  ,  en  plus  ""  ,  a-t-il  plaisanté  .",ugg,nam,ugg,des,du,ADP DET,dans,dans,ADP,comme,comme,ADV,dedans,dedans,ADV,rentrer,rentrer,VERB,!,!,PUNCT,Sans,sans,ADP,chaussettes,chaussette,NOUN,",",",",PUNCT,en,en,ADP,2020-02-02,2020,2020,ADP ADP DET Ugg PUNCT ADP,ADP DET Ugg PUNCT,ADP ADP DET Ugg,ADV ADP ADP DET Ugg,ADV ADV ADP ADP DET Ugg,Ugg PUNCT ADP,Ugg PUNCT ADP NOUN,Ugg PUNCT ADP NOUN PUNCT,dans du Ugg ! sans,du Ugg !,dans du Ugg,comme dans du Ugg,dedans comme dans du Ugg,Ugg ! sans,Ugg ! sans chaussette,"Ugg ! sans chaussette ,"
https://www.bfmtv.com/pratique/soldes-la-redoute-60percent-sur-la-mode-et-la-maison-1851913.html,bfmtv.com,2020-02-04,France,UGG/NAM/UGG,"Poussette  trio  step  and  go  Safety  first  à  239,84  €  au  lieu  de  449,99  €  (  -  47  %  )  Parka  à  capuche  imperméable  FERRIS  Quiksilver  à  139,99  €  au  lieu  de  199,99  €  (  -  30  %  )  Boots  Fluff  mini  quilted UGG  à  127,96  €  au  lieu  de  159,95  €  (  -  20  %  )  Combi-pilote  déperlante  BOSS  à  118,30  €  au  lieu  de  169  €  (  -  30  %  )",ugg,nam,ugg,quilted,quilted,NOUN,mini,mini,ADJ,Fluff,Fluff,PROPN,Boots,Boots,PROPN,),),PUNCT,à,à,ADP,"127,96",@card@,ADJ,€,€,NOUN,au,au,ADP DET,lieu,lieu,NOUN,2020-02-04,2020,2020,ADJ NOUN Ugg ADP ADJ,NOUN Ugg ADP,ADJ NOUN Ugg,PROPN ADJ NOUN Ugg,PROPN PROPN ADJ NOUN Ugg,Ugg ADP ADJ,Ugg ADP ADJ NOUN,Ugg ADP ADJ NOUN ADP DET,mini quilted Ugg à @card@,quilted Ugg à,mini quilted Ugg,Fluff mini quilted Ugg,Boots Fluff mini quilted Ugg,Ugg à @card@,Ugg à @card@ €,Ugg à @card@ € au
https://www.journaldesfemmes.fr/mariage/organisation/1827997-evjf-kate-pippa-middleton/,journaldesfemmes.fr,2020-02-17,France,Ugg/NAM/Ugg,"""  Ils  leur  ont  offert  des  montres  Swatch  ,  des  pantoufles Ugg  ,  des  cahiers  en  cuir  et  des  parfums  réalisés  sur-mesure  .",ugg,nam,ugg,pantoufles,pantoufle,NOUN,des,du,ADP DET,",",",",PUNCT,Swatch,Swatch,PROPN,montres,montre,NOUN,",",",",PUNCT,des,du,ADP DET,cahiers,cahier,NOUN,en,en,ADP,cuir,cuir,NOUN,2020-02-17,2020,2020,ADP DET NOUN Ugg PUNCT ADP DET,NOUN Ugg PUNCT,ADP DET NOUN Ugg,PUNCT ADP DET NOUN Ugg,PROPN PUNCT ADP DET NOUN Ugg,Ugg PUNCT ADP DET,Ugg PUNCT ADP DET NOUN,Ugg PUNCT ADP DET NOUN ADP,"du pantoufle Ugg , du","pantoufle Ugg ,",du pantoufle Ugg,", du pantoufle Ugg","Swatch , du pantoufle Ugg","Ugg , du","Ugg , du cahier","Ugg , du cahier en"
https://www.gala.fr/mode/tendances_mode/photos-25-bottines-qui-apportent-une-touche-rock-a-votre-tenue_443375,gala.fr,2020-02-18,France,UGG/NAM/UGG,"Ultra-confortables  ,  les  bottines  fourrées UGG  deviennent  alors  un  véritable  fashion  statement  .",ugg,nam,ugg,fourrées,fourré,ADJ,bottines,bottine,NOUN,les,le,DET,",",",",PUNCT,Ultra-confortables,Ultra-confortables,ADJ,deviennent,devenir,VERB,alors,alors,ADV,un,un,DET,véritable,véritable,ADJ,fashion,fashion,NOUN,2020-02-18,2020,2020,NOUN ADJ Ugg VERB ADV,ADJ Ugg VERB,NOUN ADJ Ugg,DET NOUN ADJ Ugg,PUNCT DET NOUN ADJ Ugg,Ugg VERB ADV,Ugg VERB ADV DET,Ugg VERB ADV DET ADJ,bottine fourré Ugg devenir alors,fourré Ugg devenir,bottine fourré Ugg,le bottine fourré Ugg,", le bottine fourré Ugg",Ugg devenir alors,Ugg devenir alors un,Ugg devenir alors un véritable
https://www.voici.fr/mode/10-facons-de-porter-des-baskets-655847,voici.fr,2020-04-10,France,UGG/NAM/UGG,>>>  Les  influenceuses  se  les  arrachent  toutes  :  les  boots UGG ,ugg,nam,ugg,boots,boots,NOUN,les,le,DET,:,:,PUNCT,toutes,tout,PRON,arrachent,arracher,VERB,,,,,,,,,,,,,,,,2020-04-10,2020,2020,,,DET NOUN Ugg,PUNCT DET NOUN Ugg,PRON PUNCT DET NOUN Ugg,,,,,,le boots Ugg,: le boots Ugg,tout : le boots Ugg,,,
https://viacomit.net/2020/05/05/ugg-devoile-ca805-x-thermal-sneaker/,viacomit.net,2020-05-05,===NONE===,UGG/NAM/UGG,<doc uri=https://viacomit.net/2020/05/05/ugg-devoile-ca805-x-thermal-sneaker/ website=viacomit.net date=2020-05-05 source_country=> UGG  dévoile  la  CA  805  x  Thermal  Sneaker,ugg,nam,ugg,,,,,,,,,,,,,,,,dévoile,dévoiler,VERB,la,le,DET,CA,CA,NOUN,805,@card@,ADJ,x,x,NOUN,2020-05-05,2020,2020,,,,,,Ugg VERB DET,Ugg VERB DET NOUN,Ugg VERB DET NOUN ADJ,,,,,,Ugg dévoiler le,Ugg dévoiler le CA,Ugg dévoiler le CA @card@
https://viacomit.net/2020/05/05/ugg-devoile-ca805-x-thermal-sneaker/,viacomit.net,2020-05-05,===NONE===,UGG/NAM/UGG,"Après  le  lancement  de  sa  collection  de  modèles  de  sneakers  en  édition  limitée  12  ×  12  en  janvier  2020  , UGG  présente  son  quatrième  drop  mensuel  de  l'  année  ,  la  CA  805  x  Thermal  Sneaker  .",ugg,nam,ugg,",",",",PUNCT,2020,@card@,ADJ,janvier,janvier,NOUN,en,en,ADP,12,@card@,ADJ,présente,présenter,VERB,son,son,DET,quatrième,quatrième,ADJ,drop,drop,NOUN,mensuel,mensuel,ADJ,2020-05-05,2020,2020,ADJ PUNCT Ugg VERB DET,PUNCT Ugg VERB,ADJ PUNCT Ugg,NOUN ADJ PUNCT Ugg,ADP NOUN ADJ PUNCT Ugg,Ugg VERB DET,Ugg VERB DET ADJ,Ugg VERB DET ADJ NOUN,"@card@ , Ugg présenter son",", Ugg présenter","@card@ , Ugg","janvier @card@ , Ugg","en janvier @card@ , Ugg",Ugg présenter son,Ugg présenter son quatrième,Ugg présenter son quatrième drop
https://viacomit.net/2020/05/05/ugg-devoile-ca805-x-thermal-sneaker/,viacomit.net,2020-05-05,===NONE===,UGG/NAM/UGG,"Avec  le  modèle  CA  805  x  Thermal  Sneaker  , UGG  met  en  avant  la  culture  disruptive  de  la  Silicon  Valley  ,  région  à  la  pointe  des  nouvelles  technologies  .",ugg,nam,ugg,",",",",PUNCT,Sneaker,Sneaker,PROPN,Thermal,Thermal,PROPN,x,x,NOUN,805,@card@,ADJ,met,mettre,VERB,en,en,ADP,avant,avant,ADP,la,le,DET,culture,culture,NOUN,2020-05-05,2020,2020,PROPN PUNCT Ugg VERB ADP,PUNCT Ugg VERB,PROPN PUNCT Ugg,PROPN PROPN PUNCT Ugg,NOUN PROPN PROPN PUNCT Ugg,Ugg VERB ADP,Ugg VERB ADP ADP,Ugg VERB ADP ADP DET,"Sneaker , Ugg mettre en",", Ugg mettre","Sneaker , Ugg","Thermal Sneaker , Ugg","x Thermal Sneaker , Ugg",Ugg mettre en,Ugg mettre en avant,Ugg mettre en avant le
https://viacomit.net/2020/05/05/ugg-devoile-ca805-x-thermal-sneaker/,viacomit.net,2020-05-05,===NONE===,UGG/NAM/UGG,Le  modèle  est  disponible  en  deux  coloris  pour  varier  les  plaisirs  et  est  disponible  en  édition  limitée  sur  le  site  officiel  de UGG  . </doc>,ugg,nam,ugg,de,de,ADP,officiel,officiel,ADJ,site,site,NOUN,le,le,DET,sur,sur,ADP,.,.,PUNCT,</doc>,,,,,,,,,,,,2020-05-05,2020,2020,,ADP Ugg PUNCT,ADJ ADP Ugg,NOUN ADJ ADP Ugg,DET NOUN ADJ ADP Ugg,,,,,de Ugg .,officiel de Ugg,site officiel de Ugg,le site officiel de Ugg,,,
https://www.lindependant.fr/2020/05/10/ugg-presente-une-paire-de-sneakers-qui-change-en-fonction-de-la-temperature%2C8881565.php,lindependant.fr,2020-05-10,France,UGG/NAM/UGG,<doc uri=https://www.lindependant.fr/2020/05/10/ugg-presente-une-paire-de-sneakers-qui-change-en-fonction-de-la-temperature%2C8881565.php website=lindependant.fr date=2020-05-10 source_country=France> UGG  présente  une  paire  de  sneakers  qui  change  en  fonction  de  la  température,ugg,nam,ugg,,,,,,,,,,,,,,,,présente,présenter,VERB,une,un,DET,paire,paire,NOUN,de,de,ADP,sneakers,sneaker,NOUN,2020-05-10,2020,2020,,,,,,Ugg VERB DET,Ugg VERB DET NOUN,Ugg VERB DET NOUN ADP,,,,,,Ugg présenter un,Ugg présenter un paire,Ugg présenter un paire de
https://www.lindependant.fr/2020/05/10/ugg-presente-une-paire-de-sneakers-qui-change-en-fonction-de-la-temperature%2C8881565.php,lindependant.fr,2020-05-10,France,UGG/NAM/UGG,"(  Relaxnews  )  -  La  marque UGG  enrichit  sa  collection  12  X  12  avec  le  lancement  de  la  sneaker  ""  CA  805  x  Thermal  ""  dont  la  couleur  évolue  selon  la  température  .",ugg,nam,ugg,marque,marque,NOUN,La,le,DET,-,-,PUNCT,),),PUNCT,Relaxnews,Relaxnews,NOUN,enrichit,enrichir,VERB,sa,son,DET,collection,collection,NOUN,12,@card@,ADJ,X,X,ADJ,2020-05-10,2020,2020,DET NOUN Ugg VERB DET,NOUN Ugg VERB,DET NOUN Ugg,PUNCT DET NOUN Ugg,PUNCT PUNCT DET NOUN Ugg,Ugg VERB DET,Ugg VERB DET NOUN,Ugg VERB DET NOUN ADJ,le marque Ugg enrichir son,marque Ugg enrichir,le marque Ugg,- le marque Ugg,) - le marque Ugg,Ugg enrichir son,Ugg enrichir son collection,Ugg enrichir son collection @card@
https://www.lindependant.fr/2020/05/10/ugg-presente-une-paire-de-sneakers-qui-change-en-fonction-de-la-temperature%2C8881565.php,lindependant.fr,2020-05-10,France,UGG/NAM/UGG,"Avec  sa  collection  12  X  12  ,  dont  le  concept  est  de  présenter  une  paire  de  sneakers  par  mois  tout  au  long  de  l'  année  2020  ,  la  marque UGG  a  décidé  de  célébrer  la  Californie  à  travers  différentes  sources  d'  inspiration  .",ugg,nam,ugg,marque,marque,NOUN,la,le,DET,",",",",PUNCT,2020,@card@,ADJ,année,année,NOUN,a,avoir,VERB,décidé,décider,VERB,de,de,ADP,célébrer,célébrer,VERB,la,le,DET,2020-05-10,2020,2020,DET NOUN Ugg VERB VERB,NOUN Ugg VERB,DET NOUN Ugg,PUNCT DET NOUN Ugg,ADJ PUNCT DET NOUN Ugg,Ugg VERB VERB,Ugg VERB VERB ADP,Ugg VERB VERB ADP VERB,le marque Ugg avoir décider,marque Ugg avoir,le marque Ugg,", le marque Ugg","@card@ , le marque Ugg",Ugg avoir décider,Ugg avoir décider de,Ugg avoir décider de célébrer
https://www.lindependant.fr/2020/05/10/ugg-presente-une-paire-de-sneakers-qui-change-en-fonction-de-la-temperature%2C8881565.php,lindependant.fr,2020-05-10,France,Ugg/NAM/Ugg,"Cette  création  innovante  est  disponible  en  édition  limitée  en  ligne  sur Ugg  .  com  au  prix  de  149,95  euros  .",ugg,nam,ugg,sur,sur,ADP,ligne,ligne,NOUN,en,en,ADP,limitée,limiter,VERB,édition,édition,NOUN,.,.,PUNCT,com,com,NOUN,au,au,ADP DET,prix,prix,NOUN,de,de,ADP,2020-05-10,2020,2020,NOUN ADP Ugg PUNCT NOUN,ADP Ugg PUNCT,NOUN ADP Ugg,ADP NOUN ADP Ugg,VERB ADP NOUN ADP Ugg,Ugg PUNCT NOUN,Ugg PUNCT NOUN ADP DET,Ugg PUNCT NOUN ADP DET NOUN,ligne sur Ugg . com,sur Ugg .,ligne sur Ugg,en ligne sur Ugg,limiter en ligne sur Ugg,Ugg . com,Ugg . com au,Ugg . com au prix
https://mcetv.fr/mon-mag-buzz/people/cardi-b-balenciaga-versace-marques-luxe-couvrent-cadeaux-14052020/,mcetv.fr,2020-05-14,France,Ugg/NAM/Ugg,La  chanteuse  a  reçu  de  nombreuses  paires  de  chaussures  de  chez Ugg  .,ugg,nam,ugg,chez,chez,ADP,de,de,ADP,chaussures,chaussure,NOUN,de,de,ADP,paires,paire,NOUN,.,.,PUNCT,,,,,,,,,,,,,2020-05-14,2020,2020,,ADP Ugg PUNCT,ADP ADP Ugg,NOUN ADP ADP Ugg,ADP NOUN ADP ADP Ugg,,,,,chez Ugg .,de chez Ugg,chaussure de chez Ugg,de chaussure de chez Ugg,,,
https://viacomit.net/2020/06/07/ugg-ca805-x-cali-sunset-sneaker/,viacomit.net,2020-06-07,===NONE===,UGG/NAM/UGG,<doc uri=https://viacomit.net/2020/06/07/ugg-ca805-x-cali-sunset-sneaker/ website=viacomit.net date=2020-06-07 source_country=> UGG  dévoile  sa  nouvelle  CA  805  x  Cali  Sunset  Sneaker,ugg,nam,ugg,,,,,,,,,,,,,,,,dévoile,dévoiler,VERB,sa,son,DET,nouvelle,nouveau,ADJ,CA,CA,NOUN,805,@card@,ADJ,2020-06-07,2020,2020,,,,,,Ugg VERB DET,Ugg VERB DET ADJ,Ugg VERB DET ADJ NOUN,,,,,,Ugg dévoiler son,Ugg dévoiler son nouveau,Ugg dévoiler son nouveau CA
https://viacomit.net/2020/06/07/ugg-ca805-x-cali-sunset-sneaker/,viacomit.net,2020-06-07,===NONE===,UGG/NAM/UGG," UGG  présente  son  cinquième  drop  mensuel  de  l'  année  ,  la  CA  805  x  Cali  Sunset  Sneaker  .",ugg,nam,ugg,,,,,,,,,,,,,,,,présente,présenter,VERB,son,son,DET,cinquième,cinquième,ADJ,drop,drop,NOUN,mensuel,mensuel,ADJ,2020-06-07,2020,2020,,,,,,Ugg VERB DET,Ugg VERB DET ADJ,Ugg VERB DET ADJ NOUN,,,,,,Ugg présenter son,Ugg présenter son cinquième,Ugg présenter son cinquième drop
https://viacomit.net/2020/06/07/ugg-ca805-x-cali-sunset-sneaker/,viacomit.net,2020-06-07,===NONE===,UGG/NAM/UGG,"Avec  son  coucher  de  soleil  incomparable  ,  devenu  l'  inspiration  de  nombreux  artistes  à  travers  ,  le  monde  ,  la  côte  californienne  est  l'  inspiration  première  de  la UGG  CA  805  x  Cali  Sunset  Sneaker  .",ugg,nam,ugg,la,le,DET,de,de,ADP,première,premier,ADJ,inspiration,inspiration,NOUN,l',le,DET,CA,CA,PROPN,805,@card@,ADJ,x,x,NOUN,Cali,Cali,PROPN,Sunset,Sunset,PROPN,2020-06-07,2020,2020,ADP DET Ugg PROPN ADJ,DET Ugg PROPN,ADP DET Ugg,ADJ ADP DET Ugg,NOUN ADJ ADP DET Ugg,Ugg PROPN ADJ,Ugg PROPN ADJ NOUN,Ugg PROPN ADJ NOUN PROPN,de le Ugg CA @card@,le Ugg CA,de le Ugg,premier de le Ugg,inspiration premier de le Ugg,Ugg CA @card@,Ugg CA @card@ x,Ugg CA @card@ x Cali
https://viacomit.net/2020/06/07/ugg-ca805-x-cali-sunset-sneaker/,viacomit.net,2020-06-07,===NONE===,UGG/NAM/UGG,La  CA  805  x  Cali  Sunset  Sneaker  est  disponible  en  édition  limitée  dans  la  boutique  online  de UGG  . </doc>,ugg,nam,ugg,de,de,ADP,online,online,NOUN,boutique,boutique,NOUN,la,le,DET,dans,dans,ADP,.,.,PUNCT,</doc>,,,,,,,,,,,,2020-06-07,2020,2020,,ADP Ugg PUNCT,NOUN ADP Ugg,NOUN NOUN ADP Ugg,DET NOUN NOUN ADP Ugg,,,,,de Ugg .,online de Ugg,boutique online de Ugg,le boutique online de Ugg,,,
https://viacomit.net/2020/06/11/ugg-sengage-nouvelle-campagne-pride/,viacomit.net,2020-06-11,===NONE===,UGG/NAM/UGG,<doc uri=https://viacomit.net/2020/06/11/ugg-sengage-nouvelle-campagne-pride/ website=viacomit.net date=2020-06-11 source_country=> UGG  s'  engage  avec  sa  nouvelle  campagne  Pride,ugg,nam,ugg,,,,,,,,,,,,,,,,s',se,PRON,engage,engager,VERB,avec,avec,ADP,sa,son,DET,nouvelle,nouveau,ADJ,2020-06-11,2020,2020,,,,,,Ugg PRON VERB,Ugg PRON VERB ADP,Ugg PRON VERB ADP DET,,,,,,Ugg se engager,Ugg se engager avec,Ugg se engager avec son
https://viacomit.net/2020/06/11/ugg-sengage-nouvelle-campagne-pride/,viacomit.net,2020-06-11,===NONE===,UGG/NAM/UGG,"Pour  célébrer  la  Pride  , UGG  de  lancer  sa  campagne  #  UGGPRIDE  mettant  en  avant  sa  collection  unisexe  Pride  en  soutien  à  la  communauté  LGBTQ  +  .",ugg,nam,ugg,",",",",PUNCT,Pride,Pride,NOUN,la,le,DET,célébrer,célébrer,VERB,Pour,Pour,NOUN,de,de,ADP,lancer,lancer,VERB,sa,son,DET,campagne,campagne,NOUN,#,#,ADJ,2020-06-11,2020,2020,NOUN PUNCT Ugg ADP VERB,PUNCT Ugg ADP,NOUN PUNCT Ugg,DET NOUN PUNCT Ugg,VERB DET NOUN PUNCT Ugg,Ugg ADP VERB,Ugg ADP VERB DET,Ugg ADP VERB DET NOUN,"Pride , Ugg de lancer",", Ugg de","Pride , Ugg","le Pride , Ugg","célébrer le Pride , Ugg",Ugg de lancer,Ugg de lancer son,Ugg de lancer son campagne
https://viacomit.net/2020/06/11/ugg-sengage-nouvelle-campagne-pride/,viacomit.net,2020-06-11,===NONE===,UGG/NAM/UGG,"A  cette  occasion  , UGG  s'  associe  à  son  partenaire  de  longue  date  GLAAD  -  une  association  américaine  qui  lutte  pour  l'  acceptation  des  LGBTQ  +  et  une  société  plus  égalitaire  -  et  fait  un  don  de  125  0  0  0  dollars  sur  l'  année  2020  pour  soutenir  les  programmes  culturels  de  l'  association  ,  à  travers  notamment  le  GLAAD  Media  Institute  .",ugg,nam,ugg,",",",",PUNCT,occasion,occasion,NOUN,cette,ce,PRON,A,à,ADP,,,,s',se,PRON,associe,associer,VERB,à,à,ADP,son,son,DET,partenaire,partenaire,NOUN,2020-06-11,2020,2020,NOUN PUNCT Ugg PRON VERB,PUNCT Ugg PRON,NOUN PUNCT Ugg,PRON NOUN PUNCT Ugg,ADP PRON NOUN PUNCT Ugg,Ugg PRON VERB,Ugg PRON VERB ADP,Ugg PRON VERB ADP DET,"occasion , Ugg se associer",", Ugg se","occasion , Ugg","ce occasion , Ugg","à ce occasion , Ugg",Ugg se associer,Ugg se associer à,Ugg se associer à son
https://viacomit.net/2020/06/11/ugg-sengage-nouvelle-campagne-pride/,viacomit.net,2020-06-11,===NONE===,UGG/NAM/UGG,"Pour  commémorer  cette  collection  capsule  , UGG  a  shooté  la  campagne  #  UGGPRIDE  à  son  événement  ""  PROUD  Prom  ""  au  mois  de  février  dernier  .",ugg,nam,ugg,",",",",PUNCT,capsule,capsuler,VERB,collection,collection,NOUN,cette,ce,PRON,commémorer,commémorer,VERB,a,avoir,VERB,shooté,shooter,VERB,la,le,DET,campagne,campagne,NOUN,#,#,ADJ,2020-06-11,2020,2020,VERB PUNCT Ugg VERB VERB,PUNCT Ugg VERB,VERB PUNCT Ugg,NOUN VERB PUNCT Ugg,PRON NOUN VERB PUNCT Ugg,Ugg VERB VERB,Ugg VERB VERB DET,Ugg VERB VERB DET NOUN,"capsuler , Ugg avoir shooter",", Ugg avoir","capsuler , Ugg","collection capsuler , Ugg","ce collection capsuler , Ugg",Ugg avoir shooter,Ugg avoir shooter le,Ugg avoir shooter le campagne
https://viacomit.net/2020/06/11/ugg-sengage-nouvelle-campagne-pride/,viacomit.net,2020-06-11,===NONE===,UGG/NAM/UGG,Cette  célébration  annuelle  est  présentée  par  la  Pacific  Pride  Foundation  et UGG  au  siège  social  du  groupe  Deckers  .,ugg,nam,ugg,et,et,CONJ,Foundation,Foundation,PROPN,Pride,Pride,PROPN,Pacific,Pacific,PROPN,la,le,DET,au,au,ADP DET,siège,siège,NOUN,social,social,ADJ,du,du,ADP DET,groupe,groupe,NOUN,2020-06-11,2020,2020,PROPN CONJ Ugg ADP DET NOUN,CONJ Ugg ADP DET,PROPN CONJ Ugg,PROPN PROPN CONJ Ugg,PROPN PROPN PROPN CONJ Ugg,Ugg ADP DET NOUN,Ugg ADP DET NOUN ADJ,Ugg ADP DET NOUN ADJ ADP DET,Foundation et Ugg au siège,et Ugg au,Foundation et Ugg,Pride Foundation et Ugg,Pacific Pride Foundation et Ugg,Ugg au siège,Ugg au siège social,Ugg au siège social du
https://viacomit.net/2020/06/11/ugg-sengage-nouvelle-campagne-pride/,viacomit.net,2020-06-11,===NONE===,UGG/NAM/UGG," UGG  dévoile  un  nouveau  modèle  de  chaussures  pour  sa  collection  Pride  ,  la  Disco  Checker  Slide  et  le  modèle  iconique  Fluff  Yeah  est  toujours  de  la  partie  ,  dans  des  coloris  rappelant  le  drapeau  LGBT  .",ugg,nam,ugg,,,,,,,,,,,,,,,,dévoile,dévoiler,VERB,un,un,DET,nouveau,nouveau,ADJ,modèle,modèle,NOUN,de,de,ADP,2020-06-11,2020,2020,,,,,,Ugg VERB DET,Ugg VERB DET ADJ,Ugg VERB DET ADJ NOUN,,,,,,Ugg dévoiler un,Ugg dévoiler un nouveau,Ugg dévoiler un nouveau modèle
https://viacomit.net/2020/06/11/ugg-sengage-nouvelle-campagne-pride/,viacomit.net,2020-06-11,===NONE===,UGG/NAM/UGG,La  Pride  Collection  est  dès  maintenant  disponible  dans  la  boutique  en-ligne  de UGG  . </doc>,ugg,nam,ugg,de,de,ADP,en-ligne,en-ligne,NOUN,boutique,boutique,NOUN,la,le,DET,dans,dans,ADP,.,.,PUNCT,</doc>,,,,,,,,,,,,2020-06-11,2020,2020,,ADP Ugg PUNCT,NOUN ADP Ugg,NOUN NOUN ADP Ugg,DET NOUN NOUN ADP Ugg,,,,,de Ugg .,en-ligne de Ugg,boutique en-ligne de Ugg,le boutique en-ligne de Ugg,,,
https://www.lindependant.fr/2020/06/12/mois-des-fiertes-ugg-se-mobilise-avec-une-collection-et-une-campagne%2C8929498.php,lindependant.fr,2020-06-12,France,UGG/NAM/UGG,<doc uri=https://www.lindependant.fr/2020/06/12/mois-des-fiertes-ugg-se-mobilise-avec-une-collection-et-une-campagne%2C8929498.php website=lindependant.fr date=2020-06-12 source_country=France> /moi|mois/NOM /du/PRP:det /fierté/NOM /:/PUN UGG  se  mobilise  avec  une  collection  et  une  campagne,ugg,nam,ugg,:,:,PUNCT,fiertés,fierté,NOUN,des,du,ADP DET,Mois,moi|mois,NOUN,,,,se,se,PRON,mobilise,mobiliser,VERB,avec,avec,ADP,une,un,DET,collection,collection,NOUN,2020-06-12,2020,2020,NOUN PUNCT Ugg PRON VERB,PUNCT Ugg PRON,NOUN PUNCT Ugg,ADP DET NOUN PUNCT Ugg,NOUN ADP DET NOUN PUNCT Ugg,Ugg PRON VERB,Ugg PRON VERB ADP,Ugg PRON VERB ADP DET,fierté : Ugg se mobiliser,: Ugg se,fierté : Ugg,du fierté : Ugg,moi|mois du fierté : Ugg,Ugg se mobiliser,Ugg se mobiliser avec,Ugg se mobiliser avec un
https://www.lindependant.fr/2020/06/12/mois-des-fiertes-ugg-se-mobilise-avec-une-collection-et-une-campagne%2C8929498.php,lindependant.fr,2020-06-12,France,UGG/NAM/UGG,"(  Relaxnews  )  -  Engagée  depuis  plusieurs  années  au  côté  de  la  communauté  LGBTQ  +  , UGG  annonce  le  lancement  de  la  campagne  ""  #  UGGPRIDE  ""  mettant  à  l'  honneur  sa  collection  unisexe  Pride  .",ugg,nam,ugg,",",",",PUNCT,+,+,SYM,LGBTQ,LGBTQ,PROPN,communauté,communauté,NOUN,la,le,DET,annonce,annoncer,VERB,le,le,DET,lancement,lancement,NOUN,de,de,ADP,la,le,DET,2020-06-12,2020,2020,SYM PUNCT Ugg VERB DET,PUNCT Ugg VERB,SYM PUNCT Ugg,PROPN SYM PUNCT Ugg,NOUN PROPN SYM PUNCT Ugg,Ugg VERB DET,Ugg VERB DET NOUN,Ugg VERB DET NOUN ADP,"+ , Ugg annoncer le",", Ugg annoncer","+ , Ugg","LGBTQ + , Ugg","communauté LGBTQ + , Ugg",Ugg annoncer le,Ugg annoncer le lancement,Ugg annoncer le lancement de
https://www.lindependant.fr/2020/06/12/mois-des-fiertes-ugg-se-mobilise-avec-une-collection-et-une-campagne%2C8929498.php,lindependant.fr,2020-06-12,France,UGG/NAM/UGG,"C'  est  le  cas  de UGG  qui  présente  une  toute  nouvelle  campagne  pour  mettre  en  lumière  sa  collection  unisexe  Pride  ,  et  annonce  un  don  de  125.000  dollars  en  2020  à  destination  du  GLAAD  Media  Institute  pour  soutenir  les  programmes  culturels  de  l'  association  .",ugg,nam,ugg,de,de,ADP,cas,cas,NOUN,le,le,DET,est,être,VERB,C',ce,PRON,qui,qui,PRON,présente,présenter,VERB,une,un,DET,toute,tout,PRON,nouvelle,nouveau,ADJ,2020-06-12,2020,2020,NOUN ADP Ugg PRON VERB,ADP Ugg PRON,NOUN ADP Ugg,DET NOUN ADP Ugg,VERB DET NOUN ADP Ugg,Ugg PRON VERB,Ugg PRON VERB DET,Ugg PRON VERB DET PRON,cas de Ugg qui présenter,de Ugg qui,cas de Ugg,le cas de Ugg,être le cas de Ugg,Ugg qui présenter,Ugg qui présenter un,Ugg qui présenter un tout
https://www.lindependant.fr/2020/06/12/mois-des-fiertes-ugg-se-mobilise-avec-une-collection-et-une-campagne%2C8929498.php,lindependant.fr,2020-06-12,France,UGG/NAM/UGG,"Il  s'  agit  d'  un  événement  annuel  ,  présenté  par  la  Pacific  Pride  Foundation  et UGG  ,  réunissant  des  jeunes  LGBTQ  +  du  comté  de  Santa  Barbara  pour  mettre  à  l'  honneur  et  célébrer  la  diversité  ,  l'  égalité  ,  et  l'  inclusivité  .",ugg,nam,ugg,et,et,CONJ,Foundation,Foundation,PROPN,Pride,Pride,PROPN,Pacific,Pacific,PROPN,la,le,DET,",",",",PUNCT,réunissant,réunir,VERB,des,du,ADP DET,jeunes,jeune,NOUN,LGBTQ,LGBTQ,PROPN,2020-06-12,2020,2020,PROPN CONJ Ugg PUNCT VERB,CONJ Ugg PUNCT,PROPN CONJ Ugg,PROPN PROPN CONJ Ugg,PROPN PROPN PROPN CONJ Ugg,Ugg PUNCT VERB,Ugg PUNCT VERB ADP DET,Ugg PUNCT VERB ADP DET NOUN,"Foundation et Ugg , réunir","et Ugg ,",Foundation et Ugg,Pride Foundation et Ugg,Pacific Pride Foundation et Ugg,"Ugg , réunir","Ugg , réunir du","Ugg , réunir du jeune"
https://www.lindependant.fr/2020/06/12/mois-des-fiertes-ugg-se-mobilise-avec-une-collection-et-une-campagne%2C8929498.php,lindependant.fr,2020-06-12,France,UGG/NAM/UGG," UGG  ne  s'  arrête  pas  là  et  lève  le  voile  sur  la  Disco  Checker  Slide  ,  une  nouvelle  paire  de  chaussures  aux  couleurs  de  l'  emblématique  drapeau  arc-en-ciel  qui  vient  enrichir  sa  collection  Pride  .",ugg,nam,ugg,,,,,,,,,,,,,,,,ne,ne,ADV,s',se,PRON,arrête,arrêter,VERB,pas,pas,ADV,là,là,ADV,2020-06-12,2020,2020,,,,,,Ugg ADV PRON,Ugg ADV PRON VERB,Ugg ADV PRON VERB ADV,,,,,,Ugg ne se,Ugg ne se arrêter,Ugg ne se arrêter pas
https://www.lindependant.fr/2020/06/12/mois-des-fiertes-ugg-se-mobilise-avec-une-collection-et-une-campagne%2C8929498.php,lindependant.fr,2020-06-12,France,UGG/NAM/UGG,"""  Avec  son  événement  '  PROUD  Prom  '  et  sa  collection  Pride  , UGG  s'  engage  et  permet  à  la  jeunesse  LGBTQ  d'  exprimer  sa  fierté  grâce  à  ces  paires  .",ugg,nam,ugg,",",",",PUNCT,Pride,Pride,PROPN,collection,collection,NOUN,sa,son,DET,et,et,CONJ,s',se,PRON,engage,engager,VERB,et,et,CONJ,permet,permettre,VERB,à,à,ADP,2020-06-12,2020,2020,PROPN PUNCT Ugg PRON VERB,PUNCT Ugg PRON,PROPN PUNCT Ugg,NOUN PROPN PUNCT Ugg,DET NOUN PROPN PUNCT Ugg,Ugg PRON VERB,Ugg PRON VERB CONJ,Ugg PRON VERB CONJ VERB,"Pride , Ugg se engager",", Ugg se","Pride , Ugg","collection Pride , Ugg","son collection Pride , Ugg",Ugg se engager,Ugg se engager et,Ugg se engager et permettre
