url,website,date,country,keyword,sentence,kw,kw_lemma,kw_pos,left_w1,left_l1,left_p1,left_w2,left_l2,left_p2,left_w3,left_l3,left_p3,left_w4,left_l4,left_p4,left_w5,left_l5,left_p5,right_w1,right_l1,right_p1,right_w2,right_l2,right_p2,right_w3,right_l3,right_p3,right_w4,right_l4,right_p4,right_w5,right_l5,right_p5,datetime,year,10years,pattern_around5,pattern_around3,pattern_left2,pattern_left3,pattern_left4,pattern_right2,pattern_right3,pattern_right4,pattern_around5_lex,pattern_around3_lex,pattern_left2_lex,pattern_left3_lex,pattern_left4_lex,pattern_right2_lex,pattern_right3_lex,pattern_right4_lex
https://laval.maville.com/actu/actudet_-laval.-le-festival-pour-enfants-monte-dans-l-bus-annonce-ses-spectacles_loc-3648908_actu.Htm?xtor=RSS-4,maville.com,2019-02-14,===NONE===,Comicolor/NAM/Comicolor,"Le  lendemain  ,  un  ciné  concert  "" Comicolor  par  GaBLé  ""  sera  joué  à  partir  de  18  h  30  (  à  partir  de  6  ans  )  .",comicolor,nam,comicolor,"""","""",PUNCT,concert,concert,NOUN,ciné,ciné,NOUN,un,un,DET,",",",",PUNCT,par,par,ADP,GaBLé,GaBLé,PROPN,"""","""",PUNCT,sera,être,VERB,joué,jouer,VERB,2019-02-14,2019,2010,NOUN PUNCT Micolor ADP PROPN,PUNCT Micolor ADP,NOUN PUNCT Micolor,NOUN NOUN PUNCT Micolor,DET NOUN NOUN PUNCT Micolor,Micolor ADP PROPN,Micolor ADP PROPN PUNCT,Micolor ADP PROPN PUNCT VERB,"concert "" Micolor par GaBLé",""" Micolor par","concert "" Micolor","ciné concert "" Micolor","un ciné concert "" Micolor",Micolor par GaBLé,"Micolor par GaBLé ""","Micolor par GaBLé "" être"
https://www.francebleu.fr/infos/faits-divers-justice/violent-incendie-a-l-usine-chimicolor-de-buzancais-1555417994,francebleu.fr,2019-04-16,France,Chimicolor/NAM/Chimicolor,<doc uri=https://www.francebleu.fr/infos/faits-divers-justice/violent-incendie-a-l-usine-chimicolor-de-buzancais-1555417994 website=francebleu.fr date=2019-04-16 source_country=France> /incendie/NOM /à/PRP /le/DET:ART /usine/NOM Chimicolor  de  Buzançais  :  les  pompiers  ont  déployé  d'  importants  moyens,chimicolor,nam,chimicolor,usine,usine,NOUN,l',le,DET,à,à,ADP,Incendie,incendie,NOUN,,,,de,de,ADP,Buzançais,Buzançais,PROPN,:,:,PUNCT,les,le,DET,pompiers,pompier,NOUN,2019-04-16,2019,2010,DET NOUN Micolor ADP PROPN,NOUN Micolor ADP,DET NOUN Micolor,ADP DET NOUN Micolor,NOUN ADP DET NOUN Micolor,Micolor ADP PROPN,Micolor ADP PROPN PUNCT,Micolor ADP PROPN PUNCT DET,le usine Micolor de Buzançais,usine Micolor de,le usine Micolor,à le usine Micolor,incendie à le usine Micolor,Micolor de Buzançais,Micolor de Buzançais :,Micolor de Buzançais : le
https://www.francebleu.fr/infos/faits-divers-justice/violent-incendie-a-l-usine-chimicolor-de-buzancais-1555417994,francebleu.fr,2019-04-16,France,Chimicolor/NAM/Chimicolor,"Quatre  sociétés  spécialisées  dans  le  traitement  de  surface  :  Galva  +  ,  GMC  ,  PSG  Industries  et Chimicolor  .",chimicolor,nam,chimicolor,et,et,CONJ,Industries,Industries,PROPN,PSG,PSG,PROPN,",",",",PUNCT,GMC,GMC,PROPN,.,.,PUNCT,,,,,,,,,,,,,2019-04-16,2019,2010,,CONJ Micolor PUNCT,PROPN CONJ Micolor,PROPN PROPN CONJ Micolor,PUNCT PROPN PROPN CONJ Micolor,,,,,et Micolor .,Industries et Micolor,PSG Industries et Micolor,", PSG Industries et Micolor",,,
https://www.lyoncapitale.fr/culture/histoire-de-lyon-lautre-collomb/,lyoncapitale.fr,2019-07-18,France,Chimicolor/NAM/Chimicolor,"À  35  ans  ,  il  achète  l'  entreprise  de  gravure  chimique Chimicolor  puis  va  se  lier  d'  amitié  avec  son  voisin  de  palier  ,  le  romancier  Frédéric  Dard  .",chimicolor,nam,chimicolor,chimique,chimique,ADJ,gravure,gravure,NOUN,de,de,ADP,entreprise,entreprise,NOUN,l',le,DET,puis,puis,ADV,va,aller,VERB,se,se,PRON,lier,lier,VERB,d',de,ADP,2019-07-18,2019,2010,NOUN ADJ Micolor ADV VERB,ADJ Micolor ADV,NOUN ADJ Micolor,ADP NOUN ADJ Micolor,NOUN ADP NOUN ADJ Micolor,Micolor ADV VERB,Micolor ADV VERB PRON,Micolor ADV VERB PRON VERB,gravure chimique Micolor puis aller,chimique Micolor puis,gravure chimique Micolor,de gravure chimique Micolor,entreprise de gravure chimique Micolor,Micolor puis aller,Micolor puis aller se,Micolor puis aller se lier
https://actu.fr/normandie/cherbourg-en-cotentin_50129/cherbourg-trois-jours-voyage-dans-pop-culture-les-voyageurs-immobiles_25646160.html,actu.fr,2019-08-29,France,ComiColor/NAM/ComiColor,"Dès  le  jeudi  soir  ,  le  groupe  caennais  GaBLé  ,  programmé  par  le  Circuit  ,  donnera  le  ton  du  festival  avec  un  ciné-concert  , ComiColor  .",comicolor,nam,comicolor,",",",",PUNCT,ciné-concert,ciné-concert,NOUN,un,un,DET,avec,avec,ADP,festival,festival,NOUN,.,.,PUNCT,,,,,,,,,,,,,2019-08-29,2019,2010,,PUNCT Micolor PUNCT,NOUN PUNCT Micolor,DET NOUN PUNCT Micolor,ADP DET NOUN PUNCT Micolor,,,,,", Micolor .","ciné-concert , Micolor","un ciné-concert , Micolor","avec un ciné-concert , Micolor",,,
https://www.atlasinfo.fr/Maroc-deces-de-l-homme-d-affaires-et-resistant-Moulay-Messaoud-Agouzzal_a104430.html,atlasinfo.fr,2019-10-06,France,Chimicolor/NAM/Chimicolor,"Deux  décennies  plus  tard  ,  Moulay  Messaoud  va  créer  les  ""  Huilleries  de  Meknès  ""  ,  puis  en  1974  il  va  se  lancer  dans  le  secteur  immobilier  ,  mais  l'  ascension  va  venir  lors  de  la  vague  de  marocanisation  ,  dans  laquelle  ,  Messaoud  Agouzzal  va  racheter Chimicolor  et  Chimilabo  .",chimicolor,nam,chimicolor,racheter,racheter,VERB,va,aller,VERB,Agouzzal,Agouzzal,PROPN,Messaoud,Messaoud,PROPN,",",",",PUNCT,et,et,CONJ,Chimilabo,Chimilabo,PROPN,.,.,PUNCT,,,,,,,2019-10-06,2019,2010,VERB VERB Micolor CONJ PROPN,VERB Micolor CONJ,VERB VERB Micolor,PROPN VERB VERB Micolor,PROPN PROPN VERB VERB Micolor,Micolor CONJ PROPN,Micolor CONJ PROPN PUNCT,,aller racheter Micolor et Chimilabo,racheter Micolor et,aller racheter Micolor,Agouzzal aller racheter Micolor,Messaoud Agouzzal aller racheter Micolor,Micolor et Chimilabo,Micolor et Chimilabo .,
https://www.bladi.net/moulay-messaoud-agouzzal-deces%2C60140.html,bladi.net,2019-10-06,===NONE===,Chimicolor/NAM/Chimicolor,Il  racheta Chimicolor  et  Chimilabo  .,chimicolor,nam,chimicolor,racheta,racheter,VERB,Il,il,PRON,,,,,,,,,,et,et,CONJ,Chimilabo,Chimilabo,PROPN,.,.,PUNCT,,,,,,,2019-10-06,2019,2010,PRON VERB Micolor CONJ PROPN,VERB Micolor CONJ,PRON VERB Micolor,,,Micolor CONJ PROPN,Micolor CONJ PROPN PUNCT,,il racheter Micolor et Chimilabo,racheter Micolor et,il racheter Micolor,,,Micolor et Chimilabo,Micolor et Chimilabo .,
http://albayane.press.ma/%EF%BB%BFabdelghani-siffeddine-un-rajaoui-qui-bosse-dans-le-silence.html,press.ma,2019-11-01,Morocco,Chimicolor/NAM/Chimicolor,"Pour  Abdelghani  ,  ces  dirigeants  ressemblent  beaucoup  à  ceux  d'  hier  dont  les  Comités  des  présidents  Abdeslam  Hanat  ,  Abdellah  Rhallam  ,  Ahmed  Ammour  et  d'  autres  de  l'  âge  d'  or  des  Verts  de  l'  époque  du  parrain  rajaoui  (  ODEP  )  et  son  sponsoring  ( Chimicolor  )  .",chimicolor,nam,chimicolor,(,(,PUNCT,sponsoring,sponsoring,NOUN,son,son,DET,et,et,CONJ,),),PUNCT,),),PUNCT,.,.,PUNCT,,,,,,,,,,2019-11-01,2019,2010,NOUN PUNCT Micolor PUNCT PUNCT,PUNCT Micolor PUNCT,NOUN PUNCT Micolor,DET NOUN PUNCT Micolor,CONJ DET NOUN PUNCT Micolor,Micolor PUNCT PUNCT,,,sponsoring ( Micolor ) .,( Micolor ),sponsoring ( Micolor,son sponsoring ( Micolor,et son sponsoring ( Micolor,Micolor ) .,,
https://fr.le360.ma/societe/intellectuels-politiques-artistes-sportifs-ils-ont-tire-leur-reverence-en-2019-205619,le360.ma,2019-12-30,Morocco,Chimicolor/NAM/Chimicolor,"Deux  décennies  plus  tard  ,  Moulay  Messaoud  avait  créé  les  ""  Huileries  de  Meknès  ""  ,  puis  en  1974  ,  il  s'  était  lancé  dans  le  secteur  immobilier  ,  mais  sa  réelle  ascension  ,  il  la  doit  à  vague  de  marocanisation  d'  entreprises  étatiques  ,  au  cours  de  laquelle  Messaoud  Agouzzal  rachète  deux  fleurons  d'  alors  :  les  entreprises Chimicolor  et  Chimilabo  .",chimicolor,nam,chimicolor,entreprises,entreprise,NOUN,les,le,DET,:,:,PUNCT,alors,alors,ADV,d',de,ADP,et,et,CONJ,Chimilabo,Chimilabo,PROPN,.,.,PUNCT,,,,,,,2019-12-30,2019,2010,DET NOUN Micolor CONJ PROPN,NOUN Micolor CONJ,DET NOUN Micolor,PUNCT DET NOUN Micolor,ADV PUNCT DET NOUN Micolor,Micolor CONJ PROPN,Micolor CONJ PROPN PUNCT,,le entreprise Micolor et Chimilabo,entreprise Micolor et,le entreprise Micolor,: le entreprise Micolor,alors : le entreprise Micolor,Micolor et Chimilabo,Micolor et Chimilabo .,
https://redon.maville.com/actu/actudet_-bain-de-bretagne.-festival-du-schmoul-gable-en-cine-concert-au-cinema_fil-3975540_actu.Htm?xtor=RSS-4,maville.com,2020-01-22,===NONE===,ComiColor/NAM/ComiColor,"""  Après  un  premier  ciné-concert  en  2014  au  Louvre  ,  à  l'  invitation  de  Rubin  Steiner  ,  GaBLé  a  décidé  de  se  lancer  dans  la  création  d'  un  nouveau  spectacle  autour  de  la  série ComiColor  d'  Ub  Iwerks  ,  composée  de  dessins  animés  de  7  à  8  minutes  en  couleur  ,  très  souvent  inspirés  de  contes  (  Sindbad  le  marin  ,  Tom  Pouce  ,  Les  Musiciens  de  Brême  ,  etc  .  )  ,  créés  dans  les  années  1930  .",comicolor,nam,comicolor,série,série,NOUN,la,le,DET,de,de,ADP,autour,autour,ADV,spectacle,spectacle,NOUN,d',de,ADP,Ub,Ub,PROPN,Iwerks,Iwerks,PROPN,",",",",PUNCT,composée,composer,VERB,2020-01-22,2020,2020,DET NOUN Micolor ADP PROPN,NOUN Micolor ADP,DET NOUN Micolor,ADP DET NOUN Micolor,ADV ADP DET NOUN Micolor,Micolor ADP PROPN,Micolor ADP PROPN PROPN,Micolor ADP PROPN PROPN PUNCT,le série Micolor de Ub,série Micolor de,le série Micolor,de le série Micolor,autour de le série Micolor,Micolor de Ub,Micolor de Ub Iwerks,"Micolor de Ub Iwerks ,"
https://www.lejdc.fr/varennes-vauzelles-58640/actualites/l-entreprise-vauzellienne-sertip-associee-a-la-fabrication-en-urgence-de-10-000-respirateurs_13781199/,lejdc.fr,2020-04-24,France,Chimicolor/NOM/Chimicolor,"Dans  cette  coopération  industrielle  inédite  ,  figure  l'  entreprise  Sertip-Sami  / Chimicolor  implantée  à  Varennes-Vauzelles  (  elle  possède  également  un  site  à  Dagneux  ,  dans  l'  Ain  )  .",chimicolor,nom,chimicolor,/,,,Sertip-Sami,Sertip-Sami,PROPN,entreprise,entreprise,NOUN,l',le,DET,figure,figurer,VERB,implantée,implanter,VERB,à,à,ADP,Varennes-Vauzelles,Varennes-Vauzelles,PROPN,(,(,PUNCT,elle,elle,PRON,2020-04-24,2020,2020,,,,,,Micolor VERB ADP,Micolor VERB ADP PROPN,Micolor VERB ADP PROPN PUNCT,,,,,,Micolor implanter à,Micolor implanter à Varennes-Vauzelles,Micolor implanter à Varennes-Vauzelles (
https://www.francebleu.fr/emissions/agenda-spectacles-soir/normandie-caen/cine-concert-comicolor-a-passais-la-conception#xtor%3DRSS-107,francebleu.fr,2020-09-25,France,Comicolor/NOM/Comicolor,"<doc uri=https://www.francebleu.fr/emissions/agenda-spectacles-soir/normandie-caen/cine-concert-comicolor-a-passais-la-conception#xtor%3DRSS-107 website=francebleu.fr date=2020-09-25 source_country=France> /Ciné-concert/NAM /""/PUN:cit Comicolor  ""  à  Passais-la-Conception  .",comicolor,nom,comicolor,"""","""",PUNCT,Ciné-concert,Ciné-concert,PROPN,,,,,,,,,,"""","""",PUNCT,à,à,ADP,Passais-la-Conception,Passais-la-Conception,NOUN,.,.,PUNCT,,,,2020-09-25,2020,2020,PROPN PUNCT Micolor PUNCT ADP,PUNCT Micolor PUNCT,PROPN PUNCT Micolor,,,Micolor PUNCT ADP,Micolor PUNCT ADP NOUN,Micolor PUNCT ADP NOUN PUNCT,"Ciné-concert "" Micolor "" à",""" Micolor ""","Ciné-concert "" Micolor",,,"Micolor "" à","Micolor "" à Passais-la-Conception","Micolor "" à Passais-la-Conception ."
https://www.francebleu.fr/emissions/agenda-spectacles-soir/normandie-caen/cine-concert-comicolor-a-passais-la-conception#xtor%3DRSS-107,francebleu.fr,2020-09-25,France,ComiColor/NAM/ComiColor,"Après  un  premier  ciné-concert  en  2014  au  Louvre  à  l'  invitation  de  Rubin  Steiner  ,  GaBLé  a  décidé  de  se  lancer  dans  la  création  d'  un  nouveau  spectacle  autour  de  la  série ComiColor  d'  Ub  Iwerks  ,  composée  de  dessins  animés  de  7  à  8  minutes  en  couleur  très  souvent  inspirés  de  contes  (  Sindbad  le  marin  ,  Tom  Pouce  ,  Les  Musiciens  de  Brême  ...  )  ,  créés  dans  les  années  1930  .",comicolor,nam,comicolor,série,série,NOUN,la,le,DET,de,de,ADP,autour,autour,ADV,spectacle,spectacle,NOUN,d',de,ADP,Ub,Ub,PROPN,Iwerks,Iwerks,PROPN,",",",",PUNCT,composée,composer,VERB,2020-09-25,2020,2020,DET NOUN Micolor ADP PROPN,NOUN Micolor ADP,DET NOUN Micolor,ADP DET NOUN Micolor,ADV ADP DET NOUN Micolor,Micolor ADP PROPN,Micolor ADP PROPN PROPN,Micolor ADP PROPN PROPN PUNCT,le série Micolor de Ub,série Micolor de,le série Micolor,de le série Micolor,autour de le série Micolor,Micolor de Ub,Micolor de Ub Iwerks,"Micolor de Ub Iwerks ,"
https://alencon.maville.com/actu/actudet_-passais-villages.-comicolor-a-la-salle-multiculturelle-ce-soir_dep-4310757_actu.Htm?xtor=RSS-4,maville.com,2020-10-02,===NONE===,CoMiCoLoR/NOM/CoMiCoLoR, CoMiCoLoR  à  la  salle  multiculturelle  ce  soir  (  Ouest-France  ),comicolor,nom,comicolor,,,,,,,,,,,,,,,,à,à,ADP,la,le,DET,salle,salle,NOUN,multiculturelle,multiculturelle,ADJ,ce,ce,PRON,2020-10-02,2020,2020,,,,,,Micolor ADP DET,Micolor ADP DET NOUN,Micolor ADP DET NOUN ADJ,,,,,,Micolor à le,Micolor à le salle,Micolor à le salle multiculturelle
https://alencon.maville.com/actu/actudet_-passais-villages.-comicolor-a-la-salle-multiculturelle-ce-soir_dep-4310757_actu.Htm?xtor=RSS-4,maville.com,2020-10-02,===NONE===,CoMiCoLoR/NAM/CoMiCoLoR,"La  compagnie  GaBlé  présente  un  ciné-concert  débridé  intitulé CoMiCoLoR  ,  pour  petits  et  grands  à  la  salle  multiculturelle  vendredi  .",comicolor,nam,comicolor,intitulé,intituler,VERB,débridé,débridé,ADJ,ciné-concert,ciné-concert,NOUN,un,un,DET,présente,présenter,VERB,",",",",PUNCT,pour,pour,ADP,petits,petit,ADJ,et,et,CONJ,grands,grand,ADJ,2020-10-02,2020,2020,ADJ VERB Micolor PUNCT ADP,VERB Micolor PUNCT,ADJ VERB Micolor,NOUN ADJ VERB Micolor,DET NOUN ADJ VERB Micolor,Micolor PUNCT ADP,Micolor PUNCT ADP ADJ,Micolor PUNCT ADP ADJ CONJ,"débridé intituler Micolor , pour","intituler Micolor ,",débridé intituler Micolor,ciné-concert débridé intituler Micolor,un ciné-concert débridé intituler Micolor,"Micolor , pour","Micolor , pour petit","Micolor , pour petit et"
https://alencon.maville.com/actu/actudet_-passais-villages.-comicolor-a-la-salle-multiculturelle-ce-soir_dep-4310757_actu.Htm?xtor=RSS-4,maville.com,2020-10-02,===NONE===,CoMiCoLoR/NAM/CoMiCoLoR," CoMiCoLoR  est  ,  à  l'  origine  ,  une  série  créée  et  produite  par  un  néerlandais  ,  Ub  Iwerks  dans  les  années  1930  .",comicolor,nam,comicolor,,,,,,,,,,,,,,,,est,être,VERB,",",",",PUNCT,à,à,ADP,l',le,DET,origine,origine,NOUN,2020-10-02,2020,2020,,,,,,Micolor VERB PUNCT,Micolor VERB PUNCT ADP,Micolor VERB PUNCT ADP DET,,,,,,"Micolor être ,","Micolor être , à","Micolor être , à le"
https://www.letelegramme.fr/cotes-darmor/loudeac/la-programmation-du-festival-mini-momes-maxi-momes-dans-le-detail-05-10-2020-12632046.php?xtor=RSS-21,letelegramme.fr,2020-10-05,France,ComiColor/NAM/ComiColor,"Jeudi  15  octobre  ,  à  10  h  et  14  h  ,  au  PCC  de  Loudéac  ,  "" ComiColor  ""  par  GaBlé  (  ciné-concert  )  .",comicolor,nam,comicolor,"""","""",PUNCT,",",",",PUNCT,Loudéac,Loudéac,PROPN,de,de,ADP,PCC,PCC,PROPN,"""","""",PUNCT,par,par,ADP,GaBlé,GaBlé,PROPN,(,(,PUNCT,ciné-concert,ciné-concert,NOUN,2020-10-05,2020,2020,PUNCT PUNCT Micolor PUNCT ADP,PUNCT Micolor PUNCT,PUNCT PUNCT Micolor,PROPN PUNCT PUNCT Micolor,ADP PROPN PUNCT PUNCT Micolor,Micolor PUNCT ADP,Micolor PUNCT ADP PROPN,Micolor PUNCT ADP PROPN PUNCT,", "" Micolor "" par",""" Micolor """,", "" Micolor","Loudéac , "" Micolor","de Loudéac , "" Micolor","Micolor "" par","Micolor "" par GaBlé","Micolor "" par GaBlé ("
https://www.paris-normandie.fr/loisirs/a-lyons-la-foret-le-cinema-fait-son-festival-des-a-cotes-JH17325682,paris-normandie.fr,2020-10-09,France,Comicolor/NAM/Comicolor,"Aujourd  '  hui  vendredi  ,  ouverture  officielle  à  18  h  30  et  ciné-concert  à  20  h.  Pendant  que Comicolor  sera  projeté  ,  les  Tontons  Tourneurs  s'  occuperont  de  l'  accompagnement  musical  .",comicolor,nam,comicolor,que,que,CONJ,Pendant,Pendant,PROPN,h.,h.,ABR,20,@card@,ADJ,à,à,ADP,sera,être,VERB,projeté,projeter,VERB,",",",",PUNCT,les,le,DET,Tontons,tonton,NOUN,2020-10-09,2020,2020,PROPN CONJ Micolor VERB VERB,CONJ Micolor VERB,PROPN CONJ Micolor,ABR PROPN CONJ Micolor,ADJ ABR PROPN CONJ Micolor,Micolor VERB VERB,Micolor VERB VERB PUNCT,Micolor VERB VERB PUNCT DET,Pendant que Micolor être projeter,que Micolor être,Pendant que Micolor,h. Pendant que Micolor,@card@ h. Pendant que Micolor,Micolor être projeter,"Micolor être projeter ,","Micolor être projeter , le"
https://actu.fr/normandie/lyons-la-foret_27377/eure-le-cinema-s-invite-au-festival-des-a-cotes-a-lyons-la-foret_36658555.html,actu.fr,2020-10-09,France,comicolor/NOM/comicolor,"-  Vendredi  9  octobre  :  à  20  h  ouverture  du  festival  avec  le  ciné-concert  ""  Gablé comicolor  ""  .",comicolor,nom,comicolor,Gablé,Gablé,ADJ,"""","""",PUNCT,ciné-concert,ciné-concert,NOUN,le,le,DET,avec,avec,ADP,"""","""",PUNCT,.,.,PUNCT,,,,,,,,,,2020-10-09,2020,2020,PUNCT ADJ Micolor PUNCT PUNCT,ADJ Micolor PUNCT,PUNCT ADJ Micolor,NOUN PUNCT ADJ Micolor,DET NOUN PUNCT ADJ Micolor,Micolor PUNCT PUNCT,,,""" Gablé Micolor "" .","Gablé Micolor """,""" Gablé Micolor","ciné-concert "" Gablé Micolor","le ciné-concert "" Gablé Micolor","Micolor "" .",,
https://pontivy.maville.com/actu/actudet_-hennebont.-le-festival-salles-momes-souffle-ses-18-bougies_dep-4346500_actu.Htm?xtor=RSS-4,maville.com,2020-10-23,===NONE===,Comicolor/NAM/Comicolor,"Dimanche  8  novembre  ,  à  17  h  , Comicolor  ,  un  ciné-concert  est  programmé  avec  le  groupe  Gablé  .",comicolor,nam,comicolor,",",",",PUNCT,h,heure,ABR,17,@card@,ADJ,à,à,ADP,",",",",PUNCT,",",",",PUNCT,un,un,DET,ciné-concert,ciné-concert,NOUN,est,être,VERB,programmé,programmer,VERB,2020-10-23,2020,2020,ABR PUNCT Micolor PUNCT DET,PUNCT Micolor PUNCT,ABR PUNCT Micolor,ADJ ABR PUNCT Micolor,ADP ADJ ABR PUNCT Micolor,Micolor PUNCT DET,Micolor PUNCT DET NOUN,Micolor PUNCT DET NOUN VERB,"heure , Micolor , un",", Micolor ,","heure , Micolor","@card@ heure , Micolor","à @card@ heure , Micolor","Micolor , un","Micolor , un ciné-concert","Micolor , un ciné-concert être"
https://www.lereporter.ma/amenagement-de-casablanca-ca-commence-par-le-transport/,lereporter.ma,2020-11-14,Morocco,Chimicolor/NAM/Chimicolor,"En  effet  ,  la  plupart  des  principaux  projets  structurants  de  la  capitale  économique  seront  opérationnels  au  terme  de  cette  année  ,  notamment  la  trémie  de Chimicolor  ,  Sindiparc  ou  encore  le  chantier  du  collecteur  est  de  Casablanca  .",chimicolor,nam,chimicolor,de,de,ADP,trémie,trémie,NOUN,la,le,DET,notamment,notamment,ADV,",",",",PUNCT,",",",",PUNCT,Sindiparc,Sindiparc,PROPN,ou,ou,CONJ,encore,encore,ADV,le,le,DET,2020-11-14,2020,2020,NOUN ADP Micolor PUNCT PROPN,ADP Micolor PUNCT,NOUN ADP Micolor,DET NOUN ADP Micolor,ADV DET NOUN ADP Micolor,Micolor PUNCT PROPN,Micolor PUNCT PROPN CONJ,Micolor PUNCT PROPN CONJ ADV,"trémie de Micolor , Sindiparc","de Micolor ,",trémie de Micolor,le trémie de Micolor,notamment le trémie de Micolor,"Micolor , Sindiparc","Micolor , Sindiparc ou","Micolor , Sindiparc ou encore"
https://www.letelegramme.fr/morbihan/lorient/a-lorient-hydrophone-devoile-une-serie-de-concerts-assis-pour-2021-12-12-2020-12672146.php?xtor=RSS-21,letelegramme.fr,2020-12-12,France,ComiColor/NOM/ComiColor,"Et  si  l'  amour  c'  était  d'  aimer  ?  de  Fabcaro  ,  en  version  ciné-BD-concert  par  Totorro  &  Friend  ;  4  février  :  Boom  Bunker  Club  :  conférence  Images  de  la  fin  du  monde  avec  Christophe  Siebert  +  concert  Les  morts  vont  bien  ;  11  février  :  Mathias  Malzieu  et  Daria  Nelson  ,  en  version  lecture-concert  ;  13  février  :  Plogoff  ,  des  pierres  contre  des  fusils  ,  en  version  ciné-concert  par  Monolithe  Noir  +  concert  L'  Orage  ;  27  février  :  Les  Nuits  de  l'  Alligator  avec  les  concerts  de  Jontavious  Willis  +  Jerron  Paxton  ;  7  mars  : ComiColor  par  Gablé  ,  un  ciné-concert  au  Trio  ...",comicolor,nom,comicolor,:,:,PUNCT,mars,mars,NOUN,7,@card@,ADJ,;,;,PUNCT,Paxton,Paxton,PROPN,par,par,ADP,Gablé,Gablé,PROPN,",",",",PUNCT,un,un,DET,ciné-concert,ciné-concert,NOUN,2020-12-12,2020,2020,NOUN PUNCT Micolor ADP PROPN,PUNCT Micolor ADP,NOUN PUNCT Micolor,ADJ NOUN PUNCT Micolor,PUNCT ADJ NOUN PUNCT Micolor,Micolor ADP PROPN,Micolor ADP PROPN PUNCT,Micolor ADP PROPN PUNCT DET,mars : Micolor par Gablé,: Micolor par,mars : Micolor,@card@ mars : Micolor,; @card@ mars : Micolor,Micolor par Gablé,"Micolor par Gablé ,","Micolor par Gablé , un"
https://www.dna.fr/pour-sortir/loisirs/Spectacle-theatre-conte/Autres-spectacles/Alsace/Bas-rhin/Wissembourg/2021/04/14/Comicolor,dna.fr,2021-04-03,France,Comicolor/NAM/Comicolor,<doc uri=https://www.dna.fr/pour-sortir/loisirs/Spectacle-theatre-conte/Autres-spectacles/Alsace/Bas-rhin/Wissembourg/2021/04/14/Comicolor website=dna.fr date=2021-04-03 source_country=France> /spectacle/NOM Comicolor  Wissembourg  avr  .  14,comicolor,nam,comicolor,Spectacle,spectacle,NOUN,,,,,,,,,,,,,Wissembourg,Wissembourg,PROPN,avr,avr,NOUN,.,.,PUNCT,14,@card@,ADJ,,,,2021-04-03,2021,2020,,NOUN Micolor PROPN,,,,Micolor PROPN NOUN,Micolor PROPN NOUN PUNCT,Micolor PROPN NOUN PUNCT ADJ,,spectacle Micolor Wissembourg,,,,Micolor Wissembourg avr,Micolor Wissembourg avr .,Micolor Wissembourg avr . @card@
https://www.dna.fr/pour-sortir/loisirs/Spectacle-theatre-conte/Autres-spectacles/Alsace/Bas-rhin/Wissembourg/2021/04/14/Comicolor,dna.fr,2021-04-03,France,comicolors/NOM/comicolors,"De  part  et  d'  autre  de  l'  écran  ,  sur  lequel  sont  projetés  sept  de  ses comicolors  ,  gags  hilarants  et  contes  pour  enfants  revisités  (  La  reine  de  coeur  ,  Boucle  d'  or  ...  )  ,  la  bande  joue  en  direct  des  boucles  musicales  synchronisées  avec  les  images  et  des  chansons  qui  soulignent  ou  décalent  le  sens  .",comicolors,nom,comicolors,ses,son,DET,de,de,ADP,sept,sept,ADJ,projetés,projeter,VERB,sont,être,VERB,",",",",PUNCT,gags,gag,NOUN,hilarants,hilarant,ADJ,et,et,CONJ,contes,conte,NOUN,2021-04-03,2021,2020,ADP DET Micolor PUNCT NOUN,DET Micolor PUNCT,ADP DET Micolor,ADJ ADP DET Micolor,VERB ADJ ADP DET Micolor,Micolor PUNCT NOUN,Micolor PUNCT NOUN ADJ,Micolor PUNCT NOUN ADJ CONJ,"de son Micolor , gag","son Micolor ,",de son Micolor,sept de son Micolor,projeter sept de son Micolor,"Micolor , gag","Micolor , gag hilarant","Micolor , gag hilarant et"
