url,website,date,country,keyword,sentence,kw,kw_lemma,kw_pos,left_w1,left_l1,left_p1,left_w2,left_l2,left_p2,left_w3,left_l3,left_p3,left_w4,left_l4,left_p4,left_w5,left_l5,left_p5,right_w1,right_l1,right_p1,right_w2,right_l2,right_p2,right_w3,right_l3,right_p3,right_w4,right_l4,right_p4,right_w5,right_l5,right_p5,datetime,year,10years,pattern_around5,pattern_around3,pattern_left2,pattern_left3,pattern_left4,pattern_right2,pattern_right3,pattern_right4,pattern_around5_lex,pattern_around3_lex,pattern_left2_lex,pattern_left3_lex,pattern_left4_lex,pattern_right2_lex,pattern_right3_lex,pattern_right4_lex
https://www.lindependant.fr/2018/11/27/gilets-jaunes-au-peage-nord-les-annonces-de-macron-cest-du-mercurochrome-sur-une-jambe-de-bois%2C4985098.php,lindependant.fr,2018-11-28,France,mercurochrome/NOM/mercurochrome,"Tout  ce  qu'  il  annonce  c'  est  du mercurochrome  sur  une  jambe  de  bois  ""  . </doc>",mercurochrome,nom,mercurochrome,du,du,ADP DET,est,être,VERB,c',ce,PRON,annonce,annoncer,VERB,il,il,PRON,sur,sur,ADP,une,un,DET,jambe,jambe,NOUN,de,de,ADP,bois,bois,NOUN,2018-11-28,2018,2010,VERB ADP DET Mercurochrome ADP DET,ADP DET Mercurochrome ADP,VERB ADP DET Mercurochrome,PRON VERB ADP DET Mercurochrome,VERB PRON VERB ADP DET Mercurochrome,Mercurochrome ADP DET,Mercurochrome ADP DET NOUN,Mercurochrome ADP DET NOUN ADP,être du Mercurochrome sur un,du Mercurochrome sur,être du Mercurochrome,ce être du Mercurochrome,annoncer ce être du Mercurochrome,Mercurochrome sur un,Mercurochrome sur un jambe,Mercurochrome sur un jambe de
http://www.elmoudjahid.com/fr/actualites/130997,elmoudjahid.com,2018-11-29,===NONE===,mercurochrome/NOM/mercurochrome,L'  automédication  ne  concerne  pas  seulement  le mercurochrome  ou  le  paracétamol  .,mercurochrome,nom,mercurochrome,le,le,DET,seulement,seulement,ADV,pas,pas,ADV,concerne,concerner,VERB,ne,ne,ADV,ou,ou,CONJ,le,le,DET,paracétamol,paracétamol,NOUN,.,.,PUNCT,,,,2018-11-29,2018,2010,ADV DET Mercurochrome CONJ DET,DET Mercurochrome CONJ,ADV DET Mercurochrome,ADV ADV DET Mercurochrome,VERB ADV ADV DET Mercurochrome,Mercurochrome CONJ DET,Mercurochrome CONJ DET NOUN,Mercurochrome CONJ DET NOUN PUNCT,seulement le Mercurochrome ou le,le Mercurochrome ou,seulement le Mercurochrome,pas seulement le Mercurochrome,concerner pas seulement le Mercurochrome,Mercurochrome ou le,Mercurochrome ou le paracétamol,Mercurochrome ou le paracétamol .
https://www.rtbf.be/tv/emission/detail_pop-m/news/article_pop-m-votre-magazine-pop-culture-en-replay-sur-auvio?id=10084177&emissionId=13557,rtbf.be,2018-12-04,Belgium,mercurochrome/NOM/mercurochrome,"""  comme  magazine  ,  M  !  comme  média-pop  et  M  !  comme mercurochrome  !  Chaque  semaine  ,  Cathy  Immelen  et  la  rédaction  de  Pop  M  !  vous  racontent  les  phénomènes  de  la  pop  culture  .",mercurochrome,nom,mercurochrome,comme,comme,ADV,!,!,PUNCT,M,M,NOUN,et,et,CONJ,média-pop,média-pop,NOUN,!,!,PUNCT,Chaque,chaque,PRON,semaine,semaine,NOUN,",",",",PUNCT,Cathy,Cathy,PROPN,2018-12-04,2018,2010,PUNCT ADV Mercurochrome PUNCT PRON,ADV Mercurochrome PUNCT,PUNCT ADV Mercurochrome,NOUN PUNCT ADV Mercurochrome,CONJ NOUN PUNCT ADV Mercurochrome,Mercurochrome PUNCT PRON,Mercurochrome PUNCT PRON NOUN,Mercurochrome PUNCT PRON NOUN PUNCT,! comme Mercurochrome ! chaque,comme Mercurochrome !,! comme Mercurochrome,M ! comme Mercurochrome,et M ! comme Mercurochrome,Mercurochrome ! chaque,Mercurochrome ! chaque semaine,"Mercurochrome ! chaque semaine ,"
https://www.capital.fr/entreprises-marches/medicaments-comment-urgo-gagne-gros-avec-vos-bobos-1322987,capital.fr,2019-01-11,France,Mercurochrome/NAM/Mercurochrome,"""  Sur  les  dix  noms  les  plus  connus  du  grand  public  dans  le  domaine  de  la  santé  ,  nous  en  possédons  quatre  :  Urgo  , Mercurochrome  ,  Humex  et  Juvamine  ""  ,  se  plaît  à  répéter  le  patron  .",mercurochrome,nam,mercurochrome,",",",",PUNCT,Urgo,Urgo,PROPN,:,:,PUNCT,quatre,quatre,ADJ,possédons,posséder,VERB,",",",",PUNCT,Humex,Humex,PROPN,et,et,CONJ,Juvamine,Juvamine,PROPN,"""","""",PUNCT,2019-01-11,2019,2010,PROPN PUNCT Mercurochrome PUNCT PROPN,PUNCT Mercurochrome PUNCT,PROPN PUNCT Mercurochrome,PUNCT PROPN PUNCT Mercurochrome,ADJ PUNCT PROPN PUNCT Mercurochrome,Mercurochrome PUNCT PROPN,Mercurochrome PUNCT PROPN CONJ,Mercurochrome PUNCT PROPN CONJ PROPN,"Urgo , Mercurochrome , Humex",", Mercurochrome ,","Urgo , Mercurochrome",": Urgo , Mercurochrome","quatre : Urgo , Mercurochrome","Mercurochrome , Humex","Mercurochrome , Humex et","Mercurochrome , Humex et Juvamine"
https://www.capital.fr/entreprises-marches/medicaments-comment-urgo-gagne-gros-avec-vos-bobos-1322987,capital.fr,2019-01-11,France,Mercurochrome/NAM/Mercurochrome,"Côté  distribution  ,  Urgo  est  parvenu  à  s'  imposer  partout  :  dans  les  supermarchés  ,  avec  des  marques  comme Mercurochrome  ,  Juvamine  ou  Marie  Rose  ,  en  pharmacie  ,  avec  Urgo  ,  dans  les  magasins  bio  ,  avec  Super  Diet  ,  le  spécialiste  des  compléments  alimentaires  à  base  de  plantes  et  de  légumes  ...",mercurochrome,nam,mercurochrome,comme,comme,CONJ,marques,marque,NOUN,des,du,ADP DET,avec,avec,ADP,",",",",PUNCT,",",",",PUNCT,Juvamine,Juvamine,PROPN,ou,ou,CONJ,Marie,Marie,PROPN,Rose,Rose,PROPN,2019-01-11,2019,2010,NOUN CONJ Mercurochrome PUNCT PROPN,CONJ Mercurochrome PUNCT,NOUN CONJ Mercurochrome,ADP DET NOUN CONJ Mercurochrome,ADP ADP DET NOUN CONJ Mercurochrome,Mercurochrome PUNCT PROPN,Mercurochrome PUNCT PROPN CONJ,Mercurochrome PUNCT PROPN CONJ PROPN,"marque comme Mercurochrome , Juvamine","comme Mercurochrome ,",marque comme Mercurochrome,du marque comme Mercurochrome,avec du marque comme Mercurochrome,"Mercurochrome , Juvamine","Mercurochrome , Juvamine ou","Mercurochrome , Juvamine ou Marie"
https://www.capital.fr/entreprises-marches/medicaments-comment-urgo-gagne-gros-avec-vos-bobos-1322987,capital.fr,2019-01-11,France,Mercurochrome/NAM/Mercurochrome,"Comme  ""  Si  Juvabien  ,  c'  est  Juvamine  ""  ,  "" Mercurochrome  ,  le  pansement  des  héros  ""  ,  ou  ""  Intimy  ,  ça  donne  envie  ""  ,  pour  promouvoir  les  produits  de  la  marque  de  ""  bien-être  sexuel  ""  du  groupe  (  préservatifs  ,  lubriants  ...  )  .",mercurochrome,nam,mercurochrome,"""","""",PUNCT,",",",",PUNCT,"""","""",PUNCT,Juvamine,Juvamine,PROPN,est,être,VERB,",",",",PUNCT,le,le,DET,pansement,pansement,NOUN,des,du,ADP DET,héros,héro|héros,NOUN,2019-01-11,2019,2010,PUNCT PUNCT Mercurochrome PUNCT DET,PUNCT Mercurochrome PUNCT,PUNCT PUNCT Mercurochrome,PUNCT PUNCT PUNCT Mercurochrome,PROPN PUNCT PUNCT PUNCT Mercurochrome,Mercurochrome PUNCT DET,Mercurochrome PUNCT DET NOUN,Mercurochrome PUNCT DET NOUN ADP DET,", "" Mercurochrome , le",""" Mercurochrome ,",", "" Mercurochrome",""" , "" Mercurochrome","Juvamine "" , "" Mercurochrome","Mercurochrome , le","Mercurochrome , le pansement","Mercurochrome , le pansement du"
https://www.lejdd.fr/Societe/a-lecole-de-riaumont-les-pretres-accuses-de-maltraitance-3847049,lejdd.fr,2019-01-30,France,mercurochrome/NOM/mercurochrome,"Certains  anciens  enseignants  racontent  que  les  fugueurs  étaient  tondus  ,  le  crâne  recouvert  de mercurochrome  .",mercurochrome,nom,mercurochrome,de,de,ADP,recouvert,recouvrir,VERB,crâne,crâne,NOUN,le,le,DET,",",",",PUNCT,.,.,PUNCT,,,,,,,,,,,,,2019-01-30,2019,2010,,ADP Mercurochrome PUNCT,VERB ADP Mercurochrome,NOUN VERB ADP Mercurochrome,DET NOUN VERB ADP Mercurochrome,,,,,de Mercurochrome .,recouvrir de Mercurochrome,crâne recouvrir de Mercurochrome,le crâne recouvrir de Mercurochrome,,,
http://www.martinique.franceantilles.fr/actualite/planete_sports/six-nations-bastareaud-tuilagi-etincelles-en-perspective-508231.php,franceantilles.fr,2019-02-09,France,mercurochrome/NOM/mercurochrome,"Où  flotte  aussi  comme  un  parfum  de mercurochrome  ,  entre  des  premiers  centres  bien  connus  pour  leur  capacité  de  destruction  offensive  et  utilisés  dans  un  rôle  similaire  de  point  de  fixation  .",mercurochrome,nom,mercurochrome,de,de,ADP,parfum,parfum,NOUN,un,un,DET,comme,comme,ADV,aussi,aussi,ADV,",",",",PUNCT,entre,entre,ADP,des,du,ADP DET,premiers,premier,ADJ,centres,centre,NOUN,2019-02-09,2019,2010,NOUN ADP Mercurochrome PUNCT ADP,ADP Mercurochrome PUNCT,NOUN ADP Mercurochrome,DET NOUN ADP Mercurochrome,ADV DET NOUN ADP Mercurochrome,Mercurochrome PUNCT ADP,Mercurochrome PUNCT ADP ADP DET,Mercurochrome PUNCT ADP ADP DET ADJ,"parfum de Mercurochrome , entre","de Mercurochrome ,",parfum de Mercurochrome,un parfum de Mercurochrome,comme un parfum de Mercurochrome,"Mercurochrome , entre","Mercurochrome , entre du","Mercurochrome , entre du premier"
https://next.liberation.fr/cinema/2019/02/26/robert-mitchum-grandeur-et-nonchalance_1711743?xtor=rss-450,liberation.fr,2019-02-26,France,mercurochrome/NOM/mercurochrome,"""  Une  femme  avec  un  talent  véritable  et  un  cul  magnifique  ,  c'  est  très  rare  ""  ,  balance-t-il  en  blaguant  à  la  table  d'  un  restaurant  et  une  ex  raconte  comment  ,  après  avoir  été  maltraité  par  un  de  ses  gardiens  lors  de  son  séjour  en  taule  pour  possession  de  marijuana  ,  il  s'  est  empressé  dès  sa  sortie  d'  emballer  sa  femme  et  de  coucher  avec  en  la  tatouant  de  son  nom  au mercurochrome  .",mercurochrome,nom,mercurochrome,au,au,ADP DET,nom,nom,NOUN,son,son,DET,de,de,ADP,tatouant,tatouer,VERB,.,.,PUNCT,,,,,,,,,,,,,2019-02-26,2019,2010,,ADP DET Mercurochrome PUNCT,NOUN ADP DET Mercurochrome,DET NOUN ADP DET Mercurochrome,ADP DET NOUN ADP DET Mercurochrome,,,,,au Mercurochrome .,nom au Mercurochrome,son nom au Mercurochrome,de son nom au Mercurochrome,,,
https://bibliobs.nouvelobs.com/actualites/20190227.OBS0920/gilets-jaunes-sexe-et-johnny-neuf-fois-nicolas-mathieu-sur-instagram.html?xtor=RSS-17,nouvelobs.com,2019-02-28,France,mercurochrome/NOM/mercurochrome,"Les  genoux  au mercurochrome  ,  les  billes  dans  un  trou  ,  bientôt  il  y  aura  les  filles  ,  demain  le  baccalauréat  et  c'  est  déjà  fini  .",mercurochrome,nom,mercurochrome,au,au,ADP DET,genoux,genou,NOUN,Les,le,DET,,,,,,,",",",",PUNCT,les,le,DET,billes,bille,NOUN,dans,dans,ADP,un,un,DET,2019-02-28,2019,2010,NOUN ADP DET Mercurochrome PUNCT DET,ADP DET Mercurochrome PUNCT,NOUN ADP DET Mercurochrome,DET NOUN ADP DET Mercurochrome,,Mercurochrome PUNCT DET,Mercurochrome PUNCT DET NOUN,Mercurochrome PUNCT DET NOUN ADP,"genou au Mercurochrome , le","au Mercurochrome ,",genou au Mercurochrome,le genou au Mercurochrome,,"Mercurochrome , le","Mercurochrome , le bille","Mercurochrome , le bille dans"
https://www.dhnet.be/regions/tournai-ath-mouscron/frasnes-le-croh-le-centre-de-revalidation-s-occupe-des-oiseaux-handicapes-5c864319d8ad5878f0f82548,dhnet.be,2019-03-11,Belgium,mercurochrome/NOM/mercurochrome,"En  cas  de  plaies  ouvertes  ,  n'  utilisez  surtout  pas  de mercurochrome  .",mercurochrome,nom,mercurochrome,de,de,ADP,pas,pas,ADV,surtout,surtout,ADV,utilisez,utiliser,VERB,n',ne,ADV,.,.,PUNCT,,,,,,,,,,,,,2019-03-11,2019,2010,,ADP Mercurochrome PUNCT,ADV ADP Mercurochrome,ADV ADV ADP Mercurochrome,VERB ADV ADV ADP Mercurochrome,,,,,de Mercurochrome .,pas de Mercurochrome,surtout pas de Mercurochrome,utiliser surtout pas de Mercurochrome,,,
https://www.macg.co/logiciels/2019/03/chrome-le-nouveau-syndrome-internet-explorer-105606,macg.co,2019-03-19,Colombia,MercuroChrome/NAM/MercuroChrome,Prenez  un  peu  de MercuroChrome  et  ça  ira  mieux  .,mercurochrome,nam,mercurochrome,de,de,ADP,peu,peu,ADV,un,un,DET,Prenez,prendre,VERB,,,,et,et,CONJ,ça,cela,PRON,ira,aller,VERB,mieux,mieux,ADV,.,.,PUNCT,2019-03-19,2019,2010,ADV ADP Mercurochrome CONJ PRON,ADP Mercurochrome CONJ,ADV ADP Mercurochrome,DET ADV ADP Mercurochrome,VERB DET ADV ADP Mercurochrome,Mercurochrome CONJ PRON,Mercurochrome CONJ PRON VERB,Mercurochrome CONJ PRON VERB ADV,peu de Mercurochrome et cela,de Mercurochrome et,peu de Mercurochrome,un peu de Mercurochrome,prendre un peu de Mercurochrome,Mercurochrome et cela,Mercurochrome et cela aller,Mercurochrome et cela aller mieux
https://www.monde-diplomatique.fr/1993/03/BEAUGE/45114,monde-diplomatique.fr,2019-03-21,France,mercurochrome/NOM/mercurochrome,Le  linge  taché  (  au  besoin  de mercurochrome  )  qu'  elle  doit  présenter  le  lendemain  matin  à  sa  belle-famille  avant  de  s'  en  entourer  pour  danser  devant  les  invitées  qui  sont  restées  ...,mercurochrome,nom,mercurochrome,de,de,ADP,besoin,besoin,NOUN,au,au,ADP DET,(,(,PUNCT,taché,tacher,VERB,),),PUNCT,qu',que,PRON,elle,elle,PRON,doit,devoir,VERB,présenter,présenter,VERB,2019-03-21,2019,2010,NOUN ADP Mercurochrome PUNCT PRON,ADP Mercurochrome PUNCT,NOUN ADP Mercurochrome,ADP DET NOUN ADP Mercurochrome,PUNCT ADP DET NOUN ADP Mercurochrome,Mercurochrome PUNCT PRON,Mercurochrome PUNCT PRON PRON,Mercurochrome PUNCT PRON PRON VERB,besoin de Mercurochrome ) que,de Mercurochrome ),besoin de Mercurochrome,au besoin de Mercurochrome,( au besoin de Mercurochrome,Mercurochrome ) que,Mercurochrome ) que elle,Mercurochrome ) que elle devoir
https://www.dakaractu.com/SENEGAL-Le-Naufrage-Social-et-la-Reconquete-Sociale_a167491.html,dakaractu.com,2019-03-21,===NONE===,mercurochrome/NOM/mercurochrome,"Depuis  les  années  1980  ,  l'  ajustement  structurel  ,  ""  Du mercurochrome  pour  toutes  les  maladies  ""  ,  demandé  par  les  bailleurs  internationaux  a  fini  par  vider  nos  Etats  de  toute  vitalité  entrainant  nos  populations  dans  l'  ignorance  et  la  misère  la  plus  abjecte  .",mercurochrome,nom,mercurochrome,Du,Du,ADJ,"""","""",PUNCT,",",",",PUNCT,structurel,structurel,ADJ,ajustement,ajustement,NOUN,pour,pour,ADP,toutes,tout,PRON,les,le,DET,maladies,maladie,NOUN,"""","""",PUNCT,2019-03-21,2019,2010,PUNCT ADJ Mercurochrome ADP PRON,ADJ Mercurochrome ADP,PUNCT ADJ Mercurochrome,PUNCT PUNCT ADJ Mercurochrome,ADJ PUNCT PUNCT ADJ Mercurochrome,Mercurochrome ADP PRON,Mercurochrome ADP PRON DET,Mercurochrome ADP PRON DET NOUN,""" Du Mercurochrome pour tout",Du Mercurochrome pour,""" Du Mercurochrome",", "" Du Mercurochrome","structurel , "" Du Mercurochrome",Mercurochrome pour tout,Mercurochrome pour tout le,Mercurochrome pour tout le maladie
https://blogs.lexpress.fr/cinema/2015/11/10/le-spectre-dange-et-gabrielle/,lexpress.fr,2019-05-01,France,mercurochrome/NOM/mercurochrome,"Le  distributeur  a  décidé  de  ne  s'  appuyer  que  sur  la  promo  télé  et  radio  ,  celle-là  même  qui  a  autant  d'  influence  sur  le  public  que  du mercurochrome  sur  une  jambe  de  bois  -parce  qu'  à  l'  heure  des  réseaux  sociaux  et  d'  Internet  ,  plus  personne  n'  est  dupe  .",mercurochrome,nom,mercurochrome,du,du,ADP DET,que,que,CONJ,public,public,NOUN,le,le,DET,sur,sur,ADP,sur,sur,ADP,une,un,DET,jambe,jambe,NOUN,de,de,ADP,bois,bois,NOUN,2019-05-01,2019,2010,CONJ ADP DET Mercurochrome ADP DET,ADP DET Mercurochrome ADP,CONJ ADP DET Mercurochrome,NOUN CONJ ADP DET Mercurochrome,DET NOUN CONJ ADP DET Mercurochrome,Mercurochrome ADP DET,Mercurochrome ADP DET NOUN,Mercurochrome ADP DET NOUN ADP,que du Mercurochrome sur un,du Mercurochrome sur,que du Mercurochrome,public que du Mercurochrome,le public que du Mercurochrome,Mercurochrome sur un,Mercurochrome sur un jambe,Mercurochrome sur un jambe de
http://www.lefigaro.fr/societes/nouvelle-generation-nouveaux-defis-pour-urgo-20190611,lefigaro.fr,2019-06-11,France,Mercurochrome/NAM/Mercurochrome,"À  70  ans  ,  le  fondateur  du  groupe  familial  français  (  Urgo  ,  Juvamine  ,  Humex  , Mercurochrome  ...  )  ,  Hervé  Le  Lous  ,  s'  apprête  à  céder  les  rênes  à  ses  trois  fils  ,  Briac  ,  Tristan  et  Guirec  ,  comme  le  révèle  Le  Figaro  .",mercurochrome,nam,mercurochrome,",",",",PUNCT,Humex,Humex,PROPN,",",",",PUNCT,Juvamine,Juvamine,PROPN,",",",",PUNCT,...,...,PUNCT,),),PUNCT,",",",",PUNCT,Hervé,Hervé,PROPN,Le,le,DET,2019-06-11,2019,2010,PROPN PUNCT Mercurochrome PUNCT PUNCT,PUNCT Mercurochrome PUNCT,PROPN PUNCT Mercurochrome,PUNCT PROPN PUNCT Mercurochrome,PROPN PUNCT PROPN PUNCT Mercurochrome,Mercurochrome PUNCT PUNCT,Mercurochrome PUNCT PUNCT PUNCT,Mercurochrome PUNCT PUNCT PUNCT PROPN,"Humex , Mercurochrome ... )",", Mercurochrome ...","Humex , Mercurochrome",", Humex , Mercurochrome","Juvamine , Humex , Mercurochrome",Mercurochrome ... ),"Mercurochrome ... ) ,","Mercurochrome ... ) , Hervé"
https://www.francetvinfo.fr/bac/calculatrice-en-panne-examinateur-recalcitrant-le-baccalaureat-ce-grand-moment-de-solitude_3487937.html#xtor%3DRSS-3-%255Blestitres%255D,francetvinfo.fr,2019-06-18,France,mercurochrome/NOM/mercurochrome,"Elle  a  même  passé  la  deuxième  épreuve  instrumentale  de  harpe  ,  l'  après-midi  ,  le  genou  recouvert  de mercurochrome  .",mercurochrome,nom,mercurochrome,de,de,ADP,recouvert,recouvrir,VERB,genou,genou,NOUN,le,le,DET,",",",",PUNCT,.,.,PUNCT,,,,,,,,,,,,,2019-06-18,2019,2010,,ADP Mercurochrome PUNCT,VERB ADP Mercurochrome,NOUN VERB ADP Mercurochrome,DET NOUN VERB ADP Mercurochrome,,,,,de Mercurochrome .,recouvrir de Mercurochrome,genou recouvrir de Mercurochrome,le genou recouvrir de Mercurochrome,,,
https://www.rtl.fr/actu/conso/urgo-le-specialiste-de-la-sante-va-etre-repris-par-les-trois-fils-du-fondateur-7797901251,rtl.fr,2019-06-22,France,Mercurochrome/NAM/Mercurochrome,"Ce  sont  aussi  dix  sites  dont  quatre  en  France  :  l'  usine  de  Dijon  est  la  plus  importante  avec  le  médical  et  la  pharmacie  ,  une  usine  de  textile  médical  près  de  Lyon  ,  Superdiet  à  Lille  et  Juvasanté  à  Forbach  ,  avec  Juvamine  et Mercurochrome  .",mercurochrome,nam,mercurochrome,et,et,CONJ,Juvamine,Juvamine,PROPN,avec,avec,ADP,",",",",PUNCT,Forbach,Forbach,PROPN,.,.,PUNCT,,,,,,,,,,,,,2019-06-22,2019,2010,,CONJ Mercurochrome PUNCT,PROPN CONJ Mercurochrome,ADP PROPN CONJ Mercurochrome,PUNCT ADP PROPN CONJ Mercurochrome,,,,,et Mercurochrome .,Juvamine et Mercurochrome,avec Juvamine et Mercurochrome,", avec Juvamine et Mercurochrome",,,
https://www.lesechos.fr/industrie-services/pharmacie-sante/ces-petits-labos-francais-qui-resistent-a-la-big-pharma-1033688,lesechos.fr,2019-06-27,France,Mercurochrome/NAM/Mercurochrome,"Avec  un  budget  annuel  de  recherche  de  25  millions  d'  euros  ,  soit  près  de  4  %  du  chiffre  d'  affaires  ,  le  laboratoire  dijonnais  ,  connu  pour  ses  quatre  marques  grand  public  Urgo  ,  Juvamine  , Mercurochrome  et  Humex  ,  étudie  toutes  les  pistes  pour  accélérer  la  cicatrisation  .",mercurochrome,nam,mercurochrome,",",",",PUNCT,Juvamine,Juvamine,PROPN,",",",",PUNCT,Urgo,Urgo,PROPN,public,public,ADJ,et,et,CONJ,Humex,Humex,PROPN,",",",",PUNCT,étudie,étudier,VERB,toutes,tout,PRON,2019-06-27,2019,2010,PROPN PUNCT Mercurochrome CONJ PROPN,PUNCT Mercurochrome CONJ,PROPN PUNCT Mercurochrome,PUNCT PROPN PUNCT Mercurochrome,PROPN PUNCT PROPN PUNCT Mercurochrome,Mercurochrome CONJ PROPN,Mercurochrome CONJ PROPN PUNCT,Mercurochrome CONJ PROPN PUNCT VERB,"Juvamine , Mercurochrome et Humex",", Mercurochrome et","Juvamine , Mercurochrome",", Juvamine , Mercurochrome","Urgo , Juvamine , Mercurochrome",Mercurochrome et Humex,"Mercurochrome et Humex ,","Mercurochrome et Humex , étudier"
https://business.lesechos.fr/entrepreneurs/success-stories/urgo-un-sparadrap-pour-toutes-les-occasions-330267.php,lesechos.fr,2019-07-01,France,Mercurochrome/NAM/Mercurochrome,"Avec  un  budget  annuel  de  recherche  de  25  millions  d'  euros  ,  soit  près  de  4  %  du  chiffre  d'  affaires  ,  le  laboratoire  dijonnais  ,  connu  pour  ses  quatre  marques  grand  public  Urgo  ,  Juvamine  , Mercurochrome  et  Humex  ,  étudie  toutes  les  pistes  pour  accélérer  la  cicatrisation  .",mercurochrome,nam,mercurochrome,",",",",PUNCT,Juvamine,Juvamine,PROPN,",",",",PUNCT,Urgo,Urgo,PROPN,public,public,ADJ,et,et,CONJ,Humex,Humex,PROPN,",",",",PUNCT,étudie,étudier,VERB,toutes,tout,PRON,2019-07-01,2019,2010,PROPN PUNCT Mercurochrome CONJ PROPN,PUNCT Mercurochrome CONJ,PROPN PUNCT Mercurochrome,PUNCT PROPN PUNCT Mercurochrome,PROPN PUNCT PROPN PUNCT Mercurochrome,Mercurochrome CONJ PROPN,Mercurochrome CONJ PROPN PUNCT,Mercurochrome CONJ PROPN PUNCT VERB,"Juvamine , Mercurochrome et Humex",", Mercurochrome et","Juvamine , Mercurochrome",", Juvamine , Mercurochrome","Urgo , Juvamine , Mercurochrome",Mercurochrome et Humex,"Mercurochrome et Humex ,","Mercurochrome et Humex , étudier"
https://www.laprovence.com/article/sante/5604546/sante-comment-ne-pas-se-blesser-aux-mains-pendant-lete.html,laprovence.com,2019-07-22,France,Mercurochrome/NOM/mercurochrome,"Enfin  ,  sur  la  plaie  ,  évitez  le Mercurochrome  et  le  coton  ,  les  fibres  risquent  de  se  coller  sur  la  plaie  .",mercurochrome,nom,mercurochrome,le,le,DET,évitez,éviter,VERB,",",",",PUNCT,plaie,plaie,NOUN,la,le,DET,et,et,CONJ,le,le,DET,coton,coton,NOUN,",",",",PUNCT,les,le,DET,2019-07-22,2019,2010,VERB DET Mercurochrome CONJ DET,DET Mercurochrome CONJ,VERB DET Mercurochrome,PUNCT VERB DET Mercurochrome,NOUN PUNCT VERB DET Mercurochrome,Mercurochrome CONJ DET,Mercurochrome CONJ DET NOUN,Mercurochrome CONJ DET NOUN PUNCT,éviter le Mercurochrome et le,le Mercurochrome et,éviter le Mercurochrome,", éviter le Mercurochrome","plaie , éviter le Mercurochrome",Mercurochrome et le,Mercurochrome et le coton,"Mercurochrome et le coton ,"
https://www.journaldemontreal.com/2019/08/02/les-vacances-cest-de-la-job,journaldemontreal.com,2019-08-02,Canada,mercurochrome/NOM/mercurochrome,"As-tu  du mercurochrome  ?  Non  ,  je  l'  ai  oublié  à  la  maison  .",mercurochrome,nom,mercurochrome,du,du,ADP DET,As-tu,As-tu,NOUN,,,,,,,,,,?,?,PUNCT,Non,non,ADV,",",",",PUNCT,je,je,PRON,l',la|le,PRON,2019-08-02,2019,2010,NOUN ADP DET Mercurochrome PUNCT ADV,ADP DET Mercurochrome PUNCT,NOUN ADP DET Mercurochrome,,,Mercurochrome PUNCT ADV,Mercurochrome PUNCT ADV PUNCT,Mercurochrome PUNCT ADV PUNCT PRON,As-tu du Mercurochrome ? non,du Mercurochrome ?,As-tu du Mercurochrome,,,Mercurochrome ? non,"Mercurochrome ? non ,","Mercurochrome ? non , je"
https://www.francetvinfo.fr/culture/patrimoine/histoire/il-s-etait-jure-de-remettre-le-drapeau-francais-en-haut-de-la-tour-eiffel-raconte-la-fille-d-un-pompier-qui-a-participe-a-laliberation-de-paris-il-y-a-75-ans_3589055.html#xtor%3DRSS-3-%255Blestitres%255D,francetvinfo.fr,2019-08-25,France,mercurochrome/NOM/mercurochrome,"""  Il  n'  était  pas  question  de  commander  un  drapeau  ,  il  a  donc  été  confectionné  par  des  femmes  d'  officiers  ou  de  sous-officiers  du  régiment  ,  avec  six  grands  draps  teints  au  bleu  de  méthylène  et  du mercurochrome  ou  de  l'  éosine  ""  ,  précise  Jeanne-Marie  Badoche  ,  aujourd  '  hui  âgée  de  92  ans  .",mercurochrome,nom,mercurochrome,du,du,ADP DET,et,et,CONJ,méthylène,méthylène,NOUN,de,de,ADP,bleu,bleu,NOUN,ou,ou,CONJ,de,de,ADP,l',le,DET,éosine,éosine,NOUN,"""","""",PUNCT,2019-08-25,2019,2010,CONJ ADP DET Mercurochrome CONJ ADP,ADP DET Mercurochrome CONJ,CONJ ADP DET Mercurochrome,NOUN CONJ ADP DET Mercurochrome,ADP NOUN CONJ ADP DET Mercurochrome,Mercurochrome CONJ ADP,Mercurochrome CONJ ADP DET,Mercurochrome CONJ ADP DET NOUN,et du Mercurochrome ou de,du Mercurochrome ou,et du Mercurochrome,méthylène et du Mercurochrome,de méthylène et du Mercurochrome,Mercurochrome ou de,Mercurochrome ou de le,Mercurochrome ou de le éosine
http://www.lefigaro.fr/decideurs/herve-le-lous-urgo-est-une-entreprise-apprenante-car-on-ne-s-eleve-qu-en-elevant-les-autres-20190901,lefigaro.fr,2019-09-01,France,Mercurochrome/NAM/Mercurochrome,"Après  avoir  fondé  le  groupe  Urgo  (  Juvamine  ,  Humex  , Mercurochrome  ...  )  qu'  il  a  présidé  pendant  trente  ans  ,  Hervé  Le  Lous  transmet  le  flambeau  à  ses  fils  ,  Briac  ,  Tristan  et  Guirec  ,  sous  la  forme  d'  une  présidence  alternée  .",mercurochrome,nam,mercurochrome,",",",",PUNCT,Humex,Humex,PROPN,",",",",PUNCT,Juvamine,Juvamine,PROPN,(,(,PUNCT,...,...,PUNCT,),),PUNCT,qu',que,PRON,il,il,PRON,a,avoir,VERB,2019-09-01,2019,2010,PROPN PUNCT Mercurochrome PUNCT PUNCT,PUNCT Mercurochrome PUNCT,PROPN PUNCT Mercurochrome,PUNCT PROPN PUNCT Mercurochrome,PROPN PUNCT PROPN PUNCT Mercurochrome,Mercurochrome PUNCT PUNCT,Mercurochrome PUNCT PUNCT PRON,Mercurochrome PUNCT PUNCT PRON PRON,"Humex , Mercurochrome ... )",", Mercurochrome ...","Humex , Mercurochrome",", Humex , Mercurochrome","Juvamine , Humex , Mercurochrome",Mercurochrome ... ),Mercurochrome ... ) que,Mercurochrome ... ) que il
https://www.dhnet.be/regions/tournai-ath-mouscron/pays-vert/l-oree-du-pays-des-collines-est-aux-petits-soins-pour-un-grand-duc-5d80a23dd8ad5878fd4970c3,dhnet.be,2019-09-17,Belgium,mercurochrome/NOM/mercurochrome,"En  cas  de  plaies  ouvertes  ,  n'  utilisez  surtout  pas  de mercurochrome  .",mercurochrome,nom,mercurochrome,de,de,ADP,pas,pas,ADV,surtout,surtout,ADV,utilisez,utiliser,VERB,n',ne,ADV,.,.,PUNCT,,,,,,,,,,,,,2019-09-17,2019,2010,,ADP Mercurochrome PUNCT,ADV ADP Mercurochrome,ADV ADV ADP Mercurochrome,VERB ADV ADV ADP Mercurochrome,,,,,de Mercurochrome .,pas de Mercurochrome,surtout pas de Mercurochrome,utiliser surtout pas de Mercurochrome,,,
