url,website,date,country,keyword,sentence,kw,kw_lemma,kw_pos,left_w1,left_l1,left_p1,left_w2,left_l2,left_p2,left_w3,left_l3,left_p3,left_w4,left_l4,left_p4,left_w5,left_l5,left_p5,right_w1,right_l1,right_p1,right_w2,right_l2,right_p2,right_w3,right_l3,right_p3,right_w4,right_l4,right_p4,right_w5,right_l5,right_p5,datetime,year,10years,pattern_around5,pattern_around3,pattern_left2,pattern_left3,pattern_left4,pattern_right2,pattern_right3,pattern_right4,pattern_around5_lex,pattern_around3_lex,pattern_left2_lex,pattern_left3_lex,pattern_left4_lex,pattern_right2_lex,pattern_right3_lex,pattern_right4_lex
http://www.europapress.es/comunicados/internacional-00907/noticia-comunicado-inter-lubric-china-2018-celebrara-shanghai-noviembre-20180508110042.html,europapress.es,2018-05-08,Spain,WD-40/Z/WD-40,"Patrocinada  por  SINOPEC  Lubricant  Company  ,  PetroChina  Lubricant  Company  y  CCPIT  Shanghai  ,  organizada  por  Shanghai  Intex  ,  Inter  Lubric  China  se  ha  celebrado  anualmente  en  Pekín  ,  Guangzhou  ,  Shanghái  en  los  últimos  18  años  ,  atrayendo  a  más  de  25.000  expositores  entre  los  que  se  incluye  SINOPEC  ,  PetroChina  ,  CNOOC  ,  ExxonMobil  Chemical  ,  Shell  ,  Fuchs  ,  Caltex  ,  GS  Oil  ,  INEOS  ,  G-Energy  ,  BASF  ,  Chemtura  ,  Dow  ,  Lubrizol  ,  HUNTSMAN  ,  Croda  ,  Henkel  ,  LUKOIL  ,  ENI  ,  SK  ,  Afton  ,  Valvoline  ,  Total  , WD-40  ,  ENEOS  ,  AMALIE  ,  Emery  ,  Petromin  ,  Sephan  Oil  ,  SASOL  ,  MicRos  ,  LOPAL  ,  HANDI  ,  NACO  ,  Jama  ,  LiuGong  ,  etc.  La  muestra  ha  sido  visitada  por  más  de  200.000  profesionales  ,  entre  ellos  fabricantes  ,  proveedores  ,  distribuidores  y  usuarios  finales  .",wd-40,z,wd-40,",",",",Fc,Total,total,NP00000,",",",",Fc,Valvoline,valvoline,NP00000,",",",",Fc,",",",",Fc,ENEOS,eneos,NP00000,",",",",Fc,AMALIE,amalie,NP00000,",",",",Fc,2018-05-08,2018,2010,NP00000 Fc WD-40 Fc NP00000,Fc WD-40 Fc,NP00000 Fc WD-40,Fc NP00000 Fc WD-40,NP00000 Fc NP00000 Fc WD-40,WD-40 Fc NP00000,WD-40 Fc NP00000 Fc,WD-40 Fc NP00000 Fc NP00000,"total , WD-40 , eneos",", WD-40 ,","total , WD-40",", total , WD-40","valvoline , total , WD-40","WD-40 , eneos","WD-40 , eneos ,","WD-40 , eneos , amalie"
http://www.icrowdsp.com/2018/12/26/analisis-de-crecimiento-de-mercado-mundial-desoxidantes-2018-2023-por-top-principales-jugadores-reckitt-benckiser-group-jelmar-3m-especialista-en-rust-oleum-wd-40/,icrowdsp.com,2018-12-26,===NONE===,WD-40/Z/WD-40,"<doc uri=http://www.icrowdsp.com/2018/12/26/analisis-de-crecimiento-de-mercado-mundial-desoxidantes-2018-2023-por-top-principales-jugadores-reckitt-benckiser-group-jelmar-3m-especialista-en-rust-oleum-wd-40/ website=icrowdsp.com date=2018-12-26 source_country=> /análisis/NCMN000 /de/SPS00 /crecimiento/NCMS000 /de/SPS00 /mercado/NCMS000 /mundial/AQ0CS0 /desoxidante/AQ0CP0 /(/Fpa /2018-2023/Z /)/Fpt /por/SPS00 /top/NP00000 /principal/AQ0CP0 /jugador/NCMP000 /&#8211/Z /;/Fx /reckitt/NP00000 /benckiser/NP00000 /group/NP00000 /,/Fc /jelmar/NP00000 /,/Fc /3M/Z /,/Fc /especialista/AQ0CS0 /en/SPS00 /rust-oleum/NP00000 /,/Fc WD-40 ",wd-40,z,wd-40,",",",",Fc,RUST-OLEUM,rust-oleum,NP00000,en,en,SPS00,especialista,especialista,AQ0CS0,",",",",Fc,,,,,,,,,,,,,,,,2018-12-26,2018,2010,,,NP00000 Fc WD-40,SPS00 NP00000 Fc WD-40,AQ0CS0 SPS00 NP00000 Fc WD-40,,,,,,"rust-oleum , WD-40","en rust-oleum , WD-40","especialista en rust-oleum , WD-40",,,
https://www.prnewswire.com/news-releases/interlubric-china-celebrara-su-20-o-aniversario-en-guangzhou-893257545.html,prnewswire.com,2019-03-08,United States,WD-40/Z/WD-40,"Entre  ellos  se  encuentran  ExxonMobil  ,  Shell  ,  BP  ,  Fuchs  ,  Caltex  ,  GS  Oil  ,  INEOS  ,  G-Energy  ,  BASF  ,  Chemtura  ,  Dow  ,  Lubrizol  ,  Croda  ,  Henkel  ,  Lukoil  ,  Afton  ,  Valvoline  ,  Total  y WD-40  ,  por  nombrar  algunos  .",wd-40,z,wd-40,y,y,CC,Total,total,NP00000,",",",",Fc,Valvoline,valvoline,NP00000,",",",",Fc,",",",",Fc,por,por,SPS00,nombrar,nombrar,VMN0000,algunos,alguno,PI0MP000,.,.,Fp,2019-03-08,2019,2010,NP00000 CC WD-40 Fc SPS00,CC WD-40 Fc,NP00000 CC WD-40,Fc NP00000 CC WD-40,NP00000 Fc NP00000 CC WD-40,WD-40 Fc SPS00,WD-40 Fc SPS00 VMN0000,WD-40 Fc SPS00 VMN0000 PI0MP000,"total y WD-40 , por","y WD-40 ,",total y WD-40,", total y WD-40","valvoline , total y WD-40","WD-40 , por","WD-40 , por nombrar","WD-40 , por nombrar alguno"
https://www.lanacion.com.ar/espectaculos/candelaria-tinelli-estoy-dispuesta-escuchar-criticas-no-nid2231931,lanacion.com.ar,2019-03-26,Argentina,WD-40/Z/WD-40,"Tírenme  algo  ,  [  el  acetie  lubricante  para  metales  ] WD-40  en  las  rodillas  .",wd-40,z,wd-40,],],Fct,metales,metal,NCMP000,para,para,SPS00,lubricante,lubricante,AQ0CS0,acetie,acetie,NCFS000,en,en,SPS00,las,el,DA0FP0,rodillas,rodilla,NCFP000,.,.,Fp,,,,2019-03-26,2019,2010,NCMP000 Fct WD-40 SPS00 DA0FP0,Fct WD-40 SPS00,NCMP000 Fct WD-40,SPS00 NCMP000 Fct WD-40,AQ0CS0 SPS00 NCMP000 Fct WD-40,WD-40 SPS00 DA0FP0,WD-40 SPS00 DA0FP0 NCFP000,WD-40 SPS00 DA0FP0 NCFP000 Fp,metal ] WD-40 en el,] WD-40 en,metal ] WD-40,para metal ] WD-40,lubricante para metal ] WD-40,WD-40 en el,WD-40 en el rodilla,WD-40 en el rodilla .
http://www.icrowdsp.com/2019/04/02/frankie-keyes-mas-confiable-a-experto-en-ciberseguridad-dicen-los-iniciados-de-industria/,icrowdsp.com,2019-04-02,===NONE===,WD-40/Z/WD-40,"F.A.K.E.  seguridad  contó  con  stand  propio  en  el  encuentro  anual  de  la  industria  (  por  segundo  año  consecutivo  )  ,  donde  Frankie  Keyes  continuó  su  ascenso  meteórico  a  la  fama  de  geek  por  vendiendo  su  último  kit  de  ciberseguridad  :  conducto  de  cinta  y WD-40  .",wd-40,z,wd-40,y,y,CC,cinta,cinta,NCFS000,de,de,SPS00,conducto,conducto,NCMS000,:,:,Fd,.,.,Fp,,,,,,,,,,,,,2019-04-02,2019,2010,,CC WD-40 Fp,NCFS000 CC WD-40,SPS00 NCFS000 CC WD-40,NCMS000 SPS00 NCFS000 CC WD-40,,,,,y WD-40 .,cinta y WD-40,de cinta y WD-40,conducto de cinta y WD-40,,,
http://www.rebelion.org/noticia.php?id=257381,rebelion.org,2019-06-21,===NONE===,WD-40/Z/WD-40,"Para  la  derecha  añeja  y  golpista  ,  un  grupo  anarquista  y  peligroso  ;  para  la  nueva  mayoría  ,  oxigeno  renovador  y WD-40  para  los  engranajes  oxidados  de  esta  Democracia  tutelada  ;  y  para  la  izquierda  ,  un  cúmulo  de  amarillos  pequeño  burgueses  que  defraudan  a  Lenin  y  a  Marx  con  su  discurso  simplón  y  cuidadanista  ,  que  con  sus  consignas  sólo  le  hacen  el  juego  a  la  derecha  ,  ya  que  la  institución  es  una  vaca  sagrada  que  nadie  ,  excepto  el  fascismo  y  sus  aliados  deben  tocar  .",wd-40,z,wd-40,y,y,CC,renovador,renovador,AQ0MS0,oxigeno,oxigenar,VMIP1S0,",",",",Fc,mayoría,mayoría,NCFS000,para,para,SPS00,los,el,DA0MP0,engranajes,engranaje,NCMP000,oxidados,oxidar,VMP00PM,de,de,SPS00,2019-06-21,2019,2010,AQ0MS0 CC WD-40 SPS00 DA0MP0,CC WD-40 SPS00,AQ0MS0 CC WD-40,VMIP1S0 AQ0MS0 CC WD-40,Fc VMIP1S0 AQ0MS0 CC WD-40,WD-40 SPS00 DA0MP0,WD-40 SPS00 DA0MP0 NCMP000,WD-40 SPS00 DA0MP0 NCMP000 VMP00PM,renovador y WD-40 para el,y WD-40 para,renovador y WD-40,oxigenar renovador y WD-40,", oxigenar renovador y WD-40",WD-40 para el,WD-40 para el engranaje,WD-40 para el engranaje oxidar
https://www.laprensa.com.ni/2019/07/29/suplemento/empresariales/2573949-2573949,laprensa.com.ni,2019-07-29,Nicaragua,WD-40/Z/WD-40,"""  En  esta  ocasión  también  incluimos  accesorios  de  nuestra  línea  automotriz  como  cargadores  de  baterías  y  diferentes  modelos  de  gata  hidraúlica  ,  ya  sea  de  lagarto  o  botella  ,  o  bien  puede  optar  por  la  línea  de  lubricantes WD-40  que  trae  30  %  de  ahorro  .",wd-40,z,wd-40,lubricantes,lubricante,NCMP000,de,de,SPS00,línea,línea,NCFS000,la,el,DA0FS0,por,por,SPS00,que,que,PR0CN000,trae,traer,VMIP3S0,30,30,Z,%,%,Ft,de,de,SPS00,2019-07-29,2019,2010,SPS00 NCMP000 WD-40 PR0CN000 VMIP3S0,NCMP000 WD-40 PR0CN000,SPS00 NCMP000 WD-40,NCFS000 SPS00 NCMP000 WD-40,DA0FS0 NCFS000 SPS00 NCMP000 WD-40,WD-40 PR0CN000 VMIP3S0,WD-40 PR0CN000 VMIP3S0 Z,WD-40 PR0CN000 VMIP3S0 Z Ft,de lubricante WD-40 que traer,lubricante WD-40 que,de lubricante WD-40,línea de lubricante WD-40,el línea de lubricante WD-40,WD-40 que traer,WD-40 que traer 30,WD-40 que traer 30 %
https://as.com/opinion/2019/08/18/blogs/1566147407_697581.html#ref%3Drss%26format%3Dsimple%26link%3Dlink,as.com,2019-08-18,===NONE===,WD-40/Z/WD-40,"A  los  que  les  vaya  más  la  adrenalina  podrán  disfrutar  del  Red  Bull  Dirt  Jump  ,  el  Pump  Track  ,  el WD-40  Biketrial  o  el  Looping  Bike  .",wd-40,z,wd-40,el,el,DA0MS0,",",",",Fc,Track,track,NP00000,Pump,pump,NP00000,el,el,DA0MS0,Biketrial,biketrial,NP00000,o,o,CC,el,el,DA0MS0,Looping,looping,NP00000,Bike,bike,NP00000,2019-08-18,2019,2010,Fc DA0MS0 WD-40 NP00000 CC,DA0MS0 WD-40 NP00000,Fc DA0MS0 WD-40,NP00000 Fc DA0MS0 WD-40,NP00000 NP00000 Fc DA0MS0 WD-40,WD-40 NP00000 CC,WD-40 NP00000 CC DA0MS0,WD-40 NP00000 CC DA0MS0 NP00000,", el WD-40 biketrial o",el WD-40 biketrial,", el WD-40","track , el WD-40","pump track , el WD-40",WD-40 biketrial o,WD-40 biketrial o el,WD-40 biketrial o el looping
https://www.cmdsport.com/ciclismo/festibike-ofrecera-servicios-fisioterapia-lavado-bicis/,cmdsport.com,2019-08-29,===NONE===,WD-40/Z/WD-40,"Además  de  estar  presente  en  la  zona  de  exposición  de  la  feria  con  su  nueva  gama  de  producto WD-40  Bike  ,  la  marca  tendrá  también  una  presencia  activa  en  la  zona  de  actividades  con  un  servicio  técnico  junto  al  lavado  de  bicicletas  Bosch  .",wd-40,z,wd-40,producto,producto,NCMS000,de,de,SPS00,gama,gama,NCFS000,nueva,nuevo,AQ0FS0,su,su,DP3CS0,Bike,bike,NP00000,",",",",Fc,la,el,DA0FS0,marca,marca,NCFS000,tendrá,tener,VMIF3S0,2019-08-29,2019,2010,SPS00 NCMS000 WD-40 NP00000 Fc,NCMS000 WD-40 NP00000,SPS00 NCMS000 WD-40,NCFS000 SPS00 NCMS000 WD-40,AQ0FS0 NCFS000 SPS00 NCMS000 WD-40,WD-40 NP00000 Fc,WD-40 NP00000 Fc DA0FS0,WD-40 NP00000 Fc DA0FS0 NCFS000,"de producto WD-40 bike ,",producto WD-40 bike,de producto WD-40,gama de producto WD-40,nuevo gama de producto WD-40,"WD-40 bike ,","WD-40 bike , el","WD-40 bike , el marca"
https://www.cmdsport.com/ciclismo/festibike-ofrecera-servicios-fisioterapia-lavado-bicis/,cmdsport.com,2019-08-29,===NONE===,WD-40/Z/WD-40,Esta  carpa  contará  con  personal  técnico  de  la  marca  y  una  amplia  gama  de  producto WD-40  Bike  para  realizar  el  mantenimiento  y  cuidado  especializado  de  la  transmisión  y  engranajes  de  las  bicicletas  presentes  en  Festibike  .,wd-40,z,wd-40,producto,producto,NCMS000,de,de,SPS00,gama,gama,NCFS000,amplia,amplio,AQ0FS0,una,uno,DI0FS0,Bike,bike,NP00000,para,para,SPS00,realizar,realizar,VMN0000,el,el,DA0MS0,mantenimiento,mantenimiento,NCMS000,2019-08-29,2019,2010,SPS00 NCMS000 WD-40 NP00000 SPS00,NCMS000 WD-40 NP00000,SPS00 NCMS000 WD-40,NCFS000 SPS00 NCMS000 WD-40,AQ0FS0 NCFS000 SPS00 NCMS000 WD-40,WD-40 NP00000 SPS00,WD-40 NP00000 SPS00 VMN0000,WD-40 NP00000 SPS00 VMN0000 DA0MS0,de producto WD-40 bike para,producto WD-40 bike,de producto WD-40,gama de producto WD-40,amplio gama de producto WD-40,WD-40 bike para,WD-40 bike para realizar,WD-40 bike para realizar el
https://www.interempresas.net/Ferreteria/Articulos/255237-Spray-Multi-Uso-Flexible-WD-40-candidato-candidato-VI-Premio-Especial-Innovacion.html,interempresas.net,2019-09-25,===NONE===,WD-40/Z/WD-40,"<doc uri=https://www.interempresas.net/Ferreteria/Articulos/255237-Spray-Multi-Uso-Flexible-WD-40-candidato-candidato-VI-Premio-Especial-Innovacion.html website=interempresas.net date=2019-09-25 source_country=> WD-40  Producto  Multi-Uso  Flexible  protege  el  metal  del  óxido  y  la  corrosión  ,  libera  piezas  atascadas  ,  desplaza  la  humedad  y  lubrica  .",wd-40,z,wd-40,,,,,,,,,,,,,,,,Producto,producto,NP00000,Multi-Uso,multi-uso,NP00000,Flexible,flexible,NP00000,protege,proteger,VMIP3S0,el,el,DA0MS0,2019-09-25,2019,2010,,,,,,WD-40 NP00000 NP00000,WD-40 NP00000 NP00000 NP00000,WD-40 NP00000 NP00000 NP00000 VMIP3S0,,,,,,WD-40 producto multi-uso,WD-40 producto multi-uso flexible,WD-40 producto multi-uso flexible proteger
https://la100.cienradios.com/violo-y-mato-a-una-chica-despues-les-escribio-una-carta-a-sus-padres-no-cedan-al-odio-como-lo-hice/,cienradios.com,2019-10-03,===NONE===,WD-40/Z/WD-40,"Después  de  realizar  este  aberrante  hecho  ,  la  cubrió  con  un  aerosol  inflamable WD-40  antes  de  encenderlo  en  los  suburbios  de  Melbourne  en  enero  pasado  .",wd-40,z,wd-40,inflamable,inflamable,AQ0CS0,aerosol,aerosol,NCMS000,un,uno,DI0MS0,con,con,SPS00,cubrió,cubrir,VMIS3S0,antes,antes,RG,de,de,SPS00,encenderlo,encender+lo,VMN0000+PP3CNA00,en,en,SPS00,los,el,DA0MP0,2019-10-03,2019,2010,NCMS000 AQ0CS0 WD-40 RG SPS00,AQ0CS0 WD-40 RG,NCMS000 AQ0CS0 WD-40,DI0MS0 NCMS000 AQ0CS0 WD-40,SPS00 DI0MS0 NCMS000 AQ0CS0 WD-40,WD-40 RG SPS00,WD-40 RG SPS00 VMN0000+PP3CNA00,WD-40 RG SPS00 VMN0000+PP3CNA00 SPS00,aerosol inflamable WD-40 antes de,inflamable WD-40 antes,aerosol inflamable WD-40,uno aerosol inflamable WD-40,con uno aerosol inflamable WD-40,WD-40 antes de,WD-40 antes de encender+lo,WD-40 antes de encender+lo en
https://ar.cienradios.com/la-carta-de-disculpas-de-un-asesino-a-los-padres-de-su-victima-no-cedan-al-odio-como-lo-hice/,cienradios.com,2019-10-03,===NONE===,WD-40/Z/WD-40,"Mientras  que  estaba  inconsciente  ,  el  hombre  la  roció  con WD-40  y  la  prendió  fuego  con  un  encendedor  en  los  suburbios  de  Melbourne  .",wd-40,z,wd-40,con,con,SPS00,roció,rociar,VMIS3S0,la,lo,PP3FSA00,hombre,hombre,NCMS000,el,el,DA0MS0,y,y,CC,la,lo,PP3FSA00,prendió,prender,VMIS3S0,fuego,fuego,NCMS000,con,con,SPS00,2019-10-03,2019,2010,VMIS3S0 SPS00 WD-40 CC PP3FSA00,SPS00 WD-40 CC,VMIS3S0 SPS00 WD-40,PP3FSA00 VMIS3S0 SPS00 WD-40,NCMS000 PP3FSA00 VMIS3S0 SPS00 WD-40,WD-40 CC PP3FSA00,WD-40 CC PP3FSA00 VMIS3S0,WD-40 CC PP3FSA00 VMIS3S0 NCMS000,rociar con WD-40 y lo,con WD-40 y,rociar con WD-40,lo rociar con WD-40,hombre lo rociar con WD-40,WD-40 y lo,WD-40 y lo prender,WD-40 y lo prender fuego
https://www.latimes.com/espanol/eeuu/articulo/2019-12-30/este-sacerdote-catolico-celebra-la-misa-en-un-casino-el-llama-a-la-oracion-una-apuesta-segura,latimes.com,2019-12-30,USA,WD-40/Z/WD-40,Comenzó  una  homilía  insistiendo  en  que  las  únicas  herramientas  que  alguien  necesitaba  en  la  vida  eran WD-40  y  un  rollo  de  cinta  adhesiva  .,wd-40,z,wd-40,eran,ser,VSII3P0,vida,vida,NCFS000,la,el,DA0FS0,en,en,SPS00,necesitaba,necesitar,VMII3S0,y,y,CC,un,1,Z,rollo,rollo,NCMS000,de,de,SPS00,cinta,cinta,NCFS000,2019-12-30,2019,2010,NCFS000 VSII3P0 WD-40 CC Z,VSII3P0 WD-40 CC,NCFS000 VSII3P0 WD-40,DA0FS0 NCFS000 VSII3P0 WD-40,SPS00 DA0FS0 NCFS000 VSII3P0 WD-40,WD-40 CC Z,WD-40 CC Z NCMS000,WD-40 CC Z NCMS000 SPS00,vida ser WD-40 y 1,ser WD-40 y,vida ser WD-40,el vida ser WD-40,en el vida ser WD-40,WD-40 y 1,WD-40 y 1 rollo,WD-40 y 1 rollo de
https://es.gizmodo.com/la-historia-del-aceite-multiusos-wd-40-es-la-cosa-mas-e-1841599793,gizmodo.com,2020-02-11,===NONE===,WD-40/Z/WD-40,"<doc uri=https://es.gizmodo.com/la-historia-del-aceite-multiusos-wd-40-es-la-cosa-mas-e-1841599793 website=gizmodo.com date=2020-02-11 source_country=> /en/SPS00 /1/AO0MS0 /lugar/NCMS000 /,/Fc /dejar+me/VMM03P0+PP1CS000 /aclarar/VMN0000 /que/CS /,/Fc /si/CS /bien/RG /estar/VAIP1S0 /hablar/VMG0000 /de+el/SPS00+DA0MS0 /aceite/NCMS000 /multiuso/NCMP000 WD-40  ,  un  producto  disponible  en  el  mercado  ,  no  me  importa  si  lo  compras  o  no  .",wd-40,z,wd-40,multiusos,multiuso,NCMP000,aceite,aceite,NCMS000,del,de+el,SPS00+DA0MS0,hablando,hablar,VMG0000,estoy,estar,VAIP1S0,",",",",Fc,un,uno,DI0MS0,producto,producto,NCMS000,disponible,disponible,AQ0CS0,en,en,SPS00,2020-02-11,2020,2020,NCMS000 NCMP000 WD-40 Fc DI0MS0,NCMP000 WD-40 Fc,NCMS000 NCMP000 WD-40,SPS00+DA0MS0 NCMS000 NCMP000 WD-40,VMG0000 SPS00+DA0MS0 NCMS000 NCMP000 WD-40,WD-40 Fc DI0MS0,WD-40 Fc DI0MS0 NCMS000,WD-40 Fc DI0MS0 NCMS000 AQ0CS0,"aceite multiuso WD-40 , uno","multiuso WD-40 ,",aceite multiuso WD-40,de+el aceite multiuso WD-40,hablar de+el aceite multiuso WD-40,"WD-40 , uno","WD-40 , uno producto","WD-40 , uno producto disponible"
https://es.gizmodo.com/la-historia-del-aceite-multiusos-wd-40-es-la-cosa-mas-e-1841599793,gizmodo.com,2020-02-11,===NONE===,WD-40/Z/WD-40,"No  me  importa  si  nunca  más  vuelves  a  comprar WD-40  para  usarlo  en  el  automóvil  ,  aunque  sea  solo  para  fastidiarme  .",wd-40,z,wd-40,comprar,comprar,VMN0000,a,a,SPS00,vuelves,volver,VMIP2S0,más,más,RG,nunca,nunca,RG,para,para,SPS00,usarlo,usar+lo,VMN0000+PP3CNA00,en,en,SPS00,el,el,DA0MS0,automóvil,automóvil,NCMS000,2020-02-11,2020,2020,SPS00 VMN0000 WD-40 SPS00 VMN0000+PP3CNA00,VMN0000 WD-40 SPS00,SPS00 VMN0000 WD-40,VMIP2S0 SPS00 VMN0000 WD-40,RG VMIP2S0 SPS00 VMN0000 WD-40,WD-40 SPS00 VMN0000+PP3CNA00,WD-40 SPS00 VMN0000+PP3CNA00 SPS00,WD-40 SPS00 VMN0000+PP3CNA00 SPS00 DA0MS0,a comprar WD-40 para usar+lo,comprar WD-40 para,a comprar WD-40,volver a comprar WD-40,más volver a comprar WD-40,WD-40 para usar+lo,WD-40 para usar+lo en,WD-40 para usar+lo en el
https://es.gizmodo.com/la-historia-del-aceite-multiusos-wd-40-es-la-cosa-mas-e-1841599793,gizmodo.com,2020-02-11,===NONE===,WD-40/Z/WD-40,"Solo  quiero  hablar  sobre  la  historia  de WD-40  ,  que  ,  creo  ,  es  tan  interesante  como  inesperada  .",wd-40,z,wd-40,de,de,SPS00,historia,historia,NCFS000,la,el,DA0FS0,sobre,sobre,SPS00,hablar,hablar,VMN0000,",",",",Fc,que,que,CS,",",",",Fc,creo,crear,VMIP1S0,",",",",Fc,2020-02-11,2020,2020,NCFS000 SPS00 WD-40 Fc CS,SPS00 WD-40 Fc,NCFS000 SPS00 WD-40,DA0FS0 NCFS000 SPS00 WD-40,SPS00 DA0FS0 NCFS000 SPS00 WD-40,WD-40 Fc CS,WD-40 Fc CS Fc,WD-40 Fc CS Fc VMIP1S0,"historia de WD-40 , que","de WD-40 ,",historia de WD-40,el historia de WD-40,sobre el historia de WD-40,"WD-40 , que","WD-40 , que ,","WD-40 , que , crear"
https://es.gizmodo.com/la-historia-del-aceite-multiusos-wd-40-es-la-cosa-mas-e-1841599793,gizmodo.com,2020-02-11,===NONE===,WD-40/Z/WD-40,"La  compañía  Rocket  Chemical  pronto  descubrió  que  los  empleados  se  llevaban  a  casa  el WD-40  para  sus  propios  usos  personales  y  posiblemente  eróticos  (  no  comprobados  )  ,  por  lo  que  comenzaron  a  comercializarlo  en  latas  a  partir  de  1958  .",wd-40,z,wd-40,el,el,DA0MS0,casa,casa,NCFS000,a,a,SPS00,llevaban,llevar,VMII3P0,se,se,P00CN000,para,para,SPS00,sus,su,DP3CP0,propios,propio,AQ0MP0,usos,uso,NCMP000,personales,personal,AQ0CP0,2020-02-11,2020,2020,NCFS000 DA0MS0 WD-40 SPS00 DP3CP0,DA0MS0 WD-40 SPS00,NCFS000 DA0MS0 WD-40,SPS00 NCFS000 DA0MS0 WD-40,VMII3P0 SPS00 NCFS000 DA0MS0 WD-40,WD-40 SPS00 DP3CP0,WD-40 SPS00 DP3CP0 AQ0MP0,WD-40 SPS00 DP3CP0 AQ0MP0 NCMP000,casa el WD-40 para su,el WD-40 para,casa el WD-40,a casa el WD-40,llevar a casa el WD-40,WD-40 para su,WD-40 para su propio,WD-40 para su propio uso
https://es.gizmodo.com/la-historia-del-aceite-multiusos-wd-40-es-la-cosa-mas-e-1841599793,gizmodo.com,2020-02-11,===NONE===,WD-40/Z/WD-40,"Las  primeras  latas  de WD-40  incluían  una  silueta  de  cohete  en  el  logotipo  ,  dando  una  pista  sobre  los  orígenes  del  producto  ,  aunque  las  actualizaciones  más  recientes  del  logotipo  no  dan  ninguna  pista  sobre  los  orígenes  del  mismo  .",wd-40,z,wd-40,de,de,SPS00,latas,lata,NCFP000,primeras,1,AO0FP0,Las,el,DA0FP0,,,,incluían,incluir,VMII3P0,una,uno,DI0FS0,silueta,silueta,NCFS000,de,de,SPS00,cohete,cohete,NCMS000,2020-02-11,2020,2020,NCFP000 SPS00 WD-40 VMII3P0 DI0FS0,SPS00 WD-40 VMII3P0,NCFP000 SPS00 WD-40,AO0FP0 NCFP000 SPS00 WD-40,DA0FP0 AO0FP0 NCFP000 SPS00 WD-40,WD-40 VMII3P0 DI0FS0,WD-40 VMII3P0 DI0FS0 NCFS000,WD-40 VMII3P0 DI0FS0 NCFS000 SPS00,lata de WD-40 incluir uno,de WD-40 incluir,lata de WD-40,1 lata de WD-40,el 1 lata de WD-40,WD-40 incluir uno,WD-40 incluir uno silueta,WD-40 incluir uno silueta de
https://es.gizmodo.com/la-historia-del-aceite-multiusos-wd-40-es-la-cosa-mas-e-1841599793,gizmodo.com,2020-02-11,===NONE===,WD-40/Z/WD-40,"En  1969  ,  la  compañía  finalmente  cambió  su  nombre  de  Rocket  Chemical  Company  a WD-40  ,  ya  que  ese  seguía  siendo  su  único  producto  .",wd-40,z,wd-40,a,a,SPS00,Company,company,NP00000,Chemical,chemical,NP00000,Rocket,rocket,NP00000,de,de,SPS00,",",",",Fc,ya,ya,RG,que,que,CS,ese,ese,PD0MS000,seguía,seguir,VMII3S0,2020-02-11,2020,2020,NP00000 SPS00 WD-40 Fc RG,SPS00 WD-40 Fc,NP00000 SPS00 WD-40,NP00000 NP00000 SPS00 WD-40,NP00000 NP00000 NP00000 SPS00 WD-40,WD-40 Fc RG,WD-40 Fc RG CS,WD-40 Fc RG CS PD0MS000,"company a WD-40 , ya","a WD-40 ,",company a WD-40,chemical company a WD-40,rocket chemical company a WD-40,"WD-40 , ya","WD-40 , ya que","WD-40 , ya que ese"
https://es.gizmodo.com/la-historia-del-aceite-multiusos-wd-40-es-la-cosa-mas-e-1841599793,gizmodo.com,2020-02-11,===NONE===,WD-40/Z/WD-40,La  fórmula  de WD-40  es  un  secreto  .,wd-40,z,wd-40,de,de,SPS00,fórmula,fórmula,NCFS000,La,el,DA0FS0,,,,,,,es,ser,VSIP3S0,un,uno,DI0MS0,secreto,secreto,NCMS000,.,.,Fp,,,,2020-02-11,2020,2020,NCFS000 SPS00 WD-40 VSIP3S0 DI0MS0,SPS00 WD-40 VSIP3S0,NCFS000 SPS00 WD-40,DA0FS0 NCFS000 SPS00 WD-40,,WD-40 VSIP3S0 DI0MS0,WD-40 VSIP3S0 DI0MS0 NCMS000,WD-40 VSIP3S0 DI0MS0 NCMS000 Fp,fórmula de WD-40 ser uno,de WD-40 ser,fórmula de WD-40,el fórmula de WD-40,,WD-40 ser uno,WD-40 ser uno secreto,WD-40 ser uno secreto .
https://es.gizmodo.com/la-historia-del-aceite-multiusos-wd-40-es-la-cosa-mas-e-1841599793,gizmodo.com,2020-02-11,===NONE===,WD-40/Z/WD-40,"Y  para  recordar  una  vez  más  que  este  artículo  no  está  patrocinado  ,  voy  a  repetir  un  rumor  que  escuché  sobre  el WD-40  y  que  incluye  una  adorable  nutria  eyaculada  como  ingrediente  principal  .",wd-40,z,wd-40,el,el,DA0MS0,sobre,sobre,SPS00,escuché,escuchar,VMIS1S0,que,que,PR0CN000,rumor,rumor,NCMS000,y,y,CC,que,que,PR0CN000,incluye,incluir,VMIP3S0,una,uno,DI0FS0,adorable,adorable,AQ0CS0,2020-02-11,2020,2020,SPS00 DA0MS0 WD-40 CC PR0CN000,DA0MS0 WD-40 CC,SPS00 DA0MS0 WD-40,VMIS1S0 SPS00 DA0MS0 WD-40,PR0CN000 VMIS1S0 SPS00 DA0MS0 WD-40,WD-40 CC PR0CN000,WD-40 CC PR0CN000 VMIP3S0,WD-40 CC PR0CN000 VMIP3S0 DI0FS0,sobre el WD-40 y que,el WD-40 y,sobre el WD-40,escuchar sobre el WD-40,que escuchar sobre el WD-40,WD-40 y que,WD-40 y que incluir,WD-40 y que incluir uno
https://es.gizmodo.com/la-historia-del-aceite-multiusos-wd-40-es-la-cosa-mas-e-1841599793,gizmodo.com,2020-02-11,===NONE===,WD-40/Z/WD-40,"Nuevamente  ,  no  tengo  pruebas  ,  pero  estoy  bastante  seguro  de  que  este  no  es  el  tipo  de  cosas  que  las  personas  de WD-40  quieren  asociar  con  su  fluido  resbaladizo  que  se  excreta  a  través  de  un  tubo  rojo  largo  y  delgado  .",wd-40,z,wd-40,de,de,SPS00,personas,persona,NCFP000,las,el,DA0FP0,que,que,PR0CN000,cosas,cosa,NCFP000,quieren,querer,VMIP3P0,asociar,asociar,VMN0000,con,con,SPS00,su,su,DP3CS0,fluido,fluido,NCMS000,2020-02-11,2020,2020,NCFP000 SPS00 WD-40 VMIP3P0 VMN0000,SPS00 WD-40 VMIP3P0,NCFP000 SPS00 WD-40,DA0FP0 NCFP000 SPS00 WD-40,PR0CN000 DA0FP0 NCFP000 SPS00 WD-40,WD-40 VMIP3P0 VMN0000,WD-40 VMIP3P0 VMN0000 SPS00,WD-40 VMIP3P0 VMN0000 SPS00 DP3CS0,persona de WD-40 querer asociar,de WD-40 querer,persona de WD-40,el persona de WD-40,que el persona de WD-40,WD-40 querer asociar,WD-40 querer asociar con,WD-40 querer asociar con su
https://es.gizmodo.com/la-historia-del-aceite-multiusos-wd-40-es-la-cosa-mas-e-1841599793,gizmodo.com,2020-02-11,===NONE===,WD-40/Z/WD-40,Tampoco  les  gustaría  el  rumor  de  que  el  olor  del WD-40  hace  que  la  mayoría  de  las  personas  se  sientan  húmedas  .,wd-40,z,wd-40,del,de+el,SPS00+DA0MS0,olor,olor,NCMS000,el,el,DA0MS0,que,que,CS,de,de,SPS00,hace,hacer,VMIP3S0,que,que,CS,la,el,DA0FS0,mayoría,mayoría,NCFS000,de,de,SPS00,2020-02-11,2020,2020,NCMS000 SPS00+DA0MS0 WD-40 VMIP3S0 CS,SPS00+DA0MS0 WD-40 VMIP3S0,NCMS000 SPS00+DA0MS0 WD-40,DA0MS0 NCMS000 SPS00+DA0MS0 WD-40,CS DA0MS0 NCMS000 SPS00+DA0MS0 WD-40,WD-40 VMIP3S0 CS,WD-40 VMIP3S0 CS DA0FS0,WD-40 VMIP3S0 CS DA0FS0 NCFS000,olor de+el WD-40 hacer que,de+el WD-40 hacer,olor de+el WD-40,el olor de+el WD-40,que el olor de+el WD-40,WD-40 hacer que,WD-40 hacer que el,WD-40 hacer que el mayoría
https://www.elespanol.com/como/quitar-pegamento-manos-trucos-caseros/470704036_0.html,elespanol.com,2020-03-01,===NONE===,WD-40/Z/WD-40,Aplica  un  poco  de WD-40  en  un  trapo  o  papel  y  frota  la  zona  donde  tengas  pegamento  .,wd-40,z,wd-40,de,de,SPS00,poco,poco,PI0MS000,un,uno,DI0MS0,Aplica,aplicar,VMIP3S0,,,,en,en,SPS00,un,uno,DI0MS0,trapo,trapo,NCMS000,o,o,CC,papel,papel,NCMS000,2020-03-01,2020,2020,PI0MS000 SPS00 WD-40 SPS00 DI0MS0,SPS00 WD-40 SPS00,PI0MS000 SPS00 WD-40,DI0MS0 PI0MS000 SPS00 WD-40,VMIP3S0 DI0MS0 PI0MS000 SPS00 WD-40,WD-40 SPS00 DI0MS0,WD-40 SPS00 DI0MS0 NCMS000,WD-40 SPS00 DI0MS0 NCMS000 CC,poco de WD-40 en uno,de WD-40 en,poco de WD-40,uno poco de WD-40,aplicar uno poco de WD-40,WD-40 en uno,WD-40 en uno trapo,WD-40 en uno trapo o
https://www.interempresas.net/Ferreteria/Articulos/267233-Soledad-Rodriguez-nueva-responsable-de-Ecommerce-y-Digital-de-WD-40.html,interempresas.net,2020-03-04,===NONE===,WD-40/Z/WD-40,"<doc uri=https://www.interempresas.net/Ferreteria/Articulos/267233-Soledad-Rodriguez-nueva-responsable-de-Ecommerce-y-Digital-de-WD-40.html website=interempresas.net date=2020-03-04 source_country=> /soledad/NP00000 /rodríguez/NP00000 /,/Fc /nuevo/AQ0FS0 /responsable/NCCS000 /de/SPS00 /ecommerce/NP00000 /y/CC /digital/NP00000 /de/SPS00 WD-40 ",wd-40,z,wd-40,de,de,SPS00,Digital,digital,NP00000,y,y,CC,Ecommerce,ecommerce,NP00000,de,de,SPS00,,,,,,,,,,,,,,,,2020-03-04,2020,2020,,,NP00000 SPS00 WD-40,CC NP00000 SPS00 WD-40,NP00000 CC NP00000 SPS00 WD-40,,,,,,digital de WD-40,y digital de WD-40,ecommerce y digital de WD-40,,,
