url,website,date,country,keyword,sentence,kw,kw_lemma,kw_pos,left_w1,left_l1,left_p1,left_w2,left_l2,left_p2,left_w3,left_l3,left_p3,left_w4,left_l4,left_p4,left_w5,left_l5,left_p5,right_w1,right_l1,right_p1,right_w2,right_l2,right_p2,right_w3,right_l3,right_p3,right_w4,right_l4,right_p4,right_w5,right_l5,right_p5,datetime,year,10years,pattern_around5,pattern_around3,pattern_left2,pattern_left3,pattern_left4,pattern_right2,pattern_right3,pattern_right4,pattern_around5_lex,pattern_around3_lex,pattern_left2_lex,pattern_left3_lex,pattern_left4_lex,pattern_right2_lex,pattern_right3_lex,pattern_right4_lex
https://elpais.com/elpais/2020/01/27/escaparate/1580118388_415752.html,elpais.com,2020-02-02,Spain,Silk-épil/NP00000/silk-épil,"Así  ,  en  esta  comparativa  de  depiladoras  baratas  participan  :  Babyliss  G822E  (  con  una  puntuación  media  de  8  puntos  )  ,  Braun Silk-épil  9  9-561  (  8,75  )  ,  Philips  Satinelle  Advanced  BRE65000  (  8  )  ,  Rowenta  EP8080  Skin  Perfect  (  7,5  )  y  Remington  EP7700  (  8,25  )  .",silk-épil,np00000,silk-épil,Braun,braun,NP00000,",",",",Fc,),),Fpt,puntos,punto,NCMP000,8,8,Z,9,9,Z,9-561,9-561,Z,(,(,Fpa,"8,75",8.75,Z,),),Fpt,2020-02-02,2020,2020,Fc NP00000 Silk-épil Z Z,NP00000 Silk-épil Z,Fc NP00000 Silk-épil,Fpt Fc NP00000 Silk-épil,NCMP000 Fpt Fc NP00000 Silk-épil,Silk-épil Z Z,Silk-épil Z Z Fpa,Silk-épil Z Z Fpa Z,", braun Silk-épil 9 9-561",braun Silk-épil 9,", braun Silk-épil",") , braun Silk-épil","punto ) , braun Silk-épil",Silk-épil 9 9-561,Silk-épil 9 9-561 (,Silk-épil 9 9-561 ( 8.75
https://www.20minutos.es/noticia/4158051/0/tres-ventajas-de-depilarse-en-casa-que-solo-tendran-sentido-si-tienes-las-maquinillas-mas-regaladas-de-amazon/,20minutos.es,2020-02-21,Spain,Silk-épil/NP00000/silk-épil,-  Braun Silk-épil  .,silk-épil,np00000,silk-épil,Braun,braun,NP00000,-,-,Fg,,,,,,,,,,.,.,Fp,,,,,,,,,,,,,2020-02-21,2020,2020,,NP00000 Silk-épil Fp,Fg NP00000 Silk-épil,,,,,,,braun Silk-épil .,- braun Silk-épil,,,,,
https://elpais.com/elpais/2020/03/11/escaparate/1583938803_060877.html#ref%3Drss%26format%3Dsimple%26link%3Dlink,elpais.com,2020-03-12,Spain,Silk-épil/NP00000/silk-épil,-  Braun Silk-épil  9  9-561  .,silk-épil,np00000,silk-épil,Braun,braun,NP00000,-,-,Fg,,,,,,,,,,9,9,Z,9-561,9-561,Z,.,.,Fp,,,,,,,2020-03-12,2020,2020,Fg NP00000 Silk-épil Z Z,NP00000 Silk-épil Z,Fg NP00000 Silk-épil,,,Silk-épil Z Z,Silk-épil Z Z Fp,,- braun Silk-épil 9 9-561,braun Silk-épil 9,- braun Silk-épil,,,Silk-épil 9 9-561,Silk-épil 9 9-561 .,
https://www.elperiodico.com/es/mas-belleza/20200403/metodos-depilacion-facil-efectiva-casa-propuestas-braun-7915534,elperiodico.com,2020-04-03,===NONE===,Silk-épil/NP00000/silk-épil,"Nuestra  recomendación  es  la Silk-épil  9  de  Braun  ,  se  puede  utilizar  bajo  la  ducha  con  agua  templada  que  ayudará  a  reducir  las  molestias  ya  que  se  liberan  endorfinas  y  actúa  como  analgésico  natural  de  nuestro  cuerpo  .",silk-épil,np00000,silk-épil,la,el,DA0FS0,es,ser,VSIP3S0,recomendación,recomendación,NCFS000,Nuestra,nuestro,DP1FSP,,,,9,9,Z,de,de,SPS00,Braun,braun,NP00000,",",",",Fc,se,se,P00CN000,2020-04-03,2020,2020,VSIP3S0 DA0FS0 Silk-épil Z SPS00,DA0FS0 Silk-épil Z,VSIP3S0 DA0FS0 Silk-épil,NCFS000 VSIP3S0 DA0FS0 Silk-épil,DP1FSP NCFS000 VSIP3S0 DA0FS0 Silk-épil,Silk-épil Z SPS00,Silk-épil Z SPS00 NP00000,Silk-épil Z SPS00 NP00000 Fc,ser el Silk-épil 9 de,el Silk-épil 9,ser el Silk-épil,recomendación ser el Silk-épil,nuestro recomendación ser el Silk-épil,Silk-épil 9 de,Silk-épil 9 de braun,"Silk-épil 9 de braun ,"
http://www.regiondigital.com/noticias/reportajes/325673-depiladoras-una-herramienta-para-la-belleza.html,regiondigital.com,2020-04-08,===NONE===,Silk-épil/NP00000/silk-épil,"Uno  de  los  modelos  más  populares  dentro  de  los  inalámbricos  es  la  Braun Silk-épil  9  9/890  Wet  &  Dry  con  tecnología  SensoSmart  ,  una  depiladora  que  incluye  nada  menos  que  7  accesorios  .",silk-épil,np00000,silk-épil,Braun,braun,NP00000,la,el,DA0FS0,es,ser,VSIP3S0,inalámbricos,inalámbrico,NCMP000,los,el,DA0MP0,9,9,Z,9/890,9,890/Z,Wet,wet,NP00000,&,&,Fz,Dry,dry,NP00000,2020-04-08,2020,2020,DA0FS0 NP00000 Silk-épil Z 890/Z,NP00000 Silk-épil Z,DA0FS0 NP00000 Silk-épil,VSIP3S0 DA0FS0 NP00000 Silk-épil,NCMP000 VSIP3S0 DA0FS0 NP00000 Silk-épil,Silk-épil Z 890/Z,Silk-épil Z 890/Z NP00000,Silk-épil Z 890/Z NP00000 Fz,el braun Silk-épil 9 9,braun Silk-épil 9,el braun Silk-épil,ser el braun Silk-épil,inalámbrico ser el braun Silk-épil,Silk-épil 9 9,Silk-épil 9 9 wet,Silk-épil 9 9 wet &
http://www.regiondigital.com/noticias/reportajes/325673-depiladoras-una-herramienta-para-la-belleza.html,regiondigital.com,2020-04-08,===NONE===,Silk-épil/NP00000/silk-épil,"La  cantidad  de  estos  elementos  es  bastante  amplia  ,  desde  distintos  tipos  de  cabezales  hasta  cargadores  ,  guías  de  corte  ...  hasta  accesorios  para  aplicar  masajes  de  alta  frecuencia  que  consiguen  una  depilación  extra  suave  ,  como  es  el  caso  de  la  Braun Silk-épil  9  9-561  .",silk-épil,np00000,silk-épil,Braun,braun,NP00000,la,el,DA0FS0,de,de,SPS00,caso,caso,NCMS000,el,el,DA0MS0,9,9,Z,9-561,9-561,Z,.,.,Fp,,,,,,,2020-04-08,2020,2020,DA0FS0 NP00000 Silk-épil Z Z,NP00000 Silk-épil Z,DA0FS0 NP00000 Silk-épil,SPS00 DA0FS0 NP00000 Silk-épil,NCMS000 SPS00 DA0FS0 NP00000 Silk-épil,Silk-épil Z Z,Silk-épil Z Z Fp,,el braun Silk-épil 9 9-561,braun Silk-épil 9,el braun Silk-épil,de el braun Silk-épil,caso de el braun Silk-épil,Silk-épil 9 9-561,Silk-épil 9 9-561 .,
https://www.quien.com/belleza/2020/04/29/depilacion-perfecta-sin-salir-de-tu-casa,quien.com,2020-04-30,Mexico,Silk-épil/NP00000/silk-épil, Silk-épil  9  SkinSpa  5  en  1  es  una  gran  opción  ya  que  tiene  un  sensor  que  te  va  diciendo  cuánta  presión  debes  hacer  para  asegurarte  de  que  la  depilación  se  haga  de  forma  correcta  .,silk-épil,np00000,silk-épil,,,,,,,,,,,,,,,,9,9,Z,SkinSpa,skinspa,NP00000,5,5,Z,en,en,SPS00,1,1,Z,2020-04-30,2020,2020,,,,,,Silk-épil Z NP00000,Silk-épil Z NP00000 Z,Silk-épil Z NP00000 Z SPS00,,,,,,Silk-épil 9 skinspa,Silk-épil 9 skinspa 5,Silk-épil 9 skinspa 5 en
https://www.lavanguardia.com/comprar/20200513/481129233212/mejores-depiladoras-electricas-depilar-piernas-casa-cuarentena.html,lavanguardia.com,2020-05-13,Spain,Silk-épil/NP00000/silk-épil,"Esta  es  ,  sin  duda  ,  el  '  top  ventas  '  dentro  de  la  gama Silk-épil  de  la  marca  Braun  .",silk-épil,np00000,silk-épil,gama,gama,NCFS000,la,el,DA0FS0,de,de,SPS00,dentro,dentro,RG,',',Fe,de,de,SPS00,la,el,DA0FS0,marca,marca,NCFS000,Braun,braun,NP00000,.,.,Fp,2020-05-13,2020,2020,DA0FS0 NCFS000 Silk-épil SPS00 DA0FS0,NCFS000 Silk-épil SPS00,DA0FS0 NCFS000 Silk-épil,SPS00 DA0FS0 NCFS000 Silk-épil,RG SPS00 DA0FS0 NCFS000 Silk-épil,Silk-épil SPS00 DA0FS0,Silk-épil SPS00 DA0FS0 NCFS000,Silk-épil SPS00 DA0FS0 NCFS000 NP00000,el gama Silk-épil de el,gama Silk-épil de,el gama Silk-épil,de el gama Silk-épil,dentro de el gama Silk-épil,Silk-épil de el,Silk-épil de el marca,Silk-épil de el marca braun
https://www.lavanguardia.com/comprar/20200513/481129233212/mejores-depiladoras-electricas-depilar-piernas-casa-cuarentena.html,lavanguardia.com,2020-05-13,Spain,Silk-épil/NP00000/silk-épil,"Si  no  quieres  gastarte  tanto  dinero  puedes  elegir  este  modelo  se Silk-épil  que  ,  aunque  es  menos  moderno  y  trae  menos  accesorios  que  los  otros  ,  consigue  grandes  resultados  por  mucho  menos  .",silk-épil,np00000,silk-épil,se,se,P00CN000,modelo,modelo,NCCS000,este,este,DD0MS0,elegir,elegir,VMN0000,puedes,poder,VMIP2S0,que,que,PR0CN000,",",",",Fc,aunque,aunque,CC,es,ser,VSIP3S0,menos,menos,RG,2020-05-13,2020,2020,NCCS000 P00CN000 Silk-épil PR0CN000 Fc,P00CN000 Silk-épil PR0CN000,NCCS000 P00CN000 Silk-épil,DD0MS0 NCCS000 P00CN000 Silk-épil,VMN0000 DD0MS0 NCCS000 P00CN000 Silk-épil,Silk-épil PR0CN000 Fc,Silk-épil PR0CN000 Fc CC,Silk-épil PR0CN000 Fc CC VSIP3S0,"modelo se Silk-épil que ,",se Silk-épil que,modelo se Silk-épil,este modelo se Silk-épil,elegir este modelo se Silk-épil,"Silk-épil que ,","Silk-épil que , aunque","Silk-épil que , aunque ser"
https://www.europapress.es/chance/gente/noticia-aprendizaje-cristina-pedroche-cuarentena-ahora-valoras-mas-cosas-pequenas-20200522143705.html,europapress.es,2020-05-22,Spain,Silk-épil/NP00000/silk-épil,"La  presentadora  ha  sido  la  encargada  de  presentar  la  nueva Silk-épil  9  Flex  ,  una  depiladora  eléctrica  que  promete  seguir  el  ritmo  y  las  curvas  de  todas  las  que  la  usen  .",silk-épil,np00000,silk-épil,nueva,nuevo,AQ0FS0,la,el,DA0FS0,presentar,presentar,VMN0000,de,de,SPS00,encargada,encargado,NCFS000,9,9,Z,Flex,flex,NP00000,",",",",Fc,una,uno,DI0FS0,depiladora,depilador,AQ0FS0,2020-05-22,2020,2020,DA0FS0 AQ0FS0 Silk-épil Z NP00000,AQ0FS0 Silk-épil Z,DA0FS0 AQ0FS0 Silk-épil,VMN0000 DA0FS0 AQ0FS0 Silk-épil,SPS00 VMN0000 DA0FS0 AQ0FS0 Silk-épil,Silk-épil Z NP00000,Silk-épil Z NP00000 Fc,Silk-épil Z NP00000 Fc DI0FS0,el nuevo Silk-épil 9 flex,nuevo Silk-épil 9,el nuevo Silk-épil,presentar el nuevo Silk-épil,de presentar el nuevo Silk-épil,Silk-épil 9 flex,"Silk-épil 9 flex ,","Silk-épil 9 flex , uno"
https://elpais.com/elpais/2020/06/04/escaparate/1591263464_610650.html,elpais.com,2020-06-08,Spain,Silk-épil/NP00000/silk-épil,-  Depiladora  eléctrica Silk-épil  3  3-321  y  recortadora  para  la  línea  del  bikini  .,silk-épil,np00000,silk-épil,eléctrica,eléctrico,AQ0FS0,Depiladora,depiladora,NP00000,-,-,Fg,,,,,,,3,3,Z,3-321,3-321,Z,y,y,CC,recortadora,recortador,AQ0FS0,para,para,SPS00,2020-06-08,2020,2020,NP00000 AQ0FS0 Silk-épil Z Z,AQ0FS0 Silk-épil Z,NP00000 AQ0FS0 Silk-épil,Fg NP00000 AQ0FS0 Silk-épil,,Silk-épil Z Z,Silk-épil Z Z CC,Silk-épil Z Z CC AQ0FS0,depiladora eléctrico Silk-épil 3 3-321,eléctrico Silk-épil 3,depiladora eléctrico Silk-épil,- depiladora eléctrico Silk-épil,,Silk-épil 3 3-321,Silk-épil 3 3-321 y,Silk-épil 3 3-321 y recortador
https://elpais.com/elpais/2020/06/04/escaparate/1591263464_610650.html,elpais.com,2020-06-08,Spain,Silk-épil/NP00000/silk-épil,-  Depiladora  eléctrica  inalámbrica Silk-épil  5  5-511  Wet  &  Dry  .,silk-épil,np00000,silk-épil,inalámbrica,inalámbrico,AQ0FS0,eléctrica,eléctrico,AQ0FS0,Depiladora,depiladora,NP00000,-,-,Fg,,,,5,5,Z,5-511,5-511,Z,Wet,wet,NP00000,&,&,Fz,Dry,dry,NP00000,2020-06-08,2020,2020,AQ0FS0 AQ0FS0 Silk-épil Z Z,AQ0FS0 Silk-épil Z,AQ0FS0 AQ0FS0 Silk-épil,NP00000 AQ0FS0 AQ0FS0 Silk-épil,Fg NP00000 AQ0FS0 AQ0FS0 Silk-épil,Silk-épil Z Z,Silk-épil Z Z NP00000,Silk-épil Z Z NP00000 Fz,eléctrico inalámbrico Silk-épil 5 5-511,inalámbrico Silk-épil 5,eléctrico inalámbrico Silk-épil,depiladora eléctrico inalámbrico Silk-épil,- depiladora eléctrico inalámbrico Silk-épil,Silk-épil 5 5-511,Silk-épil 5 5-511 wet,Silk-épil 5 5-511 wet &
https://elpais.com/elpais/2020/07/06/escaparate/1594049928_705689.html,elpais.com,2020-07-07,Spain,Silk-épil/NP00000/silk-épil,-  Depiladora  eléctrica  Braun Silk-épil  5  Wet  &  Dry  5-511  .,silk-épil,np00000,silk-épil,Braun,braun,NP00000,eléctrica,eléctrico,AQ0FS0,Depiladora,depiladora,NP00000,-,-,Fg,,,,5,5,Z,Wet,wet,NP00000,&,&,Fz,Dry,dry,NP00000,5-511,5-511,Z,2020-07-07,2020,2020,AQ0FS0 NP00000 Silk-épil Z NP00000,NP00000 Silk-épil Z,AQ0FS0 NP00000 Silk-épil,NP00000 AQ0FS0 NP00000 Silk-épil,Fg NP00000 AQ0FS0 NP00000 Silk-épil,Silk-épil Z NP00000,Silk-épil Z NP00000 Fz,Silk-épil Z NP00000 Fz NP00000,eléctrico braun Silk-épil 5 wet,braun Silk-épil 5,eléctrico braun Silk-épil,depiladora eléctrico braun Silk-épil,- depiladora eléctrico braun Silk-épil,Silk-épil 5 wet,Silk-épil 5 wet &,Silk-épil 5 wet & dry
https://elpais.com/elpais/2020/07/15/escaparate/1594807606_971378.html,elpais.com,2020-07-16,Spain,Silk-Épil/NP00000/silk-épil,Hablamos  de  la  depiladora  eléctrica  Braun Silk-Épil  9002  Flex  Wet  &  Dry  .,silk-épil,np00000,silk-épil,Braun,braun,NP00000,eléctrica,eléctrico,AQ0FS0,depiladora,depilador,AQ0FS0,la,el,DA0FS0,de,de,SPS00,9002,9002,Z,Flex,flex,NP00000,Wet,wet,NP00000,&,&,Fz,Dry,dry,NP00000,2020-07-16,2020,2020,AQ0FS0 NP00000 Silk-épil Z NP00000,NP00000 Silk-épil Z,AQ0FS0 NP00000 Silk-épil,AQ0FS0 AQ0FS0 NP00000 Silk-épil,DA0FS0 AQ0FS0 AQ0FS0 NP00000 Silk-épil,Silk-épil Z NP00000,Silk-épil Z NP00000 NP00000,Silk-épil Z NP00000 NP00000 Fz,eléctrico braun Silk-épil 9002 flex,braun Silk-épil 9002,eléctrico braun Silk-épil,depilador eléctrico braun Silk-épil,el depilador eléctrico braun Silk-épil,Silk-épil 9002 flex,Silk-épil 9002 flex wet,Silk-épil 9002 flex wet &
https://elpais.com/elpais/2020/07/15/escaparate/1594807606_971378.html,elpais.com,2020-07-16,Spain,Silk-Épil/NP00000/silk-épil,"Para  poder  utilizarla  por  todo  el  cuerpo  y  en  cualquier  situación  ,  el  pack  de  la Silk-Épil  9002  Flex  Wet  &  Dry  incluye  el  cabezal  principal  (  un  40  %  más  ancho  para  eliminar  más  vello  de  una  pasada  )  ,  otro  más  de  rasurado  ,  otro  de  recorte  y  un  capuchón  adicional  para  conseguir  mayor  contacto  con  la  piel  .",silk-épil,np00000,silk-épil,la,el,DA0FS0,de,de,SPS00,pack,pack,NCMS000,el,el,DA0MS0,",",",",Fc,9002,9002,Z,Flex,flex,NP00000,Wet,wet,NP00000,&,&,Fz,Dry,dry,NP00000,2020-07-16,2020,2020,SPS00 DA0FS0 Silk-épil Z NP00000,DA0FS0 Silk-épil Z,SPS00 DA0FS0 Silk-épil,NCMS000 SPS00 DA0FS0 Silk-épil,DA0MS0 NCMS000 SPS00 DA0FS0 Silk-épil,Silk-épil Z NP00000,Silk-épil Z NP00000 NP00000,Silk-épil Z NP00000 NP00000 Fz,de el Silk-épil 9002 flex,el Silk-épil 9002,de el Silk-épil,pack de el Silk-épil,el pack de el Silk-épil,Silk-épil 9002 flex,Silk-épil 9002 flex wet,Silk-épil 9002 flex wet &
https://www.diariogol.com/gossip/cristina-pedroche-ensena-su-truco-de-190-euros-para-lucir-las-mejores-piernas-del-verano_20087591_102.html,diariogol.com,2020-08-06,===NONE===,Silk-épil/NP00000/silk-épil,"Concretamente  ,  del  modelo Silk-épil  9-010  ,  que  tal  y  como  ha  compartido  en  su  cuenta  de  Instagram  ,  Pedroche  utiliza  a  menudo  para  mostrar  unas  piernas  suaves  y  perfiladas  .",silk-épil,np00000,silk-épil,modelo,modelo,NCCS000,del,de+el,SPS00+DA0MS0,",",",",Fc,Concretamente,concretamente,RG,,,,9-010,9-010,Z,",",",",Fc,que,que,CS,tal,tal,PD0CS000,y,y,CC,2020-08-06,2020,2020,SPS00+DA0MS0 NCCS000 Silk-épil Z Fc,NCCS000 Silk-épil Z,SPS00+DA0MS0 NCCS000 Silk-épil,Fc SPS00+DA0MS0 NCCS000 Silk-épil,RG Fc SPS00+DA0MS0 NCCS000 Silk-épil,Silk-épil Z Fc,Silk-épil Z Fc CS,Silk-épil Z Fc CS PD0CS000,"de+el modelo Silk-épil 9-010 ,",modelo Silk-épil 9-010,de+el modelo Silk-épil,", de+el modelo Silk-épil","concretamente , de+el modelo Silk-épil","Silk-épil 9-010 ,","Silk-épil 9-010 , que","Silk-épil 9-010 , que tal"
https://www.diariogol.com/gossip/cristina-pedroche-ensena-su-truco-de-190-euros-para-lucir-las-mejores-piernas-del-verano_20087591_102.html,diariogol.com,2020-08-06,===NONE===,Silk-épil/NP00000/silk-épil,"Este  truquito  de  Pedroche  tiene  un  precio  en  las  tiendas  de  190  euros  ,  y  como  define  la  marca  ,  ""  la  nueva  Braun Silk-épil  9-010  es  la  primera  depiladora  mujer  eléctrica  del  mundo  con  un  cabezal  totalmente  flexible  para  depilarse  sin  esfuerzo  ""  .",silk-épil,np00000,silk-épil,Braun,braun,NP00000,nueva,nuevo,AQ0FS0,la,el,DA0FS0,"""","""",Fe,",",",",Fc,9-010,9-010,Z,es,ser,VSIP3S0,la,el,DA0FS0,primera,1,AO0FS0,depiladora,depilador,AQ0FS0,2020-08-06,2020,2020,AQ0FS0 NP00000 Silk-épil Z VSIP3S0,NP00000 Silk-épil Z,AQ0FS0 NP00000 Silk-épil,DA0FS0 AQ0FS0 NP00000 Silk-épil,Fe DA0FS0 AQ0FS0 NP00000 Silk-épil,Silk-épil Z VSIP3S0,Silk-épil Z VSIP3S0 DA0FS0,Silk-épil Z VSIP3S0 DA0FS0 AO0FS0,nuevo braun Silk-épil 9-010 ser,braun Silk-épil 9-010,nuevo braun Silk-épil,el nuevo braun Silk-épil,""" el nuevo braun Silk-épil",Silk-épil 9-010 ser,Silk-épil 9-010 ser el,Silk-épil 9-010 ser el 1
https://www.vozpopuli.com/parati/Afeitadoras-depiladoras-Braun-Amazon_0_1399060572.html,vozpopuli.com,2020-10-08,===NONE===,Silk-épil/NP00000/silk-épil,"Otro  aspecto  destacable  de  esta  Braun Silk-épil  es  su  versatilidad  ,  ya  que  incluye  distintos  cabezales  para  satisfacer  todo  tipo  de  necesidades  (  masaje  ,  precisión  ,  recorte  ,  zonas  sensibles  ,  afeitado  ...  )  .",silk-épil,np00000,silk-épil,Braun,braun,NP00000,esta,este,DD0FS0,de,de,SPS00,destacable,destacable,AQ0CS0,aspecto,aspecto,NCMS000,es,ser,VSIP3S0,su,su,DP3CS0,versatilidad,versatilidad,NCFS000,",",",",Fc,ya,ya,RG,2020-10-08,2020,2020,DD0FS0 NP00000 Silk-épil VSIP3S0 DP3CS0,NP00000 Silk-épil VSIP3S0,DD0FS0 NP00000 Silk-épil,SPS00 DD0FS0 NP00000 Silk-épil,AQ0CS0 SPS00 DD0FS0 NP00000 Silk-épil,Silk-épil VSIP3S0 DP3CS0,Silk-épil VSIP3S0 DP3CS0 NCFS000,Silk-épil VSIP3S0 DP3CS0 NCFS000 Fc,este braun Silk-épil ser su,braun Silk-épil ser,este braun Silk-épil,de este braun Silk-épil,destacable de este braun Silk-épil,Silk-épil ser su,Silk-épil ser su versatilidad,"Silk-épil ser su versatilidad ,"
https://www.alimarket.es/electro/noticia/r492762/braun-presenta-los-regalos--beauty--con-los-que-triunfar-en-navidad,alimarket.es,2020-10-30,Spain,Silk-épil/NP00000/silk-épil,Braun Silk-épil  9  Flex  es  el  último  lanzamiento  de  Braun  y  es  una  auténtica  revolución  .,silk-épil,np00000,silk-épil,Braun,braun,NP00000,,,,,,,,,,,,,9,9,Z,Flex,flex,NP00000,es,ser,VSIP3S0,el,el,DA0MS0,último,último,AO0MS0,2020-10-30,2020,2020,,NP00000 Silk-épil Z,,,,Silk-épil Z NP00000,Silk-épil Z NP00000 VSIP3S0,Silk-épil Z NP00000 VSIP3S0 DA0MS0,,braun Silk-épil 9,,,,Silk-épil 9 flex,Silk-épil 9 flex ser,Silk-épil 9 flex ser el
https://www.lavanguardia.com/comprar/20201112/49416168746/salon-belleza-casa-tratamientos-productos-tu-misma-cuidado-piel-depilacion-manicura-pedicura.html,lavanguardia.com,2020-11-12,Spain,Silk-épil/NP00000/silk-épil,La  Braun Silk-épil  Flex  9020  es  uno  de  los  últimos  modelos  que  ha  lanzado  a  la  venta  la  marca  Braun  .,silk-épil,np00000,silk-épil,Braun,braun,NP00000,La,el,DA0FS0,,,,,,,,,,Flex,flex,NP00000,9020,9020,Z,es,ser,VSIP3S0,uno,uno,PI0MS000,de,de,SPS00,2020-11-12,2020,2020,DA0FS0 NP00000 Silk-épil NP00000 Z,NP00000 Silk-épil NP00000,DA0FS0 NP00000 Silk-épil,,,Silk-épil NP00000 Z,Silk-épil NP00000 Z VSIP3S0,Silk-épil NP00000 Z VSIP3S0 PI0MS000,el braun Silk-épil flex 9020,braun Silk-épil flex,el braun Silk-épil,,,Silk-épil flex 9020,Silk-épil flex 9020 ser,Silk-épil flex 9020 ser uno
https://www.vozpopuli.com/parati/maquinas-depiladoras-respetaran-piel-depilacion_0_1413459010.html,vozpopuli.com,2020-11-25,===NONE===,Silk-épil/NP00000/silk-épil,"Tal  es  el  caso  de  la  Braun Silk-épil  9  ,  a  cuyas  numerosas  virtudes  técnicas  se  suma  el  descuento  del  Black  Friday  ,  que  la  deja  un  38  %  más  barata  .",silk-épil,np00000,silk-épil,Braun,braun,NP00000,la,el,DA0FS0,de,de,SPS00,caso,caso,NCMS000,el,el,DA0MS0,9,9,Z,",",",",Fc,a,a,SPS00,cuyas,cuyo,PR0FP000,numerosas,numeroso,AQ0FP0,2020-11-25,2020,2020,DA0FS0 NP00000 Silk-épil Z Fc,NP00000 Silk-épil Z,DA0FS0 NP00000 Silk-épil,SPS00 DA0FS0 NP00000 Silk-épil,NCMS000 SPS00 DA0FS0 NP00000 Silk-épil,Silk-épil Z Fc,Silk-épil Z Fc SPS00,Silk-épil Z Fc SPS00 PR0FP000,"el braun Silk-épil 9 ,",braun Silk-épil 9,el braun Silk-épil,de el braun Silk-épil,caso de el braun Silk-épil,"Silk-épil 9 ,","Silk-épil 9 , a","Silk-épil 9 , a cuyo"
https://computerhoy.com/noticias/tecnologia/depiladora-luz-pulsada-barata-nunca-amazon-braun-baja-299eu-black-friday-763107,computerhoy.com,2020-11-26,===NONE===,Silk-épil/NP00000/silk-épil,"La  tecnología  de  luz  pulsada  intensa  IPL  tiene  muchas  ventajas  frente  a  las  técnicas  tradicionales  de  arrancado  ,  como  la  cera  o  las  depiladoras  convencionales  de  tipo Silk-épil  .",silk-épil,np00000,silk-épil,tipo,tipo,NCMS000,de,de,SPS00,convencionales,convencional,NCMP000,depiladoras,depilador,AQ0FP0,las,el,DA0FP0,.,.,Fp,,,,,,,,,,,,,2020-11-26,2020,2020,,NCMS000 Silk-épil Fp,SPS00 NCMS000 Silk-épil,NCMP000 SPS00 NCMS000 Silk-épil,AQ0FP0 NCMP000 SPS00 NCMS000 Silk-épil,,,,,tipo Silk-épil .,de tipo Silk-épil,convencional de tipo Silk-épil,depilador convencional de tipo Silk-épil,,,
https://www.20minutos.es/noticia/4492066/0/seis-en-uno-y-con-un-43-de-rebaja-asi-es-el-beauty-gadget-para-conseguir-una-piel-perfecta-de-la-mano-de-braun/,20minutos.es,2020-11-28,Spain,Silk-épil/NP00000/silk-épil,"Buceando  en  el  catálogo  rebajado  por  el  Viernes  Negro  de  El  Corte  Inglés  hemos  dado  con  un  dispositivo  que  nos  ofrece  seis  tratamientos  en  uno  :  la  depiladora  Braun Silk-épil  9  Flex  9300  que  está  rebajada  un  43  %  y  puede  ser  tuya  por  menos  de  170  euros  y  ,  a  cambio  ,  te  ofrece  toda  una  experiencia  de  belleza  .",silk-épil,np00000,silk-épil,Braun,braun,NP00000,depiladora,depilador,AQ0FS0,la,el,DA0FS0,:,:,Fd,uno,uno,PI0MS000,9,9,Z,Flex,flex,NP00000,9300,9300,Z,que,que,PR0CN000,está,estar,VAIP3S0,2020-11-28,2020,2020,AQ0FS0 NP00000 Silk-épil Z NP00000,NP00000 Silk-épil Z,AQ0FS0 NP00000 Silk-épil,DA0FS0 AQ0FS0 NP00000 Silk-épil,Fd DA0FS0 AQ0FS0 NP00000 Silk-épil,Silk-épil Z NP00000,Silk-épil Z NP00000 Z,Silk-épil Z NP00000 Z PR0CN000,depilador braun Silk-épil 9 flex,braun Silk-épil 9,depilador braun Silk-épil,el depilador braun Silk-épil,: el depilador braun Silk-épil,Silk-épil 9 flex,Silk-épil 9 flex 9300,Silk-épil 9 flex 9300 que
https://www.vanitatis.elconfidencial.com/estilo/belleza/2020-11-30/cyber-monday-amazon-braun-ofertas-depilacion-cuidado_2853115/,elconfidencial.com,2020-11-30,===NONE===,Silk-épil/NP00000/silk-épil,La  clásica  depiladora  eléctrica Silk-épil  se  presenta  con  una  nueva  tecnología  SensoSmart  que  ayuda  a  mejorar  la  eliminación  del  vello  .,silk-épil,np00000,silk-épil,eléctrica,eléctrico,AQ0FS0,depiladora,depilador,AQ0FS0,clásica,clásico,AQ0FS0,La,el,DA0FS0,,,,se,se,P00CN000,presenta,presentar,VMIP3S0,con,con,SPS00,una,uno,DI0FS0,nueva,nuevo,AQ0FS0,2020-11-30,2020,2020,AQ0FS0 AQ0FS0 Silk-épil P00CN000 VMIP3S0,AQ0FS0 Silk-épil P00CN000,AQ0FS0 AQ0FS0 Silk-épil,AQ0FS0 AQ0FS0 AQ0FS0 Silk-épil,DA0FS0 AQ0FS0 AQ0FS0 AQ0FS0 Silk-épil,Silk-épil P00CN000 VMIP3S0,Silk-épil P00CN000 VMIP3S0 SPS00,Silk-épil P00CN000 VMIP3S0 SPS00 DI0FS0,depilador eléctrico Silk-épil se presentar,eléctrico Silk-épil se,depilador eléctrico Silk-épil,clásico depilador eléctrico Silk-épil,el clásico depilador eléctrico Silk-épil,Silk-épil se presentar,Silk-épil se presentar con,Silk-épil se presentar con uno
https://computerhoy.com/noticias/tecnologia/depiladora-luz-pulsada-barata-oferta-precio-minimo-amazon-solo-cuesta-45eu-768119,computerhoy.com,2020-12-04,===NONE===,Silk-épil/NP00000/silk-épil,"A  los  métodos  tradicionales  ,  como  la  cera  ,  la  cuchilla  o  las  máquinas  de  arrancado  de  tipo Silk-épil  se  han  sumado  las  depiladoras  de  luz  pulsada  ,  que  ofrecen  unos  resultados  más  permanentes  sin  salir  de  casa  .",silk-épil,np00000,silk-épil,tipo,tipo,NCMS000,de,de,SPS00,arrancado,arrancar,VMP00SM,de,de,SPS00,máquinas,máquina,NCFP000,se,se,P00CN000,han,haber,VAIP3P0,sumado,sumar,VMP00SM,las,el,DA0FP0,depiladoras,depilador,AQ0FP0,2020-12-04,2020,2020,SPS00 NCMS000 Silk-épil P00CN000 VAIP3P0,NCMS000 Silk-épil P00CN000,SPS00 NCMS000 Silk-épil,VMP00SM SPS00 NCMS000 Silk-épil,SPS00 VMP00SM SPS00 NCMS000 Silk-épil,Silk-épil P00CN000 VAIP3P0,Silk-épil P00CN000 VAIP3P0 VMP00SM,Silk-épil P00CN000 VAIP3P0 VMP00SM DA0FP0,de tipo Silk-épil se haber,tipo Silk-épil se,de tipo Silk-épil,arrancar de tipo Silk-épil,de arrancar de tipo Silk-épil,Silk-épil se haber,Silk-épil se haber sumar,Silk-épil se haber sumar el
https://www.elmundo.es/ofertas-regalos/2020/12/07/5fce0b42fc6c83e37a8b464b.html?follow=1,elmundo.es,2020-12-07,Spain,Silk-épil/NP00000/silk-épil,"Braun Silk-épil  9  SkinSpa  es  una  depiladora  cuatro  en  uno  ya  que  ,  además  de  arrancar  el  vello  de  raíz  ,  masajea  la  piel  y  la  exfolia  .",silk-épil,np00000,silk-épil,Braun,braun,NP00000,,,,,,,,,,,,,9,9,Z,SkinSpa,skinspa,NP00000,es,ser,VSIP3S0,una,uno,DI0FS0,depiladora,depilador,AQ0FS0,2020-12-07,2020,2020,,NP00000 Silk-épil Z,,,,Silk-épil Z NP00000,Silk-épil Z NP00000 VSIP3S0,Silk-épil Z NP00000 VSIP3S0 DI0FS0,,braun Silk-épil 9,,,,Silk-épil 9 skinspa,Silk-épil 9 skinspa ser,Silk-épil 9 skinspa ser uno
https://elcaso.elnacional.cat/es/sucesos/lidl-ofertas-regalos-navidad-super-electronica-decoracion-precio_42785_102.html,elnacional.cat,2020-12-15,===NONE===,Silk-Épil/NP00000/silk-épil,"La Silk-Épil  3170  elimina  el  vello  de  raíz  ,  incluso  el  más  corto  .",silk-épil,np00000,silk-épil,La,el,DA0FS0,,,,,,,,,,,,,3170,3170,Z,elimina,eliminar,VMIP3S0,el,el,DA0MS0,vello,vello,NCMS000,de,de,SPS00,2020-12-15,2020,2020,,DA0FS0 Silk-épil Z,,,,Silk-épil Z VMIP3S0,Silk-épil Z VMIP3S0 DA0MS0,Silk-épil Z VMIP3S0 DA0MS0 NCMS000,,el Silk-épil 3170,,,,Silk-épil 3170 eliminar,Silk-épil 3170 eliminar el,Silk-épil 3170 eliminar el vello
