url,website,date,country,keyword,sentence,kw,kw_lemma,kw_pos,left_w1,left_l1,left_p1,left_w2,left_l2,left_p2,left_w3,left_l3,left_p3,left_w4,left_l4,left_p4,left_w5,left_l5,left_p5,right_w1,right_l1,right_p1,right_w2,right_l2,right_p2,right_w3,right_l3,right_p3,right_w4,right_l4,right_p4,right_w5,right_l5,right_p5,datetime,year,10years,pattern_around5,pattern_around3,pattern_left2,pattern_left3,pattern_left4,pattern_right2,pattern_right3,pattern_right4,pattern_around5_lex,pattern_around3_lex,pattern_left2_lex,pattern_left3_lex,pattern_left4_lex,pattern_right2_lex,pattern_right3_lex,pattern_right4_lex
http://www.lavanguardia.com/local/madrid/20140527/54409353164/dani-comas-realizara-exhibiciones-de-biketrial-en-el-centro-comercial-la-vaguada-de-madrid.html,lavanguardia.com,2014-05-27,Spain,WD-40/Z/WD-40,"El  diez  veces  campeón  mundial  de  Biketrial  ,  Dani  Comas  ,  realizará  el  próximo  viernes  6  y  sábado  7  de  junio  ,  una  serie  de  exhibiciones  patrocinadas  por WD-40  ,  Bricosoriano  y  el  Centro  Comercial  La  Vaguada  para  acercar  este  deporte  a  los  madrileños  .",wd-40,z,wd-40,por,por,SPS00,patrocinadas,patrocinar,VMP00PF,exhibiciones,exhibición,NCFP000,de,de,SPS00,serie,serie,NCFS000,",",",",Fc,Bricosoriano,bricosoriano,NP00000,y,y,CC,el,el,DA0MS0,Centro,centro,NP00000,2014-05-27,2014,2010,VMP00PF SPS00 WD-40 Fc NP00000,SPS00 WD-40 Fc,VMP00PF SPS00 WD-40,NCFP000 VMP00PF SPS00 WD-40,SPS00 NCFP000 VMP00PF SPS00 WD-40,WD-40 Fc NP00000,WD-40 Fc NP00000 CC,WD-40 Fc NP00000 CC DA0MS0,"patrocinar por WD-40 , bricosoriano","por WD-40 ,",patrocinar por WD-40,exhibición patrocinar por WD-40,de exhibición patrocinar por WD-40,"WD-40 , bricosoriano","WD-40 , bricosoriano y","WD-40 , bricosoriano y el"
http://www.lavanguardia.com/local/madrid/20140603/54409592127/el-diez-veces-campeon-mundial-de-biketrial-dani-comas-realizara-exhibiciones-este-viernes-y-sabado.html,lavanguardia.com,2014-06-03,Spain,WD-40/Z/WD-40,"El  evento  está  patrocinado  por WD-40  ,  Bricosoriano  y  el  Centro  Comercial  La  Vaguada  y  pretende  acercar  este  deporte  a  los  madrileños  .",wd-40,z,wd-40,por,por,SPS00,patrocinado,patrocinar,VMP00SM,está,estar,VAIP3S0,evento,evento,NCMS000,El,el,DA0MS0,",",",",Fc,Bricosoriano,bricosoriano,NP00000,y,y,CC,el,el,DA0MS0,Centro,centro,NP00000,2014-06-03,2014,2010,VMP00SM SPS00 WD-40 Fc NP00000,SPS00 WD-40 Fc,VMP00SM SPS00 WD-40,VAIP3S0 VMP00SM SPS00 WD-40,NCMS000 VAIP3S0 VMP00SM SPS00 WD-40,WD-40 Fc NP00000,WD-40 Fc NP00000 CC,WD-40 Fc NP00000 CC DA0MS0,"patrocinar por WD-40 , bricosoriano","por WD-40 ,",patrocinar por WD-40,estar patrocinar por WD-40,evento estar patrocinar por WD-40,"WD-40 , bricosoriano","WD-40 , bricosoriano y","WD-40 , bricosoriano y el"
http://www.guatevision.com/5-usos-que-no-sabias-de-wd-40/#comment-2141,guatevision.com,2015-03-27,===NONE===,WD-40/Z/WD-40,<doc uri=http://www.guatevision.com/5-usos-que-no-sabias-de-wd-40/#comment-2141 website=guatevision.com date=2015-03-27 source_country=> /comment/NP00000 /on/VMIS3P0 /5/Z /uso/NCMP000 /que/PR0CN000 /no/RN /saber/VMII2S0 /de/SPS00 WD-40  by  sonia,wd-40,z,wd-40,de,de,SPS00,sabías,saber,VMII2S0,no,no,RN,que,que,PR0CN000,usos,uso,NCMP000,by,by,RG,sonia,sonia,NCFS000,,,,,,,,,,2015-03-27,2015,2010,VMII2S0 SPS00 WD-40 RG NCFS000,SPS00 WD-40 RG,VMII2S0 SPS00 WD-40,RN VMII2S0 SPS00 WD-40,PR0CN000 RN VMII2S0 SPS00 WD-40,WD-40 RG NCFS000,,,saber de WD-40 by sonia,de WD-40 by,saber de WD-40,no saber de WD-40,que no saber de WD-40,WD-40 by sonia,,
http://www.guatevision.com/5-usos-que-no-sabias-de-wd-40/#comment-2141,guatevision.com,2015-03-27,===NONE===,WD-40/Z/WD-40,"No  querido  /  a  amigo  /  a  , WD-40  no  sólo  lo  puedes  utilizar  para  prevenir  el  óxido  ,  desatascar  piezas  de  metal  o  tuercas  .",wd-40,z,wd-40,",",",",Fc,a,a,SPS00,/,,,amigo,amigo,AQ0MS0,a,a,SPS00,no,no,RN,sólo,sólo,RG,lo,lo,PP3CNA00,puedes,poder,VMIP2S0,utilizar,utilizar,VMN0000,2015-03-27,2015,2010,SPS00 Fc WD-40 RN RG,Fc WD-40 RN,SPS00 Fc WD-40,,,WD-40 RN RG,WD-40 RN RG PP3CNA00,WD-40 RN RG PP3CNA00 VMIP2S0,"a , WD-40 no sólo",", WD-40 no","a , WD-40",,,WD-40 no sólo,WD-40 no sólo lo,WD-40 no sólo lo poder
http://www.guatevision.com/5-usos-que-no-sabias-de-wd-40/#comment-2141,guatevision.com,2015-03-27,===NONE===,WD-40/Z/WD-40,"Sí  ,  utilizar WD-40  en  la  entrada  de  las  puertas  ,  marcos  de  ventanas  ,  ventilas  del  aire  acondicionado  (  atrás  en  el  motor  ,  nunca  en  donde  expele  el  aire  ya  que  los  gases  son  dañinos  para  la  salud  )  y  cualquier  lugar  de  fácil  ,  común  ,  acceso  para  las  cucarachas  ,  alejará  a  estas  molestas  ""  invitadas  ""  .",wd-40,z,wd-40,utilizar,utilizar,VMN0000,",",",",Fc,Sí,sí,RG,,,,,,,en,en,SPS00,la,el,DA0FS0,entrada,entrada,NCFS000,de,de,SPS00,las,el,DA0FP0,2015-03-27,2015,2010,Fc VMN0000 WD-40 SPS00 DA0FS0,VMN0000 WD-40 SPS00,Fc VMN0000 WD-40,RG Fc VMN0000 WD-40,,WD-40 SPS00 DA0FS0,WD-40 SPS00 DA0FS0 NCFS000,WD-40 SPS00 DA0FS0 NCFS000 SPS00,", utilizar WD-40 en el",utilizar WD-40 en,", utilizar WD-40","sí , utilizar WD-40",,WD-40 en el,WD-40 en el entrada,WD-40 en el entrada de
http://www.guatevision.com/5-usos-que-no-sabias-de-wd-40/#comment-2141,guatevision.com,2015-03-27,===NONE===,WD-40/Z/WD-40,"Aplícate WD-40  y  frótate  las  manos  ,  área  ,  con  ello  hasta  que  la  goma  desaparezca  .",wd-40,z,wd-40,Aplícate,aplicar+te,VMM02S0+PP2CS000,,,,,,,,,,,,,y,y,CC,frótate,frotar+te,VMM02S0+PP2CS000,las,el,DA0FP0,manos,mano,NCFP000,",",",",Fc,2015-03-27,2015,2010,,VMM02S0+PP2CS000 WD-40 CC,,,,WD-40 CC VMM02S0+PP2CS000,WD-40 CC VMM02S0+PP2CS000 DA0FP0,WD-40 CC VMM02S0+PP2CS000 DA0FP0 NCFP000,,aplicar+te WD-40 y,,,,WD-40 y frotar+te,WD-40 y frotar+te el,WD-40 y frotar+te el mano
http://www.guatevision.com/5-usos-que-no-sabias-de-wd-40/#comment-2141,guatevision.com,2015-03-27,===NONE===,WD-40/Z/WD-40,Rocía WD-40  sobre  la  superficie  afectada  y  en  30  segundos  elimina  esas  calcomanías  y  la  goma  imposible  de  eliminar  .,wd-40,z,wd-40,Rocía,rociar,VMIP3S0,,,,,,,,,,,,,sobre,sobre,SPS00,la,el,DA0FS0,superficie,superficie,NCFS000,afectada,afectar,VMP00SF,y,y,CC,2015-03-27,2015,2010,,VMIP3S0 WD-40 SPS00,,,,WD-40 SPS00 DA0FS0,WD-40 SPS00 DA0FS0 NCFS000,WD-40 SPS00 DA0FS0 NCFS000 VMP00SF,,rociar WD-40 sobre,,,,WD-40 sobre el,WD-40 sobre el superficie,WD-40 sobre el superficie afectar
http://www.guatevision.com/5-usos-que-no-sabias-de-wd-40/#comment-2141,guatevision.com,2015-03-27,===NONE===,WD-40/Z/WD-40,"Se  te  acaba  de  caer  sobre  tu  camisa  o  blusa  blanca  una  desagradable  cantidad  de  salsa  de  tomate  y  no  sabes  qué  hacer  por  que  tu  mamá  te  ha  dicho  que  ""  no  le  va  salir  ""  ,  tranquila  ,  sigue  comiendo  ,  disfruta  el  momento  y  luego  ve  por  esa  lata  de WD-40  ,  rocía  un  poco  sobre  la  mancha  ,  deja  que  trabaje  unos  minutos  y  lava  de  inmediato  como  de  costumbre  .  (  Ahora  cuéntale  a  tu  mamá  el  secreto  )  . </doc>",wd-40,z,wd-40,de,de,SPS00,lata,lata,NCFS000,esa,ese,DD0FS0,por,por,SPS00,ve,ver,VMIP3S0,",",",",Fc,rocía,rociar,VMIP3S0,un,uno,DI0MS0,poco,poco,PI0MS000,sobre,sobre,SPS00,2015-03-27,2015,2010,NCFS000 SPS00 WD-40 Fc VMIP3S0,SPS00 WD-40 Fc,NCFS000 SPS00 WD-40,DD0FS0 NCFS000 SPS00 WD-40,SPS00 DD0FS0 NCFS000 SPS00 WD-40,WD-40 Fc VMIP3S0,WD-40 Fc VMIP3S0 DI0MS0,WD-40 Fc VMIP3S0 DI0MS0 PI0MS000,"lata de WD-40 , rociar","de WD-40 ,",lata de WD-40,ese lata de WD-40,por ese lata de WD-40,"WD-40 , rociar","WD-40 , rociar uno","WD-40 , rociar uno poco"
http://www.guatevision.com/5-usos-de-windex-que-desconocias-limpia-vidrios/#comment-2297,guatevision.com,2015-03-30,===NONE===,WD-40/Z/WD-40,"El  limpia  vidrios  puede  quitar  todas  las  manchas  producidas  por  salsa  de  soya  ,  salsa  de  hongos  ,  vino  y  hasta  aguacate  ,  pero  ,  deberás  apresurarte  por  que  ,  a  diferencia  del WD-40  (  te  compartimos  el  enlace  por  si  te  perdiste  de  esta  serie  de  consejos  de  acerca  del  WD-40  )  ,  el  limpia  vidrios  trabaja  mejor  con  la  mancha  fresca  .",wd-40,z,wd-40,del,de+el,SPS00+DA0MS0,diferencia,diferencia,NCFS000,a,a,SPS00,",",",",Fc,que,que,CS,(,(,Fpa,te,te,PP2CS000,compartimos,compartir,VMIP1P0,el,el,DA0MS0,enlace,enlace,NCMS000,2015-03-30,2015,2010,NCFS000 SPS00+DA0MS0 WD-40 Fpa PP2CS000,SPS00+DA0MS0 WD-40 Fpa,NCFS000 SPS00+DA0MS0 WD-40,SPS00 NCFS000 SPS00+DA0MS0 WD-40,Fc SPS00 NCFS000 SPS00+DA0MS0 WD-40,WD-40 Fpa PP2CS000,WD-40 Fpa PP2CS000 VMIP1P0,WD-40 Fpa PP2CS000 VMIP1P0 DA0MS0,diferencia de+el WD-40 ( te,de+el WD-40 (,diferencia de+el WD-40,a diferencia de+el WD-40,", a diferencia de+el WD-40",WD-40 ( te,WD-40 ( te compartir,WD-40 ( te compartir el
http://www.guatevision.com/5-usos-de-windex-que-desconocias-limpia-vidrios/#comment-2297,guatevision.com,2015-03-30,===NONE===,WD-40/Z/WD-40,"El  limpia  vidrios  puede  quitar  todas  las  manchas  producidas  por  salsa  de  soya  ,  salsa  de  hongos  ,  vino  y  hasta  aguacate  ,  pero  ,  deberás  apresurarte  por  que  ,  a  diferencia  del  WD-40  (  te  compartimos  el  enlace  por  si  te  perdiste  de  esta  serie  de  consejos  de  acerca  del WD-40  )  ,  el  limpia  vidrios  trabaja  mejor  con  la  mancha  fresca  .",wd-40,z,wd-40,del,de+el,SPS00+DA0MS0,acerca,acercar,VMIP3S0,de,de,SPS00,consejos,consejo,NCMP000,de,de,SPS00,),),Fpt,",",",",Fc,el,el,DA0MS0,limpia,limpio,AQ0FS0,vidrios,vidrio,NCMP000,2015-03-30,2015,2010,VMIP3S0 SPS00+DA0MS0 WD-40 Fpt Fc,SPS00+DA0MS0 WD-40 Fpt,VMIP3S0 SPS00+DA0MS0 WD-40,SPS00 VMIP3S0 SPS00+DA0MS0 WD-40,NCMP000 SPS00 VMIP3S0 SPS00+DA0MS0 WD-40,WD-40 Fpt Fc,WD-40 Fpt Fc DA0MS0,WD-40 Fpt Fc DA0MS0 AQ0FS0,"acercar de+el WD-40 ) ,",de+el WD-40 ),acercar de+el WD-40,de acercar de+el WD-40,consejo de acercar de+el WD-40,"WD-40 ) ,","WD-40 ) , el","WD-40 ) , el limpio"
http://noticiasyprotagonistas.com/actualidad/no-podemos-subsidiar-a-barrionuevo-de-ninguna-manera/,noticiasyprotagonistas.com,2015-04-11,===NONE===,WD-40/Z/WD-40,"Los  resortes  deben  funcionar  ,  sino  que  vayan  a  comprar WD-40  .",wd-40,z,wd-40,comprar,comprar,VMN0000,a,a,SPS00,vayan,ir,VMSP3P0,que,que,CS,sino,sino,CC,.,.,Fp,,,,,,,,,,,,,2015-04-11,2015,2010,,VMN0000 WD-40 Fp,SPS00 VMN0000 WD-40,VMSP3P0 SPS00 VMN0000 WD-40,CS VMSP3P0 SPS00 VMN0000 WD-40,,,,,comprar WD-40 .,a comprar WD-40,ir a comprar WD-40,que ir a comprar WD-40,,,
http://www.unidossc.com/articles/irving-20978-escuela-dijo.html,unidossc.com,2015-06-23,===NONE===,WD-40/Z/WD-40,Él  les  habla  sobre  el  fracaso  y  apunta  hacia  la  parte  superior  de  un  mostrador  donde  tiene  una  lata  de  spray WD-40  y  una  botella  limpiadora  de  Fórmula  409  .,wd-40,z,wd-40,spray,spray,NCMS000,de,de,SPS00,lata,lata,NCFS000,una,uno,DI0FS0,tiene,tener,VMIP3S0,y,y,CC,una,1,Z,botella,botella,NCFS000,limpiadora,limpiador,AQ0FS0,de,de,SPS00,2015-06-23,2015,2010,SPS00 NCMS000 WD-40 CC Z,NCMS000 WD-40 CC,SPS00 NCMS000 WD-40,NCFS000 SPS00 NCMS000 WD-40,DI0FS0 NCFS000 SPS00 NCMS000 WD-40,WD-40 CC Z,WD-40 CC Z NCFS000,WD-40 CC Z NCFS000 AQ0FS0,de spray WD-40 y 1,spray WD-40 y,de spray WD-40,lata de spray WD-40,uno lata de spray WD-40,WD-40 y 1,WD-40 y 1 botella,WD-40 y 1 botella limpiador
http://www.eleconomista.es/espana/noticias/7010808/09/15/Unibike-presenta-en-Feria-de-Madrid-la-oferta-de-mas-de-500-marcas-del-sector-de-la-bicicleta.html,eleconomista.es,2015-09-18,Spain,WD-40/Z/WD-40,"Otra  de  las  actividades  que  se  volverán  a  dar  cita  en  Unibike  será  el  Biketrial WD-40  ,  con  las  exhibiciones  del  campeón  del  mundo  Dani  Comas  y  un  nuevo  circuito  de  Pump  Track  donde  se  enlazan  rizados  y  peraltes  gestionados  a  gran  velocidad  .",wd-40,z,wd-40,Biketrial,biketrial,NP00000,el,el,DA0MS0,será,ser,VSIF3S0,Unibike,unibike,NP00000,en,en,SPS00,",",",",Fc,con,con,SPS00,las,el,DA0FP0,exhibiciones,exhibición,NCFP000,del,de+el,SPS00+DA0MS0,2015-09-18,2015,2010,DA0MS0 NP00000 WD-40 Fc SPS00,NP00000 WD-40 Fc,DA0MS0 NP00000 WD-40,VSIF3S0 DA0MS0 NP00000 WD-40,NP00000 VSIF3S0 DA0MS0 NP00000 WD-40,WD-40 Fc SPS00,WD-40 Fc SPS00 DA0FP0,WD-40 Fc SPS00 DA0FP0 NCFP000,"el biketrial WD-40 , con","biketrial WD-40 ,",el biketrial WD-40,ser el biketrial WD-40,unibike ser el biketrial WD-40,"WD-40 , con","WD-40 , con el","WD-40 , con el exhibición"
http://www.primerahora.com/noticias/puerto-rico/nota/unjugueteopesadillainfantil-1122775/,primerahora.com,2015-11-25,Puerto Rico,WD-40/Z/WD-40,La  mejor  soluciÃ3n  que  encontrÃ3  la  compaÃ  ±  Ãa  al  momento  de  recibir  la  avalancha  de  denuncias  fue  usar  nada  mÃ  ¡  s  y  nada  menos  que  el  lubricante  industrial WD-40  .,wd-40,z,wd-40,industrial,industrial,AQ0CS0,lubricante,lubricante,NCMS000,el,el,DA0MS0,que,que,CS,menos,menos,RG,.,.,Fp,,,,,,,,,,,,,2015-11-25,2015,2010,,AQ0CS0 WD-40 Fp,NCMS000 AQ0CS0 WD-40,DA0MS0 NCMS000 AQ0CS0 WD-40,CS DA0MS0 NCMS000 AQ0CS0 WD-40,,,,,industrial WD-40 .,lubricante industrial WD-40,el lubricante industrial WD-40,que el lubricante industrial WD-40,,,
http://www.lacuarta.com/noticias/espectacular/2016/02/65-196657-9-a-pamela-jiles-le-gusto-puro-calentar-la-sopa.shtml,lacuarta.com,2016-02-22,===NONE===,WD-40/Z/WD-40,"Escenario  ,  luces  ,  alfombra  roja WD-40  para  las  visagras  ,  ¡  todo  !",wd-40,z,wd-40,roja,rojo,AQ0FS0,alfombra,alfombra,NCFS000,",",",",Fc,luces,luz,NCFP000,",",",",Fc,para,para,SPS00,las,el,DA0FP0,visagras,visagras,NCMN000,",",",",Fc,¡,¡,Faa,2016-02-22,2016,2010,NCFS000 AQ0FS0 WD-40 SPS00 DA0FP0,AQ0FS0 WD-40 SPS00,NCFS000 AQ0FS0 WD-40,Fc NCFS000 AQ0FS0 WD-40,NCFP000 Fc NCFS000 AQ0FS0 WD-40,WD-40 SPS00 DA0FP0,WD-40 SPS00 DA0FP0 NCMN000,WD-40 SPS00 DA0FP0 NCMN000 Fc,alfombra rojo WD-40 para el,rojo WD-40 para,alfombra rojo WD-40,", alfombra rojo WD-40","luz , alfombra rojo WD-40",WD-40 para el,WD-40 para el visagras,"WD-40 para el visagras ,"
http://www.atv.pe/actualidad/aceite-arruino-camiseta-truco-podras-salvar-299342,atv.pe,2016-03-16,Peru,WD-40/Z/WD-40,Aplicar  el WD-40  sobre  la  zona  afectada  y  con  los  cotones  expandir  el  líquido  .,wd-40,z,wd-40,el,el,DA0MS0,Aplicar,aplicar,VMN0000,,,,,,,,,,sobre,sobre,SPS00,la,el,DA0FS0,zona,zona,NCFS000,afectada,afectar,VMP00SF,y,y,CC,2016-03-16,2016,2010,VMN0000 DA0MS0 WD-40 SPS00 DA0FS0,DA0MS0 WD-40 SPS00,VMN0000 DA0MS0 WD-40,,,WD-40 SPS00 DA0FS0,WD-40 SPS00 DA0FS0 NCFS000,WD-40 SPS00 DA0FS0 NCFS000 VMP00SF,aplicar el WD-40 sobre el,el WD-40 sobre,aplicar el WD-40,,,WD-40 sobre el,WD-40 sobre el zona,WD-40 sobre el zona afectar
http://www.repretel.com/actualidad/el-aceite-arruino-tu-camiseta-favorita-con-este-truco-la-podras-salvar-23595,repretel.com,2016-03-17,Costa Rica,WD-40/Z/WD-40,<doc uri=http://www.repretel.com/actualidad/el-aceite-arruino-tu-camiseta-favorita-con-este-truco-la-podras-salvar-23595 website=repretel.com date=2016-03-17 source_country=Costa Rica> /jabón/NCMS000 /líquido/AQ0MS0 /para/SPS00 /lavar/VMN0000 /plato/NCMP000 /aceite/NP00000 /lubricante/AQ0CS0 /(/Fpa /tipo/NCMS000 WD-40  )  Bicarbonato  de  sodio  Un  cepillo  de  dientes  Un  pedazo  de  cartón  Cotones  para  el  oído </doc>,wd-40,z,wd-40,Tipo,tipo,NCMS000,(,(,Fpa,lubricante,lubricante,AQ0CS0,Aceite,aceite,NP00000,platos,plato,NCMP000,),),Fpt,Bicarbonato,bicarbonato,NP00000,de,de,SPS00,sodio,sodio,NCMS000,Un,uno,DI0MS0,2016-03-17,2016,2010,Fpa NCMS000 WD-40 Fpt NP00000,NCMS000 WD-40 Fpt,Fpa NCMS000 WD-40,AQ0CS0 Fpa NCMS000 WD-40,NP00000 AQ0CS0 Fpa NCMS000 WD-40,WD-40 Fpt NP00000,WD-40 Fpt NP00000 SPS00,WD-40 Fpt NP00000 SPS00 NCMS000,( tipo WD-40 ) bicarbonato,tipo WD-40 ),( tipo WD-40,lubricante ( tipo WD-40,aceite lubricante ( tipo WD-40,WD-40 ) bicarbonato,WD-40 ) bicarbonato de,WD-40 ) bicarbonato de sodio
http://www.prnewswire.co.uk/news-releases/2016-inter-lubric-china-se-celebrara-en-guangzhou-del-20-al-22-de-septiembre-575029721.html,prnewswire.co.uk,2016-04-08,===NONE===,WD-40/Z/WD-40,"Patrocinada  por  SINOPEC  Lubricant  Company  ,  PetroChina  Lubricant  Company  y  CCPIT  Shanghai  ,  organizada  por  Intex  Shanghai  ,  Inter  Lubric  China  se  ha  estado  celebrado  anualmente  en  Beijing  ,  Guangzhou  y  Shanghai  durante  los  últimos  17  años  ,  con  más  de  2.000  expositores  ,  entre  ellos  SINOPEC  ,  PetroChina  ,  ExxonMobil  Chemical  ,  Shell  ,  Fuchs  ,  Caltex  ,  GS  Oil  ,  INEOS  ,  G-Energy  ,  BASF  ,  Chemtura  ,  Dow  ,  Lubrizol  ,  HUNTSMAN  ,  Croda  ,  Henkel  ,  LUKOIL  ,  ENI  ,  SK  ,  Afton  ,  Valvoline  ,  Total  , WD-40  ,  ENEOS  ,  AMALIE  ,  Emery  ,  Petromin  ,  Sephan  Oil  ,  SASOL  ,  MicRos  ,  LOPAL  ,  HANDI  ,  NACO  ,  Jama  y  LiuGong  .",wd-40,z,wd-40,",",",",Fc,Total,total,NP00000,",",",",Fc,Valvoline,valvoline,NP00000,",",",",Fc,",",",",Fc,ENEOS,eneos,NP00000,",",",",Fc,AMALIE,amalie,NP00000,",",",",Fc,2016-04-08,2016,2010,NP00000 Fc WD-40 Fc NP00000,Fc WD-40 Fc,NP00000 Fc WD-40,Fc NP00000 Fc WD-40,NP00000 Fc NP00000 Fc WD-40,WD-40 Fc NP00000,WD-40 Fc NP00000 Fc,WD-40 Fc NP00000 Fc NP00000,"total , WD-40 , eneos",", WD-40 ,","total , WD-40",", total , WD-40","valvoline , total , WD-40","WD-40 , eneos","WD-40 , eneos ,","WD-40 , eneos , amalie"
http://elvocero.com/incautan-miles-de-latas-de-wd-40-fatulas/,elvocero.com,2016-11-04,===NONE===,WD-40/Z/WD-40,<doc uri=http://elvocero.com/incautan-miles-de-latas-de-wd-40-fatulas/ website=elvocero.com date=2016-11-04 source_country=> /incautar/VMIP3P0 /mil/NCMP000 /de/SPS00 /lata/NCFP000 /de/SPS00 WD-40  fatulas,wd-40,z,wd-40,de,de,SPS00,latas,lata,NCFP000,de,de,SPS00,miles,mil,NCMP000,Incautan,incautar,VMIP3P0,fatulas,fatulas,NCFP000,,,,,,,,,,,,,2016-11-04,2016,2010,,SPS00 WD-40 NCFP000,NCFP000 SPS00 WD-40,SPS00 NCFP000 SPS00 WD-40,NCMP000 SPS00 NCFP000 SPS00 WD-40,,,,,de WD-40 fatulas,lata de WD-40,de lata de WD-40,mil de lata de WD-40,,,
http://elvocero.com/incautan-miles-de-latas-de-wd-40-fatulas/,elvocero.com,2016-11-04,===NONE===,WD-40/Z/WD-40,"Oficiales  del  Puerto  de  Área  de  San  Juan  del  Negociado  de  Aduanas  y  Protección  Fronteriza  de  Estados  Unidos  (  CBP  ,  siglas  en  inglés  )  incautaron  un  cargamento  que  contenía  cerca  de  1,500  latas  de  lubricante  de  marca WD-40  falsificado  ,  enviado  desde  China  .",wd-40,z,wd-40,marca,marca,NCFS000,de,de,SPS00,lubricante,lubricante,NCMS000,de,de,SPS00,latas,lata,NCFP000,falsificado,falsificar,VMP00SM,",",",",Fc,enviado,enviar,VMP00SM,desde,desde,SPS00,China,china,NP00000,2016-11-04,2016,2010,SPS00 NCFS000 WD-40 VMP00SM Fc,NCFS000 WD-40 VMP00SM,SPS00 NCFS000 WD-40,NCMS000 SPS00 NCFS000 WD-40,SPS00 NCMS000 SPS00 NCFS000 WD-40,WD-40 VMP00SM Fc,WD-40 VMP00SM Fc VMP00SM,WD-40 VMP00SM Fc VMP00SM SPS00,"de marca WD-40 falsificar ,",marca WD-40 falsificar,de marca WD-40,lubricante de marca WD-40,de lubricante de marca WD-40,"WD-40 falsificar ,","WD-40 falsificar , enviar","WD-40 falsificar , enviar desde"
http://elvocero.com/incautan-miles-de-latas-de-wd-40-fatulas/,elvocero.com,2016-11-04,===NONE===,WD-40/Z/WD-40,"Richard  Clampitt  ,  asesor  jurídico  de WD-40  Company  en  San  Diego  ,  California  ,  dijo  que  ""  nos  place  saber  que  CBP  está  protegiendo  activamente  los  intereses  de  los  dueños  de  derechos  así  como  al  público  ,  de  infracciones  de  productos  como  estos  ""  . </doc>",wd-40,z,wd-40,de,de,SPS00,jurídico,jurídico,AQ0MS0,asesor,asesor,NCMS000,",",",",Fc,Clampitt,clampitt,NP00000,Company,company,NP00000,en,en,SPS00,San,san,NP00000,Diego,diego,NP00000,",",",",Fc,2016-11-04,2016,2010,AQ0MS0 SPS00 WD-40 NP00000 SPS00,SPS00 WD-40 NP00000,AQ0MS0 SPS00 WD-40,NCMS000 AQ0MS0 SPS00 WD-40,Fc NCMS000 AQ0MS0 SPS00 WD-40,WD-40 NP00000 SPS00,WD-40 NP00000 SPS00 NP00000,WD-40 NP00000 SPS00 NP00000 NP00000,jurídico de WD-40 company en,de WD-40 company,jurídico de WD-40,asesor jurídico de WD-40,", asesor jurídico de WD-40",WD-40 company en,WD-40 company en san,WD-40 company en san diego
http://www.elciudadano.cl/2016/11/17/339431/este-es-el-mejor-dato-para-sacar-las-manchas-de-aceite-de-tu-ropa/,elciudadano.cl,2016-11-18,Chile,WD-40/Z/WD-40,Esto  es  lo  que  necesitas  : WD-40  Lavalozas  líquido  Un  cepillo  de  dientes  Bicarbonato  de  Sodio  Cotonitos  o  algodón  Un  trozo  de  cartón  o  cartulina,wd-40,z,wd-40,:,:,Fd,necesitas,necesitar,VMIP2S0,que,que,PR0CN000,lo,el,DA0NS0,es,ser,VSIP3S0,Lavalozas,lavalozas,NP00000,líquido,líquido,AQ0MS0,Un,uno,DI0MS0,cepillo,cepillo,NCMS000,de,de,SPS00,2016-11-18,2016,2010,VMIP2S0 Fd WD-40 NP00000 AQ0MS0,Fd WD-40 NP00000,VMIP2S0 Fd WD-40,PR0CN000 VMIP2S0 Fd WD-40,DA0NS0 PR0CN000 VMIP2S0 Fd WD-40,WD-40 NP00000 AQ0MS0,WD-40 NP00000 AQ0MS0 DI0MS0,WD-40 NP00000 AQ0MS0 DI0MS0 NCMS000,necesitar : WD-40 lavalozas líquido,: WD-40 lavalozas,necesitar : WD-40,que necesitar : WD-40,el que necesitar : WD-40,WD-40 lavalozas líquido,WD-40 lavalozas líquido uno,WD-40 lavalozas líquido uno cepillo
http://www.elciudadano.cl/2016/11/17/339431/este-es-el-mejor-dato-para-sacar-las-manchas-de-aceite-de-tu-ropa/,elciudadano.cl,2016-11-18,Chile,WD-40/Z/WD-40,Usa WD-40  para  rociar  sobre  el  área  afectada  y  friega  con  un  cotonito  o  trozo  de  algodón  .,wd-40,z,wd-40,Usa,usar,VMIP3S0,,,,,,,,,,,,,para,para,SPS00,rociar,rociar,VMN0000,sobre,sobre,SPS00,el,el,DA0MS0,área,área,NCFS000,2016-11-18,2016,2010,,VMIP3S0 WD-40 SPS00,,,,WD-40 SPS00 VMN0000,WD-40 SPS00 VMN0000 SPS00,WD-40 SPS00 VMN0000 SPS00 DA0MS0,,usar WD-40 para,,,,WD-40 para rociar,WD-40 para rociar sobre,WD-40 para rociar sobre el
http://www.eleconomista.es/espana/noticias/8324828/04/17/Un-total-de-8000-ciclistas-participaran-este-sabado-en-la-XVII-edicion-de-la-Orbea-Monegros.html,eleconomista.es,2017-04-28,Spain,WD-40/Z/WD-40,"También  cuenta  con  el  patrocinio  de  Continental  ,  TowCar  ,  Two  Nav  ,  Skoda  y  Poweaede  y  la  colaboración  de  DNL  ,  Kaiku  y WD-40  .",wd-40,z,wd-40,y,y,CC,Kaiku,kaiku,NP00000,",",",",Fc,DNL,dnl,NP00000,de,de,SPS00,.,.,Fp,,,,,,,,,,,,,2017-04-28,2017,2010,,CC WD-40 Fp,NP00000 CC WD-40,Fc NP00000 CC WD-40,NP00000 Fc NP00000 CC WD-40,,,,,y WD-40 .,kaiku y WD-40,", kaiku y WD-40","dnl , kaiku y WD-40",,,
http://www.colimanoticias.com/los-faros-de-tu-auto-lucen-opacos-prueba-con-estos-tips/,colimanoticias.com,2017-05-19,Mexico,WD-40/Z/WD-40,"Tras  esta  limpieza  ,  aplicamos  con  un  paño  la  pasta  de  dientes  y  pulimos  toda  la  superficie  de  las  ópticas  ,  añadiendo  después  algún  desengrasante  como WD-40  ,  para  darle  un  acabado  brillante  .",wd-40,z,wd-40,como,como,CS,desengrasante,desengrasante,AQ0CS0,algún,alguno,DI0MS0,después,después,RG,añadiendo,añadir,VMG0000,",",",",Fc,para,para,SPS00,darle,dar+le,VMN0000+PP3CSD00,un,uno,DI0MS0,acabado,acabado,NCMS000,2017-05-19,2017,2010,AQ0CS0 CS WD-40 Fc SPS00,CS WD-40 Fc,AQ0CS0 CS WD-40,DI0MS0 AQ0CS0 CS WD-40,RG DI0MS0 AQ0CS0 CS WD-40,WD-40 Fc SPS00,WD-40 Fc SPS00 VMN0000+PP3CSD00,WD-40 Fc SPS00 VMN0000+PP3CSD00 DI0MS0,"desengrasante como WD-40 , para","como WD-40 ,",desengrasante como WD-40,alguno desengrasante como WD-40,después alguno desengrasante como WD-40,"WD-40 , para","WD-40 , para dar+le","WD-40 , para dar+le uno"
http://www.microsiervos.com/archivo/ciencia/superficie-visualizar-campos-magneticos.html,microsiervos.com,2017-05-21,Canada,WD-40/Z/WD-40,Además  de  las  placas  transparentes  se  necesita  un  poco  de  ferrofluido  y  aceite  mineral  ( WD-40  o  aquí  en  España  3-en-1  )  en  el  que  diluirlo  .,wd-40,z,wd-40,(,(,Fpa,mineral,mineral,AQ0CS0,aceite,aceite,NCMS000,y,y,CC,ferrofluido,ferrofluido,VMP00SM,o,o,CC,aquí,aquí,RG,en,en,SPS00,España,españa,NP00000,3-en-1,3-en-1,Z,2017-05-21,2017,2010,AQ0CS0 Fpa WD-40 CC RG,Fpa WD-40 CC,AQ0CS0 Fpa WD-40,NCMS000 AQ0CS0 Fpa WD-40,CC NCMS000 AQ0CS0 Fpa WD-40,WD-40 CC RG,WD-40 CC RG SPS00,WD-40 CC RG SPS00 NP00000,mineral ( WD-40 o aquí,( WD-40 o,mineral ( WD-40,aceite mineral ( WD-40,y aceite mineral ( WD-40,WD-40 o aquí,WD-40 o aquí en,WD-40 o aquí en españa
https://www.elespanol.com/ciencia/salud/20170928/250225766_0.html,elespanol.com,2017-09-29,===NONE===,WD-40/Z/WD-40,"Desde  aplicarse WD-40  ,  un  potente  antioxidante  ,  a  colgarse  literalmente  de  una  puerta  .",wd-40,z,wd-40,aplicarse,aplicar+se,VMN0000+PP3CN000,Desde,desde,SPS00,,,,,,,,,,",",",",Fc,un,uno,DI0MS0,potente,potente,AQ0CS0,antioxidante,antioxidante,NCMS000,",",",",Fc,2017-09-29,2017,2010,SPS00 VMN0000+PP3CN000 WD-40 Fc DI0MS0,VMN0000+PP3CN000 WD-40 Fc,SPS00 VMN0000+PP3CN000 WD-40,,,WD-40 Fc DI0MS0,WD-40 Fc DI0MS0 AQ0CS0,WD-40 Fc DI0MS0 AQ0CS0 NCMS000,"desde aplicar+se WD-40 , uno","aplicar+se WD-40 ,",desde aplicar+se WD-40,,,"WD-40 , uno","WD-40 , uno potente","WD-40 , uno potente antioxidante"
http://www.elpopular.com.ar/nota/106976/el-programa-de-actividades-de-las-tardecitas-culturales-del-domingo,elpopular.com.ar,2018-01-17,Argentina,WD-40/Z/WD-40,"El  Parque  Mitre  presentará  noche  de  Jazz  ,  con  actuaciones  del  trío  conformado  por  Nicolás  Hailand  ,  Gabriel  Larraz  y  Samuel  Carabajal  ;  y  también  el  grupo WD-40  con  Benjamín  Rampoldi  ,  Samuel  Carabajal  y  Santiago  De  la  Vega  .",wd-40,z,wd-40,grupo,grupo,NCMS000,el,el,DA0MS0,también,también,RG,y,y,CC,;,;,Fx,con,con,SPS00,Benjamín,benjamín,NP00000,Rampoldi,rampoldi,NP00000,",",",",Fc,Samuel,samuel,NP00000,2018-01-17,2018,2010,DA0MS0 NCMS000 WD-40 SPS00 NP00000,NCMS000 WD-40 SPS00,DA0MS0 NCMS000 WD-40,RG DA0MS0 NCMS000 WD-40,CC RG DA0MS0 NCMS000 WD-40,WD-40 SPS00 NP00000,WD-40 SPS00 NP00000 NP00000,WD-40 SPS00 NP00000 NP00000 Fc,el grupo WD-40 con benjamín,grupo WD-40 con,el grupo WD-40,también el grupo WD-40,y también el grupo WD-40,WD-40 con benjamín,WD-40 con benjamín rampoldi,"WD-40 con benjamín rampoldi ,"
