url,website,date,country,keyword,sentence,kw,kw_lemma,kw_pos,left_w1,left_l1,left_p1,left_w2,left_l2,left_p2,left_w3,left_l3,left_p3,left_w4,left_l4,left_p4,left_w5,left_l5,left_p5,right_w1,right_l1,right_p1,right_w2,right_l2,right_p2,right_w3,right_l3,right_p3,right_w4,right_l4,right_p4,right_w5,right_l5,right_p5,datetime,year,10years,pattern_around5,pattern_around3,pattern_left2,pattern_left3,pattern_left4,pattern_right2,pattern_right3,pattern_right4,pattern_around5_lex,pattern_around3_lex,pattern_left2_lex,pattern_left3_lex,pattern_left4_lex,pattern_right2_lex,pattern_right3_lex,pattern_right4_lex
http://www.elancasti.com.ar/info-gral/2016/6/19/medicamentos-aumentaron-entre-301833.html,elancasti.com.ar,2016-06-19,Argentina,aspirinetas/NCFP00D/aspirina,"Explicaron  que  el  caso  más  ejemplificador  es  el  de  las  clásicas aspirinetas  ,  que  antes  venían  en  cajas  de  98  comprimidos  a  un  precio  accesible  que  en  diciembre  de  2015  no  superaba  los  $30  ,  y  que  por  los  reiterados  incrementos  ,  ahora  se  comercializa  en  cajas  de  28  unidades  a  $33  .",aspirinetas,ncfp00d,aspirina,clásicas,clásico,AQ0FP0,las,el,DA0FP0,de,de,SPS00,el,el,DA0MS0,es,ser,VSIP3S0,",",",",Fc,que,que,PR0CN000,antes,antes,RG,venían,venir,VMII3P0,en,en,SPS00,2016-06-19,2016,2010,DA0FP0 AQ0FP0 Aspirine Fc PR0CN000,AQ0FP0 Aspirine Fc,DA0FP0 AQ0FP0 Aspirine,SPS00 DA0FP0 AQ0FP0 Aspirine,DA0MS0 SPS00 DA0FP0 AQ0FP0 Aspirine,Aspirine Fc PR0CN000,Aspirine Fc PR0CN000 RG,Aspirine Fc PR0CN000 RG VMII3P0,"el clásico Aspirine , que","clásico Aspirine ,",el clásico Aspirine,de el clásico Aspirine,el de el clásico Aspirine,"Aspirine , que","Aspirine , que antes","Aspirine , que antes venir"
http://larepublica.pe/deportes/797405-colon-de-santa-fe-de-argentina-inscribio-al-peruano-diego-mayora,larepublica.pe,2016-08-26,Peru,Aspirineta/NP00000/aspirineta,"Tráeme  a  este  tipo  ,  @  edu_dominguez  te  lo  pido  por  Dios  .  https://t.co/3hAmKPXsnv  --  El  Flaco Aspirineta  (  @  marx_cos  )",aspirineta,np00000,aspirineta,Flaco,flaco,NP00000,El,el,DA0MS0,--,--,Fg,https://t.co/3hAmKPXsnv,https:,/t.co/3hAmKPXsnv/Z,.,.,Fp,(,(,Fpa,@,@,Fz,marx_cos,marx_cos,NCMP000,),),Fpt,,,,2016-08-26,2016,2010,DA0MS0 NP00000 Aspirine Fpa Fz,NP00000 Aspirine Fpa,DA0MS0 NP00000 Aspirine,Fg DA0MS0 NP00000 Aspirine,/t.co/3hAmKPXsnv/Z Fg DA0MS0 NP00000 Aspirine,Aspirine Fpa Fz,Aspirine Fpa Fz NCMP000,Aspirine Fpa Fz NCMP000 Fpt,el flaco Aspirine ( @,flaco Aspirine (,el flaco Aspirine,-- el flaco Aspirine,https: -- el flaco Aspirine,Aspirine ( @,Aspirine ( @ marx_cos,Aspirine ( @ marx_cos )
http://www.losandes.com.ar/article/crece-la-devocion-por-el-padre-juan-schiavo?rv=1,losandes.com.ar,2016-09-03,Argentina,aspirineta/NCFS00D/aspirina,"""  En  mi  caso  ,  hace  siete  años  que  no  tomo  ni  una aspirineta  ""  ,  comentó  este  hombre  que  cumplió  los  70  años  y  trabaja  varias  horas  al  día  ,  además  de  practicar  actividades  deportivas  .",aspirineta,ncfs00d,aspirina,una,uno,DI0FS0,ni,ni,CC,tomo,tomo,NCMS000,no,no,RN,que,que,PR0CN000,"""","""",Fe,",",",",Fc,comentó,comentar,VMIS3S0,este,este,DD0MS0,hombre,hombre,NCMS000,2016-09-03,2016,2010,CC DI0FS0 Aspirine Fe Fc,DI0FS0 Aspirine Fe,CC DI0FS0 Aspirine,NCMS000 CC DI0FS0 Aspirine,RN NCMS000 CC DI0FS0 Aspirine,Aspirine Fe Fc,Aspirine Fe Fc VMIS3S0,Aspirine Fe Fc VMIS3S0 DD0MS0,"ni uno Aspirine "" ,","uno Aspirine """,ni uno Aspirine,tomo ni uno Aspirine,no tomo ni uno Aspirine,"Aspirine "" ,","Aspirine "" , comentar","Aspirine "" , comentar este"
http://tn.com.ar/opinion/conurbollywood-cuando-lo-esperado-nos-deja-mudos_736885,tn.com.ar,2016-09-22,Argentina,aspirinetas/NCFP00D/aspirina,"Tragedia  de  por  medio  ,  es  común  que  suene  la  campana  para  que  el  circo  de  indignados  empiece  hacer  malabares  con  pirotécnia  discursiva  diciendo  que  ""  ahora  está  de  moda  que  los  jóvenes  mezclen  alcohol  etílico  con aspirinetas  y  cocaína  ""  o  que  ,  de  repente  ,  ""  hay  nuevas  formas  de  violencia  que  implican  formar  un  puente  humano  para  apuñalar  a  quienes  pasen  por  debajo  de  él  ""  .",aspirinetas,ncfp00d,aspirina,con,con,SPS00,etílico,etílico,AQ0MS0,alcohol,alcohol,NCMS000,mezclen,mezclar,VMSP3P0,jóvenes,joven,NCCP000,y,y,CC,cocaína,cocaína,NCFS000,"""","""",Fe,o,o,CC,que,que,CS,2016-09-22,2016,2010,AQ0MS0 SPS00 Aspirine CC NCFS000,SPS00 Aspirine CC,AQ0MS0 SPS00 Aspirine,NCMS000 AQ0MS0 SPS00 Aspirine,VMSP3P0 NCMS000 AQ0MS0 SPS00 Aspirine,Aspirine CC NCFS000,Aspirine CC NCFS000 Fe,Aspirine CC NCFS000 Fe CC,etílico con Aspirine y cocaína,con Aspirine y,etílico con Aspirine,alcohol etílico con Aspirine,mezclar alcohol etílico con Aspirine,Aspirine y cocaína,"Aspirine y cocaína ""","Aspirine y cocaína "" o"
http://www.radiohuesca.com/noticia/571659/Hoy-por-Hoy-Huesca-desde-Benasque-recordando-los-100-anos-del-refugio-de-la-Renclusa,radiohuesca.com,2016-09-26,===NONE===,MasPirineo/NP00000/maspirineo,"Esta  prevista  la  partipación  del  alcalde  de  Benasque  José  Ignacio  Abadias  ,  del  guarda  del  refugio  Antonio  Lafón  y  de  representantes  de  la  FAM  ,  de  la  empresa MasPirineo  y  DPH",maspirineo,np00000,maspirineo,empresa,empresa,NCFS000,la,el,DA0FS0,de,de,SPS00,",",",",Fc,FAM,fam,NP00000,y,y,CC,DPH,dph,NP00000,,,,,,,,,,2016-09-26,2016,2010,DA0FS0 NCFS000 Aspirine CC NP00000,NCFS000 Aspirine CC,DA0FS0 NCFS000 Aspirine,SPS00 DA0FS0 NCFS000 Aspirine,Fc SPS00 DA0FS0 NCFS000 Aspirine,Aspirine CC NP00000,,,el empresa Aspirine y dph,empresa Aspirine y,el empresa Aspirine,de el empresa Aspirine,", de el empresa Aspirine",Aspirine y dph,,
http://www.lanueva.com/la-ciudad/882476/saludmental--tiene-8-anos--sufre-al-menos-un-brote-psicotico-por-dia-y-le-cuesta-atenderse.html,lanueva.com,2016-10-21,Argentina,Aspirineta/NP00000/aspirineta,"Más  adelante  ,  Mariana  se  daría  cuenta  de  que  la  pastilla  tiene  solo  una  ranura  ,  para  partirla  en  dos  partes  ,  por  lo  que  un  cuarto  solo  ""  hace  el  efecto  de  una Aspirineta  ""  .",aspirineta,np00000,aspirineta,una,uno,DI0FS0,de,de,SPS00,efecto,efecto,NCMS000,el,el,DA0MS0,hace,hacer,VMIP3S0,"""","""",Fe,.,.,Fp,,,,,,,,,,2016-10-21,2016,2010,SPS00 DI0FS0 Aspirine Fe Fp,DI0FS0 Aspirine Fe,SPS00 DI0FS0 Aspirine,NCMS000 SPS00 DI0FS0 Aspirine,DA0MS0 NCMS000 SPS00 DI0FS0 Aspirine,Aspirine Fe Fp,,,"de uno Aspirine "" .","uno Aspirine """,de uno Aspirine,efecto de uno Aspirine,el efecto de uno Aspirine,"Aspirine "" .",,
http://www.s21.gt/2016/11/teatro/,s21.gt,2016-11-15,Guatemala,Aspirinetta/NP00000/aspirinetta,"Piccoletta Aspirinetta  es  el  nombre  de  su  personaje  ,  por  el  cual  es  reconocida  en  diversos  países  del  mundo  ,  a  los  cuales  ha  llevado  alegría  ,  reflexión  y  carcajadas  .",aspirinetta,np00000,aspirinetta,Piccoletta,piccoletta,NP00000,,,,,,,,,,,,,es,ser,VSIP3S0,el,el,DA0MS0,nombre,nombre,NCMS000,de,de,SPS00,su,su,DP3CS0,2016-11-15,2016,2010,,NP00000 Aspirine VSIP3S0,,,,Aspirine VSIP3S0 DA0MS0,Aspirine VSIP3S0 DA0MS0 NCMS000,Aspirine VSIP3S0 DA0MS0 NCMS000 SPS00,,piccoletta Aspirine ser,,,,Aspirine ser el,Aspirine ser el nombre,Aspirine ser el nombre de
http://www.eluniversal.com.co/cartagena/bayunca-reclama-con-urgencia-el-alcantarillado-241469,eluniversal.com.co,2016-12-02,Colombia,aspirineta/NCFS00D/aspirina,"""  Fue  muy  feo  ese  aguacero  ,  tuve  que  tomar  una aspirineta  de  la  angustia  que  sentí  porque  la  lluvia  nos  cogió  durmiendo  ,  tuve  que  despertar  a  mis  hijos  y  llevarlos  donde  el  vecino  .",aspirineta,ncfs00d,aspirina,una,uno,DI0FS0,tomar,tomar,VMN0000,que,que,CS,tuve,tener,VMIS1S0,",",",",Fc,de,de,SPS00,la,el,DA0FS0,angustia,angustia,NCFS000,que,que,PR0CN000,sentí,sentir,VMIS1S0,2016-12-02,2016,2010,VMN0000 DI0FS0 Aspirine SPS00 DA0FS0,DI0FS0 Aspirine SPS00,VMN0000 DI0FS0 Aspirine,CS VMN0000 DI0FS0 Aspirine,VMIS1S0 CS VMN0000 DI0FS0 Aspirine,Aspirine SPS00 DA0FS0,Aspirine SPS00 DA0FS0 NCFS000,Aspirine SPS00 DA0FS0 NCFS000 PR0CN000,tomar uno Aspirine de el,uno Aspirine de,tomar uno Aspirine,que tomar uno Aspirine,tener que tomar uno Aspirine,Aspirine de el,Aspirine de el angustia,Aspirine de el angustia que
http://www.radiohuesca.com/noticia/576431/Conseguimos-que-tu-y-tus-hijos-aprendais-a-esquiar-campana-de-esqui-del-SCD-de-Ribagorza,radiohuesca.com,2016-12-13,===NONE===,Maspirineo/NP00000/maspirineo,El  período  de  inscripción  será  hasta  el  17  de  enero  y  lo  impartirá  la  escuela Maspirineo  .,maspirineo,np00000,maspirineo,escuela,escuela,NCFS000,la,el,DA0FS0,impartirá,impartir,VMIF3S0,lo,lo,PP3CNA00,y,y,CC,.,.,Fp,,,,,,,,,,,,,2016-12-13,2016,2010,,NCFS000 Aspirine Fp,DA0FS0 NCFS000 Aspirine,VMIF3S0 DA0FS0 NCFS000 Aspirine,PP3CNA00 VMIF3S0 DA0FS0 NCFS000 Aspirine,,,,,escuela Aspirine .,el escuela Aspirine,impartir el escuela Aspirine,lo impartir el escuela Aspirine,,,
http://www.elliberal.com.ar/noticia/316376/trump-toma-pastillas-para-colesterol-crecimiento-pelo,elliberal.com.ar,2017-02-03,Argentina,aspirineta/NCFS00D/aspirina,"Una aspirineta  diaria  para  reducir  el  riesgo  de  infarto  .  ""  Está  perfecto  ""  ,  comentó  el  profesional  .",aspirineta,ncfs00d,aspirina,Una,uno,DI0FS0,,,,,,,,,,,,,diaria,diario,AQ0FS0,para,para,SPS00,reducir,reducir,VMN0000,el,el,DA0MS0,riesgo,riesgo,NCMS000,2017-02-03,2017,2010,,DI0FS0 Aspirine AQ0FS0,,,,Aspirine AQ0FS0 SPS00,Aspirine AQ0FS0 SPS00 VMN0000,Aspirine AQ0FS0 SPS00 VMN0000 DA0MS0,,uno Aspirine diario,,,,Aspirine diario para,Aspirine diario para reducir,Aspirine diario para reducir el
http://www.elliberal.com.ar/noticia/316376/trump-toma-pastillas-para-colesterol-crecimiento-pelo,elliberal.com.ar,2017-02-03,Argentina,aspirineta/NCFS00D/aspirina,"Además  de  la  finasterida  ,  mencionó  que  el  magnate  toma  rosuvastatina  para  controlar  el  colesterol  y  los  lípidos  ,  tetracycline  para  la  rosácea  (  una  condición  que  causa  un  enrojecimiento  de  partes  de  la  cara  )  y  una aspirineta  diaria  para  disminuir  el  riesgo  de  infarto  .",aspirineta,ncfs00d,aspirina,una,uno,DI0FS0,y,y,CC,),),Fpt,cara,cara,NCFS000,la,el,DA0FS0,diaria,diario,AQ0FS0,para,para,SPS00,disminuir,disminuir,VMN0000,el,el,DA0MS0,riesgo,riesgo,NCMS000,2017-02-03,2017,2010,CC DI0FS0 Aspirine AQ0FS0 SPS00,DI0FS0 Aspirine AQ0FS0,CC DI0FS0 Aspirine,Fpt CC DI0FS0 Aspirine,NCFS000 Fpt CC DI0FS0 Aspirine,Aspirine AQ0FS0 SPS00,Aspirine AQ0FS0 SPS00 VMN0000,Aspirine AQ0FS0 SPS00 VMN0000 DA0MS0,y uno Aspirine diario para,uno Aspirine diario,y uno Aspirine,) y uno Aspirine,cara ) y uno Aspirine,Aspirine diario para,Aspirine diario para disminuir,Aspirine diario para disminuir el
http://www.vanguardia.com.mx/articulo/trump-sufre-de-narcisismo-maligno-aseguran-expertos,vanguardia.com.mx,2017-02-08,Mexico,aspirineta/NCFS00D/aspirina,"A  su  vez  ,  también  especificó  que  el  presidente  toma  un  antibiótico  conocido  como  rosuvastatina  para  estabilizar  el  colesterol  y  los  lípidos  ,  tetracycline  para  controlar  la  rosácea  -  la  condición  que  enrojece  parte  de  su  cara  -  ,  además  de  una aspirineta  diaria  que  busca  reducir  el  riesgo  de  sufrir  un  infarto  .",aspirineta,ncfs00d,aspirina,una,uno,DI0FS0,de,de,SPS00,además,además,RG,",",",",Fc,-,-,Fg,diaria,diario,AQ0FS0,que,que,PR0CN000,busca,buscar,VMIP3S0,reducir,reducir,VMN0000,el,el,DA0MS0,2017-02-08,2017,2010,SPS00 DI0FS0 Aspirine AQ0FS0 PR0CN000,DI0FS0 Aspirine AQ0FS0,SPS00 DI0FS0 Aspirine,RG SPS00 DI0FS0 Aspirine,Fc RG SPS00 DI0FS0 Aspirine,Aspirine AQ0FS0 PR0CN000,Aspirine AQ0FS0 PR0CN000 VMIP3S0,Aspirine AQ0FS0 PR0CN000 VMIP3S0 VMN0000,de uno Aspirine diario que,uno Aspirine diario,de uno Aspirine,además de uno Aspirine,", además de uno Aspirine",Aspirine diario que,Aspirine diario que buscar,Aspirine diario que buscar reducir
http://www.eldiario.net/noticias/2017/2017_02/nt170213/opinion.php?n=30,eldiario.net,2017-02-13,===NONE===,aspirinetas/NCFP00D/aspirina,"Pero  con  las  manos  vacías  ,  pues  no  hay  :  metformina  850  Mg  .  (  7  de  febrero  de  2017  )  para  los  diabéticos  ,  no  hay aspirinetas  ;  en  diciembre  y  enero  no  había  ni  jeringa  que  cuesta  un  peso  en  las  farmacias  .",aspirinetas,ncfp00d,aspirina,hay,haber,VMIP3S0,no,no,RN,",",",",Fc,diabéticos,diabético,NCMP000,los,el,DA0MP0,;,;,Fx,en,en,SPS00,diciembre,diciembre,NCMS000,y,y,CC,enero,enero,NCMS000,2017-02-13,2017,2010,RN VMIP3S0 Aspirine Fx SPS00,VMIP3S0 Aspirine Fx,RN VMIP3S0 Aspirine,Fc RN VMIP3S0 Aspirine,NCMP000 Fc RN VMIP3S0 Aspirine,Aspirine Fx SPS00,Aspirine Fx SPS00 NCMS000,Aspirine Fx SPS00 NCMS000 CC,no haber Aspirine ; en,haber Aspirine ;,no haber Aspirine,", no haber Aspirine","diabético , no haber Aspirine",Aspirine ; en,Aspirine ; en diciembre,Aspirine ; en diciembre y
http://www.diarionorte.com/article/149137/?utm_source=feed&utm_medium=rss&utm_term=rss&utm_campaign=Rss%2520Feed,diarionorte.com,2017-03-05,Argentina,aspirinetas/NCFP00D/aspirina,Quieren  curar  el  cáncer  con aspirinetas  y  restañar  un  cuchillazo  con  curitas  .,aspirinetas,ncfp00d,aspirina,con,con,SPS00,cáncer,cáncer,NCMS000,el,el,DA0MS0,curar,curar,VMN0000,Quieren,querer,VMIP3P0,y,y,CC,restañar,restañar,VMN0000,un,uno,DI0MS0,cuchillazo,cuchillazo,NCMS000,con,con,SPS00,2017-03-05,2017,2010,NCMS000 SPS00 Aspirine CC VMN0000,SPS00 Aspirine CC,NCMS000 SPS00 Aspirine,DA0MS0 NCMS000 SPS00 Aspirine,VMN0000 DA0MS0 NCMS000 SPS00 Aspirine,Aspirine CC VMN0000,Aspirine CC VMN0000 DI0MS0,Aspirine CC VMN0000 DI0MS0 NCMS000,cáncer con Aspirine y restañar,con Aspirine y,cáncer con Aspirine,el cáncer con Aspirine,curar el cáncer con Aspirine,Aspirine y restañar,Aspirine y restañar uno,Aspirine y restañar uno cuchillazo
http://www.analisisdigital.com.ar/noticias.php?ed=1&di=0&no=250713,analisisdigital.com.ar,2017-03-07,Argentina,Aspirineta/NP00000/aspirineta,Y  también  ocurre  algo  similar  con  las  populares Aspirineta  y  Cafiaspirina  .,aspirineta,np00000,aspirineta,populares,popular,AQ0CP0,las,el,DA0FP0,con,con,SPS00,similar,similar,AQ0CS0,algo,algo,PI0CS000,y,y,CC,Cafiaspirina,cafiaspirina,NP00000,.,.,Fp,,,,,,,2017-03-07,2017,2010,DA0FP0 AQ0CP0 Aspirine CC NP00000,AQ0CP0 Aspirine CC,DA0FP0 AQ0CP0 Aspirine,SPS00 DA0FP0 AQ0CP0 Aspirine,AQ0CS0 SPS00 DA0FP0 AQ0CP0 Aspirine,Aspirine CC NP00000,Aspirine CC NP00000 Fp,,el popular Aspirine y cafiaspirina,popular Aspirine y,el popular Aspirine,con el popular Aspirine,similar con el popular Aspirine,Aspirine y cafiaspirina,Aspirine y cafiaspirina .,
http://www.analisisdigital.com.ar/noticias.php?ed=1&di=0&no=250713,analisisdigital.com.ar,2017-03-07,Argentina,Aspirineta/NP00000/aspirineta,"Por  otra  parte  ,  Bayer  retiró  del  mercado  sus  presentaciones  de Aspirineta  por  98  unidades  y  la  Cafiaspirina  por  100  unidades  ,  luego  de  que  a  mediados  de  enero  debieron  retrotraer  sus  precios  ,  por  pedido  de  la  Secretaría  de  Comercio  .",aspirineta,np00000,aspirineta,de,de,SPS00,presentaciones,presentación,NCFP000,sus,su,DP3CP0,mercado,mercado,NCMS000,del,de+el,SPS00+DA0MS0,por,por,SPS00,98,98,Z,unidades,unidad,NCFP000,y,y,CC,la,el,DA0FS0,2017-03-07,2017,2010,NCFP000 SPS00 Aspirine SPS00 Z,SPS00 Aspirine SPS00,NCFP000 SPS00 Aspirine,DP3CP0 NCFP000 SPS00 Aspirine,NCMS000 DP3CP0 NCFP000 SPS00 Aspirine,Aspirine SPS00 Z,Aspirine SPS00 Z NCFP000,Aspirine SPS00 Z NCFP000 CC,presentación de Aspirine por 98,de Aspirine por,presentación de Aspirine,su presentación de Aspirine,mercado su presentación de Aspirine,Aspirine por 98,Aspirine por 98 unidad,Aspirine por 98 unidad y
http://www.analisisdigital.com.ar/noticias.php?ed=1&di=0&no=250713,analisisdigital.com.ar,2017-03-07,Argentina,Aspirineta/NP00000/aspirineta,"Bayer  retrotrajo  sus  precios  ,  pero  sin  previo  aviso  la Aspirineta  por  98  unidades  se  convirtió  en  una  presentación  de  28  unidades  y  la  Cafiaspirina  por  100  unidades  desapareció  del  mercado  y  ahora  se  vende  por  30  unidades  .",aspirineta,np00000,aspirineta,la,el,DA0FS0,aviso,aviso,NCMS000,previo,previo,AQ0MS0,sin,sin,SPS00,pero,pero,CC,por,por,SPS00,98,98,Z,unidades,unidad,NCFP000,se,se,P00CN000,convirtió,convertir,VMIS3S0,2017-03-07,2017,2010,NCMS000 DA0FS0 Aspirine SPS00 Z,DA0FS0 Aspirine SPS00,NCMS000 DA0FS0 Aspirine,AQ0MS0 NCMS000 DA0FS0 Aspirine,SPS00 AQ0MS0 NCMS000 DA0FS0 Aspirine,Aspirine SPS00 Z,Aspirine SPS00 Z NCFP000,Aspirine SPS00 Z NCFP000 P00CN000,aviso el Aspirine por 98,el Aspirine por,aviso el Aspirine,previo aviso el Aspirine,sin previo aviso el Aspirine,Aspirine por 98,Aspirine por 98 unidad,Aspirine por 98 unidad se
http://www.analisisdigital.com.ar/noticias.php?ed=1&di=0&no=250713,analisisdigital.com.ar,2017-03-07,Argentina,Aspirineta/NP00000/aspirineta,"La Aspirineta  por  98  unidades  costaba  $40,71  en  octubre  2015  .",aspirineta,np00000,aspirineta,La,el,DA0FS0,,,,,,,,,,,,,por,por,SPS00,98,98,Z,unidades,unidad,NCFP000,costaba,costar,VMII3S0,"$40,71","$40,71",Z,2017-03-07,2017,2010,,DA0FS0 Aspirine SPS00,,,,Aspirine SPS00 Z,Aspirine SPS00 Z NCFP000,Aspirine SPS00 Z NCFP000 VMII3S0,,el Aspirine por,,,,Aspirine por 98,Aspirine por 98 unidad,Aspirine por 98 unidad costar
http://www.analisisdigital.com.ar/noticias.php?ed=1&di=0&no=250713,analisisdigital.com.ar,2017-03-07,Argentina,Aspirineta/NP00000/aspirineta,"Entonces  ,  si  en  octubre  la Aspirineta  costaba  0,41  pesos  /  unidad  ,  en  la  actualidad  se  vende  a  1,18  pesos  /  unidad  .",aspirineta,np00000,aspirineta,la,el,DA0FS0,octubre,octubre,NCMS000,en,en,SPS00,si,si,CS,",",",",Fc,costaba,costar,VMII3S0,"0,41",0.41,Z,pesos,peso,NCMP000,/,,,unidad,unidad,NCFS000,2017-03-07,2017,2010,NCMS000 DA0FS0 Aspirine VMII3S0 Z,DA0FS0 Aspirine VMII3S0,NCMS000 DA0FS0 Aspirine,SPS00 NCMS000 DA0FS0 Aspirine,CS SPS00 NCMS000 DA0FS0 Aspirine,Aspirine VMII3S0 Z,Aspirine VMII3S0 Z NCMP000,,octubre el Aspirine costar 0.41,el Aspirine costar,octubre el Aspirine,en octubre el Aspirine,si en octubre el Aspirine,Aspirine costar 0.41,Aspirine costar 0.41 peso,
http://seprin.info/2017/04/06/nueva-ley-de-genericos-el-oficialismo-se-desmarca-de-la-reforma-propuesta-por-la-oposicion/,seprin.info,2017-04-06,===NONE===,aspirinetas/NCFP00D/aspirina,"""  Nosotros  no  compramos aspirinetas  como  se  hacía  en  el  pasado  sino  los  remedios  claves  para  bajar  estas  enfermedades  que  son  las  principales  causas  de  la  mortalidad  ""  ,  apunto  .",aspirinetas,ncfp00d,aspirina,compramos,comprar,VMIP1P0,no,no,RN,Nosotros,nosotros,PP1MP000,"""","""",Fe,,,,como,como,CS,se,se,P00CN000,hacía,hacer,VMII3S0,en,en,SPS00,el,el,DA0MS0,2017-04-06,2017,2010,RN VMIP1P0 Aspirine CS P00CN000,VMIP1P0 Aspirine CS,RN VMIP1P0 Aspirine,PP1MP000 RN VMIP1P0 Aspirine,Fe PP1MP000 RN VMIP1P0 Aspirine,Aspirine CS P00CN000,Aspirine CS P00CN000 VMII3S0,Aspirine CS P00CN000 VMII3S0 SPS00,no comprar Aspirine como se,comprar Aspirine como,no comprar Aspirine,nosotros no comprar Aspirine,""" nosotros no comprar Aspirine",Aspirine como se,Aspirine como se hacer,Aspirine como se hacer en
http://lt3.com.ar/para-la-mesa-de-lecheria-el-salvataje-de-sancor-es-solo-una-aspirineta/,lt3.com.ar,2017-04-11,Argentina,aspirineta/NCFS00D/aspirina,"<doc uri=http://lt3.com.ar/para-la-mesa-de-lecheria-el-salvataje-de-sancor-es-solo-una-aspirineta/ website=lt3.com.ar date=2017-04-11 source_country=Argentina> /para/SPS00 /el/DA0FS0 /mesa/NP00000 /de/SPS00 /lechería/NP00000 /""/Fe /el/DA0MS0 /salvataje/NCMS000 /de/SPS00 /450000000/Zd /para/SPS00 /sancor/NP00000 /ser/VSIP3S0 /sólo/RG /uno/DI0FS0 aspirineta  """,aspirineta,ncfs00d,aspirina,una,uno,DI0FS0,sólo,sólo,RG,es,ser,VSIP3S0,Sancor,sancor,NP00000,para,para,SPS00,"""","""",Fe,,,,,,,,,,,,,2017-04-11,2017,2010,,DI0FS0 Aspirine Fe,RG DI0FS0 Aspirine,VSIP3S0 RG DI0FS0 Aspirine,NP00000 VSIP3S0 RG DI0FS0 Aspirine,,,,,"uno Aspirine """,sólo uno Aspirine,ser sólo uno Aspirine,sancor ser sólo uno Aspirine,,,
http://lt3.com.ar/para-la-mesa-de-lecheria-el-salvataje-de-sancor-es-solo-una-aspirineta/,lt3.com.ar,2017-04-11,Argentina,aspirineta/NCFS00D/aspirina,"""  Nación  enviará  450_millones  de  pesos  ,  pero  es  sólo  una aspirineta  ,  porque  la  deuda  es  de  200_millones  de  dólares  ""  ,  sentenció  Córdoba  respecto  a  la  inyección  de  capitales  que  propone  el  gobierno  nacional  para  salvar  a  la  empresa  Sancor  .",aspirineta,ncfs00d,aspirina,una,uno,DI0FS0,sólo,sólo,RG,es,ser,VSIP3S0,pero,pero,CC,",",",",Fc,",",",",Fc,porque,porque,CS,la,el,DA0FS0,deuda,deuda,NCFS000,es,ser,VSIP3S0,2017-04-11,2017,2010,RG DI0FS0 Aspirine Fc CS,DI0FS0 Aspirine Fc,RG DI0FS0 Aspirine,VSIP3S0 RG DI0FS0 Aspirine,CC VSIP3S0 RG DI0FS0 Aspirine,Aspirine Fc CS,Aspirine Fc CS DA0FS0,Aspirine Fc CS DA0FS0 NCFS000,"sólo uno Aspirine , porque","uno Aspirine ,",sólo uno Aspirine,ser sólo uno Aspirine,pero ser sólo uno Aspirine,"Aspirine , porque","Aspirine , porque el","Aspirine , porque el deuda"
http://www.lanueva.com/aplausos/903700/luceros-el-ojo-daltonico--difundiendo-la-palabra.html,lanueva.com,2017-05-21,Argentina,Aspirinetas/NP00000/aspirinetas,"-  Murcy  Bouscayrol  (  Vúmetro  ,  ex  Bob  y  Las Aspirinetas  Band  )  ,  voz  en  ""  Retroanatomía  ""  .",aspirinetas,np00000,aspirinetas,Las,las,NP00000,y,y,CC,Bob,bob,NP00000,ex,ex,NCCN000,",",",",Fc,Band,band,NP00000,),),Fpt,",",",",Fc,voz,voz,NCFS000,en,en,SPS00,2017-05-21,2017,2010,CC NP00000 Aspirine NP00000 Fpt,NP00000 Aspirine NP00000,CC NP00000 Aspirine,NP00000 CC NP00000 Aspirine,NCCN000 NP00000 CC NP00000 Aspirine,Aspirine NP00000 Fpt,Aspirine NP00000 Fpt Fc,Aspirine NP00000 Fpt Fc NCFS000,y las Aspirine band ),las Aspirine band,y las Aspirine,bob y las Aspirine,ex bob y las Aspirine,Aspirine band ),"Aspirine band ) ,","Aspirine band ) , voz"
http://diariohoy.net/politica/mas-caros-y-con-menor-cobertura-descomunal-aumento-en-el-precio-de-los-medicamentos-98243,diariohoy.net,2017-06-19,===NONE===,aspirineta/NCFS00D/aspirina,"Un  medicamento  de  venta  libre  que  los  jubilados  usan  mucho  ,  la  simple aspirineta  anticoagulante  para  los  problemas  cardíacos  ,  aumentó  en  promedio  más  del  cien  por  ciento  ,  lo  que  afecta  muy  negativamente  al  bolsillo  de  los  jubilados  porque  es  de  venta  libre  y  no  lo  tienen  en  la  cobertura  del  PAMI  .",aspirineta,ncfs00d,aspirina,simple,simple,AQ0CS0,la,el,DA0FS0,",",",",Fc,mucho,mucho,RG,usan,usar,VMIP3P0,anticoagulante,anticoagulante,AQ0CS0,para,para,SPS00,los,el,DA0MP0,problemas,problema,NCMP000,cardíacos,cardíaco,AQ0MP0,2017-06-19,2017,2010,DA0FS0 AQ0CS0 Aspirine AQ0CS0 SPS00,AQ0CS0 Aspirine AQ0CS0,DA0FS0 AQ0CS0 Aspirine,Fc DA0FS0 AQ0CS0 Aspirine,RG Fc DA0FS0 AQ0CS0 Aspirine,Aspirine AQ0CS0 SPS00,Aspirine AQ0CS0 SPS00 DA0MP0,Aspirine AQ0CS0 SPS00 DA0MP0 NCMP000,el simple Aspirine anticoagulante para,simple Aspirine anticoagulante,el simple Aspirine,", el simple Aspirine","mucho , el simple Aspirine",Aspirine anticoagulante para,Aspirine anticoagulante para el,Aspirine anticoagulante para el problema
http://www.eldiario.net/noticias/2017/2017_07/nt170712/sociedad.php?n=48,eldiario.net,2017-07-12,===NONE===,aspirinetas/NCFP00D/aspirina,"El  administrador  regional  de  la  Caja  Nacional  de  Salud  (  CNS  )  ,  William  de  la  Barra  ,  admitió  que  la  entidad  aseguradora  repartió  un  ítem  ( aspirinetas  )  de  procedencia  China  ,  dijo  que  si  este  aspecto  crea  susceptibilidad  ""  no  se  volverá  a  comprar  ningún  medicamento  chino  ""  .",aspirinetas,ncfp00d,aspirina,(,(,Fpa,ítem,ítem,NCMS000,un,uno,DI0MS0,repartió,repartir,VMIS3S0,aseguradora,asegurador,AQ0FS0,),),Fpt,de,de,SPS00,procedencia,procedencia,NCFS000,China,china,NP00000,",",",",Fc,2017-07-12,2017,2010,NCMS000 Fpa Aspirine Fpt SPS00,Fpa Aspirine Fpt,NCMS000 Fpa Aspirine,DI0MS0 NCMS000 Fpa Aspirine,VMIS3S0 DI0MS0 NCMS000 Fpa Aspirine,Aspirine Fpt SPS00,Aspirine Fpt SPS00 NCFS000,Aspirine Fpt SPS00 NCFS000 NP00000,ítem ( Aspirine ) de,( Aspirine ),ítem ( Aspirine,uno ítem ( Aspirine,repartir uno ítem ( Aspirine,Aspirine ) de,Aspirine ) de procedencia,Aspirine ) de procedencia china
http://www.juventudrebelde.cu/deportes/2017-07-19/un-verano-de-tiendas/,juventudrebelde.cu,2017-07-20,Cuba,aspirineros/NCMP000/aspirineros,"Los  aurinegros  del  Dortmund  ,  al  parecer  en  contra  de  las  ""  importaciones  ""  ,  trajeron  a  sus  filas  a  tres  locales  :  Maximilian  Philipp  (  Friburgo  )  ,  Mahmoud  Dahoud  (  M'Gladbach  )  y  Ömer  Toprak  (  leverkusen  )  ,  a  la  vez  que  cambiaron  a  Sven  Bender  por  su  mellizo  Lars  ,  hasta  el  momento  jugador  de  los aspirineros  de  Leverkusen  .",aspirineros,ncmp000,aspirineros,los,el,DA0MP0,de,de,SPS00,jugador,jugador,NCMS000,momento,momento,NCMS000,el,el,DA0MS0,de,de,SPS00,Leverkusen,leverkusen,NP00000,.,.,Fp,,,,,,,2017-07-20,2017,2010,SPS00 DA0MP0 Aspirine SPS00 NP00000,DA0MP0 Aspirine SPS00,SPS00 DA0MP0 Aspirine,NCMS000 SPS00 DA0MP0 Aspirine,NCMS000 NCMS000 SPS00 DA0MP0 Aspirine,Aspirine SPS00 NP00000,Aspirine SPS00 NP00000 Fp,,de el Aspirine de leverkusen,el Aspirine de,de el Aspirine,jugador de el Aspirine,momento jugador de el Aspirine,Aspirine de leverkusen,Aspirine de leverkusen .,
