url,website,date,country,keyword,sentence,kw,kw_lemma,kw_pos,left_w1,left_l1,left_p1,left_w2,left_l2,left_p2,left_w3,left_l3,left_p3,left_w4,left_l4,left_p4,left_w5,left_l5,left_p5,right_w1,right_l1,right_p1,right_w2,right_l2,right_p2,right_w3,right_l3,right_p3,right_w4,right_l4,right_p4,right_w5,right_l5,right_p5,datetime,year,10years,pattern_around5,pattern_around3,pattern_left2,pattern_left3,pattern_left4,pattern_right2,pattern_right3,pattern_right4,pattern_around5_lex,pattern_around3_lex,pattern_left2_lex,pattern_left3_lex,pattern_left4_lex,pattern_right2_lex,pattern_right3_lex,pattern_right4_lex
http://www.elmundo.es/sociedad/2016/12/17/585441f6468aebee118b464c.html,elmundo.es,2016-12-17,Spain,bitter_kas/NCMS000_AQ0FP0/bitter_kas,"Luego  ,  ante  un bitter_kas  y  unas  almendras  ,  Arturo  es  una  burbuja  de  risas  y  dos  apellidos  que  se  conforman  con  una  vocal  /  Nació  en  el  periodismo  de  los  ceniceros  y  los  malditos  y  se  fue  a  las  guerras  para  contarlas  sin  saber  que  las  miradas  de  los  niños  ,  los  estertores  de  otros  en  sus  brazos  o  los  perros  desperrados  habrían  de  visitarlo  durante  el  resto  de  su  paz  /  22  novelas  después  ,  Falcó  es  la  última  muesca  de  un  tipo  que  escribe  con  cicatrices  y  lleva  tinta  de  sangre  en  el  estilo  ,  una  literatura  en  directo  ,  un  columnismo",bitter_kas,ncms000_aq0fp0,bitter_kas,un,uno,DI0MS0,ante,ante,SPS00,",",",",Fc,Luego,luego,RG,,,,y,y,CC,unas,uno,DI0FP0,almendras,almendra,NCFP000,",",",",Fc,Arturo,arturo,NP00000,2016-12-17,2016,2010,SPS00 DI0MS0 Bitter Kas CC DI0FP0,DI0MS0 Bitter Kas CC,SPS00 DI0MS0 Bitter Kas,Fc SPS00 DI0MS0 Bitter Kas,RG Fc SPS00 DI0MS0 Bitter Kas,Bitter Kas CC DI0FP0,Bitter Kas CC DI0FP0 NCFP000,Bitter Kas CC DI0FP0 NCFP000 Fc,ante uno Bitter Kas y uno,uno Bitter Kas y,ante uno Bitter Kas,", ante uno Bitter Kas","luego , ante uno Bitter Kas",Bitter Kas y uno,Bitter Kas y uno almendra,"Bitter Kas y uno almendra ,"
http://www.lavozdegalicia.es/noticia/cine/2017/03/03/fantasma-kirs-pasea-calle-real/0003_201703H3C2995.htm,lavozdegalicia.es,2017-03-03,Spain,Bitter_Kas/NP00000_NP00000/bitter_kas,"Se  trataba  de  un  lugar  en  el  que  a  tu  lado  una  señora  pedía  un Bitter_Kas  ,  cuando  pensabas  que  esa  bebida  ya  no  se  fabricaba  .",bitter_kas,np00000_np00000,bitter_kas,un,uno,DI0MS0,pedía,pedir,VMII3S0,señora,señor,NCFS000,una,uno,DI0FS0,lado,lado,NCMS000,",",",",Fc,cuando,cuando,CS,pensabas,pensar,VMII2S0,que,que,CS,esa,ese,DD0FS0,2017-03-03,2017,2010,VMII3S0 DI0MS0 Bitter Kas Fc CS,DI0MS0 Bitter Kas Fc,VMII3S0 DI0MS0 Bitter Kas,NCFS000 VMII3S0 DI0MS0 Bitter Kas,DI0FS0 NCFS000 VMII3S0 DI0MS0 Bitter Kas,Bitter Kas Fc CS,Bitter Kas Fc CS VMII2S0,Bitter Kas Fc CS VMII2S0 CS,"pedir uno Bitter Kas , cuando","uno Bitter Kas ,",pedir uno Bitter Kas,señor pedir uno Bitter Kas,uno señor pedir uno Bitter Kas,"Bitter Kas , cuando","Bitter Kas , cuando pensar","Bitter Kas , cuando pensar que"
http://www.lne.es/oviedo/2017/03/19/ultimo-almuerzo-casa-conrado/2075518.html?utm_medium=rss,lne.es,2017-03-19,Spain,Bitter_Kas/NP00000_NP00000/bitter_kas,"Ana  Obregón  asoma  por  la  pantalla  de  la  televisión  y  las  tres  amigas  -  amplias  gafas  de  sol  y  bolso  LV  -  piden Bitter_Kas  en  la  barra  .  ""  ¿  Y  a  dónde  vamos  a  ir  ahora  ,  al  Tizón  ?  ""  .",bitter_kas,np00000_np00000,bitter_kas,piden,pedir,VMIP3P0,-,-,Fg,LV,lv,NP00000,bolso,bolso,NCMS000,y,y,CC,en,en,SPS00,la,el,DA0FS0,barra,barra,NCFS000,.,.,Fp,"""","""",Fe,2017-03-19,2017,2010,Fg VMIP3P0 Bitter Kas SPS00 DA0FS0,VMIP3P0 Bitter Kas SPS00,Fg VMIP3P0 Bitter Kas,NP00000 Fg VMIP3P0 Bitter Kas,NCMS000 NP00000 Fg VMIP3P0 Bitter Kas,Bitter Kas SPS00 DA0FS0,Bitter Kas SPS00 DA0FS0 NCFS000,Bitter Kas SPS00 DA0FS0 NCFS000 Fp,- pedir Bitter Kas en el,pedir Bitter Kas en,- pedir Bitter Kas,lv - pedir Bitter Kas,bolso lv - pedir Bitter Kas,Bitter Kas en el,Bitter Kas en el barra,Bitter Kas en el barra .
http://www.diariosur.es/sociedad/bitter-20170706132010-nt.html,diariosur.es,2017-07-08,Spain,Bitter_Kas/NP00000_NP00000/bitter_kas,<doc uri=http://www.diariosur.es/sociedad/bitter-20170706132010-nt.html website=diariosur.es date=2017-07-08 source_country=Spain> /el/DA0FS0 /historia/NCFS000 /tras/SPS00 /el/DA0MS0 Bitter_Kas ,bitter_kas,np00000_np00000,bitter_kas,el,el,DA0MS0,tras,tras,SPS00,historia,historia,NCFS000,La,el,DA0FS0,,,,,,,,,,,,,,,,,,,2017-07-08,2017,2010,,,SPS00 DA0MS0 Bitter Kas,NCFS000 SPS00 DA0MS0 Bitter Kas,DA0FS0 NCFS000 SPS00 DA0MS0 Bitter Kas,,,,,,tras el Bitter Kas,historia tras el Bitter Kas,el historia tras el Bitter Kas,,,
http://www.diariosur.es/sociedad/bitter-20170706132010-nt.html,diariosur.es,2017-07-08,Spain,Bitter_Kas/NP00000_NP00000/bitter_kas,El Bitter_Kas  se  abría  camino  con  distinción  y  sin  competencia  en  España  .,bitter_kas,np00000_np00000,bitter_kas,El,el,DA0MS0,,,,,,,,,,,,,se,se,P00CN000,abría,abrir,VMII3S0,camino,camino,NCMS000,con,con,SPS00,distinción,distinción,NCFS000,2017-07-08,2017,2010,,DA0MS0 Bitter Kas P00CN000,,,,Bitter Kas P00CN000 VMII3S0,Bitter Kas P00CN000 VMII3S0 NCMS000,Bitter Kas P00CN000 VMII3S0 NCMS000 SPS00,,el Bitter Kas se,,,,Bitter Kas se abrir,Bitter Kas se abrir camino,Bitter Kas se abrir camino con
http://www.diariosur.es/sociedad/bitter-20170706132010-nt.html,diariosur.es,2017-07-08,Spain,Bitter_Kas/NP00000_NP00000/bitter_kas,"Las  claves  las  detallan  desde  la  propia  empresa  ,  perteneciente  al  grupo  Pepsi  Co  desde  1992  y  que  sigue  fabricando  el Bitter_Kas  fiel  a  su  fórmula  original  desde  Vitoria  ,  donde  la  marca  Kas  nació  en  1956  de  la  mano  del  empresario  Roman  Knörr  Streiff  .",bitter_kas,np00000_np00000,bitter_kas,el,el,DA0MS0,fabricando,fabricar,VMG0000,sigue,seguir,VMIP3S0,que,que,PR0CN000,y,y,CC,fiel,fiel,AQ0CS0,a,a,SPS00,su,su,DP3CS0,fórmula,fórmula,NCFS000,original,original,AQ0CS0,2017-07-08,2017,2010,VMG0000 DA0MS0 Bitter Kas AQ0CS0 SPS00,DA0MS0 Bitter Kas AQ0CS0,VMG0000 DA0MS0 Bitter Kas,VMIP3S0 VMG0000 DA0MS0 Bitter Kas,PR0CN000 VMIP3S0 VMG0000 DA0MS0 Bitter Kas,Bitter Kas AQ0CS0 SPS00,Bitter Kas AQ0CS0 SPS00 DP3CS0,Bitter Kas AQ0CS0 SPS00 DP3CS0 NCFS000,fabricar el Bitter Kas fiel a,el Bitter Kas fiel,fabricar el Bitter Kas,seguir fabricar el Bitter Kas,que seguir fabricar el Bitter Kas,Bitter Kas fiel a,Bitter Kas fiel a su,Bitter Kas fiel a su fórmula
http://www.diariosur.es/sociedad/bitter-20170706132010-nt.html,diariosur.es,2017-07-08,Spain,Bitter_Kas/NP00000_NP00000/bitter_kas,"El  mensaje  va  dirigido  a  un  público  joven  ,  dado  que  los  consumidores  habituales  de  esta  bebida  estaban  envejeciendo  .  ""  Se  trataba  de  llegar  a  personas  que  ,  o  bien  nunca  habían  oído  hablar  de Bitter_Kas  ,  o  bien  ,  no  lo  había  probado  hasta  ese  momento  ""  ,  detalla  García  .",bitter_kas,np00000_np00000,bitter_kas,de,de,SPS00,hablar,hablar,VMN0000,oído,oír,VMP00SM,habían,haber,VAII3P0,nunca,nunca,RG,",",",",Fc,o,o,CC,bien,bien,RG,",",",",Fc,no,no,RN,2017-07-08,2017,2010,VMN0000 SPS00 Bitter Kas Fc CC,SPS00 Bitter Kas Fc,VMN0000 SPS00 Bitter Kas,VMP00SM VMN0000 SPS00 Bitter Kas,VAII3P0 VMP00SM VMN0000 SPS00 Bitter Kas,Bitter Kas Fc CC,Bitter Kas Fc CC RG,Bitter Kas Fc CC RG Fc,"hablar de Bitter Kas , o","de Bitter Kas ,",hablar de Bitter Kas,oír hablar de Bitter Kas,haber oír hablar de Bitter Kas,"Bitter Kas , o","Bitter Kas , o bien","Bitter Kas , o bien ,"
http://www.diariosur.es/sociedad/bitter-20170706132010-nt.html,diariosur.es,2017-07-08,Spain,Bitter_Kas/NP00000_NP00000/bitter_kas,Desde  la  empresa  están  satisfechos  con  los  resultados  alcanzados  hasta  ahora  y  aseguran  que  el Bitter_Kas  ha  dejado  de  ser  una  bebida  de  nostálgicos  .,bitter_kas,np00000_np00000,bitter_kas,el,el,DA0MS0,que,que,CS,aseguran,asegurar,VMIP3P0,y,y,CC,ahora,ahora,RG,ha,haber,VAIP3S0,dejado,dejar,VMP00SM,de,de,SPS00,ser,ser,VSN0000,una,uno,DI0FS0,2017-07-08,2017,2010,CS DA0MS0 Bitter Kas VAIP3S0 VMP00SM,DA0MS0 Bitter Kas VAIP3S0,CS DA0MS0 Bitter Kas,VMIP3P0 CS DA0MS0 Bitter Kas,CC VMIP3P0 CS DA0MS0 Bitter Kas,Bitter Kas VAIP3S0 VMP00SM,Bitter Kas VAIP3S0 VMP00SM SPS00,Bitter Kas VAIP3S0 VMP00SM SPS00 VSN0000,que el Bitter Kas haber dejar,el Bitter Kas haber,que el Bitter Kas,asegurar que el Bitter Kas,y asegurar que el Bitter Kas,Bitter Kas haber dejar,Bitter Kas haber dejar de,Bitter Kas haber dejar de ser
http://blogs.adobe.com/creative/es/andoni-beristain-surrealismo-postmoderno-con-cabeza/,adobe.com,2017-10-23,===NONE===,Bitter_Kas/NP00000_NP00000/bitter_kas,"Léase  :  Apple  ,  Absolut  Vodka  ,  Carolina  Herrera  ,  Etnia  Barcelona  ,  Typeform  ,  Wallapop  , Bitter_Kas  ,  Diesel  ,  Armani  ,  Ralph  Lauren  ,  Cacharel  ,  Aristocrazy  ,  Neo2  Magazine  ,  Brosmind  ,  Sala  Apolo  ,  Hey  Studio  ,  Mucho  ,  New  Balance  ,  Havaianas  ,  Odd  Pears  y  IED  Madrid  ,  entre  muchos  otros  . </doc>",bitter_kas,np00000_np00000,bitter_kas,",",",",Fc,Wallapop,wallapop,NP00000,",",",",Fc,Typeform,typeform,NP00000,",",",",Fc,",",",",Fc,Diesel,diesel,NP00000,",",",",Fc,Armani,armani,NP00000,",",",",Fc,2017-10-23,2017,2010,NP00000 Fc Bitter Kas Fc NP00000,Fc Bitter Kas Fc,NP00000 Fc Bitter Kas,Fc NP00000 Fc Bitter Kas,NP00000 Fc NP00000 Fc Bitter Kas,Bitter Kas Fc NP00000,Bitter Kas Fc NP00000 Fc,Bitter Kas Fc NP00000 Fc NP00000,"wallapop , Bitter Kas , diesel",", Bitter Kas ,","wallapop , Bitter Kas",", wallapop , Bitter Kas","typeform , wallapop , Bitter Kas","Bitter Kas , diesel","Bitter Kas , diesel ,","Bitter Kas , diesel , armani"
http://www.diariodeleon.es/noticias/sociedad/aprendices-buen-gusto_1200421.html,diariodeleon.es,2017-11-02,Spain,bitter_Kas/NCMS000_NP00000/bitter_kas,"Naranjas  para  el  ácido  ,  rojo  de bitter_Kas  para  el  amargo  ,  verde  de  queso  de  cabra  para  el  salado  y  azul  dulce  hecho  con  mosto  .  ""  Les  vamos  a  poner  un  antifaz  para  que  adivinen  los  alimentos  y  el  sabor  que  tienen  ,  como  el  chocolate  amargo  ,  mandarina  para  el  ácido  ,  aceitunas  para  el  salado  y  gominola  de  regaliz  para  el  dulce  .",bitter_kas,ncms000_np00000,bitter_kas,de,de,SPS00,rojo,rojo,NCMS000,",",",",Fc,ácido,ácido,NCMS000,el,el,DA0MS0,para,para,SPS00,el,el,DA0MS0,amargo,amargo,NCMS000,",",",",Fc,verde,verde,AQ0CS0,2017-11-02,2017,2010,NCMS000 SPS00 Bitter Kas SPS00 DA0MS0,SPS00 Bitter Kas SPS00,NCMS000 SPS00 Bitter Kas,Fc NCMS000 SPS00 Bitter Kas,NCMS000 Fc NCMS000 SPS00 Bitter Kas,Bitter Kas SPS00 DA0MS0,Bitter Kas SPS00 DA0MS0 NCMS000,Bitter Kas SPS00 DA0MS0 NCMS000 Fc,rojo de Bitter Kas para el,de Bitter Kas para,rojo de Bitter Kas,", rojo de Bitter Kas","ácido , rojo de Bitter Kas",Bitter Kas para el,Bitter Kas para el amargo,"Bitter Kas para el amargo ,"
http://sevilla.abc.es/cultura/abci-asesino-mataba-madre-cada-crimen-201712031105_noticia.html,abc.es,2017-12-03,Spain,Bitter_Kas/NP00000_NP00000/bitter_kas,"Al  ser  detenido  un  mes  más  tarde  ,  la  policía  descubrió  en  su  vivienda  una  habitación  cuyas  paredes  y  cortinas  estaban  tapizadas  en  rojo  sangre  ,  llena  de  objetos  de  sus  víctimas  ;  recuerdos  que  herían  la  memoria  de  cada  una  de  ellas  :  muñecas  con  sus  anillos  y  collares  ;  medallas  ,  cruces  ,  relojes  ,  gargantillas  ,  jarras  de  loza  ,  transistores  ,  algún  televisor  ,  ceniceros  ,  botellas  con  restos  rojos  de Bitter_Kas  ...",bitter_kas,np00000_np00000,bitter_kas,de,de,SPS00,rojos,rojo,AQ0MP0,restos,resto,NCMP000,con,con,SPS00,botellas,botella,NCFP000,...,...,Fs,,,,,,,,,,,,,2017-12-03,2017,2010,,SPS00 Bitter Kas Fs,AQ0MP0 SPS00 Bitter Kas,NCMP000 AQ0MP0 SPS00 Bitter Kas,SPS00 NCMP000 AQ0MP0 SPS00 Bitter Kas,,,,,de Bitter Kas ...,rojo de Bitter Kas,resto rojo de Bitter Kas,con resto rojo de Bitter Kas,,,
http://www.marca.com/tiramillas/actualidad/2018/02/28/5a96a700ca474173138b4615.html,marca.com,2018-02-28,Spain,Bitter_Kas/NP00000_NP00000/bitter_kas,"En  las  imágenes  de  anuncios  de  El  Corte  Inglés  y Bitter_Kas  ,  con  las  que  rendimos  homenaje  a  '  Quini  '  ,  también  aparecen  otros  jugadores  como  Camacho  ,  Zamora  o  Tendillo  .",bitter_kas,np00000_np00000,bitter_kas,y,y,CC,Inglés,inglés,NP00000,Corte,corte,NP00000,El,el,NP00000,de,de,SPS00,",",",",Fc,con,con,SPS00,las,el,DA0FP0,que,que,PR0CN000,rendimos,rendir,VMIS1P0,2018-02-28,2018,2010,NP00000 CC Bitter Kas Fc SPS00,CC Bitter Kas Fc,NP00000 CC Bitter Kas,NP00000 NP00000 CC Bitter Kas,NP00000 NP00000 NP00000 CC Bitter Kas,Bitter Kas Fc SPS00,Bitter Kas Fc SPS00 DA0FP0,Bitter Kas Fc SPS00 DA0FP0 PR0CN000,"inglés y Bitter Kas , con","y Bitter Kas ,",inglés y Bitter Kas,corte inglés y Bitter Kas,el corte inglés y Bitter Kas,"Bitter Kas , con","Bitter Kas , con el","Bitter Kas , con el que"
https://www.huffingtonpost.es/2018/11/14/esta-tuitera-triunfa-con-su-lista-de-expresiones-horteras-que-hay-que-recuperar_a_23589401/,huffingtonpost.es,2018-11-14,Spain,Bitter_Kas/NP00000_NP00000/bitter_kas,De Bitter_Kas  '  podría  ser  viral  .,bitter_kas,np00000_np00000,bitter_kas,De,de,SPS00,,,,,,,,,,,,,',',Fe,podría,poder,VMIC3S0,ser,ser,VSN0000,viral,viral,AQ0CS0,.,.,Fp,2018-11-14,2018,2010,,SPS00 Bitter Kas Fe,,,,Bitter Kas Fe VMIC3S0,Bitter Kas Fe VMIC3S0 VSN0000,Bitter Kas Fe VMIC3S0 VSN0000 AQ0CS0,,de Bitter Kas ',,,,Bitter Kas ' poder,Bitter Kas ' poder ser,Bitter Kas ' poder ser viral
https://www.sport.es/es/noticias/opinion/formentor-7187064,sport.es,2018-12-06,Spain,Bitter_Kas/NP00000_NP00000/bitter_kas,"Allí  estaba  el  presidente  ,  con  su  esposa  y  su Bitter_Kas  .",bitter_kas,np00000_np00000,bitter_kas,su,su,DP3CS0,y,y,CC,esposa,esposo,NCFS000,su,su,DP3CS0,con,con,SPS00,.,.,Fp,,,,,,,,,,,,,2018-12-06,2018,2010,,DP3CS0 Bitter Kas Fp,CC DP3CS0 Bitter Kas,NCFS000 CC DP3CS0 Bitter Kas,DP3CS0 NCFS000 CC DP3CS0 Bitter Kas,,,,,su Bitter Kas .,y su Bitter Kas,esposo y su Bitter Kas,su esposo y su Bitter Kas,,,
https://elpais.com/cultura/2019/03/26/babelia/1553599592_225481.html#ref%3Drss%26format%3Dsimple%26link%3Dlink,elpais.com,2019-03-27,Spain,Bitter_Kas/NP00000_NP00000/bitter_kas,"Pop  áspero  como  un Bitter_Kas  ,  magullado  por  la  tristeza  pero  de  estribillo  indeleble  .",bitter_kas,np00000_np00000,bitter_kas,un,uno,DI0MS0,como,como,CS,áspero,áspero,AQ0MS0,Pop,pop,NCMS000,,,,",",",",Fc,magullado,magullar,VMP00SM,por,por,SPS00,la,el,DA0FS0,tristeza,tristeza,NCFS000,2019-03-27,2019,2010,CS DI0MS0 Bitter Kas Fc VMP00SM,DI0MS0 Bitter Kas Fc,CS DI0MS0 Bitter Kas,AQ0MS0 CS DI0MS0 Bitter Kas,NCMS000 AQ0MS0 CS DI0MS0 Bitter Kas,Bitter Kas Fc VMP00SM,Bitter Kas Fc VMP00SM SPS00,Bitter Kas Fc VMP00SM SPS00 DA0FS0,"como uno Bitter Kas , magullar","uno Bitter Kas ,",como uno Bitter Kas,áspero como uno Bitter Kas,pop áspero como uno Bitter Kas,"Bitter Kas , magullar","Bitter Kas , magullar por","Bitter Kas , magullar por el"
https://www.vozpopuli.com/economia-y-finanzas/Pepsico-espanoles-directores-sectoriales-Europa_0_1245175924.html,vozpopuli.com,2019-05-14,===NONE===,Bitter_KAS/NP00000_NP00000/bitter_kas,"Suazo  -  procedente  de  la  cervecera  Molson  Coors  -  será  la  responsable  de  enseñas  como  PepsiMax  ,  7UP  ,  KAS  , Bitter_KAS  ,  Lipton  y  Gatorade  ,  y  su  objetivo  será  ""  dar  respuesta  a  las  tendencias  de  mercado  relacionadas  con  salud  y  sostenibilidad  ""  .",bitter_kas,np00000_np00000,bitter_kas,",",",",Fc,KAS,kas,NP00000,",",",",Fc,7UP,7UP,Z,",",",",Fc,",",",",Fc,Lipton,lipton,NP00000,y,y,CC,Gatorade,gatorade,NP00000,",",",",Fc,2019-05-14,2019,2010,NP00000 Fc Bitter Kas Fc NP00000,Fc Bitter Kas Fc,NP00000 Fc Bitter Kas,Fc NP00000 Fc Bitter Kas,Z Fc NP00000 Fc Bitter Kas,Bitter Kas Fc NP00000,Bitter Kas Fc NP00000 CC,Bitter Kas Fc NP00000 CC NP00000,"kas , Bitter Kas , lipton",", Bitter Kas ,","kas , Bitter Kas",", kas , Bitter Kas","7UP , kas , Bitter Kas","Bitter Kas , lipton","Bitter Kas , lipton y","Bitter Kas , lipton y gatorade"
https://www.publico.es/tremending/2019/06/14/guerramundialmillenials-el-divertido-hashtag-que-muestra-la-forma-en-la-que-se-expresan-los-jovenes/,publico.es,2019-06-14,Spain,Bitter_Kas/NP00000_NP00000/bitter_kas,"De Bitter_Kas  ""  son  muy  difíciles  de  escuchar  en  boca  de  las  nuevas  generaciones  .",bitter_kas,np00000_np00000,bitter_kas,De,de,SPS00,,,,,,,,,,,,,"""","""",Fe,son,ser,VSIP3P0,muy,muy,RG,difíciles,difícil,AQ0CP0,de,de,SPS00,2019-06-14,2019,2010,,SPS00 Bitter Kas Fe,,,,Bitter Kas Fe VSIP3P0,Bitter Kas Fe VSIP3P0 RG,Bitter Kas Fe VSIP3P0 RG AQ0CP0,,"de Bitter Kas """,,,,"Bitter Kas "" ser","Bitter Kas "" ser muy","Bitter Kas "" ser muy difícil"
https://www.elperiodicoextremadura.com/noticias/masperiodico/cesar-serrano-permanentemente-puede-ser-joven-otra-cosa-es-sientas-huesos-cascan-poco_1171256.html,elperiodicoextremadura.com,2019-06-23,===NONE===,Bitter_Kass/NP00000_NP00000/bitter_kass,Pero  aquello  para  mí  era  un  espectáculo  y  cuando  terminó  la  jura  me  fui  y  me  bebí  un Bitter_Kass  .,bitter_kass,np00000_np00000,bitter_kass,un,uno,DI0MS0,bebí,beber,VMIS1S0,me,me,PP1CS000,y,y,CC,fui,ir,VMIS1S0,.,.,Fp,,,,,,,,,,,,,2019-06-23,2019,2010,,DI0MS0 Bitter Kas Fp,VMIS1S0 DI0MS0 Bitter Kas,PP1CS000 VMIS1S0 DI0MS0 Bitter Kas,CC PP1CS000 VMIS1S0 DI0MS0 Bitter Kas,,,,,uno Bitter Kas .,beber uno Bitter Kas,me beber uno Bitter Kas,y me beber uno Bitter Kas,,,
https://elpais.com/elpais/2019/07/29/buenavida/1564385343_499148.html#ref%3Drss%26format%3Dsimple%26link%3Dlink,elpais.com,2019-08-01,Spain,Bitter_Kas/NP00000_NP00000/bitter_kas,"Si  bien  cualquier  sistema  basado  en  comer  menos  acaba  funcionando  en  primera  instancia  cuando  de  lo  que  se  trata  es  de  perder  peso  ,  --  con  independencia  de  que  la  opción  elegida  sea  alimentarse  únicamente  con  peras  limoneras  o  hacer  la  ""  dieta  de  los  berberechos  y Bitter_Kas  ""  (  durante  tres  días  solo  es  posible  comer  este  molusco  y  beber  de  este  trago  amargo  )  --  ,  ""  lo  realmente  importante  es  el  mantenimiento  y  no  el  recorte  en  sí  ""  ,  remarca  el  catedrático  Salas-Salvadó  .",bitter_kas,np00000_np00000,bitter_kas,y,y,CC,berberechos,berberecho,NCMP000,los,el,DA0MP0,de,de,SPS00,dieta,dieta,NCFS000,"""","""",Fe,(,(,Fpa,durante,durante,SPS00,tres,3,Z,días,día,NCMP000,2019-08-01,2019,2010,NCMP000 CC Bitter Kas Fe Fpa,CC Bitter Kas Fe,NCMP000 CC Bitter Kas,DA0MP0 NCMP000 CC Bitter Kas,SPS00 DA0MP0 NCMP000 CC Bitter Kas,Bitter Kas Fe Fpa,Bitter Kas Fe Fpa SPS00,Bitter Kas Fe Fpa SPS00 Z,"berberecho y Bitter Kas "" (","y Bitter Kas """,berberecho y Bitter Kas,el berberecho y Bitter Kas,de el berberecho y Bitter Kas,"Bitter Kas "" (","Bitter Kas "" ( durante","Bitter Kas "" ( durante 3"
https://valenciaplaza.com/el-gusto-fue-mio,valenciaplaza.com,2019-09-20,===NONE===,bitter_kas/NCMS000_AQ0FP0/bitter_kas,"Recuerdo  que  cuando  tenía  12  años  ,  me  pedí  un bitter_kas  porque  la  tía  de  una  amiga  ,  que  tenía  una  melena  rubia  ,  adulta  y  larguísima  ,  bebía  bitter  kas  .",bitter_kas,ncms000_aq0fp0,bitter_kas,un,uno,DI0MS0,pedí,pedir,VMIS1S0,me,me,PP1CS000,",",",",Fc,años,año,NCMP000,porque,porque,CS,la,el,DA0FS0,tía,tío,NCFS000,de,de,SPS00,una,uno,DI0FS0,2019-09-20,2019,2010,VMIS1S0 DI0MS0 Bitter Kas CS DA0FS0,DI0MS0 Bitter Kas CS,VMIS1S0 DI0MS0 Bitter Kas,PP1CS000 VMIS1S0 DI0MS0 Bitter Kas,Fc PP1CS000 VMIS1S0 DI0MS0 Bitter Kas,Bitter Kas CS DA0FS0,Bitter Kas CS DA0FS0 NCFS000,Bitter Kas CS DA0FS0 NCFS000 SPS00,pedir uno Bitter Kas porque el,uno Bitter Kas porque,pedir uno Bitter Kas,me pedir uno Bitter Kas,", me pedir uno Bitter Kas",Bitter Kas porque el,Bitter Kas porque el tío,Bitter Kas porque el tío de
https://valenciaplaza.com/el-gusto-fue-mio,valenciaplaza.com,2019-09-20,===NONE===,bitter_kas/VMN0000_NCFP000/bitter_kas,"Recuerdo  que  cuando  tenía  12  años  ,  me  pedí  un  bitter  kas  porque  la  tía  de  una  amiga  ,  que  tenía  una  melena  rubia  ,  adulta  y  larguísima  ,  bebía bitter_kas  .",bitter_kas,vmn0000_ncfp000,bitter_kas,bebía,beber,VMII3S0,",",",",Fc,larguísima,largo,AQSFS0,y,y,CC,adulta,adulto,AQ0FS0,.,.,Fp,,,,,,,,,,,,,2019-09-20,2019,2010,,VMII3S0 Bitter Kas Fp,Fc VMII3S0 Bitter Kas,AQSFS0 Fc VMII3S0 Bitter Kas,CC AQSFS0 Fc VMII3S0 Bitter Kas,,,,,beber Bitter Kas .,", beber Bitter Kas","largo , beber Bitter Kas","y largo , beber Bitter Kas",,,
https://www.elnacional.cat/enblau/es/television/joan-pera-roger-pera-droga-adiccion_426572_102.html,elnacional.cat,2019-10-04,===NONE===,Bitter_Kas/NP00000_NP00000/bitter_kas,Roger  Pera  toma  un Bitter_Kas  sin  alcohol  .,bitter_kas,np00000_np00000,bitter_kas,un,uno,DI0MS0,toma,tomar,VMIP3S0,Pera,pera,NP00000,Roger,roger,NP00000,,,,sin,sin,SPS00,alcohol,alcohol,NCMS000,.,.,Fp,,,,,,,2019-10-04,2019,2010,VMIP3S0 DI0MS0 Bitter Kas SPS00 NCMS000,DI0MS0 Bitter Kas SPS00,VMIP3S0 DI0MS0 Bitter Kas,NP00000 VMIP3S0 DI0MS0 Bitter Kas,NP00000 NP00000 VMIP3S0 DI0MS0 Bitter Kas,Bitter Kas SPS00 NCMS000,Bitter Kas SPS00 NCMS000 Fp,,tomar uno Bitter Kas sin alcohol,uno Bitter Kas sin,tomar uno Bitter Kas,pera tomar uno Bitter Kas,roger pera tomar uno Bitter Kas,Bitter Kas sin alcohol,Bitter Kas sin alcohol .,
https://www.periodistadigital.com/periodismo/20191127/jorge-javier-vazquez-madre-dice-beba-rian-noticia-689404196327/,periodistadigital.com,2019-11-27,Spain,Bitter_Kas/NP00000_NP00000/bitter_kas,Mi  padre  era  de Bitter_Kas  sin  alcohol  -  no  sé  si  lo  habría  con  -  .,bitter_kas,np00000_np00000,bitter_kas,de,de,SPS00,era,ser,VSII1S0,padre,padre,NCMS000,Mi,mi,DP1CSS,,,,sin,sin,SPS00,alcohol,alcohol,NCMS000,-,-,Fg,no,no,RN,sé,saber,VMIP1S0,2019-11-27,2019,2010,VSII1S0 SPS00 Bitter Kas SPS00 NCMS000,SPS00 Bitter Kas SPS00,VSII1S0 SPS00 Bitter Kas,NCMS000 VSII1S0 SPS00 Bitter Kas,DP1CSS NCMS000 VSII1S0 SPS00 Bitter Kas,Bitter Kas SPS00 NCMS000,Bitter Kas SPS00 NCMS000 Fg,Bitter Kas SPS00 NCMS000 Fg RN,ser de Bitter Kas sin alcohol,de Bitter Kas sin,ser de Bitter Kas,padre ser de Bitter Kas,mi padre ser de Bitter Kas,Bitter Kas sin alcohol,Bitter Kas sin alcohol -,Bitter Kas sin alcohol - no
https://www.diariogol.com/gossip/fotos-terribles-borracho-perdido-kiko-hernandez-y-gema-lopez-callan-y-es-de-salvame_20013761_102.html,diariogol.com,2019-11-27,===NONE===,Bitter_Kas/NP00000_NP00000/bitter_kas,"El  presentador  confiesa  que  en  su  familia  nunca  se  había  bebido  ,  incluso  su  padre  pedía Bitter_Kas  sin  alcohol  .",bitter_kas,np00000_np00000,bitter_kas,pedía,pedir,VMII3S0,padre,padre,NCMS000,su,su,DP3CS0,incluso,incluso,RG,",",",",Fc,sin,sin,SPS00,alcohol,alcohol,NCMS000,.,.,Fp,,,,,,,2019-11-27,2019,2010,NCMS000 VMII3S0 Bitter Kas SPS00 NCMS000,VMII3S0 Bitter Kas SPS00,NCMS000 VMII3S0 Bitter Kas,DP3CS0 NCMS000 VMII3S0 Bitter Kas,RG DP3CS0 NCMS000 VMII3S0 Bitter Kas,Bitter Kas SPS00 NCMS000,Bitter Kas SPS00 NCMS000 Fp,,padre pedir Bitter Kas sin alcohol,pedir Bitter Kas sin,padre pedir Bitter Kas,su padre pedir Bitter Kas,incluso su padre pedir Bitter Kas,Bitter Kas sin alcohol,Bitter Kas sin alcohol .,
https://carnaval.lavozdigital.es/noticia/recuerdos-de-manolo-desde-la-orillita-de-la-caleta/,lavozdigital.es,2020-02-25,Spain,Bitter_Kas/NP00000_NP00000/bitter_kas,Era  la  hermandad  de  las  Columnas  de  allí  y  nosotros  que  estábamos  gloriosos  después  de  tomarnos  algún  que  otro Bitter_Kas  nos  metimos  en  la  procesión  ;  '  chico  '  y  yo  detrás  del  paso  haciendo  la  penitencia  vestido  de  capuchinos  (  estábamos  pletóricos  de  Bitter  Kas  porque  la  actuación  había  salido  muy  bien  )  .,bitter_kas,np00000_np00000,bitter_kas,otro,otro,DI0MS0,que,que,CS,algún,alguno,DI0MS0,tomarnos,tomar+nos,VMN0000+PP1CP000,de,de,SPS00,nos,nos,PP1CP000,metimos,meter,VMIS1P0,en,en,SPS00,la,el,DA0FS0,procesión,procesión,NCFS000,2020-02-25,2020,2020,CS DI0MS0 Bitter Kas PP1CP000 VMIS1P0,DI0MS0 Bitter Kas PP1CP000,CS DI0MS0 Bitter Kas,DI0MS0 CS DI0MS0 Bitter Kas,VMN0000+PP1CP000 DI0MS0 CS DI0MS0 Bitter Kas,Bitter Kas PP1CP000 VMIS1P0,Bitter Kas PP1CP000 VMIS1P0 SPS00,Bitter Kas PP1CP000 VMIS1P0 SPS00 DA0FS0,que otro Bitter Kas nos meter,otro Bitter Kas nos,que otro Bitter Kas,alguno que otro Bitter Kas,tomar+nos alguno que otro Bitter Kas,Bitter Kas nos meter,Bitter Kas nos meter en,Bitter Kas nos meter en el
https://carnaval.lavozdigital.es/noticia/recuerdos-de-manolo-desde-la-orillita-de-la-caleta/,lavozdigital.es,2020-02-25,Spain,Bitter_Kas/NP00000_NP00000/bitter_kas,Era  la  hermandad  de  las  Columnas  de  allí  y  nosotros  que  estábamos  gloriosos  después  de  tomarnos  algún  que  otro  Bitter  Kas  nos  metimos  en  la  procesión  ;  '  chico  '  y  yo  detrás  del  paso  haciendo  la  penitencia  vestido  de  capuchinos  (  estábamos  pletóricos  de Bitter_Kas  porque  la  actuación  había  salido  muy  bien  )  .,bitter_kas,np00000_np00000,bitter_kas,de,de,SPS00,pletóricos,pletórico,AQ0MP0,estábamos,estar,VAII1P0,(,(,Fpa,capuchinos,capuchino,NCMP000,porque,porque,CS,la,el,DA0FS0,actuación,actuación,NCFS000,había,haber,VAII1S0,salido,salir,VMP00SM,2020-02-25,2020,2020,AQ0MP0 SPS00 Bitter Kas CS DA0FS0,SPS00 Bitter Kas CS,AQ0MP0 SPS00 Bitter Kas,VAII1P0 AQ0MP0 SPS00 Bitter Kas,Fpa VAII1P0 AQ0MP0 SPS00 Bitter Kas,Bitter Kas CS DA0FS0,Bitter Kas CS DA0FS0 NCFS000,Bitter Kas CS DA0FS0 NCFS000 VAII1S0,pletórico de Bitter Kas porque el,de Bitter Kas porque,pletórico de Bitter Kas,estar pletórico de Bitter Kas,( estar pletórico de Bitter Kas,Bitter Kas porque el,Bitter Kas porque el actuación,Bitter Kas porque el actuación haber
