url,website,date,country,keyword,sentence,kw,kw_lemma,kw_pos,left_w1,left_l1,left_p1,left_w2,left_l2,left_p2,left_w3,left_l3,left_p3,left_w4,left_l4,left_p4,left_w5,left_l5,left_p5,right_w1,right_l1,right_p1,right_w2,right_l2,right_p2,right_w3,right_l3,right_p3,right_w4,right_l4,right_p4,right_w5,right_l5,right_p5,datetime,year,10years,pattern_around5,pattern_around3,pattern_left2,pattern_left3,pattern_left4,pattern_right2,pattern_right3,pattern_right4,pattern_around5_lex,pattern_around3_lex,pattern_left2_lex,pattern_left3_lex,pattern_left4_lex,pattern_right2_lex,pattern_right3_lex,pattern_right4_lex
http://www.nopuedocreer.com/quelohayaninventado/25682/cubitos-de-hielo-binarios-solo-he-tomado-dos-copas-y-parece-que-lleve-10/?utm_source=feedburner&utm_medium=feed&utm_campaign=Feed%253A%2BNoPuedoCreerQueLoHayanInventado%2B%2528No%2Bpuedo%2Bcreer%2Bque%2Blo%2Bhayan%2Binventado...%2529,nopuedocreer.com,2014-06-05,===NONE===,bitter_Kas/NCMS000_NP00000/bitter_kas,"No  sólo  te  hacen  parecer  un  maestro  del  código  entre  tus  amigos  ,  sino  que  vas  a  poder  hacer  bromas  tan  manidas  pero  aún  así  efectivas  como  ""  voy  a  tomarme  un bitter_Kas  ""  ,  ""  pon  10  cubitos  en  mi  vaso  ""  para  amenizar  tus  reuniones  de  informáticos  ¡  y  sin  tener  que  recurrir  a  la  de  la  bolsa  de  boca  bits  !  (  eso  sí  ,  no  esperes  que  te  ayuden  a  ligar  ,  el  lenguaje  correcto  para  ese  fin  sería  el  ensamblador  )  .",bitter_kas,ncms000_np00000,bitter_kas,un,uno,DI0MS0,tomarme,tomar+me,VMN0000+PP1CS000,a,a,SPS00,voy,ir,VMIP1S0,"""","""",Fe,"""","""",Fe,",",",",Fc,"""","""",Fe,pon,poner,VMM02S0,10,10,Z,2014-06-05,2014,2010,VMN0000+PP1CS000 DI0MS0 Bitter Kas Fe Fc,DI0MS0 Bitter Kas Fe,VMN0000+PP1CS000 DI0MS0 Bitter Kas,SPS00 VMN0000+PP1CS000 DI0MS0 Bitter Kas,VMIP1S0 SPS00 VMN0000+PP1CS000 DI0MS0 Bitter Kas,Bitter Kas Fe Fc,Bitter Kas Fe Fc Fe,Bitter Kas Fe Fc Fe VMM02S0,"tomar+me uno Bitter Kas "" ,","uno Bitter Kas """,tomar+me uno Bitter Kas,a tomar+me uno Bitter Kas,ir a tomar+me uno Bitter Kas,"Bitter Kas "" ,","Bitter Kas "" , ""","Bitter Kas "" , "" poner"
http://www.levante-emv.com/carreras-populares/2015/10/18/medio-maraton-creo-elche/1329086.html?utm_medium=rss,levante-emv.com,2015-10-18,Spain,Adidas-Bitter_Kas/NP00000_NP00000/adidas-bitter_kas,"Ese  día  ,  la  Alameda  acogió  la  salida  y  llegada  de  una  prueba  nueva  :  el  ""  20  Kilómetros Adidas-Bitter_Kas  ""  ,  una  carrera  que  formaba  parte  de  un  circuito  nacional  de  nuevo  cuño  .",adidas-bitter_kas,np00000_np00000,adidas-bitter_kas,Kilómetros,kilómetros,NP00000,20,20,Z,"""","""",Fe,el,el,DA0MS0,:,:,Fd,"""","""",Fe,",",",",Fc,una,uno,DI0FS0,carrera,carrera,NCFS000,que,que,PR0CN000,2015-10-18,2015,2010,Z NP00000 Bitter Kas Fe Fc,NP00000 Bitter Kas Fe,Z NP00000 Bitter Kas,Fe Z NP00000 Bitter Kas,DA0MS0 Fe Z NP00000 Bitter Kas,Bitter Kas Fe Fc,Bitter Kas Fe Fc DI0FS0,Bitter Kas Fe Fc DI0FS0 NCFS000,"20 kilómetros Bitter Kas "" ,","kilómetros Bitter Kas """,20 kilómetros Bitter Kas,""" 20 kilómetros Bitter Kas","el "" 20 kilómetros Bitter Kas","Bitter Kas "" ,","Bitter Kas "" , uno","Bitter Kas "" , uno carrera"
http://www.elmundo.es/papel/historias/2015/10/19/5620cb8722601d9a788b4633.html,elmundo.es,2015-10-19,Spain,Bitter_Kas/NP00000_NP00000/bitter_kas,"Hoy  ,  tienen  las  caderas  deshechas  ,  se  sujetan  la  columna  cuando  se  les  pregunta  por  los  dolores  y  piden Bitter_Kas  .",bitter_kas,np00000_np00000,bitter_kas,piden,pedir,VMIP3P0,y,y,CC,dolores,dolor,NCMP000,los,el,DA0MP0,por,por,SPS00,.,.,Fp,,,,,,,,,,,,,2015-10-19,2015,2010,,VMIP3P0 Bitter Kas Fp,CC VMIP3P0 Bitter Kas,NCMP000 CC VMIP3P0 Bitter Kas,DA0MP0 NCMP000 CC VMIP3P0 Bitter Kas,,,,,pedir Bitter Kas .,y pedir Bitter Kas,dolor y pedir Bitter Kas,el dolor y pedir Bitter Kas,,,
http://www.laopiniondemalaga.es/malaga/2015/12/20/jovenes-bebian-orange/816764.html?utm_source=rss,laopiniondemalaga.es,2015-12-20,Spain,bitter_Kas/NCMS000_NP00000/bitter_kas,"se  emanciparan  ,  en  los  guateques  que  se  organizaban  en  las  viviendas  de  sus  madres  para  ser  vigiladas  ,  y  en  las  verbenas  de  verano  que  se  montaban  en  los  Baños  del  Carmen  y  en  el  Real  de  la  Feria  ,  tomaban  como  bebida  Orange  Crusch  ,  una  naranjada  que  dominaba  el  mercado  de  las  bebidas  no  alcohólicas  ,  marca  que  lentamente  fue  desapareciendo  al  irrumpir  otra  bebida  similar  denominada  Citrania  y  posteriormente  ,  y  de  forma  arrolladora  ,  la  Coca-Cola  ,  la  Pepsi  ,  la  Fanta  de  naranja  y  limón  ,  la  Mirinda  ,  el  Agua  Tónica  ,  el bitter_Kas  y  otras  bebidas  no  alcohólicas  .",bitter_kas,ncms000_np00000,bitter_kas,el,el,DA0MS0,",",",",Fc,Tónica,tónica,NP00000,Agua,agua,NP00000,el,el,DA0MS0,y,y,CC,otras,otro,DI0FP0,bebidas,bebida,NCFP000,no,no,RN,alcohólicas,alcohólico,AQ0FP0,2015-12-20,2015,2010,Fc DA0MS0 Bitter Kas CC DI0FP0,DA0MS0 Bitter Kas CC,Fc DA0MS0 Bitter Kas,NP00000 Fc DA0MS0 Bitter Kas,NP00000 NP00000 Fc DA0MS0 Bitter Kas,Bitter Kas CC DI0FP0,Bitter Kas CC DI0FP0 NCFP000,Bitter Kas CC DI0FP0 NCFP000 RN,", el Bitter Kas y otro",el Bitter Kas y,", el Bitter Kas","tónica , el Bitter Kas","agua tónica , el Bitter Kas",Bitter Kas y otro,Bitter Kas y otro bebida,Bitter Kas y otro bebida no
http://abcblogs.abc.es/loading/2016/01/31/entreactos/,abc.es,2016-01-31,Spain,Bitter_Kas/NP00000_NP00000/bitter_kas,"Con  el  sabor  amargo  de  un Bitter_Kas  ,  antes  de  las  tres  de  la  tarde  ,  uno  de  los  miembros  del  Comité  Federal  ,  que  conoce  los  entresijos  orgánicos  ,  me  resume  el  partido  .  ""  Los  dos  han  cedido  .",bitter_kas,np00000_np00000,bitter_kas,un,uno,DI0MS0,de,de,SPS00,amargo,amargo,AQ0MS0,sabor,sabor,NCMS000,el,el,DA0MS0,",",",",Fc,antes,antes,RG,de,de,SPS00,las,el,DA0FP0,tres,3,Z,2016-01-31,2016,2010,SPS00 DI0MS0 Bitter Kas Fc RG,DI0MS0 Bitter Kas Fc,SPS00 DI0MS0 Bitter Kas,AQ0MS0 SPS00 DI0MS0 Bitter Kas,NCMS000 AQ0MS0 SPS00 DI0MS0 Bitter Kas,Bitter Kas Fc RG,Bitter Kas Fc RG SPS00,Bitter Kas Fc RG SPS00 DA0FP0,"de uno Bitter Kas , antes","uno Bitter Kas ,",de uno Bitter Kas,amargo de uno Bitter Kas,sabor amargo de uno Bitter Kas,"Bitter Kas , antes","Bitter Kas , antes de","Bitter Kas , antes de el"
http://jenesaispop.com/2016/05/10/260146/mixtape-piyama-te-ama-por-toda-la-galaxia/,jenesaispop.com,2016-05-10,===NONE===,bitter_kas/NCMS000_AQ0FP0/bitter_kas,"La  banda  la  describe  como  una  ""  batidora  de  influencias  ,  caspa  y bitter_kas  ""  .  ""  PIYAMA  te  ama  por  toda  la  galaxia  ""  ,  explica  .  ""  Si  no  ¿  cómo  iban  a  entrar  en  un  sola  sesión  Lucio  Batistti  y  La  Mafia  del  Amor  ?",bitter_kas,ncms000_aq0fp0,bitter_kas,y,y,CC,caspa,caspa,NCFS000,",",",",Fc,influencias,influencia,NCFP000,de,de,SPS00,"""","""",Fe,.,.,Fp,"""","""",Fe,PIYAMA,piyama,NP00000,te,te,PP2CS000,2016-05-10,2016,2010,NCFS000 CC Bitter Kas Fe Fp,CC Bitter Kas Fe,NCFS000 CC Bitter Kas,Fc NCFS000 CC Bitter Kas,NCFP000 Fc NCFS000 CC Bitter Kas,Bitter Kas Fe Fp,Bitter Kas Fe Fp Fe,Bitter Kas Fe Fp Fe NP00000,"caspa y Bitter Kas "" .","y Bitter Kas """,caspa y Bitter Kas,", caspa y Bitter Kas","influencia , caspa y Bitter Kas","Bitter Kas "" .","Bitter Kas "" . ""","Bitter Kas "" . "" piyama"
http://www.lne.es/gijon/2016/05/25/aprender-arte-magia/1932024.html?utm_medium=rss,lne.es,2016-05-25,Spain,bitter_kas/NCMS000_AQ0FP0/bitter_kas,"Éste  ,  que  se  negó  ,  le  sirvió  un  "" bitter_kas  ""  .",bitter_kas,ncms000_aq0fp0,bitter_kas,"""","""",Fe,un,uno,DI0MS0,sirvió,servir,VMIS3S0,le,le,PP3CSD00,",",",",Fc,"""","""",Fe,.,.,Fp,,,,,,,,,,2016-05-25,2016,2010,DI0MS0 Fe Bitter Kas Fe Fp,Fe Bitter Kas Fe,DI0MS0 Fe Bitter Kas,VMIS3S0 DI0MS0 Fe Bitter Kas,PP3CSD00 VMIS3S0 DI0MS0 Fe Bitter Kas,Bitter Kas Fe Fp,,,"uno "" Bitter Kas "" .",""" Bitter Kas ""","uno "" Bitter Kas","servir uno "" Bitter Kas","le servir uno "" Bitter Kas","Bitter Kas "" .",,
http://cincodias.com/cincodias/2013/09/05/sentidos/1378401626_168008.html#%3Fref%3Drss%26format%3Dsimple%26link%3Dlink,cincodias.com,2016-06-25,===NONE===,Bitter_Kas/NP00000_NP00000/bitter_kas,<doc uri=http://cincodias.com/cincodias/2013/09/05/sentidos/1378401626_168008.html#%3Fref%3Drss%26format%3Dsimple%26link%3Dlink website=cincodias.com date=2016-06-25 source_country=> Bitter_Kas  :  medio  siglo  de  burbujas  rosadas  con  toque  amargo,bitter_kas,np00000_np00000,bitter_kas,,,,,,,,,,,,,,,,:,:,Fd,medio,medio,AQ0MS0,siglo,siglo,NCMS000,de,de,SPS00,burbujas,burbuja,NCFP000,2016-06-25,2016,2010,,,,,,Bitter Kas Fd AQ0MS0,Bitter Kas Fd AQ0MS0 NCMS000,Bitter Kas Fd AQ0MS0 NCMS000 SPS00,,,,,,Bitter Kas : medio,Bitter Kas : medio siglo,Bitter Kas : medio siglo de
http://cincodias.com/cincodias/2013/09/05/sentidos/1378401626_168008.html#%3Fref%3Drss%26format%3Dsimple%26link%3Dlink,cincodias.com,2016-06-25,===NONE===,Bitter_Kas/NP00000_NP00000/bitter_kas,"El  marrón  de  la  Coca-Cola  o  el  naranja  de  la  Fanta  son  inequívocos  ,  casi  universales  ,  pero  el  rosa  ha  dado  a Bitter_Kas  un  toque  de  diferenciación  que  identifica  a  la  bebida  de  forma  inseparable  con  su  coloración  .",bitter_kas,np00000_np00000,bitter_kas,a,a,SPS00,dado,dar,VMP00SM,ha,haber,VAIP3S0,rosa,rosa,NCFS000,el,el,DA0MS0,un,uno,DI0MS0,toque,toque,NCMS000,de,de,SPS00,diferenciación,diferenciación,NCFS000,que,que,PR0CN000,2016-06-25,2016,2010,VMP00SM SPS00 Bitter Kas DI0MS0 NCMS000,SPS00 Bitter Kas DI0MS0,VMP00SM SPS00 Bitter Kas,VAIP3S0 VMP00SM SPS00 Bitter Kas,NCFS000 VAIP3S0 VMP00SM SPS00 Bitter Kas,Bitter Kas DI0MS0 NCMS000,Bitter Kas DI0MS0 NCMS000 SPS00,Bitter Kas DI0MS0 NCMS000 SPS00 NCFS000,dar a Bitter Kas uno toque,a Bitter Kas uno,dar a Bitter Kas,haber dar a Bitter Kas,rosa haber dar a Bitter Kas,Bitter Kas uno toque,Bitter Kas uno toque de,Bitter Kas uno toque de diferenciación
http://cincodias.com/cincodias/2013/09/05/sentidos/1378401626_168008.html#%3Fref%3Drss%26format%3Dsimple%26link%3Dlink,cincodias.com,2016-06-25,===NONE===,Bitter_Kas/NP00000_NP00000/bitter_kas,"El Bitter_Kas  ,  sin  alcohol  ,  era  aquella  bebida  de  mayores  que  podían  beber  los  niños  ,  de  color  rosa  y  con  un  punto  amargo  que  en  poco  se  parecía  al  sabor  dulzón  de  la  mayoría  de  los  refrescos  .",bitter_kas,np00000_np00000,bitter_kas,El,el,DA0MS0,,,,,,,,,,,,,",",",",Fc,sin,sin,SPS00,alcohol,alcohol,NCMS000,",",",",Fc,era,ser,VSII1S0,2016-06-25,2016,2010,,DA0MS0 Bitter Kas Fc,,,,Bitter Kas Fc SPS00,Bitter Kas Fc SPS00 NCMS000,Bitter Kas Fc SPS00 NCMS000 Fc,,"el Bitter Kas ,",,,,"Bitter Kas , sin","Bitter Kas , sin alcohol","Bitter Kas , sin alcohol ,"
http://cincodias.com/cincodias/2013/09/05/sentidos/1378401626_168008.html#%3Fref%3Drss%26format%3Dsimple%26link%3Dlink,cincodias.com,2016-06-25,===NONE===,bitter_kas/NCMS000_AQ0FP0/bitter_kas,"Esta  bebida  ha  superado  ya  sobradamente  la  mayoría  de  edad  y  quienes  la  bebían  en  los  años  70  y  80  ,  el  momento  en  que  tuvo  mayor  popularidad  ,  aún  lo  pueden  seguir  haciendo  ,  aunque  resulte  extraño  y  casi  exótico  pedir  un bitter_kas  en  un  bar  .",bitter_kas,ncms000_aq0fp0,bitter_kas,un,uno,DI0MS0,pedir,pedir,VMN0000,exótico,exótico,AQ0MS0,casi,casi,RG,y,y,CC,en,en,SPS00,un,uno,DI0MS0,bar,bar,NCMS000,.,.,Fp,,,,2016-06-25,2016,2010,VMN0000 DI0MS0 Bitter Kas SPS00 DI0MS0,DI0MS0 Bitter Kas SPS00,VMN0000 DI0MS0 Bitter Kas,AQ0MS0 VMN0000 DI0MS0 Bitter Kas,RG AQ0MS0 VMN0000 DI0MS0 Bitter Kas,Bitter Kas SPS00 DI0MS0,Bitter Kas SPS00 DI0MS0 NCMS000,Bitter Kas SPS00 DI0MS0 NCMS000 Fp,pedir uno Bitter Kas en uno,uno Bitter Kas en,pedir uno Bitter Kas,exótico pedir uno Bitter Kas,casi exótico pedir uno Bitter Kas,Bitter Kas en uno,Bitter Kas en uno bar,Bitter Kas en uno bar .
http://cincodias.com/cincodias/2013/09/05/sentidos/1378401626_168008.html#%3Fref%3Drss%26format%3Dsimple%26link%3Dlink,cincodias.com,2016-06-25,===NONE===,Bitter_Kas/NP00000_NP00000/bitter_kas,"El Bitter_Kas  tiene  ya  47  años  de  edad  ,  desde  su  lanzamiento  en  1966  por  la  casa  de  bebidas  Kas  .",bitter_kas,np00000_np00000,bitter_kas,El,el,DA0MS0,,,,,,,,,,,,,tiene,tener,VMIP3S0,ya,ya,RG,47,47,Z,años,año,NCMP000,de,de,SPS00,2016-06-25,2016,2010,,DA0MS0 Bitter Kas VMIP3S0,,,,Bitter Kas VMIP3S0 RG,Bitter Kas VMIP3S0 RG Z,Bitter Kas VMIP3S0 RG Z NCMP000,,el Bitter Kas tener,,,,Bitter Kas tener ya,Bitter Kas tener ya 47,Bitter Kas tener ya 47 año
http://cincodias.com/cincodias/2013/09/05/sentidos/1378401626_168008.html#%3Fref%3Drss%26format%3Dsimple%26link%3Dlink,cincodias.com,2016-06-25,===NONE===,Bitter_Kas/NP00000_NP00000/bitter_kas,"Según  explican  en  la  compañía  ,  el Bitter_Kas  se  elabora  a  partir  de  una  veintena  de  hierbas  y  plantas  aromáticas  .",bitter_kas,np00000_np00000,bitter_kas,el,el,DA0MS0,",",",",Fc,compañía,compañía,NCFS000,la,el,DA0FS0,en,en,SPS00,se,se,P00CN000,elabora,elaborar,VMIP3S0,a,a,SPS00,partir,partir,VMN0000,de,de,SPS00,2016-06-25,2016,2010,Fc DA0MS0 Bitter Kas P00CN000 VMIP3S0,DA0MS0 Bitter Kas P00CN000,Fc DA0MS0 Bitter Kas,NCFS000 Fc DA0MS0 Bitter Kas,DA0FS0 NCFS000 Fc DA0MS0 Bitter Kas,Bitter Kas P00CN000 VMIP3S0,Bitter Kas P00CN000 VMIP3S0 SPS00,Bitter Kas P00CN000 VMIP3S0 SPS00 VMN0000,", el Bitter Kas se elaborar",el Bitter Kas se,", el Bitter Kas","compañía , el Bitter Kas","el compañía , el Bitter Kas",Bitter Kas se elaborar,Bitter Kas se elaborar a,Bitter Kas se elaborar a partir
http://cincodias.com/cincodias/2013/09/05/sentidos/1378401626_168008.html#%3Fref%3Drss%26format%3Dsimple%26link%3Dlink,cincodias.com,2016-06-25,===NONE===,bitter_kas/NCMS000_AQ0FP0/bitter_kas,"Es  el  ingrediente  más  desconocido  del bitter_kas  ,  dentro  de  lo  poco  que  se  conoce  de  su  fórmula  .",bitter_kas,ncms000_aq0fp0,bitter_kas,del,de+el,SPS00+DA0MS0,desconocido,desconocer,VMP00SM,más,más,RG,ingrediente,ingrediente,NCMS000,el,el,DA0MS0,",",",",Fc,dentro,dentro,RG,de,de,SPS00,lo,el,DA0NS0,poco,poco,PI0MS000,2016-06-25,2016,2010,VMP00SM SPS00+DA0MS0 Bitter Kas Fc RG,SPS00+DA0MS0 Bitter Kas Fc,VMP00SM SPS00+DA0MS0 Bitter Kas,RG VMP00SM SPS00+DA0MS0 Bitter Kas,NCMS000 RG VMP00SM SPS00+DA0MS0 Bitter Kas,Bitter Kas Fc RG,Bitter Kas Fc RG SPS00,Bitter Kas Fc RG SPS00 DA0NS0,"desconocer de+el Bitter Kas , dentro","de+el Bitter Kas ,",desconocer de+el Bitter Kas,más desconocer de+el Bitter Kas,ingrediente más desconocer de+el Bitter Kas,"Bitter Kas , dentro","Bitter Kas , dentro de","Bitter Kas , dentro de el"
http://cincodias.com/cincodias/2013/09/05/sentidos/1378401626_168008.html#%3Fref%3Drss%26format%3Dsimple%26link%3Dlink,cincodias.com,2016-06-25,===NONE===,bitter_kas/VMN0000_NCFP000/bitter_kas,Y  quizá  sea  el  uso  de  la  genciana  y  su  capacidad  para  estimular  el  apetito  lo  que  ha  convertido  al bitter_kas  en  una  bebida  habitual  para  el  aperitivo  .,bitter_kas,vmn0000_ncfp000,bitter_kas,al,a+el,SPS00+DA0MS0,convertido,convertir,VMP00SM,ha,haber,VAIP3S0,que,que,PR0CN000,lo,el,DA0NS0,en,en,SPS00,una,uno,DI0FS0,bebida,bebida,NCFS000,habitual,habitual,AQ0CS0,para,para,SPS00,2016-06-25,2016,2010,VMP00SM SPS00+DA0MS0 Bitter Kas SPS00 DI0FS0,SPS00+DA0MS0 Bitter Kas SPS00,VMP00SM SPS00+DA0MS0 Bitter Kas,VAIP3S0 VMP00SM SPS00+DA0MS0 Bitter Kas,PR0CN000 VAIP3S0 VMP00SM SPS00+DA0MS0 Bitter Kas,Bitter Kas SPS00 DI0FS0,Bitter Kas SPS00 DI0FS0 NCFS000,Bitter Kas SPS00 DI0FS0 NCFS000 AQ0CS0,convertir a+el Bitter Kas en uno,a+el Bitter Kas en,convertir a+el Bitter Kas,haber convertir a+el Bitter Kas,que haber convertir a+el Bitter Kas,Bitter Kas en uno,Bitter Kas en uno bebida,Bitter Kas en uno bebida habitual
http://cincodias.com/cincodias/2013/09/05/sentidos/1378401626_168008.html#%3Fref%3Drss%26format%3Dsimple%26link%3Dlink,cincodias.com,2016-06-25,===NONE===,bitter_kas/NCMS000_AQ0FP0/bitter_kas,"Una  afirmación  que  alude  al  público  de  más  edad  una  vez  pasada  la  época  inicial  ,  hace  ya  algunas  décadas  ,  en  la  que  el bitter_kas  era  apetitivo  muy  común  en  bares  y  entre  clientela  de  menor  edad  .",bitter_kas,ncms000_aq0fp0,bitter_kas,el,el,DA0MS0,que,que,PR0CN000,la,el,DA0FS0,en,en,SPS00,",",",",Fc,era,ser,VSII1S0,apetitivo,apetitivo,AQ0MS0,muy,muy,RG,común,común,AQ0CS0,en,en,SPS00,2016-06-25,2016,2010,PR0CN000 DA0MS0 Bitter Kas VSII1S0 AQ0MS0,DA0MS0 Bitter Kas VSII1S0,PR0CN000 DA0MS0 Bitter Kas,DA0FS0 PR0CN000 DA0MS0 Bitter Kas,SPS00 DA0FS0 PR0CN000 DA0MS0 Bitter Kas,Bitter Kas VSII1S0 AQ0MS0,Bitter Kas VSII1S0 AQ0MS0 RG,Bitter Kas VSII1S0 AQ0MS0 RG AQ0CS0,que el Bitter Kas ser apetitivo,el Bitter Kas ser,que el Bitter Kas,el que el Bitter Kas,en el que el Bitter Kas,Bitter Kas ser apetitivo,Bitter Kas ser apetitivo muy,Bitter Kas ser apetitivo muy común
http://cincodias.com/cincodias/2013/09/05/sentidos/1378401626_168008.html#%3Fref%3Drss%26format%3Dsimple%26link%3Dlink,cincodias.com,2016-06-25,===NONE===,Bitter_Kas/NP00000_NP00000/bitter_kas,"Y  a  diferencia  de  la  tónica  o  incluso  la  Coca-Cola  ,  el Bitter_Kas  no  se  ha  hecho  hueco  como  bebida  habitual  para  cócteles  con  alcohol  .",bitter_kas,np00000_np00000,bitter_kas,el,el,DA0MS0,",",",",Fc,Coca-Cola,coca-cola,NP00000,la,el,DA0FS0,incluso,incluso,RG,no,no,RN,se,se,P00CN000,ha,haber,VAIP3S0,hecho,hacer,VMP00SM,hueco,hueco,NCMS000,2016-06-25,2016,2010,Fc DA0MS0 Bitter Kas RN P00CN000,DA0MS0 Bitter Kas RN,Fc DA0MS0 Bitter Kas,NP00000 Fc DA0MS0 Bitter Kas,DA0FS0 NP00000 Fc DA0MS0 Bitter Kas,Bitter Kas RN P00CN000,Bitter Kas RN P00CN000 VAIP3S0,Bitter Kas RN P00CN000 VAIP3S0 VMP00SM,", el Bitter Kas no se",el Bitter Kas no,", el Bitter Kas","coca-cola , el Bitter Kas","el coca-cola , el Bitter Kas",Bitter Kas no se,Bitter Kas no se haber,Bitter Kas no se haber hacer
http://cincodias.com/cincodias/2013/09/05/sentidos/1378401626_168008.html#%3Fref%3Drss%26format%3Dsimple%26link%3Dlink,cincodias.com,2016-06-25,===NONE===,bitter_kas/NCMS000_AQ0FP0/bitter_kas,En  1993  entró  a  formar  parte  del  grupo  Pepsi  y  el bitter_kas  comparte  cartel  con  el  resto  de  bebidas  del  grupo  .,bitter_kas,ncms000_aq0fp0,bitter_kas,el,el,DA0MS0,y,y,CC,Pepsi,pepsi,NP00000,grupo,grupo,NCMS000,del,de+el,SPS00+DA0MS0,comparte,comparte,NCCS000,cartel,cartel,NCMS000,con,con,SPS00,el,el,DA0MS0,resto,resto,NCMS000,2016-06-25,2016,2010,CC DA0MS0 Bitter Kas NCCS000 NCMS000,DA0MS0 Bitter Kas NCCS000,CC DA0MS0 Bitter Kas,NP00000 CC DA0MS0 Bitter Kas,NCMS000 NP00000 CC DA0MS0 Bitter Kas,Bitter Kas NCCS000 NCMS000,Bitter Kas NCCS000 NCMS000 SPS00,Bitter Kas NCCS000 NCMS000 SPS00 DA0MS0,y el Bitter Kas comparte cartel,el Bitter Kas comparte,y el Bitter Kas,pepsi y el Bitter Kas,grupo pepsi y el Bitter Kas,Bitter Kas comparte cartel,Bitter Kas comparte cartel con,Bitter Kas comparte cartel con el
http://www.elblogsalmon.com/empresas/quien-esta-detras-de-las-grandes-marcas-de-consumo?utm_source=feedburner&utm_medium=feed&utm_campaign=Feed%253A%2Belblogsalmon2%2B%2528El%2BBlog%2BSalm%25C3%25B3n%2529,elblogsalmon.com,2016-08-24,===NONE===,Bitter_Kas/NP00000_NP00000/bitter_kas,"Pepsico  se  ha  consolidado  como  un  referente  para  los  consumidores  de  bebida  con  los  siguientes  marcas  tan  conocidas  :  Pepsi  ,  Kas  , Bitter_Kas  ,  Aquafina  ,  etc.",bitter_kas,np00000_np00000,bitter_kas,",",",",Fc,Kas,kas,NP00000,",",",",Fc,Pepsi,pepsi,NP00000,:,:,Fd,",",",",Fc,Aquafina,aquafina,NP00000,",",",",Fc,etc.,etcétera,Fs,,,,2016-08-24,2016,2010,NP00000 Fc Bitter Kas Fc NP00000,Fc Bitter Kas Fc,NP00000 Fc Bitter Kas,Fc NP00000 Fc Bitter Kas,NP00000 Fc NP00000 Fc Bitter Kas,Bitter Kas Fc NP00000,Bitter Kas Fc NP00000 Fc,Bitter Kas Fc NP00000 Fc Fs,"kas , Bitter Kas , aquafina",", Bitter Kas ,","kas , Bitter Kas",", kas , Bitter Kas","pepsi , kas , Bitter Kas","Bitter Kas , aquafina","Bitter Kas , aquafina ,","Bitter Kas , aquafina , etcétera"
http://www.lavanguardia.com/comer/materia-prima/20160923/41494857654/bitter-tendencia-2016.html,lavanguardia.com,2016-09-23,Spain,Bitter_Kas/NP00000_NP00000/bitter_kas,"Este  mes  el Bitter_Kas  ,  rey  analcohólico  (  durante  décadas  )  del  vermút  español  ,  cumple  60  años  de  vida  .",bitter_kas,np00000_np00000,bitter_kas,el,el,DA0MS0,mes,mes,NCMS000,Este,este,DD0MS0,,,,,,,",",",",Fc,rey,rey,NCMS000,analcohólico,analcohólico,AQ0MS0,(,(,Fpa,durante,durante,SPS00,2016-09-23,2016,2010,NCMS000 DA0MS0 Bitter Kas Fc NCMS000,DA0MS0 Bitter Kas Fc,NCMS000 DA0MS0 Bitter Kas,DD0MS0 NCMS000 DA0MS0 Bitter Kas,,Bitter Kas Fc NCMS000,Bitter Kas Fc NCMS000 AQ0MS0,Bitter Kas Fc NCMS000 AQ0MS0 Fpa,"mes el Bitter Kas , rey","el Bitter Kas ,",mes el Bitter Kas,este mes el Bitter Kas,,"Bitter Kas , rey","Bitter Kas , rey analcohólico","Bitter Kas , rey analcohólico ("
http://www.directoalpaladar.com/directo-al-paladar/cazuelita-de-esparragos-queso-emmental-y-jamon-la-ultima-locura-foodie-y-mas-en-la-semana-gourmet-de-trendencias?utm_source=feedburner&utm_medium=feed&utm_campaign=Feed%253A%2Bdirectoalpaladar%2B%2528Directo%2Bal%2Bpaladar%2529,directoalpaladar.com,2016-09-25,===NONE===,Bitter_Kas/NP00000_NP00000/bitter_kas,"Un  aperitivo  que  ha  formado  parte  de  nuestras  vidas  desde  nuestra  infancia  ha  decidido  renovar  su  presentación  ,  no  os  perdáis  la  celebración  del  50  cumpleaños  de Bitter_Kas  con  este  cambio  de  imagen  .",bitter_kas,np00000_np00000,bitter_kas,de,de,SPS00,cumpleaños,cumpleaños,NCMN000,50,50,Z,del,de+el,SPS00+DA0MS0,celebración,celebración,NCFS000,con,con,SPS00,este,este,DD0MS0,cambio,cambio,NCMS000,de,de,SPS00,imagen,imagen,NCFS000,2016-09-25,2016,2010,NCMN000 SPS00 Bitter Kas SPS00 DD0MS0,SPS00 Bitter Kas SPS00,NCMN000 SPS00 Bitter Kas,Z NCMN000 SPS00 Bitter Kas,SPS00+DA0MS0 Z NCMN000 SPS00 Bitter Kas,Bitter Kas SPS00 DD0MS0,Bitter Kas SPS00 DD0MS0 NCMS000,Bitter Kas SPS00 DD0MS0 NCMS000 SPS00,cumpleaños de Bitter Kas con este,de Bitter Kas con,cumpleaños de Bitter Kas,50 cumpleaños de Bitter Kas,de+el 50 cumpleaños de Bitter Kas,Bitter Kas con este,Bitter Kas con este cambio,Bitter Kas con este cambio de
http://www.interviu.es/ocio/apuntes/articulos/un-festival-unico-en-barcelona,interviu.es,2016-10-19,Spain,Bitter_Kas/NP00000_NP00000/bitter_kas,En  su  50  aniversario  el  rojo  de Bitter_Kas  vuelve  al  aperitivo  .,bitter_kas,np00000_np00000,bitter_kas,de,de,SPS00,rojo,rojo,NCMS000,el,el,DA0MS0,aniversario,aniversario,NCMS000,50,50,Z,vuelve,volver,VMIP3S0,al,a+el,SPS00+DA0MS0,aperitivo,aperitivo,NCMS000,.,.,Fp,,,,2016-10-19,2016,2010,NCMS000 SPS00 Bitter Kas VMIP3S0 SPS00+DA0MS0,SPS00 Bitter Kas VMIP3S0,NCMS000 SPS00 Bitter Kas,DA0MS0 NCMS000 SPS00 Bitter Kas,NCMS000 DA0MS0 NCMS000 SPS00 Bitter Kas,Bitter Kas VMIP3S0 SPS00+DA0MS0,Bitter Kas VMIP3S0 SPS00+DA0MS0 NCMS000,Bitter Kas VMIP3S0 SPS00+DA0MS0 NCMS000 Fp,rojo de Bitter Kas volver a+el,de Bitter Kas volver,rojo de Bitter Kas,el rojo de Bitter Kas,aniversario el rojo de Bitter Kas,Bitter Kas volver a+el,Bitter Kas volver a+el aperitivo,Bitter Kas volver a+el aperitivo .
http://www.libertaddigital.com/chic/vida-estilo/2016-10-30/echa-el-freno-madaleno-y-otras-expresiones-que-demuestran-que-eres-un-viejoven-1276585556/?utm_source=feedburner&utm_medium=feed&utm_campaign=Feed%253A%2Blibertaddigital%252Fportada%2B%2528Libertad%2BDigital%2529,libertaddigital.com,2016-10-30,===NONE===,Bitter_Kas/NP00000_NP00000/bitter_kas,"¿  De  qué  vas  , Bitter_Kas  ?",bitter_kas,np00000_np00000,bitter_kas,",",",",Fc,vas,ir,VMIP2S0,qué,qué,PT0CN000,De,de,SPS00,¿,¿,Fia,?,?,Fit,,,,,,,,,,,,,2016-10-30,2016,2010,,Fc Bitter Kas Fit,VMIP2S0 Fc Bitter Kas,PT0CN000 VMIP2S0 Fc Bitter Kas,SPS00 PT0CN000 VMIP2S0 Fc Bitter Kas,,,,,", Bitter Kas ?","ir , Bitter Kas","qué ir , Bitter Kas","de qué ir , Bitter Kas",,,
http://www.libertaddigital.com/chic/vida-estilo/2016-10-30/echa-el-freno-madaleno-y-otras-expresiones-que-demuestran-que-eres-un-viejoven-1276585556/?utm_source=feedburner&utm_medium=feed&utm_campaign=Feed%253A%2Blibertaddigital%252Fportada%2B%2528Libertad%2BDigital%2529,libertaddigital.com,2016-10-30,===NONE===,Bitter_Kas/NP00000_NP00000/bitter_kas,Dicen  que  antes  del  surgimiento  de  cualquier  droga  ya  estaba  el Bitter_Kas  .,bitter_kas,np00000_np00000,bitter_kas,el,el,DA0MS0,estaba,estar,VAII1S0,ya,ya,RG,droga,droga,NCFS000,cualquier,cualquiera,DI0CS0,.,.,Fp,,,,,,,,,,,,,2016-10-30,2016,2010,,DA0MS0 Bitter Kas Fp,VAII1S0 DA0MS0 Bitter Kas,RG VAII1S0 DA0MS0 Bitter Kas,NCFS000 RG VAII1S0 DA0MS0 Bitter Kas,,,,,el Bitter Kas .,estar el Bitter Kas,ya estar el Bitter Kas,droga ya estar el Bitter Kas,,,
http://www.merca20.com/trabajamos-clientes-las-ideas-nos-pertenecen-suyas-vendemos-carles-gomez-director-creativo-sra-rushmore/,merca20.com,2016-12-01,===NONE===,Bitter_Kas/NP00000_NP00000/bitter_kas,"Este  nuevo  talento  que  ahora  desarrolla  su  actividad  desde  Madrid  ,  trabajó  en  Villar-Rosàs  y  hasta  hace  poco  en  &  Rosàs  donde  puso  a  prueba  su  creatividad  para  numerosos  clientes  como  Damm  ,  Pepsi  ,  Kas  , Bitter_Kas  ,  Honda  y  Decathlon  ,  por  citar  sólo  algunos  ;  mientras  que  ahora  desde  Sra.  Rushmore  ,  Gómez  trabajará  ,  para  las  cuentas  de  Mini  ,  Coca-Cola  ,  Vodafone  y  El  Corte  Inglés  .",bitter_kas,np00000_np00000,bitter_kas,",",",",Fc,Kas,kas,NP00000,",",",",Fc,Pepsi,pepsi,NP00000,",",",",Fc,",",",",Fc,Honda,honda,NP00000,y,y,CC,Decathlon,decathlon,NP00000,",",",",Fc,2016-12-01,2016,2010,NP00000 Fc Bitter Kas Fc NP00000,Fc Bitter Kas Fc,NP00000 Fc Bitter Kas,Fc NP00000 Fc Bitter Kas,NP00000 Fc NP00000 Fc Bitter Kas,Bitter Kas Fc NP00000,Bitter Kas Fc NP00000 CC,Bitter Kas Fc NP00000 CC NP00000,"kas , Bitter Kas , honda",", Bitter Kas ,","kas , Bitter Kas",", kas , Bitter Kas","pepsi , kas , Bitter Kas","Bitter Kas , honda","Bitter Kas , honda y","Bitter Kas , honda y decathlon"
