url,website,date,country,keyword,sentence,kw,kw_lemma,kw_pos,left_w1,left_l1,left_p1,left_w2,left_l2,left_p2,left_w3,left_l3,left_p3,left_w4,left_l4,left_p4,left_w5,left_l5,left_p5,right_w1,right_l1,right_p1,right_w2,right_l2,right_p2,right_w3,right_l3,right_p3,right_w4,right_l4,right_p4,right_w5,right_l5,right_p5,datetime,year,10years,pattern_around5,pattern_around3,pattern_left2,pattern_left3,pattern_left4,pattern_right2,pattern_right3,pattern_right4,pattern_around5_lex,pattern_around3_lex,pattern_left2_lex,pattern_left3_lex,pattern_left4_lex,pattern_right2_lex,pattern_right3_lex,pattern_right4_lex
http://www.elnuevodiario.com.ni/variedades/340455-grito-de-tecnologia,elnuevodiario.com.ni,2015-01-29,Nicaragua,Silk-épil/NP00000/silk-épil,"Sin  embargo  ,  si  eres  de  las  que  prefieren  un  recorte  de  precisión  en  áreas  sensibles  ,  dejando  que  la  creatividad  salga  a  relucir  ,  la  Perfiladora  Femenina Silk-épil  de  Braun  ,  da  forma  a  las  ingles  y  toda  la  zona  que  queda  más  al  descubierto  con  el  biquini  .",silk-épil,np00000,silk-épil,Femenina,femenina,NP00000,Perfiladora,perfiladora,NP00000,la,el,DA0FS0,",",",",Fc,relucir,relucir,VMN0000,de,de,SPS00,Braun,braun,NP00000,",",",",Fc,da,dar,VMIP3S0,forma,forma,NCFS000,2015-01-29,2015,2010,NP00000 NP00000 Silk-épil SPS00 NP00000,NP00000 Silk-épil SPS00,NP00000 NP00000 Silk-épil,DA0FS0 NP00000 NP00000 Silk-épil,Fc DA0FS0 NP00000 NP00000 Silk-épil,Silk-épil SPS00 NP00000,Silk-épil SPS00 NP00000 Fc,Silk-épil SPS00 NP00000 Fc VMIP3S0,perfiladora femenina Silk-épil de braun,femenina Silk-épil de,perfiladora femenina Silk-épil,el perfiladora femenina Silk-épil,", el perfiladora femenina Silk-épil",Silk-épil de braun,"Silk-épil de braun ,","Silk-épil de braun , dar"
http://confirmado.com.ve/10-tips-para-lucir-un-increible-bikini-body/,confirmado.com.ve,2015-06-23,"Venezuela, Bolivarian Republic of",Silk-Épil/NP00000/silk-épil,"Funcionan  para  todo  el  cuerpo  ,  son  ultrarrápidas  ,  limpias  y  puedes  viajar  con  ellas  adonde  sea  .  ( Silk-Épil  9  ,  Braun  )",silk-épil,np00000,silk-épil,(,(,Fpa,.,.,Fp,sea,ser,VSSP1S0,adonde,adonde,CS,ellas,ellos,PP3FP000,9,9,Z,",",",",Fc,Braun,braun,NP00000,),),Fpt,,,,2015-06-23,2015,2010,Fp Fpa Silk-épil Z Fc,Fpa Silk-épil Z,Fp Fpa Silk-épil,VSSP1S0 Fp Fpa Silk-épil,CS VSSP1S0 Fp Fpa Silk-épil,Silk-épil Z Fc,Silk-épil Z Fc NP00000,Silk-épil Z Fc NP00000 Fpt,". ( Silk-épil 9 ,",( Silk-épil 9,. ( Silk-épil,ser . ( Silk-épil,adonde ser . ( Silk-épil,"Silk-épil 9 ,","Silk-épil 9 , braun","Silk-épil 9 , braun )"
http://www.cuatro.com/noticias/sociedad/Ana_Fernandez-Santi_Trancho-acto_publicitario_2_2002380116.html,cuatro.com,2015-06-12,Spain,Silk-épil/NP00000/silk-épil,Ana  Fernández  se  atreve  con  cualquier  estilo  de  moda  gracias  a  la  nueva  Braun Silk-épil  9  y  lo  ha  demostrado  posando  ante  los  medios  de  comunicación  de  corto  y  luciendo  piernas  .,silk-épil,np00000,silk-épil,Braun,braun,NP00000,nueva,nuevo,AQ0FS0,la,el,DA0FS0,a,a,SPS00,gracias,gracia,NCFP000,9,9,Z,y,y,CC,lo,lo,PP3CNA00,ha,haber,VAIP3S0,demostrado,demostrar,VMP00SM,2015-06-12,2015,2010,AQ0FS0 NP00000 Silk-épil Z CC,NP00000 Silk-épil Z,AQ0FS0 NP00000 Silk-épil,DA0FS0 AQ0FS0 NP00000 Silk-épil,SPS00 DA0FS0 AQ0FS0 NP00000 Silk-épil,Silk-épil Z CC,Silk-épil Z CC PP3CNA00,Silk-épil Z CC PP3CNA00 VAIP3S0,nuevo braun Silk-épil 9 y,braun Silk-épil 9,nuevo braun Silk-épil,el nuevo braun Silk-épil,a el nuevo braun Silk-épil,Silk-épil 9 y,Silk-épil 9 y lo,Silk-épil 9 y lo haber
http://www.elmundo.es/vida-sana/estilo-y-gastro/2016/05/28/574474f0e2704e02618b45bf.html,elmundo.es,2016-05-28,Spain,Silk-épil/NP00000/silk-épil,"La  actriz  de  Sin  tetas  no  hay  paraíso  ,  Gran  Hotel  y  Velvet  luce  perfecta  de  la  cabeza  a  los  pies  ,  por  eso  Braun  la  ha  escogido  como  embajadora  de  su  nueva Silk-épil  9  SkinSpa  ,  un  acto  en  el  que  ha  podido  presumir  de  piernas  .  ""  Hay  una  parte  de  genética  y  otra  de  deporte  ,  yo  lo  he  practicado  desde  pequeñita  .",silk-épil,np00000,silk-épil,nueva,nuevo,AQ0FS0,su,su,DP3CS0,de,de,SPS00,embajadora,embajador,NCFS000,como,como,CS,9,9,Z,SkinSpa,skinspa,NP00000,",",",",Fc,un,uno,DI0MS0,acto,acto,NCMS000,2016-05-28,2016,2010,DP3CS0 AQ0FS0 Silk-épil Z NP00000,AQ0FS0 Silk-épil Z,DP3CS0 AQ0FS0 Silk-épil,SPS00 DP3CS0 AQ0FS0 Silk-épil,NCFS000 SPS00 DP3CS0 AQ0FS0 Silk-épil,Silk-épil Z NP00000,Silk-épil Z NP00000 Fc,Silk-épil Z NP00000 Fc DI0MS0,su nuevo Silk-épil 9 skinspa,nuevo Silk-épil 9,su nuevo Silk-épil,de su nuevo Silk-épil,embajador de su nuevo Silk-épil,Silk-épil 9 skinspa,"Silk-épil 9 skinspa ,","Silk-épil 9 skinspa , uno"
http://www.abc.es/economia/abci-mejores-ofertas-prime-amazon-201607121129_noticia.html,abc.es,2016-07-12,Spain,Silk-épil/NP00000/silk-épil,"También  hay  descuentos  en  otras  categorías  :  una  maleta  de  Samsonite  se  puede  comprar  por  249  euros  ,  una Silk-épil  por  79  o  una  impresora  Samsung  por  98  euros  .",silk-épil,np00000,silk-épil,una,uno,DI0FS0,",",",",Fc,euros,euro,NCMP000,249,249,Z,por,por,SPS00,por,por,SPS00,79,79,Z,o,o,CC,una,1,Z,impresora,impresora,NCFS000,2016-07-12,2016,2010,Fc DI0FS0 Silk-épil SPS00 Z,DI0FS0 Silk-épil SPS00,Fc DI0FS0 Silk-épil,NCMP000 Fc DI0FS0 Silk-épil,Z NCMP000 Fc DI0FS0 Silk-épil,Silk-épil SPS00 Z,Silk-épil SPS00 Z CC,Silk-épil SPS00 Z CC Z,", uno Silk-épil por 79",uno Silk-épil por,", uno Silk-épil","euro , uno Silk-épil","249 euro , uno Silk-épil",Silk-épil por 79,Silk-épil por 79 o,Silk-épil por 79 o 1
http://www.eleconomista.es/tecnologia/noticias/7702450/07/16/Amazon-bate-su-record-historico-de-ventas-en-la-segunda-edicion-de-Prime-Day-en-Espana.html,eleconomista.es,2016-07-13,Spain,Silk-épil/NP00000/silk-épil,"Entre  los  artículos  más  adquiridos  encontramos  el  libro  electrónico  Kindle  Paperwhite  ,  el  recortador  de  barba  Philips  MultiGroom  o  la  depiladora  Braun Silk-épil  ,  entre  otros  . </doc>",silk-épil,np00000,silk-épil,Braun,braun,NP00000,depiladora,depilador,AQ0FS0,la,el,DA0FS0,o,o,CC,MultiGroom,multigroom,NP00000,",",",",Fc,entre,entre,SPS00,otros,otro,PI0MP000,.,.,Fp,</doc>,,,2016-07-13,2016,2010,AQ0FS0 NP00000 Silk-épil Fc SPS00,NP00000 Silk-épil Fc,AQ0FS0 NP00000 Silk-épil,DA0FS0 AQ0FS0 NP00000 Silk-épil,CC DA0FS0 AQ0FS0 NP00000 Silk-épil,Silk-épil Fc SPS00,Silk-épil Fc SPS00 PI0MP000,Silk-épil Fc SPS00 PI0MP000 Fp,"depilador braun Silk-épil , entre","braun Silk-épil ,",depilador braun Silk-épil,el depilador braun Silk-épil,o el depilador braun Silk-épil,"Silk-épil , entre","Silk-épil , entre otro","Silk-épil , entre otro ."
https://www.lavozdegalicia.es/noticia/sociedad/2017/11/14/amazon-da-pistoletazo-salida-black-friday-doce-dias-adelanto/0003_201711G14P26993.htm,lavozdegalicia.es,2017-11-14,Spain,Silk-épil/NP00000/silk-épil,"El  año  pasado  ,  los  más  vendidos  fueron  los  videojuegos  FIFA  17  ,  Call  of  Duty  Infinite  Warfare  y  Uncharted  4  ;  el  robot  aspirador  Roomba  871  ;  una  tira  de  bombillas  LED  de  dos  metros  Philips  HUE  ,  controlable  vía  smartphone  ;  el  móvil  Motorola  G4  Plus  y  la  depiladora  eléctrica  Braun Silk-épil  9  .",silk-épil,np00000,silk-épil,Braun,braun,NP00000,eléctrica,eléctrico,AQ0FS0,depiladora,depilador,AQ0FS0,la,el,DA0FS0,y,y,CC,9,9,Z,.,.,Fp,,,,,,,,,,2017-11-14,2017,2010,AQ0FS0 NP00000 Silk-épil Z Fp,NP00000 Silk-épil Z,AQ0FS0 NP00000 Silk-épil,AQ0FS0 AQ0FS0 NP00000 Silk-épil,DA0FS0 AQ0FS0 AQ0FS0 NP00000 Silk-épil,Silk-épil Z Fp,,,eléctrico braun Silk-épil 9 .,braun Silk-épil 9,eléctrico braun Silk-épil,depilador eléctrico braun Silk-épil,el depilador eléctrico braun Silk-épil,Silk-épil 9 .,,
http://www.lavanguardia.com/economia/20171122/433063476182/productos-no-puedes-dejar-escapar-black-friday-amazon-miercoles.html,lavanguardia.com,2017-11-22,Spain,Silk-épily/NP00000/silk-épily,"Sin  dejar  los  artículos  para  el  cuidado  personal  ,  las  bajas  de  precio  más  destacadas  de  hoy  son  la  Depiladora  eléctrica  Braun Silk-épily  y  la  afeitadora  eléctrica  Braun  Series  7  para  hombre  .",silk-épily,np00000,silk-épily,Braun,braun,NP00000,eléctrica,eléctrico,AQ0FS0,Depiladora,depiladora,NP00000,la,el,DA0FS0,son,ser,VSIP3P0,y,y,CC,la,el,DA0FS0,afeitadora,afeitadora,NCFS000,eléctrica,eléctrico,AQ0FS0,Braun,braun,NP00000,2017-11-22,2017,2010,AQ0FS0 NP00000 Silk-épil CC DA0FS0,NP00000 Silk-épil CC,AQ0FS0 NP00000 Silk-épil,NP00000 AQ0FS0 NP00000 Silk-épil,DA0FS0 NP00000 AQ0FS0 NP00000 Silk-épil,Silk-épil CC DA0FS0,Silk-épil CC DA0FS0 NCFS000,Silk-épil CC DA0FS0 NCFS000 AQ0FS0,eléctrico braun Silk-épil y el,braun Silk-épil y,eléctrico braun Silk-épil,depiladora eléctrico braun Silk-épil,el depiladora eléctrico braun Silk-épil,Silk-épil y el,Silk-épil y el afeitadora,Silk-épil y el afeitadora eléctrico
http://ecodiario.eleconomista.es/espana/noticias/8769003/11/17/Amazon-lanza-para-el-Black-Friday-multitud-de-ofertas-en-electronica-y-tecnologia.html,eleconomista.es,2017-11-24,Spain,Silk-épil/NP00000/silk-épil,"Otras  oportunidades  son  la  silla  de  paseo  Citi  Mini  4  Babyjogger  por  239  euros  ,  la  silla  de  coche  Maxi  Cosi  Cabriofix  por  82,99  euros  ,  el  cepillo  eléctrico  Oral  B  Genius  9000  por  109,99  y  la  depiladora  Braun Silk-épil  9  SkinSpa  por  82,20  euros  .",silk-épil,np00000,silk-épil,Braun,braun,NP00000,depiladora,depilador,AQ0FS0,la,el,DA0FS0,y,y,CC,"109,99",109.99,Z,9,9,Z,SkinSpa,skinspa,NP00000,por,por,SPS00,"82,20",82.2,Z,euros,euro,NCMP000,2017-11-24,2017,2010,AQ0FS0 NP00000 Silk-épil Z NP00000,NP00000 Silk-épil Z,AQ0FS0 NP00000 Silk-épil,DA0FS0 AQ0FS0 NP00000 Silk-épil,CC DA0FS0 AQ0FS0 NP00000 Silk-épil,Silk-épil Z NP00000,Silk-épil Z NP00000 SPS00,Silk-épil Z NP00000 SPS00 Z,depilador braun Silk-épil 9 skinspa,braun Silk-épil 9,depilador braun Silk-épil,el depilador braun Silk-épil,y el depilador braun Silk-épil,Silk-épil 9 skinspa,Silk-épil 9 skinspa por,Silk-épil 9 skinspa por 82.2
http://www.marca.com/tiramillas/tecnologia/2018/05/28/5b0c3a80468aeb98378b460f.html,marca.com,2018-06-01,Spain,Silk-épil/NP00000/silk-épil,"La Silk-épil  SkinSpa  es  un  sistema  4  en  1  completo  para  la  depilación  ,  exfoliación  y  el  cuidado  de  la  piel  .",silk-épil,np00000,silk-épil,La,el,DA0FS0,,,,,,,,,,,,,SkinSpa,skinspa,NP00000,es,ser,VSIP3S0,un,uno,DI0MS0,sistema,sistema,NCMS000,4,4,Z,2018-06-01,2018,2010,,DA0FS0 Silk-épil NP00000,,,,Silk-épil NP00000 VSIP3S0,Silk-épil NP00000 VSIP3S0 DI0MS0,Silk-épil NP00000 VSIP3S0 DI0MS0 NCMS000,,el Silk-épil skinspa,,,,Silk-épil skinspa ser,Silk-épil skinspa ser uno,Silk-épil skinspa ser uno sistema
https://elpais.com/elpais/2018/08/14/escaparate/1534244287_704979.html#ref%3Drss%26format%3Dsimple%26link%3Dlink,elpais.com,2018-08-15,Spain,Silk-épil/NP00000/silk-épil,Depiladora  Braun Silk-épil  9  9/970  .,silk-épil,np00000,silk-épil,Braun,braun,NP00000,Depiladora,depiladora,NP00000,,,,,,,,,,9,9,Z,9/970,9,970/Z,.,.,Fp,,,,,,,2018-08-15,2018,2010,NP00000 NP00000 Silk-épil Z 970/Z,NP00000 Silk-épil Z,NP00000 NP00000 Silk-épil,,,Silk-épil Z 970/Z,Silk-épil Z 970/Z Fp,,depiladora braun Silk-épil 9 9,braun Silk-épil 9,depiladora braun Silk-épil,,,Silk-épil 9 9,Silk-épil 9 9 .,
https://www.elmundo.es/economia/ahorro-y-consumo/2018/11/14/5bec858022601dcf098b4621.html,elmundo.es,2018-11-15,Spain,Silk-épil/NP00000/silk-épil,Depiladora  BRAUN Silk-épil  7  7545  .,silk-épil,np00000,silk-épil,BRAUN,braun,NP00000,Depiladora,depiladora,NP00000,,,,,,,,,,7,7,Z,7545,7545,Z,.,.,Fp,,,,,,,2018-11-15,2018,2010,NP00000 NP00000 Silk-épil Z Z,NP00000 Silk-épil Z,NP00000 NP00000 Silk-épil,,,Silk-épil Z Z,Silk-épil Z Z Fp,,depiladora braun Silk-épil 7 7545,braun Silk-épil 7,depiladora braun Silk-épil,,,Silk-épil 7 7545,Silk-épil 7 7545 .,
https://elpais.com/elpais/2018/11/15/escaparate/1542306904_756973.html#ref%3Drss%26format%3Dsimple%26link%3Dlink,elpais.com,2018-11-15,Spain,Silk-épil/NP00000/silk-épil,MODA  Y  BELLEZA  Depiladora  para  mujer  Braun Silk-épil  9  SkinSpa  .,silk-épil,np00000,silk-épil,Braun,braun,NP00000,mujer,mujer,NCFS000,para,para,SPS00,Depiladora,depiladora,NP00000,BELLEZA,belleza,NP00000,9,9,Z,SkinSpa,skinspa,NP00000,.,.,Fp,,,,,,,2018-11-15,2018,2010,NCFS000 NP00000 Silk-épil Z NP00000,NP00000 Silk-épil Z,NCFS000 NP00000 Silk-épil,SPS00 NCFS000 NP00000 Silk-épil,NP00000 SPS00 NCFS000 NP00000 Silk-épil,Silk-épil Z NP00000,Silk-épil Z NP00000 Fp,,mujer braun Silk-épil 9 skinspa,braun Silk-épil 9,mujer braun Silk-épil,para mujer braun Silk-épil,depiladora para mujer braun Silk-épil,Silk-épil 9 skinspa,Silk-épil 9 skinspa .,
https://www.lavanguardia.com/comprar/20181126/453174338814/cyber-monday-amazon-ofertas-descuentos-electrodomesticos-tecnologia-echo.html,lavanguardia.com,2018-11-26,Spain,Silk-épil/NP00000/silk-épil,"La  Braun Silk-épil  9  9/890  es  una  depiladora  para  mujer  inalámbrica  ,  con  7  accesorios  para  arrancar  bello  o  recortar  las  zonas  más  sensibles  .",silk-épil,np00000,silk-épil,Braun,braun,NP00000,La,el,DA0FS0,,,,,,,,,,9,9,Z,9/890,9,890/Z,es,ser,VSIP3S0,una,uno,DI0FS0,depiladora,depilador,AQ0FS0,2018-11-26,2018,2010,DA0FS0 NP00000 Silk-épil Z 890/Z,NP00000 Silk-épil Z,DA0FS0 NP00000 Silk-épil,,,Silk-épil Z 890/Z,Silk-épil Z 890/Z VSIP3S0,Silk-épil Z 890/Z VSIP3S0 DI0FS0,el braun Silk-épil 9 9,braun Silk-épil 9,el braun Silk-épil,,,Silk-épil 9 9,Silk-épil 9 9 ser,Silk-épil 9 9 ser uno
https://retina.elpais.com/retina/2018/12/03/innovacion/1543835439_075159.html#ref%3Drss%26format%3Dsimple%26link%3Dlink,elpais.com,2018-12-06,===NONE===,Silk-épil/NP00000/silk-épil,Decenas  de  afeitadoras  y  depiladoras  (  como  la  famosa Silk-épil  )  con  la  insignia  Braun  han  sido  forjadas  en  esta  especie  de  búnker  acristalado  compuesto  de  ocho  edificios  que  en  conjunto  ocupan  cerca  de  113.000  metros  cuadrados  .,silk-épil,np00000,silk-épil,famosa,famoso,AQ0FS0,la,el,DA0FS0,como,como,CS,(,(,Fpa,depiladoras,depilador,AQ0FP0,),),Fpt,con,con,SPS00,la,el,DA0FS0,insignia,insignia,NCFS000,Braun,braun,NP00000,2018-12-06,2018,2010,DA0FS0 AQ0FS0 Silk-épil Fpt SPS00,AQ0FS0 Silk-épil Fpt,DA0FS0 AQ0FS0 Silk-épil,CS DA0FS0 AQ0FS0 Silk-épil,Fpa CS DA0FS0 AQ0FS0 Silk-épil,Silk-épil Fpt SPS00,Silk-épil Fpt SPS00 DA0FS0,Silk-épil Fpt SPS00 DA0FS0 NCFS000,el famoso Silk-épil ) con,famoso Silk-épil ),el famoso Silk-épil,como el famoso Silk-épil,( como el famoso Silk-épil,Silk-épil ) con,Silk-épil ) con el,Silk-épil ) con el insignia
https://www.elperiodico.com/es/shopping/20190712/mejores-ofertas-amazon-prime-day-chollos-7551867,elperiodico.com,2019-07-14,===NONE===,Silk-épil/NP00000/silk-épil,La  Braun Silk-épil  9  SensoSmart  es  la  primera  depiladora  eléctrica  inteligente  del  mundo  .,silk-épil,np00000,silk-épil,Braun,braun,NP00000,La,el,DA0FS0,,,,,,,,,,9,9,Z,SensoSmart,sensosmart,NP00000,es,ser,VSIP3S0,la,el,DA0FS0,primera,1,AO0FS0,2019-07-14,2019,2010,DA0FS0 NP00000 Silk-épil Z NP00000,NP00000 Silk-épil Z,DA0FS0 NP00000 Silk-épil,,,Silk-épil Z NP00000,Silk-épil Z NP00000 VSIP3S0,Silk-épil Z NP00000 VSIP3S0 DA0FS0,el braun Silk-épil 9 sensosmart,braun Silk-épil 9,el braun Silk-épil,,,Silk-épil 9 sensosmart,Silk-épil 9 sensosmart ser,Silk-épil 9 sensosmart ser el
https://www.elperiodico.com/es/shopping/20190712/mejores-ofertas-amazon-prime-day-chollos-7551867,elperiodico.com,2019-07-14,===NONE===,Silk-épil/NP00000/silk-épil,"La Silk-épil  SkinSpa  es  un  sistema  4  en  1  completo  para  la  depilación  ,  exfoliación  y  el  cuidado  de  la  piel  .",silk-épil,np00000,silk-épil,La,el,DA0FS0,,,,,,,,,,,,,SkinSpa,skinspa,NP00000,es,ser,VSIP3S0,un,uno,DI0MS0,sistema,sistema,NCMS000,4,4,Z,2019-07-14,2019,2010,,DA0FS0 Silk-épil NP00000,,,,Silk-épil NP00000 VSIP3S0,Silk-épil NP00000 VSIP3S0 DI0MS0,Silk-épil NP00000 VSIP3S0 DI0MS0 NCMS000,,el Silk-épil skinspa,,,,Silk-épil skinspa ser,Silk-épil skinspa ser uno,Silk-épil skinspa ser uno sistema
http://www.noticiasnoa.com/amazon-prime-day-2019-las-mejores-ofertas-en-belleza-y-cuidado-personal-escaparate/,noticiasnoa.com,2019-07-15,===NONE===,Silk-épil/NP00000/silk-épil,-  Depiladora  Braun Silk-épil  9  9/990  con  13  accesorios  .,silk-épil,np00000,silk-épil,Braun,braun,NP00000,Depiladora,depiladora,NP00000,-,-,Fg,,,,,,,9,9,Z,9/990,9,990/Z,con,con,SPS00,13,13,Z,accesorios,accesorio,NCMP000,2019-07-15,2019,2010,NP00000 NP00000 Silk-épil Z 990/Z,NP00000 Silk-épil Z,NP00000 NP00000 Silk-épil,Fg NP00000 NP00000 Silk-épil,,Silk-épil Z 990/Z,Silk-épil Z 990/Z SPS00,Silk-épil Z 990/Z SPS00 Z,depiladora braun Silk-épil 9 9,braun Silk-épil 9,depiladora braun Silk-épil,- depiladora braun Silk-épil,,Silk-épil 9 9,Silk-épil 9 9 con,Silk-épil 9 9 con 13
https://www.entornointeligente.com/amazon-prime-day-2019-las-mejores-ofertas-en-productos-de-belleza-y-cosmticos/,entornointeligente.com,2019-07-15,"Venezuela, Bolivarian Republic of",Silk-épil/NP00000/silk-épil,"Depiladora  eléctrica  inalámbrica  4  en  1  Braun Silk-épil  SkinSpa  con  SensoSmart  y  sistema  de  depilación  ,  exfoliación  y  cuidado  de  la  piel  ,  Wet  &  Dry  con  13  accesorios  que  se  convierte  en  un  gran  aliado  frente  al  vello  corpporal  con  el  que  conseguir  además  una  piel  más  cuidada  y  con  un  precio  de  145,98  €  89,99  €  .",silk-épil,np00000,silk-épil,Braun,braun,NP00000,1,1,Z,en,en,SPS00,4,4,Z,inalámbrica,inalámbrico,AQ0FS0,SkinSpa,skinspa,NP00000,con,con,SPS00,SensoSmart,sensosmart,NP00000,y,y,CC,sistema,sistema,NCMS000,2019-07-15,2019,2010,Z NP00000 Silk-épil NP00000 SPS00,NP00000 Silk-épil NP00000,Z NP00000 Silk-épil,SPS00 Z NP00000 Silk-épil,Z SPS00 Z NP00000 Silk-épil,Silk-épil NP00000 SPS00,Silk-épil NP00000 SPS00 NP00000,Silk-épil NP00000 SPS00 NP00000 CC,1 braun Silk-épil skinspa con,braun Silk-épil skinspa,1 braun Silk-épil,en 1 braun Silk-épil,4 en 1 braun Silk-épil,Silk-épil skinspa con,Silk-épil skinspa con sensosmart,Silk-épil skinspa con sensosmart y
https://www.entornointeligente.com/amazon-prime-day-2019-las-mejores-ofertas-en-productos-de-belleza-y-cosmticos/,entornointeligente.com,2019-07-15,"Venezuela, Bolivarian Republic of",Silk-épil/NP00000/silk-épil,"Hoy  en  Amazon  por  44,57  €  Braun Silk-épil  9  9/990  SkinSpa  Depiladora  Mujer  Eléctrica  Inalámbrica  4  en  1  con  SensoSmart  y  Sistema  de  Depilación  ,  Exfoliación  y  Cuidado  de  la  piel  ,  Wet  &  Dry  con  13  Accesorios  ,  Color  Oro  Rosa",silk-épil,np00000,silk-épil,Braun,braun,NP00000,€,€,Fz,"44,57",44.57,Z,por,por,SPS00,Amazon,amazon,NP00000,9,9,Z,9/990,9,990/Z,SkinSpa,skinspa,NP00000,Depiladora,depiladora,NP00000,Mujer,mujer,NP00000,2019-07-15,2019,2010,Fz NP00000 Silk-épil Z 990/Z,NP00000 Silk-épil Z,Fz NP00000 Silk-épil,Z Fz NP00000 Silk-épil,SPS00 Z Fz NP00000 Silk-épil,Silk-épil Z 990/Z,Silk-épil Z 990/Z NP00000,Silk-épil Z 990/Z NP00000 NP00000,€ braun Silk-épil 9 9,braun Silk-épil 9,€ braun Silk-épil,44.57 € braun Silk-épil,por 44.57 € braun Silk-épil,Silk-épil 9 9,Silk-épil 9 9 skinspa,Silk-épil 9 9 skinspa depiladora
https://www.regiondigital.com/noticias/reportajes/315266-como-elegir-la-depiladora-perfecta.html,regiondigital.com,2019-09-06,===NONE===,Silk-épil/NP00000/silk-épil,Braun Silk-épil  9  .,silk-épil,np00000,silk-épil,Braun,braun,NP00000,,,,,,,,,,,,,9,9,Z,.,.,Fp,,,,,,,,,,2019-09-06,2019,2010,,NP00000 Silk-épil Z,,,,Silk-épil Z Fp,,,,braun Silk-épil 9,,,,Silk-épil 9 .,,
https://www.elidealgallego.com/articulo/sociedad/braun-calidad-variedad-mejor-precio-depilacion-cuerpo/20190918151614414981.html,elidealgallego.com,2019-09-18,Spain,Silk-épil/NP00000/silk-épil,"Aunque  también  hay  modelos Silk-épil  ,  que  retiran  el  vello  extrayéndolo  directamente  ,  la  mayoría  de  hombres  aboga  por  aquellas  que  cortan  a  ras  en  lugar  de  extraer  .",silk-épil,np00000,silk-épil,modelos,modelo,NCCP000,hay,haber,VMIP3S0,también,también,RG,Aunque,aunque,CC,,,,",",",",Fc,que,que,PR0CN000,retiran,retirar,VMIP3P0,el,el,DA0MS0,vello,vello,NCMS000,2019-09-18,2019,2010,VMIP3S0 NCCP000 Silk-épil Fc PR0CN000,NCCP000 Silk-épil Fc,VMIP3S0 NCCP000 Silk-épil,RG VMIP3S0 NCCP000 Silk-épil,CC RG VMIP3S0 NCCP000 Silk-épil,Silk-épil Fc PR0CN000,Silk-épil Fc PR0CN000 VMIP3P0,Silk-épil Fc PR0CN000 VMIP3P0 DA0MS0,"haber modelo Silk-épil , que","modelo Silk-épil ,",haber modelo Silk-épil,también haber modelo Silk-épil,aunque también haber modelo Silk-épil,"Silk-épil , que","Silk-épil , que retirar","Silk-épil , que retirar el"
https://www.ideal.es/sociedad/consumo/gangas-black-friday-amazon-ofertas-20181123113030-nt.html,ideal.es,2019-10-09,Spain,Silk-épil/NP00000/silk-épil,"Hay  más  en  los  descuentos  de  Amazon  en  Black  Friday  ,  que  ,  por  lo  menos  debes  tener  en  cuenta  :  puedes  conseguir  proyector  LCD  de  3500  lúmenes  con  envío  gratis  y  una  depiladora  Braun Silk-épil  9  con  el  mismo  tipo  de  oferta  .",silk-épil,np00000,silk-épil,Braun,braun,NP00000,depiladora,depilador,AQ0FS0,una,uno,DI0FS0,y,y,CC,gratis,gratis,AQ0CN0,9,9,Z,con,con,SPS00,el,el,DA0MS0,mismo,mismo,AQ0MS0,tipo,tipo,NCMS000,2019-10-09,2019,2010,AQ0FS0 NP00000 Silk-épil Z SPS00,NP00000 Silk-épil Z,AQ0FS0 NP00000 Silk-épil,DI0FS0 AQ0FS0 NP00000 Silk-épil,CC DI0FS0 AQ0FS0 NP00000 Silk-épil,Silk-épil Z SPS00,Silk-épil Z SPS00 DA0MS0,Silk-épil Z SPS00 DA0MS0 AQ0MS0,depilador braun Silk-épil 9 con,braun Silk-épil 9,depilador braun Silk-épil,uno depilador braun Silk-épil,y uno depilador braun Silk-épil,Silk-épil 9 con,Silk-épil 9 con el,Silk-épil 9 con el mismo
https://www.lavanguardia.com/comprar/20191216/472253005081/chollos-dia-amazon-ofertas-descuentos-regalos-navidad.html,lavanguardia.com,2019-12-16,Spain,Silk-épil/NP00000/silk-épil,La  Braun Silk-épil  9  lleva  varios  accesorios  que  la  convierten  en  un  cepillo  de  cuidado  facial  .,silk-épil,np00000,silk-épil,Braun,braun,NP00000,La,el,DA0FS0,,,,,,,,,,9,9,Z,lleva,llevar,VMIP3S0,varios,varios,DI0MP0,accesorios,accesorio,NCMP000,que,que,PR0CN000,2019-12-16,2019,2010,DA0FS0 NP00000 Silk-épil Z VMIP3S0,NP00000 Silk-épil Z,DA0FS0 NP00000 Silk-épil,,,Silk-épil Z VMIP3S0,Silk-épil Z VMIP3S0 DI0MP0,Silk-épil Z VMIP3S0 DI0MP0 NCMP000,el braun Silk-épil 9 llevar,braun Silk-épil 9,el braun Silk-épil,,,Silk-épil 9 llevar,Silk-épil 9 llevar varios,Silk-épil 9 llevar varios accesorio
https://www.elperiodicodearagon.com/noticias/050-mejores-ofertas-amazon-prime-day_1374500.html,elperiodicodearagon.com,2019-12-19,===NONE===,Silk-épil/NP00000/silk-épil,La  Braun Silk-épil  9  SensoSmart  es  la  primera  depiladora  eléctrica  inteligente  del  mundo  .,silk-épil,np00000,silk-épil,Braun,braun,NP00000,La,el,DA0FS0,,,,,,,,,,9,9,Z,SensoSmart,sensosmart,NP00000,es,ser,VSIP3S0,la,el,DA0FS0,primera,1,AO0FS0,2019-12-19,2019,2010,DA0FS0 NP00000 Silk-épil Z NP00000,NP00000 Silk-épil Z,DA0FS0 NP00000 Silk-épil,,,Silk-épil Z NP00000,Silk-épil Z NP00000 VSIP3S0,Silk-épil Z NP00000 VSIP3S0 DA0FS0,el braun Silk-épil 9 sensosmart,braun Silk-épil 9,el braun Silk-épil,,,Silk-épil 9 sensosmart,Silk-épil 9 sensosmart ser,Silk-épil 9 sensosmart ser el
https://www.elperiodicodearagon.com/noticias/050-mejores-ofertas-amazon-prime-day_1374500.html,elperiodicodearagon.com,2019-12-19,===NONE===,Silk-épil/NP00000/silk-épil,"La Silk-épil  SkinSpa  es  un  sistema  4  en  1  completo  para  la  depilación  ,  exfoliación  y  el  cuidado  de  la  piel  .",silk-épil,np00000,silk-épil,La,el,DA0FS0,,,,,,,,,,,,,SkinSpa,skinspa,NP00000,es,ser,VSIP3S0,un,uno,DI0MS0,sistema,sistema,NCMS000,4,4,Z,2019-12-19,2019,2010,,DA0FS0 Silk-épil NP00000,,,,Silk-épil NP00000 VSIP3S0,Silk-épil NP00000 VSIP3S0 DI0MS0,Silk-épil NP00000 VSIP3S0 DI0MS0 NCMS000,,el Silk-épil skinspa,,,,Silk-épil skinspa ser,Silk-épil skinspa ser uno,Silk-épil skinspa ser uno sistema
https://elpais.com/elpais/2020/01/27/escaparate/1580118388_415752.html,elpais.com,2020-02-02,Spain,Silk-épil/NP00000/silk-épil,Nuestra  experta  ha  elegido  la  Braun Silk-épil  9  9-561  como  la  mejor  depiladora  para  mujer  de  los  cinco  modelos  analizados  .,silk-épil,np00000,silk-épil,Braun,braun,NP00000,la,el,DA0FS0,elegido,elegir,VMP00SM,ha,haber,VAIP3S0,experta,experto,NCFS000,9,9,Z,9-561,9-561,Z,como,como,CS,la,el,DA0FS0,mejor,mejor,AQ0CS0,2020-02-02,2020,2020,DA0FS0 NP00000 Silk-épil Z Z,NP00000 Silk-épil Z,DA0FS0 NP00000 Silk-épil,VMP00SM DA0FS0 NP00000 Silk-épil,VAIP3S0 VMP00SM DA0FS0 NP00000 Silk-épil,Silk-épil Z Z,Silk-épil Z Z CS,Silk-épil Z Z CS DA0FS0,el braun Silk-épil 9 9-561,braun Silk-épil 9,el braun Silk-épil,elegir el braun Silk-épil,haber elegir el braun Silk-épil,Silk-épil 9 9-561,Silk-épil 9 9-561 como,Silk-épil 9 9-561 como el
