url,website,date,country,keyword,sentence,kw,kw_lemma,kw_pos,left_w1,left_l1,left_p1,left_w2,left_l2,left_p2,left_w3,left_l3,left_p3,left_w4,left_l4,left_p4,left_w5,left_l5,left_p5,right_w1,right_l1,right_p1,right_w2,right_l2,right_p2,right_w3,right_l3,right_p3,right_w4,right_l4,right_p4,right_w5,right_l5,right_p5,datetime,year,10years,pattern_around5,pattern_around3,pattern_left2,pattern_left3,pattern_left4,pattern_right2,pattern_right3,pattern_right4,pattern_around5_lex,pattern_around3_lex,pattern_left2_lex,pattern_left3_lex,pattern_left4_lex,pattern_right2_lex,pattern_right3_lex,pattern_right4_lex
http://www.lacapital.com.ar/ovacion/Tenis-Del-Potro-se-proyecta-20140110-0030.html,lacapital.com.ar,2014-01-10,Argentina,Roger-Vaseline/NP00000/roger-vaseline,Edouard Roger-Vaseline  (  40o  )  ;  Horacio  Zeballos  v  .,roger-vaseline,np00000,roger-vaseline,Edouard,edouard,NP00000,,,,,,,,,,,,,(,(,Fpa,40o,40o,Z,),),Fpt,;,;,Fx,Horacio,horacio,NP00000,2014-01-10,2014,2010,,NP00000 Vaseline Fpa,,,,Vaseline Fpa Z,Vaseline Fpa Z Fpt,Vaseline Fpa Z Fpt Fx,,edouard Vaseline (,,,,Vaseline ( 40o,Vaseline ( 40o ),Vaseline ( 40o ) ;
http://www.eldia.com.ar/edis/20140112/Monaco-Berlocq-Mayer-juegan-arranque-Abierto-Australia-deportes33.htm,eldia.com.ar,2014-01-12,Argentina,Roger-Vaseline/NP00000/roger-vaseline,"En  este  primer  día  de  competencia  ,  Carlos  Berlocq  ,  ubicado  en  el  puesto  41  del  ranking  ATP  ,  se  enfrentará  ante  el  francés  Edouard Roger-Vaseline  (  40  )  en  el  quinto  turno  de  la  cancha  número  5  .",roger-vaseline,np00000,roger-vaseline,Edouard,edouard,NP00000,francés,francés,NCMS000,el,el,DA0MS0,ante,ante,SPS00,enfrentará,enfrentar,VMIF3S0,(,(,Fpa,40,40,Z,),),Fpt,en,en,SPS00,el,el,DA0MS0,2014-01-12,2014,2010,NCMS000 NP00000 Vaseline Fpa Z,NP00000 Vaseline Fpa,NCMS000 NP00000 Vaseline,DA0MS0 NCMS000 NP00000 Vaseline,SPS00 DA0MS0 NCMS000 NP00000 Vaseline,Vaseline Fpa Z,Vaseline Fpa Z Fpt,Vaseline Fpa Z Fpt SPS00,francés edouard Vaseline ( 40,edouard Vaseline (,francés edouard Vaseline,el francés edouard Vaseline,ante el francés edouard Vaseline,Vaseline ( 40,Vaseline ( 40 ),Vaseline ( 40 ) en
http://elcomercio.pe/luces/musica/nirvana-repaso-discografia-banda-kurt-cobain-noticia-1719935,elcomercio.pe,2014-04-02,Peru,Vaselines/NP00000/vaselines,"El  disco  es  en  parte  una  muestra  de  los  poderes  compositivos  de  Cobain  y  un  homenaje  a  sus  héroes  de  la  música  ,  con  versiones  de  canciones  de  The Vaselines  ,  Leadbelly  ,  Meat  Puppets  y  David  Bowie  ,  de  este  último  interpretó  ""  The  Man  Who  Sold  the  World  """,vaselines,np00000,vaselines,The,the,NP00000,de,de,SPS00,canciones,canción,NCFP000,de,de,SPS00,versiones,versión,NCFP000,",",",",Fc,Leadbelly,leadbelly,NP00000,",",",",Fc,Meat,meat,NP00000,Puppets,puppets,NP00000,2014-04-02,2014,2010,SPS00 NP00000 Vaseline Fc NP00000,NP00000 Vaseline Fc,SPS00 NP00000 Vaseline,NCFP000 SPS00 NP00000 Vaseline,SPS00 NCFP000 SPS00 NP00000 Vaseline,Vaseline Fc NP00000,Vaseline Fc NP00000 Fc,Vaseline Fc NP00000 Fc NP00000,"de the Vaseline , leadbelly","the Vaseline ,",de the Vaseline,canción de the Vaseline,de canción de the Vaseline,"Vaseline , leadbelly","Vaseline , leadbelly ,","Vaseline , leadbelly , meat"
http://www.lavozdegalicia.es/noticia/coruna/2014/09/24/srasrsra-wild-balbina-lady-leno-abren-conciertos-retroalimentacion/00031411557760541691868.htm,lavozdegalicia.es,2014-09-24,Spain,Vaselines/NP00000/vaselines,"Les  acompañarán  los  vigueses  Wild  Balbina  con  un  sonido  delicioso  que  recuerda  a  Vivian  Girls  o  The Vaselines  ,  y  que  presentarán  nuevo  trabajo  Sisters  Before  Misters  .",vaselines,np00000,vaselines,The,the,NP00000,o,o,CC,Girls,girls,NP00000,Vivian,vivian,NP00000,a,a,SPS00,",",",",Fc,y,y,CC,que,que,PR0CN000,presentarán,presentar,VMIF3P0,nuevo,nuevo,AQ0MS0,2014-09-24,2014,2010,CC NP00000 Vaseline Fc CC,NP00000 Vaseline Fc,CC NP00000 Vaseline,NP00000 CC NP00000 Vaseline,NP00000 NP00000 CC NP00000 Vaseline,Vaseline Fc CC,Vaseline Fc CC PR0CN000,Vaseline Fc CC PR0CN000 VMIF3P0,"o the Vaseline , y","the Vaseline ,",o the Vaseline,girls o the Vaseline,vivian girls o the Vaseline,"Vaseline , y","Vaseline , y que","Vaseline , y que presentar"
http://jenesaispop.com/2014/10/14/205997/vaselines-v-vaselines/,jenesaispop.com,2014-10-15,===NONE===,Vaselines/NP00000/vaselines,<doc uri=http://jenesaispop.com/2014/10/14/205997/vaselines-v-vaselines/ website=jenesaispop.com date=2014-10-15 source_country=> /the/NP00000 Vaselines  /  V  For  Vaselines,vaselines,np00000,vaselines,The,the,NP00000,,,,,,,,,,,,,/,,,V,v,NP00000,For,for,NP00000,Vaselines,vaselines,NP00000,,,,2014-10-15,2014,2010,,,,,,,,,,,,,,,,
http://jenesaispop.com/2014/10/14/205997/vaselines-v-vaselines/,jenesaispop.com,2014-10-15,===NONE===,Vaselines/NP00000/vaselines,<doc uri=http://jenesaispop.com/2014/10/14/205997/vaselines-v-vaselines/ website=jenesaispop.com date=2014-10-15 source_country=> /the/NP00000 /vaselines/NP00000 ///Fh /v/NP00000 /for/NP00000 Vaselines ,vaselines,np00000,vaselines,For,for,NP00000,V,v,NP00000,/,,,Vaselines,vaselines,NP00000,The,the,NP00000,,,,,,,,,,,,,,,,2014-10-15,2014,2010,,,NP00000 NP00000 Vaseline,,,,,,,,v for Vaseline,,,,,
http://jenesaispop.com/2014/10/14/205997/vaselines-v-vaselines/,jenesaispop.com,2014-10-15,===NONE===,Vaselines/NP00000/vaselines,"Resulta  encomiable  y  sano  que  un  grupo  de  culto  como  The Vaselines  sacuda  la  trascendencia  que  suele  envolver  el  regreso  de  otras  bandas  de  su  estatus  ,  prácticamente  ignorados  en  su  efímera  primera  etapa  y  encumbrados  ,  años  después  ,  gracias  a  la  reivindicación  de  sus  canciones  por  parte  de  figuras  relevantes  (  en  este  caso  ,  Kurt  Cobain  )  .",vaselines,np00000,vaselines,The,the,NP00000,como,como,CS,culto,culto,NCMS000,de,de,SPS00,grupo,grupo,NCMS000,sacuda,sacudir,VMSP3S0,la,el,DA0FS0,trascendencia,trascendencia,NCFS000,que,que,PR0CN000,suele,soler,VMIP3S0,2014-10-15,2014,2010,CS NP00000 Vaseline VMSP3S0 DA0FS0,NP00000 Vaseline VMSP3S0,CS NP00000 Vaseline,NCMS000 CS NP00000 Vaseline,SPS00 NCMS000 CS NP00000 Vaseline,Vaseline VMSP3S0 DA0FS0,Vaseline VMSP3S0 DA0FS0 NCFS000,Vaseline VMSP3S0 DA0FS0 NCFS000 PR0CN000,como the Vaseline sacudir el,the Vaseline sacudir,como the Vaseline,culto como the Vaseline,de culto como the Vaseline,Vaseline sacudir el,Vaseline sacudir el trascendencia,Vaseline sacudir el trascendencia que
http://jenesaispop.com/2014/10/14/205997/vaselines-v-vaselines/,jenesaispop.com,2014-10-15,===NONE===,Vaselines/NP00000/vaselines,"Eso  desprendía  '  Sex  With  An  X  '  ,  un  segundo  disco  publicado  nada  más  que  25  años  después  que  su  único  largo  oficial  hasta  aquel  momento  ,  y  eso  mismo  desprende  '  V  For Vaselines  '  ,  que  llega  sin  el  respaldo  de  Domino  Recordings  ,  autoeditado  en  su  propio  sello  .",vaselines,np00000,vaselines,For,for,NP00000,V,v,NP00000,',',Fe,desprende,desprender,VMIP3S0,mismo,mismo,AQ0MS0,',',Fe,",",",",Fc,que,que,PR0CN000,llega,llegar,VMIP3S0,sin,sin,SPS00,2014-10-15,2014,2010,NP00000 NP00000 Vaseline Fe Fc,NP00000 Vaseline Fe,NP00000 NP00000 Vaseline,Fe NP00000 NP00000 Vaseline,VMIP3S0 Fe NP00000 NP00000 Vaseline,Vaseline Fe Fc,Vaseline Fe Fc PR0CN000,Vaseline Fe Fc PR0CN000 VMIP3S0,"v for Vaseline ' ,",for Vaseline ',v for Vaseline,' v for Vaseline,desprender ' v for Vaseline,"Vaseline ' ,","Vaseline ' , que","Vaseline ' , que llegar"
http://jenesaispop.com/2014/10/14/205997/vaselines-v-vaselines/,jenesaispop.com,2014-10-15,===NONE===,Vaselines/NP00000/vaselines,"Pero  ,  en  un  balance  global  ,  '  V  For Vaselines  '  acaba  resultando  ganador  .",vaselines,np00000,vaselines,For,for,NP00000,V,v,NP00000,',',Fe,",",",",Fc,global,global,AQ0CS0,',',Fe,acaba,acabar,VMIP3S0,resultando,resultar,VMG0000,ganador,ganador,NCMS000,.,.,Fp,2014-10-15,2014,2010,NP00000 NP00000 Vaseline Fe VMIP3S0,NP00000 Vaseline Fe,NP00000 NP00000 Vaseline,Fe NP00000 NP00000 Vaseline,Fc Fe NP00000 NP00000 Vaseline,Vaseline Fe VMIP3S0,Vaseline Fe VMIP3S0 VMG0000,Vaseline Fe VMIP3S0 VMG0000 NCMS000,v for Vaseline ' acabar,for Vaseline ',v for Vaseline,' v for Vaseline,", ' v for Vaseline",Vaseline ' acabar,Vaseline ' acabar resultar,Vaseline ' acabar resultar ganador
http://www.diariopyme.cl/sabias-que-diez-corporaciones-controlan-casi-todo-lo-que-compras/prontus_diariopyme/2014-10-21/133102.html,diariopyme.cl,2014-10-21,Chile,Vaseline/NP00000/vaseline,"Entre  los  más  conocidos  están  :  Hellmann's  ,  Magnum  ,  Dove  ,  TRESemmé  , Vaseline  ,  Breeze  y  Pepsodent  . </doc>",vaseline,np00000,vaseline,",",",",Fc,TRESemmé,tresemmé,NP00000,",",",",Fc,Dove,dove,NP00000,",",",",Fc,",",",",Fc,Breeze,breeze,NP00000,y,y,CC,Pepsodent,pepsodent,NP00000,.,.,Fp,2014-10-21,2014,2010,NP00000 Fc Vaseline Fc NP00000,Fc Vaseline Fc,NP00000 Fc Vaseline,Fc NP00000 Fc Vaseline,NP00000 Fc NP00000 Fc Vaseline,Vaseline Fc NP00000,Vaseline Fc NP00000 CC,Vaseline Fc NP00000 CC NP00000,"tresemmé , Vaseline , breeze",", Vaseline ,","tresemmé , Vaseline",", tresemmé , Vaseline","dove , tresemmé , Vaseline","Vaseline , breeze","Vaseline , breeze y","Vaseline , breeze y pepsodent"
http://jenesaispop.com/2014/11/15/209554/el-noir-cachondo-de-vaselines/,jenesaispop.com,2014-11-15,===NONE===,Vaselines/NP00000/vaselines,<doc uri=http://jenesaispop.com/2014/11/15/209554/el-noir-cachondo-de-vaselines/ website=jenesaispop.com date=2014-11-15 source_country=> /el/DA0MS0 /noir/NCMS000 /cachondo/AQ0MS0 /de/SPS00 /the/NP00000 Vaselines ,vaselines,np00000,vaselines,The,the,NP00000,de,de,SPS00,cachondo,cachondo,AQ0MS0,noir,noir,NCMS000,El,el,DA0MS0,,,,,,,,,,,,,,,,2014-11-15,2014,2010,,,SPS00 NP00000 Vaseline,AQ0MS0 SPS00 NP00000 Vaseline,NCMS000 AQ0MS0 SPS00 NP00000 Vaseline,,,,,,de the Vaseline,cachondo de the Vaseline,noir cachondo de the Vaseline,,,
http://jenesaispop.com/2014/11/15/209554/el-noir-cachondo-de-vaselines/,jenesaispop.com,2014-11-15,===NONE===,Vaselines/NP00000/vaselines,'  V  for Vaselines  '  ha  sido  reclamado  por  algunos  de  nuestros  lectores  y  comentaristas  como  el  mejor  disco  de  la  carrera  del  grupo  .,vaselines,np00000,vaselines,for,for,NCMS000,V,v,NP00000,',',Fe,,,,,,,',',Fe,ha,haber,VAIP3S0,sido,ser,VSP00SM,reclamado,reclamar,VMP00SM,por,por,SPS00,2014-11-15,2014,2010,NP00000 NCMS000 Vaseline Fe VAIP3S0,NCMS000 Vaseline Fe,NP00000 NCMS000 Vaseline,Fe NP00000 NCMS000 Vaseline,,Vaseline Fe VAIP3S0,Vaseline Fe VAIP3S0 VSP00SM,Vaseline Fe VAIP3S0 VSP00SM VMP00SM,v for Vaseline ' haber,for Vaseline ',v for Vaseline,' v for Vaseline,,Vaseline ' haber,Vaseline ' haber ser,Vaseline ' haber ser reclamar
http://pulsoslp.com.mx/2015/02/19/kurt-cobain-es-recordado-con-un-documental-sobre-su-vida/,pulsoslp.com.mx,2015-02-19,Mexico,Vaselines/NP00000/vaselines,"Su  estilo  para  tocar  este  instrumento  se  vio  influenciado  por  Black  Sabbath  ,  Led  Zeppelin  ,  Queen  ,  Pixies  ,  Sex  Pistols  ,  Black  Flag  ,  Meat  Puppets  y  The Vaselines  .",vaselines,np00000,vaselines,The,the,NP00000,y,y,CC,Puppets,puppets,NP00000,Meat,meat,NP00000,",",",",Fc,.,.,Fp,,,,,,,,,,,,,2015-02-19,2015,2010,,NP00000 Vaseline Fp,CC NP00000 Vaseline,NP00000 CC NP00000 Vaseline,NP00000 NP00000 CC NP00000 Vaseline,,,,,the Vaseline .,y the Vaseline,puppets y the Vaseline,meat puppets y the Vaseline,,,
http://www.multivu.com/players/Spanish/7477351-jordana-brewster-pond-s-rejuveness/,multivu.com,2015-03-24,===NONE===,Vaseline/NP00000/vaseline,"Ives  ,  Suave  ,  TIGI  ,  TONI  &  GUY  Hair  Meet  Wardrobe  ,  TRESemmé  y Vaseline  .",vaseline,np00000,vaseline,y,y,CC,TRESemmé,tresemmé,NP00000,",",",",Fc,Wardrobe,wardrobe,NP00000,Meet,meet,NP00000,.,.,Fp,,,,,,,,,,,,,2015-03-24,2015,2010,,CC Vaseline Fp,NP00000 CC Vaseline,Fc NP00000 CC Vaseline,NP00000 Fc NP00000 CC Vaseline,,,,,y Vaseline .,tresemmé y Vaseline,", tresemmé y Vaseline","wardrobe , tresemmé y Vaseline",,,
http://pulsoslp.com.mx/2015/04/04/kurt-cobain-sera-recordado-con-documental-a-21-anos-de-su-muerte/,pulsoslp.com.mx,2015-04-04,Mexico,Vaselines/NP00000/vaselines,"Su  estilo  para  tocar  este  instrumento  se  vio  influenciado  por  Black  Sabbath  ,  Led  Zeppelin  ,  Queen  ,  Pixies  ,  Sex  Pistols  ,  Black  Flag  ,  Meat  Puppets  y  The Vaselines  .",vaselines,np00000,vaselines,The,the,NP00000,y,y,CC,Puppets,puppets,NP00000,Meat,meat,NP00000,",",",",Fc,.,.,Fp,,,,,,,,,,,,,2015-04-04,2015,2010,,NP00000 Vaseline Fp,CC NP00000 Vaseline,NP00000 CC NP00000 Vaseline,NP00000 NP00000 CC NP00000 Vaseline,,,,,the Vaseline .,y the Vaseline,puppets y the Vaseline,meat puppets y the Vaseline,,,
http://www.lavanguardia.com/cultura/20150428/54430903955/the-pastels-mercromina-y-the-vaselines-en-el-escenario-heineken-primavera.html,lavanguardia.com,2015-04-28,Spain,Vaselines/NP00000/vaselines,"<doc uri=http://www.lavanguardia.com/cultura/20150428/54430903955/the-pastels-mercromina-y-the-vaselines-en-el-escenario-heineken-primavera.html website=lavanguardia.com date=2015-04-28 source_country=Spain> /the/NP00000 /pastels/NP00000 /,/Fc /mercromina/NP00000 /y/CC /the/NP00000 Vaselines  ,  en  el  escenario  Heineken  Primavera",vaselines,np00000,vaselines,The,the,NP00000,y,y,CC,Mercromina,mercromina,NP00000,",",",",Fc,Pastels,pastels,NP00000,",",",",Fc,en,en,SPS00,el,el,DA0MS0,escenario,escenario,NCMS000,Heineken,heineken,NP00000,2015-04-28,2015,2010,CC NP00000 Vaseline Fc SPS00,NP00000 Vaseline Fc,CC NP00000 Vaseline,NP00000 CC NP00000 Vaseline,Fc NP00000 CC NP00000 Vaseline,Vaseline Fc SPS00,Vaseline Fc SPS00 DA0MS0,Vaseline Fc SPS00 DA0MS0 NCMS000,"y the Vaseline , en","the Vaseline ,",y the Vaseline,mercromina y the Vaseline,", mercromina y the Vaseline","Vaseline , en","Vaseline , en el","Vaseline , en el escenario"
http://www.lavanguardia.com/cultura/20150428/54430903955/the-pastels-mercromina-y-the-vaselines-en-el-escenario-heineken-primavera.html,lavanguardia.com,2015-04-28,Spain,Vaselines/NP00000/vaselines,"Barcelona  (  EFE  )  .  -  Artistas  como  The  Pastels  ,  Mercromina  o  The Vaselines  serán  algunos  de  los  seis  grupos  ,  nacionales  e  internacionales  ,  que  actuarán  en  el  escenario  Heineken  del  28  al  30  de  mayo  durante  el  festival  de  música  Primavera  Sound  2015  ,  que  se  celebrará  en  el  Parc  del  Fórum  de  Barcelona  .",vaselines,np00000,vaselines,The,the,NP00000,o,o,CC,Mercromina,mercromina,NP00000,",",",",Fc,Pastels,pastels,NP00000,serán,ser,VSIF3P0,algunos,alguno,PI0MP000,de,de,SPS00,los,el,DA0MP0,seis,6,Z,2015-04-28,2015,2010,CC NP00000 Vaseline VSIF3P0 PI0MP000,NP00000 Vaseline VSIF3P0,CC NP00000 Vaseline,NP00000 CC NP00000 Vaseline,Fc NP00000 CC NP00000 Vaseline,Vaseline VSIF3P0 PI0MP000,Vaseline VSIF3P0 PI0MP000 SPS00,Vaseline VSIF3P0 PI0MP000 SPS00 DA0MP0,o the Vaseline ser alguno,the Vaseline ser,o the Vaseline,mercromina o the Vaseline,", mercromina o the Vaseline",Vaseline ser alguno,Vaseline ser alguno de,Vaseline ser alguno de el
http://www.lavanguardia.com/cultura/20150428/54430903955/the-pastels-mercromina-y-the-vaselines-en-el-escenario-heineken-primavera.html,lavanguardia.com,2015-04-28,Spain,Vaselines/NP00000/vaselines,"El  30  de  mayo  subirán  al  escenario  The Vaselines  ,  originalmente  un  dúo  formado  por  Eugene  Kelly  y  Frances  McKee  ,  que  alcanzaron  el  estatus  de  banda  de  culto  gracias  al  apoyo  de  Kurt  Cobain  ,  que  versionó  dos  de  sus  temas  (  ""  Molly's  Lips  ""  y  ""  Jesus  Wants  Me  For  A  Sunbeam  ""  )  en  el  directo  desenchufado  de  Nirvana  ,  y  los  barceloneses  Mujeres  ,  que  acaban  de  editar  su  cuarto  disco  ,  titulado  ""  Marathon  ""  . </doc>",vaselines,np00000,vaselines,The,the,NP00000,escenario,escenario,NCMS000,al,a+el,SPS00+DA0MS0,subirán,subir,VMIF3P0,mayo,mayo,NCMS000,",",",",Fc,originalmente,originalmente,RG,un,uno,DI0MS0,dúo,dúo,NCMS000,formado,formar,VMP00SM,2015-04-28,2015,2010,NCMS000 NP00000 Vaseline Fc RG,NP00000 Vaseline Fc,NCMS000 NP00000 Vaseline,SPS00+DA0MS0 NCMS000 NP00000 Vaseline,VMIF3P0 SPS00+DA0MS0 NCMS000 NP00000 Vaseline,Vaseline Fc RG,Vaseline Fc RG DI0MS0,Vaseline Fc RG DI0MS0 NCMS000,"escenario the Vaseline , originalmente","the Vaseline ,",escenario the Vaseline,a+el escenario the Vaseline,subir a+el escenario the Vaseline,"Vaseline , originalmente","Vaseline , originalmente uno","Vaseline , originalmente uno dúo"
http://jenesaispop.com/2015/04/11/222846/los-bonsais-nordeste/,jenesaispop.com,2015-04-11,===NONE===,Vaselines/NP00000/vaselines,"Al  fin  y  al  cabo  ,  si  hay  algo  parecido  a  Escocia  (  patria  de  The Vaselines  ,  The  Jesus  &  Mary  Chain  o  The  Pastels  )  en  nuestro  país  ,  eso  es  Asturias  .",vaselines,np00000,vaselines,The,the,NP00000,de,de,SPS00,patria,patria,NCFS000,(,(,Fpa,Escocia,escocia,NP00000,",",",",Fc,The,the,NP00000,Jesus,jesus,NP00000,&,&,Fz,Mary,mary,NP00000,2015-04-11,2015,2010,SPS00 NP00000 Vaseline Fc NP00000,NP00000 Vaseline Fc,SPS00 NP00000 Vaseline,NCFS000 SPS00 NP00000 Vaseline,Fpa NCFS000 SPS00 NP00000 Vaseline,Vaseline Fc NP00000,Vaseline Fc NP00000 NP00000,Vaseline Fc NP00000 NP00000 Fz,"de the Vaseline , the","the Vaseline ,",de the Vaseline,patria de the Vaseline,( patria de the Vaseline,"Vaseline , the","Vaseline , the jesus","Vaseline , the jesus &"
http://jenesaispop.com/2015/04/28/224781/the-vaselines-the-pastels-y-battles-al-primavera-sound/,jenesaispop.com,2015-04-28,===NONE===,Vaselines/NP00000/vaselines,"<doc uri=http://jenesaispop.com/2015/04/28/224781/the-vaselines-the-pastels-y-battles-al-primavera-sound/ website=jenesaispop.com date=2015-04-28 source_country=> /the/NP00000 Vaselines  ,  The  Pastels  y  Battles  ,  al  Primavera  Sound",vaselines,np00000,vaselines,The,the,NP00000,,,,,,,,,,,,,",",",",Fc,The,the,NP00000,Pastels,pastels,NP00000,y,y,CC,Battles,battles,NP00000,2015-04-28,2015,2010,,NP00000 Vaseline Fc,,,,Vaseline Fc NP00000,Vaseline Fc NP00000 NP00000,Vaseline Fc NP00000 NP00000 CC,,"the Vaseline ,",,,,"Vaseline , the","Vaseline , the pastels","Vaseline , the pastels y"
http://jenesaispop.com/2015/04/28/224781/the-vaselines-the-pastels-y-battles-al-primavera-sound/,jenesaispop.com,2015-04-28,===NONE===,Vaselines/NP00000/vaselines,The Vaselines  ofrecieron  anoche  un  concierto  en  exclusiva  en  Madrid  para  un  selecto  grupo  de  invitados  .,vaselines,np00000,vaselines,The,the,NP00000,,,,,,,,,,,,,ofrecieron,ofrecer,VMIS3P0,anoche,anoche,RG,un,uno,DI0MS0,concierto,concierto,NCMS000,en,en,SPS00,2015-04-28,2015,2010,,NP00000 Vaseline VMIS3P0,,,,Vaseline VMIS3P0 RG,Vaseline VMIS3P0 RG DI0MS0,Vaseline VMIS3P0 RG DI0MS0 NCMS000,,the Vaseline ofrecer,,,,Vaseline ofrecer anoche,Vaseline ofrecer anoche uno,Vaseline ofrecer anoche uno concierto
http://jenesaispop.com/2015/04/28/224781/the-vaselines-the-pastels-y-battles-al-primavera-sound/,jenesaispop.com,2015-04-28,===NONE===,Vaselines/NP00000/vaselines,"El  sábado  30  actuarán  The Vaselines  y  Mujeres  ,  que  acaban  de  editar  el  excelente  '  Marathon  '  .",vaselines,np00000,vaselines,The,the,NP00000,actuarán,actuar,VMIF3P0,30,30,Z,sábado,sábado,NCMS000,El,el,DA0MS0,y,y,CC,Mujeres,mujeres,NP00000,",",",",Fc,que,que,PR0CN000,acaban,acabar,VMIP3P0,2015-04-28,2015,2010,VMIF3P0 NP00000 Vaseline CC NP00000,NP00000 Vaseline CC,VMIF3P0 NP00000 Vaseline,Z VMIF3P0 NP00000 Vaseline,NCMS000 Z VMIF3P0 NP00000 Vaseline,Vaseline CC NP00000,Vaseline CC NP00000 Fc,Vaseline CC NP00000 Fc PR0CN000,actuar the Vaseline y mujeres,the Vaseline y,actuar the Vaseline,30 actuar the Vaseline,sábado 30 actuar the Vaseline,Vaseline y mujeres,"Vaseline y mujeres ,","Vaseline y mujeres , que"
http://www.elmundo.es/cultura/2015/04/28/553fb051ca4741555c8b4576.html,elmundo.es,2015-04-28,Spain,Vaselines/NP00000/vaselines,"Por  último  ,  el  sábado  30  se  subirá  a  este  escenario  otro  mítico  grupo  llegado  de  Glasgow  :  The Vaselines  .",vaselines,np00000,vaselines,The,the,NP00000,:,:,Fd,Glasgow,glasgow,NP00000,de,de,SPS00,llegado,llegar,VMP00SM,.,.,Fp,,,,,,,,,,,,,2015-04-28,2015,2010,,NP00000 Vaseline Fp,Fd NP00000 Vaseline,NP00000 Fd NP00000 Vaseline,SPS00 NP00000 Fd NP00000 Vaseline,,,,,the Vaseline .,: the Vaseline,glasgow : the Vaseline,de glasgow : the Vaseline,,,
http://www.elmundo.es/cultura/2015/04/28/553fb051ca4741555c8b4576.html,elmundo.es,2015-04-28,Spain,Vaselines/NP00000/vaselines,En  2006  volvieron  a  los  escenarios  y  su  trabajo  más  reciente  se  titula  '  V  For Vaselines  '  .,vaselines,np00000,vaselines,For,for,NP00000,V,v,NP00000,',',Fe,titula,titular,VMIP3S0,se,se,P00CN000,',',Fe,.,.,Fp,,,,,,,,,,2015-04-28,2015,2010,NP00000 NP00000 Vaseline Fe Fp,NP00000 Vaseline Fe,NP00000 NP00000 Vaseline,Fe NP00000 NP00000 Vaseline,VMIP3S0 Fe NP00000 NP00000 Vaseline,Vaseline Fe Fp,,,v for Vaseline ' .,for Vaseline ',v for Vaseline,' v for Vaseline,titular ' v for Vaseline,Vaseline ' .,,
http://elpais.com/elpais/2015/05/04/icon/1430751274_063842.html?ref=rss&format=simple&link=link,elpais.com,2015-05-04,Spain,Vaselines/NP00000/vaselines,Un  plató  fotográfico  situado  en  el  tranquilo  barrio  madrileño  de  Iglesia  sirvió  el  pasado  lunes  como  escenario  para  el  primer  concierto  en  la  ciudad  de  los Vaselines  .,vaselines,np00000,vaselines,los,el,DA0MP0,de,de,SPS00,ciudad,ciudad,NCFS000,la,el,DA0FS0,en,en,SPS00,.,.,Fp,,,,,,,,,,,,,2015-05-04,2015,2010,,DA0MP0 Vaseline Fp,SPS00 DA0MP0 Vaseline,NCFS000 SPS00 DA0MP0 Vaseline,DA0FS0 NCFS000 SPS00 DA0MP0 Vaseline,,,,,el Vaseline .,de el Vaseline,ciudad de el Vaseline,el ciudad de el Vaseline,,,
http://elpais.com/elpais/2015/05/04/icon/1430751274_063842.html?ref=rss&format=simple&link=link,elpais.com,2015-05-04,Spain,Vaselines/NP00000/vaselines,"El  último  nombre  en  aparecer  fueron  The Vaselines  ,  tras  lo  cual  (  sorpresa  )  cayó  el  telón  y  los  escoceses  empezaron  a  tocar  .",vaselines,np00000,vaselines,The,the,NP00000,fueron,ser,VSIS3P0,aparecer,aparecer,VMN0000,en,en,SPS00,nombre,nombre,NCMS000,",",",",Fc,tras,tras,SPS00,lo,el,DA0NS0,cual,cual,PR0CS000,(,(,Fpa,2015-05-04,2015,2010,VSIS3P0 NP00000 Vaseline Fc SPS00,NP00000 Vaseline Fc,VSIS3P0 NP00000 Vaseline,VMN0000 VSIS3P0 NP00000 Vaseline,SPS00 VMN0000 VSIS3P0 NP00000 Vaseline,Vaseline Fc SPS00,Vaseline Fc SPS00 DA0NS0,Vaseline Fc SPS00 DA0NS0 PR0CS000,"ser the Vaseline , tras","the Vaseline ,",ser the Vaseline,aparecer ser the Vaseline,en aparecer ser the Vaseline,"Vaseline , tras","Vaseline , tras el","Vaseline , tras el cual"
http://elpais.com/elpais/2015/05/04/icon/1430751274_063842.html?ref=rss&format=simple&link=link,elpais.com,2015-05-04,Spain,Vaselines/NP00000/vaselines,Frances  McKee  y  Eugene  Kelly  fundaron  The Vaselines  en  Glasgow  en  1986  y  se  separaron  tres  años  más  tarde  tras  dos  EPs  y  un  álbum  que  recibieron  buenas  críticas  y  poco  más  .,vaselines,np00000,vaselines,The,the,NP00000,fundaron,fundar,VMIS3P0,Kelly,kelly,NP00000,Eugene,eugene,NP00000,y,y,CC,en,en,SPS00,Glasgow,glasgow,NP00000,en,en,SPS00,1986,1986,Z,y,y,CC,2015-05-04,2015,2010,VMIS3P0 NP00000 Vaseline SPS00 NP00000,NP00000 Vaseline SPS00,VMIS3P0 NP00000 Vaseline,NP00000 VMIS3P0 NP00000 Vaseline,NP00000 NP00000 VMIS3P0 NP00000 Vaseline,Vaseline SPS00 NP00000,Vaseline SPS00 NP00000 SPS00,Vaseline SPS00 NP00000 SPS00 Z,fundar the Vaseline en glasgow,the Vaseline en,fundar the Vaseline,kelly fundar the Vaseline,eugene kelly fundar the Vaseline,Vaseline en glasgow,Vaseline en glasgow en,Vaseline en glasgow en 1986
http://elpais.com/elpais/2015/05/04/icon/1430751274_063842.html?ref=rss&format=simple&link=link,elpais.com,2015-05-04,Spain,Vaselines/NP00000/vaselines,"El  último  ,  V  for Vaselines  (  2014  )  se  abre  con  High  Tide  Low  Tide  ,  la  canción  que  también  arrancó  la  actuación  en  Madrid  .",vaselines,np00000,vaselines,for,for,NCMS000,V,v,NP00000,",",",",Fc,último,último,AO0MS0,El,el,DA0MS0,(,(,Fpa,2014,2014,Z,),),Fpt,se,se,P00CN000,abre,abrir,VMIP3S0,2015-05-04,2015,2010,NP00000 NCMS000 Vaseline Fpa Z,NCMS000 Vaseline Fpa,NP00000 NCMS000 Vaseline,Fc NP00000 NCMS000 Vaseline,AO0MS0 Fc NP00000 NCMS000 Vaseline,Vaseline Fpa Z,Vaseline Fpa Z Fpt,Vaseline Fpa Z Fpt P00CN000,v for Vaseline ( 2014,for Vaseline (,v for Vaseline,", v for Vaseline","último , v for Vaseline",Vaseline ( 2014,Vaseline ( 2014 ),Vaseline ( 2014 ) se
http://elpais.com/elpais/2015/05/04/icon/1430751274_063842.html?ref=rss&format=simple&link=link,elpais.com,2015-05-04,Spain,Vaselines/NP00000/vaselines,"Entonces  sí  ,  The Vaselines  habían  acabado  como  Kurt  manda  .",vaselines,np00000,vaselines,The,the,NP00000,",",",",Fc,sí,sí,RG,Entonces,entonces,RG,,,,habían,haber,VAII3P0,acabado,acabar,VMP00SM,como,como,CS,Kurt,kurt,NP00000,manda,mandar,VMIP3S0,2015-05-04,2015,2010,Fc NP00000 Vaseline VAII3P0 VMP00SM,NP00000 Vaseline VAII3P0,Fc NP00000 Vaseline,RG Fc NP00000 Vaseline,RG RG Fc NP00000 Vaseline,Vaseline VAII3P0 VMP00SM,Vaseline VAII3P0 VMP00SM CS,Vaseline VAII3P0 VMP00SM CS NP00000,", the Vaseline haber acabar",the Vaseline haber,", the Vaseline","sí , the Vaseline","entonces sí , the Vaseline",Vaseline haber acabar,Vaseline haber acabar como,Vaseline haber acabar como kurt
