url,website,date,country,keyword,sentence,kw,kw_lemma,kw_pos,left_w1,left_l1,left_p1,left_w2,left_l2,left_p2,left_w3,left_l3,left_p3,left_w4,left_l4,left_p4,left_w5,left_l5,left_p5,right_w1,right_l1,right_p1,right_w2,right_l2,right_p2,right_w3,right_l3,right_p3,right_w4,right_l4,right_p4,right_w5,right_l5,right_p5,datetime,year,10years,pattern_around5,pattern_around3,pattern_left2,pattern_left3,pattern_left4,pattern_right2,pattern_right3,pattern_right4,pattern_around5_lex,pattern_around3_lex,pattern_left2_lex,pattern_left3_lex,pattern_left4_lex,pattern_right2_lex,pattern_right3_lex,pattern_right4_lex
http://www.espectador.com/cultura/317451/los-diarios-y-las-bandas-favoritas-del-zurdo-mas-famoso-de-seattle,espectador.com,2015-06-19,Uruguay,Vaselines/NP00000/vaselines,"En  las  entrevistas  Cobain  hablaba  de  intérpretes  relativamente  oscuros  para  el  público  general  como  The Vaselines  ,  The  Melvins  ,  Daniel  Johnston  ,  Meat  Puppets  ,  Young  Marble  Giants  ,  King  Crimson  ,  Wipers  ,  y  The  Raincoats  .",vaselines,np00000,vaselines,The,the,NP00000,como,como,CS,general,general,AQ0CS0,público,público,NCMS000,el,el,DA0MS0,",",",",Fc,The,the,NP00000,Melvins,melvins,NP00000,",",",",Fc,Daniel,daniel,NP00000,2015-06-19,2015,2010,CS NP00000 Vaseline Fc NP00000,NP00000 Vaseline Fc,CS NP00000 Vaseline,AQ0CS0 CS NP00000 Vaseline,NCMS000 AQ0CS0 CS NP00000 Vaseline,Vaseline Fc NP00000,Vaseline Fc NP00000 NP00000,Vaseline Fc NP00000 NP00000 Fc,"como the Vaseline , the","the Vaseline ,",como the Vaseline,general como the Vaseline,público general como the Vaseline,"Vaseline , the","Vaseline , the melvins","Vaseline , the melvins ,"
http://www.espectador.com/cultura/317451/los-diarios-y-las-bandas-favoritas-del-zurdo-mas-famoso-de-seattle,espectador.com,2015-06-19,Uruguay,Vaselines/NP00000/vaselines,"Además  ,  Cobain  convenció  a  discográficas  para  que  relanzaran  álbumes  de  The  Raincoats  (  Geffen  )  y  The Vaselines  (  Sub  Pop  )  .",vaselines,np00000,vaselines,The,the,NP00000,y,y,CC,),),Fpt,Geffen,geffen,NP00000,(,(,Fpa,(,(,Fpa,Sub,sub,NP00000,Pop,pop,NP00000,),),Fpt,.,.,Fp,2015-06-19,2015,2010,CC NP00000 Vaseline Fpa NP00000,NP00000 Vaseline Fpa,CC NP00000 Vaseline,Fpt CC NP00000 Vaseline,NP00000 Fpt CC NP00000 Vaseline,Vaseline Fpa NP00000,Vaseline Fpa NP00000 NP00000,Vaseline Fpa NP00000 NP00000 Fpt,y the Vaseline ( sub,the Vaseline (,y the Vaseline,) y the Vaseline,geffen ) y the Vaseline,Vaseline ( sub,Vaseline ( sub pop,Vaseline ( sub pop )
http://sevilla.abc.es/estilo/bulevarsur/noticias/belleza/cosmetica-para-bebes-que-productos-usar/?utm_source=abc&utm_medium=rss&utm_content=uh-rss&utm_campaign=traffic-rss,abc.es,2015-07-03,Spain,vaseline/NCMS000/vaseline,"Evita  los  aceites  de  almendras  cuya  etiqueta  indique  alguno  de  estos  compuestos  :  ""  mineral  oil  ""  ,  ""  paraffinum  ""  ,  ""  glycerin  ""  ,  "" vaseline  ""  o  ""  sodium  lauryl  ""  o  ""  laureth  sulphate  ""  .",vaseline,ncms000,vaseline,"""","""",Fe,",",",",Fc,"""","""",Fe,glycerin,glycerin,NCMS000,"""","""",Fe,"""","""",Fe,o,o,CC,"""","""",Fe,sodium,sodium,NCMS000,lauryl,lauryl,AQ0CS0,2015-07-03,2015,2010,Fc Fe Vaseline Fe CC,Fe Vaseline Fe,Fc Fe Vaseline,Fe Fc Fe Vaseline,NCMS000 Fe Fc Fe Vaseline,Vaseline Fe CC,Vaseline Fe CC Fe,Vaseline Fe CC Fe NCMS000,", "" Vaseline "" o",""" Vaseline """,", "" Vaseline",""" , "" Vaseline","glycerin "" , "" Vaseline","Vaseline "" o","Vaseline "" o ""","Vaseline "" o "" sodium"
http://jenesaispop.com/2015/07/01/230905/dmas-dmas/,jenesaispop.com,2015-07-01,===NONE===,Vaselines/NP00000/vaselines,"Todo  esto  está  muy  bien  ,  pero  es  realmente  cuando  DMA's  se  alejan  de  Blur  /  Oasis  ,  cuando  se  ponen  melancólicos  ,  cuando  me  gustan  más  .  '  Laced  '  tiende  al  macarreo  en  su  estribillo  ,  pero  sus  preciosos  acordes  iniciales  nos  hacen  pensar  en  los Vaselines  que  conquistaron  a  Kurt  Cobain  ,  incluso  en  Sarah  Records  o  gente  como  Big  Star  .",vaselines,np00000,vaselines,los,el,DA0MP0,en,en,SPS00,pensar,pensar,VMN0000,hacen,hacer,VMIP3P0,nos,nos,PP1CP000,que,que,PR0CN000,conquistaron,conquistar,VMIS3P0,a,a,SPS00,Kurt,kurt,NP00000,Cobain,cobain,NP00000,2015-07-01,2015,2010,SPS00 DA0MP0 Vaseline PR0CN000 VMIS3P0,DA0MP0 Vaseline PR0CN000,SPS00 DA0MP0 Vaseline,VMN0000 SPS00 DA0MP0 Vaseline,VMIP3P0 VMN0000 SPS00 DA0MP0 Vaseline,Vaseline PR0CN000 VMIS3P0,Vaseline PR0CN000 VMIS3P0 SPS00,Vaseline PR0CN000 VMIS3P0 SPS00 NP00000,en el Vaseline que conquistar,el Vaseline que,en el Vaseline,pensar en el Vaseline,hacer pensar en el Vaseline,Vaseline que conquistar,Vaseline que conquistar a,Vaseline que conquistar a kurt
http://tn.com.ar/musica/escucha-esto/en-el-nombre-de-kurt-foo-fighters-toco-mollys-lips-por-primera-vez_617860,tn.com.ar,2015-09-10,Argentina,Vaselines/NP00000/vaselines,"Los  Foo  Fighters  se  presentaron  anoche  en  Edinburgh  ,  ciudad  natal  de  los Vaselines  .",vaselines,np00000,vaselines,los,el,DA0MP0,de,de,SPS00,natal,natal,AQ0CS0,ciudad,ciudad,NCFS000,",",",",Fc,.,.,Fp,,,,,,,,,,,,,2015-09-10,2015,2010,,DA0MP0 Vaseline Fp,SPS00 DA0MP0 Vaseline,AQ0CS0 SPS00 DA0MP0 Vaseline,NCFS000 AQ0CS0 SPS00 DA0MP0 Vaseline,,,,,el Vaseline .,de el Vaseline,natal de el Vaseline,ciudad natal de el Vaseline,,,
http://tn.com.ar/musica/escucha-esto/en-el-nombre-de-kurt-foo-fighters-toco-mollys-lips-por-primera-vez_617860,tn.com.ar,2015-09-10,Argentina,Vaselines/NP00000/vaselines,"Tanto  así  que  en  1991  lanzaron  un  sencillo  con  su  versión  de  ""  Molly's  Lips  ""  (  junto  con  otro  tema  de  The  Fluid  )  ,  y  unos  años  más  tarde  tocaron  otro  cover  de  los Vaselines  en  el  MTV  Unplugged  ,  ""  Jesus  Doesn't  Want  Me  for  a  Sunbeam  ""  . </doc>",vaselines,np00000,vaselines,los,el,DA0MP0,de,de,SPS00,cover,cover,NCMS000,otro,otro,DI0MS0,tocaron,tocar,VMIS3P0,en,en,SPS00,el,el,DA0MS0,MTV,mtv,NP00000,Unplugged,unplugged,NP00000,",",",",Fc,2015-09-10,2015,2010,SPS00 DA0MP0 Vaseline SPS00 DA0MS0,DA0MP0 Vaseline SPS00,SPS00 DA0MP0 Vaseline,NCMS000 SPS00 DA0MP0 Vaseline,DI0MS0 NCMS000 SPS00 DA0MP0 Vaseline,Vaseline SPS00 DA0MS0,Vaseline SPS00 DA0MS0 NP00000,Vaseline SPS00 DA0MS0 NP00000 NP00000,de el Vaseline en el,el Vaseline en,de el Vaseline,cover de el Vaseline,otro cover de el Vaseline,Vaseline en el,Vaseline en el mtv,Vaseline en el mtv unplugged
http://peru21.pe/espectaculos/miley-cyrus-dara-concierto-donde-todos-esten-desnudos-hasta-publico-2229746,peru21.pe,2015-10-14,Peru,Vaseline/NP00000/vaseline,"The  Flaming  Lips  --  autores  de  canciones  como  ""  She  Don't  Use  Jelly  She  Uses Vaseline  ""  --  tienen  la  tradición  de  realizar  conciertos  con  muchos  colores  y  originalidades  ,  como  cuando  Wayne  Coyne  surfea  sobre  el  público  encerrado  en  un  balón  transparente  . </doc>",vaseline,np00000,vaseline,Uses,uses,NP00000,She,she,NP00000,Jelly,jelly,NP00000,Use,use,NP00000,Don't,don't,NP00000,"""","""",Fe,--,--,Fg,tienen,tener,VMIP3P0,la,el,DA0FS0,tradición,tradición,NCFS000,2015-10-14,2015,2010,NP00000 NP00000 Vaseline Fe Fg,NP00000 Vaseline Fe,NP00000 NP00000 Vaseline,NP00000 NP00000 NP00000 Vaseline,NP00000 NP00000 NP00000 NP00000 Vaseline,Vaseline Fe Fg,Vaseline Fe Fg VMIP3P0,Vaseline Fe Fg VMIP3P0 DA0FS0,"she uses Vaseline "" --","uses Vaseline """,she uses Vaseline,jelly she uses Vaseline,use jelly she uses Vaseline,"Vaseline "" --","Vaseline "" -- tener","Vaseline "" -- tener el"
http://www.prnewswire.com/news-releases/dove-hair-puso-fin-a-la-espera-de-emoticones-con-cabello-rizado-540058691.html,prnewswire.com,2015-11-04,United States,Vaseline/NP00000/vaseline,"Ives  ,  Suave  ,  TIGI  ,  TONI  &  GUY  Hair  Meet  Wardrobe  ,  TRESemmé  y Vaseline  .",vaseline,np00000,vaseline,y,y,CC,TRESemmé,tresemmé,NP00000,",",",",Fc,Wardrobe,wardrobe,NP00000,Meet,meet,NP00000,.,.,Fp,,,,,,,,,,,,,2015-11-04,2015,2010,,CC Vaseline Fp,NP00000 CC Vaseline,Fc NP00000 CC Vaseline,NP00000 Fc NP00000 CC Vaseline,,,,,y Vaseline .,tresemmé y Vaseline,", tresemmé y Vaseline","wardrobe , tresemmé y Vaseline",,,
http://www.deperu.com/abc/gramatica/2382/wifi-es-reconocido-como-termino-espanol,deperu.com,2015-11-16,===NONE===,Vaseline/NP00000/vaseline,"Así  ocurre  con  vaselina  (  que  procede  de  la  marca Vaseline  )  ,  celofán  (  de  Cellophane  )  ,  aspirina  (  de  Aspirin  )  o  clínex  (  de  Kleenex  )  .",vaseline,np00000,vaseline,marca,marca,NCFS000,la,el,DA0FS0,de,de,SPS00,procede,proceder,VMIP3S0,que,que,PR0CN000,),),Fpt,",",",",Fc,celofán,celofán,NCMS000,(,(,Fpa,de,de,SPS00,2015-11-16,2015,2010,DA0FS0 NCFS000 Vaseline Fpt Fc,NCFS000 Vaseline Fpt,DA0FS0 NCFS000 Vaseline,SPS00 DA0FS0 NCFS000 Vaseline,VMIP3S0 SPS00 DA0FS0 NCFS000 Vaseline,Vaseline Fpt Fc,Vaseline Fpt Fc NCMS000,Vaseline Fpt Fc NCMS000 Fpa,"el marca Vaseline ) ,",marca Vaseline ),el marca Vaseline,de el marca Vaseline,proceder de el marca Vaseline,"Vaseline ) ,","Vaseline ) , celofán","Vaseline ) , celofán ("
http://ccaa.elpais.com/ccaa/2015/11/19/madrid/1447957642_304053.html,elpais.com,2015-11-19,Spain,Vaselines/NP00000/vaselines,"El  mallorquín  Joan  Vich  lo  ve  clarísimo  :  puede  que  las  chavalas  no  sean  unas  virtuosas  ,  pero  practican  ese  punk  directo  y  travieso  que  maravillaba  al  joven  Kurt  Cobain  y  han  encarnado  The Vaselines  o  The  Pastels  .",vaselines,np00000,vaselines,The,the,NP00000,encarnado,encarnar,VMP00SM,han,haber,VAIP3P0,y,y,CC,Cobain,cobain,NP00000,o,o,CC,The,the,NP00000,Pastels,pastels,NP00000,.,.,Fp,,,,2015-11-19,2015,2010,VMP00SM NP00000 Vaseline CC NP00000,NP00000 Vaseline CC,VMP00SM NP00000 Vaseline,VAIP3P0 VMP00SM NP00000 Vaseline,CC VAIP3P0 VMP00SM NP00000 Vaseline,Vaseline CC NP00000,Vaseline CC NP00000 NP00000,Vaseline CC NP00000 NP00000 Fp,encarnar the Vaseline o the,the Vaseline o,encarnar the Vaseline,haber encarnar the Vaseline,y haber encarnar the Vaseline,Vaseline o the,Vaseline o the pastels,Vaseline o the pastels .
http://www.prnewswire.com/news-releases/repara-el-cabello-danado-con-la-ultima-solucion-de-dove-advanced-hair-series-565897491.html,prnewswire.com,2016-01-20,United States,Vaseline/NP00000/vaseline,"Ives  ,  Suave  ,  Talenti  Gelato  &  Sorbetto  ,  TIGI  ,  TONI  &  GUY  Hair  Meet  Wardrobe  ,  TRESemmé  y Vaseline  .",vaseline,np00000,vaseline,y,y,CC,TRESemmé,tresemmé,NP00000,",",",",Fc,Wardrobe,wardrobe,NP00000,Meet,meet,NP00000,.,.,Fp,,,,,,,,,,,,,2016-01-20,2016,2010,,CC Vaseline Fp,NP00000 CC Vaseline,Fc NP00000 CC Vaseline,NP00000 Fc NP00000 CC Vaseline,,,,,y Vaseline .,tresemmé y Vaseline,", tresemmé y Vaseline","wardrobe , tresemmé y Vaseline",,,
http://www.pagina12.com.ar/diario/suplementos/radar/9-11220-2016-01-24.html,pagina12.com.ar,2016-01-24,Argentina,Vaselines/NP00000/vaselines,"Influenciados  por  Pixies  ,  Pavement  ,  Guided  by  Voices  ,  Sonic  Youth  ,  Jesus  and  Mary  Chain  ,  The  Pastels  ,  The Vaselines  ,  Galaxie  500  ,  pero  también  por  Violeta  Parra  ,  Silvio  Rodriguez  ,  Eduardo  Mateo  ,  Nick  Drake  ,  Embajada  Boliviana  ,  Los  Peligrosos  Gorriones  y  Flema  ,  Valentín  y  Los  Volcanes  encontraron  para  sus  primeros  discos  otra  clase  de  inspiraciones  :  ""  Puedo  decir  que  en  nuestros  discos  de  estudio  fue  mayor  la  influencia  literaria  que  la  musical  .",vaselines,np00000,vaselines,The,the,NP00000,",",",",Fc,Pastels,pastels,NP00000,The,the,NP00000,",",",",Fc,",",",",Fc,Galaxie,galaxie,NP00000,500,500,Z,",",",",Fc,pero,pero,CC,2016-01-24,2016,2010,Fc NP00000 Vaseline Fc NP00000,NP00000 Vaseline Fc,Fc NP00000 Vaseline,NP00000 Fc NP00000 Vaseline,NP00000 NP00000 Fc NP00000 Vaseline,Vaseline Fc NP00000,Vaseline Fc NP00000 Z,Vaseline Fc NP00000 Z Fc,", the Vaseline , galaxie","the Vaseline ,",", the Vaseline","pastels , the Vaseline","the pastels , the Vaseline","Vaseline , galaxie","Vaseline , galaxie 500","Vaseline , galaxie 500 ,"
http://www.merca20.com/labios-gigantes-para-un-experimento-climatico-extremo/,merca20.com,2016-02-05,===NONE===,Vaseline/NP00000/vaseline,"Reino  Unido  .  -  de  forma  más  que  ilustrativa  , Vaseline  UK  ha  llevado  a  cabo  esta  acción  en  la  que  dos  pares  de  labios  gigantes  han  sido  enviados  a  recorrer  los  más  diversos  parajes  de  Reino  Unido  mientras  actúan  las  inclemencias  del  tiempo  según  la  protección  que  lleven  .",vaseline,np00000,vaseline,",",",",Fc,ilustrativa,ilustrativo,AQ0FS0,que,que,CS,más,más,RG,forma,forma,NCFS000,UK,uk,NP00000,ha,haber,VAIP3S0,llevado,llevar,VMP00SM,a,a,SPS00,cabo,cabo,NCMS000,2016-02-05,2016,2010,AQ0FS0 Fc Vaseline NP00000 VAIP3S0,Fc Vaseline NP00000,AQ0FS0 Fc Vaseline,CS AQ0FS0 Fc Vaseline,RG CS AQ0FS0 Fc Vaseline,Vaseline NP00000 VAIP3S0,Vaseline NP00000 VAIP3S0 VMP00SM,Vaseline NP00000 VAIP3S0 VMP00SM SPS00,"ilustrativo , Vaseline uk haber",", Vaseline uk","ilustrativo , Vaseline","que ilustrativo , Vaseline","más que ilustrativo , Vaseline",Vaseline uk haber,Vaseline uk haber llevar,Vaseline uk haber llevar a
http://www.merca20.com/labios-gigantes-para-un-experimento-climatico-extremo/,merca20.com,2016-02-05,===NONE===,Vaseline/NP00000/vaseline,"Claro  esta  que  una  mostraba  su  estado  natural  y  la  segunda  ,  su  mantenimiento  gracias  al  producto Vaseline  Lip  Therapy  ,  durante  el  periodo  de  cinco  días  que  duró  el  recorrido  de  camión  con  las  vallas  '  labiales  '  . </doc>",vaseline,np00000,vaseline,producto,producto,NCMS000,al,a+el,SPS00+DA0MS0,gracias,gracia,NCFP000,mantenimiento,mantenimiento,NCMS000,su,su,DP3CS0,Lip,lip,NP00000,Therapy,therapy,NP00000,",",",",Fc,durante,durante,SPS00,el,el,DA0MS0,2016-02-05,2016,2010,SPS00+DA0MS0 NCMS000 Vaseline NP00000 NP00000,NCMS000 Vaseline NP00000,SPS00+DA0MS0 NCMS000 Vaseline,NCFP000 SPS00+DA0MS0 NCMS000 Vaseline,NCMS000 NCFP000 SPS00+DA0MS0 NCMS000 Vaseline,Vaseline NP00000 NP00000,Vaseline NP00000 NP00000 Fc,Vaseline NP00000 NP00000 Fc SPS00,a+el producto Vaseline lip therapy,producto Vaseline lip,a+el producto Vaseline,gracia a+el producto Vaseline,mantenimiento gracia a+el producto Vaseline,Vaseline lip therapy,"Vaseline lip therapy ,","Vaseline lip therapy , durante"
http://jenesaispop.com/2016/02/17/252463/la-calmada-madurez-de-sr-chinarro-en-efectos-especiales/,jenesaispop.com,2016-02-17,===NONE===,Vaselines/NP00000/vaselines,"Se  trata  de  un  gran  medio  tiempo  muestra  de  la  madurez  de  Antonio  Luque  exhibida  particularmente  desde  los  fantásticos  '  El  fuego  amigo  '  y  '  El  mundo  según  '  a  mediados  de  la  década  pasada  -  ese  sutil  crescendo  ,  esa  incorporación  de  arreglos  -  ,  manteniéndose  en  los  punteos  cerca  de  la  tradición  indie  pop  ,  de  los  primeros Vaselines  a  The  La's  pasando  por  Teenage  Fanclub  .",vaselines,np00000,vaselines,primeros,1,AO0MP0,los,el,DA0MP0,de,de,SPS00,",",",",Fc,pop,pop,NCMS000,a,a,SPS00,The,the,NP00000,La's,la's,NP00000,pasando,pasar,VMG0000,por,por,SPS00,2016-02-17,2016,2010,DA0MP0 AO0MP0 Vaseline SPS00 NP00000,AO0MP0 Vaseline SPS00,DA0MP0 AO0MP0 Vaseline,SPS00 DA0MP0 AO0MP0 Vaseline,Fc SPS00 DA0MP0 AO0MP0 Vaseline,Vaseline SPS00 NP00000,Vaseline SPS00 NP00000 NP00000,Vaseline SPS00 NP00000 NP00000 VMG0000,el 1 Vaseline a the,1 Vaseline a,el 1 Vaseline,de el 1 Vaseline,", de el 1 Vaseline",Vaseline a the,Vaseline a the la's,Vaseline a the la's pasar
http://pulsoslp.com.mx/2016/02/19/kurt-cobain-es-recordado-en-redes-sociales-con-cancion-a-capela/,pulsoslp.com.mx,2016-02-19,Mexico,Vaselines/NP00000/vaselines,"Su  estilo  para  tocar  este  instrumento  se  vio  influenciado  por  Black  Sabbath  ,  Led  Zeppelin  ,  Queen  ,  Pixies  ,  Sex  Pistols  ,  Black  Flag  ,  Meat  Puppets  y  The Vaselines  .",vaselines,np00000,vaselines,The,the,NP00000,y,y,CC,Puppets,puppets,NP00000,Meat,meat,NP00000,",",",",Fc,.,.,Fp,,,,,,,,,,,,,2016-02-19,2016,2010,,NP00000 Vaseline Fp,CC NP00000 Vaseline,NP00000 CC NP00000 Vaseline,NP00000 NP00000 CC NP00000 Vaseline,,,,,the Vaseline .,y the Vaseline,puppets y the Vaseline,meat puppets y the Vaseline,,,
http://caracol.com.co/radio/2016/02/20/entretenimiento/1456000945_651200.html,caracol.com.co,2016-02-21,Colombia,Vaselines/NP00000/vaselines,"Pero  la  magia  de  su  música  empezó  en  su  adolescencia  cuando  le  regalaron  una  guitarra  y  desarrolló  su  habilidad  musical  bajo  influencias  de  grupos  como  Pixies  ,  L7  ,  Queen  ,  Sex  Pistols  ,  The Vaselines  ,  incluso  Black  Sabbath  .",vaselines,np00000,vaselines,The,the,NP00000,",",",",Fc,Pistols,pistols,NP00000,Sex,sex,NP00000,",",",",Fc,",",",",Fc,incluso,incluso,RG,Black,black,NP00000,Sabbath,sabbath,NP00000,.,.,Fp,2016-02-21,2016,2010,Fc NP00000 Vaseline Fc RG,NP00000 Vaseline Fc,Fc NP00000 Vaseline,NP00000 Fc NP00000 Vaseline,NP00000 NP00000 Fc NP00000 Vaseline,Vaseline Fc RG,Vaseline Fc RG NP00000,Vaseline Fc RG NP00000 NP00000,", the Vaseline , incluso","the Vaseline ,",", the Vaseline","pistols , the Vaseline","sex pistols , the Vaseline","Vaseline , incluso","Vaseline , incluso black","Vaseline , incluso black sabbath"
http://informe21.com/salud-y-bienestar/tratamientos-caseros-generalmente-pueden-sanar-talones-secos-y-agrietados,informe21.com,2016-03-08,United States,Vaseline/NP00000/vaseline,"Después  de  hacerlo  ,  use  una  esponja  vegetal  o  un  estropajo  para  pies  y  luego  cubra  los  talones  con  un  ungüento  a  base  de  vaselina  ,  como Vaseline  ®  o  Aquaphor  ®  .",vaseline,np00000,vaseline,como,como,CS,",",",",Fc,vaselina,vaselina,NCFS000,de,de,SPS00,base,base,NCCS000,®,®,Fz,o,o,CC,Aquaphor,aquaphor,NP00000,®,®,Fz,.,.,Fp,2016-03-08,2016,2010,Fc CS Vaseline Fz CC,CS Vaseline Fz,Fc CS Vaseline,NCFS000 Fc CS Vaseline,SPS00 NCFS000 Fc CS Vaseline,Vaseline Fz CC,Vaseline Fz CC NP00000,Vaseline Fz CC NP00000 Fz,", como Vaseline ® o",como Vaseline ®,", como Vaseline","vaselina , como Vaseline","de vaselina , como Vaseline",Vaseline ® o,Vaseline ® o aquaphor,Vaseline ® o aquaphor ®
http://www.vanguardia.com.mx/articulo/cuando-el-grunge-lloro-22-anos-sin-kurt-cobain,vanguardia.com.mx,2016-04-05,Mexico,Vaselines/NP00000/vaselines,"Su  estilo  para  tocar  este  instrumento  se  vio  influenciado  por  Black  Sabbath  ,  Led  Zeppelin  ,  Queen  ,  Pixies  ,  Sex  Pistols  ,  Black  Flag  ,  Meat  Puppets  y  The Vaselines  .",vaselines,np00000,vaselines,The,the,NP00000,y,y,CC,Puppets,puppets,NP00000,Meat,meat,NP00000,",",",",Fc,.,.,Fp,,,,,,,,,,,,,2016-04-05,2016,2010,,NP00000 Vaseline Fp,CC NP00000 Vaseline,NP00000 CC NP00000 Vaseline,NP00000 NP00000 CC NP00000 Vaseline,,,,,the Vaseline .,y the Vaseline,puppets y the Vaseline,meat puppets y the Vaseline,,,
http://vidayestilo.terra.com/moda/dove-hair-busca-ampliar-el-concepto-de-lo-que-es-cabello-hermoso%2C7bd9cecf8945141b8682bf2e91547b1b5bn5tedg.html,terra.com,2016-04-21,===NONE===,Vaseline/NP00000/vaseline,"Ives  ,  Suave  ,  Talenti  Gelato  &  Sorbetto  ,  TIGI  ,  TONI  &  GUY  Hair  Meet  Wardrobe  ,  TRESemmé  y Vaseline  .",vaseline,np00000,vaseline,y,y,CC,TRESemmé,tresemmé,NP00000,",",",",Fc,Wardrobe,wardrobe,NP00000,Meet,meet,NP00000,.,.,Fp,,,,,,,,,,,,,2016-04-21,2016,2010,,CC Vaseline Fp,NP00000 CC Vaseline,Fc NP00000 CC Vaseline,NP00000 Fc NP00000 CC Vaseline,,,,,y Vaseline .,tresemmé y Vaseline,", tresemmé y Vaseline","wardrobe , tresemmé y Vaseline",,,
http://www.univision.com/estilo-de-vida/belleza/los-dos-grandes-aliados-de-belleza-de-marilyn-monroe,univision.com,2016-06-01,===NONE===,vaseline/NCMS000/vaseline,La  piel  de  la  actriz  se  mantenía  humectada  gracias  a  la vaseline  que  Snyder  aplicaba  antes  de  la  base  de  maquillaje  .,vaseline,ncms000,vaseline,la,el,DA0FS0,a,a,SPS00,gracias,gracia,NCFP000,humectada,humectar,VMP00SF,mantenía,mantener,VMII3S0,que,que,PR0CN000,Snyder,snyder,NP00000,aplicaba,aplicar,VMII3S0,antes,antes,RG,de,de,SPS00,2016-06-01,2016,2010,SPS00 DA0FS0 Vaseline PR0CN000 NP00000,DA0FS0 Vaseline PR0CN000,SPS00 DA0FS0 Vaseline,NCFP000 SPS00 DA0FS0 Vaseline,VMP00SF NCFP000 SPS00 DA0FS0 Vaseline,Vaseline PR0CN000 NP00000,Vaseline PR0CN000 NP00000 VMII3S0,Vaseline PR0CN000 NP00000 VMII3S0 RG,a el Vaseline que snyder,el Vaseline que,a el Vaseline,gracia a el Vaseline,humectar gracia a el Vaseline,Vaseline que snyder,Vaseline que snyder aplicar,Vaseline que snyder aplicar antes
http://www.montevideo.com.uy/contenido/Musica-sin-enemigos-25-anos-del-Nevermind-de-Nirvana-321800,montevideo.com.uy,2016-09-29,Uruguay,Vaselines/NP00000/vaselines,"Y  lo  mismo  pasaba  con  otras  influencias  directas  y  menos  conocidas  para  la  mayor  parte  de  la  gente  como  The Vaselines  ,  Meat  Puppets  o  Melvins  .",vaselines,np00000,vaselines,The,the,NP00000,como,como,CS,gente,gente,NCFS000,la,el,DA0FS0,de,de,SPS00,",",",",Fc,Meat,meat,NP00000,Puppets,puppets,NP00000,o,o,CC,Melvins,melvins,NP00000,2016-09-29,2016,2010,CS NP00000 Vaseline Fc NP00000,NP00000 Vaseline Fc,CS NP00000 Vaseline,NCFS000 CS NP00000 Vaseline,DA0FS0 NCFS000 CS NP00000 Vaseline,Vaseline Fc NP00000,Vaseline Fc NP00000 NP00000,Vaseline Fc NP00000 NP00000 CC,"como the Vaseline , meat","the Vaseline ,",como the Vaseline,gente como the Vaseline,el gente como the Vaseline,"Vaseline , meat","Vaseline , meat puppets","Vaseline , meat puppets o"
https://deportes.terra.cl/futbol/primera-division/palestino-se-enreda-y-se-deja-remontar-por-ohiggins%2C29bfdb125348121edcf2048af55b6c0anbxkhuhf.html,terra.cl,2016-10-31,Chile,vaseline/NCMS000/vaseline,"Tuvo  premio  y  se  alzó  como  uno  de  las  figures  ,  por  su  participación  en  la  apertura  de  la  cuenta  ,  con  un  tiro  libre  en  el  que  Miguel  Pinto  concede  rebote  ,  así  como  por  la  delicada vaseline  en  el  complemento",vaseline,ncms000,vaseline,delicada,delicado,AQ0FS0,la,el,DA0FS0,por,por,SPS00,como,como,CS,así,así,RG,en,en,SPS00,el,el,DA0MS0,complemento,complemento,NCMS000,,,,,,,2016-10-31,2016,2010,DA0FS0 AQ0FS0 Vaseline SPS00 DA0MS0,AQ0FS0 Vaseline SPS00,DA0FS0 AQ0FS0 Vaseline,SPS00 DA0FS0 AQ0FS0 Vaseline,CS SPS00 DA0FS0 AQ0FS0 Vaseline,Vaseline SPS00 DA0MS0,Vaseline SPS00 DA0MS0 NCMS000,,el delicado Vaseline en el,delicado Vaseline en,el delicado Vaseline,por el delicado Vaseline,como por el delicado Vaseline,Vaseline en el,Vaseline en el complemento,
http://www.latercera.com/noticia/la-ultima-barrera-cayo-hip-hop/,latercera.com,2017-01-03,Chile,vaseline/NCMS000/vaseline,"Ice  Cube  se  refería  con  una  serie  de  epítetos  homofóbicos  a  sus  ex  compañeros  de  N.W.A.  en  No vaseline  (  1991  )  ;  Tupac  Shakur  ridiculizaba  el  peso  de  The  Notorious  B.I.G.  y  aseguraba  haberse  acostado  con  su  novia  -  de  forma  bastante  misógina  -  en  Hit  '  em  up  (  1996  )  ,  y  Jay-Z  se  burlaba  del  rapero  Prodigy  por  tomar  clases  de  ballet  en  Takeover  (  2001  )  .",vaseline,ncms000,vaseline,No,no,NP00000,en,en,SPS00,N.W.A.,n.w.a.,NP00000,de,de,SPS00,compañeros,compañero,NCMP000,(,(,Fpa,1991,1991,Z,),),Fpt,;,;,Fx,Tupac,tupac,NP00000,2017-01-03,2017,2010,SPS00 NP00000 Vaseline Fpa Z,NP00000 Vaseline Fpa,SPS00 NP00000 Vaseline,NP00000 SPS00 NP00000 Vaseline,SPS00 NP00000 SPS00 NP00000 Vaseline,Vaseline Fpa Z,Vaseline Fpa Z Fpt,Vaseline Fpa Z Fpt Fx,en no Vaseline ( 1991,no Vaseline (,en no Vaseline,n.w.a. en no Vaseline,de n.w.a. en no Vaseline,Vaseline ( 1991,Vaseline ( 1991 ),Vaseline ( 1991 ) ;
http://jenesaispop.com/2017/01/10/285605/kokoshca-somos-perdedores-riendonos/,jenesaispop.com,2017-01-10,===NONE===,Vaselines/NP00000/vaselines,"Sientes  algo  ,  lees  cosas  de  Kurt  Cobain  ,  él  aprovechó  su  fama  para  divulgar  a  Sonic  Youth  y  a  The Vaselines  .",vaselines,np00000,vaselines,The,the,NP00000,a,a,SPS00,y,y,CC,Youth,youth,NP00000,Sonic,sonic,NP00000,.,.,Fp,,,,,,,,,,,,,2017-01-10,2017,2010,,NP00000 Vaseline Fp,SPS00 NP00000 Vaseline,CC SPS00 NP00000 Vaseline,NP00000 CC SPS00 NP00000 Vaseline,,,,,the Vaseline .,a the Vaseline,y a the Vaseline,youth y a the Vaseline,,,
http://jenesaispop.com/2017/02/02/288082/la-mejor-forma-celebrar-lo-habrian-los-50-anos-kurt-cobain/,jenesaispop.com,2017-02-02,===NONE===,Vaselines/NP00000/vaselines,"Su  suicidio  en  1994  marcó  a  toda  una  generación  que  todavía  recuerda  y  venera  los  tres  álbumes  de  Nirvana  -  muy  especialmente  el  segundo  ,  por  supuesto  ,  '  Nevermind  '  -  y  su  carismático  '  MTV  Unplugged  '  ,  así  como  su  gusto  por  rescatar  del  underground  a  artistas  desconocidos  como  The Vaselines  o  Bikini  Kill  ,  de  los  que  aún  hablamos  de  vez  en  cuando  hoy  .",vaselines,np00000,vaselines,The,the,NP00000,como,como,CS,desconocidos,desconocer,VMP00PM,artistas,artista,NCCP000,a,a,SPS00,o,o,CC,Bikini,bikini,NP00000,Kill,kill,NP00000,",",",",Fc,de,de,SPS00,2017-02-02,2017,2010,CS NP00000 Vaseline CC NP00000,NP00000 Vaseline CC,CS NP00000 Vaseline,VMP00PM CS NP00000 Vaseline,NCCP000 VMP00PM CS NP00000 Vaseline,Vaseline CC NP00000,Vaseline CC NP00000 NP00000,Vaseline CC NP00000 NP00000 Fc,como the Vaseline o bikini,the Vaseline o,como the Vaseline,desconocer como the Vaseline,artista desconocer como the Vaseline,Vaseline o bikini,Vaseline o bikini kill,"Vaseline o bikini kill ,"
http://www.military-technologies.net/2017/02/08/tresemme-firma-contrato-con-justine-marjan-estilista-de-las-celebridades-como-estilista-global/,military-technologies.net,2017-02-08,===NONE===,Vaseline/NP00000/vaseline,"Ives  ,  Suave  ,  Talenti  Gelato  &  Sorbetto  ,  TIGI  ,  TONI  &  GUY  ,  TRESemmé  y Vaseline  .",vaseline,np00000,vaseline,y,y,CC,TRESemmé,tresemmé,NP00000,",",",",Fc,GUY,guy,NP00000,&,&,Fz,.,.,Fp,,,,,,,,,,,,,2017-02-08,2017,2010,,CC Vaseline Fp,NP00000 CC Vaseline,Fc NP00000 CC Vaseline,NP00000 Fc NP00000 CC Vaseline,,,,,y Vaseline .,tresemmé y Vaseline,", tresemmé y Vaseline","guy , tresemmé y Vaseline",,,
