url,website,date,country,keyword,sentence,kw,kw_lemma,kw_pos,left_w1,left_l1,left_p1,left_w2,left_l2,left_p2,left_w3,left_l3,left_p3,left_w4,left_l4,left_p4,left_w5,left_l5,left_p5,right_w1,right_l1,right_p1,right_w2,right_l2,right_p2,right_w3,right_l3,right_p3,right_w4,right_l4,right_p4,right_w5,right_l5,right_p5,datetime,year,10years,pattern_around5,pattern_around3,pattern_left2,pattern_left3,pattern_left4,pattern_right2,pattern_right3,pattern_right4,pattern_around5_lex,pattern_around3_lex,pattern_left2_lex,pattern_left3_lex,pattern_left4_lex,pattern_right2_lex,pattern_right3_lex,pattern_right4_lex
https://eju.tv/2020/06/brigadas-moviles-realizaran-pruebas-rapidas-de-coronavirus-y-distribuiran-medicamentos-en-chuquisaca/,eju.tv,2020-06-29,Tuvalu,aspirineta/NCFS00D/aspirina,"""  Este  equipo  del  personal  de  salud  va  a  visitar  los  domicilios  teniendo  las  pruebas  rápidas  y  un  kit  de  medicamentos  para  otorgarle  al  paciente  ,  el  cual  consiste  en  ivermectina  ,  dióxido  de  cloro  ,  ibuprofeno  , aspirineta  de  100  miligramos  ,  dexametasona  ,  azitromicina  ,  vitaminas  A  ,  D  y  zinc  ,  que  son  los  elementos  básicos  para  contener  el  COVID  .",aspirineta,ncfs00d,aspirina,",",",",Fc,ibuprofeno,ibuprofeno,NCMS000,",",",",Fc,cloro,cloro,NCMN000,de,de,SPS00,de,de,SPS00,100,100,Z,miligramos,miligramo,NCMP000,",",",",Fc,dexametasona,dexametasona,NCFS000,2020-06-29,2020,2020,NCMS000 Fc Aspirine SPS00 Z,Fc Aspirine SPS00,NCMS000 Fc Aspirine,Fc NCMS000 Fc Aspirine,NCMN000 Fc NCMS000 Fc Aspirine,Aspirine SPS00 Z,Aspirine SPS00 Z NCMP000,Aspirine SPS00 Z NCMP000 Fc,"ibuprofeno , Aspirine de 100",", Aspirine de","ibuprofeno , Aspirine",", ibuprofeno , Aspirine","cloro , ibuprofeno , Aspirine",Aspirine de 100,Aspirine de 100 miligramo,"Aspirine de 100 miligramo ,"
https://www.paginasiete.bo/sociedad/2020/6/29/sedes-chuquisaca-incluye-el-dioxido-de-cloro-en-el-kit-de-medicamentos-para-covid-19-259802.html,paginasiete.bo,2020-06-29,"Bolivia, Plurinational State of",aspirinetas/NCFP00D/aspirina,"Se  debe  aplicar  medicamentos  como  la  ivermectina  ,  el  Dióxido  de  Cloro  , aspirinetas  y  otros  que  van  a  estar  en  un  kit  ""  ,  sostuvo  el  director  del  Sedes  de  Chuquisaca  ,  Enrique  Leaño  a  Unitel  .",aspirinetas,ncfp00d,aspirina,",",",",Fc,Cloro,cloro,NP00000,de,de,SPS00,Dióxido,dióxido,NP00000,el,el,DA0MS0,y,y,CC,otros,otro,PI0MP000,que,que,PR0CN000,van,ir,VMIP3P0,a,a,SPS00,2020-06-29,2020,2020,NP00000 Fc Aspirine CC PI0MP000,Fc Aspirine CC,NP00000 Fc Aspirine,SPS00 NP00000 Fc Aspirine,NP00000 SPS00 NP00000 Fc Aspirine,Aspirine CC PI0MP000,Aspirine CC PI0MP000 PR0CN000,Aspirine CC PI0MP000 PR0CN000 VMIP3P0,"cloro , Aspirine y otro",", Aspirine y","cloro , Aspirine","de cloro , Aspirine","dióxido de cloro , Aspirine",Aspirine y otro,Aspirine y otro que,Aspirine y otro que ir
https://www.paginasiete.bo/sociedad/2020/6/29/sedes-chuquisaca-incluye-el-dioxido-de-cloro-en-el-kit-de-medicamentos-para-covid-19-259802.html,paginasiete.bo,2020-06-29,"Bolivia, Plurinational State of",aspirineta/NCFS00D/aspirina,"Los  otros  medicamentos  que  serán  parte  del  kit  son  :  ibuprofeno  , aspirineta  de  100  miligramos  ,  dexametasona  ,  azitromicina  ,  vitamina  A  y  D  y  zinc  .",aspirineta,ncfs00d,aspirina,",",",",Fc,ibuprofeno,ibuprofeno,NCMS000,:,:,Fd,son,ser,VSIP3P0,kit,kit,NCMS000,de,de,SPS00,100,100,Z,miligramos,miligramo,NCMP000,",",",",Fc,dexametasona,dexametasona,NCFS000,2020-06-29,2020,2020,NCMS000 Fc Aspirine SPS00 Z,Fc Aspirine SPS00,NCMS000 Fc Aspirine,Fd NCMS000 Fc Aspirine,VSIP3P0 Fd NCMS000 Fc Aspirine,Aspirine SPS00 Z,Aspirine SPS00 Z NCMP000,Aspirine SPS00 Z NCMP000 Fc,"ibuprofeno , Aspirine de 100",", Aspirine de","ibuprofeno , Aspirine",": ibuprofeno , Aspirine","ser : ibuprofeno , Aspirine",Aspirine de 100,Aspirine de 100 miligramo,"Aspirine de 100 miligramo ,"
https://www.rionegro.com.ar/el-banco-de-sangre-requiere-voluntarios-para-las-cirugias-de-urgencia-en-bariloche-1416749/,rionegro.com.ar,2020-07-01,Argentina,aspirinetas/NCFP00D/aspirina,"Quienes  toman  medicamentos  para  la  tiroides  ,  la  presión  o aspirinetas  están  habilitados  para  donar  sangre  aunque  esa  mañana  no  deben  ingerirlos  .  ""  La  idea  es  que  en  la  sangre  no  haya  medicamentos  circulando  .",aspirinetas,ncfp00d,aspirina,o,o,CC,presión,presión,NCFS000,la,el,DA0FS0,",",",",Fc,tiroides,tiroides,NCFN000,están,estar,VAIP3P0,habilitados,habilitar,VMP00PM,para,para,SPS00,donar,donar,VMN0000,sangre,sangre,NCFS000,2020-07-01,2020,2020,NCFS000 CC Aspirine VAIP3P0 VMP00PM,CC Aspirine VAIP3P0,NCFS000 CC Aspirine,DA0FS0 NCFS000 CC Aspirine,Fc DA0FS0 NCFS000 CC Aspirine,Aspirine VAIP3P0 VMP00PM,Aspirine VAIP3P0 VMP00PM SPS00,Aspirine VAIP3P0 VMP00PM SPS00 VMN0000,presión o Aspirine estar habilitar,o Aspirine estar,presión o Aspirine,el presión o Aspirine,", el presión o Aspirine",Aspirine estar habilitar,Aspirine estar habilitar para,Aspirine estar habilitar para donar
https://www.paginasiete.bo/sociedad/2020/7/1/revilla-patzi-anuncian-que-el-dioxido-de-cloro-sera-sometido-un-estudio-260059.html,paginasiete.bo,2020-07-02,"Bolivia, Plurinational State of",aspirineta/NCFS00D/aspirina,"El  lunes  ,  el  director  del  Sedes  Chuquisaca  ,  Enrique  Leaño  ,  informó  que  en  las  visitas  de  casa  por  casa  se  llevará  un  kit  de  medicamentos  ,  entre  ellos  dióxido  de  cloro  .  ""  Todo  este  equipo  va  a  tener  un  kit  de  medicamentos  :  ivermectina  ,  dióxido  de  cloro  ,  ibuprofeno  , aspirineta  de  100  miligramos  ,  dexametasona  ,  azitromicina  ,  vitamina  A  y  D  y  zinc  ,  que  son  los  elementos  básicos  para  contener  ""  ,  afirmó  entonces  .",aspirineta,ncfs00d,aspirina,",",",",Fc,ibuprofeno,ibuprofeno,NCMS000,",",",",Fc,cloro,cloro,NCMN000,de,de,SPS00,de,de,SPS00,100,100,Z,miligramos,miligramo,NCMP000,",",",",Fc,dexametasona,dexametasona,NCFS000,2020-07-02,2020,2020,NCMS000 Fc Aspirine SPS00 Z,Fc Aspirine SPS00,NCMS000 Fc Aspirine,Fc NCMS000 Fc Aspirine,NCMN000 Fc NCMS000 Fc Aspirine,Aspirine SPS00 Z,Aspirine SPS00 Z NCMP000,Aspirine SPS00 Z NCMP000 Fc,"ibuprofeno , Aspirine de 100",", Aspirine de","ibuprofeno , Aspirine",", ibuprofeno , Aspirine","cloro , ibuprofeno , Aspirine",Aspirine de 100,Aspirine de 100 miligramo,"Aspirine de 100 miligramo ,"
https://www.eltribuno.com/salta/nota/2020-7-4-18-43-0-impresionante-secuestraron-mercaderia-valuada-en-mas-de-3-000-000-de-pesos-en-la-frontera,eltribuno.com,2020-07-04,===NONE===,aspirineta/NCFS00D/aspirina,".  600  paquetes  de  galletas  saladas  .  54  unidades  de  avena  por  400  gramos  96  unidades  de  leche  en  polvo  por  800  gramos  1320  cajas  de  cartón  vino  blanco  ,  por  un  1  litro  52  sachets  de  vino  tinto  de  3  litros  84  unidades  de  galletas  por  400  gramos  612  unidades  de  galleta  salada  1200  fardos  de  harina  ""  000  ""  por  un  1  kg  612  fardos  de  yerba  mate  por  1  kg  384  unidades  de  botella  con  aceite  vegetal  312  unidades  de  escobillones  para  piso  4600  unidades  de  manteca  de  cerdo  780  unidades  de  yerba  mate  1050  cajas  de aspirineta  por  98  comprimidos  252  unidades  de  licor  90  cajas  de  redoyon  por  30  comprimidos  cada  unidad  300  gafas  transparentes  15.600  unidades  de  yerba  mate  por  250  gramos  4.224  latas  de  picadillo  de  carne  540  botellas  plásticas  conteniendo  en  su  interior  agua  lavandina  por  4  litro </doc>",aspirineta,ncfs00d,aspirina,de,de,SPS00,cajas,caja,NCFP000,1050,1050,Z,mate,mate,AQ0CS0,yerba,yerba,NCFS000,por,por,SPS00,98,98,Z,comprimidos,comprimir,VMP00PM,252,252,Z,unidades,unidad,NCFP000,2020-07-04,2020,2020,NCFP000 SPS00 Aspirine SPS00 Z,SPS00 Aspirine SPS00,NCFP000 SPS00 Aspirine,Z NCFP000 SPS00 Aspirine,AQ0CS0 Z NCFP000 SPS00 Aspirine,Aspirine SPS00 Z,Aspirine SPS00 Z VMP00PM,Aspirine SPS00 Z VMP00PM Z,caja de Aspirine por 98,de Aspirine por,caja de Aspirine,1050 caja de Aspirine,mate 1050 caja de Aspirine,Aspirine por 98,Aspirine por 98 comprimir,Aspirine por 98 comprimir 252
https://www.eltribuno.com/salta/nota/2020-7-5-0-0-0-secuestran-mercaderia-por-mas-de-3-millones,eltribuno.com,2020-07-05,===NONE===,aspirinetas/NCFP00D/aspirina,"Llevaban  galletas  de  distintas  marcas  y  tipos  ,  leche  en  polvo  ,  cajas  de  vino  blanco  y  tinto  ,  fardos  de  harina  ,  botellas  de  aceite  ,  escobillones  ,  yerba  mate  ,  cajas  con  licor  , aspirinetas  ,  botellas  de  lavandina  y  otros  objetos  .",aspirinetas,ncfp00d,aspirina,",",",",Fc,licor,licor,NCMS000,con,con,SPS00,cajas,caja,NCFP000,",",",",Fc,",",",",Fc,botellas,botella,NCFP000,de,de,SPS00,lavandina,lavandina,NCFS000,y,y,CC,2020-07-05,2020,2020,NCMS000 Fc Aspirine Fc NCFP000,Fc Aspirine Fc,NCMS000 Fc Aspirine,SPS00 NCMS000 Fc Aspirine,NCFP000 SPS00 NCMS000 Fc Aspirine,Aspirine Fc NCFP000,Aspirine Fc NCFP000 SPS00,Aspirine Fc NCFP000 SPS00 NCFS000,"licor , Aspirine , botella",", Aspirine ,","licor , Aspirine","con licor , Aspirine","caja con licor , Aspirine","Aspirine , botella","Aspirine , botella de","Aspirine , botella de lavandina"
http://www.juventudrebelde.cu/deportes/2020-07-06/la-juventus-se-acerca-a-la-novena-corona-consecutiva,juventudrebelde.cu,2020-07-06,Cuba,aspirineros/NCMP000/aspirineros,"Por  el  lado  de  los  "" aspirineros  ""  se  hicieron  presentes  en  el  marcador  Sven  Bender  y  Kai  Havertz  ,  a  los  minutos  63  '  y  90+4  '  ,  respectivamente  . </doc>",aspirineros,ncmp000,aspirineros,"""","""",Fe,los,el,DA0MP0,de,de,SPS00,lado,lado,NCMS000,el,el,DA0MS0,"""","""",Fe,se,se,P00CN000,hicieron,hacer,VMIS3P0,presentes,presente,AQ0CP0,en,en,SPS00,2020-07-06,2020,2020,DA0MP0 Fe Aspirine Fe P00CN000,Fe Aspirine Fe,DA0MP0 Fe Aspirine,SPS00 DA0MP0 Fe Aspirine,NCMS000 SPS00 DA0MP0 Fe Aspirine,Aspirine Fe P00CN000,Aspirine Fe P00CN000 VMIS3P0,Aspirine Fe P00CN000 VMIS3P0 AQ0CP0,"el "" Aspirine "" se",""" Aspirine ""","el "" Aspirine","de el "" Aspirine","lado de el "" Aspirine","Aspirine "" se","Aspirine "" se hacer","Aspirine "" se hacer presente"
https://lapioneradeclorinda.com/2020/07/07/prov/una-vela-prendida-a-un-santo-genero-el-incendio-de-un-domicilio-en-el-barrio-san-francisco.html,lapioneradeclorinda.com,2020-07-07,===NONE===,aspirineta/NCFS00D/aspirina,"""  Todos  los  vecinos  los  ayudamos  ,  a  la  hija  de  la  señora  la  hicimos  sentar  porque  llegó  llorando  ,  le  dimos aspirineta  y  también  a  la  hermana  ,  la  dueña  de  la  casa  se  descompuso  ,  se  cayó  en  la  calle  y  la  ambulancia  la  llevó  .",aspirineta,ncfs00d,aspirina,dimos,dar,VMIS1P0,le,le,PP3CSD00,",",",",Fc,llorando,llorar,VMG0000,llegó,llegar,VMIS3S0,y,y,CC,también,también,RG,a,a,SPS00,la,el,DA0FS0,hermana,hermano,NCFS000,2020-07-07,2020,2020,PP3CSD00 VMIS1P0 Aspirine CC RG,VMIS1P0 Aspirine CC,PP3CSD00 VMIS1P0 Aspirine,Fc PP3CSD00 VMIS1P0 Aspirine,VMG0000 Fc PP3CSD00 VMIS1P0 Aspirine,Aspirine CC RG,Aspirine CC RG SPS00,Aspirine CC RG SPS00 DA0FS0,le dar Aspirine y también,dar Aspirine y,le dar Aspirine,", le dar Aspirine","llorar , le dar Aspirine",Aspirine y también,Aspirine y también a,Aspirine y también a el
https://www.las2orillas.co/ante-el-covid-19-se-requiere-medicacion-oportuna-en-lugar-de-simple-observacion/,las2orillas.co,2020-07-08,Colombia,aspirineta/NCFS00D/aspirina,"Dado  que  a  estas  alturas  de  la  pandemia  ya  se  sabe  que  el  coronavirus  es  multisistémico  ,  no  solo  respiratorio  ,  y  puede  afectar  varios  órganos  al  producir  coágulos  intravasculares  ,  también  se  ha  descubierto  que  antiinflamatorios  ,  anticoagulantes  ( aspirineta  )  y  antibióticos  formulados  en  dosis  adecuadas  y  oportunas  ayudan  a  combatir  esas  primeras  señales  de  agravamiento  .",aspirineta,ncfs00d,aspirina,(,(,Fpa,anticoagulantes,anticoagulante,AQ0CP0,",",",",Fc,antiinflamatorios,antiinflamatorio,AQ0MP0,que,que,CS,),),Fpt,y,y,CC,antibióticos,antibiótico,AQ0MP0,formulados,formular,VMP00PM,en,en,SPS00,2020-07-08,2020,2020,AQ0CP0 Fpa Aspirine Fpt CC,Fpa Aspirine Fpt,AQ0CP0 Fpa Aspirine,Fc AQ0CP0 Fpa Aspirine,AQ0MP0 Fc AQ0CP0 Fpa Aspirine,Aspirine Fpt CC,Aspirine Fpt CC AQ0MP0,Aspirine Fpt CC AQ0MP0 VMP00PM,anticoagulante ( Aspirine ) y,( Aspirine ),anticoagulante ( Aspirine,", anticoagulante ( Aspirine","antiinflamatorio , anticoagulante ( Aspirine",Aspirine ) y,Aspirine ) y antibiótico,Aspirine ) y antibiótico formular
https://www.lostiempos.com/actualidad/pais/20200709/dos-regiones-aplican-14-medicinas-pando-prueba-dioxido-cloro,lostiempos.com,2020-07-09,Bolivia,aspirineta/NCFS00D/aspirina,"La  receta  ,  que  es  parte  del  Plan  Todos  por  la  Vida  ,  incluye  ivermectina  , aspirineta  de  100  mg  ,  omeprazol  de  20  mg  e  ibuprofeno  de  400  mg  .",aspirineta,ncfs00d,aspirina,",",",",Fc,ivermectina,ivermectina,NCFS000,incluye,incluir,VMIP3S0,",",",",Fc,Vida,vida,NP00000,de,de,SPS00,100,100,Z,mg,miligramo,NCMN000,",",",",Fc,omeprazol,omeprazol,NCMS000,2020-07-09,2020,2020,NCFS000 Fc Aspirine SPS00 Z,Fc Aspirine SPS00,NCFS000 Fc Aspirine,VMIP3S0 NCFS000 Fc Aspirine,Fc VMIP3S0 NCFS000 Fc Aspirine,Aspirine SPS00 Z,Aspirine SPS00 Z NCMN000,Aspirine SPS00 Z NCMN000 Fc,"ivermectina , Aspirine de 100",", Aspirine de","ivermectina , Aspirine","incluir ivermectina , Aspirine",", incluir ivermectina , Aspirine",Aspirine de 100,Aspirine de 100 miligramo,"Aspirine de 100 miligramo ,"
https://www.paginasiete.bo/economia/2020/7/12/imcruz-dona-medicamentos-para-el-ejercito-261060.html,paginasiete.bo,2020-07-12,"Bolivia, Plurinational State of",aspirineta/NCFS00D/aspirina,"Entre  los  medicamentos  que  contiene  cada  kit  ,  se  encuentran  ivermectina  , aspirineta  ,  omeprazol  e  ibuprofeno  ,  prescritos  por  un  especialista  médico  ,  señala  información  de  Imcruz  .",aspirineta,ncfs00d,aspirina,",",",",Fc,ivermectina,ivermectina,NCFS000,encuentran,encontrar,VMIP3P0,se,se,P00CN000,",",",",Fc,",",",",Fc,omeprazol,omeprazol,NCMS000,e,y,CC,ibuprofeno,ibuprofeno,NCMS000,",",",",Fc,2020-07-12,2020,2020,NCFS000 Fc Aspirine Fc NCMS000,Fc Aspirine Fc,NCFS000 Fc Aspirine,VMIP3P0 NCFS000 Fc Aspirine,P00CN000 VMIP3P0 NCFS000 Fc Aspirine,Aspirine Fc NCMS000,Aspirine Fc NCMS000 CC,Aspirine Fc NCMS000 CC NCMS000,"ivermectina , Aspirine , omeprazol",", Aspirine ,","ivermectina , Aspirine","encontrar ivermectina , Aspirine","se encontrar ivermectina , Aspirine","Aspirine , omeprazol","Aspirine , omeprazol y","Aspirine , omeprazol y ibuprofeno"
https://www.vanguardia.com/opinion/columnistas/libardo-leon-guarin/cuestion-de-talante-DE2622005,vanguardia.com,2020-07-14,Colombia,aspirinetas/AQ0FP0/aspirinetas,"La  ""  despachada  ""  del  obispo  de  Cali  por  el  fracaso  intencionado  de  los  Acuerdos  de  La  Habana  ,  que  no  eran  solo  desmovilización  -  además  para  que  los  fueran  matando  poco  a  poco  -  ,  sino  ir  a  las  raíces  sociales  del  conflicto  ,  con  un  poquito  de  talante  bien  pudiera  servir  al  gobierno  para  que  cese  su  ingenuidad  y  desconocimiento  de  lo  que  es  un  conflicto  social  ,  cuyas  patologías  ,  como  las  de  los  cuerpos  vivos  ,  mientras  no  se  ataquen  las  causas  lo  demás  son aspirinetas  .",aspirinetas,aq0fp0,aspirinetas,son,ser,VSIP3P0,demás,demás,PI0CP000,lo,el,DA0NS0,causas,causa,NCFP000,las,el,DA0FP0,.,.,Fp,,,,,,,,,,,,,2020-07-14,2020,2020,,VSIP3P0 Aspirine Fp,PI0CP000 VSIP3P0 Aspirine,DA0NS0 PI0CP000 VSIP3P0 Aspirine,NCFP000 DA0NS0 PI0CP000 VSIP3P0 Aspirine,,,,,ser Aspirine .,demás ser Aspirine,el demás ser Aspirine,causa el demás ser Aspirine,,,
https://www.90min.com/es/posts/los-mejores-10-defensores-del-futbol-europeo-durante-la-actual-temporada,90min.com,2020-07-15,===NONE===,aspirineros/NCMP000/aspirineros,"Su  influencia  defensiva  en  los aspirineros  puede  ser  comparable  a  la  ofensiva  en  Erling  Haaland  ,  el  otro  fichaje  invernal  destacado  en  la  liga  alemana  ,  en  el  Borussia  Dortmund  .",aspirineros,ncmp000,aspirineros,los,el,DA0MP0,en,en,SPS00,defensiva,defensivo,AQ0FS0,influencia,influencia,NCFS000,Su,su,DP3CS0,puede,poder,VMIP3S0,ser,ser,VSN0000,comparable,comparable,AQ0CS0,a,a,SPS00,la,el,DA0FS0,2020-07-15,2020,2020,SPS00 DA0MP0 Aspirine VMIP3S0 VSN0000,DA0MP0 Aspirine VMIP3S0,SPS00 DA0MP0 Aspirine,AQ0FS0 SPS00 DA0MP0 Aspirine,NCFS000 AQ0FS0 SPS00 DA0MP0 Aspirine,Aspirine VMIP3S0 VSN0000,Aspirine VMIP3S0 VSN0000 AQ0CS0,Aspirine VMIP3S0 VSN0000 AQ0CS0 SPS00,en el Aspirine poder ser,el Aspirine poder,en el Aspirine,defensivo en el Aspirine,influencia defensivo en el Aspirine,Aspirine poder ser,Aspirine poder ser comparable,Aspirine poder ser comparable a
https://www.eldia.com.bo/index.php?c=Portada&articulo=Intervienen-un-negocio-donde-se-vendia-lavandina-y-medicamentos-de-dudosa-procedencia&cat=1&pla=3&id_articulo=311276,eldia.com.bo,2020-07-29,"Bolivia, Plurinational State of",Aspirinetas/NP00000/aspirinetas,"Según  el  informe  policial  ,  en  el  lugar  fueron  encontrados  botellas  de  lavandina  que  tenían  diferentes  stickers  ,  lo  que  hace  sospechar  que  se  traten  de  productos  adulterados  ,  asimismo  ,  fueron  hallados  medicamentos  como  Ibuprofeno  , Aspirinetas  y  Azitromicina  ,  este  última  era  comercializado  hasta  en  Bs  100  .",aspirinetas,np00000,aspirinetas,",",",",Fc,Ibuprofeno,ibuprofeno,NP00000,como,como,CS,medicamentos,medicamento,NCMP000,hallados,hallar,VMP00PM,y,y,CC,Azitromicina,azitromicina,NP00000,",",",",Fc,este,este,DD0MS0,última,último,AO0FS0,2020-07-29,2020,2020,NP00000 Fc Aspirine CC NP00000,Fc Aspirine CC,NP00000 Fc Aspirine,CS NP00000 Fc Aspirine,NCMP000 CS NP00000 Fc Aspirine,Aspirine CC NP00000,Aspirine CC NP00000 Fc,Aspirine CC NP00000 Fc DD0MS0,"ibuprofeno , Aspirine y azitromicina",", Aspirine y","ibuprofeno , Aspirine","como ibuprofeno , Aspirine","medicamento como ibuprofeno , Aspirine",Aspirine y azitromicina,"Aspirine y azitromicina ,","Aspirine y azitromicina , este"
https://www.eldia.com.bo/index.php?c=Portada&articulo=Intervienen-un-negocio-donde-se-vendia-lavandina-y-medicamentos-de-dudosa-procedencia&cat=1&pla=3&id_articulo=311276,eldia.com.bo,2020-07-29,"Bolivia, Plurinational State of",aspirinetas/NCFP00D/aspirina,"""  Se  ha  hecho  un  seguimiento  y  a  través  de  una  denuncia  de  los  vecinos  es  que  hemos  podido  llegar  a  este  lugar  ,  es  evidente  que  hemos  encontrado  bastante  líquido  de  lavandina  de  dudosa  procedencia  ,  tienen  diferentes  stickers  las  (  botellas  )  de  lavandinas  ,  entonces  eso  nos  da  a  entender  que  posiblemente  se  trataría  de  una  lavandina  adulterada  ,  aparte  de  ello  ,  hemos  encontrado  ,  algunos  medicamentos  como  Ibuprofeno  , aspirinetas  ,  vitaminas  ,  que  no  tienen  ningún  tipo  de  registro  sanitario  .",aspirinetas,ncfp00d,aspirina,",",",",Fc,Ibuprofeno,ibuprofeno,NP00000,como,como,CS,medicamentos,medicamento,NCMP000,algunos,alguno,DI0MP0,",",",",Fc,vitaminas,vitamina,NCFP000,",",",",Fc,que,que,CS,no,no,RN,2020-07-29,2020,2020,NP00000 Fc Aspirine Fc NCFP000,Fc Aspirine Fc,NP00000 Fc Aspirine,CS NP00000 Fc Aspirine,NCMP000 CS NP00000 Fc Aspirine,Aspirine Fc NCFP000,Aspirine Fc NCFP000 Fc,Aspirine Fc NCFP000 Fc CS,"ibuprofeno , Aspirine , vitamina",", Aspirine ,","ibuprofeno , Aspirine","como ibuprofeno , Aspirine","medicamento como ibuprofeno , Aspirine","Aspirine , vitamina","Aspirine , vitamina ,","Aspirine , vitamina , que"
https://www.opinion.com.bo/articulo/cochabamba/aprehenden-persona-vendia-medicamentos-sobreprecio/20200731154524780330.html,opinion.com.bo,2020-07-31,"Bolivia, Plurinational State of",aspirineta/NCFS00D/aspirina,"Tenía  300  unidades  de  aspirina  ,  190  de  paracetamol  y  390  de aspirineta  .  ""  Era  un  sobreprecio  del  50  %  y  70  %  respecto  al  costo  original  ""  ,  informaron  las  autoridades  .",aspirineta,ncfs00d,aspirina,de,de,SPS00,390,390,Z,y,y,CC,paracetamol,paracetamol,NCMS000,de,de,SPS00,.,.,Fp,"""","""",Fe,Era,ser,VSII1S0,un,uno,DI0MS0,sobreprecio,sobreprecio,NCMS000,2020-07-31,2020,2020,Z SPS00 Aspirine Fp Fe,SPS00 Aspirine Fp,Z SPS00 Aspirine,CC Z SPS00 Aspirine,NCMS000 CC Z SPS00 Aspirine,Aspirine Fp Fe,Aspirine Fp Fe VSII1S0,Aspirine Fp Fe VSII1S0 DI0MS0,"390 de Aspirine . """,de Aspirine .,390 de Aspirine,y 390 de Aspirine,paracetamol y 390 de Aspirine,"Aspirine . ""","Aspirine . "" ser","Aspirine . "" ser uno"
https://www.opinion.com.bo/articulo/cochabamba/aprehenden-persona-vendia-medicamentos-sobreprecio/20200731154524780330.html,opinion.com.bo,2020-07-31,"Bolivia, Plurinational State of",aspirineta/NCFS00D/aspirina,"Fue  aprehendida  una  persona  en  posesión  de  aspirina  , aspirineta  y  paracetamol  .",aspirineta,ncfs00d,aspirina,",",",",Fc,aspirina,aspirina,NCFS000,de,de,SPS00,posesión,posesión,NCFS000,en,en,SPS00,y,y,CC,paracetamol,paracetamol,NCMS000,.,.,Fp,,,,,,,2020-07-31,2020,2020,NCFS000 Fc Aspirine CC NCMS000,Fc Aspirine CC,NCFS000 Fc Aspirine,SPS00 NCFS000 Fc Aspirine,NCFS000 SPS00 NCFS000 Fc Aspirine,Aspirine CC NCMS000,Aspirine CC NCMS000 Fp,,"aspirina , Aspirine y paracetamol",", Aspirine y","aspirina , Aspirine","de aspirina , Aspirine","posesión de aspirina , Aspirine",Aspirine y paracetamol,Aspirine y paracetamol .,
https://www.eldia.com.bo/index.php?cat=1&pla=3&id_articulo=311603,eldia.com.bo,2020-08-01,"Bolivia, Plurinational State of",aspirinetas/AQ0FP0/aspirinetas,"El  coronel  Cárdenas  explicó  que  la  FELCC  detectó  comercialización  de  medicamentos  por  redes  sociales  y  tomó  contacto  con  la  persona  ,  a  quien  aprehendió  en  poder  de  distintos  fármacos  como  paracetamol  (  90  unidades  )  y aspirinetas  (  290  unidades  )  ,  insumos  que  en  la  mayoría  de  las  farmacias  han  desaparecido  .",aspirinetas,aq0fp0,aspirinetas,y,y,CC,),),Fpt,unidades,unidad,NCFP000,90,90,Z,(,(,Fpa,(,(,Fpa,290,290,Z,unidades,unidad,NCFP000,),),Fpt,",",",",Fc,2020-08-01,2020,2020,Fpt CC Aspirine Fpa Z,CC Aspirine Fpa,Fpt CC Aspirine,NCFP000 Fpt CC Aspirine,Z NCFP000 Fpt CC Aspirine,Aspirine Fpa Z,Aspirine Fpa Z NCFP000,Aspirine Fpa Z NCFP000 Fpt,) y Aspirine ( 290,y Aspirine (,) y Aspirine,unidad ) y Aspirine,90 unidad ) y Aspirine,Aspirine ( 290,Aspirine ( 290 unidad,Aspirine ( 290 unidad )
https://www.opinion.com.bo/articulo/policial/capturan-mujer-vendia-medicamentos-sobreprecio-60-traves-patrullaje-cibernetico/20200731214253780410.html,opinion.com.bo,2020-08-01,"Bolivia, Plurinational State of",aspirinetas/NCFP00D/aspirina,"El  jefe  policial  explicó  que  la  División  Cibercrimen  realizó  un  patrullaje  informático  en  las  redes  sociales  y  de  esa  manera  lograron  contactarse  con  la  mujer  que  ofrecía  aspirinas  , aspirinetas  y  paracetamol  a  costos  elevados  .",aspirinetas,ncfp00d,aspirina,",",",",Fc,aspirinas,aspirina,NCFP000,ofrecía,ofrecer,VMII3S0,que,que,PR0CN000,mujer,mujer,NCFS000,y,y,CC,paracetamol,paracetamol,NCMS000,a,a,SPS00,costos,costo,NCMP000,elevados,elevar,VMP00PM,2020-08-01,2020,2020,NCFP000 Fc Aspirine CC NCMS000,Fc Aspirine CC,NCFP000 Fc Aspirine,VMII3S0 NCFP000 Fc Aspirine,PR0CN000 VMII3S0 NCFP000 Fc Aspirine,Aspirine CC NCMS000,Aspirine CC NCMS000 SPS00,Aspirine CC NCMS000 SPS00 NCMP000,"aspirina , Aspirine y paracetamol",", Aspirine y","aspirina , Aspirine","ofrecer aspirina , Aspirine","que ofrecer aspirina , Aspirine",Aspirine y paracetamol,Aspirine y paracetamol a,Aspirine y paracetamol a costo
https://www.opinion.com.bo/articulo/policial/capturan-mujer-vendia-medicamentos-sobreprecio-60-traves-patrullaje-cibernetico/20200731214253780410.html,opinion.com.bo,2020-08-01,"Bolivia, Plurinational State of",aspirinetas/NCFP00D/aspirina,"Tenía  entre  sus  pertenencias  300  unidades  de  aspirina  ,  190  unidades  de  paracetamol  y  390  unidades  de aspirinetas  .",aspirinetas,ncfp00d,aspirina,de,de,SPS00,unidades,unidad,NCFP000,390,390,Z,y,y,CC,paracetamol,paracetamol,NCMS000,.,.,Fp,,,,,,,,,,,,,2020-08-01,2020,2020,,SPS00 Aspirine Fp,NCFP000 SPS00 Aspirine,Z NCFP000 SPS00 Aspirine,CC Z NCFP000 SPS00 Aspirine,,,,,de Aspirine .,unidad de Aspirine,390 unidad de Aspirine,y 390 unidad de Aspirine,,,
https://www.lanacion.com.ar/opinion/carta-de-lectores/de-lectores-cartas-e-mails-nid2416016,lanacion.com.ar,2020-08-09,Argentina,aspirinetas/NCFP00D/aspirina,"Que  haya  tinta  en  la  impresora  une  milagrosamente  en  un  mismo  papel  las  contradicciones  más  absolutas  y  aberrantes  ,  incluidas aspirinetas  de  promesas  de  acompañamiento  a  las  madres  ,  que  deberían  existir  desde  hace  años  .",aspirinetas,ncfp00d,aspirina,incluidas,incluir,VMP00PF,",",",",Fc,aberrantes,aberrante,AQ0CP0,y,y,CC,absolutas,absoluto,AQ0FP0,de,de,SPS00,promesas,promesa,NCFP000,de,de,SPS00,acompañamiento,acompañamiento,NCMS000,a,a,SPS00,2020-08-09,2020,2020,Fc VMP00PF Aspirine SPS00 NCFP000,VMP00PF Aspirine SPS00,Fc VMP00PF Aspirine,AQ0CP0 Fc VMP00PF Aspirine,CC AQ0CP0 Fc VMP00PF Aspirine,Aspirine SPS00 NCFP000,Aspirine SPS00 NCFP000 SPS00,Aspirine SPS00 NCFP000 SPS00 NCMS000,", incluir Aspirine de promesa",incluir Aspirine de,", incluir Aspirine","aberrante , incluir Aspirine","y aberrante , incluir Aspirine",Aspirine de promesa,Aspirine de promesa de,Aspirine de promesa de acompañamiento
