url,website,date,country,keyword,sentence,kw,kw_lemma,kw_pos,left_w1,left_l1,left_p1,left_w2,left_l2,left_p2,left_w3,left_l3,left_p3,left_w4,left_l4,left_p4,left_w5,left_l5,left_p5,right_w1,right_l1,right_p1,right_w2,right_l2,right_p2,right_w3,right_l3,right_p3,right_w4,right_l4,right_p4,right_w5,right_l5,right_p5,datetime,year,10years,pattern_around5,pattern_around3,pattern_left2,pattern_left3,pattern_left4,pattern_right2,pattern_right3,pattern_right4,pattern_around5_lex,pattern_around3_lex,pattern_left2_lex,pattern_left3_lex,pattern_left4_lex,pattern_right2_lex,pattern_right3_lex,pattern_right4_lex
https://verne.elpais.com/verne/2018/10/06/articulo/1538819474_064288.html,elpais.com,2018-10-06,===NONE===,Aspirine/NP00000/aspirine,"Aspirina  :  La  farmacéutica  Bayer  empezó  a  vender  sus  pastillas  de  ácido  acetilsalicílico  con  el  nombre  "" Aspirine  ""  en  Alemania  .",aspirine,np00000,aspirine,"""","""",Fe,nombre,nombre,NCMS000,el,el,DA0MS0,con,con,SPS00,acetilsalicílico,acetilsalicílico,AQ0MS0,"""","""",Fe,en,en,SPS00,Alemania,alemania,NP00000,.,.,Fp,,,,2018-10-06,2018,2010,NCMS000 Fe Aspirine Fe SPS00,Fe Aspirine Fe,NCMS000 Fe Aspirine,DA0MS0 NCMS000 Fe Aspirine,SPS00 DA0MS0 NCMS000 Fe Aspirine,Aspirine Fe SPS00,Aspirine Fe SPS00 NP00000,Aspirine Fe SPS00 NP00000 Fp,"nombre "" Aspirine "" en",""" Aspirine ""","nombre "" Aspirine","el nombre "" Aspirine","con el nombre "" Aspirine","Aspirine "" en","Aspirine "" en alemania","Aspirine "" en alemania ."
https://blogs.publico.es/otrasmiradas/15954/por-que-a-las-marcas-no-les-gusta-que-su-nombre-se-convierta-en-termino-generico/,publico.es,2018-10-13,Spain,Aspirine/NP00000/aspirine,"Y  lo  curioso  es  que  los  hablantes  a  veces  ni  siquiera  somos  conscientes  de  ello  ,  pues  naturalizamos  su  pronunciación  y  su  escritura  según  las  convenciones  de  nuestra  propia  lengua  (  así  sucedió  con  la Aspirine  de  Bayer  ,  a  la  que  todos  llamamos  comúnmente  aspirina  )  .",aspirine,np00000,aspirine,la,el,DA0FS0,con,con,SPS00,sucedió,suceder,VMIS3S0,así,así,RG,(,(,Fpa,de,de,SPS00,Bayer,bayer,NP00000,",",",",Fc,a,a,SPS00,la,el,DA0FS0,2018-10-13,2018,2010,SPS00 DA0FS0 Aspirine SPS00 NP00000,DA0FS0 Aspirine SPS00,SPS00 DA0FS0 Aspirine,VMIS3S0 SPS00 DA0FS0 Aspirine,RG VMIS3S0 SPS00 DA0FS0 Aspirine,Aspirine SPS00 NP00000,Aspirine SPS00 NP00000 Fc,Aspirine SPS00 NP00000 Fc SPS00,con el Aspirine de bayer,el Aspirine de,con el Aspirine,suceder con el Aspirine,así suceder con el Aspirine,Aspirine de bayer,"Aspirine de bayer ,","Aspirine de bayer , a"
https://www.lanueva.com/nota/2018-10-20-7-0-45-por-la-crisis-cayo-la-venta-de-medicamentos-en-bahia-blanca,lanueva.com,2018-10-20,Argentina,aspirineta/NCFS00D/aspirina,"""  También  observamos  una  reducción  de  dosis  disponibles  en  medicamentos  que  no  son  críticos  si  los  suspendés  ,  como  algunos  para  el  colesterol  y  la  presión  ,  o  bien  la aspirineta  para  la  coagulación  de  la  sangre  .",aspirineta,ncfs00d,aspirina,la,el,DA0FS0,bien,bien,RG,o,o,CC,",",",",Fc,presión,presión,NCFS000,para,para,SPS00,la,el,DA0FS0,coagulación,coagulación,NCFS000,de,de,SPS00,la,el,DA0FS0,2018-10-20,2018,2010,RG DA0FS0 Aspirine SPS00 DA0FS0,DA0FS0 Aspirine SPS00,RG DA0FS0 Aspirine,CC RG DA0FS0 Aspirine,Fc CC RG DA0FS0 Aspirine,Aspirine SPS00 DA0FS0,Aspirine SPS00 DA0FS0 NCFS000,Aspirine SPS00 DA0FS0 NCFS000 SPS00,bien el Aspirine para el,el Aspirine para,bien el Aspirine,o bien el Aspirine,", o bien el Aspirine",Aspirine para el,Aspirine para el coagulación,Aspirine para el coagulación de
https://www.perfil.com/noticias/ciencia/cronoterapia-el-horario-en-que-se-toma-un-medicamento-clave-para-su-eficacia.phtml,perfil.com,2018-10-28,Argentina,Aspirinetas/NP00000/aspirinetas,"Según  este  experto  ,  casi  la  mitad  de  nuestro  acervo  genético  se  expresa  en  forma  diferente  a  lo  largo  del  día  ,  siguiendo  sus  relojes  biológicos  .  ""  El  efecto  de  tomar  una  molécula  curativa  en  diferentes  momentos  del  día  puede  ser  sustancial  :  hoy  sabemos  que  tomar Aspirinetas  para  el  corazón  al  acostarse  puede  mejorar  la  prevención  en  forma  más  efectiva  que  si  se  toman  en  otro  horario  .",aspirinetas,np00000,aspirinetas,tomar,tomar,VMN0000,que,que,CS,sabemos,saber,VMIP1P0,hoy,hoy,RG,:,:,Fd,para,para,SPS00,el,el,DA0MS0,corazón,corazón,NCMS000,al,a+el,SPS00+DA0MS0,acostarse,acostar+se,VMN0000+PP3CN000,2018-10-28,2018,2010,CS VMN0000 Aspirine SPS00 DA0MS0,VMN0000 Aspirine SPS00,CS VMN0000 Aspirine,VMIP1P0 CS VMN0000 Aspirine,RG VMIP1P0 CS VMN0000 Aspirine,Aspirine SPS00 DA0MS0,Aspirine SPS00 DA0MS0 NCMS000,Aspirine SPS00 DA0MS0 NCMS000 SPS00+DA0MS0,que tomar Aspirine para el,tomar Aspirine para,que tomar Aspirine,saber que tomar Aspirine,hoy saber que tomar Aspirine,Aspirine para el,Aspirine para el corazón,Aspirine para el corazón a+el
http://www.diariodelujan.com/aspirina-y-mitos/,diariodelujan.com,2018-11-08,Argentina,aspirineta/NCFS00D/aspirina,"La  mayoría  de  las  personas  de  este  país  está  convencida  que  una aspirineta  es  buena  para  el  corazón  ,  gracias  a  la  antigua  publicidad  ""  ,  dice  Jorge  Tartaglione  ,  presidente  de  la  Federación  Cardiológica  Argentina  .",aspirineta,ncfs00d,aspirina,una,uno,DI0FS0,que,que,CS,convencida,convencer,VMP00SF,está,estar,VAIP3S0,país,país,NCMS000,es,ser,VSIP3S0,buena,bueno,AQ0FS0,para,para,SPS00,el,el,DA0MS0,corazón,corazón,NCMS000,2018-11-08,2018,2010,CS DI0FS0 Aspirine VSIP3S0 AQ0FS0,DI0FS0 Aspirine VSIP3S0,CS DI0FS0 Aspirine,VMP00SF CS DI0FS0 Aspirine,VAIP3S0 VMP00SF CS DI0FS0 Aspirine,Aspirine VSIP3S0 AQ0FS0,Aspirine VSIP3S0 AQ0FS0 SPS00,Aspirine VSIP3S0 AQ0FS0 SPS00 DA0MS0,que uno Aspirine ser bueno,uno Aspirine ser,que uno Aspirine,convencer que uno Aspirine,estar convencer que uno Aspirine,Aspirine ser bueno,Aspirine ser bueno para,Aspirine ser bueno para el
http://www.diariodelujan.com/aspirina-y-mitos/,diariodelujan.com,2018-11-08,Argentina,aspirineta/NCFS00D/aspirina,"""  Hoy  en  día  ya  se  sabe  que  no  puedo  utilizar  sistemáticamente  la aspirineta  para  prevenir  el  infarto  .",aspirineta,ncfs00d,aspirina,la,el,DA0FS0,sistemáticamente,sistemáticamente,RG,utilizar,utilizar,VMN0000,puedo,poder,VMIP1S0,no,no,RN,para,para,SPS00,prevenir,prevenir,VMN0000,el,el,DA0MS0,infarto,infarto,NCMS000,.,.,Fp,2018-11-08,2018,2010,RG DA0FS0 Aspirine SPS00 VMN0000,DA0FS0 Aspirine SPS00,RG DA0FS0 Aspirine,VMN0000 RG DA0FS0 Aspirine,VMIP1S0 VMN0000 RG DA0FS0 Aspirine,Aspirine SPS00 VMN0000,Aspirine SPS00 VMN0000 DA0MS0,Aspirine SPS00 VMN0000 DA0MS0 NCMS000,sistemáticamente el Aspirine para prevenir,el Aspirine para,sistemáticamente el Aspirine,utilizar sistemáticamente el Aspirine,poder utilizar sistemáticamente el Aspirine,Aspirine para prevenir,Aspirine para prevenir el,Aspirine para prevenir el infarto
https://www.radiohuesca.com/sociedad/cerler-y-llanos-del-hospital-esperan-importante-afluencia-de-esquiadores-05122018-117988.html,radiohuesca.com,2018-12-05,===NONE===,Maspirineo/NP00000/maspirineo,"Agradecía  ,  en  ese  sentido  ,  la  colaboración  y  el  esfuerzo  de  los  profesionales  que  trabajan  en  la  estación  ,  las  dos  escuelas  de  esquí Maspirineo  y  Pronordics  y  los  monitores  y  voluntarios  de  la  Agrupación  Deportiva  Hospital  de  Benasque  .",maspirineo,np00000,maspirineo,esquí,esquí,NCMS000,de,de,SPS00,escuelas,escuela,NCFP000,dos,2,Z,las,el,DA0FP0,y,y,CC,Pronordics,pronordics,NP00000,y,y,CC,los,el,DA0MP0,monitores,monitor,NCMP000,2018-12-05,2018,2010,SPS00 NCMS000 Aspirine CC NP00000,NCMS000 Aspirine CC,SPS00 NCMS000 Aspirine,NCFP000 SPS00 NCMS000 Aspirine,Z NCFP000 SPS00 NCMS000 Aspirine,Aspirine CC NP00000,Aspirine CC NP00000 CC,Aspirine CC NP00000 CC DA0MP0,de esquí Aspirine y pronordics,esquí Aspirine y,de esquí Aspirine,escuela de esquí Aspirine,2 escuela de esquí Aspirine,Aspirine y pronordics,Aspirine y pronordics y,Aspirine y pronordics y el
https://www.radiohuesca.com/sociedad/buen-ambiente-y-buenas-condiciones-de-nieve-en-las-estaciones-de-ribagorza-22122018-118643.html,radiohuesca.com,2018-12-22,===NONE===,Maspirineo/NP00000/maspirineo,"Llanos  sumaba  hoy  medio  kilómetro  más  de  circuito  alcanzando  los  8,5  kms  entre  Plan  D'  Estan  y  Plan  del  Hospital  con  gran  esfuerzo  por  parte  de  personal  de  la  estación  ,  de  las  escuelas Maspirineo  y  Pronordics  y  de  la  Agrupación  Deportiva  Hospital  de  Benasque  . </doc>",maspirineo,np00000,maspirineo,escuelas,escuela,NCFP000,las,el,DA0FP0,de,de,SPS00,",",",",Fc,estación,estación,NCFS000,y,y,CC,Pronordics,pronordics,NP00000,y,y,CC,de,de,SPS00,la,el,DA0FS0,2018-12-22,2018,2010,DA0FP0 NCFP000 Aspirine CC NP00000,NCFP000 Aspirine CC,DA0FP0 NCFP000 Aspirine,SPS00 DA0FP0 NCFP000 Aspirine,Fc SPS00 DA0FP0 NCFP000 Aspirine,Aspirine CC NP00000,Aspirine CC NP00000 CC,Aspirine CC NP00000 CC SPS00,el escuela Aspirine y pronordics,escuela Aspirine y,el escuela Aspirine,de el escuela Aspirine,", de el escuela Aspirine",Aspirine y pronordics,Aspirine y pronordics y,Aspirine y pronordics y de
http://www.rcinet.ca/es/2019/01/10/aspirina-diaria-sin-efecto-preventivo-real-para-personas-mayores/,rcinet.ca,2019-01-10,Canada,Aspirine/NP00000/aspirine,"Estos  resultados  se  obtuvieron  a  través  del  estudio  ASPREE  ( Aspirine  in  Reducing  Events  in  the  Elderly  )  ,  en  el  cual  casi  20,000  personas  de  70  años  y  más  participaron  en  los  Estados  Unidos  y  Australia  .",aspirine,np00000,aspirine,(,(,Fpa,ASPREE,aspree,NP00000,estudio,estudio,NCMS000,del,de+el,SPS00+DA0MS0,través,través,NCMS000,in,in,NCMS000,Reducing,reducing,NP00000,Events,events,NP00000,in,in,RG,the,the,NCFS000,2019-01-10,2019,2010,NP00000 Fpa Aspirine NCMS000 NP00000,Fpa Aspirine NCMS000,NP00000 Fpa Aspirine,NCMS000 NP00000 Fpa Aspirine,SPS00+DA0MS0 NCMS000 NP00000 Fpa Aspirine,Aspirine NCMS000 NP00000,Aspirine NCMS000 NP00000 NP00000,Aspirine NCMS000 NP00000 NP00000 RG,aspree ( Aspirine in reducing,( Aspirine in,aspree ( Aspirine,estudio aspree ( Aspirine,de+el estudio aspree ( Aspirine,Aspirine in reducing,Aspirine in reducing events,Aspirine in reducing events in
https://comercioyjusticia.info/blog/opinion/hospital-de-derecho-y-salud-juridica-de-los-ciudadanos/,comercioyjusticia.info,2019-02-08,===NONE===,aspirineta/NCFS00D/aspirina,Este  diagnóstico  me  lleva  a  pensar  que  nuevamente  el  Estado  pretende  utilizar  una aspirineta  para  frenar  el  cáncer  de  la  imposibilidad  de  acceso  a  justicia  en  nuestro  país  .,aspirineta,ncfs00d,aspirina,una,uno,DI0FS0,utilizar,utilizar,VMN0000,pretende,pretender,VMIP3S0,Estado,estado,NP00000,el,el,DA0MS0,para,para,SPS00,frenar,frenar,VMN0000,el,el,DA0MS0,cáncer,cáncer,NCMS000,de,de,SPS00,2019-02-08,2019,2010,VMN0000 DI0FS0 Aspirine SPS00 VMN0000,DI0FS0 Aspirine SPS00,VMN0000 DI0FS0 Aspirine,VMIP3S0 VMN0000 DI0FS0 Aspirine,NP00000 VMIP3S0 VMN0000 DI0FS0 Aspirine,Aspirine SPS00 VMN0000,Aspirine SPS00 VMN0000 DA0MS0,Aspirine SPS00 VMN0000 DA0MS0 NCMS000,utilizar uno Aspirine para frenar,uno Aspirine para,utilizar uno Aspirine,pretender utilizar uno Aspirine,estado pretender utilizar uno Aspirine,Aspirine para frenar,Aspirine para frenar el,Aspirine para frenar el cáncer
http://centrodeinformes.com.ar/a-la-herencia-k-se-le-agrega-ahora-la-herencia-cambiemos/,centrodeinformes.com.ar,2019-02-12,Argentina,aspirinetas/NCFP00D/aspirina,"En  estos  4  años  habrán  agregado  otros  problemas  a  los  ya  heredados  por  el  kirchnerismo  como  es  el  caso  de  la  deuda  pública  para  financiar  el  déficit  fiscal  por  el  gasto  público  que  no  se  animaron  a  bajarEl  desafío  que  la  Argentina  tiene  por  delante  para  entrar  en  serio  en  una  senda  de  crecimiento  sostenido  es  de  una  magnitud  insospechada  que  no  se  resuelve  con  retoques  en  el  tipo  de  cambio  ,  en  la  tasa  de  interés  o  haciendo  artilugios  financieros  ni  aplicando aspirinetas  al  tema  fiscal  .",aspirinetas,ncfp00d,aspirina,aplicando,aplicar,VMG0000,ni,ni,CC,financieros,financiero,AQ0MP0,artilugios,artilugio,NCMP000,haciendo,hacer,VMG0000,al,a+el,SPS00+DA0MS0,tema,tema,NCMS000,fiscal,fiscal,AQ0CS0,.,.,Fp,,,,2019-02-12,2019,2010,CC VMG0000 Aspirine SPS00+DA0MS0 NCMS000,VMG0000 Aspirine SPS00+DA0MS0,CC VMG0000 Aspirine,AQ0MP0 CC VMG0000 Aspirine,NCMP000 AQ0MP0 CC VMG0000 Aspirine,Aspirine SPS00+DA0MS0 NCMS000,Aspirine SPS00+DA0MS0 NCMS000 AQ0CS0,Aspirine SPS00+DA0MS0 NCMS000 AQ0CS0 Fp,ni aplicar Aspirine a+el tema,aplicar Aspirine a+el,ni aplicar Aspirine,financiero ni aplicar Aspirine,artilugio financiero ni aplicar Aspirine,Aspirine a+el tema,Aspirine a+el tema fiscal,Aspirine a+el tema fiscal .
https://www.baenegocios.com/edicion-impresa/Remedio-o-aspirineta-20190301-0001.html,baenegocios.com,2019-03-01,===NONE===,aspirineta/NCFS00D/aspirina,<doc uri=https://www.baenegocios.com/edicion-impresa/Remedio-o-aspirineta-20190301-0001.html website=baenegocios.com date=2019-03-01 source_country=> /¿/Fia /remedio/NCMS000 /o/CC aspirineta  ?,aspirineta,ncfs00d,aspirina,o,o,CC,Remedio,remedio,NCMS000,¿,¿,Fia,,,,,,,?,?,Fit,,,,,,,,,,,,,2019-03-01,2019,2010,,CC Aspirine Fit,NCMS000 CC Aspirine,Fia NCMS000 CC Aspirine,,,,,,o Aspirine ?,remedio o Aspirine,¿ remedio o Aspirine,,,,
https://www.elancasti.com.ar/info-gral/2019/3/12/por-los-continuos-aumentos-se-venden-menos-medicamentos-398432.html,elancasti.com.ar,2019-03-12,Argentina,aspirinetas/NCFP00D/aspirina,"Remedios  como  Clonax  ,  Cardevil  ,  Atlansil  ,  Bigetril  ,  Nulipar  ,  Lotrial  ,  Valsartan  ,  Lanzopral  , aspirinetas  tuvieron  en  los  últimos  dos  meses  un  incremento  de  entre  un  7  %  y  9  %  .",aspirinetas,ncfp00d,aspirina,",",",",Fc,Lanzopral,lanzopral,NP00000,",",",",Fc,Valsartan,valsartan,NP00000,",",",",Fc,tuvieron,tener,VMIS3P0,en,en,SPS00,los,el,DA0MP0,últimos,último,AO0MP0,dos,2,Z,2019-03-12,2019,2010,NP00000 Fc Aspirine VMIS3P0 SPS00,Fc Aspirine VMIS3P0,NP00000 Fc Aspirine,Fc NP00000 Fc Aspirine,NP00000 Fc NP00000 Fc Aspirine,Aspirine VMIS3P0 SPS00,Aspirine VMIS3P0 SPS00 DA0MP0,Aspirine VMIS3P0 SPS00 DA0MP0 AO0MP0,"lanzopral , Aspirine tener en",", Aspirine tener","lanzopral , Aspirine",", lanzopral , Aspirine","valsartan , lanzopral , Aspirine",Aspirine tener en,Aspirine tener en el,Aspirine tener en el último
https://www.lanacion.com.ar/espectaculos/personajes/salomon-nid2232166,lanacion.com.ar,2019-03-27,Argentina,aspirineta/NCFS00D/aspirina,"Yo  era  una  mujer  sana  ,  apenas  una aspirineta  por  día  .",aspirineta,ncfs00d,aspirina,una,uno,DI0FS0,apenas,apenas,RG,",",",",Fc,sana,sano,AQ0FS0,mujer,mujer,NCFS000,por,por,SPS00,día,día,NCMS000,.,.,Fp,,,,,,,2019-03-27,2019,2010,RG DI0FS0 Aspirine SPS00 NCMS000,DI0FS0 Aspirine SPS00,RG DI0FS0 Aspirine,Fc RG DI0FS0 Aspirine,AQ0FS0 Fc RG DI0FS0 Aspirine,Aspirine SPS00 NCMS000,Aspirine SPS00 NCMS000 Fp,,apenas uno Aspirine por día,uno Aspirine por,apenas uno Aspirine,", apenas uno Aspirine","sano , apenas uno Aspirine",Aspirine por día,Aspirine por día .,
https://www.lanueva.com/nota/2019-4-6-7-0-18-preocupacion-por-el-movimiento-antivacunas-en-bahia-blanca-y-la-region,lanueva.com,2019-04-06,Argentina,aspirineta/NCFS00D/aspirina,"--  Excepcionalmente  puede  tenerlos  ,  al  igual  que  una aspirineta  ,  si  vamos  al  caso  .",aspirineta,ncfs00d,aspirina,una,uno,DI0FS0,que,que,CS,igual,igual,AQ0CS0,al,a+el,SPS00+DA0MS0,",",",",Fc,",",",",Fc,si,si,CS,vamos,ir,VMIP1P0,al,a+el,SPS00+DA0MS0,caso,caso,NCMS000,2019-04-06,2019,2010,CS DI0FS0 Aspirine Fc CS,DI0FS0 Aspirine Fc,CS DI0FS0 Aspirine,AQ0CS0 CS DI0FS0 Aspirine,SPS00+DA0MS0 AQ0CS0 CS DI0FS0 Aspirine,Aspirine Fc CS,Aspirine Fc CS VMIP1P0,Aspirine Fc CS VMIP1P0 SPS00+DA0MS0,"que uno Aspirine , si","uno Aspirine ,",que uno Aspirine,igual que uno Aspirine,a+el igual que uno Aspirine,"Aspirine , si","Aspirine , si ir","Aspirine , si ir a+el"
https://noticias.perfil.com/2019/04/24/economia-2019-elecciones-macri-medidas-economicas/,perfil.com,2019-04-24,===NONE===,aspirinetas/NCFP00D/aspirina,"Si  llegás  a  la  elección  con  un  2,5  %  mensual  será  para  festejar  ,  pero  puede  que  las  nuevas  medidas  queden  como aspirinetas  o  populismo  homeopático  porque  las  paritarias  se  van  a  quedar  cortas  respecto  de  la  inflación  .",aspirinetas,ncfp00d,aspirina,como,como,CS,queden,quedar,VMSP3P0,medidas,medida,NCFP000,nuevas,nuevo,AQ0FP0,las,el,DA0FP0,o,o,CC,populismo,populismo,NCMS000,homeopático,homeopático,AQ0MS0,porque,porque,CS,las,el,DA0FP0,2019-04-24,2019,2010,VMSP3P0 CS Aspirine CC NCMS000,CS Aspirine CC,VMSP3P0 CS Aspirine,NCFP000 VMSP3P0 CS Aspirine,AQ0FP0 NCFP000 VMSP3P0 CS Aspirine,Aspirine CC NCMS000,Aspirine CC NCMS000 AQ0MS0,Aspirine CC NCMS000 AQ0MS0 CS,quedar como Aspirine o populismo,como Aspirine o,quedar como Aspirine,medida quedar como Aspirine,nuevo medida quedar como Aspirine,Aspirine o populismo,Aspirine o populismo homeopático,Aspirine o populismo homeopático porque
http://www.diariodelaltoaragon.es/Deportes/NoticiasDetalle.aspx?Id=1163180,diariodelaltoaragon.es,2019-04-28,Spain,Maspirineo/NP00000/maspirineo,"Del  evento  informaron  en  rueda  de  prensa  ,  José  Masgrau  ,  presidente  de  MAB  ,  Fernando  Morata  ,  presidente  del  Comité  Aragonés  de  Marcha  Nórdica  ,  María  Dolores  Fábregas  ,  de  la  sección  de  MAB  y  Chemary  Carrera  ,  director  de Maspirineo  de  la  Escuela  de  Esquí  de  Montaña  ,  profesor  ,  formador  y  monitor  de  Marcha  Nórdica  .",maspirineo,np00000,maspirineo,de,de,SPS00,director,director,NCMS000,",",",",Fc,Carrera,carrera,NP00000,Chemary,chemary,NP00000,de,de,SPS00,la,el,DA0FS0,Escuela,escuela,NP00000,de,de,SPS00,Esquí,esquí,NP00000,2019-04-28,2019,2010,NCMS000 SPS00 Aspirine SPS00 DA0FS0,SPS00 Aspirine SPS00,NCMS000 SPS00 Aspirine,Fc NCMS000 SPS00 Aspirine,NP00000 Fc NCMS000 SPS00 Aspirine,Aspirine SPS00 DA0FS0,Aspirine SPS00 DA0FS0 NP00000,Aspirine SPS00 DA0FS0 NP00000 SPS00,director de Aspirine de el,de Aspirine de,director de Aspirine,", director de Aspirine","carrera , director de Aspirine",Aspirine de el,Aspirine de el escuela,Aspirine de el escuela de
https://www.90min.com/es/posts/6375427-el-real-madrid-busca-otra-cesion-para-odegaard,90min.com,2019-05-24,===NONE===,aspirineros/NCMP000/aspirineros,"Es  por  ello  que  los  merengues  querrían  cederle  a  un  club  de  un  escalón  superior  al  Geel  en  Zwart  ,  como  son  los aspirineros  .",aspirineros,ncmp000,aspirineros,los,el,DA0MP0,son,ser,VSIP3P0,como,como,CS,",",",",Fc,Zwart,zwart,NP00000,.,.,Fp,,,,,,,,,,,,,2019-05-24,2019,2010,,DA0MP0 Aspirine Fp,VSIP3P0 DA0MP0 Aspirine,CS VSIP3P0 DA0MP0 Aspirine,Fc CS VSIP3P0 DA0MP0 Aspirine,,,,,el Aspirine .,ser el Aspirine,como ser el Aspirine,", como ser el Aspirine",,,
http://www.primeraedicion.com.ar/nota/100124753/yo-me-ataje-y-no-vi-si-le-corte-declaro-el-imputado-por-homicidio/,primeraedicion.com.ar,2019-05-30,Argentina,aspirinetas/NCFP00D/aspirina,"Acerca  de  la  lluviosa  noche  en  que  ocurrió  el  sangriento  episodio  ,  Williams  contó  que  ""  fui  al  bar  a  comprar  unas aspirinetas  para  mi  hermana  ,  cuando  fui  interceptado  por  los  hermanos  Silveira  ,  Horacio  y  Miguel  .",aspirinetas,ncfp00d,aspirina,unas,uno,DI0FP0,comprar,comprar,VMN0000,a,a,SPS00,bar,bar,NCMS000,al,a+el,SPS00+DA0MS0,para,para,SPS00,mi,mi,DP1CSS,hermana,hermano,NCFS000,",",",",Fc,cuando,cuando,CS,2019-05-30,2019,2010,VMN0000 DI0FP0 Aspirine SPS00 DP1CSS,DI0FP0 Aspirine SPS00,VMN0000 DI0FP0 Aspirine,SPS00 VMN0000 DI0FP0 Aspirine,NCMS000 SPS00 VMN0000 DI0FP0 Aspirine,Aspirine SPS00 DP1CSS,Aspirine SPS00 DP1CSS NCFS000,Aspirine SPS00 DP1CSS NCFS000 Fc,comprar uno Aspirine para mi,uno Aspirine para,comprar uno Aspirine,a comprar uno Aspirine,bar a comprar uno Aspirine,Aspirine para mi,Aspirine para mi hermano,"Aspirine para mi hermano ,"
https://www.radiohuesca.com/deportes/barbastro-acoge-las-segundas-jornadas-aragonesas-de-marcha-nordica-de-aragon-30052019-125377.html,radiohuesca.com,2019-05-30,===NONE===,MASPIRINEO/NP00000/maspirineo,"Posteriormente  ,  Chemary  Carrera  ,  director  de MASPIRINEO  ,  tratará  el  tema  ""  Marcha  Nórdica  y  Montaña  ""  y  Mariano  Moreno  ,  instructor  de  Marcha  Nórdica  ,  desarrollará  el  tema  ""  Competición  y  Marcha  Nórdica  ""  .",maspirineo,np00000,maspirineo,de,de,SPS00,director,director,NCMS000,",",",",Fc,Carrera,carrera,NP00000,Chemary,chemary,NP00000,",",",",Fc,tratará,tratar,VMIF3S0,el,el,DA0MS0,tema,tema,NCMS000,"""","""",Fe,2019-05-30,2019,2010,NCMS000 SPS00 Aspirine Fc VMIF3S0,SPS00 Aspirine Fc,NCMS000 SPS00 Aspirine,Fc NCMS000 SPS00 Aspirine,NP00000 Fc NCMS000 SPS00 Aspirine,Aspirine Fc VMIF3S0,Aspirine Fc VMIF3S0 DA0MS0,Aspirine Fc VMIF3S0 DA0MS0 NCMS000,"director de Aspirine , tratar","de Aspirine ,",director de Aspirine,", director de Aspirine","carrera , director de Aspirine","Aspirine , tratar","Aspirine , tratar el","Aspirine , tratar el tema"
https://www.radiohuesca.com/deportes/exito-de-las-ii-jornadas-de-marcha-nordica-de-aragon-celebradas-en-barbastro-03062019-125522.html,radiohuesca.com,2019-06-03,===NONE===,Maspirineo/NP00000/maspirineo,"A  continuación  ,  Chemary  Carerra  ,  director  de Maspirineo  se  centró  en  '  Marcha  nórdica  y  montaña  '  y  Mariano  Moreno  ,  instructor  de  marcha  nórdica  ,  habló  acerca  de  '  Competición  y  marcha  nórdica  '  .",maspirineo,np00000,maspirineo,de,de,SPS00,director,director,NCMS000,",",",",Fc,Carerra,carerra,NP00000,Chemary,chemary,NP00000,se,se,P00CN000,centró,centrar,VMIS3S0,en,en,SPS00,',',Fe,Marcha,marcha,NCFS000,2019-06-03,2019,2010,NCMS000 SPS00 Aspirine P00CN000 VMIS3S0,SPS00 Aspirine P00CN000,NCMS000 SPS00 Aspirine,Fc NCMS000 SPS00 Aspirine,NP00000 Fc NCMS000 SPS00 Aspirine,Aspirine P00CN000 VMIS3S0,Aspirine P00CN000 VMIS3S0 SPS00,Aspirine P00CN000 VMIS3S0 SPS00 Fe,director de Aspirine se centrar,de Aspirine se,director de Aspirine,", director de Aspirine","carerra , director de Aspirine",Aspirine se centrar,Aspirine se centrar en,Aspirine se centrar en '
https://viapais.com.ar/san-nicolas/1078786-detuvieron-a-un-hombre-por-venta-ilegal-de-medicamentos-en-kioscos/,viapais.com.ar,2019-06-11,Argentina,Aspirineta/NP00000/aspirineta,"Entre  sus  pertenencias  le  hallaron  medicamentos  varios  bajo  receta  ,  IbuEvanol  ,  Tafirol  ,  Ibuprofeno  ,  Bayaspirina  , Aspirineta  ,  Buscapina  ,  Amoxicilina  ,  Paramen  y  Loratadina  ;  los  cuales  eran  distribuidos  en  locales  de  la  zona  .",aspirineta,np00000,aspirineta,",",",",Fc,Bayaspirina,bayaspirina,NP00000,",",",",Fc,Ibuprofeno,ibuprofeno,NP00000,",",",",Fc,",",",",Fc,Buscapina,buscapina,NP00000,",",",",Fc,Amoxicilina,amoxicilina,NP00000,",",",",Fc,2019-06-11,2019,2010,NP00000 Fc Aspirine Fc NP00000,Fc Aspirine Fc,NP00000 Fc Aspirine,Fc NP00000 Fc Aspirine,NP00000 Fc NP00000 Fc Aspirine,Aspirine Fc NP00000,Aspirine Fc NP00000 Fc,Aspirine Fc NP00000 Fc NP00000,"bayaspirina , Aspirine , buscapina",", Aspirine ,","bayaspirina , Aspirine",", bayaspirina , Aspirine","ibuprofeno , bayaspirina , Aspirine","Aspirine , buscapina","Aspirine , buscapina ,","Aspirine , buscapina , amoxicilina"
https://www.90min.com/es/posts/6397542-odegaard-podria-ser-cedido-a-la-real-sociedad,90min.com,2019-06-24,===NONE===,aspirineros/NCMP000/aspirineros,"Además  ,  con  los aspirineros  podría  coger  experiencia  europea  ,  dado  que  estarán  en  la  próxima  edición  de  la  Liga  de  Campeones  .",aspirineros,ncmp000,aspirineros,los,el,DA0MP0,con,con,SPS00,",",",",Fc,Además,además,RG,,,,podría,poder,VMIC3S0,coger,coger,VMN0000,experiencia,experiencia,NCFS000,europea,europeo,AQ0FS0,",",",",Fc,2019-06-24,2019,2010,SPS00 DA0MP0 Aspirine VMIC3S0 VMN0000,DA0MP0 Aspirine VMIC3S0,SPS00 DA0MP0 Aspirine,Fc SPS00 DA0MP0 Aspirine,RG Fc SPS00 DA0MP0 Aspirine,Aspirine VMIC3S0 VMN0000,Aspirine VMIC3S0 VMN0000 NCFS000,Aspirine VMIC3S0 VMN0000 NCFS000 AQ0FS0,con el Aspirine poder coger,el Aspirine poder,con el Aspirine,", con el Aspirine","además , con el Aspirine",Aspirine poder coger,Aspirine poder coger experiencia,Aspirine poder coger experiencia europeo
https://www.lavoz.com.ar/numero-cero/padres-en-tiempos-de-feminismo,lavoz.com.ar,2019-06-26,Argentina,aspirineta/NCFS00D/aspirina,"""  Qué  tranquilidad  ,  señora  mamá  ,  para  sus  hijitos  ,  usted  tiene aspirineta  ""  ,  rezaba  una  vieja  publicidad  que  representaba  una  cosmovisión  de  la  época  en  la  que  la  salud  de  los  hijos  estaba  a  cargo  de  la  madre  .",aspirineta,ncfs00d,aspirina,tiene,tener,VMIP3S0,usted,usted,PP2CS00P,",",",",Fc,hijitos,hijo,NCMP00D,sus,su,DP3CP0,"""","""",Fe,",",",",Fc,rezaba,rezar,VMII3S0,una,uno,DI0FS0,vieja,viejo,AQ0FS0,2019-06-26,2019,2010,PP2CS00P VMIP3S0 Aspirine Fe Fc,VMIP3S0 Aspirine Fe,PP2CS00P VMIP3S0 Aspirine,Fc PP2CS00P VMIP3S0 Aspirine,NCMP00D Fc PP2CS00P VMIP3S0 Aspirine,Aspirine Fe Fc,Aspirine Fe Fc VMII3S0,Aspirine Fe Fc VMII3S0 DI0FS0,"usted tener Aspirine "" ,","tener Aspirine """,usted tener Aspirine,", usted tener Aspirine","hijo , usted tener Aspirine","Aspirine "" ,","Aspirine "" , rezar","Aspirine "" , rezar uno"
https://centrodeinformes.com.ar/belu-lucius-sera-mama-por-segunda-vez-este-embarazo-es-distinto/,centrodeinformes.com.ar,2019-07-10,Argentina,aspirineta/NCFS00D/aspirina,Lo  están  regulando  con aspirineta  .,aspirineta,ncfs00d,aspirina,con,con,SPS00,regulando,regular,VMG0000,están,estar,VAIP3P0,Lo,lo,PP3CNA00,,,,.,.,Fp,,,,,,,,,,,,,2019-07-10,2019,2010,,SPS00 Aspirine Fp,VMG0000 SPS00 Aspirine,VAIP3P0 VMG0000 SPS00 Aspirine,PP3CNA00 VAIP3P0 VMG0000 SPS00 Aspirine,,,,,con Aspirine .,regular con Aspirine,estar regular con Aspirine,lo estar regular con Aspirine,,,
