url,website,date,country,keyword,sentence,kw,kw_lemma,kw_pos,left_w1,left_l1,left_p1,left_w2,left_l2,left_p2,left_w3,left_l3,left_p3,left_w4,left_l4,left_p4,left_w5,left_l5,left_p5,right_w1,right_l1,right_p1,right_w2,right_l2,right_p2,right_w3,right_l3,right_p3,right_w4,right_l4,right_p4,right_w5,right_l5,right_p5,datetime,year,10years,pattern_around5,pattern_around3,pattern_left2,pattern_left3,pattern_left4,pattern_right2,pattern_right3,pattern_right4,pattern_around5_lex,pattern_around3_lex,pattern_left2_lex,pattern_left3_lex,pattern_left4_lex,pattern_right2_lex,pattern_right3_lex,pattern_right4_lex
https://hardzone.es/tutoriales/mantenimiento/cambiar-ruedas-silla-gaming/,hardzone.es,2020-10-04,Spain,WD-40/Z/WD-40,"Por  norma  general  y  si  la  silla  está  en  buen  estado  no  necesitarás  tener  ninguna  herramienta  para  este  proceso  ,  pero  en  el  caso  de  que  haya  algún  problema  es  posible  que  necesites  unos  guantes  gruesos  (  o  un  trapo  )  y  un  destornillador  plano  o  incluso  3  en  1  o  algún  lubricante  como  el  conocido WD-40  .",wd-40,z,wd-40,conocido,conocer,VMP00SM,el,el,DA0MS0,como,como,CS,lubricante,lubricante,NCMS000,algún,alguno,DI0MS0,.,.,Fp,,,,,,,,,,,,,2020-10-04,2020,2020,,VMP00SM WD-40 Fp,DA0MS0 VMP00SM WD-40,CS DA0MS0 VMP00SM WD-40,NCMS000 CS DA0MS0 VMP00SM WD-40,,,,,conocer WD-40 .,el conocer WD-40,como el conocer WD-40,lubricante como el conocer WD-40,,,
https://hardzone.es/tutoriales/mantenimiento/cambiar-ruedas-silla-gaming/,hardzone.es,2020-10-04,Spain,WD-40/Z/WD-40,"Si  alguna  de  las  ruedas  está  atascada  tienes  varias  opciones  :  puedes  rociar  el  anclaje  con  lubricante  como  3  en  1  o WD-40  y  entonces  tirar  de  la  rueda  con  un  trapo  ,  o  puedes  hacer  palanca  con  un  destornillador  plano  que  sea  lo  suficientemente  grande  .",wd-40,z,wd-40,o,o,CC,1,1,Z,en,en,SPS00,3,3,Z,como,como,CS,y,y,CC,entonces,entonces,RG,tirar,tirar,VMN0000,de,de,SPS00,la,el,DA0FS0,2020-10-04,2020,2020,Z CC WD-40 CC RG,CC WD-40 CC,Z CC WD-40,SPS00 Z CC WD-40,Z SPS00 Z CC WD-40,WD-40 CC RG,WD-40 CC RG VMN0000,WD-40 CC RG VMN0000 SPS00,1 o WD-40 y entonces,o WD-40 y,1 o WD-40,en 1 o WD-40,3 en 1 o WD-40,WD-40 y entonces,WD-40 y entonces tirar,WD-40 y entonces tirar de
https://www.diariovasco.com/motor/reportajes/como-limpiar-faros-coche-20201021011400-ntrc.html,diariovasco.com,2020-10-20,Spain,WD-40/Z/WD-40,"Por  ejemplo  usando  pasta  de  dientes  para  pulir  la  superficie  ,  añadiendo  después  algún  desengrasante  como WD-40  .",wd-40,z,wd-40,como,como,CS,desengrasante,desengrasante,AQ0CS0,algún,alguno,DI0MS0,después,después,RG,añadiendo,añadir,VMG0000,.,.,Fp,,,,,,,,,,,,,2020-10-20,2020,2020,,CS WD-40 Fp,AQ0CS0 CS WD-40,DI0MS0 AQ0CS0 CS WD-40,RG DI0MS0 AQ0CS0 CS WD-40,,,,,como WD-40 .,desengrasante como WD-40,alguno desengrasante como WD-40,después alguno desengrasante como WD-40,,,
https://www.latercera.com/tendencias/noticia/la-aventura-de-abrir-un-nuevo-local-gastronomico-en-plena-pandemia/NQGWX7N5ANGCHFML57BMPXIDYQ/,latercera.com,2020-11-06,Chile,WD-40/Z/WD-40,"Aun  así  tuvieron  que  poner  más  plata  de  su  bolsillo  para  seguir  aguantando  a  puertas  cerradas  y  sólo  con  delivery  hasta  que  en  septiembre  pudieron  por  fin  abrir  literalmente  todas  las  puertas  del  local  .  ""  Tuvimos  que  aplicar WD-40  en  los  candados  de  la  terraza  para  poder  abrirlos  ,  porque  al  final  llevábamos  meses  trabajando  de  verdad  encerrados  ""  ,  recuerda  .",wd-40,z,wd-40,aplicar,aplicar,VMN0000,que,que,CS,Tuvimos,tener,VMIS1P0,"""","""",Fe,.,.,Fp,en,en,SPS00,los,el,DA0MP0,candados,candado,NCMP000,de,de,SPS00,la,el,DA0FS0,2020-11-06,2020,2020,CS VMN0000 WD-40 SPS00 DA0MP0,VMN0000 WD-40 SPS00,CS VMN0000 WD-40,VMIS1P0 CS VMN0000 WD-40,Fe VMIS1P0 CS VMN0000 WD-40,WD-40 SPS00 DA0MP0,WD-40 SPS00 DA0MP0 NCMP000,WD-40 SPS00 DA0MP0 NCMP000 SPS00,que aplicar WD-40 en el,aplicar WD-40 en,que aplicar WD-40,tener que aplicar WD-40,""" tener que aplicar WD-40",WD-40 en el,WD-40 en el candado,WD-40 en el candado de
https://lanetaneta.com/batir-la-grasa-quitar-las-manchas-de-grasa-de-la-ropa/,lanetaneta.com,2020-11-12,===NONE===,WD-40/Z/WD-40,"La  laca  para  el  cabello  y  el WD-40  también  se  han  utilizado  para  combatir  las  manchas  de  grasa  ,  pero  estos  métodos  son  más  duros  y  pueden  no  ser  adecuados  para  todos  los  tejidos  .",wd-40,z,wd-40,el,el,DA0MS0,y,y,CC,cabello,cabello,NCMS000,el,el,DA0MS0,para,para,SPS00,también,también,RG,se,se,P00CN000,han,haber,VAIP3P0,utilizado,utilizar,VMP00SM,para,para,SPS00,2020-11-12,2020,2020,CC DA0MS0 WD-40 RG P00CN000,DA0MS0 WD-40 RG,CC DA0MS0 WD-40,NCMS000 CC DA0MS0 WD-40,DA0MS0 NCMS000 CC DA0MS0 WD-40,WD-40 RG P00CN000,WD-40 RG P00CN000 VAIP3P0,WD-40 RG P00CN000 VAIP3P0 VMP00SM,y el WD-40 también se,el WD-40 también,y el WD-40,cabello y el WD-40,el cabello y el WD-40,WD-40 también se,WD-40 también se haber,WD-40 también se haber utilizar
https://lanetaneta.com/como-quitar-las-manchas-de-grasa-de-la-ropa/,lanetaneta.com,2020-11-15,===NONE===,WD-40/Z/WD-40,"Algunos  de  los  mejores  materiales  para  eliminar  las  manchas  de  grasa  son  el  líquido  para  lavar  platos  ,  el  almidón  de  maíz  ,  el  talco  en  polvo  ,  el  bicarbonato  de  sodio  y  ,  en  situaciones  difíciles  ,  el WD-40  .",wd-40,z,wd-40,el,el,DA0MS0,",",",",Fc,difíciles,difícil,AQ0CP0,situaciones,situación,NCFP000,en,en,SPS00,.,.,Fp,,,,,,,,,,,,,2020-11-15,2020,2020,,DA0MS0 WD-40 Fp,Fc DA0MS0 WD-40,AQ0CP0 Fc DA0MS0 WD-40,NCFP000 AQ0CP0 Fc DA0MS0 WD-40,,,,,el WD-40 .,", el WD-40","difícil , el WD-40","situación difícil , el WD-40",,,
https://lanetaneta.com/como-quitar-las-manchas-de-grasa-de-la-ropa/,lanetaneta.com,2020-11-15,===NONE===,WD-40/Z/WD-40,"En  tales  casos  ,  aplique  una  pequeña  cantidad  de WD-40  en  el  área  afectada  .",wd-40,z,wd-40,de,de,SPS00,cantidad,cantidad,NCFS000,pequeña,pequeño,AQ0FS0,una,uno,DI0FS0,aplique,aplicar,VMSP3S0,en,en,SPS00,el,el,DA0MS0,área,área,NCFS000,afectada,afectar,VMP00SF,.,.,Fp,2020-11-15,2020,2020,NCFS000 SPS00 WD-40 SPS00 DA0MS0,SPS00 WD-40 SPS00,NCFS000 SPS00 WD-40,AQ0FS0 NCFS000 SPS00 WD-40,DI0FS0 AQ0FS0 NCFS000 SPS00 WD-40,WD-40 SPS00 DA0MS0,WD-40 SPS00 DA0MS0 NCFS000,WD-40 SPS00 DA0MS0 NCFS000 VMP00SF,cantidad de WD-40 en el,de WD-40 en,cantidad de WD-40,pequeño cantidad de WD-40,uno pequeño cantidad de WD-40,WD-40 en el,WD-40 en el área,WD-40 en el área afectar
https://lanetaneta.com/como-sacar-la-savia-de-los-arboles-de-los-pantalones/,lanetaneta.com,2020-11-17,===NONE===,WD-40/Z/WD-40,"Si  sus  pantalones  son  jeans  o  están  hechos  de  otro  material  pesado  ,  puede  rociar  el  área  cursi  con WD-40  y  dejar  que  penetre  en  el  área  durante  al  menos  1  minuto  .",wd-40,z,wd-40,con,con,SPS00,cursi,cursi,AQ0CS0,área,área,NCFS000,el,el,DA0MS0,rociar,rociar,VMN0000,y,y,CC,dejar,dejar,VMN0000,que,que,CS,penetre,penetrar,VMSP3S0,en,en,SPS00,2020-11-17,2020,2020,AQ0CS0 SPS00 WD-40 CC VMN0000,SPS00 WD-40 CC,AQ0CS0 SPS00 WD-40,NCFS000 AQ0CS0 SPS00 WD-40,DA0MS0 NCFS000 AQ0CS0 SPS00 WD-40,WD-40 CC VMN0000,WD-40 CC VMN0000 CS,WD-40 CC VMN0000 CS VMSP3S0,cursi con WD-40 y dejar,con WD-40 y,cursi con WD-40,área cursi con WD-40,el área cursi con WD-40,WD-40 y dejar,WD-40 y dejar que,WD-40 y dejar que penetrar
https://lanetaneta.com/como-quitar-las-manchas-de-lapiz-labial-de-la-ropa/,lanetaneta.com,2020-11-23,===NONE===,WD-40/Z/WD-40,"El WD-40  ,  la  laca  para  el  cabello  y  el  amoníaco  tienden  a  tener  olores  muy  fuertes  ,  y  el  alcohol  desnaturalizado  tiene  un  olor  especialmente  tóxico  ,  ya  que  es  etanol  y  es  altamente  venenoso  .",wd-40,z,wd-40,El,el,DA0MS0,,,,,,,,,,,,,",",",",Fc,la,el,DA0FS0,laca,laca,NCFS000,para,para,SPS00,el,el,DA0MS0,2020-11-23,2020,2020,,DA0MS0 WD-40 Fc,,,,WD-40 Fc DA0FS0,WD-40 Fc DA0FS0 NCFS000,WD-40 Fc DA0FS0 NCFS000 SPS00,,"el WD-40 ,",,,,"WD-40 , el","WD-40 , el laca","WD-40 , el laca para"
https://lanetaneta.com/como-quitar-las-manchas-de-lapiz-labial-de-la-ropa/,lanetaneta.com,2020-11-23,===NONE===,WD-40/Z/WD-40,Haga  lo  mismo  si  usa  aceite WD-40  .,wd-40,z,wd-40,aceite,aceite,NCMS000,usa,usar,VMIP3S0,si,si,CS,mismo,mismo,AQ0MS0,lo,el,DA0NS0,.,.,Fp,,,,,,,,,,,,,2020-11-23,2020,2020,,NCMS000 WD-40 Fp,VMIP3S0 NCMS000 WD-40,CS VMIP3S0 NCMS000 WD-40,AQ0MS0 CS VMIP3S0 NCMS000 WD-40,,,,,aceite WD-40 .,usar aceite WD-40,si usar aceite WD-40,mismo si usar aceite WD-40,,,
https://lanetaneta.com/como-quitar-la-cera-de-crayon-de-la-tapiceria-del-automovil/,lanetaneta.com,2020-11-23,===NONE===,WD-40/Z/WD-40,"Una  vez  que  haya  quitado  la  mayor  cantidad  de  crayón  que  pueda  ,  rocíe  una  pequeña  cantidad  de WD-40  .",wd-40,z,wd-40,de,de,SPS00,cantidad,cantidad,NCFS000,pequeña,pequeño,AQ0FS0,una,uno,DI0FS0,rocíe,rociar,VMM03S0,.,.,Fp,,,,,,,,,,,,,2020-11-23,2020,2020,,SPS00 WD-40 Fp,NCFS000 SPS00 WD-40,AQ0FS0 NCFS000 SPS00 WD-40,DI0FS0 AQ0FS0 NCFS000 SPS00 WD-40,,,,,de WD-40 .,cantidad de WD-40,pequeño cantidad de WD-40,uno pequeño cantidad de WD-40,,,
https://lanetaneta.com/como-quitar-la-cera-de-crayon-de-la-tapiceria-del-automovil/,lanetaneta.com,2020-11-23,===NONE===,WD-40/Z/WD-40,"Después  de  que  el WD-40  haya  fraguado  durante  10  minutos  ,  aplique  una  pequeña  cantidad  de  líquido  para  platos  en  la  mancha  y  frótelo  con  una  esponja  .",wd-40,z,wd-40,el,el,DA0MS0,que,que,CS,de,de,SPS00,Después,después,RG,,,,haya,haber,VASP1S0,fraguado,fraguar,VMP00SM,durante,durante,SPS00,10,10,Z,minutos,minuto,NCMP000,2020-11-23,2020,2020,CS DA0MS0 WD-40 VASP1S0 VMP00SM,DA0MS0 WD-40 VASP1S0,CS DA0MS0 WD-40,SPS00 CS DA0MS0 WD-40,RG SPS00 CS DA0MS0 WD-40,WD-40 VASP1S0 VMP00SM,WD-40 VASP1S0 VMP00SM SPS00,WD-40 VASP1S0 VMP00SM SPS00 Z,que el WD-40 haber fraguar,el WD-40 haber,que el WD-40,de que el WD-40,después de que el WD-40,WD-40 haber fraguar,WD-40 haber fraguar durante,WD-40 haber fraguar durante 10
https://lanetaneta.com/como-quitar-las-manchas-hollin-alquitran-colorante-alimentario/,lanetaneta.com,2020-11-24,===NONE===,WD-40/Z/WD-40,La  investigación  muestra  que WD-40  funciona  bien  en  la  eliminación  de  alquitrán  .,wd-40,z,wd-40,que,que,CS,muestra,mostrar,VMIP3S0,investigación,investigación,NCFS000,La,el,DA0FS0,,,,funciona,funcionar,VMIP3S0,bien,bien,RG,en,en,SPS00,la,el,DA0FS0,eliminación,eliminación,NCFS000,2020-11-24,2020,2020,VMIP3S0 CS WD-40 VMIP3S0 RG,CS WD-40 VMIP3S0,VMIP3S0 CS WD-40,NCFS000 VMIP3S0 CS WD-40,DA0FS0 NCFS000 VMIP3S0 CS WD-40,WD-40 VMIP3S0 RG,WD-40 VMIP3S0 RG SPS00,WD-40 VMIP3S0 RG SPS00 DA0FS0,mostrar que WD-40 funcionar bien,que WD-40 funcionar,mostrar que WD-40,investigación mostrar que WD-40,el investigación mostrar que WD-40,WD-40 funcionar bien,WD-40 funcionar bien en,WD-40 funcionar bien en el
https://lanetaneta.com/metodos-de-eliminacion-de-cera-de-velas-lanetaneta-com/,lanetaneta.com,2020-11-25,===NONE===,WD-40/Z/WD-40,"Para  ventanas  de  vidrio  ,  rocíe  la  superficie  de  la  ventana  con  lubricante WD-40  ,  que  ayuda  a  licuar  la  parafina  de  las  velas  .",wd-40,z,wd-40,lubricante,lubricante,NCMS000,con,con,SPS00,ventana,ventana,NCFS000,la,el,DA0FS0,de,de,SPS00,",",",",Fc,que,que,CS,ayuda,ayuda,NCFS000,a,a,SPS00,licuar,licuar,VMN0000,2020-11-25,2020,2020,SPS00 NCMS000 WD-40 Fc CS,NCMS000 WD-40 Fc,SPS00 NCMS000 WD-40,NCFS000 SPS00 NCMS000 WD-40,DA0FS0 NCFS000 SPS00 NCMS000 WD-40,WD-40 Fc CS,WD-40 Fc CS NCFS000,WD-40 Fc CS NCFS000 SPS00,"con lubricante WD-40 , que","lubricante WD-40 ,",con lubricante WD-40,ventana con lubricante WD-40,el ventana con lubricante WD-40,"WD-40 , que","WD-40 , que ayuda","WD-40 , que ayuda a"
https://lanetaneta.com/quitar-la-cinta-adhesiva-sin-dejar-residuos/,lanetaneta.com,2020-11-25,===NONE===,WD-40/Z/WD-40,"Suponiendo  que  la  superficie  donde  se  encuentra  el  residuo  no  se  dañará  con  productos  químicos  ,  puede  rociar  el  área  pegajosa  con WD-40  .",wd-40,z,wd-40,con,con,SPS00,pegajosa,pegajoso,AQ0FS0,área,área,NCFS000,el,el,DA0MS0,rociar,rociar,VMN0000,.,.,Fp,,,,,,,,,,,,,2020-11-25,2020,2020,,SPS00 WD-40 Fp,AQ0FS0 SPS00 WD-40,NCFS000 AQ0FS0 SPS00 WD-40,DA0MS0 NCFS000 AQ0FS0 SPS00 WD-40,,,,,con WD-40 .,pegajoso con WD-40,área pegajoso con WD-40,el área pegajoso con WD-40,,,
https://lanetaneta.com/como-pulir-el-niquelado/,lanetaneta.com,2020-11-29,===NONE===,WD-40/Z/WD-40,"Si  el  truco  del  limpiador  de  hornos  no  funciona  ,  intente  usar  un  poco  de WD-40  y  lana  de  acero  .",wd-40,z,wd-40,de,de,SPS00,poco,poco,PI0MS000,un,uno,DI0MS0,usar,usar,VMN0000,intente,intentar,VMSP3S0,y,y,CC,lana,lana,NCFS000,de,de,SPS00,acero,acero,NCMS000,.,.,Fp,2020-11-29,2020,2020,PI0MS000 SPS00 WD-40 CC NCFS000,SPS00 WD-40 CC,PI0MS000 SPS00 WD-40,DI0MS0 PI0MS000 SPS00 WD-40,VMN0000 DI0MS0 PI0MS000 SPS00 WD-40,WD-40 CC NCFS000,WD-40 CC NCFS000 SPS00,WD-40 CC NCFS000 SPS00 NCMS000,poco de WD-40 y lana,de WD-40 y,poco de WD-40,uno poco de WD-40,usar uno poco de WD-40,WD-40 y lana,WD-40 y lana de,WD-40 y lana de acero
https://lanetaneta.com/como-pulir-el-niquelado/,lanetaneta.com,2020-11-29,===NONE===,WD-40/Z/WD-40,"Si  sus  artículos  de  níquel  están  manchados  o  tienen  un  aspecto  verde  ,  use  una  pequeña  cantidad  de WD-40  y  lana  de  acero  para  restregarlos  suavemente  .",wd-40,z,wd-40,de,de,SPS00,cantidad,cantidad,NCFS000,pequeña,pequeño,AQ0FS0,una,uno,DI0FS0,use,usar,VMSP3S0,y,y,CC,lana,lana,NCFS000,de,de,SPS00,acero,acero,NCMS000,para,para,SPS00,2020-11-29,2020,2020,NCFS000 SPS00 WD-40 CC NCFS000,SPS00 WD-40 CC,NCFS000 SPS00 WD-40,AQ0FS0 NCFS000 SPS00 WD-40,DI0FS0 AQ0FS0 NCFS000 SPS00 WD-40,WD-40 CC NCFS000,WD-40 CC NCFS000 SPS00,WD-40 CC NCFS000 SPS00 NCMS000,cantidad de WD-40 y lana,de WD-40 y,cantidad de WD-40,pequeño cantidad de WD-40,uno pequeño cantidad de WD-40,WD-40 y lana,WD-40 y lana de,WD-40 y lana de acero
https://lanetaneta.com/como-quitar-chicle-del-hormigon/,lanetaneta.com,2020-12-08,===NONE===,WD-40/Z/WD-40,Puede  agregar  un  poco  de WD-40  a  sus  herramientas  para  este  trabajo  .,wd-40,z,wd-40,de,de,SPS00,poco,poco,PI0MS000,un,uno,DI0MS0,agregar,agregar,VMN0000,Puede,poder,VMIP3S0,a,a,SPS00,sus,su,DP3CP0,herramientas,herramienta,NCFP000,para,para,SPS00,este,este,DD0MS0,2020-12-08,2020,2020,PI0MS000 SPS00 WD-40 SPS00 DP3CP0,SPS00 WD-40 SPS00,PI0MS000 SPS00 WD-40,DI0MS0 PI0MS000 SPS00 WD-40,VMN0000 DI0MS0 PI0MS000 SPS00 WD-40,WD-40 SPS00 DP3CP0,WD-40 SPS00 DP3CP0 NCFP000,WD-40 SPS00 DP3CP0 NCFP000 SPS00,poco de WD-40 a su,de WD-40 a,poco de WD-40,uno poco de WD-40,agregar uno poco de WD-40,WD-40 a su,WD-40 a su herramienta,WD-40 a su herramienta para
https://www.que.es/como/como-quitar-chicle-suela-zapato.html,que.es,2020-12-26,Spain,WD-40/Z/WD-40," WD-40  ,  gracias  a  la  boquilla  de  pulverización  dirigida  ,  es  mejor  cuando  te  preocupan  las  manchas  porque  puedes  apuntar  directamente  al  chicle  en  lugar  de  esparcirse  por  todo  el  zapato  .",wd-40,z,wd-40,,,,,,,,,,,,,,,,",",",",Fc,gracias,gracia,NCFP000,a,a,SPS00,la,el,DA0FS0,boquilla,boquilla,NCFS000,2020-12-26,2020,2020,,,,,,WD-40 Fc NCFP000,WD-40 Fc NCFP000 SPS00,WD-40 Fc NCFP000 SPS00 DA0FS0,,,,,,"WD-40 , gracia","WD-40 , gracia a","WD-40 , gracia a el"
https://www.que.es/como/como-quitar-chicle-suela-zapato.html,que.es,2020-12-26,Spain,WD-40/Z/WD-40,"El WD-40  y  el  líquido  para  encendedores  pueden  parecer  opciones  inusuales  para  quitar  el  chicle  de  los  zapatos  ,  pero  en  realidad  son  bastante  efectivos  ya  que  funcionan  de  manera  muy  similar  a  la  congelación  para  endurecer  la  goma  de  mascar  y  hacer  que  sea  más  fácil  de  pelar  .",wd-40,z,wd-40,El,el,DA0MS0,,,,,,,,,,,,,y,y,CC,el,el,DA0MS0,líquido,líquido,NCMS000,para,para,SPS00,encendedores,encendedor,NCMP000,2020-12-26,2020,2020,,DA0MS0 WD-40 CC,,,,WD-40 CC DA0MS0,WD-40 CC DA0MS0 NCMS000,WD-40 CC DA0MS0 NCMS000 SPS00,,el WD-40 y,,,,WD-40 y el,WD-40 y el líquido,WD-40 y el líquido para
https://www.que.es/como/como-quitar-chicle-suela-zapato.html,que.es,2020-12-26,Spain,WD-40/Z/WD-40,"Para WD-40  ,  simplemente  rocía  una  cantidad  generosa  de  la  lata  sobre  el  chicle  y  déjalo  reposar  durante  un  minuto  .",wd-40,z,wd-40,Para,para,SPS00,,,,,,,,,,,,,",",",",Fc,simplemente,simplemente,RG,rocía,rociar,VMIP3S0,una,uno,DI0FS0,cantidad,cantidad,NCFS000,2020-12-26,2020,2020,,SPS00 WD-40 Fc,,,,WD-40 Fc RG,WD-40 Fc RG VMIP3S0,WD-40 Fc RG VMIP3S0 DI0FS0,,"para WD-40 ,",,,,"WD-40 , simplemente","WD-40 , simplemente rociar","WD-40 , simplemente rociar uno"
https://www.deperu.com/autos/chasis-del-automvil-637,deperu.com,2020-12-27,===NONE===,WD-40/Z/WD-40,"Cuando  se  ha  completado  el  lavado  ,  se  debe  aplicar  una  capa  protectora  que  surge  de  mezclar  aceite WD-40  más  una  solución  siliconeada  que  ,  a  su  vez  ,  mantiene  la  lubricación  durante  más  tiempo  .",wd-40,z,wd-40,aceite,aceite,NCMS000,mezclar,mezclar,VMN0000,de,de,SPS00,surge,surgir,VMIP3S0,que,que,PR0CN000,más,más,RG,una,uno,DI0FS0,solución,solución,NCFS000,siliconeada,siliconeada,VMP00SF,que,que,PR0CN000,2020-12-27,2020,2020,VMN0000 NCMS000 WD-40 RG DI0FS0,NCMS000 WD-40 RG,VMN0000 NCMS000 WD-40,SPS00 VMN0000 NCMS000 WD-40,VMIP3S0 SPS00 VMN0000 NCMS000 WD-40,WD-40 RG DI0FS0,WD-40 RG DI0FS0 NCFS000,WD-40 RG DI0FS0 NCFS000 VMP00SF,mezclar aceite WD-40 más uno,aceite WD-40 más,mezclar aceite WD-40,de mezclar aceite WD-40,surgir de mezclar aceite WD-40,WD-40 más uno,WD-40 más uno solución,WD-40 más uno solución siliconeada
https://es.theepochtimes.com/autonomia-una-virtud-estadounidense_773149.html,theepochtimes.com,2020-12-30,===NONE===,WD-40/Z/WD-40,"Primero  usó WD-40  y  una  llave  inglesa  ,  luego  fue  adentro  ,  regresó  con  un  soplete  ,  calentó  con  cuidado  una  de  las  tapas  y  válvulas  y  probó  la  llave  de  nuevo  .",wd-40,z,wd-40,usó,usar,VMIS3S0,Primero,primero,RG,,,,,,,,,,y,y,CC,una,1,Z,llave,llave,NCFS000,inglesa,inglés,AQ0FS0,",",",",Fc,2020-12-30,2020,2020,RG VMIS3S0 WD-40 CC Z,VMIS3S0 WD-40 CC,RG VMIS3S0 WD-40,,,WD-40 CC Z,WD-40 CC Z NCFS000,WD-40 CC Z NCFS000 AQ0FS0,primero usar WD-40 y 1,usar WD-40 y,primero usar WD-40,,,WD-40 y 1,WD-40 y 1 llave,WD-40 y 1 llave inglés
https://www.interempresas.net/Ferreteria/Articulos/322731-AFEB-organiza-una-jornada-sobre-la-gestion-del-departamento-de-recursos-humanos.html,interempresas.net,2021-01-12,===NONE===,WD-40/Z/WD-40,"La  Asociación  de  Fabricantes  de  Bricolaje  y  Ferretería  (  AFEB  )  celebró  dos  sesiones  para  el  grupo  de  trabajo  sobre  RR  HH  ,  lideradas  por  Carmen  Quesada  ,  directora  financiera  y  de  RR  HH  de WD-40  ,  en  ambas  ocasiones  .",wd-40,z,wd-40,de,de,SPS00,HH,hh,NP00000,RR,rr,NP00000,de,de,SPS00,y,y,CC,",",",",Fc,en,en,SPS00,ambas,ambos,DI0FP0,ocasiones,ocasión,NCFP000,.,.,Fp,2021-01-12,2021,2020,NP00000 SPS00 WD-40 Fc SPS00,SPS00 WD-40 Fc,NP00000 SPS00 WD-40,NP00000 NP00000 SPS00 WD-40,SPS00 NP00000 NP00000 SPS00 WD-40,WD-40 Fc SPS00,WD-40 Fc SPS00 DI0FP0,WD-40 Fc SPS00 DI0FP0 NCFP000,"hh de WD-40 , en","de WD-40 ,",hh de WD-40,rr hh de WD-40,de rr hh de WD-40,"WD-40 , en","WD-40 , en ambos","WD-40 , en ambos ocasión"
https://lanetaneta.com/como-limpiar-la-goma-de-mascar-de-la-secadora/,lanetaneta.com,2021-01-16,===NONE===,WD-40/Z/WD-40,Enfoque  con  cuidado  y  rocíe WD-40  sobre  las  manchas  engomadas  .,wd-40,z,wd-40,rocíe,rociar,VMSP3S0,y,y,CC,cuidado,cuidado,NCMS000,con,con,SPS00,Enfoque,enfoque,NCMS000,sobre,sobre,SPS00,las,el,DA0FP0,manchas,mancha,NCFP000,engomadas,engomar,VMP00PF,.,.,Fp,2021-01-16,2021,2020,CC VMSP3S0 WD-40 SPS00 DA0FP0,VMSP3S0 WD-40 SPS00,CC VMSP3S0 WD-40,NCMS000 CC VMSP3S0 WD-40,SPS00 NCMS000 CC VMSP3S0 WD-40,WD-40 SPS00 DA0FP0,WD-40 SPS00 DA0FP0 NCFP000,WD-40 SPS00 DA0FP0 NCFP000 VMP00PF,y rociar WD-40 sobre el,rociar WD-40 sobre,y rociar WD-40,cuidado y rociar WD-40,con cuidado y rociar WD-40,WD-40 sobre el,WD-40 sobre el mancha,WD-40 sobre el mancha engomar
https://lanetaneta.com/como-limpiar-la-goma-de-mascar-de-la-secadora/,lanetaneta.com,2021-01-16,===NONE===,WD-40/Z/WD-40,"Haga  esto  en  un  área  ventilada  ,  ya  que  el WD-40  puede  emitir  vapores  desagradables  y  deje  que  el  lubricante  penetre  completamente  después  .",wd-40,z,wd-40,el,el,DA0MS0,que,que,CS,ya,ya,RG,",",",",Fc,ventilada,ventilar,VMP00SF,puede,poder,VMIP3S0,emitir,emitir,VMN0000,vapores,vapor,NCMP000,desagradables,desagradable,AQ0CP0,y,y,CC,2021-01-16,2021,2020,CS DA0MS0 WD-40 VMIP3S0 VMN0000,DA0MS0 WD-40 VMIP3S0,CS DA0MS0 WD-40,RG CS DA0MS0 WD-40,Fc RG CS DA0MS0 WD-40,WD-40 VMIP3S0 VMN0000,WD-40 VMIP3S0 VMN0000 NCMP000,WD-40 VMIP3S0 VMN0000 NCMP000 AQ0CP0,que el WD-40 poder emitir,el WD-40 poder,que el WD-40,ya que el WD-40,", ya que el WD-40",WD-40 poder emitir,WD-40 poder emitir vapor,WD-40 poder emitir vapor desagradable
https://lanetaneta.com/como-limpiar-la-goma-de-mascar-de-la-secadora/,lanetaneta.com,2021-01-16,===NONE===,WD-40/Z/WD-40,"Humedezca  las  toallas  y  los  trapos  gastados  con  agua  corriente  y  séquelos  en  la  secadora  a  fuego  medio  para  limpiar  cualquier  chicle  ,  jabón  o WD-40  que  pueda  haber  en  el  tambor  . </doc>",wd-40,z,wd-40,o,o,CC,jabón,jabón,NCMS000,",",",",Fc,chicle,chicle,NCMS000,cualquier,cualquiera,DI0CS0,que,que,PR0CN000,pueda,poder,VMSP1S0,haber,haber,VMN0000,en,en,SPS00,el,el,DA0MS0,2021-01-16,2021,2020,NCMS000 CC WD-40 PR0CN000 VMSP1S0,CC WD-40 PR0CN000,NCMS000 CC WD-40,Fc NCMS000 CC WD-40,NCMS000 Fc NCMS000 CC WD-40,WD-40 PR0CN000 VMSP1S0,WD-40 PR0CN000 VMSP1S0 VMN0000,WD-40 PR0CN000 VMSP1S0 VMN0000 SPS00,jabón o WD-40 que poder,o WD-40 que,jabón o WD-40,", jabón o WD-40","chicle , jabón o WD-40",WD-40 que poder,WD-40 que poder haber,WD-40 que poder haber en
https://www.deperu.com/autos/chasis-del-automovil-637,deperu.com,2021-01-19,===NONE===,WD-40/Z/WD-40,"Cuando  se  ha  completado  el  lavado  ,  se  debe  aplicar  una  capa  protectora  que  surge  de  mezclar  aceite WD-40  más  una  solución  siliconeada  que  ,  a  su  vez  ,  mantiene  la  lubricación  durante  más  tiempo  .",wd-40,z,wd-40,aceite,aceite,NCMS000,mezclar,mezclar,VMN0000,de,de,SPS00,surge,surgir,VMIP3S0,que,que,PR0CN000,más,más,RG,una,uno,DI0FS0,solución,solución,NCFS000,siliconeada,siliconeada,VMP00SF,que,que,PR0CN000,2021-01-19,2021,2020,VMN0000 NCMS000 WD-40 RG DI0FS0,NCMS000 WD-40 RG,VMN0000 NCMS000 WD-40,SPS00 VMN0000 NCMS000 WD-40,VMIP3S0 SPS00 VMN0000 NCMS000 WD-40,WD-40 RG DI0FS0,WD-40 RG DI0FS0 NCFS000,WD-40 RG DI0FS0 NCFS000 VMP00SF,mezclar aceite WD-40 más uno,aceite WD-40 más,mezclar aceite WD-40,de mezclar aceite WD-40,surgir de mezclar aceite WD-40,WD-40 más uno,WD-40 más uno solución,WD-40 más uno solución siliconeada
https://www.excelsior.com.mx/opinion/alfredo-la-mont-iii/sin-maquillaje-arlamontmsncom/1428943,excelsior.com.mx,2021-01-25,Mexico,WD-40/Z/WD-40,"En  este  caso  ,  un  buen  método  es  usar  aceite WD-40  ,  el  cual  puede  borrar  las  marcas  de  crayón  de  numerosas  superficies  como  :  papel  tapiz  ,  alfombras  ,  pizarrones  ,  muebles  de  madera  comprimida  y  paredes  blancas  .",wd-40,z,wd-40,aceite,aceite,NCMS000,usar,usar,VMN0000,es,ser,VSIP3S0,método,método,NCMS000,buen,bueno,AQ0MS0,",",",",Fc,el,el,DA0MS0,cual,cual,PR0CS000,puede,poder,VMIP3S0,borrar,borrar,VMN0000,2021-01-25,2021,2020,VMN0000 NCMS000 WD-40 Fc DA0MS0,NCMS000 WD-40 Fc,VMN0000 NCMS000 WD-40,VSIP3S0 VMN0000 NCMS000 WD-40,NCMS000 VSIP3S0 VMN0000 NCMS000 WD-40,WD-40 Fc DA0MS0,WD-40 Fc DA0MS0 PR0CS000,WD-40 Fc DA0MS0 PR0CS000 VMIP3S0,"usar aceite WD-40 , el","aceite WD-40 ,",usar aceite WD-40,ser usar aceite WD-40,método ser usar aceite WD-40,"WD-40 , el","WD-40 , el cual","WD-40 , el cual poder"
https://lanetaneta.com/como-quitar-los-residuos-de-cinta-adhesiva-del-exterior-de-un-automovil/,lanetaneta.com,2021-03-06,===NONE===,WD-40/Z/WD-40,"Además  ,  no  use WD-40  ,  que  puede  hacer  que  un  residuo  aceitoso  penetre  en  la  pintura  de  su  automóvil  ,  y  esto  es  aún  más  difícil  de  limpiar  por  completo  que  el  residuo  original  de  la  cinta  adhesiva  . </doc>",wd-40,z,wd-40,use,usar,VMSP3S0,no,no,RN,",",",",Fc,Además,además,RG,,,,",",",",Fc,que,que,PR0CN000,puede,poder,VMIP3S0,hacer,hacer,VMN0000,que,que,CS,2021-03-06,2021,2020,RN VMSP3S0 WD-40 Fc PR0CN000,VMSP3S0 WD-40 Fc,RN VMSP3S0 WD-40,Fc RN VMSP3S0 WD-40,RG Fc RN VMSP3S0 WD-40,WD-40 Fc PR0CN000,WD-40 Fc PR0CN000 VMIP3S0,WD-40 Fc PR0CN000 VMIP3S0 VMN0000,"no usar WD-40 , que","usar WD-40 ,",no usar WD-40,", no usar WD-40","además , no usar WD-40","WD-40 , que","WD-40 , que poder","WD-40 , que poder hacer"
https://lanetaneta.com/preguntas-y-respuestas-sobre-el-cuidado-de-la-madera/,lanetaneta.com,2021-03-18,===NONE===,WD-40/Z/WD-40,"El  aceite  mineral  puro  ,  el  aceite  vegetal  y  el WD-40  también  son  eficaces  para  eliminar  los  residuos  de  cinta  de  las  superficies  acabadas  .",wd-40,z,wd-40,el,el,DA0MS0,y,y,CC,vegetal,vegetal,AQ0CS0,aceite,aceite,NCMS000,el,el,DA0MS0,también,también,RG,son,ser,VSIP3P0,eficaces,eficaz,AQ0CP0,para,para,SPS00,eliminar,eliminar,VMN0000,2021-03-18,2021,2020,CC DA0MS0 WD-40 RG VSIP3P0,DA0MS0 WD-40 RG,CC DA0MS0 WD-40,AQ0CS0 CC DA0MS0 WD-40,NCMS000 AQ0CS0 CC DA0MS0 WD-40,WD-40 RG VSIP3P0,WD-40 RG VSIP3P0 AQ0CP0,WD-40 RG VSIP3P0 AQ0CP0 SPS00,y el WD-40 también ser,el WD-40 también,y el WD-40,vegetal y el WD-40,aceite vegetal y el WD-40,WD-40 también ser,WD-40 también ser eficaz,WD-40 también ser eficaz para
