url,website,date,country,keyword,sentence,kw,kw_lemma,kw_pos,left_w1,left_l1,left_p1,left_w2,left_l2,left_p2,left_w3,left_l3,left_p3,left_w4,left_l4,left_p4,left_w5,left_l5,left_p5,right_w1,right_l1,right_p1,right_w2,right_l2,right_p2,right_w3,right_l3,right_p3,right_w4,right_l4,right_p4,right_w5,right_l5,right_p5,datetime,year,10years,pattern_around5,pattern_around3,pattern_left2,pattern_left3,pattern_left4,pattern_right2,pattern_right3,pattern_right4,pattern_around5_lex,pattern_around3_lex,pattern_left2_lex,pattern_left3_lex,pattern_left4_lex,pattern_right2_lex,pattern_right3_lex,pattern_right4_lex
http://www.vavel.com/es/internacional/bundesliga/333988-bayerrn-de-munich-vs-schalke-04-en-vivo-y-en-directo-online.html,vavel.com,2014-03-01,Spain,aspirineros/NCMP000/aspirineros,Los aspirineros  podrian  Perder  also  La  Tercera  posicion  en  el  Caso  de  Que  el  Schalke  ganara  Hoy  en  Munich  .,aspirineros,ncmp000,aspirineros,Los,el,DA0MP0,,,,,,,,,,,,,podrian,podrian,VMIP3P0,Perder,perder,NP00000,also,also,NCMS000,La,la,NP00000,Tercera,tercera,NP00000,2014-03-01,2014,2010,,DA0MP0 Aspirine VMIP3P0,,,,Aspirine VMIP3P0 NP00000,Aspirine VMIP3P0 NP00000 NCMS000,Aspirine VMIP3P0 NP00000 NCMS000 NP00000,,el Aspirine podrian,,,,Aspirine podrian perder,Aspirine podrian perder also,Aspirine podrian perder also la
http://www.clarin.com/politica/Polemica-precio-medicamentos_0_1097290331.html,clarin.com,2014-03-07,Argentina,Aspirineta/NP00000/aspirineta,"El  listado  incluye  la Aspirineta  ,  con  un  alza  del  29,3  %  .  ""  Pero  los  productos  de  venta  libre  no  entran  en  el  acuerdo  ""  ,  dicen  las  empresas  .",aspirineta,np00000,aspirineta,la,el,DA0FS0,incluye,incluir,VMIP3S0,listado,listado,NCMS000,El,el,DA0MS0,,,,",",",",Fc,con,con,SPS00,un,uno,DI0MS0,alza,alza,NCFS000,del,de+el,SPS00+DA0MS0,2014-03-07,2014,2010,VMIP3S0 DA0FS0 Aspirine Fc SPS00,DA0FS0 Aspirine Fc,VMIP3S0 DA0FS0 Aspirine,NCMS000 VMIP3S0 DA0FS0 Aspirine,DA0MS0 NCMS000 VMIP3S0 DA0FS0 Aspirine,Aspirine Fc SPS00,Aspirine Fc SPS00 DI0MS0,Aspirine Fc SPS00 DI0MS0 NCFS000,"incluir el Aspirine , con","el Aspirine ,",incluir el Aspirine,listado incluir el Aspirine,el listado incluir el Aspirine,"Aspirine , con","Aspirine , con uno","Aspirine , con uno alza"
http://www.lanacion.com.ar/1673047-a-pesar-de-los-anuncios-los-precios-de-los-medicamentos-no-bajan,lanacion.com.ar,2014-03-19,Argentina,Aspirinetas/NP00000/aspirinetas,"Hoy  ,  la  caja  de Aspirinetas  es  un  30  %  más  alto  :  26,34  pesos  .",aspirinetas,np00000,aspirinetas,de,de,SPS00,caja,caja,NCFS000,la,el,DA0FS0,",",",",Fc,Hoy,hoy,RG,es,ser,VSIP3S0,un,uno,DI0MS0,30,30,Z,%,%,Ft,más,más,RG,2014-03-19,2014,2010,NCFS000 SPS00 Aspirine VSIP3S0 DI0MS0,SPS00 Aspirine VSIP3S0,NCFS000 SPS00 Aspirine,DA0FS0 NCFS000 SPS00 Aspirine,Fc DA0FS0 NCFS000 SPS00 Aspirine,Aspirine VSIP3S0 DI0MS0,Aspirine VSIP3S0 DI0MS0 Z,Aspirine VSIP3S0 DI0MS0 Z Ft,caja de Aspirine ser uno,de Aspirine ser,caja de Aspirine,el caja de Aspirine,", el caja de Aspirine",Aspirine ser uno,Aspirine ser uno 30,Aspirine ser uno 30 %
http://www.telam.com.ar/notas/201405/64402-la-fda-de-estados-unidos-confirmo-que-la-aspirina-no-tiene-ningun-efecto-preventivo-contra-los-infartos.html,telam.com.ar,2014-05-24,Argentina,aspirineta/NCFS00D/aspirina,"La  AAPM  denunció  entonces  ""  la  proliferación  de  publicidades  de  medicamentos  de  venta  libre  ""  y  señaló  su  ""  preocupación  ""  por  ""  la  flamante  campaña  del  laboratorio  Bayer  para  la aspirineta  ,  dirigida  en  especial  a  las  mujeres  y  proponiendo  su  producto  como  '  remedio  '  para  la  obesidad  ,  el  sedentarismo  y  el  tabaquismo  ""  .",aspirineta,ncfs00d,aspirina,la,el,DA0FS0,para,para,SPS00,Bayer,bayer,NP00000,laboratorio,laboratorio,NCMS000,del,de+el,SPS00+DA0MS0,",",",",Fc,dirigida,dirigir,VMP00SF,en,en,SPS00,especial,especial,AQ0CS0,a,a,SPS00,2014-05-24,2014,2010,SPS00 DA0FS0 Aspirine Fc VMP00SF,DA0FS0 Aspirine Fc,SPS00 DA0FS0 Aspirine,NP00000 SPS00 DA0FS0 Aspirine,NCMS000 NP00000 SPS00 DA0FS0 Aspirine,Aspirine Fc VMP00SF,Aspirine Fc VMP00SF SPS00,Aspirine Fc VMP00SF SPS00 AQ0CS0,"para el Aspirine , dirigir","el Aspirine ,",para el Aspirine,bayer para el Aspirine,laboratorio bayer para el Aspirine,"Aspirine , dirigir","Aspirine , dirigir en","Aspirine , dirigir en especial"
http://www.telam.com.ar/notas/201405/64402-la-fda-de-estados-unidos-confirmo-que-la-aspirina-no-tiene-ningun-efecto-preventivo-contra-los-infartos.html,telam.com.ar,2014-05-24,Argentina,aspirineta/NCFS00D/aspirina,"El  mensaje  que  deviene  de  Bayer  sostuvo  :  ""  seguí  comiendo  y  fumando  ,  no  hagas  actividad  física  ,  total  la aspirineta  te  cuida  ""  ,  puntualizó  el  gremio  .",aspirineta,ncfs00d,aspirina,la,el,DA0FS0,total,total,AQ0CS0,",",",",Fc,física,físico,AQ0FS0,actividad,actividad,NCFS000,te,te,PP2CS000,cuida,cuidar,VMIP3S0,"""","""",Fe,",",",",Fc,puntualizó,puntualizar,VMIS3S0,2014-05-24,2014,2010,AQ0CS0 DA0FS0 Aspirine PP2CS000 VMIP3S0,DA0FS0 Aspirine PP2CS000,AQ0CS0 DA0FS0 Aspirine,Fc AQ0CS0 DA0FS0 Aspirine,AQ0FS0 Fc AQ0CS0 DA0FS0 Aspirine,Aspirine PP2CS000 VMIP3S0,Aspirine PP2CS000 VMIP3S0 Fe,Aspirine PP2CS000 VMIP3S0 Fe Fc,total el Aspirine te cuidar,el Aspirine te,total el Aspirine,", total el Aspirine","físico , total el Aspirine",Aspirine te cuidar,"Aspirine te cuidar ""","Aspirine te cuidar "" ,"
http://www.telam.com.ar/notas/201405/64402-la-fda-de-estados-unidos-confirmo-que-la-aspirina-no-tiene-ningun-efecto-preventivo-contra-los-infartos.html,telam.com.ar,2014-05-24,Argentina,aspirineta/NCFS00D/aspirina,"Resoluciones  y  Disposiciones  imponían  el  respeto  a  criterios  éticos  de  la  Disposición  2.845/11  ,  que  la  AAPM  reclamó  cumplir  para  publicidades  de  Bayer  por  la aspirineta  ,  Aleve  y  Actron  .",aspirineta,ncfs00d,aspirina,la,el,DA0FS0,por,por,SPS00,Bayer,bayer,NP00000,de,de,SPS00,publicidades,publicidad,NCFP000,",",",",Fc,Aleve,aleve,NP00000,y,y,CC,Actron,actron,NP00000,.,.,Fp,2014-05-24,2014,2010,SPS00 DA0FS0 Aspirine Fc NP00000,DA0FS0 Aspirine Fc,SPS00 DA0FS0 Aspirine,NP00000 SPS00 DA0FS0 Aspirine,SPS00 NP00000 SPS00 DA0FS0 Aspirine,Aspirine Fc NP00000,Aspirine Fc NP00000 CC,Aspirine Fc NP00000 CC NP00000,"por el Aspirine , aleve","el Aspirine ,",por el Aspirine,bayer por el Aspirine,de bayer por el Aspirine,"Aspirine , aleve","Aspirine , aleve y","Aspirine , aleve y actron"
http://www.telam.com.ar/notas/201405/64402-la-fda-de-estados-unidos-confirmo-que-la-aspirina-no-tiene-ningun-efecto-preventivo-contra-los-infartos.html,telam.com.ar,2014-05-24,Argentina,aspirineta/NCFS00D/aspirina,"El  gremio  también  difundió  en  2013  un  informe  científico  de  la  BBC  de  Londres  ,  que  desmoronó  ""  la  imagen  positiva  y  beneficiosa  que  Bayer  construyó  durante  décadas  en  torno  de  la aspirineta  ""  .",aspirineta,ncfs00d,aspirina,la,el,DA0FS0,de,de,SPS00,torno,torno,NCMS000,en,en,SPS00,décadas,década,NCFP000,"""","""",Fe,.,.,Fp,,,,,,,,,,2014-05-24,2014,2010,SPS00 DA0FS0 Aspirine Fe Fp,DA0FS0 Aspirine Fe,SPS00 DA0FS0 Aspirine,NCMS000 SPS00 DA0FS0 Aspirine,SPS00 NCMS000 SPS00 DA0FS0 Aspirine,Aspirine Fe Fp,,,"de el Aspirine "" .","el Aspirine """,de el Aspirine,torno de el Aspirine,en torno de el Aspirine,"Aspirine "" .",,
http://www.telam.com.ar/notas/201405/64402-la-fda-de-estados-unidos-confirmo-que-la-aspirina-no-tiene-ningun-efecto-preventivo-contra-los-infartos.html,telam.com.ar,2014-05-24,Argentina,aspirineta/NCFS00D/aspirina,"""  Una aspirineta  al  día  ,  más  riesgos  que  beneficios  ""  ,  fue  la  conclusión  de  un  informe  del  10  de  enero  de  2012  por  la  cadena  británica  BBC  al  reproducir  un  estudio  publicado  en  Archives  of  Internal  Medicine  (  Archivos  de  Medicina  Interna  )  .",aspirineta,ncfs00d,aspirina,Una,uno,DI0FS0,"""","""",Fe,,,,,,,,,,al,a+el,SPS00+DA0MS0,día,día,NCMS000,",",",",Fc,más,más,RG,riesgos,riesgo,NCMP000,2014-05-24,2014,2010,Fe DI0FS0 Aspirine SPS00+DA0MS0 NCMS000,DI0FS0 Aspirine SPS00+DA0MS0,Fe DI0FS0 Aspirine,,,Aspirine SPS00+DA0MS0 NCMS000,Aspirine SPS00+DA0MS0 NCMS000 Fc,Aspirine SPS00+DA0MS0 NCMS000 Fc RG,""" uno Aspirine a+el día",uno Aspirine a+el,""" uno Aspirine",,,Aspirine a+el día,"Aspirine a+el día ,","Aspirine a+el día , más"
http://www.telam.com.ar/notas/201405/64402-la-fda-de-estados-unidos-confirmo-que-la-aspirina-no-tiene-ningun-efecto-preventivo-contra-los-infartos.html,telam.com.ar,2014-05-24,Argentina,aspirineta/NCFS00D/aspirina,"""  La  popular aspirineta  puede  producir  alteraciones  sanguíneas  e  irritación  gástrica  .",aspirineta,ncfs00d,aspirina,popular,popular,AQ0CS0,La,el,DA0FS0,"""","""",Fe,,,,,,,puede,poder,VMIP3S0,producir,producir,VMN0000,alteraciones,alteración,NCFP000,sanguíneas,sanguíneo,AQ0FP0,e,y,CC,2014-05-24,2014,2010,DA0FS0 AQ0CS0 Aspirine VMIP3S0 VMN0000,AQ0CS0 Aspirine VMIP3S0,DA0FS0 AQ0CS0 Aspirine,Fe DA0FS0 AQ0CS0 Aspirine,,Aspirine VMIP3S0 VMN0000,Aspirine VMIP3S0 VMN0000 NCFP000,Aspirine VMIP3S0 VMN0000 NCFP000 AQ0FP0,el popular Aspirine poder producir,popular Aspirine poder,el popular Aspirine,""" el popular Aspirine",,Aspirine poder producir,Aspirine poder producir alteración,Aspirine poder producir alteración sanguíneo
http://lt10digital.com.ar/noticia/idnot/221926/preocupaelconsumodemedicamentoslibres.html,lt10digital.com.ar,2014-12-11,Argentina,Aspirineta/NP00000/aspirineta,"Entre  ellas  está  la  de  la Aspirineta  de  Bayer  ,  por  afirmar  que  una  de  esas  pastillas  por  día  previene  el  infarto  .",aspirineta,np00000,aspirineta,la,el,DA0FS0,de,de,SPS00,la,el,DA0FS0,está,estar,VAIP3S0,ellas,ellos,PP3FP000,de,de,SPS00,Bayer,bayer,NP00000,",",",",Fc,por,por,SPS00,afirmar,afirmar,VMN0000,2014-12-11,2014,2010,SPS00 DA0FS0 Aspirine SPS00 NP00000,DA0FS0 Aspirine SPS00,SPS00 DA0FS0 Aspirine,DA0FS0 SPS00 DA0FS0 Aspirine,VAIP3S0 DA0FS0 SPS00 DA0FS0 Aspirine,Aspirine SPS00 NP00000,Aspirine SPS00 NP00000 Fc,Aspirine SPS00 NP00000 Fc SPS00,de el Aspirine de bayer,el Aspirine de,de el Aspirine,el de el Aspirine,estar el de el Aspirine,Aspirine de bayer,"Aspirine de bayer ,","Aspirine de bayer , por"
http://an1.com.ar/?p=268#comment-6,an1.com.ar,2015-01-28,Argentina,Aspirineta/NP00000/aspirineta,"Entre  ellas  está  la  de  la Aspirineta  de  Bayer  ,  por  afirmar  que  una  de  esas  pastillas  por  día  previene  el  infarto  .",aspirineta,np00000,aspirineta,la,el,DA0FS0,de,de,SPS00,la,el,DA0FS0,está,estar,VAIP3S0,ellas,ellos,PP3FP000,de,de,SPS00,Bayer,bayer,NP00000,",",",",Fc,por,por,SPS00,afirmar,afirmar,VMN0000,2015-01-28,2015,2010,SPS00 DA0FS0 Aspirine SPS00 NP00000,DA0FS0 Aspirine SPS00,SPS00 DA0FS0 Aspirine,DA0FS0 SPS00 DA0FS0 Aspirine,VAIP3S0 DA0FS0 SPS00 DA0FS0 Aspirine,Aspirine SPS00 NP00000,Aspirine SPS00 NP00000 Fc,Aspirine SPS00 NP00000 Fc SPS00,de el Aspirine de bayer,el Aspirine de,de el Aspirine,el de el Aspirine,estar el de el Aspirine,Aspirine de bayer,"Aspirine de bayer ,","Aspirine de bayer , por"
http://www.eldiario.com.ar/diario/deportes/nota.php?id=129010,eldiario.com.ar,2015-03-12,Argentina,Aspirineta/NP00000/aspirineta,"Me  contestó  :  gracias  a  lo  que  hace  ,  solo  puede  tomar  una Aspirineta  .",aspirineta,np00000,aspirineta,una,uno,DI0FS0,tomar,tomar,VMN0000,puede,poder,VMIP3S0,solo,solo,RG,",",",",Fc,.,.,Fp,,,,,,,,,,,,,2015-03-12,2015,2010,,DI0FS0 Aspirine Fp,VMN0000 DI0FS0 Aspirine,VMIP3S0 VMN0000 DI0FS0 Aspirine,RG VMIP3S0 VMN0000 DI0FS0 Aspirine,,,,,uno Aspirine .,tomar uno Aspirine,poder tomar uno Aspirine,solo poder tomar uno Aspirine,,,
http://vos.lavoz.com.ar/cine/siempre-alice-y-otras-peliculas-sobre-el-alzheimer,lavoz.com.ar,2015-03-12,Argentina,aspirineta/NCFS00D/aspirina,"En  Eterno  resplandor  de  una  mente  sin  recuerdos  ,  por  ejemplo  ,  es  un  vacío  que  prescribe  un  médico  como  si  fuera  una aspirineta  mágica  .",aspirineta,ncfs00d,aspirina,una,uno,DI0FS0,fuera,ser,VSSI1S0,si,si,CS,como,como,CS,médico,médico,NCCS000,mágica,mágico,AQ0FS0,.,.,Fp,,,,,,,,,,2015-03-12,2015,2010,VSSI1S0 DI0FS0 Aspirine AQ0FS0 Fp,DI0FS0 Aspirine AQ0FS0,VSSI1S0 DI0FS0 Aspirine,CS VSSI1S0 DI0FS0 Aspirine,CS CS VSSI1S0 DI0FS0 Aspirine,Aspirine AQ0FS0 Fp,,,ser uno Aspirine mágico .,uno Aspirine mágico,ser uno Aspirine,si ser uno Aspirine,como si ser uno Aspirine,Aspirine mágico .,,
http://www.pagina12.com.ar/diario/deportes/8-269194-2015-03-28.html,pagina12.com.ar,2015-03-28,Argentina,aspirineta/NCFS00D/aspirina,"Una  nueva  "" aspirineta  ""  pretende  terminar  con  ciertas  violencias  .",aspirineta,ncfs00d,aspirina,"""","""",Fe,nueva,nuevo,AQ0FS0,Una,uno,DI0FS0,,,,,,,"""","""",Fe,pretende,pretender,VMIP3S0,terminar,terminar,VMN0000,con,con,SPS00,ciertas,cierto,AQ0FP0,2015-03-28,2015,2010,AQ0FS0 Fe Aspirine Fe VMIP3S0,Fe Aspirine Fe,AQ0FS0 Fe Aspirine,DI0FS0 AQ0FS0 Fe Aspirine,,Aspirine Fe VMIP3S0,Aspirine Fe VMIP3S0 VMN0000,Aspirine Fe VMIP3S0 VMN0000 SPS00,"nuevo "" Aspirine "" pretender",""" Aspirine ""","nuevo "" Aspirine","uno nuevo "" Aspirine",,"Aspirine "" pretender","Aspirine "" pretender terminar","Aspirine "" pretender terminar con"
http://www.diariobae.com/notas/66465-las-aspirinetas-de-gabriela-los-amigos-de-daniel-y-las-garrafas-de-mordor.html,diariobae.com,2015-04-10,===NONE===,aspirinetas/NCFP00D/aspirina,"<doc uri=http://www.diariobae.com/notas/66465-las-aspirinetas-de-gabriela-los-amigos-de-daniel-y-las-garrafas-de-mordor.html website=diariobae.com date=2015-04-10 source_country=> /el/DA0FP0 aspirinetas  de  Gabriela  ,  los  amigos  de  Daniel  y  las  garrafas  de  Mordor",aspirinetas,ncfp00d,aspirina,Las,el,DA0FP0,,,,,,,,,,,,,de,de,SPS00,Gabriela,gabriela,NP00000,",",",",Fc,los,el,DA0MP0,amigos,amigo,NCMP000,2015-04-10,2015,2010,,DA0FP0 Aspirine SPS00,,,,Aspirine SPS00 NP00000,Aspirine SPS00 NP00000 Fc,Aspirine SPS00 NP00000 Fc DA0MP0,,el Aspirine de,,,,Aspirine de gabriela,"Aspirine de gabriela ,","Aspirine de gabriela , el"
http://www.eldiario.com.ar/diario/interes-general/nota.php?id=136337,eldiario.com.ar,2015-06-28,Argentina,Aspirineta/NP00000/aspirineta,"Entre  ellas  está  la  de  la Aspirineta  de  Bayer  ,  por  afirmar  que  una  de  esas  pastillas  por  día  previene  el  infarto  ,  cuando  autoridades  sanitarias  de  Estados  Unidos  ,  como  la  Food  and  Drug  Administration  ,  afirman  lo  contrario  .",aspirineta,np00000,aspirineta,la,el,DA0FS0,de,de,SPS00,la,el,DA0FS0,está,estar,VAIP3S0,ellas,ellos,PP3FP000,de,de,SPS00,Bayer,bayer,NP00000,",",",",Fc,por,por,SPS00,afirmar,afirmar,VMN0000,2015-06-28,2015,2010,SPS00 DA0FS0 Aspirine SPS00 NP00000,DA0FS0 Aspirine SPS00,SPS00 DA0FS0 Aspirine,DA0FS0 SPS00 DA0FS0 Aspirine,VAIP3S0 DA0FS0 SPS00 DA0FS0 Aspirine,Aspirine SPS00 NP00000,Aspirine SPS00 NP00000 Fc,Aspirine SPS00 NP00000 Fc SPS00,de el Aspirine de bayer,el Aspirine de,de el Aspirine,el de el Aspirine,estar el de el Aspirine,Aspirine de bayer,"Aspirine de bayer ,","Aspirine de bayer , por"
http://paralelo32.com.ar/secciones/detalle.php?id=23438,paralelo32.com.ar,2015-09-07,Argentina,aspirineta/NCFS00D/aspirina,--  LC  :  La aspirineta  puede  ser  letal  en  los  niños  .,aspirineta,ncfs00d,aspirina,La,el,DA0FS0,:,:,Fd,LC,lc,NP00000,--,--,Fg,,,,puede,poder,VMIP3S0,ser,ser,VSN0000,letal,letal,AQ0CS0,en,en,SPS00,los,el,DA0MP0,2015-09-07,2015,2010,Fd DA0FS0 Aspirine VMIP3S0 VSN0000,DA0FS0 Aspirine VMIP3S0,Fd DA0FS0 Aspirine,NP00000 Fd DA0FS0 Aspirine,Fg NP00000 Fd DA0FS0 Aspirine,Aspirine VMIP3S0 VSN0000,Aspirine VMIP3S0 VSN0000 AQ0CS0,Aspirine VMIP3S0 VSN0000 AQ0CS0 SPS00,: el Aspirine poder ser,el Aspirine poder,: el Aspirine,lc : el Aspirine,-- lc : el Aspirine,Aspirine poder ser,Aspirine poder ser letal,Aspirine poder ser letal en
http://www.lmneuquen.com.ar/noticias/2015/9/29/en-el-dia-del-corazon-como-evitar-problemas-cardiacos_264414,lmneuquen.com.ar,2015-09-29,Argentina,aspirineta/NCFS00D/aspirina,"Y  agregó  :  ""  La  dosis  que  tiene  la aspirineta  es  necesaria  para  prevenir  el  evento  cardíacos  """,aspirineta,ncfs00d,aspirina,la,el,DA0FS0,tiene,tener,VMIP3S0,que,que,PR0CN000,dosis,dosis,NCFN000,La,el,DA0FS0,es,ser,VSIP3S0,necesaria,necesario,AQ0FS0,para,para,SPS00,prevenir,prevenir,VMN0000,el,el,DA0MS0,2015-09-29,2015,2010,VMIP3S0 DA0FS0 Aspirine VSIP3S0 AQ0FS0,DA0FS0 Aspirine VSIP3S0,VMIP3S0 DA0FS0 Aspirine,PR0CN000 VMIP3S0 DA0FS0 Aspirine,NCFN000 PR0CN000 VMIP3S0 DA0FS0 Aspirine,Aspirine VSIP3S0 AQ0FS0,Aspirine VSIP3S0 AQ0FS0 SPS00,Aspirine VSIP3S0 AQ0FS0 SPS00 VMN0000,tener el Aspirine ser necesario,el Aspirine ser,tener el Aspirine,que tener el Aspirine,dosis que tener el Aspirine,Aspirine ser necesario,Aspirine ser necesario para,Aspirine ser necesario para prevenir
http://notife.com/447399-la-suba-en-el-precio-de-remedios-supero-el-anuncio-oficial-y-llega-a-9/,notife.com,2015-11-13,===NONE===,aspirinetas/NCFP00D/aspirina,"La  caja  de aspirinetas  cuesta  24  %  más  y  el  antihipertensivo  Nalapril  un  21  %  más  ,  ya  que  aumentó  de  $37,26  a  $45,38  .",aspirinetas,ncfp00d,aspirina,de,de,SPS00,caja,caja,NCFS000,La,el,DA0FS0,,,,,,,cuesta,costar,VMIP3S0,24,24,Z,%,%,Ft,más,más,RG,y,y,CC,2015-11-13,2015,2010,NCFS000 SPS00 Aspirine VMIP3S0 Z,SPS00 Aspirine VMIP3S0,NCFS000 SPS00 Aspirine,DA0FS0 NCFS000 SPS00 Aspirine,,Aspirine VMIP3S0 Z,Aspirine VMIP3S0 Z Ft,Aspirine VMIP3S0 Z Ft RG,caja de Aspirine costar 24,de Aspirine costar,caja de Aspirine,el caja de Aspirine,,Aspirine costar 24,Aspirine costar 24 %,Aspirine costar 24 % más
http://www.diarioz.com.ar/nota/como-prevenir-un-acv-47779/,diarioz.com.ar,2015-11-26,Argentina,aspirineta/NCFS00D/aspirina,"La  famosa aspirineta  diaria  o  ,  en  el  caso  que  se  pueda  hacer  cirugía  para  ""  destapar  ""  la  arteria  ,  se  lo  complementa  con  el  control  de  los  lípidos  y  la  hipertensión  .",aspirineta,ncfs00d,aspirina,famosa,famoso,AQ0FS0,La,el,DA0FS0,,,,,,,,,,diaria,diario,AQ0FS0,o,o,CC,",",",",Fc,en,en,SPS00,el,el,DA0MS0,2015-11-26,2015,2010,DA0FS0 AQ0FS0 Aspirine AQ0FS0 CC,AQ0FS0 Aspirine AQ0FS0,DA0FS0 AQ0FS0 Aspirine,,,Aspirine AQ0FS0 CC,Aspirine AQ0FS0 CC Fc,Aspirine AQ0FS0 CC Fc SPS00,el famoso Aspirine diario o,famoso Aspirine diario,el famoso Aspirine,,,Aspirine diario o,"Aspirine diario o ,","Aspirine diario o , en"
http://www.diarionorte.com/article/131627/?utm_source=feed&utm_medium=rss&utm_term=rss&utm_campaign=Rss%2520Feed,diarionorte.com,2015-11-30,Argentina,aspirinetas/NCFP00D/aspirina,"La  caja  de aspirinetas  subió  15,9  por  ciento  en  el  mes  y  39,5  por  ciento  en  los  últimos  doce  meses  .",aspirinetas,ncfp00d,aspirina,de,de,SPS00,caja,caja,NCFS000,La,el,DA0FS0,,,,,,,subió,subir,VMIS3S0,"15,9",15.9,Z,por,por,SPS00,ciento,100,Z,en,en,SPS00,2015-11-30,2015,2010,NCFS000 SPS00 Aspirine VMIS3S0 Z,SPS00 Aspirine VMIS3S0,NCFS000 SPS00 Aspirine,DA0FS0 NCFS000 SPS00 Aspirine,,Aspirine VMIS3S0 Z,Aspirine VMIS3S0 Z SPS00,Aspirine VMIS3S0 Z SPS00 Z,caja de Aspirine subir 15.9,de Aspirine subir,caja de Aspirine,el caja de Aspirine,,Aspirine subir 15.9,Aspirine subir 15.9 por,Aspirine subir 15.9 por 100
http://www.clarin.com/sociedad/aumentos-remdios-subas-9-medicamentos-relevamiento_0_1466853379.html,clarin.com,2015-11-13,Argentina,Aspirinetas/NP00000/aspirinetas,"La  caja  de Aspirinetas  ,  en  tanto  ,  cuesta  ahora  24  %  más  y  el  Ventolín  ya  está  21,7  %  más  caro  que  hace  un  año  ,  tal  como  sucedió  con  el  antihipertensivo  Nalapril  ,  que  fue  de  $  37,26  a  45,38  .",aspirinetas,np00000,aspirinetas,de,de,SPS00,caja,caja,NCFS000,La,el,DA0FS0,,,,,,,",",",",Fc,en,en,SPS00,tanto,tanto,RG,",",",",Fc,cuesta,costar,VMIP3S0,2015-11-13,2015,2010,NCFS000 SPS00 Aspirine Fc SPS00,SPS00 Aspirine Fc,NCFS000 SPS00 Aspirine,DA0FS0 NCFS000 SPS00 Aspirine,,Aspirine Fc SPS00,Aspirine Fc SPS00 RG,Aspirine Fc SPS00 RG Fc,"caja de Aspirine , en","de Aspirine ,",caja de Aspirine,el caja de Aspirine,,"Aspirine , en","Aspirine , en tanto","Aspirine , en tanto ,"
http://www.cmhw.icrt.cu/index.php/noticias/provinciales/17773-heroe-cubano-gerardo-hernandez-junto-a-adriana-y-gema-visitan-santa-clara,icrt.cu,2015-12-23,Cuba,aspirineros/NCMP000/aspirineros,"Diferentes  cuestiones  nos  habían  impedido  venir  antes  ,  por  las  múltiples  actividades  que  tenemos  ,  pero  estamos  acá  ,  hemos  compartido  con  los  colegas  de  Melaito  ,  con  los  amigos  brasileños  ,  con  colegas  "" aspirineros  ""  --  fundadores  del  Grupo  Aspirina  ,  del  cual  él  fue  integrante  --  por  eso  estoy  muy  contento  ,  emocionado  ,  y  aprovecho  para  agradecerle  a  Villa  Clara  ,  el  apoyo  a  su  lucha  por  la  justicia  ,  y  esta  solidaridad  de  tantos  años  ""  ,  dijo  visiblemente  emocionado  .",aspirineros,ncmp000,aspirineros,"""","""",Fe,colegas,colega,NCCP000,con,con,SPS00,",",",",Fc,brasileños,brasileño,AQ0MP0,"""","""",Fe,--,--,Fg,fundadores,fundador,NCMP000,del,de+el,SPS00+DA0MS0,Grupo,grupo,NP00000,2015-12-23,2015,2010,NCCP000 Fe Aspirine Fe Fg,Fe Aspirine Fe,NCCP000 Fe Aspirine,SPS00 NCCP000 Fe Aspirine,Fc SPS00 NCCP000 Fe Aspirine,Aspirine Fe Fg,Aspirine Fe Fg NCMP000,Aspirine Fe Fg NCMP000 SPS00+DA0MS0,"colega "" Aspirine "" --",""" Aspirine ""","colega "" Aspirine","con colega "" Aspirine",", con colega "" Aspirine","Aspirine "" --","Aspirine "" -- fundador","Aspirine "" -- fundador de+el"
http://www.mdzol.com/nota/645831-la-hora-de-oro-te-puede-salvar-la-vida-si-sabes-que-es-y-como-usarla/,mdzol.com,2015-12-14,Saudi Arabia,aspirineta/NCFS00D/aspirina,"Por  último  ,  el  profesional  destacó  que  si  bien  no  es  recomendable  realizar  maniobras  mientras  la  persona  sufre  un  infarto  ,  sí  se  le  puede  dar  una aspirineta  ,  rescostarlo  y  mantener  la  calma  ,  para  que  a  su  vez  el  cuerpo  consuma  menos  oxígeno  y  el  corazón  trabaje  menos  .",aspirineta,ncfs00d,aspirina,una,uno,DI0FS0,dar,dar,VMN0000,puede,poder,VMIP3S0,le,le,PP3CSD00,se,se,P00CN000,",",",",Fc,rescostarlo,rescostarlo,NCMS000,y,y,CC,mantener,mantener,VMN0000,la,el,DA0FS0,2015-12-14,2015,2010,VMN0000 DI0FS0 Aspirine Fc NCMS000,DI0FS0 Aspirine Fc,VMN0000 DI0FS0 Aspirine,VMIP3S0 VMN0000 DI0FS0 Aspirine,PP3CSD00 VMIP3S0 VMN0000 DI0FS0 Aspirine,Aspirine Fc NCMS000,Aspirine Fc NCMS000 CC,Aspirine Fc NCMS000 CC VMN0000,"dar uno Aspirine , rescostarlo","uno Aspirine ,",dar uno Aspirine,poder dar uno Aspirine,le poder dar uno Aspirine,"Aspirine , rescostarlo","Aspirine , rescostarlo y","Aspirine , rescostarlo y mantener"
http://www.mdzol.com/nota/645831-la-hora-de-oro-te-puede-salvar-la-vida-si-sabes-que-es-y-como-usarla/,mdzol.com,2015-12-14,Saudi Arabia,aspirineta/NCFS00D/aspirina,"Si  no  es  alérgico  ,  se  le  puede  administrar  una aspirineta ",aspirineta,ncfs00d,aspirina,una,uno,DI0FS0,administrar,administrar,VMN0000,puede,poder,VMIP3S0,le,le,PP3CSD00,se,se,P00CN000,,,,,,,,,,,,,,,,2015-12-14,2015,2010,,,VMN0000 DI0FS0 Aspirine,VMIP3S0 VMN0000 DI0FS0 Aspirine,PP3CSD00 VMIP3S0 VMN0000 DI0FS0 Aspirine,,,,,,administrar uno Aspirine,poder administrar uno Aspirine,le poder administrar uno Aspirine,,,
http://www.radiohuesca.com/noticia/555600/La-campana-de-esqui-del-SCD-de-Ribagorza-arranca-en-enero,radiohuesca.com,2016-01-01,===NONE===,Maspirineo/NP00000/maspirineo,"Las  escuelas  encargadas  de  impartir  los  cursos  de  iniciación  y  perfeccionamiento  serán  ,  la  Escuela  de  Esquí  del  Grupo  Velarta  en  el  caso  del  alpino  y  snow  ,  y Maspirineo  en  el  caso  del  esquí  de  fondo  .",maspirineo,np00000,maspirineo,y,y,CC,",",",",Fc,snow,snow,AQ0CS0,y,y,CC,alpino,alpino,AQ0MS0,en,en,SPS00,el,el,DA0MS0,caso,caso,NCMS000,del,de+el,SPS00+DA0MS0,esquí,esquí,NCMS000,2016-01-01,2016,2010,Fc CC Aspirine SPS00 DA0MS0,CC Aspirine SPS00,Fc CC Aspirine,AQ0CS0 Fc CC Aspirine,CC AQ0CS0 Fc CC Aspirine,Aspirine SPS00 DA0MS0,Aspirine SPS00 DA0MS0 NCMS000,Aspirine SPS00 DA0MS0 NCMS000 SPS00+DA0MS0,", y Aspirine en el",y Aspirine en,", y Aspirine","snow , y Aspirine","y snow , y Aspirine",Aspirine en el,Aspirine en el caso,Aspirine en el caso de+el
http://eldia.es/2016-02-15/deportes/16-Sevilla-vuelve-defender-corona-amplio-grupo-retadores.htm,eldia.es,2016-02-15,Spain,aspirineros/NCMP000/aspirineros,"Los  amarillos  dirimirán  una  confrontación  con  claro  sabor  Champions  ante  el  Oporto  y  los  ' aspirineros  '  ante  el  líder  de  la  Liga  lusa  ,  el  Sporting  en  otra  eliminatoria  más  que  interesante  .",aspirineros,ncmp000,aspirineros,',',Fe,los,el,DA0MP0,y,y,CC,Oporto,oporto,NP00000,el,el,DA0MS0,',',Fe,ante,ante,SPS00,el,el,DA0MS0,líder,líder,NCCS000,de,de,SPS00,2016-02-15,2016,2010,DA0MP0 Fe Aspirine Fe SPS00,Fe Aspirine Fe,DA0MP0 Fe Aspirine,CC DA0MP0 Fe Aspirine,NP00000 CC DA0MP0 Fe Aspirine,Aspirine Fe SPS00,Aspirine Fe SPS00 DA0MS0,Aspirine Fe SPS00 DA0MS0 NCCS000,el ' Aspirine ' ante,' Aspirine ',el ' Aspirine,y el ' Aspirine,oporto y el ' Aspirine,Aspirine ' ante,Aspirine ' ante el,Aspirine ' ante el líder
http://www.enlacecritico.com/columnistas/la-clase-politica-responsable-de-crimenes-masivos-cada-ano,enlacecritico.com,2016-02-15,===NONE===,aspirineta/NCFS00D/aspirina,"Nuestra  sociedad  es  como  es  ,  los  remedios  son  para  nuestra  sociedad  enferma  por  esta  masacre  ,  y  nadie  esperará  atacar  un  cáncer  con  una aspirineta  ni  con  un  sermón  .",aspirineta,ncfs00d,aspirina,una,uno,DI0FS0,con,con,SPS00,cáncer,cáncer,NCMS000,un,uno,DI0MS0,atacar,atacar,VMN0000,ni,ni,CC,con,con,SPS00,un,uno,DI0MS0,sermón,sermón,NCMS000,.,.,Fp,2016-02-15,2016,2010,SPS00 DI0FS0 Aspirine CC SPS00,DI0FS0 Aspirine CC,SPS00 DI0FS0 Aspirine,NCMS000 SPS00 DI0FS0 Aspirine,DI0MS0 NCMS000 SPS00 DI0FS0 Aspirine,Aspirine CC SPS00,Aspirine CC SPS00 DI0MS0,Aspirine CC SPS00 DI0MS0 NCMS000,con uno Aspirine ni con,uno Aspirine ni,con uno Aspirine,cáncer con uno Aspirine,uno cáncer con uno Aspirine,Aspirine ni con,Aspirine ni con uno,Aspirine ni con uno sermón
