url,website,date,country,keyword,sentence,kw,kw_lemma,kw_pos,left_w1,left_l1,left_p1,left_w2,left_l2,left_p2,left_w3,left_l3,left_p3,left_w4,left_l4,left_p4,left_w5,left_l5,left_p5,right_w1,right_l1,right_p1,right_w2,right_l2,right_p2,right_w3,right_l3,right_p3,right_w4,right_l4,right_p4,right_w5,right_l5,right_p5,datetime,year,10years,pattern_around5,pattern_around3,pattern_left2,pattern_left3,pattern_left4,pattern_right2,pattern_right3,pattern_right4,pattern_around5_lex,pattern_around3_lex,pattern_left2_lex,pattern_left3_lex,pattern_left4_lex,pattern_right2_lex,pattern_right3_lex,pattern_right4_lex
https://elcaso.elnacional.cat/es/sucesos/lidl-ofertas-regalos-navidad-super-electronica-decoracion-precio_42785_102.html,elnacional.cat,2020-12-15,===NONE===,Silk-épil/NP00000/silk-épil,"La Silk-épil  por  el  increíble  precio  de  29,99  euros  /  Lidl",silk-épil,np00000,silk-épil,La,el,DA0FS0,,,,,,,,,,,,,por,por,SPS00,el,el,DA0MS0,increíble,increíble,AQ0CS0,precio,precio,NCMS000,de,de,SPS00,2020-12-15,2020,2020,,DA0FS0 Silk-épil SPS00,,,,Silk-épil SPS00 DA0MS0,Silk-épil SPS00 DA0MS0 AQ0CS0,Silk-épil SPS00 DA0MS0 AQ0CS0 NCMS000,,el Silk-épil por,,,,Silk-épil por el,Silk-épil por el increíble,Silk-épil por el increíble precio
https://www.vozpopuli.com/parati/Sabias-ahorrar-navidenas-Amazon-Outlet_0_1422157948.html,vozpopuli.com,2020-12-24,===NONE===,Silk-épil/NP00000/silk-épil,La  depiladora  recargable  Braun Silk-épil  Flex  9020  utiliza  un  innovador  cabezal  pivotante  capaz  de  adaptarse  por  completo  a  tus  curvas  .,silk-épil,np00000,silk-épil,Braun,braun,NP00000,recargable,recargable,AQ0CS0,depiladora,depilador,AQ0FS0,La,el,DA0FS0,,,,Flex,flex,NP00000,9020,9020,Z,utiliza,utilizar,VMIP3S0,un,uno,DI0MS0,innovador,innovador,AQ0MS0,2020-12-24,2020,2020,AQ0CS0 NP00000 Silk-épil NP00000 Z,NP00000 Silk-épil NP00000,AQ0CS0 NP00000 Silk-épil,AQ0FS0 AQ0CS0 NP00000 Silk-épil,DA0FS0 AQ0FS0 AQ0CS0 NP00000 Silk-épil,Silk-épil NP00000 Z,Silk-épil NP00000 Z VMIP3S0,Silk-épil NP00000 Z VMIP3S0 DI0MS0,recargable braun Silk-épil flex 9020,braun Silk-épil flex,recargable braun Silk-épil,depilador recargable braun Silk-épil,el depilador recargable braun Silk-épil,Silk-épil flex 9020,Silk-épil flex 9020 utilizar,Silk-épil flex 9020 utilizar uno
https://www.vozpopuli.com/parati/depiladora-luz-pulsada-depiladora-electrica-tecnologia-pinzas.html,vozpopuli.com,2021-04-08,===NONE===,Silk-épil/NP00000/silk-épil,La  depiladora  eléctrica  Braun Silk-épil  9  9-720  ha  logrado  depurar  al  máximo  el  sistema  de  depilación  por  pinzas  .,silk-épil,np00000,silk-épil,Braun,braun,NP00000,eléctrica,eléctrico,AQ0FS0,depiladora,depilador,AQ0FS0,La,el,DA0FS0,,,,9,9,Z,9-720,9-720,Z,ha,haber,VAIP3S0,logrado,lograr,VMP00SM,depurar,depurar,VMN0000,2021-04-08,2021,2020,AQ0FS0 NP00000 Silk-épil Z Z,NP00000 Silk-épil Z,AQ0FS0 NP00000 Silk-épil,AQ0FS0 AQ0FS0 NP00000 Silk-épil,DA0FS0 AQ0FS0 AQ0FS0 NP00000 Silk-épil,Silk-épil Z Z,Silk-épil Z Z VAIP3S0,Silk-épil Z Z VAIP3S0 VMP00SM,eléctrico braun Silk-épil 9 9-720,braun Silk-épil 9,eléctrico braun Silk-épil,depilador eléctrico braun Silk-épil,el depilador eléctrico braun Silk-épil,Silk-épil 9 9-720,Silk-épil 9 9-720 haber,Silk-épil 9 9-720 haber lograr
https://www.elmundo.es/ofertas-regalos/2021/04/21/607f101b21efa0f5638b463d.html?intcmp=PORTBAZ,elmundo.es,2021-04-21,Spain,Silk-épil/NP00000/silk-épil,"Sobre  todo  ,  con  la  calidad  de  Braun  y  de Silk-épil  ,  que  ha  hecho  famosa  a  esta  depiladora  que  ofrece  efectos  duraderos  ,  durante  semanas  ,  con  su  sistema  de  20  pinzas  .",silk-épil,np00000,silk-épil,de,de,SPS00,y,y,CC,Braun,braun,NP00000,de,de,SPS00,calidad,calidad,NCFS000,",",",",Fc,que,que,PR0CN000,ha,haber,VAIP3S0,hecho,hacer,VMP00SM,famosa,famoso,NCFS000,2021-04-21,2021,2020,CC SPS00 Silk-épil Fc PR0CN000,SPS00 Silk-épil Fc,CC SPS00 Silk-épil,NP00000 CC SPS00 Silk-épil,SPS00 NP00000 CC SPS00 Silk-épil,Silk-épil Fc PR0CN000,Silk-épil Fc PR0CN000 VAIP3S0,Silk-épil Fc PR0CN000 VAIP3S0 VMP00SM,"y de Silk-épil , que","de Silk-épil ,",y de Silk-épil,braun y de Silk-épil,de braun y de Silk-épil,"Silk-épil , que","Silk-épil , que haber","Silk-épil , que haber hacer"
https://www.larazon.es/economia/20210424/bl5ad5a23rawlp5rxh2yxhx7bi.html,larazon.es,2021-04-24,Spain,Silk-épil/NP00000/silk-épil,"Lidl  también  tiene  de  oferta  una  depiladora  ,  en  este  caso  se  trata  de  la  depiladora  Braun  3  en  1 Silk-épil  3-440  .",silk-épil,np00000,silk-épil,1,1,Z,en,en,SPS00,3,3,Z,Braun,braun,NP00000,depiladora,depilador,AQ0FS0,3-440,3-440,Z,.,.,Fp,,,,,,,,,,2021-04-24,2021,2020,SPS00 Z Silk-épil Z Fp,Z Silk-épil Z,SPS00 Z Silk-épil,Z SPS00 Z Silk-épil,NP00000 Z SPS00 Z Silk-épil,Silk-épil Z Fp,,,en 1 Silk-épil 3-440 .,1 Silk-épil 3-440,en 1 Silk-épil,3 en 1 Silk-épil,braun 3 en 1 Silk-épil,Silk-épil 3-440 .,,
