url,website,date,country,keyword,sentence,kw,kw_lemma,kw_pos,left_w1,left_l1,left_p1,left_w2,left_l2,left_p2,left_w3,left_l3,left_p3,left_w4,left_l4,left_p4,left_w5,left_l5,left_p5,right_w1,right_l1,right_p1,right_w2,right_l2,right_p2,right_w3,right_l3,right_p3,right_w4,right_l4,right_p4,right_w5,right_l5,right_p5,datetime,year,10years,pattern_around5,pattern_around3,pattern_left2,pattern_left3,pattern_left4,pattern_right2,pattern_right3,pattern_right4,pattern_around5_lex,pattern_around3_lex,pattern_left2_lex,pattern_left3_lex,pattern_left4_lex,pattern_right2_lex,pattern_right3_lex,pattern_right4_lex
https://www.interempresas.net/Ferreteria/Articulos/267233-Soledad-Rodriguez-nueva-responsable-de-Ecommerce-y-Digital-de-WD-40.html,interempresas.net,2020-03-04,===NONE===,WD-40/Z/WD-40, WD-40  Company  acaba  de  incorporar  a  su  equipo  a  Soledad  Rodríguez  como  responsable  de  Ecommerce  y  Digital  .,wd-40,z,wd-40,,,,,,,,,,,,,,,,Company,company,NP00000,acaba,acabar,VMIP3S0,de,de,SPS00,incorporar,incorporar,VMN0000,a,a,SPS00,2020-03-04,2020,2020,,,,,,WD-40 NP00000 VMIP3S0,WD-40 NP00000 VMIP3S0 SPS00,WD-40 NP00000 VMIP3S0 SPS00 VMN0000,,,,,,WD-40 company acabar,WD-40 company acabar de,WD-40 company acabar de incorporar
https://www.america-retail.com/ecommerce/ecommerce-soledad-rodriguez-nueva-responsable-de-ecommerce-y-digital-de-wd-40/,america-retail.com,2020-03-09,===NONE===,WD-40/Z/WD-40,"<doc uri=https://www.america-retail.com/ecommerce/ecommerce-soledad-rodriguez-nueva-responsable-de-ecommerce-y-digital-de-wd-40/ website=america-retail.com date=2020-03-09 source_country=> /en/SPS00 /palabra/NCFP000 /de/SPS00 /francisco/NP00000 /ortega/NP00000 /,/Fc /director/NCMS000 /de/SPS00 /marketing/NP00000 /de/SPS00 WD-40  :  ""  La  incorporación  de  Soledad  al  equipo  de  Marketing  confirma  la  apuesta  firme  de  la  compañía  por  el  proceso  de  transformación  digital  que  viene  llevando  a  cabo  en  los  últimos  años  y  por  seguir  desarrollando  sus  marcas  en  el  mundo  digital  ""  . </doc>",wd-40,z,wd-40,de,de,SPS00,Marketing,marketing,NP00000,de,de,SPS00,director,director,NCMS000,",",",",Fc,:,:,Fd,"""","""",Fe,La,el,DA0FS0,incorporación,incorporación,NCFS000,de,de,SPS00,2020-03-09,2020,2020,NP00000 SPS00 WD-40 Fd Fe,SPS00 WD-40 Fd,NP00000 SPS00 WD-40,SPS00 NP00000 SPS00 WD-40,NCMS000 SPS00 NP00000 SPS00 WD-40,WD-40 Fd Fe,WD-40 Fd Fe DA0FS0,WD-40 Fd Fe DA0FS0 NCFS000,"marketing de WD-40 : """,de WD-40 :,marketing de WD-40,de marketing de WD-40,director de marketing de WD-40,"WD-40 : ""","WD-40 : "" el","WD-40 : "" el incorporación"
http://www.icrowdsp.com/2020/03/12/wd-40-brand-se-asocia-con-habitat-for-humanity-para-devolver-a-las-comunidades/,icrowdsp.com,2020-03-12,===NONE===,WD-40/Z/WD-40,<doc uri=http://www.icrowdsp.com/2020/03/12/wd-40-brand-se-asocia-con-habitat-for-humanity-para-devolver-a-las-comunidades/ website=icrowdsp.com date=2020-03-12 source_country=> WD-40  Brand  se  asocia  con  Habitat  for  Humanity  para  devolver  a  las  comunidades,wd-40,z,wd-40,,,,,,,,,,,,,,,,Brand,brand,NP00000,se,se,P00CN000,asocia,asociar,VMIP3S0,con,con,SPS00,Habitat,habitat,NP00000,2020-03-12,2020,2020,,,,,,WD-40 NP00000 P00CN000,WD-40 NP00000 P00CN000 VMIP3S0,WD-40 NP00000 P00CN000 VMIP3S0 SPS00,,,,,,WD-40 brand se,WD-40 brand se asociar,WD-40 brand se asociar con
http://www.icrowdsp.com/2020/03/12/wd-40-brand-se-asocia-con-habitat-for-humanity-para-devolver-a-las-comunidades/,icrowdsp.com,2020-03-12,===NONE===,WD-40/Z/WD-40," WD-40  Brand  donará  hasta  $50,000  a  Hábitat  para  la  Humanidad  para  ayudar  a  la  organización  en  su  misión  de  reunir  a  las  personas  para  construir  hogares  ,  comunidades  y  esperanza  .",wd-40,z,wd-40,,,,,,,,,,,,,,,,Brand,brand,NP00000,donará,donar,VMIF3S0,hasta,hasta,SPS00,"$50,000","$50,000",Z,a,a,SPS00,2020-03-12,2020,2020,,,,,,WD-40 NP00000 VMIF3S0,WD-40 NP00000 VMIF3S0 SPS00,WD-40 NP00000 VMIF3S0 SPS00 Z,,,,,,WD-40 brand donar,WD-40 brand donar hasta,"WD-40 brand donar hasta $50,000"
http://www.icrowdsp.com/2020/03/12/wd-40-brand-se-asocia-con-habitat-for-humanity-para-devolver-a-las-comunidades/,icrowdsp.com,2020-03-12,===NONE===,WD-40/Z/WD-40,"""  Nuestra  empresa  valora  hacer  lo  correcto  y  crear  recuerdos  duraderos  positivos  mediante  el  desarrollo  de  productos  que  ayuden  a  las  personas  a  hacer  bien  sus  trabajos  ""  ,  dijo  Erin  Bala  ,  directorade  gestión  de  marca  e  innovación  de WD-40  Company  .  ""  Apoyar  la  visión  de  Hábitat  para  la  Humanidad  de  '  un  mundo  donde  todo  el  mundo  tiene  un  lugar  decente  para  vivir  '  nos  permite  vivir  nuestros  valores  y  devolver  de  una  manera  significativa  ""  .",wd-40,z,wd-40,de,de,SPS00,innovación,innovación,NCFS000,e,y,CC,marca,marca,NCFS000,de,de,SPS00,Company,company,NP00000,.,.,Fp,"""","""",Fe,Apoyar,apoyar,VMN0000,la,el,DA0FS0,2020-03-12,2020,2020,NCFS000 SPS00 WD-40 NP00000 Fp,SPS00 WD-40 NP00000,NCFS000 SPS00 WD-40,CC NCFS000 SPS00 WD-40,NCFS000 CC NCFS000 SPS00 WD-40,WD-40 NP00000 Fp,WD-40 NP00000 Fp Fe,WD-40 NP00000 Fp Fe VMN0000,innovación de WD-40 company .,de WD-40 company,innovación de WD-40,y innovación de WD-40,marca y innovación de WD-40,WD-40 company .,"WD-40 company . ""","WD-40 company . "" apoyar"
http://www.icrowdsp.com/2020/03/12/wd-40-brand-se-asocia-con-habitat-for-humanity-para-devolver-a-las-comunidades/,icrowdsp.com,2020-03-12,===NONE===,WD-40/Z/WD-40,"""  Estamos  encantados  de  asociarnos  con WD-40  Brand  a  escala  nacional  .",wd-40,z,wd-40,con,con,SPS00,asociarnos,asociar+nos,VMN0000+PP1CP000,de,de,SPS00,encantados,encantar,VMP00PM,Estamos,estar,VAIP1P0,Brand,brand,NP00000,a,a,SPS00,escala,escala,NCFS000,nacional,nacional,AQ0CS0,.,.,Fp,2020-03-12,2020,2020,VMN0000+PP1CP000 SPS00 WD-40 NP00000 SPS00,SPS00 WD-40 NP00000,VMN0000+PP1CP000 SPS00 WD-40,SPS00 VMN0000+PP1CP000 SPS00 WD-40,VMP00PM SPS00 VMN0000+PP1CP000 SPS00 WD-40,WD-40 NP00000 SPS00,WD-40 NP00000 SPS00 NCFS000,WD-40 NP00000 SPS00 NCFS000 AQ0CS0,asociar+nos con WD-40 brand a,con WD-40 brand,asociar+nos con WD-40,de asociar+nos con WD-40,encantar de asociar+nos con WD-40,WD-40 brand a,WD-40 brand a escala,WD-40 brand a escala nacional
http://www.icrowdsp.com/2020/03/12/wd-40-brand-se-asocia-con-habitat-for-humanity-para-devolver-a-las-comunidades/,icrowdsp.com,2020-03-12,===NONE===,WD-40/Z/WD-40,La  marca WD-40  ofrece  más  de  20  productos  innovadores  y  de  calidad  .,wd-40,z,wd-40,marca,marca,NCFS000,La,el,DA0FS0,,,,,,,,,,ofrece,ofrecer,VMIP3S0,más,más,RG,de,de,SPS00,20,20,Z,productos,producto,NCMP000,2020-03-12,2020,2020,DA0FS0 NCFS000 WD-40 VMIP3S0 RG,NCFS000 WD-40 VMIP3S0,DA0FS0 NCFS000 WD-40,,,WD-40 VMIP3S0 RG,WD-40 VMIP3S0 RG SPS00,WD-40 VMIP3S0 RG SPS00 Z,el marca WD-40 ofrecer más,marca WD-40 ofrecer,el marca WD-40,,,WD-40 ofrecer más,WD-40 ofrecer más de,WD-40 ofrecer más de 20
http://www.icrowdsp.com/2020/03/12/wd-40-brand-se-asocia-con-habitat-for-humanity-para-devolver-a-las-comunidades/,icrowdsp.com,2020-03-12,===NONE===,WD-40/Z/WD-40,"Durante  más  de  65  años  ,  el WD-40  Multi-Use  Product  ,  el  #1  lubricante  multiusos  recomendado  ,  se  ha  contado  para  ayudar  a  los  usuarios  finales  a  detener  los  chirridos  ,  eliminar  la  grasa  y  la  suciedad  ,  aflojar  las  piezas  oxidadas  ,  liberar  las  piezas  atascadas  y  desplazar  la  humedad  .",wd-40,z,wd-40,el,el,DA0MS0,",",",",Fc,años,año,NCMP000,65,65,Z,de,de,SPS00,Multi-Use,multi-use,NP00000,Product,product,NP00000,",",",",Fc,el,el,DA0MS0,#1,#1,Z,2020-03-12,2020,2020,Fc DA0MS0 WD-40 NP00000 NP00000,DA0MS0 WD-40 NP00000,Fc DA0MS0 WD-40,NCMP000 Fc DA0MS0 WD-40,Z NCMP000 Fc DA0MS0 WD-40,WD-40 NP00000 NP00000,WD-40 NP00000 NP00000 Fc,WD-40 NP00000 NP00000 Fc DA0MS0,", el WD-40 multi-use product",el WD-40 multi-use,", el WD-40","año , el WD-40","65 año , el WD-40",WD-40 multi-use product,"WD-40 multi-use product ,","WD-40 multi-use product , el"
http://www.icrowdsp.com/2020/03/12/wd-40-brand-se-asocia-con-habitat-for-humanity-para-devolver-a-las-comunidades/,icrowdsp.com,2020-03-12,===NONE===,WD-40/Z/WD-40,"La  línea  de  productos WD-40  Specialist  ayuda  a  los  profesionales  de  una  serie  de  industrias  ,  incluyendo  la  automoción  ,  la  agricultura  ,  el  HVAC  y  la  construcción  y  los  oficios  calificados  para  hacer  bien  el  trabajo  .",wd-40,z,wd-40,productos,producto,NCMP000,de,de,SPS00,línea,línea,NCFS000,La,el,DA0FS0,,,,Specialist,specialist,NP00000,ayuda,ayuda,NCFS000,a,a,SPS00,los,el,DA0MP0,profesionales,profesional,NCCP000,2020-03-12,2020,2020,SPS00 NCMP000 WD-40 NP00000 NCFS000,NCMP000 WD-40 NP00000,SPS00 NCMP000 WD-40,NCFS000 SPS00 NCMP000 WD-40,DA0FS0 NCFS000 SPS00 NCMP000 WD-40,WD-40 NP00000 NCFS000,WD-40 NP00000 NCFS000 SPS00,WD-40 NP00000 NCFS000 SPS00 DA0MP0,de producto WD-40 specialist ayuda,producto WD-40 specialist,de producto WD-40,línea de producto WD-40,el línea de producto WD-40,WD-40 specialist ayuda,WD-40 specialist ayuda a,WD-40 specialist ayuda a el
http://www.icrowdsp.com/2020/03/12/wd-40-brand-se-asocia-con-habitat-for-humanity-para-devolver-a-las-comunidades/,icrowdsp.com,2020-03-12,===NONE===,WD-40/Z/WD-40," WD-40  Specialist  también  incluye  una  línea  de  cinco  productos  especiales  WD-40  BIKE  Las  formulaciones  WD-40  Specialist  de  alto  rendimiento  resuelven  problemas  de  mantenimiento  más  difíciles  que  requieren  una  solución  de  gestión  de  lubricante  ,  penetrante  ,  grasa  ,  limpiador  ,  desengrasante  o  de  óxido  .",wd-40,z,wd-40,,,,,,,,,,,,,,,,Specialist,specialist,NP00000,también,también,RG,incluye,incluir,VMIP3S0,una,uno,DI0FS0,línea,línea,NCFS000,2020-03-12,2020,2020,,,,,,WD-40 NP00000 RG,WD-40 NP00000 RG VMIP3S0,WD-40 NP00000 RG VMIP3S0 DI0FS0,,,,,,WD-40 specialist también,WD-40 specialist también incluir,WD-40 specialist también incluir uno
http://www.icrowdsp.com/2020/03/12/wd-40-brand-se-asocia-con-habitat-for-humanity-para-devolver-a-las-comunidades/,icrowdsp.com,2020-03-12,===NONE===,WD-40/Z/WD-40,"WD-40  Specialist  también  incluye  una  línea  de  cinco  productos  especiales WD-40  BIKE  Las  formulaciones  WD-40  Specialist  de  alto  rendimiento  resuelven  problemas  de  mantenimiento  más  difíciles  que  requieren  una  solución  de  gestión  de  lubricante  ,  penetrante  ,  grasa  ,  limpiador  ,  desengrasante  o  de  óxido  .",wd-40,z,wd-40,especiales,especial,AQ0CP0,productos,producto,NCMP000,cinco,5,Z,de,de,SPS00,línea,línea,NCFS000,BIKE,bike,NP00000,Las,las,NP00000,formulaciones,formulación,NCFP000,WD-40,WD-40,Z,Specialist,specialist,NP00000,2020-03-12,2020,2020,NCMP000 AQ0CP0 WD-40 NP00000 NP00000,AQ0CP0 WD-40 NP00000,NCMP000 AQ0CP0 WD-40,Z NCMP000 AQ0CP0 WD-40,SPS00 Z NCMP000 AQ0CP0 WD-40,WD-40 NP00000 NP00000,WD-40 NP00000 NP00000 NCFP000,WD-40 NP00000 NP00000 NCFP000 Z,producto especial WD-40 bike las,especial WD-40 bike,producto especial WD-40,5 producto especial WD-40,de 5 producto especial WD-40,WD-40 bike las,WD-40 bike las formulación,WD-40 bike las formulación WD-40
http://www.icrowdsp.com/2020/03/12/wd-40-brand-se-asocia-con-habitat-for-humanity-para-devolver-a-las-comunidades/,icrowdsp.com,2020-03-12,===NONE===,WD-40/Z/WD-40,"WD-40  Specialist  también  incluye  una  línea  de  cinco  productos  especiales  WD-40  BIKE  Las  formulaciones WD-40  Specialist  de  alto  rendimiento  resuelven  problemas  de  mantenimiento  más  difíciles  que  requieren  una  solución  de  gestión  de  lubricante  ,  penetrante  ,  grasa  ,  limpiador  ,  desengrasante  o  de  óxido  .",wd-40,z,wd-40,formulaciones,formulación,NCFP000,Las,las,NP00000,BIKE,bike,NP00000,WD-40,WD-40,Z,especiales,especial,AQ0CP0,Specialist,specialist,NP00000,de,de,SPS00,alto,alto,AQ0MS0,rendimiento,rendimiento,NCMS000,resuelven,resolver,VMIP3P0,2020-03-12,2020,2020,NP00000 NCFP000 WD-40 NP00000 SPS00,NCFP000 WD-40 NP00000,NP00000 NCFP000 WD-40,NP00000 NP00000 NCFP000 WD-40,Z NP00000 NP00000 NCFP000 WD-40,WD-40 NP00000 SPS00,WD-40 NP00000 SPS00 AQ0MS0,WD-40 NP00000 SPS00 AQ0MS0 NCMS000,las formulación WD-40 specialist de,formulación WD-40 specialist,las formulación WD-40,bike las formulación WD-40,WD-40 bike las formulación WD-40,WD-40 specialist de,WD-40 specialist de alto,WD-40 specialist de alto rendimiento
http://www.icrowdsp.com/2020/03/12/wd-40-brand-se-asocia-con-habitat-for-humanity-para-devolver-a-las-comunidades/,icrowdsp.com,2020-03-12,===NONE===,wd-40/Z/wd-40,"Para  obtener  información  adicional  acerca  de  los  productos wd-40  Brand  ,  visite  WD40.com  .",wd-40,z,wd-40,productos,producto,NCMP000,los,el,DA0MP0,de,de,SPS00,acerca,acercar,VMIP3S0,adicional,adicional,AQ0CS0,Brand,brand,NP00000,",",",",Fc,visite,visitar,VMSP3S0,WD40.com,WD40.com,Z,.,.,Fp,2020-03-12,2020,2020,DA0MP0 NCMP000 WD-40 NP00000 Fc,NCMP000 WD-40 NP00000,DA0MP0 NCMP000 WD-40,SPS00 DA0MP0 NCMP000 WD-40,VMIP3S0 SPS00 DA0MP0 NCMP000 WD-40,WD-40 NP00000 Fc,WD-40 NP00000 Fc VMSP3S0,WD-40 NP00000 Fc VMSP3S0 Z,"el producto WD-40 brand ,",producto WD-40 brand,el producto WD-40,de el producto WD-40,acercar de el producto WD-40,"WD-40 brand ,","WD-40 brand , visitar","WD-40 brand , visitar WD40.com"
http://www.icrowdsp.com/2020/03/12/wd-40-brand-se-asocia-con-habitat-for-humanity-para-devolver-a-las-comunidades/,icrowdsp.com,2020-03-12,===NONE===,WD-40/Z/WD-40," WD-40  Company  es  una  organización  de  marketing  global  dedicada  a  crear  recuerdos  duraderos  positivos  mediante  el  desarrollo  y  venta  de  productos  que  resuelven  problemas  en  talleres  ,  fábricas  y  hogares  de  todo  el  mundo  .",wd-40,z,wd-40,,,,,,,,,,,,,,,,Company,company,NP00000,es,ser,VSIP3S0,una,uno,DI0FS0,organización,organización,NCFS000,de,de,SPS00,2020-03-12,2020,2020,,,,,,WD-40 NP00000 VSIP3S0,WD-40 NP00000 VSIP3S0 DI0FS0,WD-40 NP00000 VSIP3S0 DI0FS0 NCFS000,,,,,,WD-40 company ser,WD-40 company ser uno,WD-40 company ser uno organización
http://www.icrowdsp.com/2020/03/12/wd-40-brand-se-asocia-con-habitat-for-humanity-para-devolver-a-las-comunidades/,icrowdsp.com,2020-03-12,===NONE===,WD-40/Z/WD-40,"La  Compañía  comercializa  sus  productos  de  mantenimiento  y  cuidado  del  hogar  y  productos  de  limpieza  bajo  las  siguientes  marcas  conocidas  : WD-40  ,  3-IN-ONEGT85  ,  X-14  ,  2000  Flushes  ,  Carpet  Freshno  vac  ,  Spot  Shot1001  ,  Lava  y  Solvol  . </doc>",wd-40,z,wd-40,:,:,Fd,conocidas,conocer,VMP00PF,marcas,marca,NCFP000,siguientes,siguiente,AQ0CP0,las,el,DA0FP0,",",",",Fc,3-IN-ONEGT85,3-IN-ONEGT85,Z,",",",",Fc,X-14,X-14,Z,",",",",Fc,2020-03-12,2020,2020,VMP00PF Fd WD-40 Fc Z,Fd WD-40 Fc,VMP00PF Fd WD-40,NCFP000 VMP00PF Fd WD-40,AQ0CP0 NCFP000 VMP00PF Fd WD-40,WD-40 Fc Z,WD-40 Fc Z Fc,WD-40 Fc Z Fc Z,"conocer : WD-40 , 3-IN-ONEGT85",": WD-40 ,",conocer : WD-40,marca conocer : WD-40,siguiente marca conocer : WD-40,"WD-40 , 3-IN-ONEGT85","WD-40 , 3-IN-ONEGT85 ,","WD-40 , 3-IN-ONEGT85 , X-14"
https://www.eleconomista.es/economia/noticias/10406834/03/20/Scott-Woods-Las-pequenas-capitalizaciones-el-paraiso-para-la-seleccion-de-valores.html,eleconomista.es,2020-03-16,Spain,WD-40/Z/WD-40,"Más  de  40  analistas  cubren  este  valor  individual  ,  pero  solo  dos  analistas  cubren  la  pequeña  empresa  con  sede  en  California WD-40  ,  que  fabrica  productos  domésticos  ,  incluida  su  emblemática  marca  de  aceites  multiusos  .",wd-40,z,wd-40,California,california,NP00000,en,en,SPS00,sede,sede,NCFS000,con,con,SPS00,empresa,empresa,NCFS000,",",",",Fc,que,que,PR0CN000,fabrica,fabricar,VMIP3S0,productos,producto,NCMP000,domésticos,doméstico,AQ0MP0,2020-03-16,2020,2020,SPS00 NP00000 WD-40 Fc PR0CN000,NP00000 WD-40 Fc,SPS00 NP00000 WD-40,NCFS000 SPS00 NP00000 WD-40,SPS00 NCFS000 SPS00 NP00000 WD-40,WD-40 Fc PR0CN000,WD-40 Fc PR0CN000 VMIP3S0,WD-40 Fc PR0CN000 VMIP3S0 NCMP000,"en california WD-40 , que","california WD-40 ,",en california WD-40,sede en california WD-40,con sede en california WD-40,"WD-40 , que","WD-40 , que fabricar","WD-40 , que fabricar producto"
http://www.diarioalfil.com.ar/2020/03/18/por-suerte-existe-cuba/,diarioalfil.com.ar,2020-03-18,Argentina,WD-40/Z/WD-40,"Las  imágenes  de  los  médicos  cubanos  viajando  a  Italia  ,  o  el  supuesto  envío  de  interferón  (  que  a  juzgar  por  un  discurso  de  más  de  30  años  ,  pronunciado  por  Fidel  Castro  ,  que  se  encargaron  de  hacer  circular  por  redes  ,  tiene  más  usos  que  el WD-40  )  son  otro  capítulo  más  en  la  construcción  de  una  imagen  pulida  y  controlada  para  aquellos  que  son  un  poco  perezosos  como  para  buscar  un  poco  más  allá  de  lo  que  les  muestran  .",wd-40,z,wd-40,el,el,DA0MS0,que,que,CS,usos,uso,NCMP000,más,más,RG,tiene,tener,VMIP3S0,),),Fpt,son,ser,VSIP3P0,otro,otro,DI0MS0,capítulo,capítulo,NCMS000,más,más,RG,2020-03-18,2020,2020,CS DA0MS0 WD-40 Fpt VSIP3P0,DA0MS0 WD-40 Fpt,CS DA0MS0 WD-40,NCMP000 CS DA0MS0 WD-40,RG NCMP000 CS DA0MS0 WD-40,WD-40 Fpt VSIP3P0,WD-40 Fpt VSIP3P0 DI0MS0,WD-40 Fpt VSIP3P0 DI0MS0 NCMS000,que el WD-40 ) ser,el WD-40 ),que el WD-40,uso que el WD-40,más uso que el WD-40,WD-40 ) ser,WD-40 ) ser otro,WD-40 ) ser otro capítulo
https://la100.cienradios.com/nadie-deja-las-cosas-en-su-lugar-sergio-lapegue-y-un-divertido-video-buscando-el-repelente-de-mosquitos/,cienradios.com,2020-04-06,===NONE===,WD-40/Z/WD-40,"¡  Los  adoro  !  ""  ,  ""  Pasa  en  todas  las  familias  ,  ja  ,  ja  ""  ,  ""  Que  pase  Bochi  diciendo  que  eso  es WD-40  es  lo  mejor  del  mundo  ""  ,  escribieron  los  fans  de  Sergio  Lapegüe  . </doc>",wd-40,z,wd-40,es,ser,VSIP3S0,eso,ese,PD0NS000,que,que,CS,diciendo,decir,VMG0000,Bochi,bochi,NP00000,es,ser,VSIP3S0,lo,el,DA0NS0,mejor,mejor,AQ0CS0,del,de+el,SPS00+DA0MS0,mundo,mundo,NCMS000,2020-04-06,2020,2020,PD0NS000 VSIP3S0 WD-40 VSIP3S0 DA0NS0,VSIP3S0 WD-40 VSIP3S0,PD0NS000 VSIP3S0 WD-40,CS PD0NS000 VSIP3S0 WD-40,VMG0000 CS PD0NS000 VSIP3S0 WD-40,WD-40 VSIP3S0 DA0NS0,WD-40 VSIP3S0 DA0NS0 AQ0CS0,WD-40 VSIP3S0 DA0NS0 AQ0CS0 SPS00+DA0MS0,ese ser WD-40 ser el,ser WD-40 ser,ese ser WD-40,que ese ser WD-40,decir que ese ser WD-40,WD-40 ser el,WD-40 ser el mejor,WD-40 ser el mejor de+el
https://www.entornointeligente.com/consejos-de-mantenimiento-para-un-auto-libre-de-virus/,entornointeligente.com,2020-05-05,"Venezuela, Bolivarian Republic of",WD-40/Z/WD-40,"Con  respecto  a  los  seguros  de  las  puertas  ,  recuerda  esto  también  para  el  próximo  invierno  :  Quiet-corner.com  aconseja  a  los  conductores  sumergir  la  llave  de  la  puerta  en  vaselina  o  aplicar  un  chorrito  de  lubricante WD-40  o  algún  producto  descongelante  fácil  de  conseguir  en  el  ojo  de  la  cerradura  cuando  la  nieve  empiece  a  caer  y  las  temperaturas  se  desplomen  .",wd-40,z,wd-40,lubricante,lubricante,NCMS000,de,de,SPS00,chorrito,chorrito,NCMS000,un,uno,DI0MS0,aplicar,aplicar,VMN0000,o,o,CC,algún,alguno,DI0MS0,producto,producto,NCMS000,descongelante,descongelante,RG,fácil,fácil,AQ0CS0,2020-05-05,2020,2020,SPS00 NCMS000 WD-40 CC DI0MS0,NCMS000 WD-40 CC,SPS00 NCMS000 WD-40,NCMS000 SPS00 NCMS000 WD-40,DI0MS0 NCMS000 SPS00 NCMS000 WD-40,WD-40 CC DI0MS0,WD-40 CC DI0MS0 NCMS000,WD-40 CC DI0MS0 NCMS000 RG,de lubricante WD-40 o alguno,lubricante WD-40 o,de lubricante WD-40,chorrito de lubricante WD-40,uno chorrito de lubricante WD-40,WD-40 o alguno,WD-40 o alguno producto,WD-40 o alguno producto descongelante
http://es.globedia.com/limpiar-impresora-inyeccion-tinta,globedia.com,2020-06-10,===NONE===,WD-40/Z/WD-40,"Aceite  de  impresora  (  El  aceite  de  la  máquina  de  coser  también  funcionará  ,  el WD-40  puede  ser  usado  si  no  se  encuentran  otros  tipos  de  aceite  )  .",wd-40,z,wd-40,el,el,DA0MS0,",",",",Fc,funcionará,funcionar,VMIF3S0,también,también,RG,coser,coser,VMN0000,puede,poder,VMIP3S0,ser,ser,VSN0000,usado,usar,VMP00SM,si,si,CS,no,no,RN,2020-06-10,2020,2020,Fc DA0MS0 WD-40 VMIP3S0 VSN0000,DA0MS0 WD-40 VMIP3S0,Fc DA0MS0 WD-40,VMIF3S0 Fc DA0MS0 WD-40,RG VMIF3S0 Fc DA0MS0 WD-40,WD-40 VMIP3S0 VSN0000,WD-40 VMIP3S0 VSN0000 VMP00SM,WD-40 VMIP3S0 VSN0000 VMP00SM CS,", el WD-40 poder ser",el WD-40 poder,", el WD-40","funcionar , el WD-40","también funcionar , el WD-40",WD-40 poder ser,WD-40 poder ser usar,WD-40 poder ser usar si
http://es.globedia.com/limpiar-impresora-inyeccion-tinta,globedia.com,2020-06-10,===NONE===,WD-40/Z/WD-40,"Para  rectificar  este  problema  ,  simplemente  ponga  un  poco  de  aceite  de  impresora  (  o  aceite  de  máquina  de  coser  y WD-40  si  no  lo  tiene  )  en  diferentes  partes  de  la  barra  y  arrastre  el  cabezal  del  cartucho  de  tinta  a  través  de  la  barra  para  asegurar  una  cobertura  uniforme  .",wd-40,z,wd-40,y,y,CC,coser,coser,VMN0000,de,de,SPS00,máquina,máquina,NCFS000,de,de,SPS00,si,si,CS,no,no,RN,lo,lo,PP3CNA00,tiene,tener,VMIP3S0,),),Fpt,2020-06-10,2020,2020,VMN0000 CC WD-40 CS RN,CC WD-40 CS,VMN0000 CC WD-40,SPS00 VMN0000 CC WD-40,NCFS000 SPS00 VMN0000 CC WD-40,WD-40 CS RN,WD-40 CS RN PP3CNA00,WD-40 CS RN PP3CNA00 VMIP3S0,coser y WD-40 si no,y WD-40 si,coser y WD-40,de coser y WD-40,máquina de coser y WD-40,WD-40 si no,WD-40 si no lo,WD-40 si no lo tener
http://www.diariosigloxxi.com/texto-diario/mostrar/2009863/consejos-cerrajero-profesional-portal-cerrajeros,diariosigloxxi.com,2020-07-01,Spain,WD-40/Z/WD-40,"La  mayoría  de  las  veces  ,  un  bloqueo  de  la  cerradura  se  debe  a  la  acumulación  de  suciedad  o  escombros  :  puede  limpiar  el  mecanismo  con  un  bastoncillo  de  algodón  ligeramente  húmedo  o  con WD-40  para  desbloquear  la  cerradura  .",wd-40,z,wd-40,con,con,SPS00,o,o,CC,húmedo,húmedo,AQ0MS0,ligeramente,ligeramente,RG,algodón,algodón,NCMS000,para,para,SPS00,desbloquear,desbloquear,VMN0000,la,el,DA0FS0,cerradura,cerradura,NCFS000,.,.,Fp,2020-07-01,2020,2020,CC SPS00 WD-40 SPS00 VMN0000,SPS00 WD-40 SPS00,CC SPS00 WD-40,AQ0MS0 CC SPS00 WD-40,RG AQ0MS0 CC SPS00 WD-40,WD-40 SPS00 VMN0000,WD-40 SPS00 VMN0000 DA0FS0,WD-40 SPS00 VMN0000 DA0FS0 NCFS000,o con WD-40 para desbloquear,con WD-40 para,o con WD-40,húmedo o con WD-40,ligeramente húmedo o con WD-40,WD-40 para desbloquear,WD-40 para desbloquear el,WD-40 para desbloquear el cerradura
http://www.diariosigloxxi.com/texto-diario/mostrar/2009863/consejos-cerrajero-profesional-portal-cerrajeros,diariosigloxxi.com,2020-07-01,Spain,WD-40/Z/WD-40,"Para  resolver  este  problema  ,  simplemente  usar  un  lubricante  como  el WD-40  :  rocíelo  en  el  ojo  de  la  cerradura  ,  gire  la  llave  un  poco  y  verá  que  desaparece  mucho  más  fácilmente  .",wd-40,z,wd-40,el,el,DA0MS0,como,como,CS,lubricante,lubricante,NCMS000,un,uno,DI0MS0,usar,usar,VMN0000,:,:,Fd,rocíelo,rociar+lo,VMM03S0+PP3CNA00,en,en,SPS00,el,el,DA0MS0,ojo,ojo,NCMS000,2020-07-01,2020,2020,CS DA0MS0 WD-40 Fd VMM03S0+PP3CNA00,DA0MS0 WD-40 Fd,CS DA0MS0 WD-40,NCMS000 CS DA0MS0 WD-40,DI0MS0 NCMS000 CS DA0MS0 WD-40,WD-40 Fd VMM03S0+PP3CNA00,WD-40 Fd VMM03S0+PP3CNA00 SPS00,WD-40 Fd VMM03S0+PP3CNA00 SPS00 DA0MS0,como el WD-40 : rociar+lo,el WD-40 :,como el WD-40,lubricante como el WD-40,uno lubricante como el WD-40,WD-40 : rociar+lo,WD-40 : rociar+lo en,WD-40 : rociar+lo en el
https://www.excelsior.com.mx/opinion/alfredo-la-mont-iii/sin-maquillaje-arlamontmsncom/1392019,excelsior.com.mx,2020-07-04,Mexico,WD-40/Z/WD-40,Compre  una  lata  de  spray  de WD-40  para  quitarlas  fácilmente  .,wd-40,z,wd-40,de,de,SPS00,spray,spray,NCMS000,de,de,SPS00,lata,lata,NCFS000,una,uno,DI0FS0,para,para,SPS00,quitarlas,quitar+lo,VMN0000+PP3FPA00,fácilmente,fácilmente,RG,.,.,Fp,,,,2020-07-04,2020,2020,NCMS000 SPS00 WD-40 SPS00 VMN0000+PP3FPA00,SPS00 WD-40 SPS00,NCMS000 SPS00 WD-40,SPS00 NCMS000 SPS00 WD-40,NCFS000 SPS00 NCMS000 SPS00 WD-40,WD-40 SPS00 VMN0000+PP3FPA00,WD-40 SPS00 VMN0000+PP3FPA00 RG,WD-40 SPS00 VMN0000+PP3FPA00 RG Fp,spray de WD-40 para quitar+lo,de WD-40 para,spray de WD-40,de spray de WD-40,lata de spray de WD-40,WD-40 para quitar+lo,WD-40 para quitar+lo fácilmente,WD-40 para quitar+lo fácilmente .
https://www.alimarket.es/construccion/noticia/318041/las-fabricantes-de-ferreteria-y-bricolaje-aceleraran-el-desarrollo-del-e-commerce-y-la-digitalizacion,alimarket.es,2020-07-09,Spain,WD-40/Z/WD-40,"Por  último  ;  Carlos  Martín  ,  director  general  de WD-40  ,  se  ocupó  de  liderar  la  mesa  de  debate  sobre  ""  La  Transformación  Digital  ""  ,  que  puso  de  manifiesto  las  ventajas  del  teletrabajo  .",wd-40,z,wd-40,de,de,SPS00,general,general,AQ0CS0,director,director,NCMS000,",",",",Fc,Martín,martín,NP00000,",",",",Fc,se,se,P00CN000,ocupó,ocupar,VMIS3S0,de,de,SPS00,liderar,liderar,VMN0000,2020-07-09,2020,2020,AQ0CS0 SPS00 WD-40 Fc P00CN000,SPS00 WD-40 Fc,AQ0CS0 SPS00 WD-40,NCMS000 AQ0CS0 SPS00 WD-40,Fc NCMS000 AQ0CS0 SPS00 WD-40,WD-40 Fc P00CN000,WD-40 Fc P00CN000 VMIS3S0,WD-40 Fc P00CN000 VMIS3S0 SPS00,"general de WD-40 , se","de WD-40 ,",general de WD-40,director general de WD-40,", director general de WD-40","WD-40 , se","WD-40 , se ocupar","WD-40 , se ocupar de"
https://canal44.com/ee-uu/hombre-prende-fuego-a-cliente-en-cafeteria-en-eu/,canal44.com,2020-09-21,===NONE===,WD-40/Z/WD-40,"Los  clientes  trataron  de  alejarse  ante  la  amenaza  y  mientras  se  retiraban  ,  el  sujeto  los  roció  con  aceite WD-40  .",wd-40,z,wd-40,aceite,aceite,NCMS000,con,con,SPS00,roció,rociar,VMIS3S0,los,lo,PP3MPA00,sujeto,sujeto,NCMS000,.,.,Fp,,,,,,,,,,,,,2020-09-21,2020,2020,,NCMS000 WD-40 Fp,SPS00 NCMS000 WD-40,VMIS3S0 SPS00 NCMS000 WD-40,PP3MPA00 VMIS3S0 SPS00 NCMS000 WD-40,,,,,aceite WD-40 .,con aceite WD-40,rociar con aceite WD-40,lo rociar con aceite WD-40,,,
