url,website,date,country,keyword,sentence,kw,kw_lemma,kw_pos,left_w1,left_l1,left_p1,left_w2,left_l2,left_p2,left_w3,left_l3,left_p3,left_w4,left_l4,left_p4,left_w5,left_l5,left_p5,right_w1,right_l1,right_p1,right_w2,right_l2,right_p2,right_w3,right_l3,right_p3,right_w4,right_l4,right_p4,right_w5,right_l5,right_p5,datetime,year,10years,pattern_around5,pattern_around3,pattern_left2,pattern_left3,pattern_left4,pattern_right2,pattern_right3,pattern_right4,pattern_around5_lex,pattern_around3_lex,pattern_left2_lex,pattern_left3_lex,pattern_left4_lex,pattern_right2_lex,pattern_right3_lex,pattern_right4_lex
https://impresa.prensa.com/economia/Construyendo-marcas_0_5391210870.html,prensa.com,2019-09-08,===NONE===,Vaseline/NP00000/vaseline,"Este  es  el  caso  de  empresas  como  Mars  (  fabricante  de  M  &  M  ,  Snickers  ,  Milky  Way  ,  Twix  o  la  marca  de  comida  para  mascotas  Pedigree  )  y  empresas  como  Unilever  (  fabricante  de  jabón  Dove  , Vaseline  ,  Axe  o  Rexona  )  .",vaseline,np00000,vaseline,",",",",Fc,Dove,dove,NP00000,jabón,jabón,NCMS000,de,de,SPS00,fabricante,fabricante,NCCS000,",",",",Fc,Axe,axe,NP00000,o,o,CC,Rexona,rexona,NP00000,),),Fpt,2019-09-08,2019,2010,NP00000 Fc Vaseline Fc NP00000,Fc Vaseline Fc,NP00000 Fc Vaseline,NCMS000 NP00000 Fc Vaseline,SPS00 NCMS000 NP00000 Fc Vaseline,Vaseline Fc NP00000,Vaseline Fc NP00000 CC,Vaseline Fc NP00000 CC NP00000,"dove , Vaseline , axe",", Vaseline ,","dove , Vaseline","jabón dove , Vaseline","de jabón dove , Vaseline","Vaseline , axe","Vaseline , axe o","Vaseline , axe o rexona"
https://laopinion.com/2019/09/18/los-muchos-usos-de-la-vaselina-para-el-cuidado-de-la-piel/,laopinion.com,2019-09-18,United States,Vaseline/NP00000/vaseline,"Y  entre  esas  ,  seguramente  está  el  uso  de  un  producto  universal  ,  la Vaseline  Petroleum  Jelly  ,  que  sin  duda  ha  sido  un  elemento  básico  en  muchos  de  los  hogares  de  nuestras  familias  latinas  ,  generación  tras  generación  .",vaseline,np00000,vaseline,la,el,DA0FS0,",",",",Fc,universal,universal,AQ0CS0,producto,producto,NCMS000,un,uno,DI0MS0,Petroleum,petroleum,NP00000,Jelly,jelly,NP00000,",",",",Fc,que,que,PR0CN000,sin,sin,SPS00,2019-09-18,2019,2010,Fc DA0FS0 Vaseline NP00000 NP00000,DA0FS0 Vaseline NP00000,Fc DA0FS0 Vaseline,AQ0CS0 Fc DA0FS0 Vaseline,NCMS000 AQ0CS0 Fc DA0FS0 Vaseline,Vaseline NP00000 NP00000,Vaseline NP00000 NP00000 Fc,Vaseline NP00000 NP00000 Fc PR0CN000,", el Vaseline petroleum jelly",el Vaseline petroleum,", el Vaseline","universal , el Vaseline","producto universal , el Vaseline",Vaseline petroleum jelly,"Vaseline petroleum jelly ,","Vaseline petroleum jelly , que"
https://www.sopitas.com/musica/a-ahorrar-se-lanzara-reedicion-del-mtv-unplugged-de-nirvana-por-sus-25-anos/,sopitas.com,2019-09-27,United States,Vaselines/NP00000/vaselines,La  lista  incluyó  covers  de  actos  poco  conocidos  como  The Vaselines  y  los  Meat  Puppets  .,vaselines,np00000,vaselines,The,the,NP00000,como,como,CS,conocidos,conocer,VMP00PM,poco,poco,RG,actos,acto,NCMP000,y,y,CC,los,el,DA0MP0,Meat,meat,NP00000,Puppets,puppets,NP00000,.,.,Fp,2019-09-27,2019,2010,CS NP00000 Vaseline CC DA0MP0,NP00000 Vaseline CC,CS NP00000 Vaseline,VMP00PM CS NP00000 Vaseline,RG VMP00PM CS NP00000 Vaseline,Vaseline CC DA0MP0,Vaseline CC DA0MP0 NP00000,Vaseline CC DA0MP0 NP00000 NP00000,como the Vaseline y el,the Vaseline y,como the Vaseline,conocer como the Vaseline,poco conocer como the Vaseline,Vaseline y el,Vaseline y el meat,Vaseline y el meat puppets
https://launion.com.ar/el-emblematico-unplugged-de-nirvana-cumple-25-anos/,launion.com.ar,2019-10-05,Argentina,Vaselines/NP00000/vaselines,"Además  de  recorrer  su  repertorio  en  clave  desenchufada  ,  el  grupo  se  despachó  con  covers  de  The Vaselines  ,  David  Bowie  ,  los  Meat  Puppets  y  Leadbelly  .",vaselines,np00000,vaselines,The,the,NP00000,de,de,SPS00,covers,cover,NCMP000,con,con,SPS00,despachó,despachar,VMIS3S0,",",",",Fc,David,david,NP00000,Bowie,bowie,NP00000,",",",",Fc,los,el,DA0MP0,2019-10-05,2019,2010,SPS00 NP00000 Vaseline Fc NP00000,NP00000 Vaseline Fc,SPS00 NP00000 Vaseline,NCMP000 SPS00 NP00000 Vaseline,SPS00 NCMP000 SPS00 NP00000 Vaseline,Vaseline Fc NP00000,Vaseline Fc NP00000 NP00000,Vaseline Fc NP00000 NP00000 Fc,"de the Vaseline , david","the Vaseline ,",de the Vaseline,cover de the Vaseline,con cover de the Vaseline,"Vaseline , david","Vaseline , david bowie","Vaseline , david bowie ,"
https://jenesaispop.com/2009/02/17/12325/the-pains-of-being-pure-at-heart-st/#comment-1195041,jenesaispop.com,2019-11-05,===NONE===,Vaselines/NP00000/vaselines,"The  Pains  Of  Being  Pure  At  Heart  ,  un  joven  cuarteto  neoyorquino  compuesto  por  tres  chicos  y  una  chica  amantes  del  pop  ruidoso  de  The  Pastels  ,  Ramones  , Vaselines  ,  Nirvana  o  Teenage  Fanclub  ,  es  un  nombre  muy  largo  pero  muy  aclaratorio  respecto  al  espíritu  de  la  banda  :  emociones  vividas  con  la  intensidad  de  la  que  solo  es  capaz  un  adolescente  .",vaselines,np00000,vaselines,",",",",Fc,Ramones,ramones,NP00000,",",",",Fc,Pastels,pastels,NP00000,The,the,NP00000,",",",",Fc,Nirvana,nirvana,NP00000,o,o,CC,Teenage,teenage,NP00000,Fanclub,fanclub,NP00000,2019-11-05,2019,2010,NP00000 Fc Vaseline Fc NP00000,Fc Vaseline Fc,NP00000 Fc Vaseline,Fc NP00000 Fc Vaseline,NP00000 Fc NP00000 Fc Vaseline,Vaseline Fc NP00000,Vaseline Fc NP00000 CC,Vaseline Fc NP00000 CC NP00000,"ramones , Vaseline , nirvana",", Vaseline ,","ramones , Vaseline",", ramones , Vaseline","pastels , ramones , Vaseline","Vaseline , nirvana","Vaseline , nirvana o","Vaseline , nirvana o teenage"
https://www.concierto.cl/2019/11/18-de-noviembre-mtv-unplugged-nirvana/,concierto.cl,2019-11-14,Chile,Vaselines/NP00000/vaselines,"La  banda  interpretó  canciones  de  The Vaselines  ,  David  Bowie  y  Meat  Puppets  .",vaselines,np00000,vaselines,The,the,NP00000,de,de,SPS00,canciones,canción,NCFP000,interpretó,interpretar,VMIS3S0,banda,banda,NCFS000,",",",",Fc,David,david,NP00000,Bowie,bowie,NP00000,y,y,CC,Meat,meat,NP00000,2019-11-14,2019,2010,SPS00 NP00000 Vaseline Fc NP00000,NP00000 Vaseline Fc,SPS00 NP00000 Vaseline,NCFP000 SPS00 NP00000 Vaseline,VMIS3S0 NCFP000 SPS00 NP00000 Vaseline,Vaseline Fc NP00000,Vaseline Fc NP00000 NP00000,Vaseline Fc NP00000 NP00000 CC,"de the Vaseline , david","the Vaseline ,",de the Vaseline,canción de the Vaseline,interpretar canción de the Vaseline,"Vaseline , david","Vaseline , david bowie","Vaseline , david bowie y"
https://www.concierto.cl/2019/11/18-de-noviembre-mtv-unplugged-nirvana/,concierto.cl,2019-11-14,Chile,Vaselines/NP00000/vaselines,"En  los  Sony  Studios  de  la  ciudad  estadounidense  ,  Kurt  Cobain  ,  Krist  Novoselic  y  Dave  Grohl  realizaron  un  set  de  catorce  canciones  ,  entre  piezas  de  su  repertorio  y  versiones  de Vaselines  ,  David  Bowie  y  Meat  Puppets  .",vaselines,np00000,vaselines,de,de,SPS00,versiones,versión,NCFP000,y,y,CC,repertorio,repertorio,NCMS000,su,su,DP3CS0,",",",",Fc,David,david,NP00000,Bowie,bowie,NP00000,y,y,CC,Meat,meat,NP00000,2019-11-14,2019,2010,NCFP000 SPS00 Vaseline Fc NP00000,SPS00 Vaseline Fc,NCFP000 SPS00 Vaseline,CC NCFP000 SPS00 Vaseline,NCMS000 CC NCFP000 SPS00 Vaseline,Vaseline Fc NP00000,Vaseline Fc NP00000 NP00000,Vaseline Fc NP00000 NP00000 CC,"versión de Vaseline , david","de Vaseline ,",versión de Vaseline,y versión de Vaseline,repertorio y versión de Vaseline,"Vaseline , david","Vaseline , david bowie","Vaseline , david bowie y"
https://www.prnewswire.com/news-releases/unilever-y-sundial-brands-anuncian-emerge-su-nueva-marca-para-lucir-una-cabellera-natural-de-venta-exclusiva-en-target-896846153.html,prnewswire.com,2020-01-23,United States,Vaseline/NP00000/vaseline,"Ives  ,  Suave  ,  Talenti  Gelato  &  Sorbetto  ,  TAZO  ,  TIGI  ,  TRESemmé  y Vaseline  .",vaseline,np00000,vaseline,y,y,CC,TRESemmé,tresemmé,NP00000,",",",",Fc,TIGI,tigi,NP00000,",",",",Fc,.,.,Fp,,,,,,,,,,,,,2020-01-23,2020,2020,,CC Vaseline Fp,NP00000 CC Vaseline,Fc NP00000 CC Vaseline,NP00000 Fc NP00000 CC Vaseline,,,,,y Vaseline .,tresemmé y Vaseline,", tresemmé y Vaseline","tigi , tresemmé y Vaseline",,,
https://www.muyinteresante.es/naturaleza/fotos/los-paisajes-mas-bellos-del-ano-881581345021,muyinteresante.es,2020-02-11,Spain,Vaseline/NP00000/vaseline,"El  concurso  de  este  año  también  nos  ha  aportado  imágenes  impresionantes  de  nuevas  categorías  de  premios  incluidas  en  esta  sexta  edición  :  el  Premio  Snow  and  Ice  ,  que  fue  para  el  fotógrafo  búlgaro Vaseline  Atanasov  ,  el  Premio  Lone  Tree  ,  que  fue  otorgado  al  fotógrafo  alemán  Anke  Butawitsch  ,  y  el  Premio  Heavenly  Cloud  ,  que  fue  recogido  por  el  fotógrafo  estadounidense  Brandon  Yoshizawa  .",vaseline,np00000,vaseline,búlgaro,búlgaro,AQ0MS0,fotógrafo,fotógrafo,NCMS000,el,el,DA0MS0,para,para,SPS00,fue,ser,VSIS3S0,Atanasov,atanasov,NP00000,",",",",Fc,el,el,DA0MS0,Premio,premio,NP00000,Lone,lone,NP00000,2020-02-11,2020,2020,NCMS000 AQ0MS0 Vaseline NP00000 Fc,AQ0MS0 Vaseline NP00000,NCMS000 AQ0MS0 Vaseline,DA0MS0 NCMS000 AQ0MS0 Vaseline,SPS00 DA0MS0 NCMS000 AQ0MS0 Vaseline,Vaseline NP00000 Fc,Vaseline NP00000 Fc DA0MS0,Vaseline NP00000 Fc DA0MS0 NP00000,"fotógrafo búlgaro Vaseline atanasov ,",búlgaro Vaseline atanasov,fotógrafo búlgaro Vaseline,el fotógrafo búlgaro Vaseline,para el fotógrafo búlgaro Vaseline,"Vaseline atanasov ,","Vaseline atanasov , el","Vaseline atanasov , el premio"
https://www.periodistadigital.com/magazine/belleza/20200302/productos-iconicos-belleza-noticia-689404273414/,periodistadigital.com,2020-03-02,Spain,Vaseline/NP00000/vaseline,"Desde  1870  los  productos Vaseline  ®  ,  han  brindado  cuidados  a  la  piel  .",vaseline,np00000,vaseline,productos,producto,NCMP000,los,el,DA0MP0,1870,1870,Z,Desde,desde,SPS00,,,,®,®,Fz,",",",",Fc,han,haber,VAIP3P0,brindado,brindar,VMP00SM,cuidados,cuidar,VMP00PM,2020-03-02,2020,2020,DA0MP0 NCMP000 Vaseline Fz Fc,NCMP000 Vaseline Fz,DA0MP0 NCMP000 Vaseline,Z DA0MP0 NCMP000 Vaseline,SPS00 Z DA0MP0 NCMP000 Vaseline,Vaseline Fz Fc,Vaseline Fz Fc VAIP3P0,Vaseline Fz Fc VAIP3P0 VMP00SM,"el producto Vaseline ® ,",producto Vaseline ®,el producto Vaseline,1870 el producto Vaseline,desde 1870 el producto Vaseline,"Vaseline ® ,","Vaseline ® , haber","Vaseline ® , haber brindar"
https://jenesaispop.com/2020/05/03/389896/porridge-radio-every-bad/,jenesaispop.com,2020-05-03,===NONE===,Vaselines/NP00000/vaselines,"Los  golpes  de  adrenalina  lanzados  en  temas  como  '  Sweet  '  les  sitúan  en  la  estela  de  la  exbanda  de  Kim  Gordon  ,  pero  los  detalles  les  hacen  sonar  mucho  más  pop  :  '  Don't  Ask  Me  Twice  '  termina  en  plan  Smiths  ,  los  teclados  a  menudo  les  acercan  a  la  new-wave  ,  algún  tímido  arreglo  de  cuerda  a  The Vaselines  e  incluso  el  timbre  de  Dana  suena  cercano  a  otro  ""  Smith  ""  ,  en  concreto  el  líder  de  The  Cure  .",vaselines,np00000,vaselines,The,the,NP00000,a,a,SPS00,cuerda,cuerda,NCFS000,de,de,SPS00,arreglo,arreglo,NCMS000,e,y,CC,incluso,incluso,RG,el,el,DA0MS0,timbre,timbre,NCMS000,de,de,SPS00,2020-05-03,2020,2020,SPS00 NP00000 Vaseline CC RG,NP00000 Vaseline CC,SPS00 NP00000 Vaseline,NCFS000 SPS00 NP00000 Vaseline,SPS00 NCFS000 SPS00 NP00000 Vaseline,Vaseline CC RG,Vaseline CC RG DA0MS0,Vaseline CC RG DA0MS0 NCMS000,a the Vaseline y incluso,the Vaseline y,a the Vaseline,cuerda a the Vaseline,de cuerda a the Vaseline,Vaseline y incluso,Vaseline y incluso el,Vaseline y incluso el timbre
https://hipertextual.com/2020/06/coca-cola-frena-anuncios-facebook,hipertextual.com,2020-06-27,===NONE===,Vaseline/NP00000/vaseline,"Ives  ,  Hellmann's  ,  Lipton  ,  Knorr  ,  Popsicle  y Vaseline  ,  por  mencionar  solo  algunas  .  ""  Continuar  publicitando  en  estas  plataformas  en  este  momento  no  agregaría  valor  para  las  personas  y  la  sociedad  .",vaseline,np00000,vaseline,y,y,CC,Popsicle,popsicle,NP00000,",",",",Fc,Knorr,knorr,NP00000,",",",",Fc,",",",",Fc,por,por,SPS00,mencionar,mencionar,VMN0000,solo,solo,AQ0MS0,algunas,alguno,PI0FP000,2020-06-27,2020,2020,NP00000 CC Vaseline Fc SPS00,CC Vaseline Fc,NP00000 CC Vaseline,Fc NP00000 CC Vaseline,NP00000 Fc NP00000 CC Vaseline,Vaseline Fc SPS00,Vaseline Fc SPS00 VMN0000,Vaseline Fc SPS00 VMN0000 AQ0MS0,"popsicle y Vaseline , por","y Vaseline ,",popsicle y Vaseline,", popsicle y Vaseline","knorr , popsicle y Vaseline","Vaseline , por","Vaseline , por mencionar","Vaseline , por mencionar solo"
https://www.sopitas.com/musica/estas-son-las-16-mejores-presentaciones-en-historia-mtv-unplugged/,sopitas.com,2020-06-27,United States,Vaselines/NP00000/vaselines,"Durante  esta  presentación  ,  en  el  setlist  aparecieron  rolas  que  no  gozaban  de  la  misma  popularidad  que  otras  y  sobre  todo  ,  decidieron  tocar  covers  de  sus  ídolos  ,  como  David  Bowie  ,  The Vaselines  ,  Meat  Puppets  y  Leadbelly  .",vaselines,np00000,vaselines,The,the,NP00000,",",",",Fc,Bowie,bowie,NP00000,David,david,NP00000,como,como,CS,",",",",Fc,Meat,meat,NP00000,Puppets,puppets,NP00000,y,y,CC,Leadbelly,leadbelly,NP00000,2020-06-27,2020,2020,Fc NP00000 Vaseline Fc NP00000,NP00000 Vaseline Fc,Fc NP00000 Vaseline,NP00000 Fc NP00000 Vaseline,NP00000 NP00000 Fc NP00000 Vaseline,Vaseline Fc NP00000,Vaseline Fc NP00000 NP00000,Vaseline Fc NP00000 NP00000 CC,", the Vaseline , meat","the Vaseline ,",", the Vaseline","bowie , the Vaseline","david bowie , the Vaseline","Vaseline , meat","Vaseline , meat puppets","Vaseline , meat puppets y"
https://www.soy502.com/articulo/grandes-empresas-dejaran-pautar-redes-sociales-153,soy502.com,2020-06-27,===NONE===,Vaseline/NP00000/vaseline,"Ives  ,  Hellmann's  ,  Knorr  ,  Popsicle  y Vaseline  ,  que  dejaría  de  anunciarse  en  Facebook  ,  Twitter  e  Instagram  en  los  Estados  Unidos  ,  hasta  finales  de  2020  ,  debido  al  ""  período  de  elecciones  polarizadas  ""  en  ese  país  .",vaseline,np00000,vaseline,y,y,CC,Popsicle,popsicle,NP00000,",",",",Fc,Knorr,knorr,NP00000,",",",",Fc,",",",",Fc,que,que,PR0CN000,dejaría,dejar,VMIC3S0,de,de,SPS00,anunciarse,anunciar+se,VMN0000+PP3CN000,2020-06-27,2020,2020,NP00000 CC Vaseline Fc PR0CN000,CC Vaseline Fc,NP00000 CC Vaseline,Fc NP00000 CC Vaseline,NP00000 Fc NP00000 CC Vaseline,Vaseline Fc PR0CN000,Vaseline Fc PR0CN000 VMIC3S0,Vaseline Fc PR0CN000 VMIC3S0 SPS00,"popsicle y Vaseline , que","y Vaseline ,",popsicle y Vaseline,", popsicle y Vaseline","knorr , popsicle y Vaseline","Vaseline , que","Vaseline , que dejar","Vaseline , que dejar de"
https://www.prnewswire.com/news-releases/black-girls-lead-tm-2020-se-vuelve-virtual-en-asociacion-con-emerge-tm--887681929.html,prnewswire.com,2020-07-14,United States,Vaseline/NP00000/vaseline,"Ives  ,  Suave  ,  Talenti  Gelato  &  Sorbetto  ,  TAZO  ,  TIGI  ,  TRESemmé  y Vaseline  .",vaseline,np00000,vaseline,y,y,CC,TRESemmé,tresemmé,NP00000,",",",",Fc,TIGI,tigi,NP00000,",",",",Fc,.,.,Fp,,,,,,,,,,,,,2020-07-14,2020,2020,,CC Vaseline Fp,NP00000 CC Vaseline,Fc NP00000 CC Vaseline,NP00000 Fc NP00000 CC Vaseline,,,,,y Vaseline .,tresemmé y Vaseline,", tresemmé y Vaseline","tigi , tresemmé y Vaseline",,,
https://www.icrowdsp.com/2020/07/23/mercado-de-vaselina-medicinal-2020-tasa-de-crecimiento-de-la-industria-global-acciones-tamano-precio-perspectiva-desarrollos-y-pronostico-hasta-2025/,icrowdsp.com,2020-07-23,===NONE===,Vaseline/NP00000/vaseline,"Global  Medicinal Vaseline  Market  Report  analiza  los  principales  fabricantes  ,  aplicaciones  y  tipos  por  segmentos  y  cubre  todos  los  detalles  esenciales  sobre  la  evolución  futura  del  mercado  y  la  perspectiva  durante  el  período  de  previsión  .",vaseline,np00000,vaseline,Medicinal,medicinal,NP00000,Global,global,NP00000,,,,,,,,,,Market,market,NP00000,Report,report,NP00000,analiza,analizar,VMIP3S0,los,el,DA0MP0,principales,principal,NCMP000,2020-07-23,2020,2020,NP00000 NP00000 Vaseline NP00000 NP00000,NP00000 Vaseline NP00000,NP00000 NP00000 Vaseline,,,Vaseline NP00000 NP00000,Vaseline NP00000 NP00000 VMIP3S0,Vaseline NP00000 NP00000 VMIP3S0 DA0MP0,global medicinal Vaseline market report,medicinal Vaseline market,global medicinal Vaseline,,,Vaseline market report,Vaseline market report analizar,Vaseline market report analizar el
https://www.icrowdsp.com/2020/07/23/mercado-de-vaselina-medicinal-2020-tasa-de-crecimiento-de-la-industria-global-acciones-tamano-precio-perspectiva-desarrollos-y-pronostico-hasta-2025/,icrowdsp.com,2020-07-23,===NONE===,Vaseline/NP00000/vaseline,"Global  ""  Medicinal Vaseline  Market  ""  Research  Report  ofrece  análisis  clave  y  perspectivas  de  fabricantes  de  vaselina  medicinal  con  los  mejores  datos  y  cifras  ,  datos  sobre  los  desafíos  de  la  industria  y  oportunidad  de  crecimiento  potencial  con  los  últimos  avances  en  todo  el  mundo  .",vaseline,np00000,vaseline,Medicinal,medicinal,NP00000,"""","""",Fe,Global,global,NP00000,,,,,,,Market,market,NP00000,"""","""",Fe,Research,research,NP00000,Report,report,NP00000,ofrece,ofrecer,VMIP3S0,2020-07-23,2020,2020,Fe NP00000 Vaseline NP00000 Fe,NP00000 Vaseline NP00000,Fe NP00000 Vaseline,NP00000 Fe NP00000 Vaseline,,Vaseline NP00000 Fe,Vaseline NP00000 Fe NP00000,Vaseline NP00000 Fe NP00000 NP00000,""" medicinal Vaseline market """,medicinal Vaseline market,""" medicinal Vaseline","global "" medicinal Vaseline",,"Vaseline market ""","Vaseline market "" research","Vaseline market "" research report"
https://www.icrowdsp.com/2020/07/23/mercado-de-vaselina-medicinal-2020-tasa-de-crecimiento-de-la-industria-global-acciones-tamano-precio-perspectiva-desarrollos-y-pronostico-hasta-2025/,icrowdsp.com,2020-07-23,===NONE===,Vaseline/NP00000/vaseline,PARA  ENTENDER  CÓMO  SE  TRATA  EL  IMPACTO  DE  COVID-19  EN  ESTE  INFORME  -  SOLICITAR  MUESTRA  El  informe  de  análisis  Global  Medicinal Vaseline  Market  proporciona  un  estudio  detallado  del  tamaño  del  mercado  de  diferentes  segmentos  y  países  de  años  anteriores  y  pronostica  los  valores  para  los  próximos  cinco  años  .,vaseline,np00000,vaseline,Medicinal,medicinal,NP00000,Global,global,NP00000,análisis,análisis,NCMN000,de,de,SPS00,informe,informe,AQ0CS0,Market,market,NP00000,proporciona,proporcionar,VMIP3S0,un,uno,DI0MS0,estudio,estudio,NCMS000,detallado,detallar,VMP00SM,2020-07-23,2020,2020,NP00000 NP00000 Vaseline NP00000 VMIP3S0,NP00000 Vaseline NP00000,NP00000 NP00000 Vaseline,NCMN000 NP00000 NP00000 Vaseline,SPS00 NCMN000 NP00000 NP00000 Vaseline,Vaseline NP00000 VMIP3S0,Vaseline NP00000 VMIP3S0 DI0MS0,Vaseline NP00000 VMIP3S0 DI0MS0 NCMS000,global medicinal Vaseline market proporcionar,medicinal Vaseline market,global medicinal Vaseline,análisis global medicinal Vaseline,de análisis global medicinal Vaseline,Vaseline market proporcionar,Vaseline market proporcionar uno,Vaseline market proporcionar uno estudio
https://www.icrowdsp.com/2020/07/23/mercado-de-vaselina-medicinal-2020-tasa-de-crecimiento-de-la-industria-global-acciones-tamano-precio-perspectiva-desarrollos-y-pronostico-hasta-2025/,icrowdsp.com,2020-07-23,===NONE===,Vaseline/NP00000/vaseline,"Acerca  de  Medicinal Vaseline  Market  :  El  informe  comienza  a  partir  de  una  visión  general  de  la  estructura  de  la  cadena  de  industria  ,  y  describe  el  entorno  de  la  industria  ,  luego  analiza  el  tamaño  del  mercado  y  la  previsión  de  la  vaselina  medicinal  por  producto  ,  región  y  aplicación  ,  además  ,  este  informe  presenta  la  situación  de  la  competencia  de  mercado  entre  los  proveedores  y  el  perfil  de  la  empresa  ,  además  ,  el  análisis  de  precios  de  mercado  y  las  características  de  la  cadena  de  valor  se  tratan  en  este  informe  .",vaseline,np00000,vaseline,Medicinal,medicinal,NP00000,de,de,SPS00,Acerca,acercar,VMIP3S0,,,,,,,Market,market,NP00000,:,:,Fd,El,el,DA0MS0,informe,informe,NCMS000,comienza,comenzar,VMIP3S0,2020-07-23,2020,2020,SPS00 NP00000 Vaseline NP00000 Fd,NP00000 Vaseline NP00000,SPS00 NP00000 Vaseline,VMIP3S0 SPS00 NP00000 Vaseline,,Vaseline NP00000 Fd,Vaseline NP00000 Fd DA0MS0,Vaseline NP00000 Fd DA0MS0 NCMS000,de medicinal Vaseline market :,medicinal Vaseline market,de medicinal Vaseline,acercar de medicinal Vaseline,,Vaseline market :,Vaseline market : el,Vaseline market : el informe
https://www.icrowdsp.com/2020/07/23/mercado-de-vaselina-medicinal-2020-tasa-de-crecimiento-de-la-industria-global-acciones-tamano-precio-perspectiva-desarrollos-y-pronostico-hasta-2025/,icrowdsp.com,2020-07-23,===NONE===,Vaseline/NP00000/vaseline,"tamaño  ,  precio  ,  CAGR  ,  tasa  de  crecimiento  y  perspectivas  futuras  Informe  de  mercado  del  módulo  de  pantalla  táctil  2020  -  Análisis  de  la  profundidad  sobre  la  cuota  de  mercado  ,  el  tamaño  ,  la  tasa  de  crecimiento  y  los  factores  ,  los  desarrollos  y  perspectivas  futuros  Global  Journal  App  Market  2020  -  Análisis  en  profundidad  de  las  tendencias  actuales  del  mercado  ,  incluyendo  la  cuota  de  la  industria  ,  el  tamaño  ,  los  fabricantes  y  las  perspectivas  de  futuro  Comunicado  de  prensa  distribuido  por  The  Express  Wire  Para  ver  la  versión  original  en  The  Express  Wire  visite  Medicinal Vaseline  Market  2020  -  Global  Industry  Growth  Rate  ,  Share  ,  Size  ,  Price  ,  Prospect  ,  Developments  and  Forecast  hasta  2025 </doc>",vaseline,np00000,vaseline,Medicinal,medicinal,NP00000,visite,visitar,VMSP3S0,Wire,wire,NP00000,Express,express,NP00000,The,the,NP00000,Market,market,NP00000,2020,2020,Z,-,-,Fg,Global,global,NP00000,Industry,industry,NP00000,2020-07-23,2020,2020,VMSP3S0 NP00000 Vaseline NP00000 Z,NP00000 Vaseline NP00000,VMSP3S0 NP00000 Vaseline,NP00000 VMSP3S0 NP00000 Vaseline,NP00000 NP00000 VMSP3S0 NP00000 Vaseline,Vaseline NP00000 Z,Vaseline NP00000 Z Fg,Vaseline NP00000 Z Fg NP00000,visitar medicinal Vaseline market 2020,medicinal Vaseline market,visitar medicinal Vaseline,wire visitar medicinal Vaseline,express wire visitar medicinal Vaseline,Vaseline market 2020,Vaseline market 2020 -,Vaseline market 2020 - global
https://www.prnewswire.com/news-releases/con-smell-ready-axe-r-ayuda-a-los-adolescentes-a-estar-listos-para-citas-romanticas-en-un-entorno-impredecible-824964547.html,prnewswire.com,2020-08-03,United States,Vaseline/NP00000/vaseline,"Ives  ,  Suave  ,  Talenti  Gelato  &  Sorbetto  ,  TAZO  ,  TIGI  ,  TRESemmé  y Vaseline  .",vaseline,np00000,vaseline,y,y,CC,TRESemmé,tresemmé,NP00000,",",",",Fc,TIGI,tigi,NP00000,",",",",Fc,.,.,Fp,,,,,,,,,,,,,2020-08-03,2020,2020,,CC Vaseline Fp,NP00000 CC Vaseline,Fc NP00000 CC Vaseline,NP00000 Fc NP00000 CC Vaseline,,,,,y Vaseline .,tresemmé y Vaseline,", tresemmé y Vaseline","tigi , tresemmé y Vaseline",,,
https://www.eluniversal.com.mx/de-ultima/usos-de-la-vaselina-en-la-belleza,eluniversal.com.mx,2020-09-08,Mexico,Vaseline/NP00000/vaseline,"Si  no  tienes  iluminador  y  te  urge  uno  para  lucir  espectacular  ,  el  sitio  en  inglés Vaseline  recomienda  utilizar  vaselina  sobre  tu  rostro  ,  aplícalo  en  la  parte  superior  de  tus  mejillas  para  provocar  que  tu  piel  luzca  brillante  e  hidratada  .",vaseline,np00000,vaseline,inglés,inglés,NCMS000,en,en,SPS00,sitio,sitio,NCMS000,el,el,DA0MS0,",",",",Fc,recomienda,recomendar,VMIP3S0,utilizar,utilizar,VMN0000,vaselina,vaselina,NCFS000,sobre,sobre,SPS00,tu,tu,DP2CSS,2020-09-08,2020,2020,SPS00 NCMS000 Vaseline VMIP3S0 VMN0000,NCMS000 Vaseline VMIP3S0,SPS00 NCMS000 Vaseline,NCMS000 SPS00 NCMS000 Vaseline,DA0MS0 NCMS000 SPS00 NCMS000 Vaseline,Vaseline VMIP3S0 VMN0000,Vaseline VMIP3S0 VMN0000 NCFS000,Vaseline VMIP3S0 VMN0000 NCFS000 SPS00,en inglés Vaseline recomendar utilizar,inglés Vaseline recomendar,en inglés Vaseline,sitio en inglés Vaseline,el sitio en inglés Vaseline,Vaseline recomendar utilizar,Vaseline recomendar utilizar vaselina,Vaseline recomendar utilizar vaselina sobre
https://www.sopitas.com/musica/16-mejores-presentaciones-en-historia-mtv-unplugged/,sopitas.com,2020-09-08,United States,Vaselines/NP00000/vaselines,"Durante  esta  presentación  ,  en  el  setlist  aparecieron  rolas  que  no  gozaban  de  la  misma  popularidad  que  otras  y  sobre  todo  ,  decidieron  tocar  covers  de  sus  ídolos  ,  como  David  Bowie  ,  The Vaselines  ,  Meat  Puppets  y  Leadbelly  .",vaselines,np00000,vaselines,The,the,NP00000,",",",",Fc,Bowie,bowie,NP00000,David,david,NP00000,como,como,CS,",",",",Fc,Meat,meat,NP00000,Puppets,puppets,NP00000,y,y,CC,Leadbelly,leadbelly,NP00000,2020-09-08,2020,2020,Fc NP00000 Vaseline Fc NP00000,NP00000 Vaseline Fc,Fc NP00000 Vaseline,NP00000 Fc NP00000 Vaseline,NP00000 NP00000 Fc NP00000 Vaseline,Vaseline Fc NP00000,Vaseline Fc NP00000 NP00000,Vaseline Fc NP00000 NP00000 CC,", the Vaseline , meat","the Vaseline ,",", the Vaseline","bowie , the Vaseline","david bowie , the Vaseline","Vaseline , meat","Vaseline , meat puppets","Vaseline , meat puppets y"
https://www.prnewswire.com/news-releases/knorr-y-dascha-polanco-lanzan-feedthevote-para-que-el-acceso-a-una-alimentacion-nutritiva-sea-un-tema-a-abordar-en-esta-temporada-electoral-808597670.html,prnewswire.com,2020-10-02,United States,Vaseline/NP00000/vaseline,"Ives  ,  Suave  ,  Talenti  Gelato  &  Sorbetto  ,  TAZO  ,  TIGI  ,  TRESemmé  y Vaseline  .",vaseline,np00000,vaseline,y,y,CC,TRESemmé,tresemmé,NP00000,",",",",Fc,TIGI,tigi,NP00000,",",",",Fc,.,.,Fp,,,,,,,,,,,,,2020-10-02,2020,2020,,CC Vaseline Fp,NP00000 CC Vaseline,Fc NP00000 CC Vaseline,NP00000 Fc NP00000 CC Vaseline,,,,,y Vaseline .,tresemmé y Vaseline,", tresemmé y Vaseline","tigi , tresemmé y Vaseline",,,
