url,website,date,country,keyword,sentence,kw,kw_lemma,kw_pos,left_w1,left_l1,left_p1,left_w2,left_l2,left_p2,left_w3,left_l3,left_p3,left_w4,left_l4,left_p4,left_w5,left_l5,left_p5,right_w1,right_l1,right_p1,right_w2,right_l2,right_p2,right_w3,right_l3,right_p3,right_w4,right_l4,right_p4,right_w5,right_l5,right_p5,datetime,year,10years,pattern_around5,pattern_around3,pattern_left2,pattern_left3,pattern_left4,pattern_right2,pattern_right3,pattern_right4,pattern_around5_lex,pattern_around3_lex,pattern_left2_lex,pattern_left3_lex,pattern_left4_lex,pattern_right2_lex,pattern_right3_lex,pattern_right4_lex
https://elcomidista.elpais.com/elcomidista/2020/03/25/articulo/1585152812_813663.html,elpais.com,2020-04-14,===NONE===,Bitter_Kas/NP00000_NP00000/bitter_kas,"La  única  indulgencia  que  me  permito  del  super  son  berberechos  en  escabeche  ,  mejillones  y Bitter_Kas  ,  que  el  vermut  hay  que  hacerlo  aunque  Godzilla  esté  jugando  al  pádel  con  las  torres  KIO  y  España  se  caiga  en  pedazos  .",bitter_kas,np00000_np00000,bitter_kas,y,y,CC,mejillones,mejillón,NCMP000,",",",",Fc,escabeche,escabeche,NCMS000,en,en,SPS00,",",",",Fc,que,que,CS,el,el,DA0MS0,vermut,vermut,NCMS000,hay,haber,VMIP3S0,2020-04-14,2020,2020,NCMP000 CC Bitter Kas Fc CS,CC Bitter Kas Fc,NCMP000 CC Bitter Kas,Fc NCMP000 CC Bitter Kas,NCMS000 Fc NCMP000 CC Bitter Kas,Bitter Kas Fc CS,Bitter Kas Fc CS DA0MS0,Bitter Kas Fc CS DA0MS0 NCMS000,"mejillón y Bitter Kas , que","y Bitter Kas ,",mejillón y Bitter Kas,", mejillón y Bitter Kas","escabeche , mejillón y Bitter Kas","Bitter Kas , que","Bitter Kas , que el","Bitter Kas , que el vermut"
https://www.abc.es/espana/castilla-la-mancha/toledo/abci-santiago-sastre-para-luis-alba-202005141249_noticia.html,abc.es,2020-05-14,Spain,bitter_kas/NCMS000_AQ0FP0/bitter_kas,Él  siempre  se  pedía  un bitter_kas  .,bitter_kas,ncms000_aq0fp0,bitter_kas,un,uno,DI0MS0,pedía,pedir,VMII3S0,se,se,P00CN000,siempre,siempre,RG,Él,él,PP3MS000,.,.,Fp,,,,,,,,,,,,,2020-05-14,2020,2020,,DI0MS0 Bitter Kas Fp,VMII3S0 DI0MS0 Bitter Kas,P00CN000 VMII3S0 DI0MS0 Bitter Kas,RG P00CN000 VMII3S0 DI0MS0 Bitter Kas,,,,,uno Bitter Kas .,pedir uno Bitter Kas,se pedir uno Bitter Kas,siempre se pedir uno Bitter Kas,,,
https://www.economiadigital.es/consumo/mercadona-retira-bitter-kas-hacendado-protestas-clientes_20084475_102.html,economiadigital.es,2020-07-24,Spain,bitter_kas/NCMS000_AQ0FP0/bitter_kas,"El  supermercado  valenciano  ha  decidido  retirar  su  exitoso bitter_kas  de  marca  Hacendado  ,  algo  que  ha  generado  mucho  revuelo  en  las  redes  sociales  entre  sus  seguidores  .",bitter_kas,ncms000_aq0fp0,bitter_kas,exitoso,exitoso,AQ0MS0,su,su,DP3CS0,retirar,retirar,VMN0000,decidido,decidir,VMP00SM,ha,haber,VAIP3S0,de,de,SPS00,marca,marca,NCFS000,Hacendado,hacendado,NP00000,",",",",Fc,algo,algo,PI0CS000,2020-07-24,2020,2020,DP3CS0 AQ0MS0 Bitter Kas SPS00 NCFS000,AQ0MS0 Bitter Kas SPS00,DP3CS0 AQ0MS0 Bitter Kas,VMN0000 DP3CS0 AQ0MS0 Bitter Kas,VMP00SM VMN0000 DP3CS0 AQ0MS0 Bitter Kas,Bitter Kas SPS00 NCFS000,Bitter Kas SPS00 NCFS000 NP00000,Bitter Kas SPS00 NCFS000 NP00000 Fc,su exitoso Bitter Kas de marca,exitoso Bitter Kas de,su exitoso Bitter Kas,retirar su exitoso Bitter Kas,decidir retirar su exitoso Bitter Kas,Bitter Kas de marca,Bitter Kas de marca hacendado,"Bitter Kas de marca hacendado ,"
https://www.economiadigital.es/consumo/mercadona-retira-bitter-kas-hacendado-protestas-clientes_20084475_102.html,economiadigital.es,2020-07-24,Spain,Bitter_Kas/NP00000_NP00000/bitter_kas,¿  Cuánto  os  paga  el  monopolio  de Bitter_Kas  ?,bitter_kas,np00000_np00000,bitter_kas,de,de,SPS00,monopolio,monopolio,NCMS000,el,el,DA0MS0,paga,pagar,VMIP3S0,os,os,PP2CP000,?,?,Fit,,,,,,,,,,,,,2020-07-24,2020,2020,,SPS00 Bitter Kas Fit,NCMS000 SPS00 Bitter Kas,DA0MS0 NCMS000 SPS00 Bitter Kas,VMIP3S0 DA0MS0 NCMS000 SPS00 Bitter Kas,,,,,de Bitter Kas ?,monopolio de Bitter Kas,el monopolio de Bitter Kas,pagar el monopolio de Bitter Kas,,,
https://www.economiadigital.es/consumo/mercadona-retira-bitter-kas-hacendado-protestas-clientes_20084475_102.html,economiadigital.es,2020-07-24,Spain,Bitter_Kas/NP00000_NP00000/bitter_kas,"Antes  bebo  '  meao  '  que  pagar  0,85  €  por  un Bitter_Kas  ""  .",bitter_kas,np00000_np00000,bitter_kas,un,uno,DI0MS0,por,por,SPS00,€,€,Fz,"0,85",0.85,Z,pagar,pagar,VMN0000,"""","""",Fe,.,.,Fp,,,,,,,,,,2020-07-24,2020,2020,SPS00 DI0MS0 Bitter Kas Fe Fp,DI0MS0 Bitter Kas Fe,SPS00 DI0MS0 Bitter Kas,Fz SPS00 DI0MS0 Bitter Kas,Z Fz SPS00 DI0MS0 Bitter Kas,Bitter Kas Fe Fp,,,"por uno Bitter Kas "" .","uno Bitter Kas """,por uno Bitter Kas,€ por uno Bitter Kas,0.85 € por uno Bitter Kas,"Bitter Kas "" .",,
https://www.economiadigital.es/consumo/mercadona-retira-bitter-kas-hacendado-protestas-clientes_20084475_102.html,economiadigital.es,2020-07-24,Spain,Bitter_Kas/NP00000_NP00000/bitter_kas,"No  ha  sido  el  único  en  exponer  este  supuesto  complot  entre  Mercadona  y Bitter_Kas  para  retirar  la  marca  blanca  del  producto  ,  otro  usuario  (  @  FreeganBCN  )  también  se  ha  unido  :  ¿  El  monopolio  de  Bitter  Kas  está  detrás  de  que  descataloguen  el  Bitter  Hacendado  ?",bitter_kas,np00000_np00000,bitter_kas,y,y,CC,Mercadona,mercadona,NP00000,entre,entre,SPS00,complot,complot,NCMS000,supuesto,suponer,VMP00SM,para,para,SPS00,retirar,retirar,VMN0000,la,el,DA0FS0,marca,marca,NCFS000,blanca,blanco,AQ0FS0,2020-07-24,2020,2020,NP00000 CC Bitter Kas SPS00 VMN0000,CC Bitter Kas SPS00,NP00000 CC Bitter Kas,SPS00 NP00000 CC Bitter Kas,NCMS000 SPS00 NP00000 CC Bitter Kas,Bitter Kas SPS00 VMN0000,Bitter Kas SPS00 VMN0000 DA0FS0,Bitter Kas SPS00 VMN0000 DA0FS0 NCFS000,mercadona y Bitter Kas para retirar,y Bitter Kas para,mercadona y Bitter Kas,entre mercadona y Bitter Kas,complot entre mercadona y Bitter Kas,Bitter Kas para retirar,Bitter Kas para retirar el,Bitter Kas para retirar el marca
https://www.economiadigital.es/consumo/mercadona-retira-bitter-kas-hacendado-protestas-clientes_20084475_102.html,economiadigital.es,2020-07-24,Spain,Bitter_Kas/NP00000_NP00000/bitter_kas,"No  ha  sido  el  único  en  exponer  este  supuesto  complot  entre  Mercadona  y  Bitter  Kas  para  retirar  la  marca  blanca  del  producto  ,  otro  usuario  (  @  FreeganBCN  )  también  se  ha  unido  :  ¿  El  monopolio  de Bitter_Kas  está  detrás  de  que  descataloguen  el  Bitter  Hacendado  ?",bitter_kas,np00000_np00000,bitter_kas,de,de,SPS00,monopolio,monopolio,NCMS000,El,el,DA0MS0,¿,¿,Fia,:,:,Fd,está,estar,VAIP3S0,detrás,detrás,RG,de,de,SPS00,que,que,CS,descataloguen,descatalogar,VMSP3P0,2020-07-24,2020,2020,NCMS000 SPS00 Bitter Kas VAIP3S0 RG,SPS00 Bitter Kas VAIP3S0,NCMS000 SPS00 Bitter Kas,DA0MS0 NCMS000 SPS00 Bitter Kas,Fia DA0MS0 NCMS000 SPS00 Bitter Kas,Bitter Kas VAIP3S0 RG,Bitter Kas VAIP3S0 RG SPS00,Bitter Kas VAIP3S0 RG SPS00 CS,monopolio de Bitter Kas estar detrás,de Bitter Kas estar,monopolio de Bitter Kas,el monopolio de Bitter Kas,¿ el monopolio de Bitter Kas,Bitter Kas estar detrás,Bitter Kas estar detrás de,Bitter Kas estar detrás de que
https://www.laopiniondemalaga.es/opinion/2020/07/25/fria-linea-azul/1180434.html,laopiniondemalaga.es,2020-07-25,Spain,bitter_KAS/NCMS000_NP00000/bitter_kas,"Se  pusieron  unas  copas  de  ginebra  ,  bien  fría  ,  con bitter_KAS  ,  y  volvieron  a  todos  los  lugares  en  los  que  estuvieron  y  a  aquellos  con  los  que  soñaron  .  ""  Nos  dejaremos  llevar  ,  como  siempre  ""  ,  dijo  él  .",bitter_kas,ncms000_np00000,bitter_kas,con,con,SPS00,",",",",Fc,fría,frío,AQ0FS0,bien,bien,RG,",",",",Fc,",",",",Fc,y,y,CC,volvieron,volver,VMIS3P0,a,a,SPS00,todos,todo,DI0MP0,2020-07-25,2020,2020,Fc SPS00 Bitter Kas Fc CC,SPS00 Bitter Kas Fc,Fc SPS00 Bitter Kas,AQ0FS0 Fc SPS00 Bitter Kas,RG AQ0FS0 Fc SPS00 Bitter Kas,Bitter Kas Fc CC,Bitter Kas Fc CC VMIS3P0,Bitter Kas Fc CC VMIS3P0 SPS00,", con Bitter Kas , y","con Bitter Kas ,",", con Bitter Kas","frío , con Bitter Kas","bien frío , con Bitter Kas","Bitter Kas , y","Bitter Kas , y volver","Bitter Kas , y volver a"
https://www.laopiniondemalaga.es/opinion/2020/07/25/fria-linea-azul/1180434.html,laopiniondemalaga.es,2020-07-25,Spain,Bitter_KAS/NP00000_NP00000/bitter_kas,"Cerraron  la  sesión  ,  apagaron  el  equipo  ,  terminaron  el  viaje  con  cierto  sabor  amargo  como  el Bitter_KAS  ,  las  vueltas  ,  el  acto  ficcional  ,  la  huida  hacia  adelante  ,  todo  acabó  al  apagar  las  luces  del  salón  .",bitter_kas,np00000_np00000,bitter_kas,el,el,DA0MS0,como,como,CS,amargo,amargo,AQ0MS0,sabor,sabor,NCMS000,cierto,cierto,AQ0MS0,",",",",Fc,las,el,DA0FP0,vueltas,vuelta,NCFP000,",",",",Fc,el,el,DA0MS0,2020-07-25,2020,2020,CS DA0MS0 Bitter Kas Fc DA0FP0,DA0MS0 Bitter Kas Fc,CS DA0MS0 Bitter Kas,AQ0MS0 CS DA0MS0 Bitter Kas,NCMS000 AQ0MS0 CS DA0MS0 Bitter Kas,Bitter Kas Fc DA0FP0,Bitter Kas Fc DA0FP0 NCFP000,Bitter Kas Fc DA0FP0 NCFP000 Fc,"como el Bitter Kas , el","el Bitter Kas ,",como el Bitter Kas,amargo como el Bitter Kas,sabor amargo como el Bitter Kas,"Bitter Kas , el","Bitter Kas , el vuelta","Bitter Kas , el vuelta ,"
https://elcomidista.elpais.com/elcomidista/2020/07/23/articulo/1595502802_125963.html,elpais.com,2020-08-26,===NONE===,Bitter_Kas/NP00000_NP00000/bitter_kas,"Sobre  el  sabor  del  agua  del  grifo  es  ,  como  muchos  otros  sabores  ,  cuestión  de  acostumbrarse  .  ""  Te  sabe  mal  el  agua  del  grifo  pero  seguro  que  te  has  tomado  un  café  ,  has  bebido  alguna  cerveza  este  fin  de  semana  o  de  vez  en  cuando  te  pides  un  gin  tónic  ,  un  té  o  un Bitter_Kas  .",bitter_kas,np00000_np00000,bitter_kas,un,uno,DI0MS0,o,o,CC,té,té,NCMS000,un,uno,DI0MS0,",",",",Fc,.,.,Fp,,,,,,,,,,,,,2020-08-26,2020,2020,,DI0MS0 Bitter Kas Fp,CC DI0MS0 Bitter Kas,NCMS000 CC DI0MS0 Bitter Kas,DI0MS0 NCMS000 CC DI0MS0 Bitter Kas,,,,,uno Bitter Kas .,o uno Bitter Kas,té o uno Bitter Kas,uno té o uno Bitter Kas,,,
https://www.elmundo.es/papel/gastro/2020/09/01/5f4d34dcfc6c8392418b46a6.html,elmundo.es,2020-09-01,Spain,Bitter_Kas/NP00000_NP00000/bitter_kas,"Teniendo  en  cuenta  que  ,  como  Monti  recuerda  ,  ""  el Bitter_Kas  es  la  prueba  de  que  en  algún  momento  el  producto  amargo  tuvo  aquí  su  oportunidad  ""  .",bitter_kas,np00000_np00000,bitter_kas,el,el,DA0MS0,"""","""",Fe,",",",",Fc,recuerda,recordar,VMIP3S0,Monti,monti,NP00000,es,ser,VSIP3S0,la,el,DA0FS0,prueba,prueba,NCFS000,de,de,SPS00,que,que,CS,2020-09-01,2020,2020,Fe DA0MS0 Bitter Kas VSIP3S0 DA0FS0,DA0MS0 Bitter Kas VSIP3S0,Fe DA0MS0 Bitter Kas,Fc Fe DA0MS0 Bitter Kas,VMIP3S0 Fc Fe DA0MS0 Bitter Kas,Bitter Kas VSIP3S0 DA0FS0,Bitter Kas VSIP3S0 DA0FS0 NCFS000,Bitter Kas VSIP3S0 DA0FS0 NCFS000 SPS00,""" el Bitter Kas ser el",el Bitter Kas ser,""" el Bitter Kas",", "" el Bitter Kas","recordar , "" el Bitter Kas",Bitter Kas ser el,Bitter Kas ser el prueba,Bitter Kas ser el prueba de
https://www.elperiodico.com/es/sociedad/20200917/mujer-octogenaria-bilbao-ribadesella-geriatrico-hotel-confinamiento-coronavirus-8116325,elperiodico.com,2020-09-17,===NONE===,bitter_kas/NCMS000_AQ0FP0/bitter_kas,"Cuando  un  camarero  al  que  ya  conoce  por  el  nombre  le  trae  un  "" bitter_kas  ""  comienza  a  contar  su  historia  .",bitter_kas,ncms000_aq0fp0,bitter_kas,"""","""",Fe,un,uno,DI0MS0,trae,traer,VMIP3S0,le,le,PP3CSD00,nombre,nombre,NCMS000,"""","""",Fe,comienza,comenzar,VMIP3S0,a,a,SPS00,contar,contar,VMN0000,su,su,DP3CS0,2020-09-17,2020,2020,DI0MS0 Fe Bitter Kas Fe VMIP3S0,Fe Bitter Kas Fe,DI0MS0 Fe Bitter Kas,VMIP3S0 DI0MS0 Fe Bitter Kas,PP3CSD00 VMIP3S0 DI0MS0 Fe Bitter Kas,Bitter Kas Fe VMIP3S0,Bitter Kas Fe VMIP3S0 SPS00,Bitter Kas Fe VMIP3S0 SPS00 VMN0000,"uno "" Bitter Kas "" comenzar",""" Bitter Kas ""","uno "" Bitter Kas","traer uno "" Bitter Kas","le traer uno "" Bitter Kas","Bitter Kas "" comenzar","Bitter Kas "" comenzar a","Bitter Kas "" comenzar a contar"
https://www.cope.es/actualidad/sociedad/crimenes-historicos/noticias/mataviejas-ancianas-asesinadas-por-venganza-final-inesperado-recordar-madre-excitaba-20201011_930696,cope.es,2020-10-11,Spain,Bitter_Kas/NP00000_NP00000/bitter_kas,"Ambos  tomaron  un Bitter_Kas  rojo  ,  era  verano  .",bitter_kas,np00000_np00000,bitter_kas,un,uno,DI0MS0,tomaron,tomar,VMIS3P0,Ambos,ambos,PI0MP000,,,,,,,rojo,rojo,AQ0MS0,",",",",Fc,era,ser,VSII1S0,verano,verano,NCMS000,.,.,Fp,2020-10-11,2020,2020,VMIS3P0 DI0MS0 Bitter Kas AQ0MS0 Fc,DI0MS0 Bitter Kas AQ0MS0,VMIS3P0 DI0MS0 Bitter Kas,PI0MP000 VMIS3P0 DI0MS0 Bitter Kas,,Bitter Kas AQ0MS0 Fc,Bitter Kas AQ0MS0 Fc VSII1S0,Bitter Kas AQ0MS0 Fc VSII1S0 NCMS000,"tomar uno Bitter Kas rojo ,",uno Bitter Kas rojo,tomar uno Bitter Kas,ambos tomar uno Bitter Kas,,"Bitter Kas rojo ,","Bitter Kas rojo , ser","Bitter Kas rojo , ser verano"
https://www.elmundo.es/economia/ahorro-y-consumo/2020/10/16/5f8989bdfdddff8e808b45d7.html,elmundo.es,2020-10-16,Spain,Bitter_Kas/NP00000_NP00000/bitter_kas,"Schweppes  , Bitter_Kas  o  Nórdica  añaden  edulcorantes  a  sus  tónicas  ,  lo  que  hará  que  el  coste  de  estos  productos  para  cócteles  o  combinados  suba  un  11  %  .",bitter_kas,np00000_np00000,bitter_kas,",",",",Fc,Schweppes,schweppes,NP00000,,,,,,,,,,o,o,CC,Nórdica,nórdica,NP00000,añaden,añadir,VMIP3P0,edulcorantes,edulcorante,NCCP000,a,a,SPS00,2020-10-16,2020,2020,NP00000 Fc Bitter Kas CC NP00000,Fc Bitter Kas CC,NP00000 Fc Bitter Kas,,,Bitter Kas CC NP00000,Bitter Kas CC NP00000 VMIP3P0,Bitter Kas CC NP00000 VMIP3P0 NCCP000,"schweppes , Bitter Kas o nórdica",", Bitter Kas o","schweppes , Bitter Kas",,,Bitter Kas o nórdica,Bitter Kas o nórdica añadir,Bitter Kas o nórdica añadir edulcorante
https://www.lavanguardia.com/comer/opinion/20201108/4038764/tormenta-perfecta-cierre-restaurantes-restricciones-covid19-virus.html,lavanguardia.com,2020-11-08,Spain,Bitter_Kas/NP00000_NP00000/bitter_kas,"Y  como  anécdota  ,  intentaré  recuperar  los  275  euros  que  me  cobraron  por  un Bitter_Kas  sin  alcohol  .",bitter_kas,np00000_np00000,bitter_kas,un,uno,DI0MS0,por,por,SPS00,cobraron,cobrar,VMIS3P0,me,me,PP1CS000,que,que,PR0CN000,sin,sin,SPS00,alcohol,alcohol,NCMS000,.,.,Fp,,,,,,,2020-11-08,2020,2020,SPS00 DI0MS0 Bitter Kas SPS00 NCMS000,DI0MS0 Bitter Kas SPS00,SPS00 DI0MS0 Bitter Kas,VMIS3P0 SPS00 DI0MS0 Bitter Kas,PP1CS000 VMIS3P0 SPS00 DI0MS0 Bitter Kas,Bitter Kas SPS00 NCMS000,Bitter Kas SPS00 NCMS000 Fp,,por uno Bitter Kas sin alcohol,uno Bitter Kas sin,por uno Bitter Kas,cobrar por uno Bitter Kas,me cobrar por uno Bitter Kas,Bitter Kas sin alcohol,Bitter Kas sin alcohol .,
https://www.lavanguardia.com/comer/opinion/20201108/4038764/tormenta-perfecta-cierre-restaurantes-restricciones-covid19-virus.html,lavanguardia.com,2020-11-08,Spain,Bitter_Kas/NP00000_NP00000/bitter_kas,"A  275  euros  un Bitter_Kas  sin  alcohol  no  te  lo  cobraban  ni  en  el  Zalacaín  ,  que  en  paz  descanse  . </doc>",bitter_kas,np00000_np00000,bitter_kas,un,uno,DI0MS0,euros,euro,NCMP000,275,275,Z,A,a,SPS00,,,,sin,sin,SPS00,alcohol,alcohol,NCMS000,no,no,RN,te,te,PP2CS000,lo,lo,PP3CNA00,2020-11-08,2020,2020,NCMP000 DI0MS0 Bitter Kas SPS00 NCMS000,DI0MS0 Bitter Kas SPS00,NCMP000 DI0MS0 Bitter Kas,Z NCMP000 DI0MS0 Bitter Kas,SPS00 Z NCMP000 DI0MS0 Bitter Kas,Bitter Kas SPS00 NCMS000,Bitter Kas SPS00 NCMS000 RN,Bitter Kas SPS00 NCMS000 RN PP2CS000,euro uno Bitter Kas sin alcohol,uno Bitter Kas sin,euro uno Bitter Kas,275 euro uno Bitter Kas,a 275 euro uno Bitter Kas,Bitter Kas sin alcohol,Bitter Kas sin alcohol no,Bitter Kas sin alcohol no te
https://www.ultimahora.es/noticias/local/2020/12/20/1224161/juan-carlos-frontera-tuning-tuve-salir-mallorca-para-poder-trabajar-mundo-publicidad.html,ultimahora.es,2020-12-20,Spain,Bitter_Kas/NP00000_NP00000/bitter_kas,"Lo  cierto  es  que  su  trabajo  firma  anuncios  muy  conocidos  de  marcas  o  cadenas  muy  importantes  como  Estrella  Damm  ,  Decathlon  , Bitter_Kas  ,  Media  Markt  ,  ...  Son  firmas  conocidísimas  para  los  que  la  estrategia  publicitaria  es  fundamental  ...",bitter_kas,np00000_np00000,bitter_kas,",",",",Fc,Decathlon,decathlon,NP00000,",",",",Fc,Damm,damm,NP00000,Estrella,estrella,NP00000,",",",",Fc,Media,media,NP00000,Markt,markt,NP00000,",",",",Fc,...,...,Fs,2020-12-20,2020,2020,NP00000 Fc Bitter Kas Fc NP00000,Fc Bitter Kas Fc,NP00000 Fc Bitter Kas,Fc NP00000 Fc Bitter Kas,NP00000 Fc NP00000 Fc Bitter Kas,Bitter Kas Fc NP00000,Bitter Kas Fc NP00000 NP00000,Bitter Kas Fc NP00000 NP00000 Fc,"decathlon , Bitter Kas , media",", Bitter Kas ,","decathlon , Bitter Kas",", decathlon , Bitter Kas","damm , decathlon , Bitter Kas","Bitter Kas , media","Bitter Kas , media markt","Bitter Kas , media markt ,"
https://www.diariodejerez.es/suplementos-cadiz/en-la-mesa-lo-mejor/sopicaldo-vieiras_0_1531047102.html,diariodejerez.es,2020-12-22,Spain,Bitter_Kas/NP00000_NP00000/bitter_kas,"A  las  bebidas  se  incorporan  algunas  posmodernas  de  cuando  entonces  : Bitter_Kas  ,  Pepsi-Cola  y  Mirinda  .",bitter_kas,np00000_np00000,bitter_kas,:,:,Fd,entonces,entonces,RG,cuando,cuando,CS,de,de,SPS00,posmodernas,posmoderno,NCFP000,",",",",Fc,Pepsi-Cola,pepsi-cola,NP00000,y,y,CC,Mirinda,mirinda,NP00000,.,.,Fp,2020-12-22,2020,2020,RG Fd Bitter Kas Fc NP00000,Fd Bitter Kas Fc,RG Fd Bitter Kas,CS RG Fd Bitter Kas,SPS00 CS RG Fd Bitter Kas,Bitter Kas Fc NP00000,Bitter Kas Fc NP00000 CC,Bitter Kas Fc NP00000 CC NP00000,"entonces : Bitter Kas , pepsi-cola",": Bitter Kas ,",entonces : Bitter Kas,cuando entonces : Bitter Kas,de cuando entonces : Bitter Kas,"Bitter Kas , pepsi-cola","Bitter Kas , pepsi-cola y","Bitter Kas , pepsi-cola y mirinda"
https://www.elespanol.com/opinion/columnas/20210111/limites-humor-punto/550324967_13.html,elespanol.com,2021-01-11,===NONE===,Bitter_Kass/NP00000_NP00000/bitter_kass,"La  señora  del Bitter_Kass  aulló  :  ""  Martín  ,  calla  ""  .",bitter_kass,np00000_np00000,bitter_kass,del,de+el,SPS00+DA0MS0,señora,señor,NCFS000,La,el,DA0FS0,,,,,,,aulló,aullar,VMIS3S0,:,:,Fd,"""","""",Fe,Martín,martín,NP00000,",",",",Fc,2021-01-11,2021,2020,NCFS000 SPS00+DA0MS0 Bitter Kas VMIS3S0 Fd,SPS00+DA0MS0 Bitter Kas VMIS3S0,NCFS000 SPS00+DA0MS0 Bitter Kas,DA0FS0 NCFS000 SPS00+DA0MS0 Bitter Kas,,Bitter Kas VMIS3S0 Fd,Bitter Kas VMIS3S0 Fd Fe,Bitter Kas VMIS3S0 Fd Fe NP00000,señor de+el Bitter Kas aullar :,de+el Bitter Kas aullar,señor de+el Bitter Kas,el señor de+el Bitter Kas,,Bitter Kas aullar :,"Bitter Kas aullar : ""","Bitter Kas aullar : "" martín"
https://elcomidista.elpais.com/elcomidista/2021/03/01/articulo/1614602123_330653.html#ref%3Drss%26format%3Dsimple%26link%3Dlink,elpais.com,2021-03-17,===NONE===,Bitter_Kas/NP00000_NP00000/bitter_kas,"Maximino  Rodríguez  Marina  ,  sumiller  y  memoria  viva  de  los  locales  antiguos  más  señeros  de  Asturias  ,  recuerda  la  fruición  con  la  que  se  despachaba  el  lumumba  ,  junto  a  otros  combinados  de  imaginación  patria  ""  como  el  fino  con Bitter_Kas  o  el  pipermín  con  leche  ""  ,  este  último  engarzado  con  los  anteriores  y  que  se  llamaba  ,  en  otro  arrebato  de  poesía  ,  vaca  verde  .",bitter_kas,np00000_np00000,bitter_kas,con,con,SPS00,fino,fino,AQ0MS0,el,el,DA0MS0,como,como,CS,"""","""",Fe,o,o,CC,el,el,DA0MS0,pipermín,pipermín,NCMS000,con,con,SPS00,leche,leche,NCFS000,2021-03-17,2021,2020,AQ0MS0 SPS00 Bitter Kas CC DA0MS0,SPS00 Bitter Kas CC,AQ0MS0 SPS00 Bitter Kas,DA0MS0 AQ0MS0 SPS00 Bitter Kas,CS DA0MS0 AQ0MS0 SPS00 Bitter Kas,Bitter Kas CC DA0MS0,Bitter Kas CC DA0MS0 NCMS000,Bitter Kas CC DA0MS0 NCMS000 SPS00,fino con Bitter Kas o el,con Bitter Kas o,fino con Bitter Kas,el fino con Bitter Kas,como el fino con Bitter Kas,Bitter Kas o el,Bitter Kas o el pipermín,Bitter Kas o el pipermín con
https://blogs.publico.es/recetas-caseras-nutricion-saludable/2021/03/19/por-que-deberiamos-reducir-el-consumo-de-alcohol-y-que-bebidas-alternativas-tenemos-para-hacerlo/?doing_wp_cron=1616140513.9238579273223876953125,publico.es,2021-03-19,Spain,Bitter_Kas/NP00000_NP00000/bitter_kas," Bitter_Kas  sin  alcohol  :  Como  el  mosto  ,  el  '  Bitter  sin  '  fue  una  alternativa  al  alcohol  muy  popular  en  los  aperitivos  de  la  década  de  los  ochenta  .",bitter_kas,np00000_np00000,bitter_kas,,,,,,,,,,,,,,,,sin,sin,SPS00,alcohol,alcohol,NCMS000,:,:,Fd,Como,como,CS,el,el,DA0MS0,2021-03-19,2021,2020,,,,,,Bitter Kas SPS00 NCMS000,Bitter Kas SPS00 NCMS000 Fd,Bitter Kas SPS00 NCMS000 Fd CS,,,,,,Bitter Kas sin alcohol,Bitter Kas sin alcohol :,Bitter Kas sin alcohol : como
https://www.elnacional.cat/es/cultura/13-dias-y-medio-enganchado-a-las-telenovelas-turcas_596825_102.html,elnacional.cat,2021-04-01,===NONE===,Bitter_Kas/NP00000_NP00000/bitter_kas,"La  reacción  no  denota  dudas  :  descubrir  que  las  telenovelas  turcas  te  gustan  genera  aquella  incomprensión  equiparable  ,  desdichadamente  ,  a  cuando  con  veinte  años  afirmas  que  te  gusta  el Bitter_Kas  y  nadie  te  entiende  o  cuando  con  veinticinco  ,  en  vez  de  hacerte  un  tatuaje  ,  optas  por  dejarte  bigote  y  tus  amigos  te  preguntan  si  has  perdido  el  juicio  .",bitter_kas,np00000_np00000,bitter_kas,el,el,DA0MS0,gusta,gustar,VMIP3S0,te,te,PP2CS000,que,que,CS,afirmas,afirmar,VMIP2S0,y,y,CC,nadie,nadie,PI0CS000,te,te,PP2CS000,entiende,entender,VMIP3S0,o,o,CC,2021-04-01,2021,2020,VMIP3S0 DA0MS0 Bitter Kas CC PI0CS000,DA0MS0 Bitter Kas CC,VMIP3S0 DA0MS0 Bitter Kas,PP2CS000 VMIP3S0 DA0MS0 Bitter Kas,CS PP2CS000 VMIP3S0 DA0MS0 Bitter Kas,Bitter Kas CC PI0CS000,Bitter Kas CC PI0CS000 PP2CS000,Bitter Kas CC PI0CS000 PP2CS000 VMIP3S0,gustar el Bitter Kas y nadie,el Bitter Kas y,gustar el Bitter Kas,te gustar el Bitter Kas,que te gustar el Bitter Kas,Bitter Kas y nadie,Bitter Kas y nadie te,Bitter Kas y nadie te entender
https://www.eldiario.es/andalucia/sevilla/homenaje-hombre-tranquilo-construyo-sevilla-1992_1_7378471.html,eldiario.es,2021-04-05,Spain,Bitter_Kas/NP00000_NP00000/bitter_kas,"A  Alfonso  Guerra  le  dio  por  enumerar  los  adjetivos  que  le  dedican  a  Manuel  del  Valle  en  el  libro  homenaje  que  ha  prologado  el  propio  ex  vicepresidente  del  Gobierno  ,  y  agotó  buena  parte  de  las  existencias  del  diccionario  :  serio  ,  amistoso  ,  humano  ,  callado  ,  respetuoso  ,  inteligente  ,  culto  ,  bueno  ,  honesto  conciliador  ,  irónico  ,  dialogante  ,  discreto  ,  Buster  Keaton  (  por  lo  de  la  seriedad  )  o  abstemio  ,  por  aquello  de  que  le  reprochaban  que  en  la  Feria  bebía Bitter_Kas  .  ""  No  conozco  a  nadie  que  hablara  mal  de  él  ""  ,  subrayó  el  alcalde  de  Sevilla  ,  Juan  Espadas  ,  al  hilo  de  las  palabras  que  le  dedica  en  esta  obra  la  americanista  y  exconcejal  andalucista  Enriqueta  Vila  .",bitter_kas,np00000_np00000,bitter_kas,bebía,beber,VMII3S0,Feria,feria,NP00000,la,el,DA0FS0,en,en,SPS00,que,que,CS,.,.,Fp,"""","""",Fe,No,no,RN,conozco,conocer,VMIP1S0,a,a,SPS00,2021-04-05,2021,2020,NP00000 VMII3S0 Bitter Kas Fp Fe,VMII3S0 Bitter Kas Fp,NP00000 VMII3S0 Bitter Kas,DA0FS0 NP00000 VMII3S0 Bitter Kas,SPS00 DA0FS0 NP00000 VMII3S0 Bitter Kas,Bitter Kas Fp Fe,Bitter Kas Fp Fe RN,Bitter Kas Fp Fe RN VMIP1S0,"feria beber Bitter Kas . """,beber Bitter Kas .,feria beber Bitter Kas,el feria beber Bitter Kas,en el feria beber Bitter Kas,"Bitter Kas . ""","Bitter Kas . "" no","Bitter Kas . "" no conocer"
https://www.elnacional.cat/es/gastronomia/3-vinos-economicos-para-disfrutar-de-una-barbacoa-con-glamour_599570_102.html,elnacional.cat,2021-04-11,===NONE===,bitter_kas/NCMS000_AQ0FP0/bitter_kas,"Después  ,  en  aquella  hora  del  mediodía  en  la  cual  los  campesinos  huyen  del  campo  porque  dicen  que  el  sol  cae  como  un  rayo  en  línea  recta  ,  daremos  el  salto  a  algún bitter_kas  ,  un  vermú  o  ,  los  más  atrevidos  ,  un  poco  de  sangría  ,  dulce  como  la  felicidad  y  traidora  como  aquel  jugador  portugués  cuyo  nombre  está  prohibido  recordar  .",bitter_kas,ncms000_aq0fp0,bitter_kas,algún,alguno,DI0MS0,a,a,SPS00,salto,salto,NCMS000,el,el,DA0MS0,daremos,dar,VMIF1P0,",",",",Fc,un,uno,DI0MS0,vermú,vermú,NCMS000,o,o,CC,",",",",Fc,2021-04-11,2021,2020,SPS00 DI0MS0 Bitter Kas Fc DI0MS0,DI0MS0 Bitter Kas Fc,SPS00 DI0MS0 Bitter Kas,NCMS000 SPS00 DI0MS0 Bitter Kas,DA0MS0 NCMS000 SPS00 DI0MS0 Bitter Kas,Bitter Kas Fc DI0MS0,Bitter Kas Fc DI0MS0 NCMS000,Bitter Kas Fc DI0MS0 NCMS000 CC,"a alguno Bitter Kas , uno","alguno Bitter Kas ,",a alguno Bitter Kas,salto a alguno Bitter Kas,el salto a alguno Bitter Kas,"Bitter Kas , uno","Bitter Kas , uno vermú","Bitter Kas , uno vermú o"
